{
  "companyCode": "APOLLO-HOSPITALS-ENTERPRI-9058923",
  "timestamp": "2025-10-13T12:15:27.870Z",
  "annualResults": {
    "2023": {
      "Net salesMillion INR": {
        "metric": "Net salesMillion INR",
        "unit": "Million INR",
        "fiscalMonth": "March",
        "year": "2023",
        "released": "166 125",
        "forecast": "168 094",
        "spreadRaw": "-1.17%"
      },
      "EBITDAMillion INR": {
        "metric": "EBITDAMillion INR",
        "unit": "Million INR",
        "fiscalMonth": "March",
        "year": "2023",
        "released": "20 065",
        "forecast": "21 346",
        "spreadRaw": "-6%"
      },
      "EBITMillion INR": {
        "metric": "EBITMillion INR",
        "unit": "Million INR",
        "fiscalMonth": "March",
        "year": "2023",
        "released": "13 912",
        "forecast": "15 139",
        "spreadRaw": "-8.1%"
      },
      "Earnings before Tax (EBT)Million INR": {
        "metric": "Earnings before Tax (EBT)Million INR",
        "unit": "Million INR",
        "fiscalMonth": "March",
        "year": "2023",
        "released": "11 008",
        "forecast": "12 442",
        "spreadRaw": "-11.53%"
      },
      "Net incomeMillion INR": {
        "metric": "Net incomeMillion INR",
        "unit": "Million INR",
        "fiscalMonth": "March",
        "year": "2023",
        "released": "8 191",
        "forecast": "8 900",
        "spreadRaw": "-7.97%"
      },
      "EPS INR": {
        "metric": "EPS INR",
        "unit": "INR",
        "fiscalMonth": "March",
        "year": "2023",
        "released": "57,0",
        "forecast": "60,0",
        "spreadRaw": "-5.01%"
      },
      "Announcement Date": {
        "metric": "Announcement Date",
        "unit": null,
        "fiscalMonth": "March",
        "year": "2023",
        "released": "30/05/23",
        "forecast": null,
        "spreadRaw": null
      }
    },
    "2024": {
      "Net salesMillion INR": {
        "metric": "Net salesMillion INR",
        "unit": "Million INR",
        "fiscalMonth": "March",
        "year": "2024",
        "released": "190 592",
        "forecast": "190 532",
        "spreadRaw": "0.03%"
      },
      "EBITDAMillion INR": {
        "metric": "EBITDAMillion INR",
        "unit": "Million INR",
        "fiscalMonth": "March",
        "year": "2024",
        "released": "24 106",
        "forecast": "24 150",
        "spreadRaw": "-0.18%"
      },
      "EBITMillion INR": {
        "metric": "EBITMillion INR",
        "unit": "Million INR",
        "fiscalMonth": "March",
        "year": "2024",
        "released": "17 236",
        "forecast": "17 588",
        "spreadRaw": "-2%"
      },
      "Earnings before Tax (EBT)Million INR": {
        "metric": "Earnings before Tax (EBT)Million INR",
        "unit": "Million INR",
        "fiscalMonth": "March",
        "year": "2024",
        "released": "13 805",
        "forecast": "14 083",
        "spreadRaw": "-1.98%"
      },
      "Net incomeMillion INR": {
        "metric": "Net incomeMillion INR",
        "unit": "Million INR",
        "fiscalMonth": "March",
        "year": "2024",
        "released": "8 986",
        "forecast": "9 442",
        "spreadRaw": "-4.83%"
      },
      "EPS INR": {
        "metric": "EPS INR",
        "unit": "INR",
        "fiscalMonth": "March",
        "year": "2024",
        "released": "62,5",
        "forecast": "65,5",
        "spreadRaw": "-4.54%"
      },
      "Announcement Date": {
        "metric": "Announcement Date",
        "unit": null,
        "fiscalMonth": "March",
        "year": "2024",
        "released": "30/05/24",
        "forecast": null,
        "spreadRaw": null
      }
    },
    "2025": {
      "Net salesMillion INR": {
        "metric": "Net salesMillion INR",
        "unit": "Million INR",
        "fiscalMonth": "March",
        "year": "2025",
        "released": "217 940",
        "forecast": "218 422",
        "spreadRaw": "-0.22%"
      },
      "EBITDAMillion INR": {
        "metric": "EBITDAMillion INR",
        "unit": "Million INR",
        "fiscalMonth": "March",
        "year": "2025",
        "released": "30 548",
        "forecast": "30 505",
        "spreadRaw": "0.14%"
      },
      "EBITMillion INR": {
        "metric": "EBITMillion INR",
        "unit": "Million INR",
        "fiscalMonth": "March",
        "year": "2025",
        "released": "22 973",
        "forecast": "23 266",
        "spreadRaw": "-1.26%"
      },
      "Earnings before Tax (EBT)Million INR": {
        "metric": "Earnings before Tax (EBT)Million INR",
        "unit": "Million INR",
        "fiscalMonth": "March",
        "year": "2025",
        "released": "20 391",
        "forecast": "20 477",
        "spreadRaw": "-0.42%"
      },
      "Net incomeMillion INR": {
        "metric": "Net incomeMillion INR",
        "unit": "Million INR",
        "fiscalMonth": "March",
        "year": "2025",
        "released": "14 459",
        "forecast": "14 354",
        "spreadRaw": "0.73%"
      },
      "EPS INR": {
        "metric": "EPS INR",
        "unit": "INR",
        "fiscalMonth": "March",
        "year": "2025",
        "released": "101",
        "forecast": "99,9",
        "spreadRaw": "0.67%"
      },
      "Announcement Date": {
        "metric": "Announcement Date",
        "unit": null,
        "fiscalMonth": "March",
        "year": "2025",
        "released": "30/05/25",
        "forecast": null,
        "spreadRaw": null
      }
    },
    "2026": {
      "Net salesMillion INR": {
        "metric": "Net salesMillion INR",
        "unit": "Million INR",
        "fiscalMonth": "March",
        "year": "2026",
        "released": null,
        "forecast": "253 397",
        "spreadRaw": null
      },
      "EBITDAMillion INR": {
        "metric": "EBITDAMillion INR",
        "unit": "Million INR",
        "fiscalMonth": "March",
        "year": "2026",
        "released": null,
        "forecast": "37 489",
        "spreadRaw": null
      },
      "EBITMillion INR": {
        "metric": "EBITMillion INR",
        "unit": "Million INR",
        "fiscalMonth": "March",
        "year": "2026",
        "released": null,
        "forecast": "29 080",
        "spreadRaw": null
      },
      "Earnings before Tax (EBT)Million INR": {
        "metric": "Earnings before Tax (EBT)Million INR",
        "unit": "Million INR",
        "fiscalMonth": "March",
        "year": "2026",
        "released": null,
        "forecast": "26 446",
        "spreadRaw": null
      },
      "Net incomeMillion INR": {
        "metric": "Net incomeMillion INR",
        "unit": "Million INR",
        "fiscalMonth": "March",
        "year": "2026",
        "released": null,
        "forecast": "19 049",
        "spreadRaw": null
      },
      "EPS INR": {
        "metric": "EPS INR",
        "unit": "INR",
        "fiscalMonth": "March",
        "year": "2026",
        "released": null,
        "forecast": "132",
        "spreadRaw": null
      },
      "Announcement Date": {
        "metric": "Announcement Date",
        "unit": null,
        "fiscalMonth": "March",
        "year": "2026",
        "released": "-",
        "forecast": null,
        "spreadRaw": null
      }
    },
    "2027": {
      "Net salesMillion INR": {
        "metric": "Net salesMillion INR",
        "unit": "Million INR",
        "fiscalMonth": "March",
        "year": "2027",
        "released": null,
        "forecast": "306 692",
        "spreadRaw": null
      },
      "EBITDAMillion INR": {
        "metric": "EBITDAMillion INR",
        "unit": "Million INR",
        "fiscalMonth": "March",
        "year": "2027",
        "released": null,
        "forecast": "46 811",
        "spreadRaw": null
      },
      "EBITMillion INR": {
        "metric": "EBITMillion INR",
        "unit": "Million INR",
        "fiscalMonth": "March",
        "year": "2027",
        "released": null,
        "forecast": "37 617",
        "spreadRaw": null
      },
      "Earnings before Tax (EBT)Million INR": {
        "metric": "Earnings before Tax (EBT)Million INR",
        "unit": "Million INR",
        "fiscalMonth": "March",
        "year": "2027",
        "released": null,
        "forecast": "35 005",
        "spreadRaw": null
      },
      "Net incomeMillion INR": {
        "metric": "Net incomeMillion INR",
        "unit": "Million INR",
        "fiscalMonth": "March",
        "year": "2027",
        "released": null,
        "forecast": "25 150",
        "spreadRaw": null
      },
      "EPS INR": {
        "metric": "EPS INR",
        "unit": "INR",
        "fiscalMonth": "March",
        "year": "2027",
        "released": null,
        "forecast": "174",
        "spreadRaw": null
      },
      "Announcement Date": {
        "metric": "Announcement Date",
        "unit": null,
        "fiscalMonth": "March",
        "year": "2027",
        "released": null,
        "forecast": null,
        "spreadRaw": null
      }
    },
    "2028": {
      "Net salesMillion INR": {
        "metric": "Net salesMillion INR",
        "unit": "Million INR",
        "fiscalMonth": "March",
        "year": "2028",
        "released": null,
        "forecast": "354 713",
        "spreadRaw": null
      },
      "EBITDAMillion INR": {
        "metric": "EBITDAMillion INR",
        "unit": "Million INR",
        "fiscalMonth": "March",
        "year": "2028",
        "released": null,
        "forecast": "56 724",
        "spreadRaw": null
      },
      "EBITMillion INR": {
        "metric": "EBITMillion INR",
        "unit": "Million INR",
        "fiscalMonth": "March",
        "year": "2028",
        "released": null,
        "forecast": "46 640",
        "spreadRaw": null
      },
      "Earnings before Tax (EBT)Million INR": {
        "metric": "Earnings before Tax (EBT)Million INR",
        "unit": "Million INR",
        "fiscalMonth": "March",
        "year": "2028",
        "released": null,
        "forecast": "44 197",
        "spreadRaw": null
      },
      "Net incomeMillion INR": {
        "metric": "Net incomeMillion INR",
        "unit": "Million INR",
        "fiscalMonth": "March",
        "year": "2028",
        "released": null,
        "forecast": "32 439",
        "spreadRaw": null
      },
      "EPS INR": {
        "metric": "EPS INR",
        "unit": "INR",
        "fiscalMonth": "March",
        "year": "2028",
        "released": null,
        "forecast": "223",
        "spreadRaw": null
      },
      "Announcement Date": {
        "metric": "Announcement Date",
        "unit": null,
        "fiscalMonth": "March",
        "year": "2028",
        "released": null,
        "forecast": null,
        "spreadRaw": null
      }
    }
  },
  "quarterlyResults": {
    "2024 Q2": {
      "Net salesMillion INR": {
        "metric": "Net salesMillion INR",
        "unit": "Million INR",
        "fiscalMonth": "March",
        "period": "2024 Q2",
        "released": "48 469",
        "releasedNum": 48469,
        "forecast": "48 163",
        "forecastNum": 48163,
        "spreadRaw": "0.64%",
        "spreadPct": 0.64
      },
      "EBITDAMillion INR": {
        "metric": "EBITDAMillion INR",
        "unit": "Million INR",
        "fiscalMonth": "March",
        "period": "2024 Q2",
        "released": "6 275",
        "releasedNum": 6275,
        "forecast": "6 129",
        "forecastNum": 6129,
        "spreadRaw": "2.38%",
        "spreadPct": 2.38
      },
      "EBITMillion INR": {
        "metric": "EBITMillion INR",
        "unit": "Million INR",
        "fiscalMonth": "March",
        "period": "2024 Q2",
        "released": "4 641",
        "releasedNum": 4641,
        "forecast": "4 538",
        "forecastNum": 4538,
        "spreadRaw": "2.27%",
        "spreadPct": 2.27
      },
      "Earnings before Tax (EBT)Million INR": {
        "metric": "Earnings before Tax (EBT)Million INR",
        "unit": "Million INR",
        "fiscalMonth": "March",
        "period": "2024 Q2",
        "released": "3 750",
        "releasedNum": 3750,
        "forecast": "3 836",
        "forecastNum": 3836,
        "spreadRaw": "-2.24%",
        "spreadPct": -2.24
      },
      "Net incomeMillion INR": {
        "metric": "Net incomeMillion INR",
        "unit": "Million INR",
        "fiscalMonth": "March",
        "period": "2024 Q2",
        "released": "2 329",
        "releasedNum": 2329,
        "forecast": "2 556",
        "forecastNum": 2556,
        "spreadRaw": "-8.88%",
        "spreadPct": -8.88
      },
      "EPS INR": {
        "metric": "EPS INR",
        "unit": "INR",
        "fiscalMonth": "March",
        "period": "2024 Q2",
        "released": "16,2",
        "releasedNum": 16.2,
        "forecast": "20,5",
        "forecastNum": 20.5,
        "spreadRaw": "-21.1%",
        "spreadPct": -21.1
      },
      "Announcement Date": {
        "metric": "Announcement Date",
        "unit": null,
        "fiscalMonth": "March",
        "period": "2024 Q2",
        "released": "09/11/23",
        "releasedDate": "09/11/23",
        "forecast": null,
        "spreadRaw": null,
        "spreadPct": null
      }
    },
    "2024 Q3": {
      "Net salesMillion INR": {
        "metric": "Net salesMillion INR",
        "unit": "Million INR",
        "fiscalMonth": "March",
        "period": "2024 Q3",
        "released": "48 506",
        "releasedNum": 48506,
        "forecast": "48 265",
        "forecastNum": 48265,
        "spreadRaw": "0.5%",
        "spreadPct": 0.5
      },
      "EBITDAMillion INR": {
        "metric": "EBITDAMillion INR",
        "unit": "Million INR",
        "fiscalMonth": "March",
        "period": "2024 Q3",
        "released": "6 137",
        "releasedNum": 6137,
        "forecast": "6 147",
        "forecastNum": 6147,
        "spreadRaw": "-0.16%",
        "spreadPct": -0.16
      },
      "EBITMillion INR": {
        "metric": "EBITMillion INR",
        "unit": "Million INR",
        "fiscalMonth": "March",
        "period": "2024 Q3",
        "released": "4 467",
        "releasedNum": 4467,
        "forecast": "4 491",
        "forecastNum": 4491,
        "spreadRaw": "-0.54%",
        "spreadPct": -0.54
      },
      "Earnings before Tax (EBT)Million INR": {
        "metric": "Earnings before Tax (EBT)Million INR",
        "unit": "Million INR",
        "fiscalMonth": "March",
        "period": "2024 Q3",
        "released": "3 619",
        "releasedNum": 3619,
        "forecast": "3 696",
        "forecastNum": 3696,
        "spreadRaw": "-2.08%",
        "spreadPct": -2.08
      },
      "Net incomeMillion INR": {
        "metric": "Net incomeMillion INR",
        "unit": "Million INR",
        "fiscalMonth": "March",
        "period": "2024 Q3",
        "released": "2 453",
        "releasedNum": 2453,
        "forecast": "2 471",
        "forecastNum": 2471,
        "spreadRaw": "-0.74%",
        "spreadPct": -0.74
      },
      "EPS INR": {
        "metric": "EPS INR",
        "unit": "INR",
        "fiscalMonth": "March",
        "period": "2024 Q3",
        "released": "17,1",
        "releasedNum": 17.1,
        "forecast": "17,4",
        "forecastNum": 17.4,
        "spreadRaw": "-1.74%",
        "spreadPct": -1.74
      },
      "Announcement Date": {
        "metric": "Announcement Date",
        "unit": null,
        "fiscalMonth": "March",
        "period": "2024 Q3",
        "released": "08/02/24",
        "releasedDate": "08/02/24",
        "forecast": null,
        "spreadRaw": null,
        "spreadPct": null
      }
    },
    "2024 Q4": {
      "Net salesMillion INR": {
        "metric": "Net salesMillion INR",
        "unit": "Million INR",
        "fiscalMonth": "March",
        "period": "2024 Q4",
        "released": "49 439",
        "releasedNum": 49439,
        "forecast": "49 411",
        "forecastNum": 49411,
        "spreadRaw": "0.06%",
        "spreadPct": 0.06
      },
      "EBITDAMillion INR": {
        "metric": "EBITDAMillion INR",
        "unit": "Million INR",
        "fiscalMonth": "March",
        "period": "2024 Q4",
        "released": "6 491",
        "releasedNum": 6491,
        "forecast": "6 398",
        "forecastNum": 6398,
        "spreadRaw": "1.46%",
        "spreadPct": 1.46
      },
      "EBITMillion INR": {
        "metric": "EBITMillion INR",
        "unit": "Million INR",
        "fiscalMonth": "March",
        "period": "2024 Q4",
        "released": "4 594",
        "releasedNum": 4594,
        "forecast": "4 750",
        "forecastNum": 4750,
        "spreadRaw": "-3.29%",
        "spreadPct": -3.29
      },
      "Earnings before Tax (EBT)Million INR": {
        "metric": "Earnings before Tax (EBT)Million INR",
        "unit": "Million INR",
        "fiscalMonth": "March",
        "period": "2024 Q4",
        "released": "3 682",
        "releasedNum": 3682,
        "forecast": "3 953",
        "forecastNum": 3953,
        "spreadRaw": "-6.85%",
        "spreadPct": -6.85
      },
      "Net incomeMillion INR": {
        "metric": "Net incomeMillion INR",
        "unit": "Million INR",
        "fiscalMonth": "March",
        "period": "2024 Q4",
        "released": "2 538",
        "releasedNum": 2538,
        "forecast": "2 686",
        "forecastNum": 2686,
        "spreadRaw": "-5.5%",
        "spreadPct": -5.5
      },
      "EPS INR": {
        "metric": "EPS INR",
        "unit": "INR",
        "fiscalMonth": "March",
        "period": "2024 Q4",
        "released": "17,7",
        "releasedNum": 17.7,
        "forecast": "17,4",
        "forecastNum": 17.4,
        "spreadRaw": "1.2%",
        "spreadPct": 1.2
      },
      "Announcement Date": {
        "metric": "Announcement Date",
        "unit": null,
        "fiscalMonth": "March",
        "period": "2024 Q4",
        "released": "30/05/24",
        "releasedDate": "30/05/24",
        "forecast": null,
        "spreadRaw": null,
        "spreadPct": null
      }
    },
    "2025 Q1": {
      "Net salesMillion INR": {
        "metric": "Net salesMillion INR",
        "unit": "Million INR",
        "fiscalMonth": "March",
        "period": "2025 Q1",
        "released": "50 856",
        "releasedNum": 50856,
        "forecast": "52 878",
        "forecastNum": 52878,
        "spreadRaw": "-3.82%",
        "spreadPct": -3.82
      },
      "EBITDAMillion INR": {
        "metric": "EBITDAMillion INR",
        "unit": "Million INR",
        "fiscalMonth": "March",
        "period": "2025 Q1",
        "released": "6 750",
        "releasedNum": 6750,
        "forecast": "6 872",
        "forecastNum": 6872,
        "spreadRaw": "-1.77%",
        "spreadPct": -1.77
      },
      "EBITMillion INR": {
        "metric": "EBITMillion INR",
        "unit": "Million INR",
        "fiscalMonth": "March",
        "period": "2025 Q1",
        "released": "4 976",
        "releasedNum": 4976,
        "forecast": "5 457",
        "forecastNum": 5457,
        "spreadRaw": "-8.82%",
        "spreadPct": -8.82
      },
      "Earnings before Tax (EBT)Million INR": {
        "metric": "Earnings before Tax (EBT)Million INR",
        "unit": "Million INR",
        "fiscalMonth": "March",
        "period": "2025 Q1",
        "released": "4 300",
        "releasedNum": 4300,
        "forecast": "4 051",
        "forecastNum": 4051,
        "spreadRaw": "6.14%",
        "spreadPct": 6.14
      },
      "Net incomeMillion INR": {
        "metric": "Net incomeMillion INR",
        "unit": "Million INR",
        "fiscalMonth": "March",
        "period": "2025 Q1",
        "released": "3 052",
        "releasedNum": 3052,
        "forecast": "3 019",
        "forecastNum": 3019,
        "spreadRaw": "1.09%",
        "spreadPct": 1.09
      },
      "EPS INR": {
        "metric": "EPS INR",
        "unit": "INR",
        "fiscalMonth": "March",
        "period": "2025 Q1",
        "released": "21,2",
        "releasedNum": 21.2,
        "forecast": "22,3",
        "forecastNum": 22.3,
        "spreadRaw": "-4.61%",
        "spreadPct": -4.61
      },
      "Announcement Date": {
        "metric": "Announcement Date",
        "unit": null,
        "fiscalMonth": "March",
        "period": "2025 Q1",
        "released": "13/08/24",
        "releasedDate": "13/08/24",
        "forecast": null,
        "spreadRaw": null,
        "spreadPct": null
      }
    },
    "2025 Q2": {
      "Net salesMillion INR": {
        "metric": "Net salesMillion INR",
        "unit": "Million INR",
        "fiscalMonth": "March",
        "period": "2025 Q2",
        "released": "55 893",
        "releasedNum": 55893,
        "forecast": "55 060",
        "forecastNum": 55060,
        "spreadRaw": "1.51%",
        "spreadPct": 1.51
      },
      "EBITDAMillion INR": {
        "metric": "EBITDAMillion INR",
        "unit": "Million INR",
        "fiscalMonth": "March",
        "period": "2025 Q2",
        "released": "8 155",
        "releasedNum": 8155,
        "forecast": "7 753",
        "forecastNum": 7753,
        "spreadRaw": "5.18%",
        "spreadPct": 5.18
      },
      "EBITMillion INR": {
        "metric": "EBITMillion INR",
        "unit": "Million INR",
        "fiscalMonth": "March",
        "period": "2025 Q2",
        "released": "6 310",
        "releasedNum": 6310,
        "forecast": "5 843",
        "forecastNum": 5843,
        "spreadRaw": "7.99%",
        "spreadPct": 7.99
      },
      "Earnings before Tax (EBT)Million INR": {
        "metric": "Earnings before Tax (EBT)Million INR",
        "unit": "Million INR",
        "fiscalMonth": "March",
        "period": "2025 Q2",
        "released": "5 517",
        "releasedNum": 5517,
        "forecast": "5 145",
        "forecastNum": 5145,
        "spreadRaw": "7.23%",
        "spreadPct": 7.23
      },
      "Net incomeMillion INR": {
        "metric": "Net incomeMillion INR",
        "unit": "Million INR",
        "fiscalMonth": "March",
        "period": "2025 Q2",
        "released": "3 788",
        "releasedNum": 3788,
        "forecast": "3 602",
        "forecastNum": 3602,
        "spreadRaw": "5.17%",
        "spreadPct": 5.17
      },
      "EPS INR": {
        "metric": "EPS INR",
        "unit": "INR",
        "fiscalMonth": "March",
        "period": "2025 Q2",
        "released": "26,3",
        "releasedNum": 26.3,
        "forecast": "25,4",
        "forecastNum": 25.4,
        "spreadRaw": "3.58%",
        "spreadPct": 3.58
      },
      "Announcement Date": {
        "metric": "Announcement Date",
        "unit": null,
        "fiscalMonth": "March",
        "period": "2025 Q2",
        "released": "06/11/24",
        "releasedDate": "06/11/24",
        "forecast": null,
        "spreadRaw": null,
        "spreadPct": null
      }
    },
    "2025 Q3": {
      "Net salesMillion INR": {
        "metric": "Net salesMillion INR",
        "unit": "Million INR",
        "fiscalMonth": "March",
        "period": "2025 Q3",
        "released": "55 269",
        "releasedNum": 55269,
        "forecast": "55 425",
        "forecastNum": 55425,
        "spreadRaw": "-0.28%",
        "spreadPct": -0.28
      },
      "EBITDAMillion INR": {
        "metric": "EBITDAMillion INR",
        "unit": "Million INR",
        "fiscalMonth": "March",
        "period": "2025 Q3",
        "released": "7 615",
        "releasedNum": 7615,
        "forecast": "7 720",
        "forecastNum": 7720,
        "spreadRaw": "-1.36%",
        "spreadPct": -1.36
      },
      "EBITMillion INR": {
        "metric": "EBITMillion INR",
        "unit": "Million INR",
        "fiscalMonth": "March",
        "period": "2025 Q3",
        "released": "5 769",
        "releasedNum": 5769,
        "forecast": "6 210",
        "forecastNum": 6210,
        "spreadRaw": "-7.1%",
        "spreadPct": -7.1
      },
      "Earnings before Tax (EBT)Million INR": {
        "metric": "Earnings before Tax (EBT)Million INR",
        "unit": "Million INR",
        "fiscalMonth": "March",
        "period": "2025 Q3",
        "released": "5 309",
        "releasedNum": 5309,
        "forecast": "5 146",
        "forecastNum": 5146,
        "spreadRaw": "3.17%",
        "spreadPct": 3.17
      },
      "Net incomeMillion INR": {
        "metric": "Net incomeMillion INR",
        "unit": "Million INR",
        "fiscalMonth": "March",
        "period": "2025 Q3",
        "released": "3 723",
        "releasedNum": 3723,
        "forecast": "3 464",
        "forecastNum": 3464,
        "spreadRaw": "7.46%",
        "spreadPct": 7.46
      },
      "EPS INR": {
        "metric": "EPS INR",
        "unit": "INR",
        "fiscalMonth": "March",
        "period": "2025 Q3",
        "released": "25,9",
        "releasedNum": 25.9,
        "forecast": "24,2",
        "forecastNum": 24.2,
        "spreadRaw": "7.2%",
        "spreadPct": 7.2
      },
      "Announcement Date": {
        "metric": "Announcement Date",
        "unit": null,
        "fiscalMonth": "March",
        "period": "2025 Q3",
        "released": "10/02/25",
        "releasedDate": "10/02/25",
        "forecast": null,
        "spreadRaw": null,
        "spreadPct": null
      }
    },
    "2025 Q4": {
      "Net salesMillion INR": {
        "metric": "Net salesMillion INR",
        "unit": "Million INR",
        "fiscalMonth": "March",
        "period": "2025 Q4",
        "released": "55 922",
        "releasedNum": 55922,
        "forecast": "56 230",
        "forecastNum": 56230,
        "spreadRaw": "-0.55%",
        "spreadPct": -0.55
      },
      "EBITDAMillion INR": {
        "metric": "EBITDAMillion INR",
        "unit": "Million INR",
        "fiscalMonth": "March",
        "period": "2025 Q4",
        "released": "7 802",
        "releasedNum": 7802,
        "forecast": "7 840",
        "forecastNum": 7840,
        "spreadRaw": "-0.49%",
        "spreadPct": -0.49
      },
      "EBITMillion INR": {
        "metric": "EBITMillion INR",
        "unit": "Million INR",
        "fiscalMonth": "March",
        "period": "2025 Q4",
        "released": "5 692",
        "releasedNum": 5692,
        "forecast": "6 337",
        "forecastNum": 6337,
        "spreadRaw": "-10.18%",
        "spreadPct": -10.18
      },
      "Earnings before Tax (EBT)Million INR": {
        "metric": "Earnings before Tax (EBT)Million INR",
        "unit": "Million INR",
        "fiscalMonth": "March",
        "period": "2025 Q4",
        "released": "5 155",
        "releasedNum": 5155,
        "forecast": "5 413",
        "forecastNum": 5413,
        "spreadRaw": "-4.76%",
        "spreadPct": -4.76
      },
      "Net incomeMillion INR": {
        "metric": "Net incomeMillion INR",
        "unit": "Million INR",
        "fiscalMonth": "March",
        "period": "2025 Q4",
        "released": "3 896",
        "releasedNum": 3896,
        "forecast": "3 805",
        "forecastNum": 3805,
        "spreadRaw": "2.38%",
        "spreadPct": 2.38
      },
      "EPS INR": {
        "metric": "EPS INR",
        "unit": "INR",
        "fiscalMonth": "March",
        "period": "2025 Q4",
        "released": "27,1",
        "releasedNum": 27.1,
        "forecast": "29,6",
        "forecastNum": 29.6,
        "spreadRaw": "-8.52%",
        "spreadPct": -8.52
      },
      "Announcement Date": {
        "metric": "Announcement Date",
        "unit": null,
        "fiscalMonth": "March",
        "period": "2025 Q4",
        "released": "30/05/25",
        "releasedDate": "30/05/25",
        "forecast": null,
        "spreadRaw": null,
        "spreadPct": null
      }
    },
    "2026 Q1": {
      "Net salesMillion INR": {
        "metric": "Net salesMillion INR",
        "unit": "Million INR",
        "fiscalMonth": "March",
        "period": "2026 Q1",
        "released": "58 421",
        "releasedNum": 58421,
        "forecast": "57 776",
        "forecastNum": 57776,
        "spreadRaw": "1.12%",
        "spreadPct": 1.12
      },
      "EBITDAMillion INR": {
        "metric": "EBITDAMillion INR",
        "unit": "Million INR",
        "fiscalMonth": "March",
        "period": "2026 Q1",
        "released": "8 520",
        "releasedNum": 8520,
        "forecast": "8 030",
        "forecastNum": 8030,
        "spreadRaw": "6.1%",
        "spreadPct": 6.1
      },
      "EBITMillion INR": {
        "metric": "EBITMillion INR",
        "unit": "Million INR",
        "fiscalMonth": "March",
        "period": "2026 Q1",
        "released": "6 372",
        "releasedNum": 6372,
        "forecast": "5 878",
        "forecastNum": 5878,
        "spreadRaw": "8.4%",
        "spreadPct": 8.4
      },
      "Earnings before Tax (EBT)Million INR": {
        "metric": "Earnings before Tax (EBT)Million INR",
        "unit": "Million INR",
        "fiscalMonth": "March",
        "period": "2026 Q1",
        "released": "5 691",
        "releasedNum": 5691,
        "forecast": "5 357",
        "forecastNum": 5357,
        "spreadRaw": "6.23%",
        "spreadPct": 6.23
      },
      "Net incomeMillion INR": {
        "metric": "Net incomeMillion INR",
        "unit": "Million INR",
        "fiscalMonth": "March",
        "period": "2026 Q1",
        "released": "4 328",
        "releasedNum": 4328,
        "forecast": "3 804",
        "forecastNum": 3804,
        "spreadRaw": "13.76%",
        "spreadPct": 13.76
      },
      "EPS INR": {
        "metric": "EPS INR",
        "unit": "INR",
        "fiscalMonth": "March",
        "period": "2026 Q1",
        "released": "30,1",
        "releasedNum": 30.1,
        "forecast": "27,3",
        "forecastNum": 27.3,
        "spreadRaw": "10.42%",
        "spreadPct": 10.42
      },
      "Announcement Date": {
        "metric": "Announcement Date",
        "unit": null,
        "fiscalMonth": "March",
        "period": "2026 Q1",
        "released": "12/08/25",
        "releasedDate": "12/08/25",
        "forecast": null,
        "spreadRaw": null,
        "spreadPct": null
      }
    },
    "2026 Q2": {
      "Net salesMillion INR": {
        "metric": "Net salesMillion INR",
        "unit": "Million INR",
        "fiscalMonth": "March",
        "period": "2026 Q2",
        "released": null,
        "releasedNum": null,
        "forecast": "62 746",
        "forecastNum": 62746,
        "spreadRaw": null,
        "spreadPct": null
      },
      "EBITDAMillion INR": {
        "metric": "EBITDAMillion INR",
        "unit": "Million INR",
        "fiscalMonth": "March",
        "period": "2026 Q2",
        "released": null,
        "releasedNum": null,
        "forecast": "9 284",
        "forecastNum": 9284,
        "spreadRaw": null,
        "spreadPct": null
      },
      "EBITMillion INR": {
        "metric": "EBITMillion INR",
        "unit": "Million INR",
        "fiscalMonth": "March",
        "period": "2026 Q2",
        "released": null,
        "releasedNum": null,
        "forecast": "7 439",
        "forecastNum": 7439,
        "spreadRaw": null,
        "spreadPct": null
      },
      "Earnings before Tax (EBT)Million INR": {
        "metric": "Earnings before Tax (EBT)Million INR",
        "unit": "Million INR",
        "fiscalMonth": "March",
        "period": "2026 Q2",
        "released": null,
        "releasedNum": null,
        "forecast": "6 487",
        "forecastNum": 6487,
        "spreadRaw": null,
        "spreadPct": null
      },
      "Net incomeMillion INR": {
        "metric": "Net incomeMillion INR",
        "unit": "Million INR",
        "fiscalMonth": "March",
        "period": "2026 Q2",
        "released": null,
        "releasedNum": null,
        "forecast": "4 690",
        "forecastNum": 4690,
        "spreadRaw": null,
        "spreadPct": null
      },
      "EPS INR": {
        "metric": "EPS INR",
        "unit": "INR",
        "fiscalMonth": "March",
        "period": "2026 Q2",
        "released": null,
        "releasedNum": null,
        "forecast": "32,7",
        "forecastNum": 32.7,
        "spreadRaw": null,
        "spreadPct": null
      },
      "Announcement Date": {
        "metric": "Announcement Date",
        "unit": null,
        "fiscalMonth": "March",
        "period": "2026 Q2",
        "released": "-",
        "releasedDate": "-",
        "forecast": null,
        "spreadRaw": null,
        "spreadPct": null
      }
    },
    "2026 Q3": {
      "Net salesMillion INR": {
        "metric": "Net salesMillion INR",
        "unit": "Million INR",
        "fiscalMonth": "March",
        "period": "2026 Q3",
        "released": null,
        "releasedNum": null,
        "forecast": "63 667",
        "forecastNum": 63667,
        "spreadRaw": null,
        "spreadPct": null
      },
      "EBITDAMillion INR": {
        "metric": "EBITDAMillion INR",
        "unit": "Million INR",
        "fiscalMonth": "March",
        "period": "2026 Q3",
        "released": null,
        "releasedNum": null,
        "forecast": "9 494",
        "forecastNum": 9494,
        "spreadRaw": null,
        "spreadPct": null
      },
      "EBITMillion INR": {
        "metric": "EBITMillion INR",
        "unit": "Million INR",
        "fiscalMonth": "March",
        "period": "2026 Q3",
        "released": null,
        "releasedNum": null,
        "forecast": "7 794",
        "forecastNum": 7794,
        "spreadRaw": null,
        "spreadPct": null
      },
      "Earnings before Tax (EBT)Million INR": {
        "metric": "Earnings before Tax (EBT)Million INR",
        "unit": "Million INR",
        "fiscalMonth": "March",
        "period": "2026 Q3",
        "released": null,
        "releasedNum": null,
        "forecast": "6 757",
        "forecastNum": 6757,
        "spreadRaw": null,
        "spreadPct": null
      },
      "Net incomeMillion INR": {
        "metric": "Net incomeMillion INR",
        "unit": "Million INR",
        "fiscalMonth": "March",
        "period": "2026 Q3",
        "released": null,
        "releasedNum": null,
        "forecast": "5 237",
        "forecastNum": 5237,
        "spreadRaw": null,
        "spreadPct": null
      },
      "EPS INR": {
        "metric": "EPS INR",
        "unit": "INR",
        "fiscalMonth": "March",
        "period": "2026 Q3",
        "released": null,
        "releasedNum": null,
        "forecast": "35,5",
        "forecastNum": 35.5,
        "spreadRaw": null,
        "spreadPct": null
      },
      "Announcement Date": {
        "metric": "Announcement Date",
        "unit": null,
        "fiscalMonth": "March",
        "period": "2026 Q3",
        "released": "-",
        "releasedDate": "-",
        "forecast": null,
        "spreadRaw": null,
        "spreadPct": null
      }
    },
    "2026 Q4": {
      "Net salesMillion INR": {
        "metric": "Net salesMillion INR",
        "unit": "Million INR",
        "fiscalMonth": "March",
        "period": "2026 Q4",
        "released": null,
        "releasedNum": null,
        "forecast": "66 225",
        "forecastNum": 66225,
        "spreadRaw": null,
        "spreadPct": null
      },
      "EBITDAMillion INR": {
        "metric": "EBITDAMillion INR",
        "unit": "Million INR",
        "fiscalMonth": "March",
        "period": "2026 Q4",
        "released": null,
        "releasedNum": null,
        "forecast": "9 154",
        "forecastNum": 9154,
        "spreadRaw": null,
        "spreadPct": null
      },
      "EBITMillion INR": {
        "metric": "EBITMillion INR",
        "unit": "Million INR",
        "fiscalMonth": "March",
        "period": "2026 Q4",
        "released": null,
        "releasedNum": null,
        "forecast": "7 619",
        "forecastNum": 7619,
        "spreadRaw": null,
        "spreadPct": null
      },
      "Earnings before Tax (EBT)Million INR": {
        "metric": "Earnings before Tax (EBT)Million INR",
        "unit": "Million INR",
        "fiscalMonth": "March",
        "period": "2026 Q4",
        "released": null,
        "releasedNum": null,
        "forecast": "6 611",
        "forecastNum": 6611,
        "spreadRaw": null,
        "spreadPct": null
      },
      "Net incomeMillion INR": {
        "metric": "Net incomeMillion INR",
        "unit": "Million INR",
        "fiscalMonth": "March",
        "period": "2026 Q4",
        "released": null,
        "releasedNum": null,
        "forecast": "5 662",
        "forecastNum": 5662,
        "spreadRaw": null,
        "spreadPct": null
      },
      "EPS INR": {
        "metric": "EPS INR",
        "unit": "INR",
        "fiscalMonth": "March",
        "period": "2026 Q4",
        "released": null,
        "releasedNum": null,
        "forecast": "35,3",
        "forecastNum": 35.3,
        "spreadRaw": null,
        "spreadPct": null
      },
      "Announcement Date": {
        "metric": "Announcement Date",
        "unit": null,
        "fiscalMonth": "March",
        "period": "2026 Q4",
        "released": "-",
        "releasedDate": "-",
        "forecast": null,
        "spreadRaw": null,
        "spreadPct": null
      }
    },
    "2027 Q1": {
      "Net salesMillion INR": {
        "metric": "Net salesMillion INR",
        "unit": "Million INR",
        "fiscalMonth": "March",
        "period": "2027 Q1",
        "released": null,
        "releasedNum": null,
        "forecast": "69 506",
        "forecastNum": 69506,
        "spreadRaw": null,
        "spreadPct": null
      },
      "EBITDAMillion INR": {
        "metric": "EBITDAMillion INR",
        "unit": "Million INR",
        "fiscalMonth": "March",
        "period": "2027 Q1",
        "released": null,
        "releasedNum": null,
        "forecast": null,
        "forecastNum": null,
        "spreadRaw": null,
        "spreadPct": null
      },
      "EBITMillion INR": {
        "metric": "EBITMillion INR",
        "unit": "Million INR",
        "fiscalMonth": "March",
        "period": "2027 Q1",
        "released": null,
        "releasedNum": null,
        "forecast": "8 678",
        "forecastNum": 8678,
        "spreadRaw": null,
        "spreadPct": null
      },
      "Earnings before Tax (EBT)Million INR": {
        "metric": "Earnings before Tax (EBT)Million INR",
        "unit": "Million INR",
        "fiscalMonth": "March",
        "period": "2027 Q1",
        "released": null,
        "releasedNum": null,
        "forecast": null,
        "forecastNum": null,
        "spreadRaw": null,
        "spreadPct": null
      },
      "Net incomeMillion INR": {
        "metric": "Net incomeMillion INR",
        "unit": "Million INR",
        "fiscalMonth": "March",
        "period": "2027 Q1",
        "released": null,
        "releasedNum": null,
        "forecast": null,
        "forecastNum": null,
        "spreadRaw": null,
        "spreadPct": null
      },
      "EPS INR": {
        "metric": "EPS INR",
        "unit": "INR",
        "fiscalMonth": "March",
        "period": "2027 Q1",
        "released": null,
        "releasedNum": null,
        "forecast": null,
        "forecastNum": null,
        "spreadRaw": null,
        "spreadPct": null
      },
      "Announcement Date": {
        "metric": "Announcement Date",
        "unit": null,
        "fiscalMonth": "March",
        "period": "2027 Q1",
        "released": "-",
        "releasedDate": "-",
        "forecast": null,
        "spreadRaw": null,
        "spreadPct": null
      }
    }
  },
  "upcomingEvents": {
    "count": 4,
    "events": [
      {
        "section": "Upcoming",
        "dateTimeRaw": "06/11/2025",
        "dateTimeISO": "2025-11-05T18:30:00.000Z",
        "title": "Q2 2026 Earnings Release (Projected)",
        "icsUrl": "https://in.marketscreener.com/api/stateful/agenda/event-async/Q2-2026-Earnings-Release-Projected-48148539.ics"
      },
      {
        "section": "Upcoming",
        "dateTimeRaw": "18/02/2026",
        "dateTimeISO": "2026-02-17T18:30:00.000Z",
        "title": "Q3 2026 Earnings Release (Projected)",
        "icsUrl": "https://in.marketscreener.com/api/stateful/agenda/event-async/Q3-2026-Earnings-Release-Projected-48845508.ics"
      },
      {
        "section": "Upcoming",
        "dateTimeRaw": "28/05/2026",
        "dateTimeISO": "2026-05-27T18:30:00.000Z",
        "title": "Q4 2026 Earnings Release (Projected)",
        "icsUrl": "https://in.marketscreener.com/api/stateful/agenda/event-async/Q4-2026-Earnings-Release-Projected-50020164.ics"
      },
      {
        "section": "Upcoming",
        "dateTimeRaw": "07/08/2026",
        "dateTimeISO": "2026-08-06T18:30:00.000Z",
        "title": "Q1 2027 Earnings Release (Projected)",
        "icsUrl": "https://in.marketscreener.com/api/stateful/agenda/event-async/Q1-2027-Earnings-Release-Projected-50542744.ics"
      }
    ]
  },
  "pastEvents": {
    "count": 121,
    "events": [
      {
        "section": "Past",
        "dateTimeRaw": "29/08/2025 10:15 am",
        "dateTimeISO": "2025-08-29T04:45:00.000Z",
        "title": "Annual General Meeting",
        "icsUrl": "https://in.marketscreener.com/api/stateful/agenda/event-async/Annual-General-Meeting-50150635.ics"
      },
      {
        "section": "Past",
        "dateTimeRaw": "19/08/2025",
        "dateTimeISO": "2025-08-18T18:30:00.000Z",
        "title": "Final dividend",
        "icsUrl": "https://in.marketscreener.com/api/stateful/agenda/event-async/Final-dividend-50185394.ics"
      },
      {
        "section": "Past",
        "dateTimeRaw": "13/08/2025 02:00 pm",
        "dateTimeISO": "2025-08-13T08:30:00.000Z",
        "title": "Q1 2026 Earnings Call",
        "icsUrl": "https://in.marketscreener.com/api/stateful/agenda/event-async/Q1-2026-Earnings-Call-50648662.ics"
      },
      {
        "section": "Past",
        "dateTimeRaw": "12/08/2025 07:15 pm",
        "dateTimeISO": "2025-08-12T13:45:00.000Z",
        "title": "Q1 2026 Earnings Release",
        "icsUrl": "https://in.marketscreener.com/api/stateful/agenda/event-async/Q1-2026-Earnings-Release-47697812.ics"
      },
      {
        "section": "Past",
        "dateTimeRaw": "01/07/2025 12:00 pm",
        "dateTimeISO": "2025-07-01T06:30:00.000Z",
        "title": "Business Update Call",
        "icsUrl": "https://in.marketscreener.com/api/stateful/agenda/event-async/Business-Update-Call-50384919.ics"
      },
      {
        "section": "Past",
        "dateTimeRaw": "31/05/2025 11:00 am",
        "dateTimeISO": "2025-05-31T05:30:00.000Z",
        "title": "Q4 2025 Earnings Call",
        "icsUrl": "https://in.marketscreener.com/api/stateful/agenda/event-async/Q4-2025-Earnings-Call-50020096.ics"
      },
      {
        "section": "Past",
        "dateTimeRaw": "30/05/2025 06:15 pm",
        "dateTimeISO": "2025-05-30T12:45:00.000Z",
        "title": "Q4 2025 Earnings Release",
        "icsUrl": "https://in.marketscreener.com/api/stateful/agenda/event-async/Q4-2025-Earnings-Release-46644439.ics"
      },
      {
        "section": "Past",
        "dateTimeRaw": "14/02/2025",
        "dateTimeISO": "2025-02-13T18:30:00.000Z",
        "title": "Ex-dividend day for dividende intermédiaire",
        "icsUrl": "https://in.marketscreener.com/api/stateful/agenda/event-async/Ex-dividend-day-for-dividende-intermediaire-49133408.ics"
      },
      {
        "section": "Past",
        "dateTimeRaw": "11/02/2025 02:15 pm",
        "dateTimeISO": "2025-02-11T08:45:00.000Z",
        "title": "Q3 2025 Earnings Call",
        "icsUrl": "https://in.marketscreener.com/api/stateful/agenda/event-async/Q3-2025-Earnings-Call-48921165.ics"
      },
      {
        "section": "Past",
        "dateTimeRaw": "10/02/2025 07:24 pm",
        "dateTimeISO": "2025-02-10T13:54:00.000Z",
        "title": "Q3 2025 Earnings Release",
        "icsUrl": "https://in.marketscreener.com/api/stateful/agenda/event-async/Q3-2025-Earnings-Release-45772471.ics"
      },
      {
        "section": "Past",
        "dateTimeRaw": "07/11/2024 02:00 pm",
        "dateTimeISO": "2024-11-07T08:30:00.000Z",
        "title": "Q2 2025 Earnings Call",
        "icsUrl": "https://in.marketscreener.com/api/stateful/agenda/event-async/Q2-2025-Earnings-Call-48172259.ics"
      },
      {
        "section": "Past",
        "dateTimeRaw": "06/11/2024 03:42 pm",
        "dateTimeISO": "2024-11-06T10:12:00.000Z",
        "title": "Q2 2025 Earnings Release",
        "icsUrl": "https://in.marketscreener.com/api/stateful/agenda/event-async/Q2-2025-Earnings-Release-45328083.ics"
      },
      {
        "section": "Past",
        "dateTimeRaw": "30/08/2024",
        "dateTimeISO": "2024-08-29T18:30:00.000Z",
        "title": "Annual General Meeting",
        "icsUrl": "https://in.marketscreener.com/api/stateful/agenda/event-async/Annual-General-Meeting-48284308.ics"
      },
      {
        "section": "Past",
        "dateTimeRaw": "16/08/2024",
        "dateTimeISO": "2024-08-15T18:30:00.000Z",
        "title": "Final dividend",
        "icsUrl": "https://in.marketscreener.com/api/stateful/agenda/event-async/Final-dividend-46934081.ics"
      },
      {
        "section": "Past",
        "dateTimeRaw": "14/08/2024 02:00 pm",
        "dateTimeISO": "2024-08-14T08:30:00.000Z",
        "title": "Q1 2025 Earnings Call",
        "icsUrl": "https://in.marketscreener.com/api/stateful/agenda/event-async/Q1-2025-Earnings-Call-47576221.ics"
      },
      {
        "section": "Past",
        "dateTimeRaw": "13/08/2024 07:01 pm",
        "dateTimeISO": "2024-08-13T13:31:00.000Z",
        "title": "Q1 2025 Earnings Release",
        "icsUrl": "https://in.marketscreener.com/api/stateful/agenda/event-async/Q1-2025-Earnings-Release-44364247.ics"
      },
      {
        "section": "Past",
        "dateTimeRaw": "31/05/2024 02:30 pm",
        "dateTimeISO": "2024-05-31T09:00:00.000Z",
        "title": "Q4 2024 Earnings Call",
        "icsUrl": "https://in.marketscreener.com/api/stateful/agenda/event-async/Q4-2024-Earnings-Call-46837098.ics"
      },
      {
        "section": "Past",
        "dateTimeRaw": "30/05/2024 06:56 pm",
        "dateTimeISO": "2024-05-30T13:26:00.000Z",
        "title": "Q4 2024 Earnings Release",
        "icsUrl": "https://in.marketscreener.com/api/stateful/agenda/event-async/Q4-2024-Earnings-Release-43898651.ics"
      },
      {
        "section": "Past",
        "dateTimeRaw": "27/04/2024 01:30 pm",
        "dateTimeISO": "2024-04-27T08:00:00.000Z",
        "title": "Investor Meeting",
        "icsUrl": "https://in.marketscreener.com/api/stateful/agenda/event-async/Investor-Meeting-46554355.ics"
      },
      {
        "section": "Past",
        "dateTimeRaw": "20/02/2024",
        "dateTimeISO": "2024-02-19T18:30:00.000Z",
        "title": "Ex-dividend day for dividende intermédiaire",
        "icsUrl": "https://in.marketscreener.com/api/stateful/agenda/event-async/Ex-dividend-day-for-dividende-intermediaire-45976923.ics"
      },
      {
        "section": "Past",
        "dateTimeRaw": "09/02/2024 01:00 pm",
        "dateTimeISO": "2024-02-09T07:30:00.000Z",
        "title": "Q3 2024 Earnings Call",
        "icsUrl": "https://in.marketscreener.com/api/stateful/agenda/event-async/Q3-2024-Earnings-Call-45808854.ics"
      },
      {
        "section": "Past",
        "dateTimeRaw": "08/02/2024 02:35 pm",
        "dateTimeISO": "2024-02-08T09:05:00.000Z",
        "title": "Q3 2024 Earnings Release",
        "icsUrl": "https://in.marketscreener.com/api/stateful/agenda/event-async/Q3-2024-Earnings-Release-42899878.ics"
      },
      {
        "section": "Past",
        "dateTimeRaw": "10/11/2023 12:30 pm",
        "dateTimeISO": "2023-11-10T07:00:00.000Z",
        "title": "Q2 2024 Earnings Call",
        "icsUrl": "https://in.marketscreener.com/api/stateful/agenda/event-async/Q2-2024-Earnings-Call-45326681.ics"
      },
      {
        "section": "Past",
        "dateTimeRaw": "09/11/2023 02:35 pm",
        "dateTimeISO": "2023-11-09T09:05:00.000Z",
        "title": "Q2 2024 Earnings Release",
        "icsUrl": "https://in.marketscreener.com/api/stateful/agenda/event-async/Q2-2024-Earnings-Release-42145791.ics"
      },
      {
        "section": "Past",
        "dateTimeRaw": "30/08/2023 10:15 am",
        "dateTimeISO": "2023-08-30T04:45:00.000Z",
        "title": "Annual General Meeting",
        "icsUrl": "https://in.marketscreener.com/api/stateful/agenda/event-async/Annual-General-Meeting-43995688.ics"
      },
      {
        "section": "Past",
        "dateTimeRaw": "18/08/2023",
        "dateTimeISO": "2023-08-17T18:30:00.000Z",
        "title": "Final dividend",
        "icsUrl": "https://in.marketscreener.com/api/stateful/agenda/event-async/Final-dividend-44086484.ics"
      },
      {
        "section": "Past",
        "dateTimeRaw": "11/08/2023 05:30 pm",
        "dateTimeISO": "2023-08-11T12:00:00.000Z",
        "title": "Q1 2024 Earnings Call",
        "icsUrl": "https://in.marketscreener.com/api/stateful/agenda/event-async/Q1-2024-Earnings-Call-44572819.ics"
      },
      {
        "section": "Past",
        "dateTimeRaw": "11/08/2023 02:03 pm",
        "dateTimeISO": "2023-08-11T08:33:00.000Z",
        "title": "Q1 2024 Earnings Release",
        "icsUrl": "https://in.marketscreener.com/api/stateful/agenda/event-async/Q1-2024-Earnings-Release-41144943.ics"
      },
      {
        "section": "Past",
        "dateTimeRaw": "31/05/2023 02:00 pm",
        "dateTimeISO": "2023-05-31T08:30:00.000Z",
        "title": "Q4 2023 Earnings Call",
        "icsUrl": "https://in.marketscreener.com/api/stateful/agenda/event-async/Q4-2023-Earnings-Call-43969020.ics"
      },
      {
        "section": "Past",
        "dateTimeRaw": "30/05/2023 02:58 pm",
        "dateTimeISO": "2023-05-30T09:28:00.000Z",
        "title": "Q4 2023 Earnings Release",
        "icsUrl": "https://in.marketscreener.com/api/stateful/agenda/event-async/Q4-2023-Earnings-Release-40307820.ics"
      },
      {
        "section": "Past",
        "dateTimeRaw": "24/02/2023",
        "dateTimeISO": "2023-02-23T18:30:00.000Z",
        "title": "Ex-dividend day for dividende intermédiaire",
        "icsUrl": "https://in.marketscreener.com/api/stateful/agenda/event-async/Ex-dividend-day-for-dividende-intermediaire-43084619.ics"
      },
      {
        "section": "Past",
        "dateTimeRaw": "15/02/2023 02:30 pm",
        "dateTimeISO": "2023-02-15T09:00:00.000Z",
        "title": "Q3 2023 Earnings Call",
        "icsUrl": "https://in.marketscreener.com/api/stateful/agenda/event-async/Q3-2023-Earnings-Call-42963456.ics"
      },
      {
        "section": "Past",
        "dateTimeRaw": "14/02/2023 04:58 pm",
        "dateTimeISO": "2023-02-14T11:28:00.000Z",
        "title": "Q3 2023 Earnings Release",
        "icsUrl": "https://in.marketscreener.com/api/stateful/agenda/event-async/Q3-2023-Earnings-Release-38151101.ics"
      },
      {
        "section": "Past",
        "dateTimeRaw": "11/11/2022 02:00 pm",
        "dateTimeISO": "2022-11-11T08:30:00.000Z",
        "title": "Interim 2023 Earnings Call",
        "icsUrl": "https://in.marketscreener.com/api/stateful/agenda/event-async/Interim-2023-Earnings-Call-42217355.ics"
      },
      {
        "section": "Past",
        "dateTimeRaw": "10/11/2022 06:42 pm",
        "dateTimeISO": "2022-11-10T13:12:00.000Z",
        "title": "Interim 2023 Earnings Release",
        "icsUrl": "https://in.marketscreener.com/api/stateful/agenda/event-async/Interim-2023-Earnings-Release-36840650.ics"
      },
      {
        "section": "Past",
        "dateTimeRaw": "25/08/2022 10:15 am",
        "dateTimeISO": "2022-08-25T04:45:00.000Z",
        "title": "Annual General Meeting",
        "icsUrl": "https://in.marketscreener.com/api/stateful/agenda/event-async/Annual-General-Meeting-41066549.ics"
      },
      {
        "section": "Past",
        "dateTimeRaw": "18/08/2022",
        "dateTimeISO": "2022-08-17T18:30:00.000Z",
        "title": "Ex-dividend day for final dividend",
        "icsUrl": "https://in.marketscreener.com/api/stateful/agenda/event-async/Ex-dividend-day-for-final-dividend-40580355.ics"
      },
      {
        "section": "Past",
        "dateTimeRaw": "12/08/2022 02:30 pm",
        "dateTimeISO": "2022-08-12T09:00:00.000Z",
        "title": "Q1 2023 Earnings Call",
        "icsUrl": "https://in.marketscreener.com/api/stateful/agenda/event-async/Q1-2023-Earnings-Call-41306300.ics"
      },
      {
        "section": "Past",
        "dateTimeRaw": "11/08/2022 06:57 pm",
        "dateTimeISO": "2022-08-11T13:27:00.000Z",
        "title": "Q1 2023 Earnings Release",
        "icsUrl": "https://in.marketscreener.com/api/stateful/agenda/event-async/Q1-2023-Earnings-Release-36102750.ics"
      },
      {
        "section": "Past",
        "dateTimeRaw": "26/05/2022 01:15 pm",
        "dateTimeISO": "2022-05-26T07:45:00.000Z",
        "title": "FY 2022 Earnings Call",
        "icsUrl": "https://in.marketscreener.com/api/stateful/agenda/event-async/FY-2022-Earnings-Call-40574204.ics"
      },
      {
        "section": "Past",
        "dateTimeRaw": "12/02/2022 01:15 pm",
        "dateTimeISO": "2022-02-12T07:45:00.000Z",
        "title": "Q3 2022 Earnings Call",
        "icsUrl": "https://in.marketscreener.com/api/stateful/agenda/event-async/Q3-2022-Earnings-Call-38150540.ics"
      },
      {
        "section": "Past",
        "dateTimeRaw": "11/02/2022 03:09 pm",
        "dateTimeISO": "2022-02-11T09:39:00.000Z",
        "title": "Q3 2022 Earnings Release",
        "icsUrl": "https://in.marketscreener.com/api/stateful/agenda/event-async/Q3-2022-Earnings-Release-32376222.ics"
      },
      {
        "section": "Past",
        "dateTimeRaw": "29/01/2022 02:00 pm",
        "dateTimeISO": "2022-01-29T08:30:00.000Z",
        "title": "Business Update Call",
        "icsUrl": "https://in.marketscreener.com/api/stateful/agenda/event-async/Business-Update-Call-37681731.ics"
      },
      {
        "section": "Past",
        "dateTimeRaw": "13/11/2021 01:15 pm",
        "dateTimeISO": "2021-11-13T07:45:00.000Z",
        "title": "Interim 2022 Earnings Call",
        "icsUrl": "https://in.marketscreener.com/api/stateful/agenda/event-async/Interim-2022-Earnings-Call-37008906.ics"
      },
      {
        "section": "Past",
        "dateTimeRaw": "12/11/2021 07:52 pm",
        "dateTimeISO": "2021-11-12T14:22:00.000Z",
        "title": "Interim 2022 Earnings Release",
        "icsUrl": "https://in.marketscreener.com/api/stateful/agenda/event-async/Interim-2022-Earnings-Release-31715398.ics"
      },
      {
        "section": "Past",
        "dateTimeRaw": "31/08/2021 10:15 am",
        "dateTimeISO": "2021-08-31T04:45:00.000Z",
        "title": "Annual General Meeting",
        "icsUrl": "https://in.marketscreener.com/api/stateful/agenda/event-async/Annual-General-Meeting-36343553.ics"
      },
      {
        "section": "Past",
        "dateTimeRaw": "18/08/2021",
        "dateTimeISO": "2021-08-17T18:30:00.000Z",
        "title": "Ex-dividend day for final dividend",
        "icsUrl": "https://in.marketscreener.com/api/stateful/agenda/event-async/Ex-dividend-day-for-final-dividend-35938384.ics"
      },
      {
        "section": "Past",
        "dateTimeRaw": "14/08/2021 01:00 pm",
        "dateTimeISO": "2021-08-14T07:30:00.000Z",
        "title": "Q1 2022 Earnings Call",
        "icsUrl": "https://in.marketscreener.com/api/stateful/agenda/event-async/Q1-2022-Earnings-Call-36326524.ics"
      },
      {
        "section": "Past",
        "dateTimeRaw": "13/08/2021 07:07 pm",
        "dateTimeISO": "2021-08-13T13:37:00.000Z",
        "title": "Q1 2022 Earnings Release",
        "icsUrl": "https://in.marketscreener.com/api/stateful/agenda/event-async/Q1-2022-Earnings-Release-30698581.ics"
      },
      {
        "section": "Past",
        "dateTimeRaw": "24/06/2021 03:05 pm",
        "dateTimeISO": "2021-06-24T09:35:00.000Z",
        "title": "FY 2021 Earnings Call",
        "icsUrl": "https://in.marketscreener.com/api/stateful/agenda/event-async/FY-2021-Earnings-Call-35709492.ics"
      },
      {
        "section": "Past",
        "dateTimeRaw": "23/06/2021",
        "dateTimeISO": "2021-06-22T18:30:00.000Z",
        "title": "FY 2021 Earnings Release",
        "icsUrl": "https://in.marketscreener.com/api/stateful/agenda/event-async/FY-2021-Earnings-Release-31237229.ics"
      },
      {
        "section": "Past",
        "dateTimeRaw": "13/02/2021 12:30 pm",
        "dateTimeISO": "2021-02-13T07:00:00.000Z",
        "title": "Q3 2021 Earnings Call",
        "icsUrl": "https://in.marketscreener.com/api/stateful/agenda/event-async/Q3-2021-Earnings-Call-32435520.ics"
      },
      {
        "section": "Past",
        "dateTimeRaw": "12/02/2021",
        "dateTimeISO": "2021-02-11T18:30:00.000Z",
        "title": "Q3 2021 Earnings Release",
        "icsUrl": "https://in.marketscreener.com/api/stateful/agenda/event-async/Q3-2021-Earnings-Release-29794085.ics"
      },
      {
        "section": "Past",
        "dateTimeRaw": "12/11/2020 01:25 pm",
        "dateTimeISO": "2020-11-12T07:55:00.000Z",
        "title": "Interim 2021 Earnings Call",
        "icsUrl": "https://in.marketscreener.com/api/stateful/agenda/event-async/Interim-2021-Earnings-Call-31782391.ics"
      },
      {
        "section": "Past",
        "dateTimeRaw": "11/11/2020",
        "dateTimeISO": "2020-11-10T18:30:00.000Z",
        "title": "Interim 2021 Earnings Release",
        "icsUrl": "https://in.marketscreener.com/api/stateful/agenda/event-async/Interim-2021-Earnings-Release-29406200.ics"
      },
      {
        "section": "Past",
        "dateTimeRaw": "25/09/2020",
        "dateTimeISO": "2020-09-24T18:30:00.000Z",
        "title": "Annual General Meeting",
        "icsUrl": "https://in.marketscreener.com/api/stateful/agenda/event-async/Annual-General-Meeting-31036683.ics"
      },
      {
        "section": "Past",
        "dateTimeRaw": "17/09/2020",
        "dateTimeISO": "2020-09-16T18:30:00.000Z",
        "title": "Ex-dividend day for final dividend",
        "icsUrl": "https://in.marketscreener.com/api/stateful/agenda/event-async/Ex-dividend-day-for-final-dividend-30838057.ics"
      },
      {
        "section": "Past",
        "dateTimeRaw": "15/09/2020 02:00 pm",
        "dateTimeISO": "2020-09-15T08:30:00.000Z",
        "title": "Q1 2021 Earnings Call",
        "icsUrl": "https://in.marketscreener.com/api/stateful/agenda/event-async/Q1-2021-Earnings-Call-31324762.ics"
      },
      {
        "section": "Past",
        "dateTimeRaw": "14/09/2020",
        "dateTimeISO": "2020-09-13T18:30:00.000Z",
        "title": "Q1 2021 Earnings Release",
        "icsUrl": "https://in.marketscreener.com/api/stateful/agenda/event-async/Q1-2021-Earnings-Release-28899739.ics"
      },
      {
        "section": "Past",
        "dateTimeRaw": "28/08/2020",
        "dateTimeISO": "2020-08-27T18:30:00.000Z",
        "title": "Lifesciences Virtual Confernce",
        "icsUrl": "https://in.marketscreener.com/api/stateful/agenda/event-async/Lifesciences-Virtual-Confernce-31200043.ics"
      },
      {
        "section": "Past",
        "dateTimeRaw": "26/06/2020 02:00 pm",
        "dateTimeISO": "2020-06-26T08:30:00.000Z",
        "title": "FY 2020 Earnings Call",
        "icsUrl": "https://in.marketscreener.com/api/stateful/agenda/event-async/FY-2020-Earnings-Call-30834742.ics"
      },
      {
        "section": "Past",
        "dateTimeRaw": "25/06/2020",
        "dateTimeISO": "2020-06-24T18:30:00.000Z",
        "title": "FY 2020 Earnings Release",
        "icsUrl": "https://in.marketscreener.com/api/stateful/agenda/event-async/FY-2020-Earnings-Release-28417591.ics"
      },
      {
        "section": "Past",
        "dateTimeRaw": "22/06/2020",
        "dateTimeISO": "2020-06-21T18:30:00.000Z",
        "title": "Q1 2021 Earnings Release",
        "icsUrl": "https://in.marketscreener.com/api/stateful/agenda/event-async/Q1-2021-Earnings-Release-30698389.ics"
      },
      {
        "section": "Past",
        "dateTimeRaw": "25/02/2020",
        "dateTimeISO": "2020-02-24T18:30:00.000Z",
        "title": "Ex-dividend day for dividende intermédiaire",
        "icsUrl": "https://in.marketscreener.com/api/stateful/agenda/event-async/Ex-dividend-day-for-dividende-intermediaire-30004446.ics"
      },
      {
        "section": "Past",
        "dateTimeRaw": "14/02/2020 12:30 pm",
        "dateTimeISO": "2020-02-14T07:00:00.000Z",
        "title": "Q3 2020 Earnings Call",
        "icsUrl": "https://in.marketscreener.com/api/stateful/agenda/event-async/Q3-2020-Earnings-Call-30043972.ics"
      },
      {
        "section": "Past",
        "dateTimeRaw": "13/02/2020",
        "dateTimeISO": "2020-02-12T18:30:00.000Z",
        "title": "Q3 2020 Earnings Release",
        "icsUrl": "https://in.marketscreener.com/api/stateful/agenda/event-async/Q3-2020-Earnings-Release-28304059.ics"
      },
      {
        "section": "Past",
        "dateTimeRaw": "15/11/2019 12:30 pm",
        "dateTimeISO": "2019-11-15T07:00:00.000Z",
        "title": "Interim 2020 Earnings Call",
        "icsUrl": "https://in.marketscreener.com/api/stateful/agenda/event-async/Interim-2020-Earnings-Call-29592170.ics"
      },
      {
        "section": "Past",
        "dateTimeRaw": "14/11/2019",
        "dateTimeISO": "2019-11-13T18:30:00.000Z",
        "title": "Interim 2020 Earnings Release",
        "icsUrl": "https://in.marketscreener.com/api/stateful/agenda/event-async/Interim-2020-Earnings-Release-28296919.ics"
      },
      {
        "section": "Past",
        "dateTimeRaw": "27/09/2019 09:45 am",
        "dateTimeISO": "2019-09-27T04:15:00.000Z",
        "title": "Annual General Meeting",
        "icsUrl": "https://in.marketscreener.com/api/stateful/agenda/event-async/Annual-General-Meeting-28692094.ics"
      },
      {
        "section": "Past",
        "dateTimeRaw": "12/09/2019",
        "dateTimeISO": "2019-09-11T18:30:00.000Z",
        "title": "Ex-dividend day for final dividend",
        "icsUrl": "https://in.marketscreener.com/api/stateful/agenda/event-async/Ex-dividend-day-for-final-dividend-28693194.ics"
      },
      {
        "section": "Past",
        "dateTimeRaw": "14/08/2019 02:15 pm",
        "dateTimeISO": "2019-08-14T08:45:00.000Z",
        "title": "Q1 2020 Earnings Call",
        "icsUrl": "https://in.marketscreener.com/api/stateful/agenda/event-async/Q1-2020-Earnings-Call-29078865.ics"
      },
      {
        "section": "Past",
        "dateTimeRaw": "13/08/2019",
        "dateTimeISO": "2019-08-12T18:30:00.000Z",
        "title": "Q1 2020 Earnings Release",
        "icsUrl": "https://in.marketscreener.com/api/stateful/agenda/event-async/Q1-2020-Earnings-Release-26621348.ics"
      },
      {
        "section": "Past",
        "dateTimeRaw": "31/05/2019 12:30 pm",
        "dateTimeISO": "2019-05-31T07:00:00.000Z",
        "title": "FY 2019 Earnings Call",
        "icsUrl": "https://in.marketscreener.com/api/stateful/agenda/event-async/FY-2019-Earnings-Call-28690326.ics"
      },
      {
        "section": "Past",
        "dateTimeRaw": "30/05/2019",
        "dateTimeISO": "2019-05-29T18:30:00.000Z",
        "title": "FY 2019 Earnings Release",
        "icsUrl": "https://in.marketscreener.com/api/stateful/agenda/event-async/FY-2019-Earnings-Release-26663419.ics"
      },
      {
        "section": "Past",
        "dateTimeRaw": "11/02/2019 12:00 pm",
        "dateTimeISO": "2019-02-11T06:30:00.000Z",
        "title": "Q3 2019 Earnings Call",
        "icsUrl": "https://in.marketscreener.com/api/stateful/agenda/event-async/Q3-2019-Earnings-Call-27986526.ics"
      },
      {
        "section": "Past",
        "dateTimeRaw": "09/02/2019",
        "dateTimeISO": "2019-02-08T18:30:00.000Z",
        "title": "Q3 2019 Earnings Release",
        "icsUrl": "https://in.marketscreener.com/api/stateful/agenda/event-async/Q3-2019-Earnings-Release-26144448.ics"
      },
      {
        "section": "Past",
        "dateTimeRaw": "09/01/2019 02:30 am",
        "dateTimeISO": "2019-01-08T21:00:00.000Z",
        "title": "J.P. Morgan Healthcare Conference",
        "icsUrl": "https://in.marketscreener.com/api/stateful/agenda/event-async/J-P-Morgan-Healthcare-Conference-27825907.ics"
      },
      {
        "section": "Past",
        "dateTimeRaw": "14/11/2018 05:00 pm",
        "dateTimeISO": "2018-11-14T11:30:00.000Z",
        "title": "Interim 2019 Earnings Call",
        "icsUrl": "https://in.marketscreener.com/api/stateful/agenda/event-async/Interim-2019-Earnings-Call-27622834.ics"
      },
      {
        "section": "Past",
        "dateTimeRaw": "14/11/2018",
        "dateTimeISO": "2018-11-13T18:30:00.000Z",
        "title": "Interim 2019 Earnings Release",
        "icsUrl": "https://in.marketscreener.com/api/stateful/agenda/event-async/Interim-2019-Earnings-Release-25391870.ics"
      },
      {
        "section": "Past",
        "dateTimeRaw": "27/09/2018 10:15 am",
        "dateTimeISO": "2018-09-27T04:45:00.000Z",
        "title": "Annual General Meeting",
        "icsUrl": "https://in.marketscreener.com/api/stateful/agenda/event-async/Annual-General-Meeting-26702534.ics"
      },
      {
        "section": "Past",
        "dateTimeRaw": "12/09/2018",
        "dateTimeISO": "2018-09-11T18:30:00.000Z",
        "title": "Ex-dividend day for final dividend",
        "icsUrl": "https://in.marketscreener.com/api/stateful/agenda/event-async/Ex-dividend-day-for-final-dividend-26705056.ics"
      },
      {
        "section": "Past",
        "dateTimeRaw": "11/08/2018 12:30 pm",
        "dateTimeISO": "2018-08-11T07:00:00.000Z",
        "title": "Q1 2019 Earnings Call",
        "icsUrl": "https://in.marketscreener.com/api/stateful/agenda/event-async/Q1-2019-Earnings-Call-27097999.ics"
      },
      {
        "section": "Past",
        "dateTimeRaw": "10/08/2018",
        "dateTimeISO": "2018-08-09T18:30:00.000Z",
        "title": "Q1 2019 Earnings Release",
        "icsUrl": "https://in.marketscreener.com/api/stateful/agenda/event-async/Q1-2019-Earnings-Release-25390096.ics"
      },
      {
        "section": "Past",
        "dateTimeRaw": "31/05/2018 03:00 pm",
        "dateTimeISO": "2018-05-31T09:30:00.000Z",
        "title": "FY 2018 Earnings Call",
        "icsUrl": "https://in.marketscreener.com/api/stateful/agenda/event-async/FY-2018-Earnings-Call-26701070.ics"
      },
      {
        "section": "Past",
        "dateTimeRaw": "30/05/2018",
        "dateTimeISO": "2018-05-29T18:30:00.000Z",
        "title": "FY 2018 Earnings Release",
        "icsUrl": "https://in.marketscreener.com/api/stateful/agenda/event-async/FY-2018-Earnings-Release-25388433.ics"
      },
      {
        "section": "Past",
        "dateTimeRaw": "15/02/2018 02:30 pm",
        "dateTimeISO": "2018-02-15T09:00:00.000Z",
        "title": "Q3 2018 Earnings Call",
        "icsUrl": "https://in.marketscreener.com/api/stateful/agenda/event-async/Q3-2018-Earnings-Call-26010778.ics"
      },
      {
        "section": "Past",
        "dateTimeRaw": "14/02/2018",
        "dateTimeISO": "2018-02-13T18:30:00.000Z",
        "title": "Q3 2018 Earnings Release",
        "icsUrl": "https://in.marketscreener.com/api/stateful/agenda/event-async/Q3-2018-Earnings-Release-23902239.ics"
      },
      {
        "section": "Past",
        "dateTimeRaw": "14/11/2017 01:30 pm",
        "dateTimeISO": "2017-11-14T08:00:00.000Z",
        "title": "Interim 2018 Earnings Call",
        "icsUrl": "https://in.marketscreener.com/api/stateful/agenda/event-async/Interim-2018-Earnings-Call-25487251.ics"
      },
      {
        "section": "Past",
        "dateTimeRaw": "13/11/2017",
        "dateTimeISO": "2017-11-12T18:30:00.000Z",
        "title": "Interim 2018 Earnings Release",
        "icsUrl": "https://in.marketscreener.com/api/stateful/agenda/event-async/Interim-2018-Earnings-Release-23901951.ics"
      },
      {
        "section": "Past",
        "dateTimeRaw": "20/09/2017",
        "dateTimeISO": "2017-09-19T18:30:00.000Z",
        "title": "Annual General Meeting",
        "icsUrl": "https://in.marketscreener.com/api/stateful/agenda/event-async/Annual-General-Meeting-24537796.ics"
      },
      {
        "section": "Past",
        "dateTimeRaw": "07/09/2017",
        "dateTimeISO": "2017-09-06T18:30:00.000Z",
        "title": "Ex-dividend day for final dividend",
        "icsUrl": "https://in.marketscreener.com/api/stateful/agenda/event-async/Ex-dividend-day-for-final-dividend-24539398.ics"
      },
      {
        "section": "Past",
        "dateTimeRaw": "16/08/2017 02:30 pm",
        "dateTimeISO": "2017-08-16T09:00:00.000Z",
        "title": "Q1 2018 Earnings Call",
        "icsUrl": "https://in.marketscreener.com/api/stateful/agenda/event-async/Q1-2018-Earnings-Call-24973648.ics"
      },
      {
        "section": "Past",
        "dateTimeRaw": "14/08/2017",
        "dateTimeISO": "2017-08-13T18:30:00.000Z",
        "title": "Q1 2018 Earnings Release",
        "icsUrl": "https://in.marketscreener.com/api/stateful/agenda/event-async/Q1-2018-Earnings-Release-23901228.ics"
      },
      {
        "section": "Past",
        "dateTimeRaw": "31/05/2017 02:30 pm",
        "dateTimeISO": "2017-05-31T09:00:00.000Z",
        "title": "FY 2017 Earnings Call",
        "icsUrl": "https://in.marketscreener.com/api/stateful/agenda/event-async/FY-2017-Earnings-Call-24537501.ics"
      },
      {
        "section": "Past",
        "dateTimeRaw": "30/05/2017",
        "dateTimeISO": "2017-05-29T18:30:00.000Z",
        "title": "FY 2017 Earnings Release",
        "icsUrl": "https://in.marketscreener.com/api/stateful/agenda/event-async/FY-2017-Earnings-Release-22665787.ics"
      },
      {
        "section": "Past",
        "dateTimeRaw": "27/04/2017 03:00 pm",
        "dateTimeISO": "2017-04-27T09:30:00.000Z",
        "title": "FY 2017 Earnings Call",
        "icsUrl": "https://in.marketscreener.com/api/stateful/agenda/event-async/FY-2017-Earnings-Call-24396489.ics"
      },
      {
        "section": "Past",
        "dateTimeRaw": "15/02/2017 03:00 pm",
        "dateTimeISO": "2017-02-15T09:30:00.000Z",
        "title": "Q3 2017 Earnings Call",
        "icsUrl": "https://in.marketscreener.com/api/stateful/agenda/event-async/Q3-2017-Earnings-Call-23856836.ics"
      },
      {
        "section": "Past",
        "dateTimeRaw": "14/02/2017",
        "dateTimeISO": "2017-02-13T18:30:00.000Z",
        "title": "Q3 2017 Earnings Release",
        "icsUrl": "https://in.marketscreener.com/api/stateful/agenda/event-async/Q3-2017-Earnings-Release-22658856.ics"
      },
      {
        "section": "Past",
        "dateTimeRaw": "12/11/2016 11:30 am",
        "dateTimeISO": "2016-11-12T06:00:00.000Z",
        "title": "Interim 2017 Earnings Call",
        "icsUrl": "https://in.marketscreener.com/api/stateful/agenda/event-async/Interim-2017-Earnings-Call-23388704.ics"
      },
      {
        "section": "Past",
        "dateTimeRaw": "11/11/2016",
        "dateTimeISO": "2016-11-10T18:30:00.000Z",
        "title": "Interim 2017 Earnings Release",
        "icsUrl": "https://in.marketscreener.com/api/stateful/agenda/event-async/Interim-2017-Earnings-Release-21324376.ics"
      },
      {
        "section": "Past",
        "dateTimeRaw": "02/09/2016 02:00 pm",
        "dateTimeISO": "2016-09-02T08:30:00.000Z",
        "title": "Q1 2017 Earnings Call",
        "icsUrl": "https://in.marketscreener.com/api/stateful/agenda/event-async/Q1-2017-Earnings-Call-23001463.ics"
      },
      {
        "section": "Past",
        "dateTimeRaw": "01/09/2016",
        "dateTimeISO": "2016-08-31T18:30:00.000Z",
        "title": "Q1 2017 Earnings Release",
        "icsUrl": "https://in.marketscreener.com/api/stateful/agenda/event-async/Q1-2017-Earnings-Release-20912373.ics"
      },
      {
        "section": "Past",
        "dateTimeRaw": "12/08/2016 09:45 am",
        "dateTimeISO": "2016-08-12T04:15:00.000Z",
        "title": "Annual General Meeting",
        "icsUrl": "https://in.marketscreener.com/api/stateful/agenda/event-async/Annual-General-Meeting-22740377.ics"
      },
      {
        "section": "Past",
        "dateTimeRaw": "26/05/2016 12:00 pm",
        "dateTimeISO": "2016-05-26T06:30:00.000Z",
        "title": "FY 2016 Earnings Call",
        "icsUrl": "https://in.marketscreener.com/api/stateful/agenda/event-async/FY-2016-Earnings-Call-22434976.ics"
      },
      {
        "section": "Past",
        "dateTimeRaw": "25/05/2016",
        "dateTimeISO": "2016-05-24T18:30:00.000Z",
        "title": "FY 2016 Earnings Release",
        "icsUrl": "https://in.marketscreener.com/api/stateful/agenda/event-async/FY-2016-Earnings-Release-20910250.ics"
      },
      {
        "section": "Past",
        "dateTimeRaw": "22/03/2016",
        "dateTimeISO": "2016-03-21T18:30:00.000Z",
        "title": "Ex-dividend day for dividende intermédiaire",
        "icsUrl": "https://in.marketscreener.com/api/stateful/agenda/event-async/Ex-dividend-day-for-dividende-intermediaire-22042996.ics"
      },
      {
        "section": "Past",
        "dateTimeRaw": "15/02/2016 02:30 pm",
        "dateTimeISO": "2016-02-15T09:00:00.000Z",
        "title": "Q3 2016 Earnings Call",
        "icsUrl": "https://in.marketscreener.com/api/stateful/agenda/event-async/Q3-2016-Earnings-Call-21849680.ics"
      },
      {
        "section": "Past",
        "dateTimeRaw": "12/02/2016",
        "dateTimeISO": "2016-02-11T18:30:00.000Z",
        "title": "Q3 2016 Earnings Release",
        "icsUrl": "https://in.marketscreener.com/api/stateful/agenda/event-async/Q3-2016-Earnings-Release-20903294.ics"
      },
      {
        "section": "Past",
        "dateTimeRaw": "16/11/2015 12:30 pm",
        "dateTimeISO": "2015-11-16T07:00:00.000Z",
        "title": "Interim 2016 Earnings Call",
        "icsUrl": "https://in.marketscreener.com/api/stateful/agenda/event-async/Interim-2016-Earnings-Call-21409402.ics"
      },
      {
        "section": "Past",
        "dateTimeRaw": "14/11/2015",
        "dateTimeISO": "2015-11-13T18:30:00.000Z",
        "title": "Interim 2016 Earnings Release",
        "icsUrl": "https://in.marketscreener.com/api/stateful/agenda/event-async/Interim-2016-Earnings-Release-19183601.ics"
      },
      {
        "section": "Past",
        "dateTimeRaw": "12/08/2015 02:30 pm",
        "dateTimeISO": "2015-08-12T09:00:00.000Z",
        "title": "Q1 2016 Earnings Call",
        "icsUrl": "https://in.marketscreener.com/api/stateful/agenda/event-async/Q1-2016-Earnings-Call-20869764.ics"
      },
      {
        "section": "Past",
        "dateTimeRaw": "11/08/2015 10:00 am",
        "dateTimeISO": "2015-08-11T04:30:00.000Z",
        "title": "Annual General Meeting",
        "icsUrl": "https://in.marketscreener.com/api/stateful/agenda/event-async/Annual-General-Meeting-20463660.ics"
      },
      {
        "section": "Past",
        "dateTimeRaw": "11/08/2015",
        "dateTimeISO": "2015-08-10T18:30:00.000Z",
        "title": "Q1 2016 Earnings Release",
        "icsUrl": "https://in.marketscreener.com/api/stateful/agenda/event-async/Q1-2016-Earnings-Release-18728862.ics"
      },
      {
        "section": "Past",
        "dateTimeRaw": "30/07/2015",
        "dateTimeISO": "2015-07-29T18:30:00.000Z",
        "title": "Ex-dividend day for final dividend",
        "icsUrl": "https://in.marketscreener.com/api/stateful/agenda/event-async/Ex-dividend-day-for-final-dividend-20464076.ics"
      },
      {
        "section": "Past",
        "dateTimeRaw": "29/05/2015 02:30 pm",
        "dateTimeISO": "2015-05-29T09:00:00.000Z",
        "title": "FY 2015 Earnings Call",
        "icsUrl": "https://in.marketscreener.com/api/stateful/agenda/event-async/FY-2015-Earnings-Call-20462272.ics"
      },
      {
        "section": "Past",
        "dateTimeRaw": "28/05/2015",
        "dateTimeISO": "2015-05-27T18:30:00.000Z",
        "title": "FY 2015 Earnings Release",
        "icsUrl": "https://in.marketscreener.com/api/stateful/agenda/event-async/FY-2015-Earnings-Release-18263112.ics"
      },
      {
        "section": "Past",
        "dateTimeRaw": "16/02/2015 02:30 pm",
        "dateTimeISO": "2015-02-16T09:00:00.000Z",
        "title": "Q3 2015 Earnings Call",
        "icsUrl": "https://in.marketscreener.com/api/stateful/agenda/event-async/Q3-2015-Earnings-Call-19871717.ics"
      },
      {
        "section": "Past",
        "dateTimeRaw": "14/02/2015",
        "dateTimeISO": "2015-02-13T18:30:00.000Z",
        "title": "Q3 2015 Earnings Release",
        "icsUrl": "https://in.marketscreener.com/api/stateful/agenda/event-async/Q3-2015-Earnings-Release-17790574.ics"
      },
      {
        "section": "Past",
        "dateTimeRaw": "13/08/2014",
        "dateTimeISO": "2014-08-12T18:30:00.000Z",
        "title": "Ex-dividend day for final dividend",
        "icsUrl": "https://in.marketscreener.com/api/stateful/agenda/event-async/Ex-dividend-day-for-final-dividend-18527702.ics"
      },
      {
        "section": "Past",
        "dateTimeRaw": "25/07/2013",
        "dateTimeISO": "2013-07-24T18:30:00.000Z",
        "title": "Ex-dividend day for final dividend",
        "icsUrl": "https://in.marketscreener.com/api/stateful/agenda/event-async/Ex-dividend-day-for-final-dividend-17002027.ics"
      },
      {
        "section": "Past",
        "dateTimeRaw": "26/07/2012",
        "dateTimeISO": "2012-07-25T18:30:00.000Z",
        "title": "Ex-dividend day for final dividend",
        "icsUrl": "https://in.marketscreener.com/api/stateful/agenda/event-async/Ex-dividend-day-for-final-dividend-15289321.ics"
      }
    ]
  },
  "pastDividends": {
    "count": 33,
    "dividends": [
      {
        "section": "Past Dividends",
        "dateRaw": "19/08/2025",
        "dateISO": "2025-08-18T18:30:00.000Z",
        "type": "Final Payment",
        "amount": 10,
        "currency": "INR",
        "title": "Final Payment 10 INR"
      },
      {
        "section": "Past Dividends",
        "dateRaw": "14/02/2025",
        "dateISO": "2025-02-13T18:30:00.000Z",
        "type": "Interim Payment",
        "amount": 9,
        "currency": "INR",
        "title": "Interim Payment 9 INR"
      },
      {
        "section": "Past Dividends",
        "dateRaw": "16/08/2024",
        "dateISO": "2024-08-15T18:30:00.000Z",
        "type": "Final Payment",
        "amount": 10,
        "currency": "INR",
        "title": "Final Payment 10 INR"
      },
      {
        "section": "Past Dividends",
        "dateRaw": "20/02/2024",
        "dateISO": "2024-02-19T18:30:00.000Z",
        "type": "Interim Payment",
        "amount": 6,
        "currency": "INR",
        "title": "Interim Payment 6 INR"
      },
      {
        "section": "Past Dividends",
        "dateRaw": "18/08/2023",
        "dateISO": "2023-08-17T18:30:00.000Z",
        "type": "Final Payment",
        "amount": 9,
        "currency": "INR",
        "title": "Final Payment 9 INR"
      },
      {
        "section": "Past Dividends",
        "dateRaw": "24/02/2023",
        "dateISO": "2023-02-23T18:30:00.000Z",
        "type": "Interim Payment",
        "amount": 6,
        "currency": "INR",
        "title": "Interim Payment 6 INR"
      },
      {
        "section": "Past Dividends",
        "dateRaw": "18/08/2022",
        "dateISO": "2022-08-17T18:30:00.000Z",
        "type": "Annual",
        "amount": 11.75,
        "currency": "INR",
        "title": "Annual 11.75 INR"
      },
      {
        "section": "Past Dividends",
        "dateRaw": "18/08/2021",
        "dateISO": "2021-08-17T18:30:00.000Z",
        "type": "Annual",
        "amount": 3,
        "currency": "INR",
        "title": "Annual 3 INR"
      },
      {
        "section": "Past Dividends",
        "dateRaw": "17/09/2020",
        "dateISO": "2020-09-16T18:30:00.000Z",
        "type": "Final Payment",
        "amount": 2.75,
        "currency": "INR",
        "title": "Final Payment 2.75 INR"
      },
      {
        "section": "Past Dividends",
        "dateRaw": "25/02/2020",
        "dateISO": "2020-02-24T18:30:00.000Z",
        "type": "Interim Payment",
        "amount": 3.25,
        "currency": "INR",
        "title": "Interim Payment 3.25 INR"
      },
      {
        "section": "Past Dividends",
        "dateRaw": "12/09/2019",
        "dateISO": "2019-09-11T18:30:00.000Z",
        "type": "Annual",
        "amount": 6,
        "currency": "INR",
        "title": "Annual 6 INR"
      },
      {
        "section": "Past Dividends",
        "dateRaw": "12/09/2018",
        "dateISO": "2018-09-11T18:30:00.000Z",
        "type": "Annual",
        "amount": 5,
        "currency": "INR",
        "title": "Annual 5 INR"
      },
      {
        "section": "Past Dividends",
        "dateRaw": "07/09/2017",
        "dateISO": "2017-09-06T18:30:00.000Z",
        "type": "Annual",
        "amount": 6,
        "currency": "INR",
        "title": "Annual 6 INR"
      },
      {
        "section": "Past Dividends",
        "dateRaw": "22/03/2016",
        "dateISO": "2016-03-21T18:30:00.000Z",
        "type": "Interim Payment",
        "amount": 6,
        "currency": "INR",
        "title": "Interim Payment 6 INR"
      },
      {
        "section": "Past Dividends",
        "dateRaw": "30/07/2015",
        "dateISO": "2015-07-29T18:30:00.000Z",
        "type": "5.75 INR",
        "amount": null,
        "currency": null,
        "title": "5.75 INR"
      },
      {
        "section": "Past Dividends",
        "dateRaw": "13/08/2014",
        "dateISO": "2014-08-12T18:30:00.000Z",
        "type": "Annual",
        "amount": 5.75,
        "currency": "INR",
        "title": "Annual 5.75 INR"
      },
      {
        "section": "Past Dividends",
        "dateRaw": "25/07/2013",
        "dateISO": "2013-07-24T18:30:00.000Z",
        "type": "Annual",
        "amount": 5.5,
        "currency": "INR",
        "title": "Annual 5.5 INR"
      },
      {
        "section": "Past Dividends",
        "dateRaw": "26/07/2012",
        "dateISO": "2012-07-25T18:30:00.000Z",
        "type": "Annual",
        "amount": 4,
        "currency": "INR",
        "title": "Annual 4 INR"
      },
      {
        "section": "Past Dividends",
        "dateRaw": "07/07/2011",
        "dateISO": "2011-07-06T18:30:00.000Z",
        "type": "Annual",
        "amount": 3.75,
        "currency": "INR",
        "title": "Annual 3.75 INR"
      },
      {
        "section": "Past Dividends",
        "dateRaw": "15/07/2010",
        "dateISO": "2010-07-14T18:30:00.000Z",
        "type": "Annual",
        "amount": 7,
        "currency": "INR",
        "title": "Annual 7 INR"
      },
      {
        "section": "Past Dividends",
        "dateRaw": "20/08/2009",
        "dateISO": "2009-08-19T18:30:00.000Z",
        "type": "Annual",
        "amount": 6.5,
        "currency": "INR",
        "title": "Annual 6.5 INR"
      },
      {
        "section": "Past Dividends",
        "dateRaw": "11/08/2008",
        "dateISO": "2008-08-10T18:30:00.000Z",
        "type": "Annual",
        "amount": 6,
        "currency": "INR",
        "title": "Annual 6 INR"
      },
      {
        "section": "Past Dividends",
        "dateRaw": "09/08/2007",
        "dateISO": "2007-08-08T18:30:00.000Z",
        "type": "Final Payment",
        "amount": 2,
        "currency": "INR",
        "title": "Final Payment 2 INR"
      },
      {
        "section": "Past Dividends",
        "dateRaw": "22/03/2007",
        "dateISO": "2007-03-21T18:30:00.000Z",
        "type": "Interim Payment",
        "amount": 3,
        "currency": "INR",
        "title": "Interim Payment 3 INR"
      },
      {
        "section": "Past Dividends",
        "dateRaw": "27/07/2006",
        "dateISO": "2006-07-26T18:30:00.000Z",
        "type": "Annual",
        "amount": 4.5,
        "currency": "INR",
        "title": "Annual 4.5 INR"
      },
      {
        "section": "Past Dividends",
        "dateRaw": "29/07/2005",
        "dateISO": "2005-07-28T18:30:00.000Z",
        "type": "Annual",
        "amount": 4,
        "currency": "INR",
        "title": "Annual 4 INR"
      },
      {
        "section": "Past Dividends",
        "dateRaw": "30/08/2004",
        "dateISO": "2004-08-29T18:30:00.000Z",
        "type": "Annual",
        "amount": 3.5,
        "currency": "INR",
        "title": "Annual 3.5 INR"
      },
      {
        "section": "Past Dividends",
        "dateRaw": "11/08/2003",
        "dateISO": "2003-08-10T18:30:00.000Z",
        "type": "Annual",
        "amount": 3,
        "currency": "INR",
        "title": "Annual 3 INR"
      },
      {
        "section": "Past Dividends",
        "dateRaw": "02/09/2002",
        "dateISO": "2002-09-01T18:30:00.000Z",
        "type": "Annual",
        "amount": 2.5,
        "currency": "INR",
        "title": "Annual 2.5 INR"
      },
      {
        "section": "Past Dividends",
        "dateRaw": "08/03/2002",
        "dateISO": "2002-03-07T18:30:00.000Z",
        "type": "Interim Payment",
        "amount": 2,
        "currency": "INR",
        "title": "Interim Payment 2 INR"
      },
      {
        "section": "Past Dividends",
        "dateRaw": "17/08/2001",
        "dateISO": "2001-08-16T18:30:00.000Z",
        "type": "Annual",
        "amount": 2.5,
        "currency": "INR",
        "title": "Annual 2.5 INR"
      },
      {
        "section": "Past Dividends",
        "dateRaw": "14/08/2000",
        "dateISO": "2000-08-13T18:30:00.000Z",
        "type": "Final Payment",
        "amount": 0.5,
        "currency": "INR",
        "title": "Final Payment 0.5 INR"
      },
      {
        "section": "Past Dividends",
        "dateRaw": "02/05/2000",
        "dateISO": "2000-05-01T18:30:00.000Z",
        "type": "Interim Payment",
        "amount": 2,
        "currency": "INR",
        "title": "Interim Payment 2 INR"
      }
    ]
  }
}