{
  "companyCode": "BOSCH-LIMITED-6493403",
  "timestamp": "2025-10-13T12:18:20.845Z",
  "annualResults": {
    "2023": {
      "Net salesMillion INR": {
        "metric": "Net salesMillion INR",
        "unit": "Million INR",
        "fiscalMonth": "March",
        "year": "2023",
        "released": "149 293",
        "forecast": "146 471",
        "spreadRaw": "1.93%"
      },
      "EBITDAMillion INR": {
        "metric": "EBITDAMillion INR",
        "unit": "Million INR",
        "fiscalMonth": "March",
        "year": "2023",
        "released": "18 067",
        "forecast": "18 045",
        "spreadRaw": "0.12%"
      },
      "EBITMillion INR": {
        "metric": "EBITMillion INR",
        "unit": "Million INR",
        "fiscalMonth": "March",
        "year": "2023",
        "released": "14 211",
        "forecast": "14 653",
        "spreadRaw": "-3.01%"
      },
      "Earnings before Tax (EBT)Million INR": {
        "metric": "Earnings before Tax (EBT)Million INR",
        "unit": "Million INR",
        "fiscalMonth": "March",
        "year": "2023",
        "released": "18 824",
        "forecast": "18 928",
        "spreadRaw": "-0.55%"
      },
      "Net incomeMillion INR": {
        "metric": "Net incomeMillion INR",
        "unit": "Million INR",
        "fiscalMonth": "March",
        "year": "2023",
        "released": "14 245",
        "forecast": "14 279",
        "spreadRaw": "-0.24%"
      },
      "EPS INR": {
        "metric": "EPS INR",
        "unit": "INR",
        "fiscalMonth": "March",
        "year": "2023",
        "released": "483",
        "forecast": "484",
        "spreadRaw": "-0.24%"
      },
      "Announcement Date": {
        "metric": "Announcement Date",
        "unit": null,
        "fiscalMonth": "March",
        "year": "2023",
        "released": "11/05/23",
        "forecast": null,
        "spreadRaw": null
      }
    },
    "2024": {
      "Net salesMillion INR": {
        "metric": "Net salesMillion INR",
        "unit": "Million INR",
        "fiscalMonth": "March",
        "year": "2024",
        "released": "167 271",
        "forecast": "169 472",
        "spreadRaw": "-1.3%"
      },
      "EBITDAMillion INR": {
        "metric": "EBITDAMillion INR",
        "unit": "Million INR",
        "fiscalMonth": "March",
        "year": "2024",
        "released": "20 948",
        "forecast": "21 367",
        "spreadRaw": "-1.96%"
      },
      "EBITMillion INR": {
        "metric": "EBITMillion INR",
        "unit": "Million INR",
        "fiscalMonth": "March",
        "year": "2024",
        "released": "16 653",
        "forecast": "17 151",
        "spreadRaw": "-2.9%"
      },
      "Earnings before Tax (EBT)Million INR": {
        "metric": "Earnings before Tax (EBT)Million INR",
        "unit": "Million INR",
        "fiscalMonth": "March",
        "year": "2024",
        "released": "31 810",
        "forecast": "27 556",
        "spreadRaw": "15.44%"
      },
      "Net incomeMillion INR": {
        "metric": "Net incomeMillion INR",
        "unit": "Million INR",
        "fiscalMonth": "March",
        "year": "2024",
        "released": "24 905",
        "forecast": "21 284",
        "spreadRaw": "17.02%"
      },
      "EPS INR": {
        "metric": "EPS INR",
        "unit": "INR",
        "fiscalMonth": "March",
        "year": "2024",
        "released": "844",
        "forecast": "653",
        "spreadRaw": "29.31%"
      },
      "Announcement Date": {
        "metric": "Announcement Date",
        "unit": null,
        "fiscalMonth": "March",
        "year": "2024",
        "released": "24/05/24",
        "forecast": null,
        "spreadRaw": null
      }
    },
    "2025": {
      "Net salesMillion INR": {
        "metric": "Net salesMillion INR",
        "unit": "Million INR",
        "fiscalMonth": "March",
        "year": "2025",
        "released": "180 874",
        "forecast": "181 890",
        "spreadRaw": "-0.56%"
      },
      "EBITDAMillion INR": {
        "metric": "EBITDAMillion INR",
        "unit": "Million INR",
        "fiscalMonth": "March",
        "year": "2025",
        "released": "23 097",
        "forecast": "23 234",
        "spreadRaw": "-0.59%"
      },
      "EBITMillion INR": {
        "metric": "EBITMillion INR",
        "unit": "Million INR",
        "fiscalMonth": "March",
        "year": "2025",
        "released": "19 341",
        "forecast": "18 930",
        "spreadRaw": "2.17%"
      },
      "Earnings before Tax (EBT)Million INR": {
        "metric": "Earnings before Tax (EBT)Million INR",
        "unit": "Million INR",
        "fiscalMonth": "March",
        "year": "2025",
        "released": "27 326",
        "forecast": "26 738",
        "spreadRaw": "2.2%"
      },
      "Net incomeMillion INR": {
        "metric": "Net incomeMillion INR",
        "unit": "Million INR",
        "fiscalMonth": "March",
        "year": "2025",
        "released": "20 133",
        "forecast": "20 254",
        "spreadRaw": "-0.6%"
      },
      "EPS INR": {
        "metric": "EPS INR",
        "unit": "INR",
        "fiscalMonth": "March",
        "year": "2025",
        "released": "683",
        "forecast": "685",
        "spreadRaw": "-0.31%"
      },
      "Announcement Date": {
        "metric": "Announcement Date",
        "unit": null,
        "fiscalMonth": "March",
        "year": "2025",
        "released": "27/05/25",
        "forecast": null,
        "spreadRaw": null
      }
    },
    "2026": {
      "Net salesMillion INR": {
        "metric": "Net salesMillion INR",
        "unit": "Million INR",
        "fiscalMonth": "March",
        "year": "2026",
        "released": null,
        "forecast": "199 174",
        "spreadRaw": null
      },
      "EBITDAMillion INR": {
        "metric": "EBITDAMillion INR",
        "unit": "Million INR",
        "fiscalMonth": "March",
        "year": "2026",
        "released": null,
        "forecast": "26 674",
        "spreadRaw": null
      },
      "EBITMillion INR": {
        "metric": "EBITMillion INR",
        "unit": "Million INR",
        "fiscalMonth": "March",
        "year": "2026",
        "released": null,
        "forecast": "22 491",
        "spreadRaw": null
      },
      "Earnings before Tax (EBT)Million INR": {
        "metric": "Earnings before Tax (EBT)Million INR",
        "unit": "Million INR",
        "fiscalMonth": "March",
        "year": "2026",
        "released": null,
        "forecast": "33 980",
        "spreadRaw": null
      },
      "Net incomeMillion INR": {
        "metric": "Net incomeMillion INR",
        "unit": "Million INR",
        "fiscalMonth": "March",
        "year": "2026",
        "released": null,
        "forecast": "25 389",
        "spreadRaw": null
      },
      "EPS INR": {
        "metric": "EPS INR",
        "unit": "INR",
        "fiscalMonth": "March",
        "year": "2026",
        "released": null,
        "forecast": "827",
        "spreadRaw": null
      },
      "Announcement Date": {
        "metric": "Announcement Date",
        "unit": null,
        "fiscalMonth": "March",
        "year": "2026",
        "released": "-",
        "forecast": null,
        "spreadRaw": null
      }
    },
    "2027": {
      "Net salesMillion INR": {
        "metric": "Net salesMillion INR",
        "unit": "Million INR",
        "fiscalMonth": "March",
        "year": "2027",
        "released": null,
        "forecast": "223 536",
        "spreadRaw": null
      },
      "EBITDAMillion INR": {
        "metric": "EBITDAMillion INR",
        "unit": "Million INR",
        "fiscalMonth": "March",
        "year": "2027",
        "released": null,
        "forecast": "30 697",
        "spreadRaw": null
      },
      "EBITMillion INR": {
        "metric": "EBITMillion INR",
        "unit": "Million INR",
        "fiscalMonth": "March",
        "year": "2027",
        "released": null,
        "forecast": "25 158",
        "spreadRaw": null
      },
      "Earnings before Tax (EBT)Million INR": {
        "metric": "Earnings before Tax (EBT)Million INR",
        "unit": "Million INR",
        "fiscalMonth": "March",
        "year": "2027",
        "released": null,
        "forecast": "35 760",
        "spreadRaw": null
      },
      "Net incomeMillion INR": {
        "metric": "Net incomeMillion INR",
        "unit": "Million INR",
        "fiscalMonth": "March",
        "year": "2027",
        "released": null,
        "forecast": "27 032",
        "spreadRaw": null
      },
      "EPS INR": {
        "metric": "EPS INR",
        "unit": "INR",
        "fiscalMonth": "March",
        "year": "2027",
        "released": null,
        "forecast": "928",
        "spreadRaw": null
      },
      "Announcement Date": {
        "metric": "Announcement Date",
        "unit": null,
        "fiscalMonth": "March",
        "year": "2027",
        "released": null,
        "forecast": null,
        "spreadRaw": null
      }
    },
    "2028": {
      "Net salesMillion INR": {
        "metric": "Net salesMillion INR",
        "unit": "Million INR",
        "fiscalMonth": "March",
        "year": "2028",
        "released": null,
        "forecast": "225 760",
        "spreadRaw": null
      },
      "EBITDAMillion INR": {
        "metric": "EBITDAMillion INR",
        "unit": "Million INR",
        "fiscalMonth": "March",
        "year": "2028",
        "released": null,
        "forecast": "30 732",
        "spreadRaw": null
      },
      "EBITMillion INR": {
        "metric": "EBITMillion INR",
        "unit": "Million INR",
        "fiscalMonth": "March",
        "year": "2028",
        "released": null,
        "forecast": "26 180",
        "spreadRaw": null
      },
      "Earnings before Tax (EBT)Million INR": {
        "metric": "Earnings before Tax (EBT)Million INR",
        "unit": "Million INR",
        "fiscalMonth": "March",
        "year": "2028",
        "released": null,
        "forecast": "36 231",
        "spreadRaw": null
      },
      "Net incomeMillion INR": {
        "metric": "Net incomeMillion INR",
        "unit": "Million INR",
        "fiscalMonth": "March",
        "year": "2028",
        "released": null,
        "forecast": "27 717",
        "spreadRaw": null
      },
      "EPS INR": {
        "metric": "EPS INR",
        "unit": "INR",
        "fiscalMonth": "March",
        "year": "2028",
        "released": null,
        "forecast": "1 027",
        "spreadRaw": null
      },
      "Announcement Date": {
        "metric": "Announcement Date",
        "unit": null,
        "fiscalMonth": "March",
        "year": "2028",
        "released": null,
        "forecast": null,
        "spreadRaw": null
      }
    }
  },
  "quarterlyResults": {
    "2024 Q2": {
      "Net salesMillion INR": {
        "metric": "Net salesMillion INR",
        "unit": "Million INR",
        "fiscalMonth": "March",
        "period": "2024 Q2",
        "released": "41 301",
        "releasedNum": 41301,
        "forecast": "43 238",
        "forecastNum": 43238,
        "spreadRaw": "-4.48%",
        "spreadPct": -4.48
      },
      "EBITDAMillion INR": {
        "metric": "EBITDAMillion INR",
        "unit": "Million INR",
        "fiscalMonth": "March",
        "period": "2024 Q2",
        "released": "4 913",
        "releasedNum": 4913,
        "forecast": "5 529",
        "forecastNum": 5529,
        "spreadRaw": "-11.13%",
        "spreadPct": -11.13
      },
      "Earnings before Tax (EBT)Million INR": {
        "metric": "Earnings before Tax (EBT)Million INR",
        "unit": "Million INR",
        "fiscalMonth": "March",
        "period": "2024 Q2",
        "released": "13 170",
        "releasedNum": 13170,
        "forecast": "5 944",
        "forecastNum": 5944,
        "spreadRaw": "121.57%",
        "spreadPct": 121.57
      },
      "Net incomeMillion INR": {
        "metric": "Net incomeMillion INR",
        "unit": "Million INR",
        "fiscalMonth": "March",
        "period": "2024 Q2",
        "released": "9 989",
        "releasedNum": 9989,
        "forecast": "4 501",
        "forecastNum": 4501,
        "spreadRaw": "121.94%",
        "spreadPct": 121.94
      },
      "EPS INR": {
        "metric": "EPS INR",
        "unit": "INR",
        "fiscalMonth": "March",
        "period": "2024 Q2",
        "released": null,
        "releasedNum": null,
        "forecast": null,
        "forecastNum": null,
        "spreadRaw": null,
        "spreadPct": null
      },
      "Announcement Date": {
        "metric": "Announcement Date",
        "unit": null,
        "fiscalMonth": "March",
        "period": "2024 Q2",
        "released": "09/11/23",
        "releasedDate": "09/11/23",
        "forecast": null,
        "spreadRaw": null,
        "spreadPct": null
      }
    },
    "2024 Q3": {
      "Net salesMillion INR": {
        "metric": "Net salesMillion INR",
        "unit": "Million INR",
        "fiscalMonth": "March",
        "period": "2024 Q3",
        "released": "42 052",
        "releasedNum": 42052,
        "forecast": "42 096",
        "forecastNum": 42096,
        "spreadRaw": "-0.1%",
        "spreadPct": -0.1
      },
      "EBITDAMillion INR": {
        "metric": "EBITDAMillion INR",
        "unit": "Million INR",
        "fiscalMonth": "March",
        "period": "2024 Q3",
        "released": "5 784",
        "releasedNum": 5784,
        "forecast": "5 350",
        "forecastNum": 5350,
        "spreadRaw": "8.11%",
        "spreadPct": 8.11
      },
      "Earnings before Tax (EBT)Million INR": {
        "metric": "Earnings before Tax (EBT)Million INR",
        "unit": "Million INR",
        "fiscalMonth": "March",
        "period": "2024 Q3",
        "released": "6 708",
        "releasedNum": 6708,
        "forecast": "5 245",
        "forecastNum": 5245,
        "spreadRaw": "27.9%",
        "spreadPct": 27.9
      },
      "Net incomeMillion INR": {
        "metric": "Net incomeMillion INR",
        "unit": "Million INR",
        "fiscalMonth": "March",
        "period": "2024 Q3",
        "released": "5 181",
        "releasedNum": 5181,
        "forecast": "3 978",
        "forecastNum": 3978,
        "spreadRaw": "30.24%",
        "spreadPct": 30.24
      },
      "EPS INR": {
        "metric": "EPS INR",
        "unit": "INR",
        "fiscalMonth": "March",
        "period": "2024 Q3",
        "released": "176",
        "releasedNum": 176,
        "forecast": "140",
        "forecastNum": 140,
        "spreadRaw": "25.43%",
        "spreadPct": 25.43
      },
      "Announcement Date": {
        "metric": "Announcement Date",
        "unit": null,
        "fiscalMonth": "March",
        "period": "2024 Q3",
        "released": "13/02/24",
        "releasedDate": "13/02/24",
        "forecast": null,
        "spreadRaw": null,
        "spreadPct": null
      }
    },
    "2024 Q4": {
      "Net salesMillion INR": {
        "metric": "Net salesMillion INR",
        "unit": "Million INR",
        "fiscalMonth": "March",
        "period": "2024 Q4",
        "released": "42 334",
        "releasedNum": 42334,
        "forecast": "44 411",
        "forecastNum": 44411,
        "spreadRaw": "-4.68%",
        "spreadPct": -4.68
      },
      "EBITDAMillion INR": {
        "metric": "EBITDAMillion INR",
        "unit": "Million INR",
        "fiscalMonth": "March",
        "period": "2024 Q4",
        "released": "5 572",
        "releasedNum": 5572,
        "forecast": "6 481",
        "forecastNum": 6481,
        "spreadRaw": "-14.03%",
        "spreadPct": -14.03
      },
      "Earnings before Tax (EBT)Million INR": {
        "metric": "Earnings before Tax (EBT)Million INR",
        "unit": "Million INR",
        "fiscalMonth": "March",
        "period": "2024 Q4",
        "released": "6 607",
        "releasedNum": 6607,
        "forecast": "6 509",
        "forecastNum": 6509,
        "spreadRaw": "1.51%",
        "spreadPct": 1.51
      },
      "Net incomeMillion INR": {
        "metric": "Net incomeMillion INR",
        "unit": "Million INR",
        "fiscalMonth": "March",
        "period": "2024 Q4",
        "released": "5 645",
        "releasedNum": 5645,
        "forecast": "4 836",
        "forecastNum": 4836,
        "spreadRaw": "16.74%",
        "spreadPct": 16.74
      },
      "EPS INR": {
        "metric": "EPS INR",
        "unit": "INR",
        "fiscalMonth": "March",
        "period": "2024 Q4",
        "released": null,
        "releasedNum": null,
        "forecast": null,
        "forecastNum": null,
        "spreadRaw": null,
        "spreadPct": null
      },
      "Announcement Date": {
        "metric": "Announcement Date",
        "unit": null,
        "fiscalMonth": "March",
        "period": "2024 Q4",
        "released": "24/05/24",
        "releasedDate": "24/05/24",
        "forecast": null,
        "spreadRaw": null,
        "spreadPct": null
      }
    },
    "2025 Q1": {
      "Net salesMillion INR": {
        "metric": "Net salesMillion INR",
        "unit": "Million INR",
        "fiscalMonth": "March",
        "period": "2025 Q1",
        "released": "43 168",
        "releasedNum": 43168,
        "forecast": "42 692",
        "forecastNum": 42692,
        "spreadRaw": "1.11%",
        "spreadPct": 1.11
      },
      "EBITDAMillion INR": {
        "metric": "EBITDAMillion INR",
        "unit": "Million INR",
        "fiscalMonth": "March",
        "period": "2025 Q1",
        "released": "5 197",
        "releasedNum": 5197,
        "forecast": "5 798",
        "forecastNum": 5798,
        "spreadRaw": "-10.36%",
        "spreadPct": -10.36
      },
      "Earnings before Tax (EBT)Million INR": {
        "metric": "Earnings before Tax (EBT)Million INR",
        "unit": "Million INR",
        "fiscalMonth": "March",
        "period": "2025 Q1",
        "released": "6 108",
        "releasedNum": 6108,
        "forecast": "6 855",
        "forecastNum": 6855,
        "spreadRaw": "-10.9%",
        "spreadPct": -10.9
      },
      "Net incomeMillion INR": {
        "metric": "Net incomeMillion INR",
        "unit": "Million INR",
        "fiscalMonth": "March",
        "period": "2025 Q1",
        "released": "4 655",
        "releasedNum": 4655,
        "forecast": "5 347",
        "forecastNum": 5347,
        "spreadRaw": "-12.94%",
        "spreadPct": -12.94
      },
      "EPS INR": {
        "metric": "EPS INR",
        "unit": "INR",
        "fiscalMonth": "March",
        "period": "2025 Q1",
        "released": null,
        "releasedNum": null,
        "forecast": null,
        "forecastNum": null,
        "spreadRaw": null,
        "spreadPct": null
      },
      "Announcement Date": {
        "metric": "Announcement Date",
        "unit": null,
        "fiscalMonth": "March",
        "period": "2025 Q1",
        "released": "06/08/24",
        "releasedDate": "06/08/24",
        "forecast": null,
        "spreadRaw": null,
        "spreadPct": null
      }
    },
    "2025 Q2": {
      "Net salesMillion INR": {
        "metric": "Net salesMillion INR",
        "unit": "Million INR",
        "fiscalMonth": "March",
        "period": "2025 Q2",
        "released": "43 943",
        "releasedNum": 43943,
        "forecast": "43 221",
        "forecastNum": 43221,
        "spreadRaw": "1.67%",
        "spreadPct": 1.67
      },
      "EBITDAMillion INR": {
        "metric": "EBITDAMillion INR",
        "unit": "Million INR",
        "fiscalMonth": "March",
        "period": "2025 Q2",
        "released": "5 605",
        "releasedNum": 5605,
        "forecast": "5 348",
        "forecastNum": 5348,
        "spreadRaw": "4.81%",
        "spreadPct": 4.81
      },
      "Earnings before Tax (EBT)Million INR": {
        "metric": "Earnings before Tax (EBT)Million INR",
        "unit": "Million INR",
        "fiscalMonth": "March",
        "period": "2025 Q2",
        "released": "7 257",
        "releasedNum": 7257,
        "forecast": "6 413",
        "forecastNum": 6413,
        "spreadRaw": "13.16%",
        "spreadPct": 13.16
      },
      "Net incomeMillion INR": {
        "metric": "Net incomeMillion INR",
        "unit": "Million INR",
        "fiscalMonth": "March",
        "period": "2025 Q2",
        "released": "5 359",
        "releasedNum": 5359,
        "forecast": "5 066",
        "forecastNum": 5066,
        "spreadRaw": "5.78%",
        "spreadPct": 5.78
      },
      "EPS INR": {
        "metric": "EPS INR",
        "unit": "INR",
        "fiscalMonth": "March",
        "period": "2025 Q2",
        "released": null,
        "releasedNum": null,
        "forecast": null,
        "forecastNum": null,
        "spreadRaw": null,
        "spreadPct": null
      },
      "Announcement Date": {
        "metric": "Announcement Date",
        "unit": null,
        "fiscalMonth": "March",
        "period": "2025 Q2",
        "released": "12/11/24",
        "releasedDate": "12/11/24",
        "forecast": null,
        "spreadRaw": null,
        "spreadPct": null
      }
    },
    "2025 Q3": {
      "Net salesMillion INR": {
        "metric": "Net salesMillion INR",
        "unit": "Million INR",
        "fiscalMonth": "March",
        "period": "2025 Q3",
        "released": "44 657",
        "releasedNum": 44657,
        "forecast": "45 206",
        "forecastNum": 45206,
        "spreadRaw": "-1.21%",
        "spreadPct": -1.21
      },
      "EBITDAMillion INR": {
        "metric": "EBITDAMillion INR",
        "unit": "Million INR",
        "fiscalMonth": "March",
        "period": "2025 Q3",
        "released": "5 826",
        "releasedNum": 5826,
        "forecast": "6 061",
        "forecastNum": 6061,
        "spreadRaw": "-3.88%",
        "spreadPct": -3.88
      },
      "Earnings before Tax (EBT)Million INR": {
        "metric": "Earnings before Tax (EBT)Million INR",
        "unit": "Million INR",
        "fiscalMonth": "March",
        "period": "2025 Q3",
        "released": "6 175",
        "releasedNum": 6175,
        "forecast": "6 981",
        "forecastNum": 6981,
        "spreadRaw": "-11.55%",
        "spreadPct": -11.55
      },
      "Net incomeMillion INR": {
        "metric": "Net incomeMillion INR",
        "unit": "Million INR",
        "fiscalMonth": "March",
        "period": "2025 Q3",
        "released": "4 581",
        "releasedNum": 4581,
        "forecast": "5 445",
        "forecastNum": 5445,
        "spreadRaw": "-15.87%",
        "spreadPct": -15.87
      },
      "EPS INR": {
        "metric": "EPS INR",
        "unit": "INR",
        "fiscalMonth": "March",
        "period": "2025 Q3",
        "released": null,
        "releasedNum": null,
        "forecast": null,
        "forecastNum": null,
        "spreadRaw": null,
        "spreadPct": null
      },
      "Announcement Date": {
        "metric": "Announcement Date",
        "unit": null,
        "fiscalMonth": "March",
        "period": "2025 Q3",
        "released": "28/01/25",
        "releasedDate": "28/01/25",
        "forecast": null,
        "spreadRaw": null,
        "spreadPct": null
      }
    },
    "2025 Q4": {
      "Net salesMillion INR": {
        "metric": "Net salesMillion INR",
        "unit": "Million INR",
        "fiscalMonth": "March",
        "period": "2025 Q4",
        "released": "49 106",
        "releasedNum": 49106,
        "forecast": "45 300",
        "forecastNum": 45300,
        "spreadRaw": "8.4%",
        "spreadPct": 8.4
      },
      "EBITDAMillion INR": {
        "metric": "EBITDAMillion INR",
        "unit": "Million INR",
        "fiscalMonth": "March",
        "period": "2025 Q4",
        "released": "6 469",
        "releasedNum": 6469,
        "forecast": "5 900",
        "forecastNum": 5900,
        "spreadRaw": "9.64%",
        "spreadPct": 9.64
      },
      "Earnings before Tax (EBT)Million INR": {
        "metric": "Earnings before Tax (EBT)Million INR",
        "unit": "Million INR",
        "fiscalMonth": "March",
        "period": "2025 Q4",
        "released": "7 785",
        "releasedNum": 7785,
        "forecast": "6 900",
        "forecastNum": 6900,
        "spreadRaw": "12.83%",
        "spreadPct": 12.83
      },
      "Net incomeMillion INR": {
        "metric": "Net incomeMillion INR",
        "unit": "Million INR",
        "fiscalMonth": "March",
        "period": "2025 Q4",
        "released": "5 537",
        "releasedNum": 5537,
        "forecast": "5 900",
        "forecastNum": 5900,
        "spreadRaw": "-6.15%",
        "spreadPct": -6.15
      },
      "EPS INR": {
        "metric": "EPS INR",
        "unit": "INR",
        "fiscalMonth": "March",
        "period": "2025 Q4",
        "released": null,
        "releasedNum": null,
        "forecast": null,
        "forecastNum": null,
        "spreadRaw": null,
        "spreadPct": null
      },
      "Announcement Date": {
        "metric": "Announcement Date",
        "unit": null,
        "fiscalMonth": "March",
        "period": "2025 Q4",
        "released": "27/05/25",
        "releasedDate": "27/05/25",
        "forecast": null,
        "spreadRaw": null,
        "spreadPct": null
      }
    },
    "2026 Q1": {
      "Net salesMillion INR": {
        "metric": "Net salesMillion INR",
        "unit": "Million INR",
        "fiscalMonth": "March",
        "period": "2026 Q1",
        "released": "47 886",
        "releasedNum": 47886,
        "forecast": "46 190",
        "forecastNum": 46190,
        "spreadRaw": "3.67%",
        "spreadPct": 3.67
      },
      "EBITDAMillion INR": {
        "metric": "EBITDAMillion INR",
        "unit": "Million INR",
        "fiscalMonth": "March",
        "period": "2026 Q1",
        "released": "6 393",
        "releasedNum": 6393,
        "forecast": "5 681",
        "forecastNum": 5681,
        "spreadRaw": "12.53%",
        "spreadPct": 12.53
      },
      "Earnings before Tax (EBT)Million INR": {
        "metric": "Earnings before Tax (EBT)Million INR",
        "unit": "Million INR",
        "fiscalMonth": "March",
        "period": "2026 Q1",
        "released": "13 939",
        "releasedNum": 13939,
        "forecast": "6 546",
        "forecastNum": 6546,
        "spreadRaw": "112.94%",
        "spreadPct": 112.94
      },
      "Net incomeMillion INR": {
        "metric": "Net incomeMillion INR",
        "unit": "Million INR",
        "fiscalMonth": "March",
        "period": "2026 Q1",
        "released": "11 154",
        "releasedNum": 11154,
        "forecast": "4 909",
        "forecastNum": 4909,
        "spreadRaw": "127.22%",
        "spreadPct": 127.22
      },
      "EPS INR": {
        "metric": "EPS INR",
        "unit": "INR",
        "fiscalMonth": "March",
        "period": "2026 Q1",
        "released": null,
        "releasedNum": null,
        "forecast": null,
        "forecastNum": null,
        "spreadRaw": null,
        "spreadPct": null
      },
      "Announcement Date": {
        "metric": "Announcement Date",
        "unit": null,
        "fiscalMonth": "March",
        "period": "2026 Q1",
        "released": "04/08/25",
        "releasedDate": "04/08/25",
        "forecast": null,
        "spreadRaw": null,
        "spreadPct": null
      }
    },
    "2026 Q2": {
      "Net salesMillion INR": {
        "metric": "Net salesMillion INR",
        "unit": "Million INR",
        "fiscalMonth": "March",
        "period": "2026 Q2",
        "released": null,
        "releasedNum": null,
        "forecast": "48 777",
        "forecastNum": 48777,
        "spreadRaw": null,
        "spreadPct": null
      },
      "EBITDAMillion INR": {
        "metric": "EBITDAMillion INR",
        "unit": "Million INR",
        "fiscalMonth": "March",
        "period": "2026 Q2",
        "released": null,
        "releasedNum": null,
        "forecast": "6 439",
        "forecastNum": 6439,
        "spreadRaw": null,
        "spreadPct": null
      },
      "Earnings before Tax (EBT)Million INR": {
        "metric": "Earnings before Tax (EBT)Million INR",
        "unit": "Million INR",
        "fiscalMonth": "March",
        "period": "2026 Q2",
        "released": null,
        "releasedNum": null,
        "forecast": "7 659",
        "forecastNum": 7659,
        "spreadRaw": null,
        "spreadPct": null
      },
      "Net incomeMillion INR": {
        "metric": "Net incomeMillion INR",
        "unit": "Million INR",
        "fiscalMonth": "March",
        "period": "2026 Q2",
        "released": null,
        "releasedNum": null,
        "forecast": "5 812",
        "forecastNum": 5812,
        "spreadRaw": null,
        "spreadPct": null
      },
      "EPS INR": {
        "metric": "EPS INR",
        "unit": "INR",
        "fiscalMonth": "March",
        "period": "2026 Q2",
        "released": null,
        "releasedNum": null,
        "forecast": "203",
        "forecastNum": 203,
        "spreadRaw": null,
        "spreadPct": null
      },
      "Announcement Date": {
        "metric": "Announcement Date",
        "unit": null,
        "fiscalMonth": "March",
        "period": "2026 Q2",
        "released": "-",
        "releasedDate": "-",
        "forecast": null,
        "spreadRaw": null,
        "spreadPct": null
      }
    },
    "2026 Q3": {
      "Net salesMillion INR": {
        "metric": "Net salesMillion INR",
        "unit": "Million INR",
        "fiscalMonth": "March",
        "period": "2026 Q3",
        "released": null,
        "releasedNum": null,
        "forecast": "50 016",
        "forecastNum": 50016,
        "spreadRaw": null,
        "spreadPct": null
      },
      "EBITDAMillion INR": {
        "metric": "EBITDAMillion INR",
        "unit": "Million INR",
        "fiscalMonth": "March",
        "period": "2026 Q3",
        "released": null,
        "releasedNum": null,
        "forecast": "6 602",
        "forecastNum": 6602,
        "spreadRaw": null,
        "spreadPct": null
      },
      "Earnings before Tax (EBT)Million INR": {
        "metric": "Earnings before Tax (EBT)Million INR",
        "unit": "Million INR",
        "fiscalMonth": "March",
        "period": "2026 Q3",
        "released": null,
        "releasedNum": null,
        "forecast": "7 810",
        "forecastNum": 7810,
        "spreadRaw": null,
        "spreadPct": null
      },
      "Net incomeMillion INR": {
        "metric": "Net incomeMillion INR",
        "unit": "Million INR",
        "fiscalMonth": "March",
        "period": "2026 Q3",
        "released": null,
        "releasedNum": null,
        "forecast": "5 925",
        "forecastNum": 5925,
        "spreadRaw": null,
        "spreadPct": null
      },
      "EPS INR": {
        "metric": "EPS INR",
        "unit": "INR",
        "fiscalMonth": "March",
        "period": "2026 Q3",
        "released": null,
        "releasedNum": null,
        "forecast": "203",
        "forecastNum": 203,
        "spreadRaw": null,
        "spreadPct": null
      },
      "Announcement Date": {
        "metric": "Announcement Date",
        "unit": null,
        "fiscalMonth": "March",
        "period": "2026 Q3",
        "released": "-",
        "releasedDate": "-",
        "forecast": null,
        "spreadRaw": null,
        "spreadPct": null
      }
    },
    "2026 Q4": {
      "Net salesMillion INR": {
        "metric": "Net salesMillion INR",
        "unit": "Million INR",
        "fiscalMonth": "March",
        "period": "2026 Q4",
        "released": null,
        "releasedNum": null,
        "forecast": "51 909",
        "forecastNum": 51909,
        "spreadRaw": null,
        "spreadPct": null
      },
      "EBITDAMillion INR": {
        "metric": "EBITDAMillion INR",
        "unit": "Million INR",
        "fiscalMonth": "March",
        "period": "2026 Q4",
        "released": null,
        "releasedNum": null,
        "forecast": "6 920",
        "forecastNum": 6920,
        "spreadRaw": null,
        "spreadPct": null
      },
      "Earnings before Tax (EBT)Million INR": {
        "metric": "Earnings before Tax (EBT)Million INR",
        "unit": "Million INR",
        "fiscalMonth": "March",
        "period": "2026 Q4",
        "released": null,
        "releasedNum": null,
        "forecast": "8 136",
        "forecastNum": 8136,
        "spreadRaw": null,
        "spreadPct": null
      },
      "Net incomeMillion INR": {
        "metric": "Net incomeMillion INR",
        "unit": "Million INR",
        "fiscalMonth": "March",
        "period": "2026 Q4",
        "released": null,
        "releasedNum": null,
        "forecast": "5 943",
        "forecastNum": 5943,
        "spreadRaw": null,
        "spreadPct": null
      },
      "EPS INR": {
        "metric": "EPS INR",
        "unit": "INR",
        "fiscalMonth": "March",
        "period": "2026 Q4",
        "released": null,
        "releasedNum": null,
        "forecast": "203",
        "forecastNum": 203,
        "spreadRaw": null,
        "spreadPct": null
      },
      "Announcement Date": {
        "metric": "Announcement Date",
        "unit": null,
        "fiscalMonth": "March",
        "period": "2026 Q4",
        "released": "-",
        "releasedDate": "-",
        "forecast": null,
        "spreadRaw": null,
        "spreadPct": null
      }
    }
  },
  "upcomingEvents": {
    "count": 5,
    "events": [
      {
        "section": "Upcoming",
        "dateTimeRaw": "11/11/2025",
        "dateTimeISO": "2025-11-10T18:30:00.000Z",
        "title": "Q2 2026 Earnings Release",
        "icsUrl": "https://in.marketscreener.com/api/stateful/agenda/event-async/Q2-2026-Earnings-Release-47941938.ics"
      },
      {
        "section": "Upcoming",
        "dateTimeRaw": "11/02/2026",
        "dateTimeISO": "2026-02-10T18:30:00.000Z",
        "title": "Q3 2026 Earnings Release (Projected)",
        "icsUrl": "https://in.marketscreener.com/api/stateful/agenda/event-async/Q3-2026-Earnings-Release-Projected-48678486.ics"
      },
      {
        "section": "Upcoming",
        "dateTimeRaw": "22/05/2026",
        "dateTimeISO": "2026-05-21T18:30:00.000Z",
        "title": "Q4 2026 Earnings Release (Projected)",
        "icsUrl": "https://in.marketscreener.com/api/stateful/agenda/event-async/Q4-2026-Earnings-Release-Projected-49434173.ics"
      },
      {
        "section": "Upcoming",
        "dateTimeRaw": "05/08/2026",
        "dateTimeISO": "2026-08-04T18:30:00.000Z",
        "title": "Q1 2027 Earnings Release (Projected)",
        "icsUrl": "https://in.marketscreener.com/api/stateful/agenda/event-async/Q1-2027-Earnings-Release-Projected-50338669.ics"
      },
      {
        "section": "Upcoming",
        "dateTimeRaw": "10/11/2026",
        "dateTimeISO": "2026-11-09T18:30:00.000Z",
        "title": "Q2 2027 Earnings Release (Projected)",
        "icsUrl": "https://in.marketscreener.com/api/stateful/agenda/event-async/Q2-2027-Earnings-Release-Projected-51204799.ics"
      }
    ]
  },
  "pastEvents": {
    "count": 82,
    "events": [
      {
        "section": "Past",
        "dateTimeRaw": "05/08/2025 04:45 pm",
        "dateTimeISO": "2025-08-05T11:15:00.000Z",
        "title": "Q1 2026 Earnings Call",
        "icsUrl": "https://in.marketscreener.com/api/stateful/agenda/event-async/Q1-2026-Earnings-Call-50592556.ics"
      },
      {
        "section": "Past",
        "dateTimeRaw": "05/08/2025 11:00 am",
        "dateTimeISO": "2025-08-05T05:30:00.000Z",
        "title": "Annual General Meeting",
        "icsUrl": "https://in.marketscreener.com/api/stateful/agenda/event-async/Annual-General-Meeting-50083824.ics"
      },
      {
        "section": "Past",
        "dateTimeRaw": "04/08/2025 07:42 pm",
        "dateTimeISO": "2025-08-04T14:12:00.000Z",
        "title": "Q1 2026 Earnings Release",
        "icsUrl": "https://in.marketscreener.com/api/stateful/agenda/event-async/Q1-2026-Earnings-Release-47451489.ics"
      },
      {
        "section": "Past",
        "dateTimeRaw": "29/07/2025",
        "dateTimeISO": "2025-07-28T18:30:00.000Z",
        "title": "Final dividend",
        "icsUrl": "https://in.marketscreener.com/api/stateful/agenda/event-async/Final-dividend-50185390.ics"
      },
      {
        "section": "Past",
        "dateTimeRaw": "27/06/2025 02:00 pm",
        "dateTimeISO": "2025-06-27T08:30:00.000Z",
        "title": "Investor Meeting - Kotak Mahindra Asset Management",
        "icsUrl": "https://in.marketscreener.com/api/stateful/agenda/event-async/Investor-Meeting-Kotak-Mahindra-Asset-Management-50299203.ics"
      },
      {
        "section": "Past",
        "dateTimeRaw": "29/05/2025 10:00 am",
        "dateTimeISO": "2025-05-29T04:30:00.000Z",
        "title": "Q4 2025 Earnings Call",
        "icsUrl": "https://in.marketscreener.com/api/stateful/agenda/event-async/Q4-2025-Earnings-Call-49958584.ics"
      },
      {
        "section": "Past",
        "dateTimeRaw": "27/05/2025 07:27 pm",
        "dateTimeISO": "2025-05-27T13:57:00.000Z",
        "title": "Q4 2025 Earnings Release",
        "icsUrl": "https://in.marketscreener.com/api/stateful/agenda/event-async/Q4-2025-Earnings-Release-47451483.ics"
      },
      {
        "section": "Past",
        "dateTimeRaw": "18/02/2025 01:00 pm",
        "dateTimeISO": "2025-02-18T07:30:00.000Z",
        "title": "Kotak Chasing Growth Investor Conference",
        "icsUrl": "https://in.marketscreener.com/api/stateful/agenda/event-async/Kotak-Chasing-Growth-Investor-Conference-49044685.ics"
      },
      {
        "section": "Past",
        "dateTimeRaw": "28/01/2025 05:15 pm",
        "dateTimeISO": "2025-01-28T11:45:00.000Z",
        "title": "Q3 2025 Earnings Call",
        "icsUrl": "https://in.marketscreener.com/api/stateful/agenda/event-async/Q3-2025-Earnings-Call-48832113.ics"
      },
      {
        "section": "Past",
        "dateTimeRaw": "28/01/2025 04:40 pm",
        "dateTimeISO": "2025-01-28T11:10:00.000Z",
        "title": "Q3 2025 Earnings Release",
        "icsUrl": "https://in.marketscreener.com/api/stateful/agenda/event-async/Q3-2025-Earnings-Release-45584042.ics"
      },
      {
        "section": "Past",
        "dateTimeRaw": "17/12/2024 09:30 am",
        "dateTimeISO": "2024-12-17T04:00:00.000Z",
        "title": "Investor Meeting - ASK Investors",
        "icsUrl": "https://in.marketscreener.com/api/stateful/agenda/event-async/Investor-Meeting-ASK-Investors-48576036.ics"
      },
      {
        "section": "Past",
        "dateTimeRaw": "16/12/2024 04:30 pm",
        "dateTimeISO": "2024-12-16T11:00:00.000Z",
        "title": "Investor Meeting - HDFC Mutual Fund",
        "icsUrl": "https://in.marketscreener.com/api/stateful/agenda/event-async/Investor-Meeting-HDFC-Mutual-Fund-48576034.ics"
      },
      {
        "section": "Past",
        "dateTimeRaw": "16/12/2024 09:30 am",
        "dateTimeISO": "2024-12-16T04:00:00.000Z",
        "title": "Investor Meeting - First State Singapore (FSSA)",
        "icsUrl": "https://in.marketscreener.com/api/stateful/agenda/event-async/Investor-Meeting-First-State-Singapore-FSSA-48576033.ics"
      },
      {
        "section": "Past",
        "dateTimeRaw": "12/11/2024 05:15 pm",
        "dateTimeISO": "2024-11-12T11:45:00.000Z",
        "title": "Q2 2025 Earnings Call",
        "icsUrl": "https://in.marketscreener.com/api/stateful/agenda/event-async/Q2-2025-Earnings-Call-48172266.ics"
      },
      {
        "section": "Past",
        "dateTimeRaw": "12/11/2024 03:33 pm",
        "dateTimeISO": "2024-11-12T10:03:00.000Z",
        "title": "Q2 2025 Earnings Release",
        "icsUrl": "https://in.marketscreener.com/api/stateful/agenda/event-async/Q2-2025-Earnings-Release-44901780.ics"
      },
      {
        "section": "Past",
        "dateTimeRaw": "05/09/2024 09:30 am",
        "dateTimeISO": "2024-09-05T04:00:00.000Z",
        "title": "Batlivala & Karani Securities Investor Conference",
        "icsUrl": "https://in.marketscreener.com/api/stateful/agenda/event-async/Batlivala-Karani-Securities-Investor-Conference-47797406.ics"
      },
      {
        "section": "Past",
        "dateTimeRaw": "19/08/2024 10:00 am",
        "dateTimeISO": "2024-08-19T04:30:00.000Z",
        "title": "Motilal Oswal Global Investor Conference",
        "icsUrl": "https://in.marketscreener.com/api/stateful/agenda/event-async/Motilal-Oswal-Global-Investor-Conference-47657396.ics"
      },
      {
        "section": "Past",
        "dateTimeRaw": "07/08/2024 04:30 pm",
        "dateTimeISO": "2024-08-07T11:00:00.000Z",
        "title": "Q1 2025 Earnings Call",
        "icsUrl": "https://in.marketscreener.com/api/stateful/agenda/event-async/Q1-2025-Earnings-Call-47451465.ics"
      },
      {
        "section": "Past",
        "dateTimeRaw": "07/08/2024 11:00 am",
        "dateTimeISO": "2024-08-07T05:30:00.000Z",
        "title": "Annual General Meeting",
        "icsUrl": "https://in.marketscreener.com/api/stateful/agenda/event-async/Annual-General-Meeting-46824844.ics"
      },
      {
        "section": "Past",
        "dateTimeRaw": "06/08/2024 07:24 pm",
        "dateTimeISO": "2024-08-06T13:54:00.000Z",
        "title": "Q1 2025 Earnings Release",
        "icsUrl": "https://in.marketscreener.com/api/stateful/agenda/event-async/Q1-2025-Earnings-Release-44238006.ics"
      },
      {
        "section": "Past",
        "dateTimeRaw": "19/07/2024",
        "dateTimeISO": "2024-07-18T18:30:00.000Z",
        "title": "Final dividend",
        "icsUrl": "https://in.marketscreener.com/api/stateful/agenda/event-async/Final-dividend-46881497.ics"
      },
      {
        "section": "Past",
        "dateTimeRaw": "27/05/2024 11:30 am",
        "dateTimeISO": "2024-05-27T06:00:00.000Z",
        "title": "Q4 2024 Earnings Call",
        "icsUrl": "https://in.marketscreener.com/api/stateful/agenda/event-async/Q4-2024-Earnings-Call-46755489.ics"
      },
      {
        "section": "Past",
        "dateTimeRaw": "24/05/2024 05:35 pm",
        "dateTimeISO": "2024-05-24T12:05:00.000Z",
        "title": "Q4 2024 Earnings Release",
        "icsUrl": "https://in.marketscreener.com/api/stateful/agenda/event-async/Q4-2024-Earnings-Release-43771187.ics"
      },
      {
        "section": "Past",
        "dateTimeRaw": "23/02/2024",
        "dateTimeISO": "2024-02-22T18:30:00.000Z",
        "title": "Ex-dividend day for dividende intermédiaire",
        "icsUrl": "https://in.marketscreener.com/api/stateful/agenda/event-async/Ex-dividend-day-for-dividende-intermediaire-46023521.ics"
      },
      {
        "section": "Past",
        "dateTimeRaw": "13/02/2024 04:30 pm",
        "dateTimeISO": "2024-02-13T11:00:00.000Z",
        "title": "Q3 2024 Earnings Call",
        "icsUrl": "https://in.marketscreener.com/api/stateful/agenda/event-async/Q3-2024-Earnings-Call-45772421.ics"
      },
      {
        "section": "Past",
        "dateTimeRaw": "13/02/2024 03:34 pm",
        "dateTimeISO": "2024-02-13T10:04:00.000Z",
        "title": "Q3 2024 Earnings Release",
        "icsUrl": "https://in.marketscreener.com/api/stateful/agenda/event-async/Q3-2024-Earnings-Release-42616852.ics"
      },
      {
        "section": "Past",
        "dateTimeRaw": "30/11/2023 12:00 pm",
        "dateTimeISO": "2023-11-30T06:30:00.000Z",
        "title": "CITIC CLSA India Forum",
        "icsUrl": "https://in.marketscreener.com/api/stateful/agenda/event-async/CITIC-CLSA-India-Forum-45423969.ics"
      },
      {
        "section": "Past",
        "dateTimeRaw": "27/11/2023 10:00 am",
        "dateTimeISO": "2023-11-27T04:30:00.000Z",
        "title": "Investor Meeting - CLSA India",
        "icsUrl": "https://in.marketscreener.com/api/stateful/agenda/event-async/Investor-Meeting-CLSA-India-45414057.ics"
      },
      {
        "section": "Past",
        "dateTimeRaw": "09/11/2023 04:30 pm",
        "dateTimeISO": "2023-11-09T11:00:00.000Z",
        "title": "Q2 2024 Earnings Call",
        "icsUrl": "https://in.marketscreener.com/api/stateful/agenda/event-async/Q2-2024-Earnings-Call-45087488.ics"
      },
      {
        "section": "Past",
        "dateTimeRaw": "09/11/2023 03:03 pm",
        "dateTimeISO": "2023-11-09T09:33:00.000Z",
        "title": "Q2 2024 Earnings Release",
        "icsUrl": "https://in.marketscreener.com/api/stateful/agenda/event-async/Q2-2024-Earnings-Release-41906682.ics"
      },
      {
        "section": "Past",
        "dateTimeRaw": "08/09/2023",
        "dateTimeISO": "2023-09-07T18:30:00.000Z",
        "title": "Investor Meeting - Tunga India Long Term Equity Fund",
        "icsUrl": "https://in.marketscreener.com/api/stateful/agenda/event-async/Investor-Meeting-Tunga-India-Long-Term-Equity-Fund-44789863.ics"
      },
      {
        "section": "Past",
        "dateTimeRaw": "08/09/2023",
        "dateTimeISO": "2023-09-07T18:30:00.000Z",
        "title": "Investor Meeting - Securities Investment Management Pvt Ltd",
        "icsUrl": "https://in.marketscreener.com/api/stateful/agenda/event-async/Investor-Meeting-Securities-Investment-Management-Pvt-Ltd-44789860.ics"
      },
      {
        "section": "Past",
        "dateTimeRaw": "08/09/2023",
        "dateTimeISO": "2023-09-07T18:30:00.000Z",
        "title": "Investor Meeting - Banyan Tree Advisors",
        "icsUrl": "https://in.marketscreener.com/api/stateful/agenda/event-async/Investor-Meeting-Banyan-Tree-Advisors-44789859.ics"
      },
      {
        "section": "Past",
        "dateTimeRaw": "08/09/2023",
        "dateTimeISO": "2023-09-07T18:30:00.000Z",
        "title": "Investor Meeting - Matthews Asia",
        "icsUrl": "https://in.marketscreener.com/api/stateful/agenda/event-async/Investor-Meeting-Matthews-Asia-44789858.ics"
      },
      {
        "section": "Past",
        "dateTimeRaw": "08/09/2023",
        "dateTimeISO": "2023-09-07T18:30:00.000Z",
        "title": "Investor Meeting - First State Investments- FSSA Investment",
        "icsUrl": "https://in.marketscreener.com/api/stateful/agenda/event-async/Investor-Meeting-First-State-Investments-FSSA-Investment-44789857.ics"
      },
      {
        "section": "Past",
        "dateTimeRaw": "01/08/2023 04:30 pm",
        "dateTimeISO": "2023-08-01T11:00:00.000Z",
        "title": "Q1 2024 Earnings Call",
        "icsUrl": "https://in.marketscreener.com/api/stateful/agenda/event-async/Q1-2024-Earnings-Call-44386218.ics"
      },
      {
        "section": "Past",
        "dateTimeRaw": "01/08/2023 11:00 am",
        "dateTimeISO": "2023-08-01T05:30:00.000Z",
        "title": "Annual General Meeting",
        "icsUrl": "https://in.marketscreener.com/api/stateful/agenda/event-async/Annual-General-Meeting-44237965.ics"
      },
      {
        "section": "Past",
        "dateTimeRaw": "31/07/2023 07:51 pm",
        "dateTimeISO": "2023-07-31T14:21:00.000Z",
        "title": "Q1 2024 Earnings Release",
        "icsUrl": "https://in.marketscreener.com/api/stateful/agenda/event-async/Q1-2024-Earnings-Release-41144947.ics"
      },
      {
        "section": "Past",
        "dateTimeRaw": "14/07/2023",
        "dateTimeISO": "2023-07-13T18:30:00.000Z",
        "title": "Final dividend",
        "icsUrl": "https://in.marketscreener.com/api/stateful/agenda/event-async/Final-dividend-43906400.ics"
      },
      {
        "section": "Past",
        "dateTimeRaw": "31/05/2023",
        "dateTimeISO": "2023-05-30T18:30:00.000Z",
        "title": "Trinity India Investor Conference",
        "icsUrl": "https://in.marketscreener.com/api/stateful/agenda/event-async/Trinity-India-Investor-Conference-44045531.ics"
      },
      {
        "section": "Past",
        "dateTimeRaw": "11/05/2023 12:15 pm",
        "dateTimeISO": "2023-05-11T06:45:00.000Z",
        "title": "Q4 2023 Earnings Call",
        "icsUrl": "https://in.marketscreener.com/api/stateful/agenda/event-async/Q4-2023-Earnings-Call-43843137.ics"
      },
      {
        "section": "Past",
        "dateTimeRaw": "10/05/2023 11:00 pm",
        "dateTimeISO": "2023-05-10T17:30:00.000Z",
        "title": "Q4 2023 Earnings Release",
        "icsUrl": "https://in.marketscreener.com/api/stateful/agenda/event-async/Q4-2023-Earnings-Release-39948971.ics"
      },
      {
        "section": "Past",
        "dateTimeRaw": "23/02/2023",
        "dateTimeISO": "2023-02-22T18:30:00.000Z",
        "title": "Investor Meeting - Kotak Securities Limited",
        "icsUrl": "https://in.marketscreener.com/api/stateful/agenda/event-async/Investor-Meeting-Kotak-Securities-Limited-43089107.ics"
      },
      {
        "section": "Past",
        "dateTimeRaw": "22/02/2023",
        "dateTimeISO": "2023-02-21T18:30:00.000Z",
        "title": "Ex-dividend day for dividende intermédiaire",
        "icsUrl": "https://in.marketscreener.com/api/stateful/agenda/event-async/Ex-dividend-day-for-dividende-intermediaire-43084616.ics"
      },
      {
        "section": "Past",
        "dateTimeRaw": "14/02/2023 04:30 pm",
        "dateTimeISO": "2023-02-14T11:00:00.000Z",
        "title": "Q3 2023 Earnings Call",
        "icsUrl": "https://in.marketscreener.com/api/stateful/agenda/event-async/Q3-2023-Earnings-Call-42784035.ics"
      },
      {
        "section": "Past",
        "dateTimeRaw": "14/02/2023 01:29 pm",
        "dateTimeISO": "2023-02-14T07:59:00.000Z",
        "title": "Q3 2023 Earnings Release",
        "icsUrl": "https://in.marketscreener.com/api/stateful/agenda/event-async/Q3-2023-Earnings-Release-37790738.ics"
      },
      {
        "section": "Past",
        "dateTimeRaw": "13/12/2022",
        "dateTimeISO": "2022-12-12T18:30:00.000Z",
        "title": "Investor Meeting - Kotak Mahindra Asset Management",
        "icsUrl": "https://in.marketscreener.com/api/stateful/agenda/event-async/Investor-Meeting-Kotak-Mahindra-Asset-Management-42520747.ics"
      },
      {
        "section": "Past",
        "dateTimeRaw": "08/11/2022 04:30 pm",
        "dateTimeISO": "2022-11-08T11:00:00.000Z",
        "title": "Interim 2023 Earnings Call",
        "icsUrl": "https://in.marketscreener.com/api/stateful/agenda/event-async/Interim-2023-Earnings-Call-42217289.ics"
      },
      {
        "section": "Past",
        "dateTimeRaw": "08/11/2022 03:26 pm",
        "dateTimeISO": "2022-11-08T09:56:00.000Z",
        "title": "Interim 2023 Earnings Release",
        "icsUrl": "https://in.marketscreener.com/api/stateful/agenda/event-async/Interim-2023-Earnings-Release-36582637.ics"
      },
      {
        "section": "Past",
        "dateTimeRaw": "10/08/2022",
        "dateTimeISO": "2022-08-09T18:30:00.000Z",
        "title": "Investor Meeting",
        "icsUrl": "https://in.marketscreener.com/api/stateful/agenda/event-async/Investor-Meeting-41624492.ics"
      },
      {
        "section": "Past",
        "dateTimeRaw": "03/08/2022 05:30 pm",
        "dateTimeISO": "2022-08-03T12:00:00.000Z",
        "title": "Q1 2023 Earnings Call",
        "icsUrl": "https://in.marketscreener.com/api/stateful/agenda/event-async/Q1-2023-Earnings-Call-41144541.ics"
      },
      {
        "section": "Past",
        "dateTimeRaw": "03/08/2022 11:30 am",
        "dateTimeISO": "2022-08-03T06:00:00.000Z",
        "title": "Annual General Meeting",
        "icsUrl": "https://in.marketscreener.com/api/stateful/agenda/event-async/Annual-General-Meeting-41003071.ics"
      },
      {
        "section": "Past",
        "dateTimeRaw": "03/08/2022",
        "dateTimeISO": "2022-08-02T18:30:00.000Z",
        "title": "Q1 2023 Earnings Release",
        "icsUrl": "https://in.marketscreener.com/api/stateful/agenda/event-async/Q1-2023-Earnings-Release-36102729.ics"
      },
      {
        "section": "Past",
        "dateTimeRaw": "14/07/2022",
        "dateTimeISO": "2022-07-13T18:30:00.000Z",
        "title": "Ex-dividend day for final dividend",
        "icsUrl": "https://in.marketscreener.com/api/stateful/agenda/event-async/Ex-dividend-day-for-final-dividend-40510232.ics"
      },
      {
        "section": "Past",
        "dateTimeRaw": "14/07/2022",
        "dateTimeISO": "2022-07-13T18:30:00.000Z",
        "title": "Ex-dividend day for extraordinary dividend",
        "icsUrl": "https://in.marketscreener.com/api/stateful/agenda/event-async/Ex-dividend-day-for-extraordinary-dividend-40510231.ics"
      },
      {
        "section": "Past",
        "dateTimeRaw": "19/05/2022 03:45 pm",
        "dateTimeISO": "2022-05-19T10:15:00.000Z",
        "title": "FY 2022 Earnings Call",
        "icsUrl": "https://in.marketscreener.com/api/stateful/agenda/event-async/FY-2022-Earnings-Call-40504505.ics"
      },
      {
        "section": "Past",
        "dateTimeRaw": "19/05/2022 02:10 pm",
        "dateTimeISO": "2022-05-19T08:40:00.000Z",
        "title": "FY 2022 Earnings Release",
        "icsUrl": "https://in.marketscreener.com/api/stateful/agenda/event-async/FY-2022-Earnings-Release-33267862.ics"
      },
      {
        "section": "Past",
        "dateTimeRaw": "02/03/2022",
        "dateTimeISO": "2022-03-01T18:30:00.000Z",
        "title": "Investor Meeting - First Sentier Investors (FSSA)",
        "icsUrl": "https://in.marketscreener.com/api/stateful/agenda/event-async/Investor-Meeting-First-Sentier-Investors-FSSA-39674402.ics"
      },
      {
        "section": "Past",
        "dateTimeRaw": "02/03/2022",
        "dateTimeISO": "2022-03-01T18:30:00.000Z",
        "title": "Investor Meeting - Aberdeen Standard Investments",
        "icsUrl": "https://in.marketscreener.com/api/stateful/agenda/event-async/Investor-Meeting-Aberdeen-Standard-Investments-39674401.ics"
      },
      {
        "section": "Past",
        "dateTimeRaw": "09/02/2022 02:15 pm",
        "dateTimeISO": "2022-02-09T08:45:00.000Z",
        "title": "Q3 2022 Earnings Call",
        "icsUrl": "https://in.marketscreener.com/api/stateful/agenda/event-async/Q3-2022-Earnings-Call-38150437.ics"
      },
      {
        "section": "Past",
        "dateTimeRaw": "13/01/2022",
        "dateTimeISO": "2022-01-12T18:30:00.000Z",
        "title": "CS India Manufacturing Day",
        "icsUrl": "https://in.marketscreener.com/api/stateful/agenda/event-async/CS-India-Manufacturing-Day-37556420.ics"
      },
      {
        "section": "Past",
        "dateTimeRaw": "10/11/2021 01:30 pm",
        "dateTimeISO": "2021-11-10T08:00:00.000Z",
        "title": "Interim 2022 Earnings Call",
        "icsUrl": "https://in.marketscreener.com/api/stateful/agenda/event-async/Interim-2022-Earnings-Call-37008808.ics"
      },
      {
        "section": "Past",
        "dateTimeRaw": "09/11/2021 11:30 pm",
        "dateTimeISO": "2021-11-09T18:00:00.000Z",
        "title": "Interim 2022 Earnings Release",
        "icsUrl": "https://in.marketscreener.com/api/stateful/agenda/event-async/Interim-2022-Earnings-Release-31470472.ics"
      },
      {
        "section": "Past",
        "dateTimeRaw": "05/08/2021",
        "dateTimeISO": "2021-08-04T18:30:00.000Z",
        "title": "Annual General Meeting",
        "icsUrl": "https://in.marketscreener.com/api/stateful/agenda/event-async/Annual-General-Meeting-33328630.ics"
      },
      {
        "section": "Past",
        "dateTimeRaw": "04/08/2021 02:55 pm",
        "dateTimeISO": "2021-08-04T09:25:00.000Z",
        "title": "Q1 2022 Earnings Release",
        "icsUrl": "https://in.marketscreener.com/api/stateful/agenda/event-async/Q1-2022-Earnings-Release-30872612.ics"
      },
      {
        "section": "Past",
        "dateTimeRaw": "12/07/2021",
        "dateTimeISO": "2021-07-11T18:30:00.000Z",
        "title": "Ex-dividend day for final dividend",
        "icsUrl": "https://in.marketscreener.com/api/stateful/agenda/event-async/Ex-dividend-day-for-final-dividend-33325868.ics"
      },
      {
        "section": "Past",
        "dateTimeRaw": "20/05/2021 04:15 pm",
        "dateTimeISO": "2021-05-20T10:45:00.000Z",
        "title": "FY 2021 Earnings Call",
        "icsUrl": "https://in.marketscreener.com/api/stateful/agenda/event-async/FY-2021-Earnings-Call-33328392.ics"
      },
      {
        "section": "Past",
        "dateTimeRaw": "20/05/2021 01:20 pm",
        "dateTimeISO": "2021-05-20T07:50:00.000Z",
        "title": "FY 2021 Earnings Release",
        "icsUrl": "https://in.marketscreener.com/api/stateful/agenda/event-async/FY-2021-Earnings-Release-30732884.ics"
      },
      {
        "section": "Past",
        "dateTimeRaw": "11/02/2021 05:00 pm",
        "dateTimeISO": "2021-02-11T11:30:00.000Z",
        "title": "Q3 2021 Earnings Call",
        "icsUrl": "https://in.marketscreener.com/api/stateful/agenda/event-async/Q3-2021-Earnings-Call-32317792.ics"
      },
      {
        "section": "Past",
        "dateTimeRaw": "11/02/2021",
        "dateTimeISO": "2021-02-10T18:30:00.000Z",
        "title": "Q3 2021 Earnings Release",
        "icsUrl": "https://in.marketscreener.com/api/stateful/agenda/event-async/Q3-2021-Earnings-Release-29824952.ics"
      },
      {
        "section": "Past",
        "dateTimeRaw": "06/11/2020 04:30 pm",
        "dateTimeISO": "2020-11-06T11:00:00.000Z",
        "title": "Interim 2021 Earnings Call",
        "icsUrl": "https://in.marketscreener.com/api/stateful/agenda/event-async/Interim-2021-Earnings-Call-31714899.ics"
      },
      {
        "section": "Past",
        "dateTimeRaw": "06/11/2020",
        "dateTimeISO": "2020-11-05T18:30:00.000Z",
        "title": "Interim 2021 Earnings Release",
        "icsUrl": "https://in.marketscreener.com/api/stateful/agenda/event-async/Interim-2021-Earnings-Release-29405949.ics"
      },
      {
        "section": "Past",
        "dateTimeRaw": "11/08/2020 03:30 pm",
        "dateTimeISO": "2020-08-11T10:00:00.000Z",
        "title": "Q1 2021 Earnings Call",
        "icsUrl": "https://in.marketscreener.com/api/stateful/agenda/event-async/Q1-2021-Earnings-Call-31083931.ics"
      },
      {
        "section": "Past",
        "dateTimeRaw": "11/08/2020",
        "dateTimeISO": "2020-08-10T18:30:00.000Z",
        "title": "Q1 2021 Earnings Release",
        "icsUrl": "https://in.marketscreener.com/api/stateful/agenda/event-async/Q1-2021-Earnings-Release-28899414.ics"
      },
      {
        "section": "Past",
        "dateTimeRaw": "03/08/2020",
        "dateTimeISO": "2020-08-02T18:30:00.000Z",
        "title": "Ex-dividend day for final dividend",
        "icsUrl": "https://in.marketscreener.com/api/stateful/agenda/event-async/Ex-dividend-day-for-final-dividend-30667702.ics"
      },
      {
        "section": "Past",
        "dateTimeRaw": "22/05/2020 04:00 pm",
        "dateTimeISO": "2020-05-22T10:30:00.000Z",
        "title": "FY 2020 Earnings Call",
        "icsUrl": "https://in.marketscreener.com/api/stateful/agenda/event-async/FY-2020-Earnings-Call-30660126.ics"
      },
      {
        "section": "Past",
        "dateTimeRaw": "22/05/2020",
        "dateTimeISO": "2020-05-21T18:30:00.000Z",
        "title": "FY 2020 Earnings Release",
        "icsUrl": "https://in.marketscreener.com/api/stateful/agenda/event-async/FY-2020-Earnings-Release-30660124.ics"
      },
      {
        "section": "Past",
        "dateTimeRaw": "05/02/2020 05:00 pm",
        "dateTimeISO": "2020-02-05T11:30:00.000Z",
        "title": "Q3 2020 Earnings Call",
        "icsUrl": "https://in.marketscreener.com/api/stateful/agenda/event-async/Q3-2020-Earnings-Call-29925425.ics"
      },
      {
        "section": "Past",
        "dateTimeRaw": "05/02/2020",
        "dateTimeISO": "2020-02-04T18:30:00.000Z",
        "title": "Q3 2020 Earnings Release",
        "icsUrl": "https://in.marketscreener.com/api/stateful/agenda/event-async/Q3-2020-Earnings-Release-28224991.ics"
      },
      {
        "section": "Past",
        "dateTimeRaw": "11/11/2019",
        "dateTimeISO": "2019-11-10T18:30:00.000Z",
        "title": "Automotive Power Supply Systems Conference",
        "icsUrl": "https://in.marketscreener.com/api/stateful/agenda/event-async/Automotive-Power-Supply-Systems-Conference-29398482.ics"
      },
      {
        "section": "Past",
        "dateTimeRaw": "06/11/2019",
        "dateTimeISO": "2019-11-05T18:30:00.000Z",
        "title": "Interim 2020 Earnings Release",
        "icsUrl": "https://in.marketscreener.com/api/stateful/agenda/event-async/Interim-2020-Earnings-Release-28223711.ics"
      },
      {
        "section": "Past",
        "dateTimeRaw": "13/08/2019",
        "dateTimeISO": "2019-08-12T18:30:00.000Z",
        "title": "Q1 2020 Earnings Release",
        "icsUrl": "https://in.marketscreener.com/api/stateful/agenda/event-async/Q1-2020-Earnings-Release-25883567.ics"
      }
    ]
  },
  "pastDividends": {
    "count": 32,
    "dividends": [
      {
        "section": "Past Dividends",
        "dateRaw": "29/07/2025",
        "dateISO": "2025-07-28T18:30:00.000Z",
        "type": "Final Payment",
        "amount": 512,
        "currency": "INR",
        "title": "Final Payment 512 INR"
      },
      {
        "section": "Past Dividends",
        "dateRaw": "19/07/2024",
        "dateISO": "2024-07-18T18:30:00.000Z",
        "type": "Final Payment",
        "amount": 170,
        "currency": "INR",
        "title": "Final Payment 170 INR"
      },
      {
        "section": "Past Dividends",
        "dateRaw": "23/02/2024",
        "dateISO": "2024-02-22T18:30:00.000Z",
        "type": "Interim Payment",
        "amount": 205,
        "currency": "INR",
        "title": "Interim Payment 205 INR"
      },
      {
        "section": "Past Dividends",
        "dateRaw": "14/07/2023",
        "dateISO": "2023-07-13T18:30:00.000Z",
        "type": "Final Payment",
        "amount": 280,
        "currency": "INR",
        "title": "Final Payment 280 INR"
      },
      {
        "section": "Past Dividends",
        "dateRaw": "22/02/2023",
        "dateISO": "2023-02-21T18:30:00.000Z",
        "type": "Interim Payment",
        "amount": 200,
        "currency": "INR",
        "title": "Interim Payment 200 INR"
      },
      {
        "section": "Past Dividends",
        "dateRaw": "14/07/2022",
        "dateISO": "2022-07-13T18:30:00.000Z",
        "type": "Bonus Payment",
        "amount": 100,
        "currency": "INR",
        "title": "Bonus Payment 100 INR"
      },
      {
        "section": "Past Dividends",
        "dateRaw": "14/07/2022",
        "dateISO": "2022-07-13T18:30:00.000Z",
        "type": "Annual",
        "amount": 110,
        "currency": "INR",
        "title": "Annual 110 INR"
      },
      {
        "section": "Past Dividends",
        "dateRaw": "12/07/2021",
        "dateISO": "2021-07-11T18:30:00.000Z",
        "type": "Annual",
        "amount": 115,
        "currency": "INR",
        "title": "Annual 115 INR"
      },
      {
        "section": "Past Dividends",
        "dateRaw": "03/08/2020",
        "dateISO": "2020-08-02T18:30:00.000Z",
        "type": "Annual",
        "amount": 105,
        "currency": "INR",
        "title": "Annual 105 INR"
      },
      {
        "section": "Past Dividends",
        "dateRaw": "14/08/2019",
        "dateISO": "2019-08-13T18:30:00.000Z",
        "type": "Annual",
        "amount": 105,
        "currency": "INR",
        "title": "Annual 105 INR"
      },
      {
        "section": "Past Dividends",
        "dateRaw": "07/06/2018",
        "dateISO": "2018-06-06T18:30:00.000Z",
        "type": "Annual",
        "amount": 100,
        "currency": "INR",
        "title": "Annual 100 INR"
      },
      {
        "section": "Past Dividends",
        "dateRaw": "08/06/2017",
        "dateISO": "2017-06-07T18:30:00.000Z",
        "type": "Final Payment",
        "amount": 90,
        "currency": "INR",
        "title": "Final Payment 90 INR"
      },
      {
        "section": "Past Dividends",
        "dateRaw": "16/02/2017",
        "dateISO": "2017-02-15T18:30:00.000Z",
        "type": "Interim Payment",
        "amount": 75,
        "currency": "INR",
        "title": "Interim Payment 75 INR"
      },
      {
        "section": "Past Dividends",
        "dateRaw": "09/06/2016",
        "dateISO": "2016-06-08T18:30:00.000Z",
        "type": "Annual",
        "amount": 85,
        "currency": "INR",
        "title": "Annual 85 INR"
      },
      {
        "section": "Past Dividends",
        "dateRaw": "20/08/2015",
        "dateISO": "2015-08-19T18:30:00.000Z",
        "type": "Annual",
        "amount": 85,
        "currency": "INR",
        "title": "Annual 85 INR"
      },
      {
        "section": "Past Dividends",
        "dateRaw": "12/05/2014",
        "dateISO": "2014-05-11T18:30:00.000Z",
        "type": "Annual",
        "amount": 55,
        "currency": "INR",
        "title": "Annual 55 INR"
      },
      {
        "section": "Past Dividends",
        "dateRaw": "10/05/2013",
        "dateISO": "2013-05-09T18:30:00.000Z",
        "type": "Annual",
        "amount": 60,
        "currency": "INR",
        "title": "Annual 60 INR"
      },
      {
        "section": "Past Dividends",
        "dateRaw": "11/05/2012",
        "dateISO": "2012-05-10T18:30:00.000Z",
        "type": "Annual",
        "amount": 50,
        "currency": "INR",
        "title": "Annual 50 INR"
      },
      {
        "section": "Past Dividends",
        "dateRaw": "23/06/2011",
        "dateISO": "2011-06-22T18:30:00.000Z",
        "type": "Bonus Payment",
        "amount": 85,
        "currency": "INR",
        "title": "Bonus Payment 85 INR"
      },
      {
        "section": "Past Dividends",
        "dateRaw": "12/05/2011",
        "dateISO": "2011-05-11T18:30:00.000Z",
        "type": "Annual",
        "amount": 40,
        "currency": "INR",
        "title": "Annual 40 INR"
      },
      {
        "section": "Past Dividends",
        "dateRaw": "13/05/2010",
        "dateISO": "2010-05-12T18:30:00.000Z",
        "type": "Annual",
        "amount": 30,
        "currency": "INR",
        "title": "Annual 30 INR"
      },
      {
        "section": "Past Dividends",
        "dateRaw": "07/05/2009",
        "dateISO": "2009-05-06T18:30:00.000Z",
        "type": "Annual",
        "amount": 25,
        "currency": "INR",
        "title": "Annual 25 INR"
      },
      {
        "section": "Past Dividends",
        "dateRaw": "14/05/2008",
        "dateISO": "2008-05-13T18:30:00.000Z",
        "type": "Annual",
        "amount": 25,
        "currency": "INR",
        "title": "Annual 25 INR"
      },
      {
        "section": "Past Dividends",
        "dateRaw": "14/05/2007",
        "dateISO": "2007-05-13T18:30:00.000Z",
        "type": "Final Payment",
        "amount": 4,
        "currency": "INR",
        "title": "Final Payment 4 INR"
      },
      {
        "section": "Past Dividends",
        "dateRaw": "22/03/2007",
        "dateISO": "2007-03-21T18:30:00.000Z",
        "type": "Interim Payment",
        "amount": 12,
        "currency": "INR",
        "title": "Interim Payment 12 INR"
      },
      {
        "section": "Past Dividends",
        "dateRaw": "28/04/2006",
        "dateISO": "2006-04-27T18:30:00.000Z",
        "type": "Annual",
        "amount": 12,
        "currency": "INR",
        "title": "Annual 12 INR"
      },
      {
        "section": "Past Dividends",
        "dateRaw": "13/05/2005",
        "dateISO": "2005-05-12T18:30:00.000Z",
        "type": "Annual",
        "amount": 10,
        "currency": "INR",
        "title": "Annual 10 INR"
      },
      {
        "section": "Past Dividends",
        "dateRaw": "13/05/2004",
        "dateISO": "2004-05-12T18:30:00.000Z",
        "type": "Annual",
        "amount": 65,
        "currency": "INR",
        "title": "Annual 65 INR"
      },
      {
        "section": "Past Dividends",
        "dateRaw": "10/04/2003",
        "dateISO": "2003-04-09T18:30:00.000Z",
        "type": "Final Payment",
        "amount": 40,
        "currency": "INR",
        "title": "Final Payment 40 INR"
      },
      {
        "section": "Past Dividends",
        "dateRaw": "27/06/2002",
        "dateISO": "2002-06-26T18:30:00.000Z",
        "type": "Interim Payment",
        "amount": 3,
        "currency": "INR",
        "title": "Interim Payment 3 INR"
      },
      {
        "section": "Past Dividends",
        "dateRaw": "13/05/2002",
        "dateISO": "2002-05-12T18:30:00.000Z",
        "type": "Annual",
        "amount": 31,
        "currency": "INR",
        "title": "Annual 31 INR"
      },
      {
        "section": "Past Dividends",
        "dateRaw": "27/04/2001",
        "dateISO": "2001-04-26T18:30:00.000Z",
        "type": "Annual",
        "amount": 31,
        "currency": "INR",
        "title": "Annual 31 INR"
      }
    ]
  }
}