{
  "companyCode": "COAL-INDIA-LIMITED-9060008",
  "timestamp": "2025-10-13T12:09:32.384Z",
  "annualResults": {
    "2023": {
      "Net salesMillion INR": {
        "metric": "Net salesMillion INR",
        "unit": "Million INR",
        "fiscalMonth": "March",
        "year": "2023",
        "released": "1 382 519",
        "forecast": "1 361 831",
        "spreadRaw": "1.52%"
      },
      "EBITDAMillion INR": {
        "metric": "EBITDAMillion INR",
        "unit": "Million INR",
        "fiscalMonth": "March",
        "year": "2023",
        "released": "368 179",
        "forecast": "410 331",
        "spreadRaw": "-10.27%"
      },
      "EBITMillion INR": {
        "metric": "EBITMillion INR",
        "unit": "Million INR",
        "fiscalMonth": "March",
        "year": "2023",
        "released": "321 426",
        "forecast": "350 239",
        "spreadRaw": "-8.23%"
      },
      "Earnings before Tax (EBT)Million INR": {
        "metric": "Earnings before Tax (EBT)Million INR",
        "unit": "Million INR",
        "fiscalMonth": "March",
        "year": "2023",
        "released": "380 008",
        "forecast": "395 491",
        "spreadRaw": "-3.91%"
      },
      "Net incomeMillion INR": {
        "metric": "Net incomeMillion INR",
        "unit": "Million INR",
        "fiscalMonth": "March",
        "year": "2023",
        "released": "281 652",
        "forecast": "293 835",
        "spreadRaw": "-4.15%"
      },
      "EPS INR": {
        "metric": "EPS INR",
        "unit": "INR",
        "fiscalMonth": "March",
        "year": "2023",
        "released": "45,7",
        "forecast": "47,6",
        "spreadRaw": "-4.08%"
      },
      "Announcement Date": {
        "metric": "Announcement Date",
        "unit": null,
        "fiscalMonth": "March",
        "year": "2023",
        "released": "07/05/23",
        "forecast": null,
        "spreadRaw": null
      }
    },
    "2024": {
      "Net salesMillion INR": {
        "metric": "Net salesMillion INR",
        "unit": "Million INR",
        "fiscalMonth": "March",
        "year": "2024",
        "released": "1 423 240",
        "forecast": "1 421 978",
        "spreadRaw": "0.09%"
      },
      "EBITDAMillion INR": {
        "metric": "EBITDAMillion INR",
        "unit": "Million INR",
        "fiscalMonth": "March",
        "year": "2024",
        "released": "479 715",
        "forecast": "410 046",
        "spreadRaw": "16.99%"
      },
      "EBITMillion INR": {
        "metric": "EBITMillion INR",
        "unit": "Million INR",
        "fiscalMonth": "March",
        "year": "2024",
        "released": "412 361",
        "forecast": "354 779",
        "spreadRaw": "16.23%"
      },
      "Earnings before Tax (EBT)Million INR": {
        "metric": "Earnings before Tax (EBT)Million INR",
        "unit": "Million INR",
        "fiscalMonth": "March",
        "year": "2024",
        "released": "483 858",
        "forecast": "403 246",
        "spreadRaw": "19.99%"
      },
      "Net incomeMillion INR": {
        "metric": "Net incomeMillion INR",
        "unit": "Million INR",
        "fiscalMonth": "March",
        "year": "2024",
        "released": "374 023",
        "forecast": "307 798",
        "spreadRaw": "21.52%"
      },
      "EPS INR": {
        "metric": "EPS INR",
        "unit": "INR",
        "fiscalMonth": "March",
        "year": "2024",
        "released": "60,7",
        "forecast": "49,9",
        "spreadRaw": "21.66%"
      },
      "Announcement Date": {
        "metric": "Announcement Date",
        "unit": null,
        "fiscalMonth": "March",
        "year": "2024",
        "released": "02/05/24",
        "forecast": null,
        "spreadRaw": null
      }
    },
    "2025": {
      "Net salesMillion INR": {
        "metric": "Net salesMillion INR",
        "unit": "Million INR",
        "fiscalMonth": "March",
        "year": "2025",
        "released": "1 433 688",
        "forecast": "1 417 348",
        "spreadRaw": "1.15%"
      },
      "EBITDAMillion INR": {
        "metric": "EBITDAMillion INR",
        "unit": "Million INR",
        "fiscalMonth": "March",
        "year": "2025",
        "released": "470 630",
        "forecast": "454 875",
        "spreadRaw": "3.46%"
      },
      "EBITMillion INR": {
        "metric": "EBITMillion INR",
        "unit": "Million INR",
        "fiscalMonth": "March",
        "year": "2025",
        "released": "379 175",
        "forecast": "381 795",
        "spreadRaw": "-0.69%"
      },
      "Earnings before Tax (EBT)Million INR": {
        "metric": "Earnings before Tax (EBT)Million INR",
        "unit": "Million INR",
        "fiscalMonth": "March",
        "year": "2025",
        "released": "469 662",
        "forecast": "444 316",
        "spreadRaw": "5.7%"
      },
      "Net incomeMillion INR": {
        "metric": "Net incomeMillion INR",
        "unit": "Million INR",
        "fiscalMonth": "March",
        "year": "2025",
        "released": "353 582",
        "forecast": "339 204",
        "spreadRaw": "4.24%"
      },
      "EPS INR": {
        "metric": "EPS INR",
        "unit": "INR",
        "fiscalMonth": "March",
        "year": "2025",
        "released": "57,4",
        "forecast": "55,0",
        "spreadRaw": "4.33%"
      },
      "Announcement Date": {
        "metric": "Announcement Date",
        "unit": null,
        "fiscalMonth": "March",
        "year": "2025",
        "released": "07/05/25",
        "forecast": null,
        "spreadRaw": null
      }
    },
    "2026": {
      "Net salesMillion INR": {
        "metric": "Net salesMillion INR",
        "unit": "Million INR",
        "fiscalMonth": "March",
        "year": "2026",
        "released": null,
        "forecast": "1 468 957",
        "spreadRaw": null
      },
      "EBITDAMillion INR": {
        "metric": "EBITDAMillion INR",
        "unit": "Million INR",
        "fiscalMonth": "March",
        "year": "2026",
        "released": null,
        "forecast": "467 878",
        "spreadRaw": null
      },
      "EBITMillion INR": {
        "metric": "EBITMillion INR",
        "unit": "Million INR",
        "fiscalMonth": "March",
        "year": "2026",
        "released": null,
        "forecast": "377 935",
        "spreadRaw": null
      },
      "Earnings before Tax (EBT)Million INR": {
        "metric": "Earnings before Tax (EBT)Million INR",
        "unit": "Million INR",
        "fiscalMonth": "March",
        "year": "2026",
        "released": null,
        "forecast": "453 204",
        "spreadRaw": null
      },
      "Net incomeMillion INR": {
        "metric": "Net incomeMillion INR",
        "unit": "Million INR",
        "fiscalMonth": "March",
        "year": "2026",
        "released": null,
        "forecast": "341 350",
        "spreadRaw": null
      },
      "EPS INR": {
        "metric": "EPS INR",
        "unit": "INR",
        "fiscalMonth": "March",
        "year": "2026",
        "released": null,
        "forecast": "55,4",
        "spreadRaw": null
      },
      "Announcement Date": {
        "metric": "Announcement Date",
        "unit": null,
        "fiscalMonth": "March",
        "year": "2026",
        "released": "-",
        "forecast": null,
        "spreadRaw": null
      }
    },
    "2027": {
      "Net salesMillion INR": {
        "metric": "Net salesMillion INR",
        "unit": "Million INR",
        "fiscalMonth": "March",
        "year": "2027",
        "released": null,
        "forecast": "1 550 803",
        "spreadRaw": null
      },
      "EBITDAMillion INR": {
        "metric": "EBITDAMillion INR",
        "unit": "Million INR",
        "fiscalMonth": "March",
        "year": "2027",
        "released": null,
        "forecast": "490 029",
        "spreadRaw": null
      },
      "EBITMillion INR": {
        "metric": "EBITMillion INR",
        "unit": "Million INR",
        "fiscalMonth": "March",
        "year": "2027",
        "released": null,
        "forecast": "384 935",
        "spreadRaw": null
      },
      "Earnings before Tax (EBT)Million INR": {
        "metric": "Earnings before Tax (EBT)Million INR",
        "unit": "Million INR",
        "fiscalMonth": "March",
        "year": "2027",
        "released": null,
        "forecast": "462 401",
        "spreadRaw": null
      },
      "Net incomeMillion INR": {
        "metric": "Net incomeMillion INR",
        "unit": "Million INR",
        "fiscalMonth": "March",
        "year": "2027",
        "released": null,
        "forecast": "350 304",
        "spreadRaw": null
      },
      "EPS INR": {
        "metric": "EPS INR",
        "unit": "INR",
        "fiscalMonth": "March",
        "year": "2027",
        "released": null,
        "forecast": "56,7",
        "spreadRaw": null
      },
      "Announcement Date": {
        "metric": "Announcement Date",
        "unit": null,
        "fiscalMonth": "March",
        "year": "2027",
        "released": null,
        "forecast": null,
        "spreadRaw": null
      }
    },
    "2028": {
      "Net salesMillion INR": {
        "metric": "Net salesMillion INR",
        "unit": "Million INR",
        "fiscalMonth": "March",
        "year": "2028",
        "released": null,
        "forecast": "1 664 536",
        "spreadRaw": null
      },
      "EBITDAMillion INR": {
        "metric": "EBITDAMillion INR",
        "unit": "Million INR",
        "fiscalMonth": "March",
        "year": "2028",
        "released": null,
        "forecast": "520 611",
        "spreadRaw": null
      },
      "EBITMillion INR": {
        "metric": "EBITMillion INR",
        "unit": "Million INR",
        "fiscalMonth": "March",
        "year": "2028",
        "released": null,
        "forecast": "417 608",
        "spreadRaw": null
      },
      "Earnings before Tax (EBT)Million INR": {
        "metric": "Earnings before Tax (EBT)Million INR",
        "unit": "Million INR",
        "fiscalMonth": "March",
        "year": "2028",
        "released": null,
        "forecast": "489 492",
        "spreadRaw": null
      },
      "Net incomeMillion INR": {
        "metric": "Net incomeMillion INR",
        "unit": "Million INR",
        "fiscalMonth": "March",
        "year": "2028",
        "released": null,
        "forecast": "368 883",
        "spreadRaw": null
      },
      "EPS INR": {
        "metric": "EPS INR",
        "unit": "INR",
        "fiscalMonth": "March",
        "year": "2028",
        "released": null,
        "forecast": "59,7",
        "spreadRaw": null
      },
      "Announcement Date": {
        "metric": "Announcement Date",
        "unit": null,
        "fiscalMonth": "March",
        "year": "2028",
        "released": null,
        "forecast": null,
        "spreadRaw": null
      }
    }
  },
  "quarterlyResults": {
    "2024 Q2": {
      "Net salesMillion INR": {
        "metric": "Net salesMillion INR",
        "unit": "Million INR",
        "fiscalMonth": "March",
        "period": "2024 Q2",
        "released": "327 764",
        "releasedNum": 327764,
        "forecast": "326 889",
        "forecastNum": 326889,
        "spreadRaw": "0.27%",
        "spreadPct": 0.27
      },
      "EBITDAMillion INR": {
        "metric": "EBITDAMillion INR",
        "unit": "Million INR",
        "fiscalMonth": "March",
        "period": "2024 Q2",
        "released": "81 370",
        "releasedNum": 81370,
        "forecast": "83 372",
        "forecastNum": 83372,
        "spreadRaw": "-2.4%",
        "spreadPct": -2.4
      },
      "EBITMillion INR": {
        "metric": "EBITMillion INR",
        "unit": "Million INR",
        "fiscalMonth": "March",
        "period": "2024 Q2",
        "released": "69 588",
        "releasedNum": 69588,
        "forecast": "35 486",
        "forecastNum": 35486,
        "spreadRaw": "96.1%",
        "spreadPct": 96.1
      },
      "Earnings before Tax (EBT)Million INR": {
        "metric": "Earnings before Tax (EBT)Million INR",
        "unit": "Million INR",
        "fiscalMonth": "March",
        "period": "2024 Q2",
        "released": "88 500",
        "releasedNum": 88500,
        "forecast": "77 231",
        "forecastNum": 77231,
        "spreadRaw": "14.59%",
        "spreadPct": 14.59
      },
      "Net incomeMillion INR": {
        "metric": "Net incomeMillion INR",
        "unit": "Million INR",
        "fiscalMonth": "March",
        "period": "2024 Q2",
        "released": "67 998",
        "releasedNum": 67998,
        "forecast": "58 863",
        "forecastNum": 58863,
        "spreadRaw": "15.52%",
        "spreadPct": 15.52
      },
      "EPS INR": {
        "metric": "EPS INR",
        "unit": "INR",
        "fiscalMonth": "March",
        "period": "2024 Q2",
        "released": "11,0",
        "releasedNum": 11,
        "forecast": "11,0",
        "forecastNum": 11,
        "spreadRaw": "0.5%",
        "spreadPct": 0.5
      },
      "Announcement Date": {
        "metric": "Announcement Date",
        "unit": null,
        "fiscalMonth": "March",
        "period": "2024 Q2",
        "released": "10/11/23",
        "releasedDate": "10/11/23",
        "forecast": null,
        "spreadRaw": null,
        "spreadPct": null
      }
    },
    "2024 Q3": {
      "Net salesMillion INR": {
        "metric": "Net salesMillion INR",
        "unit": "Million INR",
        "fiscalMonth": "March",
        "period": "2024 Q3",
        "released": "361 540",
        "releasedNum": 361540,
        "forecast": "355 338",
        "forecastNum": 355338,
        "spreadRaw": "1.75%",
        "spreadPct": 1.75
      },
      "EBITDAMillion INR": {
        "metric": "EBITDAMillion INR",
        "unit": "Million INR",
        "fiscalMonth": "March",
        "period": "2024 Q3",
        "released": "113 731",
        "releasedNum": 113731,
        "forecast": "98 959",
        "forecastNum": 98959,
        "spreadRaw": "14.93%",
        "spreadPct": 14.93
      },
      "EBITMillion INR": {
        "metric": "EBITMillion INR",
        "unit": "Million INR",
        "fiscalMonth": "March",
        "period": "2024 Q3",
        "released": "101 127",
        "releasedNum": 101127,
        "forecast": "61 578",
        "forecastNum": 61578,
        "spreadRaw": "64.23%",
        "spreadPct": 64.23
      },
      "Earnings before Tax (EBT)Million INR": {
        "metric": "Earnings before Tax (EBT)Million INR",
        "unit": "Million INR",
        "fiscalMonth": "March",
        "period": "2024 Q3",
        "released": "123 749",
        "releasedNum": 123749,
        "forecast": "86 183",
        "forecastNum": 86183,
        "spreadRaw": "43.59%",
        "spreadPct": 43.59
      },
      "Net incomeMillion INR": {
        "metric": "Net incomeMillion INR",
        "unit": "Million INR",
        "fiscalMonth": "March",
        "period": "2024 Q3",
        "released": "90 692",
        "releasedNum": 90692,
        "forecast": "69 748",
        "forecastNum": 69748,
        "spreadRaw": "30.03%",
        "spreadPct": 30.03
      },
      "EPS INR": {
        "metric": "EPS INR",
        "unit": "INR",
        "fiscalMonth": "March",
        "period": "2024 Q3",
        "released": "14,7",
        "releasedNum": 14.7,
        "forecast": "12,0",
        "forecastNum": 12,
        "spreadRaw": "22.67%",
        "spreadPct": 22.67
      },
      "Announcement Date": {
        "metric": "Announcement Date",
        "unit": null,
        "fiscalMonth": "March",
        "period": "2024 Q3",
        "released": "12/02/24",
        "releasedDate": "12/02/24",
        "forecast": null,
        "spreadRaw": null,
        "spreadPct": null
      }
    },
    "2024 Q4": {
      "Net salesMillion INR": {
        "metric": "Net salesMillion INR",
        "unit": "Million INR",
        "fiscalMonth": "March",
        "period": "2024 Q4",
        "released": "374 104",
        "releasedNum": 374104,
        "forecast": "366 677",
        "forecastNum": 366677,
        "spreadRaw": "2.03%",
        "spreadPct": 2.03
      },
      "EBITDAMillion INR": {
        "metric": "EBITDAMillion INR",
        "unit": "Million INR",
        "fiscalMonth": "March",
        "period": "2024 Q4",
        "released": "113 376",
        "releasedNum": 113376,
        "forecast": "102 616",
        "forecastNum": 102616,
        "spreadRaw": "10.49%",
        "spreadPct": 10.49
      },
      "EBITMillion INR": {
        "metric": "EBITMillion INR",
        "unit": "Million INR",
        "fiscalMonth": "March",
        "period": "2024 Q4",
        "released": "93 442",
        "releasedNum": 93442,
        "forecast": "70 983",
        "forecastNum": 70983,
        "spreadRaw": "31.64%",
        "spreadPct": 31.64
      },
      "Earnings before Tax (EBT)Million INR": {
        "metric": "Earnings before Tax (EBT)Million INR",
        "unit": "Million INR",
        "fiscalMonth": "March",
        "period": "2024 Q4",
        "released": "113 561",
        "releasedNum": 113561,
        "forecast": "91 494",
        "forecastNum": 91494,
        "spreadRaw": "24.12%",
        "spreadPct": 24.12
      },
      "Net incomeMillion INR": {
        "metric": "Net incomeMillion INR",
        "unit": "Million INR",
        "fiscalMonth": "March",
        "period": "2024 Q4",
        "released": "86 822",
        "releasedNum": 86822,
        "forecast": "75 791",
        "forecastNum": 75791,
        "spreadRaw": "14.55%",
        "spreadPct": 14.55
      },
      "EPS INR": {
        "metric": "EPS INR",
        "unit": "INR",
        "fiscalMonth": "March",
        "period": "2024 Q4",
        "released": "14,1",
        "releasedNum": 14.1,
        "forecast": "12,9",
        "forecastNum": 12.9,
        "spreadRaw": "9.34%",
        "spreadPct": 9.34
      },
      "Announcement Date": {
        "metric": "Announcement Date",
        "unit": null,
        "fiscalMonth": "March",
        "period": "2024 Q4",
        "released": "02/05/24",
        "releasedDate": "02/05/24",
        "forecast": null,
        "spreadRaw": null,
        "spreadPct": null
      }
    },
    "2025 Q1": {
      "Net salesMillion INR": {
        "metric": "Net salesMillion INR",
        "unit": "Million INR",
        "fiscalMonth": "March",
        "period": "2025 Q1",
        "released": "364 646",
        "releasedNum": 364646,
        "forecast": "361 708",
        "forecastNum": 361708,
        "spreadRaw": "0.81%",
        "spreadPct": 0.81
      },
      "EBITDAMillion INR": {
        "metric": "EBITDAMillion INR",
        "unit": "Million INR",
        "fiscalMonth": "March",
        "period": "2025 Q1",
        "released": "143 385",
        "releasedNum": 143385,
        "forecast": "103 701",
        "forecastNum": 103701,
        "spreadRaw": "38.27%",
        "spreadPct": 38.27
      },
      "EBITMillion INR": {
        "metric": "EBITMillion INR",
        "unit": "Million INR",
        "fiscalMonth": "March",
        "period": "2025 Q1",
        "released": "123 860",
        "releasedNum": 123860,
        "forecast": "68 708",
        "forecastNum": 68708,
        "spreadRaw": "80.27%",
        "spreadPct": 80.27
      },
      "Earnings before Tax (EBT)Million INR": {
        "metric": "Earnings before Tax (EBT)Million INR",
        "unit": "Million INR",
        "fiscalMonth": "March",
        "period": "2025 Q1",
        "released": "140 618",
        "releasedNum": 140618,
        "forecast": "101 927",
        "forecastNum": 101927,
        "spreadRaw": "37.96%",
        "spreadPct": 37.96
      },
      "Net incomeMillion INR": {
        "metric": "Net incomeMillion INR",
        "unit": "Million INR",
        "fiscalMonth": "March",
        "period": "2025 Q1",
        "released": "109 595",
        "releasedNum": 109595,
        "forecast": "78 966",
        "forecastNum": 78966,
        "spreadRaw": "38.79%",
        "spreadPct": 38.79
      },
      "EPS INR": {
        "metric": "EPS INR",
        "unit": "INR",
        "fiscalMonth": "March",
        "period": "2025 Q1",
        "released": "17,8",
        "releasedNum": 17.8,
        "forecast": "13,2",
        "forecastNum": 13.2,
        "spreadRaw": "34.49%",
        "spreadPct": 34.49
      },
      "Announcement Date": {
        "metric": "Announcement Date",
        "unit": null,
        "fiscalMonth": "March",
        "period": "2025 Q1",
        "released": "31/07/24",
        "releasedDate": "31/07/24",
        "forecast": null,
        "spreadRaw": null,
        "spreadPct": null
      }
    },
    "2025 Q2": {
      "Net salesMillion INR": {
        "metric": "Net salesMillion INR",
        "unit": "Million INR",
        "fiscalMonth": "March",
        "period": "2025 Q2",
        "released": "306 729",
        "releasedNum": 306729,
        "forecast": "310 932",
        "forecastNum": 310932,
        "spreadRaw": "-1.35%",
        "spreadPct": -1.35
      },
      "EBITDAMillion INR": {
        "metric": "EBITDAMillion INR",
        "unit": "Million INR",
        "fiscalMonth": "March",
        "period": "2025 Q2",
        "released": "86 171",
        "releasedNum": 86171,
        "forecast": "92 005",
        "forecastNum": 92005,
        "spreadRaw": "-6.34%",
        "spreadPct": -6.34
      },
      "EBITMillion INR": {
        "metric": "EBITMillion INR",
        "unit": "Million INR",
        "fiscalMonth": "March",
        "period": "2025 Q2",
        "released": "67 193",
        "releasedNum": 67193,
        "forecast": "66 245",
        "forecastNum": 66245,
        "spreadRaw": "1.43%",
        "spreadPct": 1.43
      },
      "Earnings before Tax (EBT)Million INR": {
        "metric": "Earnings before Tax (EBT)Million INR",
        "unit": "Million INR",
        "fiscalMonth": "March",
        "period": "2025 Q2",
        "released": "80 163",
        "releasedNum": 80163,
        "forecast": "106 710",
        "forecastNum": 106710,
        "spreadRaw": "-24.88%",
        "spreadPct": -24.88
      },
      "Net incomeMillion INR": {
        "metric": "Net incomeMillion INR",
        "unit": "Million INR",
        "fiscalMonth": "March",
        "period": "2025 Q2",
        "released": "62 891",
        "releasedNum": 62891,
        "forecast": "75 907",
        "forecastNum": 75907,
        "spreadRaw": "-17.15%",
        "spreadPct": -17.15
      },
      "EPS INR": {
        "metric": "EPS INR",
        "unit": "INR",
        "fiscalMonth": "March",
        "period": "2025 Q2",
        "released": "10,2",
        "releasedNum": 10.2,
        "forecast": "12,7",
        "forecastNum": 12.7,
        "spreadRaw": "-19.61%",
        "spreadPct": -19.61
      },
      "Announcement Date": {
        "metric": "Announcement Date",
        "unit": null,
        "fiscalMonth": "March",
        "period": "2025 Q2",
        "released": "25/10/24",
        "releasedDate": "25/10/24",
        "forecast": null,
        "spreadRaw": null,
        "spreadPct": null
      }
    },
    "2025 Q3": {
      "Net salesMillion INR": {
        "metric": "Net salesMillion INR",
        "unit": "Million INR",
        "fiscalMonth": "March",
        "period": "2025 Q3",
        "released": "357 798",
        "releasedNum": 357798,
        "forecast": "347 564",
        "forecastNum": 347564,
        "spreadRaw": "2.94%",
        "spreadPct": 2.94
      },
      "EBITDAMillion INR": {
        "metric": "EBITDAMillion INR",
        "unit": "Million INR",
        "fiscalMonth": "March",
        "period": "2025 Q3",
        "released": "123 172",
        "releasedNum": 123172,
        "forecast": "109 899",
        "forecastNum": 109899,
        "spreadRaw": "12.08%",
        "spreadPct": 12.08
      },
      "EBITMillion INR": {
        "metric": "EBITMillion INR",
        "unit": "Million INR",
        "fiscalMonth": "March",
        "period": "2025 Q3",
        "released": "98 038",
        "releasedNum": 98038,
        "forecast": "76 634",
        "forecastNum": 76634,
        "spreadRaw": "27.93%",
        "spreadPct": 27.93
      },
      "Earnings before Tax (EBT)Million INR": {
        "metric": "Earnings before Tax (EBT)Million INR",
        "unit": "Million INR",
        "fiscalMonth": "March",
        "period": "2025 Q3",
        "released": "117 214",
        "releasedNum": 117214,
        "forecast": "110 171",
        "forecastNum": 110171,
        "spreadRaw": "6.39%",
        "spreadPct": 6.39
      },
      "Net incomeMillion INR": {
        "metric": "Net incomeMillion INR",
        "unit": "Million INR",
        "fiscalMonth": "March",
        "period": "2025 Q3",
        "released": "85 056",
        "releasedNum": 85056,
        "forecast": "84 217",
        "forecastNum": 84217,
        "spreadRaw": "1%",
        "spreadPct": 1
      },
      "EPS INR": {
        "metric": "EPS INR",
        "unit": "INR",
        "fiscalMonth": "March",
        "period": "2025 Q3",
        "released": "13,8",
        "releasedNum": 13.8,
        "forecast": "13,8",
        "forecastNum": 13.8,
        "spreadRaw": "-0.01%",
        "spreadPct": -0.01
      },
      "Announcement Date": {
        "metric": "Announcement Date",
        "unit": null,
        "fiscalMonth": "March",
        "period": "2025 Q3",
        "released": "27/01/25",
        "releasedDate": "27/01/25",
        "forecast": null,
        "spreadRaw": null,
        "spreadPct": null
      }
    },
    "2025 Q4": {
      "Net salesMillion INR": {
        "metric": "Net salesMillion INR",
        "unit": "Million INR",
        "fiscalMonth": "March",
        "period": "2025 Q4",
        "released": "378 245",
        "releasedNum": 378245,
        "forecast": "367 832",
        "forecastNum": 367832,
        "spreadRaw": "2.83%",
        "spreadPct": 2.83
      },
      "EBITDAMillion INR": {
        "metric": "EBITDAMillion INR",
        "unit": "Million INR",
        "fiscalMonth": "March",
        "period": "2025 Q4",
        "released": "117 902",
        "releasedNum": 117902,
        "forecast": "114 669",
        "forecastNum": 114669,
        "spreadRaw": "2.82%",
        "spreadPct": 2.82
      },
      "EBITMillion INR": {
        "metric": "EBITMillion INR",
        "unit": "Million INR",
        "fiscalMonth": "March",
        "period": "2025 Q4",
        "released": "90 084",
        "releasedNum": 90084,
        "forecast": "80 386",
        "forecastNum": 80386,
        "spreadRaw": "12.06%",
        "spreadPct": 12.06
      },
      "Earnings before Tax (EBT)Million INR": {
        "metric": "Earnings before Tax (EBT)Million INR",
        "unit": "Million INR",
        "fiscalMonth": "March",
        "period": "2025 Q4",
        "released": "128 732",
        "releasedNum": 128732,
        "forecast": "117 075",
        "forecastNum": 117075,
        "spreadRaw": "9.96%",
        "spreadPct": 9.96
      },
      "Net incomeMillion INR": {
        "metric": "Net incomeMillion INR",
        "unit": "Million INR",
        "fiscalMonth": "March",
        "period": "2025 Q4",
        "released": "96 040",
        "releasedNum": 96040,
        "forecast": "83 489",
        "forecastNum": 83489,
        "spreadRaw": "15.03%",
        "spreadPct": 15.03
      },
      "EPS INR": {
        "metric": "EPS INR",
        "unit": "INR",
        "fiscalMonth": "March",
        "period": "2025 Q4",
        "released": "15,6",
        "releasedNum": 15.6,
        "forecast": "13,6",
        "forecastNum": 13.6,
        "spreadRaw": "14.9%",
        "spreadPct": 14.9
      },
      "Announcement Date": {
        "metric": "Announcement Date",
        "unit": null,
        "fiscalMonth": "March",
        "period": "2025 Q4",
        "released": "07/05/25",
        "releasedDate": "07/05/25",
        "forecast": null,
        "spreadRaw": null,
        "spreadPct": null
      }
    },
    "2026 Q1": {
      "Net salesMillion INR": {
        "metric": "Net salesMillion INR",
        "unit": "Million INR",
        "fiscalMonth": "March",
        "period": "2026 Q1",
        "released": "358 422",
        "releasedNum": 358422,
        "forecast": "348 476",
        "forecastNum": 348476,
        "spreadRaw": "2.85%",
        "spreadPct": 2.85
      },
      "EBITDAMillion INR": {
        "metric": "EBITDAMillion INR",
        "unit": "Million INR",
        "fiscalMonth": "March",
        "period": "2026 Q1",
        "released": "125 214",
        "releasedNum": 125214,
        "forecast": "111 155",
        "forecastNum": 111155,
        "spreadRaw": "12.65%",
        "spreadPct": 12.65
      },
      "EBITMillion INR": {
        "metric": "EBITMillion INR",
        "unit": "Million INR",
        "fiscalMonth": "March",
        "period": "2026 Q1",
        "released": "102 142",
        "releasedNum": 102142,
        "forecast": "86 054",
        "forecastNum": 86054,
        "spreadRaw": "18.7%",
        "spreadPct": 18.7
      },
      "Earnings before Tax (EBT)Million INR": {
        "metric": "Earnings before Tax (EBT)Million INR",
        "unit": "Million INR",
        "fiscalMonth": "March",
        "period": "2026 Q1",
        "released": "117 092",
        "releasedNum": 117092,
        "forecast": "117 230",
        "forecastNum": 117230,
        "spreadRaw": "-0.12%",
        "spreadPct": -0.12
      },
      "Net incomeMillion INR": {
        "metric": "Net incomeMillion INR",
        "unit": "Million INR",
        "fiscalMonth": "March",
        "period": "2026 Q1",
        "released": "87 434",
        "releasedNum": 87434,
        "forecast": "85 363",
        "forecastNum": 85363,
        "spreadRaw": "2.43%",
        "spreadPct": 2.43
      },
      "EPS INR": {
        "metric": "EPS INR",
        "unit": "INR",
        "fiscalMonth": "March",
        "period": "2026 Q1",
        "released": "14,2",
        "releasedNum": 14.2,
        "forecast": "13,6",
        "forecastNum": 13.6,
        "spreadRaw": "4.54%",
        "spreadPct": 4.54
      },
      "Announcement Date": {
        "metric": "Announcement Date",
        "unit": null,
        "fiscalMonth": "March",
        "period": "2026 Q1",
        "released": "31/07/25",
        "releasedDate": "31/07/25",
        "forecast": null,
        "spreadRaw": null,
        "spreadPct": null
      }
    },
    "2026 Q2": {
      "Net salesMillion INR": {
        "metric": "Net salesMillion INR",
        "unit": "Million INR",
        "fiscalMonth": "March",
        "period": "2026 Q2",
        "released": null,
        "releasedNum": null,
        "forecast": "302 331",
        "forecastNum": 302331,
        "spreadRaw": null,
        "spreadPct": null
      },
      "EBITDAMillion INR": {
        "metric": "EBITDAMillion INR",
        "unit": "Million INR",
        "fiscalMonth": "March",
        "period": "2026 Q2",
        "released": null,
        "releasedNum": null,
        "forecast": "83 306",
        "forecastNum": 83306,
        "spreadRaw": null,
        "spreadPct": null
      },
      "EBITMillion INR": {
        "metric": "EBITMillion INR",
        "unit": "Million INR",
        "fiscalMonth": "March",
        "period": "2026 Q2",
        "released": null,
        "releasedNum": null,
        "forecast": "24 505",
        "forecastNum": 24505,
        "spreadRaw": null,
        "spreadPct": null
      },
      "Earnings before Tax (EBT)Million INR": {
        "metric": "Earnings before Tax (EBT)Million INR",
        "unit": "Million INR",
        "fiscalMonth": "March",
        "period": "2026 Q2",
        "released": null,
        "releasedNum": null,
        "forecast": "74 734",
        "forecastNum": 74734,
        "spreadRaw": null,
        "spreadPct": null
      },
      "Net incomeMillion INR": {
        "metric": "Net incomeMillion INR",
        "unit": "Million INR",
        "fiscalMonth": "March",
        "period": "2026 Q2",
        "released": null,
        "releasedNum": null,
        "forecast": "56 806",
        "forecastNum": 56806,
        "spreadRaw": null,
        "spreadPct": null
      },
      "EPS INR": {
        "metric": "EPS INR",
        "unit": "INR",
        "fiscalMonth": "March",
        "period": "2026 Q2",
        "released": null,
        "releasedNum": null,
        "forecast": "10,1",
        "forecastNum": 10.1,
        "spreadRaw": null,
        "spreadPct": null
      },
      "Announcement Date": {
        "metric": "Announcement Date",
        "unit": null,
        "fiscalMonth": "March",
        "period": "2026 Q2",
        "released": "-",
        "releasedDate": "-",
        "forecast": null,
        "spreadRaw": null,
        "spreadPct": null
      }
    },
    "2026 Q3": {
      "Net salesMillion INR": {
        "metric": "Net salesMillion INR",
        "unit": "Million INR",
        "fiscalMonth": "March",
        "period": "2026 Q3",
        "released": null,
        "releasedNum": null,
        "forecast": null,
        "forecastNum": null,
        "spreadRaw": null,
        "spreadPct": null
      },
      "EBITDAMillion INR": {
        "metric": "EBITDAMillion INR",
        "unit": "Million INR",
        "fiscalMonth": "March",
        "period": "2026 Q3",
        "released": null,
        "releasedNum": null,
        "forecast": null,
        "forecastNum": null,
        "spreadRaw": null,
        "spreadPct": null
      },
      "EBITMillion INR": {
        "metric": "EBITMillion INR",
        "unit": "Million INR",
        "fiscalMonth": "March",
        "period": "2026 Q3",
        "released": null,
        "releasedNum": null,
        "forecast": null,
        "forecastNum": null,
        "spreadRaw": null,
        "spreadPct": null
      },
      "Earnings before Tax (EBT)Million INR": {
        "metric": "Earnings before Tax (EBT)Million INR",
        "unit": "Million INR",
        "fiscalMonth": "March",
        "period": "2026 Q3",
        "released": null,
        "releasedNum": null,
        "forecast": null,
        "forecastNum": null,
        "spreadRaw": null,
        "spreadPct": null
      },
      "Net incomeMillion INR": {
        "metric": "Net incomeMillion INR",
        "unit": "Million INR",
        "fiscalMonth": "March",
        "period": "2026 Q3",
        "released": null,
        "releasedNum": null,
        "forecast": null,
        "forecastNum": null,
        "spreadRaw": null,
        "spreadPct": null
      },
      "EPS INR": {
        "metric": "EPS INR",
        "unit": "INR",
        "fiscalMonth": "March",
        "period": "2026 Q3",
        "released": null,
        "releasedNum": null,
        "forecast": "13,5",
        "forecastNum": 13.5,
        "spreadRaw": null,
        "spreadPct": null
      },
      "Announcement Date": {
        "metric": "Announcement Date",
        "unit": null,
        "fiscalMonth": "March",
        "period": "2026 Q3",
        "released": "-",
        "releasedDate": "-",
        "forecast": null,
        "spreadRaw": null,
        "spreadPct": null
      }
    },
    "2026 Q4": {
      "Net salesMillion INR": {
        "metric": "Net salesMillion INR",
        "unit": "Million INR",
        "fiscalMonth": "March",
        "period": "2026 Q4",
        "released": null,
        "releasedNum": null,
        "forecast": null,
        "forecastNum": null,
        "spreadRaw": null,
        "spreadPct": null
      },
      "EBITDAMillion INR": {
        "metric": "EBITDAMillion INR",
        "unit": "Million INR",
        "fiscalMonth": "March",
        "period": "2026 Q4",
        "released": null,
        "releasedNum": null,
        "forecast": null,
        "forecastNum": null,
        "spreadRaw": null,
        "spreadPct": null
      },
      "EBITMillion INR": {
        "metric": "EBITMillion INR",
        "unit": "Million INR",
        "fiscalMonth": "March",
        "period": "2026 Q4",
        "released": null,
        "releasedNum": null,
        "forecast": null,
        "forecastNum": null,
        "spreadRaw": null,
        "spreadPct": null
      },
      "Earnings before Tax (EBT)Million INR": {
        "metric": "Earnings before Tax (EBT)Million INR",
        "unit": "Million INR",
        "fiscalMonth": "March",
        "period": "2026 Q4",
        "released": null,
        "releasedNum": null,
        "forecast": null,
        "forecastNum": null,
        "spreadRaw": null,
        "spreadPct": null
      },
      "Net incomeMillion INR": {
        "metric": "Net incomeMillion INR",
        "unit": "Million INR",
        "fiscalMonth": "March",
        "period": "2026 Q4",
        "released": null,
        "releasedNum": null,
        "forecast": null,
        "forecastNum": null,
        "spreadRaw": null,
        "spreadPct": null
      },
      "EPS INR": {
        "metric": "EPS INR",
        "unit": "INR",
        "fiscalMonth": "March",
        "period": "2026 Q4",
        "released": null,
        "releasedNum": null,
        "forecast": "14,3",
        "forecastNum": 14.3,
        "spreadRaw": null,
        "spreadPct": null
      },
      "Announcement Date": {
        "metric": "Announcement Date",
        "unit": null,
        "fiscalMonth": "March",
        "period": "2026 Q4",
        "released": "-",
        "releasedDate": "-",
        "forecast": null,
        "spreadRaw": null,
        "spreadPct": null
      }
    },
    "2027 Q1": {
      "Net salesMillion INR": {
        "metric": "Net salesMillion INR",
        "unit": "Million INR",
        "fiscalMonth": "March",
        "period": "2027 Q1",
        "released": null,
        "releasedNum": null,
        "forecast": null,
        "forecastNum": null,
        "spreadRaw": null,
        "spreadPct": null
      },
      "EBITDAMillion INR": {
        "metric": "EBITDAMillion INR",
        "unit": "Million INR",
        "fiscalMonth": "March",
        "period": "2027 Q1",
        "released": null,
        "releasedNum": null,
        "forecast": null,
        "forecastNum": null,
        "spreadRaw": null,
        "spreadPct": null
      },
      "EBITMillion INR": {
        "metric": "EBITMillion INR",
        "unit": "Million INR",
        "fiscalMonth": "March",
        "period": "2027 Q1",
        "released": null,
        "releasedNum": null,
        "forecast": null,
        "forecastNum": null,
        "spreadRaw": null,
        "spreadPct": null
      },
      "Earnings before Tax (EBT)Million INR": {
        "metric": "Earnings before Tax (EBT)Million INR",
        "unit": "Million INR",
        "fiscalMonth": "March",
        "period": "2027 Q1",
        "released": null,
        "releasedNum": null,
        "forecast": null,
        "forecastNum": null,
        "spreadRaw": null,
        "spreadPct": null
      },
      "Net incomeMillion INR": {
        "metric": "Net incomeMillion INR",
        "unit": "Million INR",
        "fiscalMonth": "March",
        "period": "2027 Q1",
        "released": null,
        "releasedNum": null,
        "forecast": null,
        "forecastNum": null,
        "spreadRaw": null,
        "spreadPct": null
      },
      "EPS INR": {
        "metric": "EPS INR",
        "unit": "INR",
        "fiscalMonth": "March",
        "period": "2027 Q1",
        "released": null,
        "releasedNum": null,
        "forecast": "14,0",
        "forecastNum": 14,
        "spreadRaw": null,
        "spreadPct": null
      },
      "Announcement Date": {
        "metric": "Announcement Date",
        "unit": null,
        "fiscalMonth": "March",
        "period": "2027 Q1",
        "released": "-",
        "releasedDate": "-",
        "forecast": null,
        "spreadRaw": null,
        "spreadPct": null
      }
    },
    "2027 Q2": {
      "Net salesMillion INR": {
        "metric": "Net salesMillion INR",
        "unit": "Million INR",
        "fiscalMonth": "March",
        "period": "2027 Q2",
        "released": null,
        "releasedNum": null,
        "forecast": null,
        "forecastNum": null,
        "spreadRaw": null,
        "spreadPct": null
      },
      "EBITDAMillion INR": {
        "metric": "EBITDAMillion INR",
        "unit": "Million INR",
        "fiscalMonth": "March",
        "period": "2027 Q2",
        "released": null,
        "releasedNum": null,
        "forecast": null,
        "forecastNum": null,
        "spreadRaw": null,
        "spreadPct": null
      },
      "EBITMillion INR": {
        "metric": "EBITMillion INR",
        "unit": "Million INR",
        "fiscalMonth": "March",
        "period": "2027 Q2",
        "released": null,
        "releasedNum": null,
        "forecast": null,
        "forecastNum": null,
        "spreadRaw": null,
        "spreadPct": null
      },
      "Earnings before Tax (EBT)Million INR": {
        "metric": "Earnings before Tax (EBT)Million INR",
        "unit": "Million INR",
        "fiscalMonth": "March",
        "period": "2027 Q2",
        "released": null,
        "releasedNum": null,
        "forecast": null,
        "forecastNum": null,
        "spreadRaw": null,
        "spreadPct": null
      },
      "Net incomeMillion INR": {
        "metric": "Net incomeMillion INR",
        "unit": "Million INR",
        "fiscalMonth": "March",
        "period": "2027 Q2",
        "released": null,
        "releasedNum": null,
        "forecast": null,
        "forecastNum": null,
        "spreadRaw": null,
        "spreadPct": null
      },
      "EPS INR": {
        "metric": "EPS INR",
        "unit": "INR",
        "fiscalMonth": "March",
        "period": "2027 Q2",
        "released": null,
        "releasedNum": null,
        "forecast": "13,2",
        "forecastNum": 13.2,
        "spreadRaw": null,
        "spreadPct": null
      },
      "Announcement Date": {
        "metric": "Announcement Date",
        "unit": null,
        "fiscalMonth": "March",
        "period": "2027 Q2",
        "released": "-",
        "releasedDate": "-",
        "forecast": null,
        "spreadRaw": null,
        "spreadPct": null
      }
    },
    "2027 Q3": {
      "Net salesMillion INR": {
        "metric": "Net salesMillion INR",
        "unit": "Million INR",
        "fiscalMonth": "March",
        "period": "2027 Q3",
        "released": null,
        "releasedNum": null,
        "forecast": null,
        "forecastNum": null,
        "spreadRaw": null,
        "spreadPct": null
      },
      "EBITDAMillion INR": {
        "metric": "EBITDAMillion INR",
        "unit": "Million INR",
        "fiscalMonth": "March",
        "period": "2027 Q3",
        "released": null,
        "releasedNum": null,
        "forecast": null,
        "forecastNum": null,
        "spreadRaw": null,
        "spreadPct": null
      },
      "EBITMillion INR": {
        "metric": "EBITMillion INR",
        "unit": "Million INR",
        "fiscalMonth": "March",
        "period": "2027 Q3",
        "released": null,
        "releasedNum": null,
        "forecast": null,
        "forecastNum": null,
        "spreadRaw": null,
        "spreadPct": null
      },
      "Earnings before Tax (EBT)Million INR": {
        "metric": "Earnings before Tax (EBT)Million INR",
        "unit": "Million INR",
        "fiscalMonth": "March",
        "period": "2027 Q3",
        "released": null,
        "releasedNum": null,
        "forecast": null,
        "forecastNum": null,
        "spreadRaw": null,
        "spreadPct": null
      },
      "Net incomeMillion INR": {
        "metric": "Net incomeMillion INR",
        "unit": "Million INR",
        "fiscalMonth": "March",
        "period": "2027 Q3",
        "released": null,
        "releasedNum": null,
        "forecast": null,
        "forecastNum": null,
        "spreadRaw": null,
        "spreadPct": null
      },
      "EPS INR": {
        "metric": "EPS INR",
        "unit": "INR",
        "fiscalMonth": "March",
        "period": "2027 Q3",
        "released": null,
        "releasedNum": null,
        "forecast": "15,1",
        "forecastNum": 15.1,
        "spreadRaw": null,
        "spreadPct": null
      },
      "Announcement Date": {
        "metric": "Announcement Date",
        "unit": null,
        "fiscalMonth": "March",
        "period": "2027 Q3",
        "released": "-",
        "releasedDate": "-",
        "forecast": null,
        "spreadRaw": null,
        "spreadPct": null
      }
    },
    "2027 Q4": {
      "Net salesMillion INR": {
        "metric": "Net salesMillion INR",
        "unit": "Million INR",
        "fiscalMonth": "March",
        "period": "2027 Q4",
        "released": null,
        "releasedNum": null,
        "forecast": null,
        "forecastNum": null,
        "spreadRaw": null,
        "spreadPct": null
      },
      "EBITDAMillion INR": {
        "metric": "EBITDAMillion INR",
        "unit": "Million INR",
        "fiscalMonth": "March",
        "period": "2027 Q4",
        "released": null,
        "releasedNum": null,
        "forecast": null,
        "forecastNum": null,
        "spreadRaw": null,
        "spreadPct": null
      },
      "EBITMillion INR": {
        "metric": "EBITMillion INR",
        "unit": "Million INR",
        "fiscalMonth": "March",
        "period": "2027 Q4",
        "released": null,
        "releasedNum": null,
        "forecast": null,
        "forecastNum": null,
        "spreadRaw": null,
        "spreadPct": null
      },
      "Earnings before Tax (EBT)Million INR": {
        "metric": "Earnings before Tax (EBT)Million INR",
        "unit": "Million INR",
        "fiscalMonth": "March",
        "period": "2027 Q4",
        "released": null,
        "releasedNum": null,
        "forecast": null,
        "forecastNum": null,
        "spreadRaw": null,
        "spreadPct": null
      },
      "Net incomeMillion INR": {
        "metric": "Net incomeMillion INR",
        "unit": "Million INR",
        "fiscalMonth": "March",
        "period": "2027 Q4",
        "released": null,
        "releasedNum": null,
        "forecast": null,
        "forecastNum": null,
        "spreadRaw": null,
        "spreadPct": null
      },
      "EPS INR": {
        "metric": "EPS INR",
        "unit": "INR",
        "fiscalMonth": "March",
        "period": "2027 Q4",
        "released": null,
        "releasedNum": null,
        "forecast": "15,9",
        "forecastNum": 15.9,
        "spreadRaw": null,
        "spreadPct": null
      },
      "Announcement Date": {
        "metric": "Announcement Date",
        "unit": null,
        "fiscalMonth": "March",
        "period": "2027 Q4",
        "released": "-",
        "releasedDate": "-",
        "forecast": null,
        "spreadRaw": null,
        "spreadPct": null
      }
    }
  },
  "upcomingEvents": {
    "count": 5,
    "events": [
      {
        "section": "Upcoming",
        "dateTimeRaw": "29/10/2025",
        "dateTimeISO": "2025-10-28T18:30:00.000Z",
        "title": "Q2 2026 Earnings Release",
        "icsUrl": "https://in.marketscreener.com/api/stateful/agenda/event-async/Q2-2026-Earnings-Release-48074279.ics"
      },
      {
        "section": "Upcoming",
        "dateTimeRaw": "16/02/2026",
        "dateTimeISO": "2026-02-15T18:30:00.000Z",
        "title": "Q3 2026 Earnings Release (Projected)",
        "icsUrl": "https://in.marketscreener.com/api/stateful/agenda/event-async/Q3-2026-Earnings-Release-Projected-48898226.ics"
      },
      {
        "section": "Upcoming",
        "dateTimeRaw": "13/05/2026",
        "dateTimeISO": "2026-05-12T18:30:00.000Z",
        "title": "Q4 2026 Earnings Release (Projected)",
        "icsUrl": "https://in.marketscreener.com/api/stateful/agenda/event-async/Q4-2026-Earnings-Release-Projected-49889222.ics"
      },
      {
        "section": "Upcoming",
        "dateTimeRaw": "11/08/2026",
        "dateTimeISO": "2026-08-10T18:30:00.000Z",
        "title": "Q1 2027 Earnings Release (Projected)",
        "icsUrl": "https://in.marketscreener.com/api/stateful/agenda/event-async/Q1-2027-Earnings-Release-Projected-50520721.ics"
      },
      {
        "section": "Upcoming",
        "dateTimeRaw": "06/11/2026",
        "dateTimeISO": "2026-11-05T18:30:00.000Z",
        "title": "Q2 2027 Earnings Release (Projected)",
        "icsUrl": "https://in.marketscreener.com/api/stateful/agenda/event-async/Q2-2027-Earnings-Release-Projected-51306941.ics"
      }
    ]
  },
  "pastEvents": {
    "count": 117,
    "events": [
      {
        "section": "Past",
        "dateTimeRaw": "08/10/2025",
        "dateTimeISO": "2025-10-07T18:30:00.000Z",
        "title": "Non Deal Roadshow - Day 2",
        "icsUrl": "https://in.marketscreener.com/api/stateful/agenda/event-async/Non-Deal-Roadshow-Day-2-51260044.ics"
      },
      {
        "section": "Past",
        "dateTimeRaw": "07/10/2025",
        "dateTimeISO": "2025-10-06T18:30:00.000Z",
        "title": "Non Deal Roadshow - Day 1",
        "icsUrl": "https://in.marketscreener.com/api/stateful/agenda/event-async/Non-Deal-Roadshow-Day-1-51260042.ics"
      },
      {
        "section": "Past",
        "dateTimeRaw": "28/08/2025",
        "dateTimeISO": "2025-08-27T18:30:00.000Z",
        "title": "Annual General Meeting",
        "icsUrl": "https://in.marketscreener.com/api/stateful/agenda/event-async/Annual-General-Meeting-51163037.ics"
      },
      {
        "section": "Past",
        "dateTimeRaw": "21/08/2025",
        "dateTimeISO": "2025-08-20T18:30:00.000Z",
        "title": "Final dividend",
        "icsUrl": "https://in.marketscreener.com/api/stateful/agenda/event-async/Final-dividend-50851883.ics"
      },
      {
        "section": "Past",
        "dateTimeRaw": "06/08/2025",
        "dateTimeISO": "2025-08-05T18:30:00.000Z",
        "title": "Ex-dividend day for dividende intermédiaire",
        "icsUrl": "https://in.marketscreener.com/api/stateful/agenda/event-async/Ex-dividend-day-for-dividende-intermediaire-50851882.ics"
      },
      {
        "section": "Past",
        "dateTimeRaw": "31/07/2025 05:24 pm",
        "dateTimeISO": "2025-07-31T11:54:00.000Z",
        "title": "Q1 2026 Earnings Release",
        "icsUrl": "https://in.marketscreener.com/api/stateful/agenda/event-async/Q1-2026-Earnings-Release-47478409.ics"
      },
      {
        "section": "Past",
        "dateTimeRaw": "31/07/2025",
        "dateTimeISO": "2025-07-30T18:30:00.000Z",
        "title": "Q1 2026 Earnings Call",
        "icsUrl": "https://in.marketscreener.com/api/stateful/agenda/event-async/Q1-2026-Earnings-Call-50697855.ics"
      },
      {
        "section": "Past",
        "dateTimeRaw": "07/05/2025 04:55 pm",
        "dateTimeISO": "2025-05-07T11:25:00.000Z",
        "title": "Q4 2025 Earnings Release",
        "icsUrl": "https://in.marketscreener.com/api/stateful/agenda/event-async/Q4-2025-Earnings-Release-46618609.ics"
      },
      {
        "section": "Past",
        "dateTimeRaw": "14/05/2025",
        "dateTimeISO": "2025-05-13T18:30:00.000Z",
        "title": "Investor Meeting - Anand Rathi Institutional Equities",
        "icsUrl": "https://in.marketscreener.com/api/stateful/agenda/event-async/Investor-Meeting-Anand-Rathi-Institutional-Equities-49889154.ics"
      },
      {
        "section": "Past",
        "dateTimeRaw": "07/05/2025",
        "dateTimeISO": "2025-05-06T18:30:00.000Z",
        "title": "Q4 2025 Earnings Call",
        "icsUrl": "https://in.marketscreener.com/api/stateful/agenda/event-async/Q4-2025-Earnings-Call-49871289.ics"
      },
      {
        "section": "Past",
        "dateTimeRaw": "28/04/2025",
        "dateTimeISO": "2025-04-27T18:30:00.000Z",
        "title": "Non Deal Roadshow",
        "icsUrl": "https://in.marketscreener.com/api/stateful/agenda/event-async/Non-Deal-Roadshow-49671763.ics"
      },
      {
        "section": "Past",
        "dateTimeRaw": "31/01/2025",
        "dateTimeISO": "2025-01-30T18:30:00.000Z",
        "title": "Ex-dividend day for dividende intermédiaire",
        "icsUrl": "https://in.marketscreener.com/api/stateful/agenda/event-async/Ex-dividend-day-for-dividende-intermediaire-49001662.ics"
      },
      {
        "section": "Past",
        "dateTimeRaw": "27/01/2025 04:38 pm",
        "dateTimeISO": "2025-01-27T11:08:00.000Z",
        "title": "Q3 2025 Earnings Release",
        "icsUrl": "https://in.marketscreener.com/api/stateful/agenda/event-async/Q3-2025-Earnings-Release-45860957.ics"
      },
      {
        "section": "Past",
        "dateTimeRaw": "27/01/2025",
        "dateTimeISO": "2025-01-26T18:30:00.000Z",
        "title": "Q3 2025 Earnings Call",
        "icsUrl": "https://in.marketscreener.com/api/stateful/agenda/event-async/Q3-2025-Earnings-Call-48887027.ics"
      },
      {
        "section": "Past",
        "dateTimeRaw": "04/12/2024",
        "dateTimeISO": "2024-12-03T18:30:00.000Z",
        "title": "Non Deal Roadshow - Day 3",
        "icsUrl": "https://in.marketscreener.com/api/stateful/agenda/event-async/Non-Deal-Roadshow-Day-3-48481337.ics"
      },
      {
        "section": "Past",
        "dateTimeRaw": "03/12/2024",
        "dateTimeISO": "2024-12-02T18:30:00.000Z",
        "title": "Non Deal Roadshow - Day 2",
        "icsUrl": "https://in.marketscreener.com/api/stateful/agenda/event-async/Non-Deal-Roadshow-Day-2-48481327.ics"
      },
      {
        "section": "Past",
        "dateTimeRaw": "02/12/2024",
        "dateTimeISO": "2024-12-01T18:30:00.000Z",
        "title": "Non Deal Roadshow - Day 1",
        "icsUrl": "https://in.marketscreener.com/api/stateful/agenda/event-async/Non-Deal-Roadshow-Day-1-48481323.ics"
      },
      {
        "section": "Past",
        "dateTimeRaw": "05/11/2024",
        "dateTimeISO": "2024-11-04T18:30:00.000Z",
        "title": "Ex-dividend day for dividende intermédiaire",
        "icsUrl": "https://in.marketscreener.com/api/stateful/agenda/event-async/Ex-dividend-day-for-dividende-intermediaire-48240412.ics"
      },
      {
        "section": "Past",
        "dateTimeRaw": "25/10/2024 09:01 pm",
        "dateTimeISO": "2024-10-25T15:31:00.000Z",
        "title": "Q2 2025 Earnings Release",
        "icsUrl": "https://in.marketscreener.com/api/stateful/agenda/event-async/Q2-2025-Earnings-Release-45111055.ics"
      },
      {
        "section": "Past",
        "dateTimeRaw": "25/10/2024",
        "dateTimeISO": "2024-10-24T18:30:00.000Z",
        "title": "Q2 2025 Earnings Call",
        "icsUrl": "https://in.marketscreener.com/api/stateful/agenda/event-async/Q2-2025-Earnings-Call-48176092.ics"
      },
      {
        "section": "Past",
        "dateTimeRaw": "21/08/2024 11:00 am",
        "dateTimeISO": "2024-08-21T05:30:00.000Z",
        "title": "Annual General Meeting",
        "icsUrl": "https://in.marketscreener.com/api/stateful/agenda/event-async/Annual-General-Meeting-47526270.ics"
      },
      {
        "section": "Past",
        "dateTimeRaw": "16/08/2024",
        "dateTimeISO": "2024-08-15T18:30:00.000Z",
        "title": "Final dividend",
        "icsUrl": "https://in.marketscreener.com/api/stateful/agenda/event-async/Final-dividend-47619250.ics"
      },
      {
        "section": "Past",
        "dateTimeRaw": "31/07/2024 04:55 pm",
        "dateTimeISO": "2024-07-31T11:25:00.000Z",
        "title": "Q1 2025 Earnings Release",
        "icsUrl": "https://in.marketscreener.com/api/stateful/agenda/event-async/Q1-2025-Earnings-Release-44476565.ics"
      },
      {
        "section": "Past",
        "dateTimeRaw": "31/07/2024",
        "dateTimeISO": "2024-07-30T18:30:00.000Z",
        "title": "Q1 2025 Earnings Call",
        "icsUrl": "https://in.marketscreener.com/api/stateful/agenda/event-async/Q1-2025-Earnings-Call-47526244.ics"
      },
      {
        "section": "Past",
        "dateTimeRaw": "21/06/2024 11:30 am",
        "dateTimeISO": "2024-06-21T06:00:00.000Z",
        "title": "Phillip Capital Jewels of Bharat PSU Investor Conference",
        "icsUrl": "https://in.marketscreener.com/api/stateful/agenda/event-async/Phillip-Capital-Jewels-of-Bharat-PSU-Investor-Conference-46999093.ics"
      },
      {
        "section": "Past",
        "dateTimeRaw": "02/05/2024 06:13 pm",
        "dateTimeISO": "2024-05-02T12:43:00.000Z",
        "title": "Q4 2024 Earnings Release",
        "icsUrl": "https://in.marketscreener.com/api/stateful/agenda/event-async/Q4-2024-Earnings-Release-43696237.ics"
      },
      {
        "section": "Past",
        "dateTimeRaw": "02/05/2024",
        "dateTimeISO": "2024-05-01T18:30:00.000Z",
        "title": "Q4 2024 Earnings Call",
        "icsUrl": "https://in.marketscreener.com/api/stateful/agenda/event-async/Q4-2024-Earnings-Call-46618247.ics"
      },
      {
        "section": "Past",
        "dateTimeRaw": "20/02/2024",
        "dateTimeISO": "2024-02-19T18:30:00.000Z",
        "title": "Ex-dividend day for dividende intermédiaire",
        "icsUrl": "https://in.marketscreener.com/api/stateful/agenda/event-async/Ex-dividend-day-for-dividende-intermediaire-46023529.ics"
      },
      {
        "section": "Past",
        "dateTimeRaw": "19/02/2024 03:30 pm",
        "dateTimeISO": "2024-02-19T10:00:00.000Z",
        "title": "Q3 2024 Earnings Call",
        "icsUrl": "https://in.marketscreener.com/api/stateful/agenda/event-async/Q3-2024-Earnings-Call-46188790.ics"
      },
      {
        "section": "Past",
        "dateTimeRaw": "12/02/2024 06:58 pm",
        "dateTimeISO": "2024-02-12T13:28:00.000Z",
        "title": "Q3 2024 Earnings Release",
        "icsUrl": "https://in.marketscreener.com/api/stateful/agenda/event-async/Q3-2024-Earnings-Release-42786695.ics"
      },
      {
        "section": "Past",
        "dateTimeRaw": "21/11/2023 04:30 pm",
        "dateTimeISO": "2023-11-21T11:00:00.000Z",
        "title": "Q2 2024 Earnings Call",
        "icsUrl": "https://in.marketscreener.com/api/stateful/agenda/event-async/Q2-2024-Earnings-Call-45339728.ics"
      },
      {
        "section": "Past",
        "dateTimeRaw": "21/11/2023",
        "dateTimeISO": "2023-11-20T18:30:00.000Z",
        "title": "Ex-dividend day for dividende intermédiaire",
        "icsUrl": "https://in.marketscreener.com/api/stateful/agenda/event-async/Ex-dividend-day-for-dividende-intermediaire-45391553.ics"
      },
      {
        "section": "Past",
        "dateTimeRaw": "10/11/2023 04:34 pm",
        "dateTimeISO": "2023-11-10T11:04:00.000Z",
        "title": "Q2 2024 Earnings Release",
        "icsUrl": "https://in.marketscreener.com/api/stateful/agenda/event-async/Q2-2024-Earnings-Release-42154196.ics"
      },
      {
        "section": "Past",
        "dateTimeRaw": "23/08/2023 11:00 am",
        "dateTimeISO": "2023-08-23T05:30:00.000Z",
        "title": "Annual General Meeting",
        "icsUrl": "https://in.marketscreener.com/api/stateful/agenda/event-async/Annual-General-Meeting-44476530.ics"
      },
      {
        "section": "Past",
        "dateTimeRaw": "18/08/2023",
        "dateTimeISO": "2023-08-17T18:30:00.000Z",
        "title": "Final dividend",
        "icsUrl": "https://in.marketscreener.com/api/stateful/agenda/event-async/Final-dividend-44530806.ics"
      },
      {
        "section": "Past",
        "dateTimeRaw": "08/08/2023 05:27 pm",
        "dateTimeISO": "2023-08-08T11:57:00.000Z",
        "title": "Q1 2024 Earnings Release",
        "icsUrl": "https://in.marketscreener.com/api/stateful/agenda/event-async/Q1-2024-Earnings-Release-41309448.ics"
      },
      {
        "section": "Past",
        "dateTimeRaw": "08/08/2023",
        "dateTimeISO": "2023-08-07T18:30:00.000Z",
        "title": "Q1 2024 Earnings Call",
        "icsUrl": "https://in.marketscreener.com/api/stateful/agenda/event-async/Q1-2024-Earnings-Call-44573386.ics"
      },
      {
        "section": "Past",
        "dateTimeRaw": "17/05/2023",
        "dateTimeISO": "2023-05-16T18:30:00.000Z",
        "title": "Investor Meeting",
        "icsUrl": "https://in.marketscreener.com/api/stateful/agenda/event-async/Investor-Meeting-43915800.ics"
      },
      {
        "section": "Past",
        "dateTimeRaw": "10/05/2023 10:54 am",
        "dateTimeISO": "2023-05-10T05:24:00.000Z",
        "title": "Q4 2023 Earnings Release",
        "icsUrl": "https://in.marketscreener.com/api/stateful/agenda/event-async/Q4-2023-Earnings-Release-40578960.ics"
      },
      {
        "section": "Past",
        "dateTimeRaw": "07/05/2023",
        "dateTimeISO": "2023-05-06T18:30:00.000Z",
        "title": "Q4 2023 Earnings Call",
        "icsUrl": "https://in.marketscreener.com/api/stateful/agenda/event-async/Q4-2023-Earnings-Call-43902099.ics"
      },
      {
        "section": "Past",
        "dateTimeRaw": "08/02/2023",
        "dateTimeISO": "2023-02-07T18:30:00.000Z",
        "title": "Ex-dividend day for dividende intermédiaire",
        "icsUrl": "https://in.marketscreener.com/api/stateful/agenda/event-async/Ex-dividend-day-for-dividende-intermediaire-42958980.ics"
      },
      {
        "section": "Past",
        "dateTimeRaw": "31/01/2023 06:03 pm",
        "dateTimeISO": "2023-01-31T12:33:00.000Z",
        "title": "Q3 2023 Earnings Release",
        "icsUrl": "https://in.marketscreener.com/api/stateful/agenda/event-async/Q3-2023-Earnings-Release-37793921.ics"
      },
      {
        "section": "Past",
        "dateTimeRaw": "31/01/2023",
        "dateTimeISO": "2023-01-30T18:30:00.000Z",
        "title": "Q3 2023 Earnings Call",
        "icsUrl": "https://in.marketscreener.com/api/stateful/agenda/event-async/Q3-2023-Earnings-Call-42903035.ics"
      },
      {
        "section": "Past",
        "dateTimeRaw": "15/11/2022",
        "dateTimeISO": "2022-11-14T18:30:00.000Z",
        "title": "Ex-dividend day for dividende intermédiaire",
        "icsUrl": "https://in.marketscreener.com/api/stateful/agenda/event-async/Ex-dividend-day-for-dividende-intermediaire-42298596.ics"
      },
      {
        "section": "Past",
        "dateTimeRaw": "07/11/2022 07:17 pm",
        "dateTimeISO": "2022-11-07T13:47:00.000Z",
        "title": "Interim 2023 Earnings Release",
        "icsUrl": "https://in.marketscreener.com/api/stateful/agenda/event-async/Interim-2023-Earnings-Release-36844640.ics"
      },
      {
        "section": "Past",
        "dateTimeRaw": "30/08/2022 11:00 am",
        "dateTimeISO": "2022-08-30T05:30:00.000Z",
        "title": "Annual General Meeting",
        "icsUrl": "https://in.marketscreener.com/api/stateful/agenda/event-async/Annual-General-Meeting-41069022.ics"
      },
      {
        "section": "Past",
        "dateTimeRaw": "11/08/2022",
        "dateTimeISO": "2022-08-10T18:30:00.000Z",
        "title": "Ex-dividend day for final dividend",
        "icsUrl": "https://in.marketscreener.com/api/stateful/agenda/event-async/Ex-dividend-day-for-final-dividend-41070047.ics"
      },
      {
        "section": "Past",
        "dateTimeRaw": "10/08/2022 05:53 pm",
        "dateTimeISO": "2022-08-10T12:23:00.000Z",
        "title": "Q1 2023 Earnings Release",
        "icsUrl": "https://in.marketscreener.com/api/stateful/agenda/event-async/Q1-2023-Earnings-Release-36105857.ics"
      },
      {
        "section": "Past",
        "dateTimeRaw": "01/07/2022",
        "dateTimeISO": "2022-06-30T18:30:00.000Z",
        "title": "Q1 2023 Sales and Revenue Release - Production Results",
        "icsUrl": "https://in.marketscreener.com/api/stateful/agenda/event-async/Q1-2023-Sales-and-Revenue-Release-Production-Results-40946571.ics"
      },
      {
        "section": "Past",
        "dateTimeRaw": "25/05/2022",
        "dateTimeISO": "2022-05-24T18:30:00.000Z",
        "title": "FY 2022 Earnings Release",
        "icsUrl": "https://in.marketscreener.com/api/stateful/agenda/event-async/FY-2022-Earnings-Release-35592943.ics"
      },
      {
        "section": "Past",
        "dateTimeRaw": "24/05/2022",
        "dateTimeISO": "2022-05-23T18:30:00.000Z",
        "title": "FY 2022 Earnings Call",
        "icsUrl": "https://in.marketscreener.com/api/stateful/agenda/event-async/FY-2022-Earnings-Call-40578407.ics"
      },
      {
        "section": "Past",
        "dateTimeRaw": "06/05/2022 10:00 am",
        "dateTimeISO": "2022-05-06T04:30:00.000Z",
        "title": "Investor Meeting",
        "icsUrl": "https://in.marketscreener.com/api/stateful/agenda/event-async/Investor-Meeting-40578353.ics"
      },
      {
        "section": "Past",
        "dateTimeRaw": "21/02/2022",
        "dateTimeISO": "2022-02-20T18:30:00.000Z",
        "title": "Ex-dividend day for dividende intermédiaire",
        "icsUrl": "https://in.marketscreener.com/api/stateful/agenda/event-async/Ex-dividend-day-for-dividende-intermediaire-39527939.ics"
      },
      {
        "section": "Past",
        "dateTimeRaw": "17/02/2022 04:30 pm",
        "dateTimeISO": "2022-02-17T11:00:00.000Z",
        "title": "Q3 2022 Earnings Call",
        "icsUrl": "https://in.marketscreener.com/api/stateful/agenda/event-async/Q3-2022-Earnings-Call-38155181.ics"
      },
      {
        "section": "Past",
        "dateTimeRaw": "14/02/2022 05:34 pm",
        "dateTimeISO": "2022-02-14T12:04:00.000Z",
        "title": "Q3 2022 Earnings Release",
        "icsUrl": "https://in.marketscreener.com/api/stateful/agenda/event-async/Q3-2022-Earnings-Release-32320453.ics"
      },
      {
        "section": "Past",
        "dateTimeRaw": "06/12/2021",
        "dateTimeISO": "2021-12-05T18:30:00.000Z",
        "title": "Ex-dividend day for dividende intermédiaire",
        "icsUrl": "https://in.marketscreener.com/api/stateful/agenda/event-async/Ex-dividend-day-for-dividende-intermediaire-37219352.ics"
      },
      {
        "section": "Past",
        "dateTimeRaw": "24/11/2021 03:00 pm",
        "dateTimeISO": "2021-11-24T09:30:00.000Z",
        "title": "Interim 2022 Earnings Call",
        "icsUrl": "https://in.marketscreener.com/api/stateful/agenda/event-async/Interim-2022-Earnings-Call-37289717.ics"
      },
      {
        "section": "Past",
        "dateTimeRaw": "12/11/2021 06:26 pm",
        "dateTimeISO": "2021-11-12T12:56:00.000Z",
        "title": "Interim 2022 Earnings Release",
        "icsUrl": "https://in.marketscreener.com/api/stateful/agenda/event-async/Interim-2022-Earnings-Release-31664519.ics"
      },
      {
        "section": "Past",
        "dateTimeRaw": "21/09/2021 04:00 pm",
        "dateTimeISO": "2021-09-21T10:30:00.000Z",
        "title": "JP Morgan India Investor Summit",
        "icsUrl": "https://in.marketscreener.com/api/stateful/agenda/event-async/JP-Morgan-India-Investor-Summit-36519990.ics"
      },
      {
        "section": "Past",
        "dateTimeRaw": "15/09/2021 11:00 am",
        "dateTimeISO": "2021-09-15T05:30:00.000Z",
        "title": "Annual General Meeting",
        "icsUrl": "https://in.marketscreener.com/api/stateful/agenda/event-async/Annual-General-Meeting-36333472.ics"
      },
      {
        "section": "Past",
        "dateTimeRaw": "02/09/2021",
        "dateTimeISO": "2021-09-01T18:30:00.000Z",
        "title": "Ex-dividend day for final dividend",
        "icsUrl": "https://in.marketscreener.com/api/stateful/agenda/event-async/Ex-dividend-day-for-final-dividend-36218876.ics"
      },
      {
        "section": "Past",
        "dateTimeRaw": "12/08/2021 04:00 pm",
        "dateTimeISO": "2021-08-12T10:30:00.000Z",
        "title": "Q1 2022 Earnings Call",
        "icsUrl": "https://in.marketscreener.com/api/stateful/agenda/event-async/Q1-2022-Earnings-Call-36333103.ics"
      },
      {
        "section": "Past",
        "dateTimeRaw": "10/08/2021 02:22 pm",
        "dateTimeISO": "2021-08-10T08:52:00.000Z",
        "title": "Q1 2022 Earnings Release",
        "icsUrl": "https://in.marketscreener.com/api/stateful/agenda/event-async/Q1-2022-Earnings-Release-30768280.ics"
      },
      {
        "section": "Past",
        "dateTimeRaw": "17/06/2021 04:30 pm",
        "dateTimeISO": "2021-06-17T11:00:00.000Z",
        "title": "FY 2021 Earnings Call",
        "icsUrl": "https://in.marketscreener.com/api/stateful/agenda/event-async/FY-2021-Earnings-Call-35592799.ics"
      },
      {
        "section": "Past",
        "dateTimeRaw": "14/06/2021",
        "dateTimeISO": "2021-06-13T18:30:00.000Z",
        "title": "FY 2021 Earnings Release",
        "icsUrl": "https://in.marketscreener.com/api/stateful/agenda/event-async/FY-2021-Earnings-Release-31162545.ics"
      },
      {
        "section": "Past",
        "dateTimeRaw": "15/03/2021",
        "dateTimeISO": "2021-03-14T18:30:00.000Z",
        "title": "Ex-dividend day for dividende intermédiaire",
        "icsUrl": "https://in.marketscreener.com/api/stateful/agenda/event-async/Ex-dividend-day-for-dividende-intermediaire-32626095.ics"
      },
      {
        "section": "Past",
        "dateTimeRaw": "12/02/2021 04:00 pm",
        "dateTimeISO": "2021-02-12T10:30:00.000Z",
        "title": "Q3 2021 Earnings Call",
        "icsUrl": "https://in.marketscreener.com/api/stateful/agenda/event-async/Q3-2021-Earnings-Call-32379183.ics"
      },
      {
        "section": "Past",
        "dateTimeRaw": "11/02/2021",
        "dateTimeISO": "2021-02-10T18:30:00.000Z",
        "title": "Q3 2021 Earnings Release",
        "icsUrl": "https://in.marketscreener.com/api/stateful/agenda/event-async/Q3-2021-Earnings-Release-29965803.ics"
      },
      {
        "section": "Past",
        "dateTimeRaw": "19/11/2020",
        "dateTimeISO": "2020-11-18T18:30:00.000Z",
        "title": "Ex-dividend day for dividende intermédiaire",
        "icsUrl": "https://in.marketscreener.com/api/stateful/agenda/event-async/Ex-dividend-day-for-dividende-intermediaire-31786275.ics"
      },
      {
        "section": "Past",
        "dateTimeRaw": "12/11/2020 04:00 pm",
        "dateTimeISO": "2020-11-12T10:30:00.000Z",
        "title": "Interim 2021 Earnings Call",
        "icsUrl": "https://in.marketscreener.com/api/stateful/agenda/event-async/Interim-2021-Earnings-Call-31785098.ics"
      },
      {
        "section": "Past",
        "dateTimeRaw": "11/11/2020",
        "dateTimeISO": "2020-11-10T18:30:00.000Z",
        "title": "Interim 2021 Earnings Release",
        "icsUrl": "https://in.marketscreener.com/api/stateful/agenda/event-async/Interim-2021-Earnings-Release-29506024.ics"
      },
      {
        "section": "Past",
        "dateTimeRaw": "04/09/2020 04:00 pm",
        "dateTimeISO": "2020-09-04T10:30:00.000Z",
        "title": "Q1 2021 Earnings Call",
        "icsUrl": "https://in.marketscreener.com/api/stateful/agenda/event-async/Q1-2021-Earnings-Call-31239567.ics"
      },
      {
        "section": "Past",
        "dateTimeRaw": "02/09/2020",
        "dateTimeISO": "2020-09-01T18:30:00.000Z",
        "title": "Q1 2021 Earnings Release",
        "icsUrl": "https://in.marketscreener.com/api/stateful/agenda/event-async/Q1-2021-Earnings-Release-29010645.ics"
      },
      {
        "section": "Past",
        "dateTimeRaw": "29/06/2020 11:00 am",
        "dateTimeISO": "2020-06-29T05:30:00.000Z",
        "title": "FY 2020 Earnings Call",
        "icsUrl": "https://in.marketscreener.com/api/stateful/agenda/event-async/FY-2020-Earnings-Call-30837090.ics"
      },
      {
        "section": "Past",
        "dateTimeRaw": "26/06/2020",
        "dateTimeISO": "2020-06-25T18:30:00.000Z",
        "title": "FY 2020 Earnings Release",
        "icsUrl": "https://in.marketscreener.com/api/stateful/agenda/event-async/FY-2020-Earnings-Release-28897219.ics"
      },
      {
        "section": "Past",
        "dateTimeRaw": "28/05/2020 04:30 pm",
        "dateTimeISO": "2020-05-28T11:00:00.000Z",
        "title": "Business Update Call",
        "icsUrl": "https://in.marketscreener.com/api/stateful/agenda/event-async/Business-Update-Call-30700624.ics"
      },
      {
        "section": "Past",
        "dateTimeRaw": "19/03/2020",
        "dateTimeISO": "2020-03-18T18:30:00.000Z",
        "title": "Ex-dividend day for dividende intermédiaire",
        "icsUrl": "https://in.marketscreener.com/api/stateful/agenda/event-async/Ex-dividend-day-for-dividende-intermediaire-30164202.ics"
      },
      {
        "section": "Past",
        "dateTimeRaw": "11/02/2020",
        "dateTimeISO": "2020-02-10T18:30:00.000Z",
        "title": "Q3 2020 Earnings Release",
        "icsUrl": "https://in.marketscreener.com/api/stateful/agenda/event-async/Q3-2020-Earnings-Release-28304653.ics"
      },
      {
        "section": "Past",
        "dateTimeRaw": "11/11/2019",
        "dateTimeISO": "2019-11-10T18:30:00.000Z",
        "title": "Interim 2020 Earnings Call",
        "icsUrl": "https://in.marketscreener.com/api/stateful/agenda/event-async/Interim-2020-Earnings-Call-29589444.ics"
      },
      {
        "section": "Past",
        "dateTimeRaw": "11/11/2019",
        "dateTimeISO": "2019-11-10T18:30:00.000Z",
        "title": "Interim 2020 Earnings Release",
        "icsUrl": "https://in.marketscreener.com/api/stateful/agenda/event-async/Interim-2020-Earnings-Release-28296293.ics"
      },
      {
        "section": "Past",
        "dateTimeRaw": "21/08/2019 10:00 am",
        "dateTimeISO": "2019-08-21T04:30:00.000Z",
        "title": "Annual General Meeting",
        "icsUrl": "https://in.marketscreener.com/api/stateful/agenda/event-async/Annual-General-Meeting-29045542.ics"
      },
      {
        "section": "Past",
        "dateTimeRaw": "13/08/2019",
        "dateTimeISO": "2019-08-12T18:30:00.000Z",
        "title": "Q1 2020 Earnings Release",
        "icsUrl": "https://in.marketscreener.com/api/stateful/agenda/event-async/Q1-2020-Earnings-Release-26621364.ics"
      },
      {
        "section": "Past",
        "dateTimeRaw": "30/05/2019",
        "dateTimeISO": "2019-05-29T18:30:00.000Z",
        "title": "FY 2019 Earnings Release",
        "icsUrl": "https://in.marketscreener.com/api/stateful/agenda/event-async/FY-2019-Earnings-Release-26663414.ics"
      },
      {
        "section": "Past",
        "dateTimeRaw": "22/03/2019",
        "dateTimeISO": "2019-03-21T18:30:00.000Z",
        "title": "Ex-dividend day for dividende intermédiaire",
        "icsUrl": "https://in.marketscreener.com/api/stateful/agenda/event-async/Ex-dividend-day-for-dividende-intermediaire-28181152.ics"
      },
      {
        "section": "Past",
        "dateTimeRaw": "12/02/2019",
        "dateTimeISO": "2019-02-11T18:30:00.000Z",
        "title": "Q3 2019 Earnings Release",
        "icsUrl": "https://in.marketscreener.com/api/stateful/agenda/event-async/Q3-2019-Earnings-Release-26144439.ics"
      },
      {
        "section": "Past",
        "dateTimeRaw": "28/12/2018",
        "dateTimeISO": "2018-12-27T18:30:00.000Z",
        "title": "Ex-dividend day for dividende intermédiaire",
        "icsUrl": "https://in.marketscreener.com/api/stateful/agenda/event-async/Ex-dividend-day-for-dividende-intermediaire-27793144.ics"
      },
      {
        "section": "Past",
        "dateTimeRaw": "17/12/2018",
        "dateTimeISO": "2018-12-16T18:30:00.000Z",
        "title": "Interim 2019 Earnings Release",
        "icsUrl": "https://in.marketscreener.com/api/stateful/agenda/event-async/Interim-2019-Earnings-Release-25534594.ics"
      },
      {
        "section": "Past",
        "dateTimeRaw": "12/09/2018 10:00 am",
        "dateTimeISO": "2018-09-12T04:30:00.000Z",
        "title": "Annual General Meeting",
        "icsUrl": "https://in.marketscreener.com/api/stateful/agenda/event-async/Annual-General-Meeting-27230664.ics"
      },
      {
        "section": "Past",
        "dateTimeRaw": "11/08/2018",
        "dateTimeISO": "2018-08-10T18:30:00.000Z",
        "title": "Q1 2019 Earnings Release",
        "icsUrl": "https://in.marketscreener.com/api/stateful/agenda/event-async/Q1-2019-Earnings-Release-25390061.ics"
      },
      {
        "section": "Past",
        "dateTimeRaw": "29/05/2018",
        "dateTimeISO": "2018-05-28T18:30:00.000Z",
        "title": "FY 2018 Earnings Release",
        "icsUrl": "https://in.marketscreener.com/api/stateful/agenda/event-async/FY-2018-Earnings-Release-25388559.ics"
      },
      {
        "section": "Past",
        "dateTimeRaw": "16/03/2018",
        "dateTimeISO": "2018-03-15T18:30:00.000Z",
        "title": "Ex-dividend day for dividende intermédiaire",
        "icsUrl": "https://in.marketscreener.com/api/stateful/agenda/event-async/Ex-dividend-day-for-dividende-intermediaire-26186455.ics"
      },
      {
        "section": "Past",
        "dateTimeRaw": "10/02/2018",
        "dateTimeISO": "2018-02-09T18:30:00.000Z",
        "title": "Q3 2018 Earnings Release",
        "icsUrl": "https://in.marketscreener.com/api/stateful/agenda/event-async/Q3-2018-Earnings-Release-23774558.ics"
      },
      {
        "section": "Past",
        "dateTimeRaw": "11/11/2017",
        "dateTimeISO": "2017-11-10T18:30:00.000Z",
        "title": "Interim 2018 Earnings Release",
        "icsUrl": "https://in.marketscreener.com/api/stateful/agenda/event-async/Interim-2018-Earnings-Release-23773403.ics"
      },
      {
        "section": "Past",
        "dateTimeRaw": "14/09/2017 10:00 am",
        "dateTimeISO": "2017-09-14T04:30:00.000Z",
        "title": "Annual General Meeting",
        "icsUrl": "https://in.marketscreener.com/api/stateful/agenda/event-async/Annual-General-Meeting-25011055.ics"
      },
      {
        "section": "Past",
        "dateTimeRaw": "14/08/2017",
        "dateTimeISO": "2017-08-13T18:30:00.000Z",
        "title": "Q1 2018 Earnings Release",
        "icsUrl": "https://in.marketscreener.com/api/stateful/agenda/event-async/Q1-2018-Earnings-Release-23772372.ics"
      },
      {
        "section": "Past",
        "dateTimeRaw": "29/05/2017",
        "dateTimeISO": "2017-05-28T18:30:00.000Z",
        "title": "FY 2017 Earnings Release",
        "icsUrl": "https://in.marketscreener.com/api/stateful/agenda/event-async/FY-2017-Earnings-Release-22848205.ics"
      },
      {
        "section": "Past",
        "dateTimeRaw": "27/03/2017",
        "dateTimeISO": "2017-03-26T18:30:00.000Z",
        "title": "Ex-dividend day for dividende intermédiaire",
        "icsUrl": "https://in.marketscreener.com/api/stateful/agenda/event-async/Ex-dividend-day-for-dividende-intermediaire-24146162.ics"
      },
      {
        "section": "Past",
        "dateTimeRaw": "14/03/2017",
        "dateTimeISO": "2017-03-13T18:30:00.000Z",
        "title": "Ex-dividend day for dividende intermédiaire",
        "icsUrl": "https://in.marketscreener.com/api/stateful/agenda/event-async/Ex-dividend-day-for-dividende-intermediaire-24026977.ics"
      },
      {
        "section": "Past",
        "dateTimeRaw": "11/02/2017",
        "dateTimeISO": "2017-02-10T18:30:00.000Z",
        "title": "Q3 2017 Earnings Release",
        "icsUrl": "https://in.marketscreener.com/api/stateful/agenda/event-async/Q3-2017-Earnings-Release-22833345.ics"
      },
      {
        "section": "Past",
        "dateTimeRaw": "13/12/2016",
        "dateTimeISO": "2016-12-12T18:30:00.000Z",
        "title": "Interim 2017 Earnings Release",
        "icsUrl": "https://in.marketscreener.com/api/stateful/agenda/event-async/Interim-2017-Earnings-Release-19674952.ics"
      },
      {
        "section": "Past",
        "dateTimeRaw": "21/09/2016 10:00 am",
        "dateTimeISO": "2016-09-21T04:30:00.000Z",
        "title": "Annual General Meeting",
        "icsUrl": "https://in.marketscreener.com/api/stateful/agenda/event-async/Annual-General-Meeting-23002294.ics"
      },
      {
        "section": "Past",
        "dateTimeRaw": "09/09/2016",
        "dateTimeISO": "2016-09-08T18:30:00.000Z",
        "title": "Q1 2017 Earnings Release",
        "icsUrl": "https://in.marketscreener.com/api/stateful/agenda/event-async/Q1-2017-Earnings-Release-19666884.ics"
      },
      {
        "section": "Past",
        "dateTimeRaw": "28/05/2016",
        "dateTimeISO": "2016-05-27T18:30:00.000Z",
        "title": "FY 2016 Earnings Release",
        "icsUrl": "https://in.marketscreener.com/api/stateful/agenda/event-async/FY-2016-Earnings-Release-19661043.ics"
      },
      {
        "section": "Past",
        "dateTimeRaw": "14/03/2016",
        "dateTimeISO": "2016-03-13T18:30:00.000Z",
        "title": "Ex-dividend day for dividende intermédiaire",
        "icsUrl": "https://in.marketscreener.com/api/stateful/agenda/event-async/Ex-dividend-day-for-dividende-intermediaire-22006205.ics"
      },
      {
        "section": "Past",
        "dateTimeRaw": "11/02/2016",
        "dateTimeISO": "2016-02-10T18:30:00.000Z",
        "title": "Q3 2016 Earnings Release",
        "icsUrl": "https://in.marketscreener.com/api/stateful/agenda/event-async/Q3-2016-Earnings-Release-19650023.ics"
      },
      {
        "section": "Past",
        "dateTimeRaw": "09/11/2015",
        "dateTimeISO": "2015-11-08T18:30:00.000Z",
        "title": "Interim 2016 Earnings Release",
        "icsUrl": "https://in.marketscreener.com/api/stateful/agenda/event-async/Interim-2016-Earnings-Release-19182346.ics"
      },
      {
        "section": "Past",
        "dateTimeRaw": "23/09/2015 10:00 am",
        "dateTimeISO": "2015-09-23T04:30:00.000Z",
        "title": "Annual General Meeting",
        "icsUrl": "https://in.marketscreener.com/api/stateful/agenda/event-async/Annual-General-Meeting-20997790.ics"
      },
      {
        "section": "Past",
        "dateTimeRaw": "12/08/2015",
        "dateTimeISO": "2015-08-11T18:30:00.000Z",
        "title": "Q1 2016 Earnings Release",
        "icsUrl": "https://in.marketscreener.com/api/stateful/agenda/event-async/Q1-2016-Earnings-Release-18727769.ics"
      },
      {
        "section": "Past",
        "dateTimeRaw": "28/05/2015",
        "dateTimeISO": "2015-05-27T18:30:00.000Z",
        "title": "FY 2015 Earnings Release",
        "icsUrl": "https://in.marketscreener.com/api/stateful/agenda/event-async/FY-2015-Earnings-Release-18263057.ics"
      },
      {
        "section": "Past",
        "dateTimeRaw": "03/03/2015",
        "dateTimeISO": "2015-03-02T18:30:00.000Z",
        "title": "Ex-dividend day for dividende intermédiaire",
        "icsUrl": "https://in.marketscreener.com/api/stateful/agenda/event-async/Ex-dividend-day-for-dividende-intermediaire-19952835.ics"
      },
      {
        "section": "Past",
        "dateTimeRaw": "12/02/2015",
        "dateTimeISO": "2015-02-11T18:30:00.000Z",
        "title": "Q3 2015 Earnings Release",
        "icsUrl": "https://in.marketscreener.com/api/stateful/agenda/event-async/Q3-2015-Earnings-Release-17792035.ics"
      },
      {
        "section": "Past",
        "dateTimeRaw": "17/01/2014",
        "dateTimeISO": "2014-01-16T18:30:00.000Z",
        "title": "Ex-dividend day for dividende intermédiaire",
        "icsUrl": "https://in.marketscreener.com/api/stateful/agenda/event-async/Ex-dividend-day-for-dividende-intermediaire-17824834.ics"
      },
      {
        "section": "Past",
        "dateTimeRaw": "06/09/2013",
        "dateTimeISO": "2013-09-05T18:30:00.000Z",
        "title": "Ex-dividend day for final dividend",
        "icsUrl": "https://in.marketscreener.com/api/stateful/agenda/event-async/Ex-dividend-day-for-final-dividend-17182301.ics"
      },
      {
        "section": "Past",
        "dateTimeRaw": "18/03/2013",
        "dateTimeISO": "2013-03-17T18:30:00.000Z",
        "title": "Ex-dividend day for dividende intermédiaire",
        "icsUrl": "https://in.marketscreener.com/api/stateful/agenda/event-async/Ex-dividend-day-for-dividende-intermediaire-16545112.ics"
      },
      {
        "section": "Past",
        "dateTimeRaw": "06/09/2012",
        "dateTimeISO": "2012-09-05T18:30:00.000Z",
        "title": "Ex-dividend day for final dividend",
        "icsUrl": "https://in.marketscreener.com/api/stateful/agenda/event-async/Ex-dividend-day-for-final-dividend-15293386.ics"
      },
      {
        "section": "Past",
        "dateTimeRaw": "15/03/2012",
        "dateTimeISO": "2012-03-14T18:30:00.000Z",
        "title": "Ex-dividend day for dividende intermédiaire",
        "icsUrl": "https://in.marketscreener.com/api/stateful/agenda/event-async/Ex-dividend-day-for-dividende-intermediaire-15293387.ics"
      },
      {
        "section": "Past",
        "dateTimeRaw": "08/09/2011",
        "dateTimeISO": "2011-09-07T18:30:00.000Z",
        "title": "Ex-dividend day for final dividend",
        "icsUrl": "https://in.marketscreener.com/api/stateful/agenda/event-async/Ex-dividend-day-for-final-dividend-15293388.ics"
      }
    ]
  },
  "pastDividends": {
    "count": 31,
    "dividends": [
      {
        "section": "Past Dividends",
        "dateRaw": "21/08/2025",
        "dateISO": "2025-08-20T18:30:00.000Z",
        "type": "Final Payment",
        "amount": 5.15,
        "currency": "INR",
        "title": "Final Payment 5.15 INR"
      },
      {
        "section": "Past Dividends",
        "dateRaw": "06/08/2025",
        "dateISO": "2025-08-05T18:30:00.000Z",
        "type": "Interim Payment",
        "amount": 5.5,
        "currency": "INR",
        "title": "Interim Payment 5.5 INR"
      },
      {
        "section": "Past Dividends",
        "dateRaw": "31/01/2025",
        "dateISO": "2025-01-30T18:30:00.000Z",
        "type": "Interim Payment",
        "amount": 5.6,
        "currency": "INR",
        "title": "Interim Payment 5.6 INR"
      },
      {
        "section": "Past Dividends",
        "dateRaw": "05/11/2024",
        "dateISO": "2024-11-04T18:30:00.000Z",
        "type": "Interim Payment",
        "amount": 15.75,
        "currency": "INR",
        "title": "Interim Payment 15.75 INR"
      },
      {
        "section": "Past Dividends",
        "dateRaw": "16/08/2024",
        "dateISO": "2024-08-15T18:30:00.000Z",
        "type": "Final Payment",
        "amount": 5,
        "currency": "INR",
        "title": "Final Payment 5 INR"
      },
      {
        "section": "Past Dividends",
        "dateRaw": "20/02/2024",
        "dateISO": "2024-02-19T18:30:00.000Z",
        "type": "Interim Payment",
        "amount": 5.25,
        "currency": "INR",
        "title": "Interim Payment 5.25 INR"
      },
      {
        "section": "Past Dividends",
        "dateRaw": "21/11/2023",
        "dateISO": "2023-11-20T18:30:00.000Z",
        "type": "Interim Payment",
        "amount": 15.25,
        "currency": "INR",
        "title": "Interim Payment 15.25 INR"
      },
      {
        "section": "Past Dividends",
        "dateRaw": "18/08/2023",
        "dateISO": "2023-08-17T18:30:00.000Z",
        "type": "Final Payment",
        "amount": 4,
        "currency": "INR",
        "title": "Final Payment 4 INR"
      },
      {
        "section": "Past Dividends",
        "dateRaw": "08/02/2023",
        "dateISO": "2023-02-07T18:30:00.000Z",
        "type": "Interim Payment",
        "amount": 5.25,
        "currency": "INR",
        "title": "Interim Payment 5.25 INR"
      },
      {
        "section": "Past Dividends",
        "dateRaw": "15/11/2022",
        "dateISO": "2022-11-14T18:30:00.000Z",
        "type": "Interim Payment",
        "amount": 15,
        "currency": "INR",
        "title": "Interim Payment 15 INR"
      },
      {
        "section": "Past Dividends",
        "dateRaw": "11/08/2022",
        "dateISO": "2022-08-10T18:30:00.000Z",
        "type": "Final Payment",
        "amount": 3,
        "currency": "INR",
        "title": "Final Payment 3 INR"
      },
      {
        "section": "Past Dividends",
        "dateRaw": "21/02/2022",
        "dateISO": "2022-02-20T18:30:00.000Z",
        "type": "Interim Payment",
        "amount": 5,
        "currency": "INR",
        "title": "Interim Payment 5 INR"
      },
      {
        "section": "Past Dividends",
        "dateRaw": "06/12/2021",
        "dateISO": "2021-12-05T18:30:00.000Z",
        "type": "Interim Payment",
        "amount": 9,
        "currency": "INR",
        "title": "Interim Payment 9 INR"
      },
      {
        "section": "Past Dividends",
        "dateRaw": "02/09/2021",
        "dateISO": "2021-09-01T18:30:00.000Z",
        "type": "Final Payment",
        "amount": 3.5,
        "currency": "INR",
        "title": "Final Payment 3.5 INR"
      },
      {
        "section": "Past Dividends",
        "dateRaw": "15/03/2021",
        "dateISO": "2021-03-14T18:30:00.000Z",
        "type": "Interim Payment",
        "amount": 5,
        "currency": "INR",
        "title": "Interim Payment 5 INR"
      },
      {
        "section": "Past Dividends",
        "dateRaw": "19/11/2020",
        "dateISO": "2020-11-18T18:30:00.000Z",
        "type": "Interim Payment",
        "amount": 7.5,
        "currency": "INR",
        "title": "Interim Payment 7.5 INR"
      },
      {
        "section": "Past Dividends",
        "dateRaw": "19/03/2020",
        "dateISO": "2020-03-18T18:30:00.000Z",
        "type": "Interim Payment",
        "amount": 12,
        "currency": "INR",
        "title": "Interim Payment 12 INR"
      },
      {
        "section": "Past Dividends",
        "dateRaw": "22/03/2019",
        "dateISO": "2019-03-21T18:30:00.000Z",
        "type": "Interim Payment",
        "amount": 5.85,
        "currency": "INR",
        "title": "Interim Payment 5.85 INR"
      },
      {
        "section": "Past Dividends",
        "dateRaw": "28/12/2018",
        "dateISO": "2018-12-27T18:30:00.000Z",
        "type": "Interim Payment",
        "amount": 7.25,
        "currency": "INR",
        "title": "Interim Payment 7.25 INR"
      },
      {
        "section": "Past Dividends",
        "dateRaw": "16/03/2018",
        "dateISO": "2018-03-15T18:30:00.000Z",
        "type": "Interim Payment",
        "amount": 16.5,
        "currency": "INR",
        "title": "Interim Payment 16.5 INR"
      },
      {
        "section": "Past Dividends",
        "dateRaw": "27/03/2017",
        "dateISO": "2017-03-26T18:30:00.000Z",
        "type": "Interim Payment",
        "amount": 1.15,
        "currency": "INR",
        "title": "Interim Payment 1.15 INR"
      },
      {
        "section": "Past Dividends",
        "dateRaw": "14/03/2017",
        "dateISO": "2017-03-13T18:30:00.000Z",
        "type": "Interim Payment",
        "amount": 18.75,
        "currency": "INR",
        "title": "Interim Payment 18.75 INR"
      },
      {
        "section": "Past Dividends",
        "dateRaw": "14/03/2016",
        "dateISO": "2016-03-13T18:30:00.000Z",
        "type": "Interim Payment",
        "amount": 27.4,
        "currency": "INR",
        "title": "Interim Payment 27.4 INR"
      },
      {
        "section": "Past Dividends",
        "dateRaw": "03/03/2015",
        "dateISO": "2015-03-02T18:30:00.000Z",
        "type": "20.7 INR",
        "amount": null,
        "currency": null,
        "title": "20.7 INR"
      },
      {
        "section": "Past Dividends",
        "dateRaw": "17/01/2014",
        "dateISO": "2014-01-16T18:30:00.000Z",
        "type": "Interim Payment",
        "amount": 29,
        "currency": "INR",
        "title": "Interim Payment 29 INR"
      },
      {
        "section": "Past Dividends",
        "dateRaw": "06/09/2013",
        "dateISO": "2013-09-05T18:30:00.000Z",
        "type": "Final Payment",
        "amount": 4.3,
        "currency": "INR",
        "title": "Final Payment 4.3 INR"
      },
      {
        "section": "Past Dividends",
        "dateRaw": "18/03/2013",
        "dateISO": "2013-03-17T18:30:00.000Z",
        "type": "Interim Payment",
        "amount": 9.7,
        "currency": "INR",
        "title": "Interim Payment 9.7 INR"
      },
      {
        "section": "Past Dividends",
        "dateRaw": "06/09/2012",
        "dateISO": "2012-09-05T18:30:00.000Z",
        "type": "Final Payment",
        "amount": 0.5,
        "currency": "INR",
        "title": "Final Payment 0.5 INR"
      },
      {
        "section": "Past Dividends",
        "dateRaw": "15/03/2012",
        "dateISO": "2012-03-14T18:30:00.000Z",
        "type": "Interim Payment",
        "amount": 9.5,
        "currency": "INR",
        "title": "Interim Payment 9.5 INR"
      },
      {
        "section": "Past Dividends",
        "dateRaw": "08/09/2011",
        "dateISO": "2011-09-07T18:30:00.000Z",
        "type": "Final Payment",
        "amount": 0.4,
        "currency": "INR",
        "title": "Final Payment 0.4 INR"
      },
      {
        "section": "Past Dividends",
        "dateRaw": "18/02/2011",
        "dateISO": "2011-02-17T18:30:00.000Z",
        "type": "Interim Payment",
        "amount": 3.5,
        "currency": "INR",
        "title": "Interim Payment 3.5 INR"
      }
    ]
  }
}