{
  "companyCode": "DABUR-INDIA-LIMITED-9058822",
  "timestamp": "2025-10-13T12:16:33.259Z",
  "annualResults": {
    "2023": {
      "Net salesMillion INR": {
        "metric": "Net salesMillion INR",
        "unit": "Million INR",
        "fiscalMonth": "March",
        "year": "2023",
        "released": "115 299",
        "forecast": "117 001",
        "spreadRaw": "-1.45%"
      },
      "EBITDAMillion INR": {
        "metric": "EBITDAMillion INR",
        "unit": "Million INR",
        "fiscalMonth": "March",
        "year": "2023",
        "released": "21 641",
        "forecast": "23 326",
        "spreadRaw": "-7.22%"
      },
      "EBITMillion INR": {
        "metric": "EBITMillion INR",
        "unit": "Million INR",
        "fiscalMonth": "March",
        "year": "2023",
        "released": "18 515",
        "forecast": "20 545",
        "spreadRaw": "-9.88%"
      },
      "Earnings before Tax (EBT)Million INR": {
        "metric": "Earnings before Tax (EBT)Million INR",
        "unit": "Million INR",
        "fiscalMonth": "March",
        "year": "2023",
        "released": "22 187",
        "forecast": "24 303",
        "spreadRaw": "-8.71%"
      },
      "Net incomeMillion INR": {
        "metric": "Net incomeMillion INR",
        "unit": "Million INR",
        "fiscalMonth": "March",
        "year": "2023",
        "released": "17 072",
        "forecast": "18 659",
        "spreadRaw": "-8.51%"
      },
      "EPS INR": {
        "metric": "EPS INR",
        "unit": "INR",
        "fiscalMonth": "March",
        "year": "2023",
        "released": "9,61",
        "forecast": "10,6",
        "spreadRaw": "-9.6%"
      },
      "Announcement Date": {
        "metric": "Announcement Date",
        "unit": null,
        "fiscalMonth": "March",
        "year": "2023",
        "released": "04/05/23",
        "forecast": null,
        "spreadRaw": null
      }
    },
    "2024": {
      "Net salesMillion INR": {
        "metric": "Net salesMillion INR",
        "unit": "Million INR",
        "fiscalMonth": "March",
        "year": "2024",
        "released": "124 040",
        "forecast": "124 825",
        "spreadRaw": "-0.63%"
      },
      "EBITDAMillion INR": {
        "metric": "EBITDAMillion INR",
        "unit": "Million INR",
        "fiscalMonth": "March",
        "year": "2024",
        "released": "23 997",
        "forecast": "24 472",
        "spreadRaw": "-1.94%"
      },
      "EBITMillion INR": {
        "metric": "EBITMillion INR",
        "unit": "Million INR",
        "fiscalMonth": "March",
        "year": "2024",
        "released": "20 005",
        "forecast": "20 462",
        "spreadRaw": "-2.24%"
      },
      "Earnings before Tax (EBT)Million INR": {
        "metric": "Earnings before Tax (EBT)Million INR",
        "unit": "Million INR",
        "fiscalMonth": "March",
        "year": "2024",
        "released": "23 587",
        "forecast": "24 423",
        "spreadRaw": "-3.42%"
      },
      "Net incomeMillion INR": {
        "metric": "Net incomeMillion INR",
        "unit": "Million INR",
        "fiscalMonth": "March",
        "year": "2024",
        "released": "18 427",
        "forecast": "18 891",
        "spreadRaw": "-2.46%"
      },
      "EPS INR": {
        "metric": "EPS INR",
        "unit": "INR",
        "fiscalMonth": "March",
        "year": "2024",
        "released": "10,4",
        "forecast": "10,8",
        "spreadRaw": "-3.98%"
      },
      "Announcement Date": {
        "metric": "Announcement Date",
        "unit": null,
        "fiscalMonth": "March",
        "year": "2024",
        "released": "02/05/24",
        "forecast": null,
        "spreadRaw": null
      }
    },
    "2025": {
      "Net salesMillion INR": {
        "metric": "Net salesMillion INR",
        "unit": "Million INR",
        "fiscalMonth": "March",
        "year": "2025",
        "released": "125 631",
        "forecast": "126 797",
        "spreadRaw": "-0.92%"
      },
      "EBITDAMillion INR": {
        "metric": "EBITDAMillion INR",
        "unit": "Million INR",
        "fiscalMonth": "March",
        "year": "2025",
        "released": "23 163",
        "forecast": "23 821",
        "spreadRaw": "-2.76%"
      },
      "EBITMillion INR": {
        "metric": "EBITMillion INR",
        "unit": "Million INR",
        "fiscalMonth": "March",
        "year": "2025",
        "released": "18 707",
        "forecast": "19 318",
        "spreadRaw": "-3.16%"
      },
      "Earnings before Tax (EBT)Million INR": {
        "metric": "Earnings before Tax (EBT)Million INR",
        "unit": "Million INR",
        "fiscalMonth": "March",
        "year": "2025",
        "released": "22 579",
        "forecast": "23 647",
        "spreadRaw": "-4.52%"
      },
      "Net incomeMillion INR": {
        "metric": "Net incomeMillion INR",
        "unit": "Million INR",
        "fiscalMonth": "March",
        "year": "2025",
        "released": "17 676",
        "forecast": "18 274",
        "spreadRaw": "-3.27%"
      },
      "EPS INR": {
        "metric": "EPS INR",
        "unit": "INR",
        "fiscalMonth": "March",
        "year": "2025",
        "released": "9,95",
        "forecast": "10,3",
        "spreadRaw": "-3.48%"
      },
      "Announcement Date": {
        "metric": "Announcement Date",
        "unit": null,
        "fiscalMonth": "March",
        "year": "2025",
        "released": "07/05/25",
        "forecast": null,
        "spreadRaw": null
      }
    },
    "2026": {
      "Net salesMillion INR": {
        "metric": "Net salesMillion INR",
        "unit": "Million INR",
        "fiscalMonth": "March",
        "year": "2026",
        "released": null,
        "forecast": "134 992",
        "spreadRaw": null
      },
      "EBITDAMillion INR": {
        "metric": "EBITDAMillion INR",
        "unit": "Million INR",
        "fiscalMonth": "March",
        "year": "2026",
        "released": null,
        "forecast": "25 534",
        "spreadRaw": null
      },
      "EBITMillion INR": {
        "metric": "EBITMillion INR",
        "unit": "Million INR",
        "fiscalMonth": "March",
        "year": "2026",
        "released": null,
        "forecast": "20 586",
        "spreadRaw": null
      },
      "Earnings before Tax (EBT)Million INR": {
        "metric": "Earnings before Tax (EBT)Million INR",
        "unit": "Million INR",
        "fiscalMonth": "March",
        "year": "2026",
        "released": null,
        "forecast": "25 388",
        "spreadRaw": null
      },
      "Net incomeMillion INR": {
        "metric": "Net incomeMillion INR",
        "unit": "Million INR",
        "fiscalMonth": "March",
        "year": "2026",
        "released": null,
        "forecast": "19 619",
        "spreadRaw": null
      },
      "EPS INR": {
        "metric": "EPS INR",
        "unit": "INR",
        "fiscalMonth": "March",
        "year": "2026",
        "released": null,
        "forecast": "11,0",
        "spreadRaw": null
      },
      "Announcement Date": {
        "metric": "Announcement Date",
        "unit": null,
        "fiscalMonth": "March",
        "year": "2026",
        "released": "-",
        "forecast": null,
        "spreadRaw": null
      }
    },
    "2027": {
      "Net salesMillion INR": {
        "metric": "Net salesMillion INR",
        "unit": "Million INR",
        "fiscalMonth": "March",
        "year": "2027",
        "released": null,
        "forecast": "146 155",
        "spreadRaw": null
      },
      "EBITDAMillion INR": {
        "metric": "EBITDAMillion INR",
        "unit": "Million INR",
        "fiscalMonth": "March",
        "year": "2027",
        "released": null,
        "forecast": "28 311",
        "spreadRaw": null
      },
      "EBITMillion INR": {
        "metric": "EBITMillion INR",
        "unit": "Million INR",
        "fiscalMonth": "March",
        "year": "2027",
        "released": null,
        "forecast": "23 298",
        "spreadRaw": null
      },
      "Earnings before Tax (EBT)Million INR": {
        "metric": "Earnings before Tax (EBT)Million INR",
        "unit": "Million INR",
        "fiscalMonth": "March",
        "year": "2027",
        "released": null,
        "forecast": "28 387",
        "spreadRaw": null
      },
      "Net incomeMillion INR": {
        "metric": "Net incomeMillion INR",
        "unit": "Million INR",
        "fiscalMonth": "March",
        "year": "2027",
        "released": null,
        "forecast": "21 830",
        "spreadRaw": null
      },
      "EPS INR": {
        "metric": "EPS INR",
        "unit": "INR",
        "fiscalMonth": "March",
        "year": "2027",
        "released": null,
        "forecast": "12,3",
        "spreadRaw": null
      },
      "Announcement Date": {
        "metric": "Announcement Date",
        "unit": null,
        "fiscalMonth": "March",
        "year": "2027",
        "released": null,
        "forecast": null,
        "spreadRaw": null
      }
    },
    "2028": {
      "Net salesMillion INR": {
        "metric": "Net salesMillion INR",
        "unit": "Million INR",
        "fiscalMonth": "March",
        "year": "2028",
        "released": null,
        "forecast": "158 576",
        "spreadRaw": null
      },
      "EBITDAMillion INR": {
        "metric": "EBITDAMillion INR",
        "unit": "Million INR",
        "fiscalMonth": "March",
        "year": "2028",
        "released": null,
        "forecast": "31 158",
        "spreadRaw": null
      },
      "EBITMillion INR": {
        "metric": "EBITMillion INR",
        "unit": "Million INR",
        "fiscalMonth": "March",
        "year": "2028",
        "released": null,
        "forecast": "25 931",
        "spreadRaw": null
      },
      "Earnings before Tax (EBT)Million INR": {
        "metric": "Earnings before Tax (EBT)Million INR",
        "unit": "Million INR",
        "fiscalMonth": "March",
        "year": "2028",
        "released": null,
        "forecast": "31 922",
        "spreadRaw": null
      },
      "Net incomeMillion INR": {
        "metric": "Net incomeMillion INR",
        "unit": "Million INR",
        "fiscalMonth": "March",
        "year": "2028",
        "released": null,
        "forecast": "24 332",
        "spreadRaw": null
      },
      "EPS INR": {
        "metric": "EPS INR",
        "unit": "INR",
        "fiscalMonth": "March",
        "year": "2028",
        "released": null,
        "forecast": "13,7",
        "spreadRaw": null
      },
      "Announcement Date": {
        "metric": "Announcement Date",
        "unit": null,
        "fiscalMonth": "March",
        "year": "2028",
        "released": null,
        "forecast": null,
        "spreadRaw": null
      }
    }
  },
  "quarterlyResults": {
    "2024 Q2": {
      "Net salesMillion INR": {
        "metric": "Net salesMillion INR",
        "unit": "Million INR",
        "fiscalMonth": "March",
        "period": "2024 Q2",
        "released": "32 038",
        "releasedNum": 32038,
        "forecast": "32 259",
        "forecastNum": 32259,
        "spreadRaw": "-0.68%",
        "spreadPct": -0.68
      },
      "EBITDAMillion INR": {
        "metric": "EBITDAMillion INR",
        "unit": "Million INR",
        "fiscalMonth": "March",
        "period": "2024 Q2",
        "released": "6 614",
        "releasedNum": 6614,
        "forecast": "6 519",
        "forecastNum": 6519,
        "spreadRaw": "1.45%",
        "spreadPct": 1.45
      },
      "EBITMillion INR": {
        "metric": "EBITMillion INR",
        "unit": "Million INR",
        "fiscalMonth": "March",
        "period": "2024 Q2",
        "released": "5 630",
        "releasedNum": 5630,
        "forecast": "5 712",
        "forecastNum": 5712,
        "spreadRaw": "-1.43%",
        "spreadPct": -1.43
      },
      "Earnings before Tax (EBT)Million INR": {
        "metric": "Earnings before Tax (EBT)Million INR",
        "unit": "Million INR",
        "fiscalMonth": "March",
        "period": "2024 Q2",
        "released": "6 513",
        "releasedNum": 6513,
        "forecast": "6 772",
        "forecastNum": 6772,
        "spreadRaw": "-3.82%",
        "spreadPct": -3.82
      },
      "Net incomeMillion INR": {
        "metric": "Net incomeMillion INR",
        "unit": "Million INR",
        "fiscalMonth": "March",
        "period": "2024 Q2",
        "released": "5 151",
        "releasedNum": 5151,
        "forecast": "5 186",
        "forecastNum": 5186,
        "spreadRaw": "-0.68%",
        "spreadPct": -0.68
      },
      "EPS INR": {
        "metric": "EPS INR",
        "unit": "INR",
        "fiscalMonth": "March",
        "period": "2024 Q2",
        "released": "2,90",
        "releasedNum": 2.9,
        "forecast": "2,90",
        "forecastNum": 2.9,
        "spreadRaw": "0.06%",
        "spreadPct": 0.06
      },
      "Announcement Date": {
        "metric": "Announcement Date",
        "unit": null,
        "fiscalMonth": "March",
        "period": "2024 Q2",
        "released": "02/11/23",
        "releasedDate": "02/11/23",
        "forecast": null,
        "spreadRaw": null,
        "spreadPct": null
      }
    },
    "2024 Q3": {
      "Net salesMillion INR": {
        "metric": "Net salesMillion INR",
        "unit": "Million INR",
        "fiscalMonth": "March",
        "period": "2024 Q3",
        "released": "32 551",
        "releasedNum": 32551,
        "forecast": "32 652",
        "forecastNum": 32652,
        "spreadRaw": "-0.31%",
        "spreadPct": -0.31
      },
      "EBITDAMillion INR": {
        "metric": "EBITDAMillion INR",
        "unit": "Million INR",
        "fiscalMonth": "March",
        "period": "2024 Q3",
        "released": "6 674",
        "releasedNum": 6674,
        "forecast": "6 699",
        "forecastNum": 6699,
        "spreadRaw": "-0.36%",
        "spreadPct": -0.36
      },
      "EBITMillion INR": {
        "metric": "EBITMillion INR",
        "unit": "Million INR",
        "fiscalMonth": "March",
        "period": "2024 Q3",
        "released": "5 705",
        "releasedNum": 5705,
        "forecast": "5 798",
        "forecastNum": 5798,
        "spreadRaw": "-1.6%",
        "spreadPct": -1.6
      },
      "Earnings before Tax (EBT)Million INR": {
        "metric": "Earnings before Tax (EBT)Million INR",
        "unit": "Million INR",
        "fiscalMonth": "March",
        "period": "2024 Q3",
        "released": "6 614",
        "releasedNum": 6614,
        "forecast": "6 674",
        "forecastNum": 6674,
        "spreadRaw": "-0.9%",
        "spreadPct": -0.9
      },
      "Net incomeMillion INR": {
        "metric": "Net incomeMillion INR",
        "unit": "Million INR",
        "fiscalMonth": "March",
        "period": "2024 Q3",
        "released": "5 142",
        "releasedNum": 5142,
        "forecast": "5 169",
        "forecastNum": 5169,
        "spreadRaw": "-0.52%",
        "spreadPct": -0.52
      },
      "EPS INR": {
        "metric": "EPS INR",
        "unit": "INR",
        "fiscalMonth": "March",
        "period": "2024 Q3",
        "released": "2,90",
        "releasedNum": 2.9,
        "forecast": "2,93",
        "forecastNum": 2.93,
        "spreadRaw": "-0.97%",
        "spreadPct": -0.97
      },
      "Announcement Date": {
        "metric": "Announcement Date",
        "unit": null,
        "fiscalMonth": "March",
        "period": "2024 Q3",
        "released": "31/01/24",
        "releasedDate": "31/01/24",
        "forecast": null,
        "spreadRaw": null,
        "spreadPct": null
      }
    },
    "2024 Q4": {
      "Net salesMillion INR": {
        "metric": "Net salesMillion INR",
        "unit": "Million INR",
        "fiscalMonth": "March",
        "period": "2024 Q4",
        "released": "28 146",
        "releasedNum": 28146,
        "forecast": "28 264",
        "forecastNum": 28264,
        "spreadRaw": "-0.42%",
        "spreadPct": -0.42
      },
      "EBITDAMillion INR": {
        "metric": "EBITDAMillion INR",
        "unit": "Million INR",
        "fiscalMonth": "March",
        "period": "2024 Q4",
        "released": "4 664",
        "releasedNum": 4664,
        "forecast": "4 595",
        "forecastNum": 4595,
        "spreadRaw": "1.5%",
        "spreadPct": 1.5
      },
      "EBITMillion INR": {
        "metric": "EBITMillion INR",
        "unit": "Million INR",
        "fiscalMonth": "March",
        "period": "2024 Q4",
        "released": "3 591",
        "releasedNum": 3591,
        "forecast": "4 127",
        "forecastNum": 4127,
        "spreadRaw": "-13.01%",
        "spreadPct": -13.01
      },
      "Earnings before Tax (EBT)Million INR": {
        "metric": "Earnings before Tax (EBT)Million INR",
        "unit": "Million INR",
        "fiscalMonth": "March",
        "period": "2024 Q4",
        "released": "4 527",
        "releasedNum": 4527,
        "forecast": "4 466",
        "forecastNum": 4466,
        "spreadRaw": "1.35%",
        "spreadPct": 1.35
      },
      "Net incomeMillion INR": {
        "metric": "Net incomeMillion INR",
        "unit": "Million INR",
        "fiscalMonth": "March",
        "period": "2024 Q4",
        "released": "3 495",
        "releasedNum": 3495,
        "forecast": "3 476",
        "forecastNum": 3476,
        "spreadRaw": "0.55%",
        "spreadPct": 0.55
      },
      "EPS INR": {
        "metric": "EPS INR",
        "unit": "INR",
        "fiscalMonth": "March",
        "period": "2024 Q4",
        "released": "1,97",
        "releasedNum": 1.97,
        "forecast": "1,97",
        "forecastNum": 1.97,
        "spreadRaw": "0.2%",
        "spreadPct": 0.2
      },
      "Announcement Date": {
        "metric": "Announcement Date",
        "unit": null,
        "fiscalMonth": "March",
        "period": "2024 Q4",
        "released": "02/05/24",
        "releasedDate": "02/05/24",
        "forecast": null,
        "spreadRaw": null,
        "spreadPct": null
      }
    },
    "2025 Q1": {
      "Net salesMillion INR": {
        "metric": "Net salesMillion INR",
        "unit": "Million INR",
        "fiscalMonth": "March",
        "period": "2025 Q1",
        "released": "33 491",
        "releasedNum": 33491,
        "forecast": "33 483",
        "forecastNum": 33483,
        "spreadRaw": "0.02%",
        "spreadPct": 0.02
      },
      "EBITDAMillion INR": {
        "metric": "EBITDAMillion INR",
        "unit": "Million INR",
        "fiscalMonth": "March",
        "period": "2025 Q1",
        "released": "6 548",
        "releasedNum": 6548,
        "forecast": "6 607",
        "forecastNum": 6607,
        "spreadRaw": "-0.89%",
        "spreadPct": -0.89
      },
      "EBITMillion INR": {
        "metric": "EBITMillion INR",
        "unit": "Million INR",
        "fiscalMonth": "March",
        "period": "2025 Q1",
        "released": "5 457",
        "releasedNum": 5457,
        "forecast": "5 498",
        "forecastNum": 5498,
        "spreadRaw": "-0.74%",
        "spreadPct": -0.74
      },
      "Earnings before Tax (EBT)Million INR": {
        "metric": "Earnings before Tax (EBT)Million INR",
        "unit": "Million INR",
        "fiscalMonth": "March",
        "period": "2025 Q1",
        "released": "6 425",
        "releasedNum": 6425,
        "forecast": "6 473",
        "forecastNum": 6473,
        "spreadRaw": "-0.75%",
        "spreadPct": -0.75
      },
      "Net incomeMillion INR": {
        "metric": "Net incomeMillion INR",
        "unit": "Million INR",
        "fiscalMonth": "March",
        "period": "2025 Q1",
        "released": "5 001",
        "releasedNum": 5001,
        "forecast": "5 028",
        "forecastNum": 5028,
        "spreadRaw": "-0.53%",
        "spreadPct": -0.53
      },
      "EPS INR": {
        "metric": "EPS INR",
        "unit": "INR",
        "fiscalMonth": "March",
        "period": "2025 Q1",
        "released": "2,82",
        "releasedNum": 2.82,
        "forecast": "2,82",
        "forecastNum": 2.82,
        "spreadRaw": "0%",
        "spreadPct": 0
      },
      "Announcement Date": {
        "metric": "Announcement Date",
        "unit": null,
        "fiscalMonth": "March",
        "period": "2025 Q1",
        "released": "01/08/24",
        "releasedDate": "01/08/24",
        "forecast": null,
        "spreadRaw": null,
        "spreadPct": null
      }
    },
    "2025 Q2": {
      "Net salesMillion INR": {
        "metric": "Net salesMillion INR",
        "unit": "Million INR",
        "fiscalMonth": "March",
        "period": "2025 Q2",
        "released": "30 286",
        "releasedNum": 30286,
        "forecast": "30 624",
        "forecastNum": 30624,
        "spreadRaw": "-1.1%",
        "spreadPct": -1.1
      },
      "EBITDAMillion INR": {
        "metric": "EBITDAMillion INR",
        "unit": "Million INR",
        "fiscalMonth": "March",
        "period": "2025 Q2",
        "released": "5 528",
        "releasedNum": 5528,
        "forecast": "5 633",
        "forecastNum": 5633,
        "spreadRaw": "-1.86%",
        "spreadPct": -1.86
      },
      "EBITMillion INR": {
        "metric": "EBITMillion INR",
        "unit": "Million INR",
        "fiscalMonth": "March",
        "period": "2025 Q2",
        "released": "4 418",
        "releasedNum": 4418,
        "forecast": "4 664",
        "forecastNum": 4664,
        "spreadRaw": "-5.27%",
        "spreadPct": -5.27
      },
      "Earnings before Tax (EBT)Million INR": {
        "metric": "Earnings before Tax (EBT)Million INR",
        "unit": "Million INR",
        "fiscalMonth": "March",
        "period": "2025 Q2",
        "released": "5 460",
        "releasedNum": 5460,
        "forecast": "5 464",
        "forecastNum": 5464,
        "spreadRaw": "-0.08%",
        "spreadPct": -0.08
      },
      "Net incomeMillion INR": {
        "metric": "Net incomeMillion INR",
        "unit": "Million INR",
        "fiscalMonth": "March",
        "period": "2025 Q2",
        "released": "4 250",
        "releasedNum": 4250,
        "forecast": "4 464",
        "forecastNum": 4464,
        "spreadRaw": "-4.79%",
        "spreadPct": -4.79
      },
      "EPS INR": {
        "metric": "EPS INR",
        "unit": "INR",
        "fiscalMonth": "March",
        "period": "2025 Q2",
        "released": "2,39",
        "releasedNum": 2.39,
        "forecast": "2,46",
        "forecastNum": 2.46,
        "spreadRaw": "-2.95%",
        "spreadPct": -2.95
      },
      "Announcement Date": {
        "metric": "Announcement Date",
        "unit": null,
        "fiscalMonth": "March",
        "period": "2025 Q2",
        "released": "30/10/24",
        "releasedDate": "30/10/24",
        "forecast": null,
        "spreadRaw": null,
        "spreadPct": null
      }
    },
    "2025 S1": {
      "Net salesMillion INR": {
        "metric": "Net salesMillion INR",
        "unit": "Million INR",
        "fiscalMonth": "March",
        "period": "2025 S1",
        "released": "63 717",
        "releasedNum": 63717,
        "forecast": "64 015",
        "forecastNum": 64015,
        "spreadRaw": "-0.47%",
        "spreadPct": -0.47
      },
      "EBITDAMillion INR": {
        "metric": "EBITDAMillion INR",
        "unit": "Million INR",
        "fiscalMonth": "March",
        "period": "2025 S1",
        "released": "12 076",
        "releasedNum": 12076,
        "forecast": "12 046",
        "forecastNum": 12046,
        "spreadRaw": "0.25%",
        "spreadPct": 0.25
      },
      "EBITMillion INR": {
        "metric": "EBITMillion INR",
        "unit": "Million INR",
        "fiscalMonth": "March",
        "period": "2025 S1",
        "released": null,
        "releasedNum": null,
        "forecast": null,
        "forecastNum": null,
        "spreadRaw": null,
        "spreadPct": null
      },
      "Earnings before Tax (EBT)Million INR": {
        "metric": "Earnings before Tax (EBT)Million INR",
        "unit": "Million INR",
        "fiscalMonth": "March",
        "period": "2025 S1",
        "released": "11 884",
        "releasedNum": 11884,
        "forecast": "11 837",
        "forecastNum": 11837,
        "spreadRaw": "0.4%",
        "spreadPct": 0.4
      },
      "Net incomeMillion INR": {
        "metric": "Net incomeMillion INR",
        "unit": "Million INR",
        "fiscalMonth": "March",
        "period": "2025 S1",
        "released": "9 251",
        "releasedNum": 9251,
        "forecast": "9 268",
        "forecastNum": 9268,
        "spreadRaw": "-0.18%",
        "spreadPct": -0.18
      },
      "EPS INR": {
        "metric": "EPS INR",
        "unit": "INR",
        "fiscalMonth": "March",
        "period": "2025 S1",
        "released": "5,21",
        "releasedNum": 5.21,
        "forecast": "5,20",
        "forecastNum": 5.2,
        "spreadRaw": "0.19%",
        "spreadPct": 0.19
      },
      "Announcement Date": {
        "metric": "Announcement Date",
        "unit": null,
        "fiscalMonth": "March",
        "period": "2025 S1",
        "released": "30/10/24",
        "releasedDate": "30/10/24",
        "forecast": null,
        "spreadRaw": null,
        "spreadPct": null
      }
    },
    "2025 Q3": {
      "Net salesMillion INR": {
        "metric": "Net salesMillion INR",
        "unit": "Million INR",
        "fiscalMonth": "March",
        "period": "2025 Q3",
        "released": "33 553",
        "releasedNum": 33553,
        "forecast": "33 531",
        "forecastNum": 33531,
        "spreadRaw": "0.06%",
        "spreadPct": 0.06
      },
      "EBITDAMillion INR": {
        "metric": "EBITDAMillion INR",
        "unit": "Million INR",
        "fiscalMonth": "March",
        "period": "2025 Q3",
        "released": "6 819",
        "releasedNum": 6819,
        "forecast": "6 705",
        "forecastNum": 6705,
        "spreadRaw": "1.7%",
        "spreadPct": 1.7
      },
      "EBITMillion INR": {
        "metric": "EBITMillion INR",
        "unit": "Million INR",
        "fiscalMonth": "March",
        "period": "2025 Q3",
        "released": "5 733",
        "releasedNum": 5733,
        "forecast": "5 820",
        "forecastNum": 5820,
        "spreadRaw": "-1.5%",
        "spreadPct": -1.5
      },
      "Earnings before Tax (EBT)Million INR": {
        "metric": "Earnings before Tax (EBT)Million INR",
        "unit": "Million INR",
        "fiscalMonth": "March",
        "period": "2025 Q3",
        "released": "6 576",
        "releasedNum": 6576,
        "forecast": "6 592",
        "forecastNum": 6592,
        "spreadRaw": "-0.25%",
        "spreadPct": -0.25
      },
      "Net incomeMillion INR": {
        "metric": "Net incomeMillion INR",
        "unit": "Million INR",
        "fiscalMonth": "March",
        "period": "2025 Q3",
        "released": "5 224",
        "releasedNum": 5224,
        "forecast": "5 197",
        "forecastNum": 5197,
        "spreadRaw": "0.51%",
        "spreadPct": 0.51
      },
      "EPS INR": {
        "metric": "EPS INR",
        "unit": "INR",
        "fiscalMonth": "March",
        "period": "2025 Q3",
        "released": "2,94",
        "releasedNum": 2.94,
        "forecast": "2,87",
        "forecastNum": 2.87,
        "spreadRaw": "2.47%",
        "spreadPct": 2.47
      },
      "Announcement Date": {
        "metric": "Announcement Date",
        "unit": null,
        "fiscalMonth": "March",
        "period": "2025 Q3",
        "released": "30/01/25",
        "releasedDate": "30/01/25",
        "forecast": null,
        "spreadRaw": null,
        "spreadPct": null
      }
    },
    "2025 Q4": {
      "Net salesMillion INR": {
        "metric": "Net salesMillion INR",
        "unit": "Million INR",
        "fiscalMonth": "March",
        "period": "2025 Q4",
        "released": "28 301",
        "releasedNum": 28301,
        "forecast": "28 245",
        "forecastNum": 28245,
        "spreadRaw": "0.2%",
        "spreadPct": 0.2
      },
      "EBITDAMillion INR": {
        "metric": "EBITDAMillion INR",
        "unit": "Million INR",
        "fiscalMonth": "March",
        "period": "2025 Q4",
        "released": "4 269",
        "releasedNum": 4269,
        "forecast": "4 321",
        "forecastNum": 4321,
        "spreadRaw": "-1.2%",
        "spreadPct": -1.2
      },
      "EBITMillion INR": {
        "metric": "EBITMillion INR",
        "unit": "Million INR",
        "fiscalMonth": "March",
        "period": "2025 Q4",
        "released": "3 100",
        "releasedNum": 3100,
        "forecast": "3 598",
        "forecastNum": 3598,
        "spreadRaw": "-13.84%",
        "spreadPct": -13.84
      },
      "Earnings before Tax (EBT)Million INR": {
        "metric": "Earnings before Tax (EBT)Million INR",
        "unit": "Million INR",
        "fiscalMonth": "March",
        "period": "2025 Q4",
        "released": "4 119",
        "releasedNum": 4119,
        "forecast": "4 156",
        "forecastNum": 4156,
        "spreadRaw": "-0.89%",
        "spreadPct": -0.89
      },
      "Net incomeMillion INR": {
        "metric": "Net incomeMillion INR",
        "unit": "Million INR",
        "fiscalMonth": "March",
        "period": "2025 Q4",
        "released": "3 201",
        "releasedNum": 3201,
        "forecast": "3 121",
        "forecastNum": 3121,
        "spreadRaw": "2.59%",
        "spreadPct": 2.59
      },
      "EPS INR": {
        "metric": "EPS INR",
        "unit": "INR",
        "fiscalMonth": "March",
        "period": "2025 Q4",
        "released": "1,80",
        "releasedNum": 1.8,
        "forecast": "1,78",
        "forecastNum": 1.78,
        "spreadRaw": "1.3%",
        "spreadPct": 1.3
      },
      "Announcement Date": {
        "metric": "Announcement Date",
        "unit": null,
        "fiscalMonth": "March",
        "period": "2025 Q4",
        "released": "07/05/25",
        "releasedDate": "07/05/25",
        "forecast": null,
        "spreadRaw": null,
        "spreadPct": null
      }
    },
    "2026 Q1": {
      "Net salesMillion INR": {
        "metric": "Net salesMillion INR",
        "unit": "Million INR",
        "fiscalMonth": "March",
        "period": "2026 Q1",
        "released": "34 046",
        "releasedNum": 34046,
        "forecast": "34 225",
        "forecastNum": 34225,
        "spreadRaw": "-0.52%",
        "spreadPct": -0.52
      },
      "EBITDAMillion INR": {
        "metric": "EBITDAMillion INR",
        "unit": "Million INR",
        "fiscalMonth": "March",
        "period": "2026 Q1",
        "released": "6 678",
        "releasedNum": 6678,
        "forecast": "6 501",
        "forecastNum": 6501,
        "spreadRaw": "2.72%",
        "spreadPct": 2.72
      },
      "EBITMillion INR": {
        "metric": "EBITMillion INR",
        "unit": "Million INR",
        "fiscalMonth": "March",
        "period": "2026 Q1",
        "released": "5 537",
        "releasedNum": 5537,
        "forecast": "5 335",
        "forecastNum": 5335,
        "spreadRaw": "3.79%",
        "spreadPct": 3.79
      },
      "Earnings before Tax (EBT)Million INR": {
        "metric": "Earnings before Tax (EBT)Million INR",
        "unit": "Million INR",
        "fiscalMonth": "March",
        "period": "2026 Q1",
        "released": "6 630",
        "releasedNum": 6630,
        "forecast": "6 365",
        "forecastNum": 6365,
        "spreadRaw": "4.16%",
        "spreadPct": 4.16
      },
      "Net incomeMillion INR": {
        "metric": "Net incomeMillion INR",
        "unit": "Million INR",
        "fiscalMonth": "March",
        "period": "2026 Q1",
        "released": "5 139",
        "releasedNum": 5139,
        "forecast": "4 955",
        "forecastNum": 4955,
        "spreadRaw": "3.72%",
        "spreadPct": 3.72
      },
      "EPS INR": {
        "metric": "EPS INR",
        "unit": "INR",
        "fiscalMonth": "March",
        "period": "2026 Q1",
        "released": "2,89",
        "releasedNum": 2.89,
        "forecast": "2,80",
        "forecastNum": 2.8,
        "spreadRaw": "3.4%",
        "spreadPct": 3.4
      },
      "Announcement Date": {
        "metric": "Announcement Date",
        "unit": null,
        "fiscalMonth": "March",
        "period": "2026 Q1",
        "released": "31/07/25",
        "releasedDate": "31/07/25",
        "forecast": null,
        "spreadRaw": null,
        "spreadPct": null
      }
    },
    "2026 Q2": {
      "Net salesMillion INR": {
        "metric": "Net salesMillion INR",
        "unit": "Million INR",
        "fiscalMonth": "March",
        "period": "2026 Q2",
        "released": null,
        "releasedNum": null,
        "forecast": "31 898",
        "forecastNum": 31898,
        "spreadRaw": null,
        "spreadPct": null
      },
      "EBITDAMillion INR": {
        "metric": "EBITDAMillion INR",
        "unit": "Million INR",
        "fiscalMonth": "March",
        "period": "2026 Q2",
        "released": null,
        "releasedNum": null,
        "forecast": "5 869",
        "forecastNum": 5869,
        "spreadRaw": null,
        "spreadPct": null
      },
      "EBITMillion INR": {
        "metric": "EBITMillion INR",
        "unit": "Million INR",
        "fiscalMonth": "March",
        "period": "2026 Q2",
        "released": null,
        "releasedNum": null,
        "forecast": "4 657",
        "forecastNum": 4657,
        "spreadRaw": null,
        "spreadPct": null
      },
      "Earnings before Tax (EBT)Million INR": {
        "metric": "Earnings before Tax (EBT)Million INR",
        "unit": "Million INR",
        "fiscalMonth": "March",
        "period": "2026 Q2",
        "released": null,
        "releasedNum": null,
        "forecast": "5 592",
        "forecastNum": 5592,
        "spreadRaw": null,
        "spreadPct": null
      },
      "Net incomeMillion INR": {
        "metric": "Net incomeMillion INR",
        "unit": "Million INR",
        "fiscalMonth": "March",
        "period": "2026 Q2",
        "released": null,
        "releasedNum": null,
        "forecast": "4 485",
        "forecastNum": 4485,
        "spreadRaw": null,
        "spreadPct": null
      },
      "EPS INR": {
        "metric": "EPS INR",
        "unit": "INR",
        "fiscalMonth": "March",
        "period": "2026 Q2",
        "released": null,
        "releasedNum": null,
        "forecast": "2,56",
        "forecastNum": 2.56,
        "spreadRaw": null,
        "spreadPct": null
      },
      "Announcement Date": {
        "metric": "Announcement Date",
        "unit": null,
        "fiscalMonth": "March",
        "period": "2026 Q2",
        "released": "-",
        "releasedDate": "-",
        "forecast": null,
        "spreadRaw": null,
        "spreadPct": null
      }
    },
    "2026 Q3": {
      "Net salesMillion INR": {
        "metric": "Net salesMillion INR",
        "unit": "Million INR",
        "fiscalMonth": "March",
        "period": "2026 Q3",
        "released": null,
        "releasedNum": null,
        "forecast": "35 817",
        "forecastNum": 35817,
        "spreadRaw": null,
        "spreadPct": null
      },
      "EBITDAMillion INR": {
        "metric": "EBITDAMillion INR",
        "unit": "Million INR",
        "fiscalMonth": "March",
        "period": "2026 Q3",
        "released": null,
        "releasedNum": null,
        "forecast": "7 267",
        "forecastNum": 7267,
        "spreadRaw": null,
        "spreadPct": null
      },
      "EBITMillion INR": {
        "metric": "EBITMillion INR",
        "unit": "Million INR",
        "fiscalMonth": "March",
        "period": "2026 Q3",
        "released": null,
        "releasedNum": null,
        "forecast": "5 990",
        "forecastNum": 5990,
        "spreadRaw": null,
        "spreadPct": null
      },
      "Earnings before Tax (EBT)Million INR": {
        "metric": "Earnings before Tax (EBT)Million INR",
        "unit": "Million INR",
        "fiscalMonth": "March",
        "period": "2026 Q3",
        "released": null,
        "releasedNum": null,
        "forecast": "7 442",
        "forecastNum": 7442,
        "spreadRaw": null,
        "spreadPct": null
      },
      "Net incomeMillion INR": {
        "metric": "Net incomeMillion INR",
        "unit": "Million INR",
        "fiscalMonth": "March",
        "period": "2026 Q3",
        "released": null,
        "releasedNum": null,
        "forecast": "5 076",
        "forecastNum": 5076,
        "spreadRaw": null,
        "spreadPct": null
      },
      "EPS INR": {
        "metric": "EPS INR",
        "unit": "INR",
        "fiscalMonth": "March",
        "period": "2026 Q3",
        "released": null,
        "releasedNum": null,
        "forecast": "2,79",
        "forecastNum": 2.79,
        "spreadRaw": null,
        "spreadPct": null
      },
      "Announcement Date": {
        "metric": "Announcement Date",
        "unit": null,
        "fiscalMonth": "March",
        "period": "2026 Q3",
        "released": "-",
        "releasedDate": "-",
        "forecast": null,
        "spreadRaw": null,
        "spreadPct": null
      }
    },
    "2026 Q4": {
      "Net salesMillion INR": {
        "metric": "Net salesMillion INR",
        "unit": "Million INR",
        "fiscalMonth": "March",
        "period": "2026 Q4",
        "released": null,
        "releasedNum": null,
        "forecast": "30 494",
        "forecastNum": 30494,
        "spreadRaw": null,
        "spreadPct": null
      },
      "EBITDAMillion INR": {
        "metric": "EBITDAMillion INR",
        "unit": "Million INR",
        "fiscalMonth": "March",
        "period": "2026 Q4",
        "released": null,
        "releasedNum": null,
        "forecast": "4 760",
        "forecastNum": 4760,
        "spreadRaw": null,
        "spreadPct": null
      },
      "EBITMillion INR": {
        "metric": "EBITMillion INR",
        "unit": "Million INR",
        "fiscalMonth": "March",
        "period": "2026 Q4",
        "released": null,
        "releasedNum": null,
        "forecast": "3 568",
        "forecastNum": 3568,
        "spreadRaw": null,
        "spreadPct": null
      },
      "Earnings before Tax (EBT)Million INR": {
        "metric": "Earnings before Tax (EBT)Million INR",
        "unit": "Million INR",
        "fiscalMonth": "March",
        "period": "2026 Q4",
        "released": null,
        "releasedNum": null,
        "forecast": "4 802",
        "forecastNum": 4802,
        "spreadRaw": null,
        "spreadPct": null
      },
      "Net incomeMillion INR": {
        "metric": "Net incomeMillion INR",
        "unit": "Million INR",
        "fiscalMonth": "March",
        "period": "2026 Q4",
        "released": null,
        "releasedNum": null,
        "forecast": "4 186",
        "forecastNum": 4186,
        "spreadRaw": null,
        "spreadPct": null
      },
      "EPS INR": {
        "metric": "EPS INR",
        "unit": "INR",
        "fiscalMonth": "March",
        "period": "2026 Q4",
        "released": null,
        "releasedNum": null,
        "forecast": "2,40",
        "forecastNum": 2.4,
        "spreadRaw": null,
        "spreadPct": null
      },
      "Announcement Date": {
        "metric": "Announcement Date",
        "unit": null,
        "fiscalMonth": "March",
        "period": "2026 Q4",
        "released": "-",
        "releasedDate": "-",
        "forecast": null,
        "spreadRaw": null,
        "spreadPct": null
      }
    }
  },
  "upcomingEvents": {
    "count": 4,
    "events": [
      {
        "section": "Upcoming",
        "dateTimeRaw": "29/10/2025",
        "dateTimeISO": "2025-10-28T18:30:00.000Z",
        "title": "Q2 2026 Earnings Release (Projected)",
        "icsUrl": "https://in.marketscreener.com/api/stateful/agenda/event-async/Q2-2026-Earnings-Release-Projected-48094387.ics"
      },
      {
        "section": "Upcoming",
        "dateTimeRaw": "29/01/2026",
        "dateTimeISO": "2026-01-28T18:30:00.000Z",
        "title": "Q3 2026 Earnings Release (Projected)",
        "icsUrl": "https://in.marketscreener.com/api/stateful/agenda/event-async/Q3-2026-Earnings-Release-Projected-48649360.ics"
      },
      {
        "section": "Upcoming",
        "dateTimeRaw": "30/04/2026",
        "dateTimeISO": "2026-04-29T18:30:00.000Z",
        "title": "Q4 2026 Earnings Release (Projected)",
        "icsUrl": "https://in.marketscreener.com/api/stateful/agenda/event-async/Q4-2026-Earnings-Release-Projected-49581360.ics"
      },
      {
        "section": "Upcoming",
        "dateTimeRaw": "30/07/2026",
        "dateTimeISO": "2026-07-29T18:30:00.000Z",
        "title": "Q1 2027 Earnings Release (Projected)",
        "icsUrl": "https://in.marketscreener.com/api/stateful/agenda/event-async/Q1-2027-Earnings-Release-Projected-50358250.ics"
      }
    ]
  },
  "pastEvents": {
    "count": 162,
    "events": [
      {
        "section": "Past",
        "dateTimeRaw": "18/09/2025 10:00 am",
        "dateTimeISO": "2025-09-18T04:30:00.000Z",
        "title": "Jefferies India Forum",
        "icsUrl": "https://in.marketscreener.com/api/stateful/agenda/event-async/Jefferies-India-Forum-51094920.ics"
      },
      {
        "section": "Past",
        "dateTimeRaw": "07/08/2025 03:00 pm",
        "dateTimeISO": "2025-08-07T09:30:00.000Z",
        "title": "Annual General Meeting",
        "icsUrl": "https://in.marketscreener.com/api/stateful/agenda/event-async/Annual-General-Meeting-49870556.ics"
      },
      {
        "section": "Past",
        "dateTimeRaw": "31/07/2025 03:30 pm",
        "dateTimeISO": "2025-07-31T10:00:00.000Z",
        "title": "Q1 2026 Earnings Call",
        "icsUrl": "https://in.marketscreener.com/api/stateful/agenda/event-async/Q1-2026-Earnings-Call-50494729.ics"
      },
      {
        "section": "Past",
        "dateTimeRaw": "31/07/2025 03:08 pm",
        "dateTimeISO": "2025-07-31T09:38:00.000Z",
        "title": "Q1 2026 Earnings Release",
        "icsUrl": "https://in.marketscreener.com/api/stateful/agenda/event-async/Q1-2026-Earnings-Release-47282344.ics"
      },
      {
        "section": "Past",
        "dateTimeRaw": "18/07/2025",
        "dateTimeISO": "2025-07-17T18:30:00.000Z",
        "title": "Final dividend",
        "icsUrl": "https://in.marketscreener.com/api/stateful/agenda/event-async/Final-dividend-50121901.ics"
      },
      {
        "section": "Past",
        "dateTimeRaw": "10/06/2025",
        "dateTimeISO": "2025-06-09T18:30:00.000Z",
        "title": "Bank of America TMT Conference",
        "icsUrl": "https://in.marketscreener.com/api/stateful/agenda/event-async/Bank-of-America-TMT-Conference-50150428.ics"
      },
      {
        "section": "Past",
        "dateTimeRaw": "30/05/2025 12:00 pm",
        "dateTimeISO": "2025-05-30T06:30:00.000Z",
        "title": "J.P. Morgan India Consumer CEO Conference",
        "icsUrl": "https://in.marketscreener.com/api/stateful/agenda/event-async/J-P-Morgan-India-Consumer-CEO-Conference-50057131.ics"
      },
      {
        "section": "Past",
        "dateTimeRaw": "07/05/2025 04:30 pm",
        "dateTimeISO": "2025-05-07T11:00:00.000Z",
        "title": "Q4 2025 Earnings Call",
        "icsUrl": "https://in.marketscreener.com/api/stateful/agenda/event-async/Q4-2025-Earnings-Call-49581327.ics"
      },
      {
        "section": "Past",
        "dateTimeRaw": "07/05/2025 04:07 pm",
        "dateTimeISO": "2025-05-07T10:37:00.000Z",
        "title": "Q4 2025 Earnings Release",
        "icsUrl": "https://in.marketscreener.com/api/stateful/agenda/event-async/Q4-2025-Earnings-Release-46428598.ics"
      },
      {
        "section": "Past",
        "dateTimeRaw": "10/02/2025 10:00 am",
        "dateTimeISO": "2025-02-10T04:30:00.000Z",
        "title": "Nuvama India Investor Conference",
        "icsUrl": "https://in.marketscreener.com/api/stateful/agenda/event-async/Nuvama-India-Investor-Conference-48959936.ics"
      },
      {
        "section": "Past",
        "dateTimeRaw": "30/01/2025 04:30 pm",
        "dateTimeISO": "2025-01-30T11:00:00.000Z",
        "title": "Q3 2025 Earnings Call",
        "icsUrl": "https://in.marketscreener.com/api/stateful/agenda/event-async/Q3-2025-Earnings-Call-48734575.ics"
      },
      {
        "section": "Past",
        "dateTimeRaw": "30/01/2025 03:08 pm",
        "dateTimeISO": "2025-01-30T09:38:00.000Z",
        "title": "Q3 2025 Earnings Release",
        "icsUrl": "https://in.marketscreener.com/api/stateful/agenda/event-async/Q3-2025-Earnings-Release-45642773.ics"
      },
      {
        "section": "Past",
        "dateTimeRaw": "08/11/2024",
        "dateTimeISO": "2024-11-07T18:30:00.000Z",
        "title": "Ex-dividend day for dividende intermédiaire",
        "icsUrl": "https://in.marketscreener.com/api/stateful/agenda/event-async/Ex-dividend-day-for-dividende-intermediaire-48315301.ics"
      },
      {
        "section": "Past",
        "dateTimeRaw": "30/10/2024 05:00 pm",
        "dateTimeISO": "2024-10-30T11:30:00.000Z",
        "title": "Q2 2025 Earnings Call",
        "icsUrl": "https://in.marketscreener.com/api/stateful/agenda/event-async/Q2-2025-Earnings-Call-48148330.ics"
      },
      {
        "section": "Past",
        "dateTimeRaw": "30/10/2024 03:15 pm",
        "dateTimeISO": "2024-10-30T09:45:00.000Z",
        "title": "Q2 2025 Earnings Release",
        "icsUrl": "https://in.marketscreener.com/api/stateful/agenda/event-async/Q2-2025-Earnings-Release-44978283.ics"
      },
      {
        "section": "Past",
        "dateTimeRaw": "23/09/2024 10:00 am",
        "dateTimeISO": "2024-09-23T04:30:00.000Z",
        "title": "J.P. Morgan India Investor Summit",
        "icsUrl": "https://in.marketscreener.com/api/stateful/agenda/event-async/J-P-Morgan-India-Investor-Summit-47881279.ics"
      },
      {
        "section": "Past",
        "dateTimeRaw": "20/08/2024 09:00 am",
        "dateTimeISO": "2024-08-20T03:30:00.000Z",
        "title": "Motilal Oswal Global Investor Conference",
        "icsUrl": "https://in.marketscreener.com/api/stateful/agenda/event-async/Motilal-Oswal-Global-Investor-Conference-47697190.ics"
      },
      {
        "section": "Past",
        "dateTimeRaw": "12/08/2024",
        "dateTimeISO": "2024-08-11T18:30:00.000Z",
        "title": "Nuvama India Conference",
        "icsUrl": "https://in.marketscreener.com/api/stateful/agenda/event-async/Nuvama-India-Conference-47632295.ics"
      },
      {
        "section": "Past",
        "dateTimeRaw": "08/08/2024 03:00 pm",
        "dateTimeISO": "2024-08-08T09:30:00.000Z",
        "title": "Annual General Meeting",
        "icsUrl": "https://in.marketscreener.com/api/stateful/agenda/event-async/Annual-General-Meeting-47282316.ics"
      },
      {
        "section": "Past",
        "dateTimeRaw": "01/08/2024 04:30 pm",
        "dateTimeISO": "2024-08-01T11:00:00.000Z",
        "title": "Q1 2025 Earnings Call",
        "icsUrl": "https://in.marketscreener.com/api/stateful/agenda/event-async/Q1-2025-Earnings-Call-47387487.ics"
      },
      {
        "section": "Past",
        "dateTimeRaw": "19/07/2024",
        "dateTimeISO": "2024-07-18T18:30:00.000Z",
        "title": "Final dividend",
        "icsUrl": "https://in.marketscreener.com/api/stateful/agenda/event-async/Final-dividend-47330290.ics"
      },
      {
        "section": "Past",
        "dateTimeRaw": "09/06/2024 06:30 pm",
        "dateTimeISO": "2024-06-09T13:00:00.000Z",
        "title": "ICICI Securities Investor Conference",
        "icsUrl": "https://in.marketscreener.com/api/stateful/agenda/event-async/ICICI-Securities-Investor-Conference-46915978.ics"
      },
      {
        "section": "Past",
        "dateTimeRaw": "03/06/2024 10:00 am",
        "dateTimeISO": "2024-06-03T04:30:00.000Z",
        "title": "BofA India Conference",
        "icsUrl": "https://in.marketscreener.com/api/stateful/agenda/event-async/BofA-India-Conference-46859633.ics"
      },
      {
        "section": "Past",
        "dateTimeRaw": "02/05/2024 04:30 pm",
        "dateTimeISO": "2024-05-02T11:00:00.000Z",
        "title": "Q4 2024 Earnings Call",
        "icsUrl": "https://in.marketscreener.com/api/stateful/agenda/event-async/Q4-2024-Earnings-Call-46428550.ics"
      },
      {
        "section": "Past",
        "dateTimeRaw": "02/05/2024 02:12 pm",
        "dateTimeISO": "2024-05-02T08:42:00.000Z",
        "title": "Q4 2024 Earnings Release",
        "icsUrl": "https://in.marketscreener.com/api/stateful/agenda/event-async/Q4-2024-Earnings-Release-43610349.ics"
      },
      {
        "section": "Past",
        "dateTimeRaw": "14/02/2024 02:00 pm",
        "dateTimeISO": "2024-02-14T08:30:00.000Z",
        "title": "Axis Capital India Conference",
        "icsUrl": "https://in.marketscreener.com/api/stateful/agenda/event-async/Axis-Capital-India-Conference-45957908.ics"
      },
      {
        "section": "Past",
        "dateTimeRaw": "14/02/2024 10:00 am",
        "dateTimeISO": "2024-02-14T04:30:00.000Z",
        "title": "IIFL Enterprising India Global Investors Conference",
        "icsUrl": "https://in.marketscreener.com/api/stateful/agenda/event-async/IIFL-Enterprising-India-Global-Investors-Conference-45957909.ics"
      },
      {
        "section": "Past",
        "dateTimeRaw": "13/02/2024 10:00 am",
        "dateTimeISO": "2024-02-13T04:30:00.000Z",
        "title": "Nuvama India Conference",
        "icsUrl": "https://in.marketscreener.com/api/stateful/agenda/event-async/Nuvama-India-Conference-45957864.ics"
      },
      {
        "section": "Past",
        "dateTimeRaw": "31/01/2024 04:30 pm",
        "dateTimeISO": "2024-01-31T11:00:00.000Z",
        "title": "Q3 2024 Earnings Call",
        "icsUrl": "https://in.marketscreener.com/api/stateful/agenda/event-async/Q3-2024-Earnings-Call-45711065.ics"
      },
      {
        "section": "Past",
        "dateTimeRaw": "31/01/2024 02:36 pm",
        "dateTimeISO": "2024-01-31T09:06:00.000Z",
        "title": "Q3 2024 Earnings Release",
        "icsUrl": "https://in.marketscreener.com/api/stateful/agenda/event-async/Q3-2024-Earnings-Release-42642015.ics"
      },
      {
        "section": "Past",
        "dateTimeRaw": "23/11/2023 10:00 am",
        "dateTimeISO": "2023-11-23T04:30:00.000Z",
        "title": "CITIC CLSA India Forum",
        "icsUrl": "https://in.marketscreener.com/api/stateful/agenda/event-async/CITIC-CLSA-India-Forum-45403852.ics"
      },
      {
        "section": "Past",
        "dateTimeRaw": "10/11/2023",
        "dateTimeISO": "2023-11-09T18:30:00.000Z",
        "title": "Ex-dividend day for dividende intermédiaire",
        "icsUrl": "https://in.marketscreener.com/api/stateful/agenda/event-async/Ex-dividend-day-for-dividende-intermediaire-45305156.ics"
      },
      {
        "section": "Past",
        "dateTimeRaw": "06/11/2023 11:00 am",
        "dateTimeISO": "2023-11-06T05:30:00.000Z",
        "title": "Bank of America Securities India Conference",
        "icsUrl": "https://in.marketscreener.com/api/stateful/agenda/event-async/Bank-of-America-Securities-India-Conference-45323720.ics"
      },
      {
        "section": "Past",
        "dateTimeRaw": "02/11/2023 04:30 pm",
        "dateTimeISO": "2023-11-02T11:00:00.000Z",
        "title": "Q2 2024 Earnings Call",
        "icsUrl": "https://in.marketscreener.com/api/stateful/agenda/event-async/Q2-2024-Earnings-Call-45055907.ics"
      },
      {
        "section": "Past",
        "dateTimeRaw": "02/11/2023 02:54 pm",
        "dateTimeISO": "2023-11-02T09:24:00.000Z",
        "title": "Q2 2024 Earnings Release",
        "icsUrl": "https://in.marketscreener.com/api/stateful/agenda/event-async/Q2-2024-Earnings-Release-41959738.ics"
      },
      {
        "section": "Past",
        "dateTimeRaw": "26/09/2023 10:00 am",
        "dateTimeISO": "2023-09-26T04:30:00.000Z",
        "title": "J.P. Morgan India Investor Summit",
        "icsUrl": "https://in.marketscreener.com/api/stateful/agenda/event-async/J-P-Morgan-India-Investor-Summit-44901664.ics"
      },
      {
        "section": "Past",
        "dateTimeRaw": "15/09/2023 11:00 am",
        "dateTimeISO": "2023-09-15T05:30:00.000Z",
        "title": "Capital Markets Day",
        "icsUrl": "https://in.marketscreener.com/api/stateful/agenda/event-async/Capital-Markets-Day-44819542.ics"
      },
      {
        "section": "Past",
        "dateTimeRaw": "21/08/2023",
        "dateTimeISO": "2023-08-20T18:30:00.000Z",
        "title": "Ambit India Access Conference",
        "icsUrl": "https://in.marketscreener.com/api/stateful/agenda/event-async/Ambit-India-Access-Conference-44634811.ics"
      },
      {
        "section": "Past",
        "dateTimeRaw": "18/08/2023",
        "dateTimeISO": "2023-08-17T18:30:00.000Z",
        "title": "Nuvama India Conference",
        "icsUrl": "https://in.marketscreener.com/api/stateful/agenda/event-async/Nuvama-India-Conference-44634808.ics"
      },
      {
        "section": "Past",
        "dateTimeRaw": "10/08/2023 03:00 pm",
        "dateTimeISO": "2023-08-10T09:30:00.000Z",
        "title": "Annual General Meeting",
        "icsUrl": "https://in.marketscreener.com/api/stateful/agenda/event-async/Annual-General-Meeting-44174237.ics"
      },
      {
        "section": "Past",
        "dateTimeRaw": "03/08/2023 04:30 pm",
        "dateTimeISO": "2023-08-03T11:00:00.000Z",
        "title": "Q1 2024 Earnings Call",
        "icsUrl": "https://in.marketscreener.com/api/stateful/agenda/event-async/Q1-2024-Earnings-Call-44364120.ics"
      },
      {
        "section": "Past",
        "dateTimeRaw": "03/08/2023 02:30 pm",
        "dateTimeISO": "2023-08-03T09:00:00.000Z",
        "title": "Q1 2024 Earnings Release",
        "icsUrl": "https://in.marketscreener.com/api/stateful/agenda/event-async/Q1-2024-Earnings-Release-40939321.ics"
      },
      {
        "section": "Past",
        "dateTimeRaw": "21/07/2023",
        "dateTimeISO": "2023-07-20T18:30:00.000Z",
        "title": "Final dividend",
        "icsUrl": "https://in.marketscreener.com/api/stateful/agenda/event-async/Final-dividend-44247968.ics"
      },
      {
        "section": "Past",
        "dateTimeRaw": "24/05/2023",
        "dateTimeISO": "2023-05-23T18:30:00.000Z",
        "title": "Jefferies India Conference",
        "icsUrl": "https://in.marketscreener.com/api/stateful/agenda/event-async/Jefferies-India-Conference-43952823.ics"
      },
      {
        "section": "Past",
        "dateTimeRaw": "04/05/2023 04:30 pm",
        "dateTimeISO": "2023-05-04T11:00:00.000Z",
        "title": "Q4 2023 Earnings Call",
        "icsUrl": "https://in.marketscreener.com/api/stateful/agenda/event-async/Q4-2023-Earnings-Call-43610044.ics"
      },
      {
        "section": "Past",
        "dateTimeRaw": "04/05/2023 02:33 pm",
        "dateTimeISO": "2023-05-04T09:03:00.000Z",
        "title": "Q4 2023 Earnings Release",
        "icsUrl": "https://in.marketscreener.com/api/stateful/agenda/event-async/Q4-2023-Earnings-Release-39948484.ics"
      },
      {
        "section": "Past",
        "dateTimeRaw": "13/02/2023",
        "dateTimeISO": "2023-02-12T18:30:00.000Z",
        "title": "Roadshow",
        "icsUrl": "https://in.marketscreener.com/api/stateful/agenda/event-async/Roadshow-42962717.ics"
      },
      {
        "section": "Past",
        "dateTimeRaw": "07/02/2023",
        "dateTimeISO": "2023-02-06T18:30:00.000Z",
        "title": "Citi India Investor Conference",
        "icsUrl": "https://in.marketscreener.com/api/stateful/agenda/event-async/Citi-India-Investor-Conference-42898699.ics"
      },
      {
        "section": "Past",
        "dateTimeRaw": "02/02/2023 04:00 pm",
        "dateTimeISO": "2023-02-02T10:30:00.000Z",
        "title": "Q3 2023 Earnings Call",
        "icsUrl": "https://in.marketscreener.com/api/stateful/agenda/event-async/Q3-2023-Earnings-Call-42783478.ics"
      },
      {
        "section": "Past",
        "dateTimeRaw": "02/02/2023 03:08 pm",
        "dateTimeISO": "2023-02-02T09:38:00.000Z",
        "title": "Q3 2023 Earnings Release",
        "icsUrl": "https://in.marketscreener.com/api/stateful/agenda/event-async/Q3-2023-Earnings-Release-39948383.ics"
      },
      {
        "section": "Past",
        "dateTimeRaw": "22/11/2022",
        "dateTimeISO": "2022-11-21T18:30:00.000Z",
        "title": "Kotak KIE India Consumer Forum",
        "icsUrl": "https://in.marketscreener.com/api/stateful/agenda/event-async/Kotak-KIE-India-Consumer-Forum-42431192.ics"
      },
      {
        "section": "Past",
        "dateTimeRaw": "09/11/2022",
        "dateTimeISO": "2022-11-08T18:30:00.000Z",
        "title": "UBS India Virtual Conference",
        "icsUrl": "https://in.marketscreener.com/api/stateful/agenda/event-async/UBS-India-Virtual-Conference-42292811.ics"
      },
      {
        "section": "Past",
        "dateTimeRaw": "03/11/2022",
        "dateTimeISO": "2022-11-02T18:30:00.000Z",
        "title": "Ex-dividend day for dividende intermédiaire",
        "icsUrl": "https://in.marketscreener.com/api/stateful/agenda/event-async/Ex-dividend-day-for-dividende-intermediaire-42160179.ics"
      },
      {
        "section": "Past",
        "dateTimeRaw": "27/10/2022 11:00 am",
        "dateTimeISO": "2022-10-27T05:30:00.000Z",
        "title": "Interim 2023 Earnings Call",
        "icsUrl": "https://in.marketscreener.com/api/stateful/agenda/event-async/Interim-2023-Earnings-Call-42142899.ics"
      },
      {
        "section": "Past",
        "dateTimeRaw": "26/10/2022 02:49 pm",
        "dateTimeISO": "2022-10-26T09:19:00.000Z",
        "title": "Interim 2023 Earnings Release",
        "icsUrl": "https://in.marketscreener.com/api/stateful/agenda/event-async/Interim-2023-Earnings-Release-36581403.ics"
      },
      {
        "section": "Past",
        "dateTimeRaw": "20/09/2022",
        "dateTimeISO": "2022-09-19T18:30:00.000Z",
        "title": "JP Morgan India Investor Summit",
        "icsUrl": "https://in.marketscreener.com/api/stateful/agenda/event-async/JP-Morgan-India-Investor-Summit-41798704.ics"
      },
      {
        "section": "Past",
        "dateTimeRaw": "12/08/2022 10:30 am",
        "dateTimeISO": "2022-08-12T05:00:00.000Z",
        "title": "Annual General Meeting",
        "icsUrl": "https://in.marketscreener.com/api/stateful/agenda/event-async/Annual-General-Meeting-41002653.ics"
      },
      {
        "section": "Past",
        "dateTimeRaw": "04/08/2022 04:30 pm",
        "dateTimeISO": "2022-08-04T11:00:00.000Z",
        "title": "Q1 2023 Earnings Call",
        "icsUrl": "https://in.marketscreener.com/api/stateful/agenda/event-async/Q1-2023-Earnings-Call-41002602.ics"
      },
      {
        "section": "Past",
        "dateTimeRaw": "04/08/2022 02:48 pm",
        "dateTimeISO": "2022-08-04T09:18:00.000Z",
        "title": "Q1 2023 Earnings Release",
        "icsUrl": "https://in.marketscreener.com/api/stateful/agenda/event-async/Q1-2023-Earnings-Release-35962628.ics"
      },
      {
        "section": "Past",
        "dateTimeRaw": "21/07/2022",
        "dateTimeISO": "2022-07-20T18:30:00.000Z",
        "title": "Ex-dividend day for final dividend",
        "icsUrl": "https://in.marketscreener.com/api/stateful/agenda/event-async/Ex-dividend-day-for-final-dividend-41006475.ics"
      },
      {
        "section": "Past",
        "dateTimeRaw": "09/06/2022",
        "dateTimeISO": "2022-06-08T18:30:00.000Z",
        "title": "Edelweiss India Conference",
        "icsUrl": "https://in.marketscreener.com/api/stateful/agenda/event-async/Edelweiss-India-Conference-40701041.ics"
      },
      {
        "section": "Past",
        "dateTimeRaw": "08/06/2022",
        "dateTimeISO": "2022-06-07T18:30:00.000Z",
        "title": "Edelweiss India Conference",
        "icsUrl": "https://in.marketscreener.com/api/stateful/agenda/event-async/Edelweiss-India-Conference-40701028.ics"
      },
      {
        "section": "Past",
        "dateTimeRaw": "30/05/2022",
        "dateTimeISO": "2022-05-29T18:30:00.000Z",
        "title": "B&K Securities Investor Conference",
        "icsUrl": "https://in.marketscreener.com/api/stateful/agenda/event-async/B-K-Securities-Investor-Conference-40640937.ics"
      },
      {
        "section": "Past",
        "dateTimeRaw": "05/05/2022 04:30 pm",
        "dateTimeISO": "2022-05-05T11:00:00.000Z",
        "title": "FY 2022 Earnings Call",
        "icsUrl": "https://in.marketscreener.com/api/stateful/agenda/event-async/FY-2022-Earnings-Call-40131555.ics"
      },
      {
        "section": "Past",
        "dateTimeRaw": "05/05/2022 02:14 pm",
        "dateTimeISO": "2022-05-05T08:44:00.000Z",
        "title": "FY 2022 Earnings Release",
        "icsUrl": "https://in.marketscreener.com/api/stateful/agenda/event-async/FY-2022-Earnings-Release-33054986.ics"
      },
      {
        "section": "Past",
        "dateTimeRaw": "14/03/2022",
        "dateTimeISO": "2022-03-13T18:30:00.000Z",
        "title": "ICICI Consumption Conversion Conference",
        "icsUrl": "https://in.marketscreener.com/api/stateful/agenda/event-async/ICICI-Consumption-Conversion-Conference-39872273.ics"
      },
      {
        "section": "Past",
        "dateTimeRaw": "21/02/2022",
        "dateTimeISO": "2022-02-20T18:30:00.000Z",
        "title": "Kotak Chasing Growth Conference",
        "icsUrl": "https://in.marketscreener.com/api/stateful/agenda/event-async/Kotak-Chasing-Growth-Conference-39523170.ics"
      },
      {
        "section": "Past",
        "dateTimeRaw": "08/02/2022",
        "dateTimeISO": "2022-02-07T18:30:00.000Z",
        "title": "Edelweiss India Conference",
        "icsUrl": "https://in.marketscreener.com/api/stateful/agenda/event-async/Edelweiss-India-Conference-37789737.ics"
      },
      {
        "section": "Past",
        "dateTimeRaw": "03/02/2022 11:00 am",
        "dateTimeISO": "2022-02-03T05:30:00.000Z",
        "title": "Q3 2022 Earnings Call",
        "icsUrl": "https://in.marketscreener.com/api/stateful/agenda/event-async/Q3-2022-Earnings-Call-37615528.ics"
      },
      {
        "section": "Past",
        "dateTimeRaw": "02/02/2022 04:07 pm",
        "dateTimeISO": "2022-02-02T10:37:00.000Z",
        "title": "Q3 2022 Earnings Release",
        "icsUrl": "https://in.marketscreener.com/api/stateful/agenda/event-async/Q3-2022-Earnings-Release-32155535.ics"
      },
      {
        "section": "Past",
        "dateTimeRaw": "30/11/2021",
        "dateTimeISO": "2021-11-29T18:30:00.000Z",
        "title": "Investor Meeting - UBS Securities India Pvt Ltd",
        "icsUrl": "https://in.marketscreener.com/api/stateful/agenda/event-async/Investor-Meeting-UBS-Securities-India-Pvt-Ltd-37214435.ics"
      },
      {
        "section": "Past",
        "dateTimeRaw": "15/11/2021",
        "dateTimeISO": "2021-11-14T18:30:00.000Z",
        "title": "CITIC CLSA India Forum",
        "icsUrl": "https://in.marketscreener.com/api/stateful/agenda/event-async/CITIC-CLSA-India-Forum-37008385.ics"
      },
      {
        "section": "Past",
        "dateTimeRaw": "11/11/2021",
        "dateTimeISO": "2021-11-10T18:30:00.000Z",
        "title": "Ex-dividend day for dividende intermédiaire",
        "icsUrl": "https://in.marketscreener.com/api/stateful/agenda/event-async/Ex-dividend-day-for-dividende-intermediaire-36932390.ics"
      },
      {
        "section": "Past",
        "dateTimeRaw": "02/11/2021 04:00 pm",
        "dateTimeISO": "2021-11-02T10:30:00.000Z",
        "title": "Interim 2022 Earnings Call",
        "icsUrl": "https://in.marketscreener.com/api/stateful/agenda/event-async/Interim-2022-Earnings-Call-36642510.ics"
      },
      {
        "section": "Past",
        "dateTimeRaw": "02/11/2021 02:09 pm",
        "dateTimeISO": "2021-11-02T08:39:00.000Z",
        "title": "Interim 2022 Earnings Release",
        "icsUrl": "https://in.marketscreener.com/api/stateful/agenda/event-async/Interim-2022-Earnings-Release-31469711.ics"
      },
      {
        "section": "Past",
        "dateTimeRaw": "20/09/2021",
        "dateTimeISO": "2021-09-19T18:30:00.000Z",
        "title": "JP Morgan India Investor Summit",
        "icsUrl": "https://in.marketscreener.com/api/stateful/agenda/event-async/JP-Morgan-India-Investor-Summit-36459427.ics"
      },
      {
        "section": "Past",
        "dateTimeRaw": "15/09/2021",
        "dateTimeISO": "2021-09-14T18:30:00.000Z",
        "title": "CITIC CLSA Flagship Investor Forum",
        "icsUrl": "https://in.marketscreener.com/api/stateful/agenda/event-async/CITIC-CLSA-Flagship-Investor-Forum-36459394.ics"
      },
      {
        "section": "Past",
        "dateTimeRaw": "13/09/2021",
        "dateTimeISO": "2021-09-12T18:30:00.000Z",
        "title": "Motilal Oswal Global Investor Conference",
        "icsUrl": "https://in.marketscreener.com/api/stateful/agenda/event-async/Motilal-Oswal-Global-Investor-Conference-36402144.ics"
      },
      {
        "section": "Past",
        "dateTimeRaw": "19/08/2021 03:00 pm",
        "dateTimeISO": "2021-08-19T09:30:00.000Z",
        "title": "Annual General Meeting",
        "icsUrl": "https://in.marketscreener.com/api/stateful/agenda/event-async/Annual-General-Meeting-36325298.ics"
      },
      {
        "section": "Past",
        "dateTimeRaw": "11/08/2021",
        "dateTimeISO": "2021-08-10T18:30:00.000Z",
        "title": "Credit Suisse India Consumer Day",
        "icsUrl": "https://in.marketscreener.com/api/stateful/agenda/event-async/Credit-Suisse-India-Consumer-Day-36325064.ics"
      },
      {
        "section": "Past",
        "dateTimeRaw": "03/08/2021 04:00 pm",
        "dateTimeISO": "2021-08-03T10:30:00.000Z",
        "title": "Q1 2022 Earnings Call",
        "icsUrl": "https://in.marketscreener.com/api/stateful/agenda/event-async/Q1-2022-Earnings-Call-35961806.ics"
      },
      {
        "section": "Past",
        "dateTimeRaw": "03/08/2021 02:12 pm",
        "dateTimeISO": "2021-08-03T08:42:00.000Z",
        "title": "Q1 2022 Earnings Release",
        "icsUrl": "https://in.marketscreener.com/api/stateful/agenda/event-async/Q1-2022-Earnings-Release-30871558.ics"
      },
      {
        "section": "Past",
        "dateTimeRaw": "29/07/2021",
        "dateTimeISO": "2021-07-28T18:30:00.000Z",
        "title": "Ex-dividend day for final dividend",
        "icsUrl": "https://in.marketscreener.com/api/stateful/agenda/event-async/Ex-dividend-day-for-final-dividend-35832379.ics"
      },
      {
        "section": "Past",
        "dateTimeRaw": "07/05/2021 04:30 pm",
        "dateTimeISO": "2021-05-07T11:00:00.000Z",
        "title": "FY 2021 Earnings Call",
        "icsUrl": "https://in.marketscreener.com/api/stateful/agenda/event-async/FY-2021-Earnings-Call-33200028.ics"
      },
      {
        "section": "Past",
        "dateTimeRaw": "07/05/2021",
        "dateTimeISO": "2021-05-06T18:30:00.000Z",
        "title": "FY 2021 Earnings Release",
        "icsUrl": "https://in.marketscreener.com/api/stateful/agenda/event-async/FY-2021-Earnings-Release-29966831.ics"
      },
      {
        "section": "Past",
        "dateTimeRaw": "29/01/2021 04:30 pm",
        "dateTimeISO": "2021-01-29T11:00:00.000Z",
        "title": "Q3 2021 Earnings Call",
        "icsUrl": "https://in.marketscreener.com/api/stateful/agenda/event-async/Q3-2021-Earnings-Call-32211657.ics"
      },
      {
        "section": "Past",
        "dateTimeRaw": "29/01/2021",
        "dateTimeISO": "2021-01-28T18:30:00.000Z",
        "title": "Q3 2021 Earnings Release",
        "icsUrl": "https://in.marketscreener.com/api/stateful/agenda/event-async/Q3-2021-Earnings-Release-29794043.ics"
      },
      {
        "section": "Past",
        "dateTimeRaw": "11/11/2020",
        "dateTimeISO": "2020-11-10T18:30:00.000Z",
        "title": "Ex-dividend day for dividende intermédiaire",
        "icsUrl": "https://in.marketscreener.com/api/stateful/agenda/event-async/Ex-dividend-day-for-dividende-intermediaire-31719566.ics"
      },
      {
        "section": "Past",
        "dateTimeRaw": "03/11/2020 04:30 pm",
        "dateTimeISO": "2020-11-03T11:00:00.000Z",
        "title": "Interim 2021 Earnings Call",
        "icsUrl": "https://in.marketscreener.com/api/stateful/agenda/event-async/Interim-2021-Earnings-Call-31609405.ics"
      },
      {
        "section": "Past",
        "dateTimeRaw": "03/11/2020",
        "dateTimeISO": "2020-11-02T18:30:00.000Z",
        "title": "Interim 2021 Earnings Release",
        "icsUrl": "https://in.marketscreener.com/api/stateful/agenda/event-async/Interim-2021-Earnings-Release-29405021.ics"
      },
      {
        "section": "Past",
        "dateTimeRaw": "03/09/2020",
        "dateTimeISO": "2020-09-02T18:30:00.000Z",
        "title": "Annual General Meeting",
        "icsUrl": "https://in.marketscreener.com/api/stateful/agenda/event-async/Annual-General-Meeting-31036088.ics"
      },
      {
        "section": "Past",
        "dateTimeRaw": "13/08/2020",
        "dateTimeISO": "2020-08-12T18:30:00.000Z",
        "title": "Ex-dividend day for final dividend",
        "icsUrl": "https://in.marketscreener.com/api/stateful/agenda/event-async/Ex-dividend-day-for-final-dividend-31041087.ics"
      },
      {
        "section": "Past",
        "dateTimeRaw": "30/07/2020 04:00 pm",
        "dateTimeISO": "2020-07-30T10:30:00.000Z",
        "title": "Q1 2021 Earnings Call",
        "icsUrl": "https://in.marketscreener.com/api/stateful/agenda/event-async/Q1-2021-Earnings-Call-30946989.ics"
      },
      {
        "section": "Past",
        "dateTimeRaw": "30/07/2020",
        "dateTimeISO": "2020-07-29T18:30:00.000Z",
        "title": "Q1 2021 Earnings Release",
        "icsUrl": "https://in.marketscreener.com/api/stateful/agenda/event-async/Q1-2021-Earnings-Release-28898619.ics"
      },
      {
        "section": "Past",
        "dateTimeRaw": "27/05/2020 03:30 pm",
        "dateTimeISO": "2020-05-27T10:00:00.000Z",
        "title": "FY 2020 Earnings Call",
        "icsUrl": "https://in.marketscreener.com/api/stateful/agenda/event-async/FY-2020-Earnings-Call-30659453.ics"
      },
      {
        "section": "Past",
        "dateTimeRaw": "27/05/2020",
        "dateTimeISO": "2020-05-26T18:30:00.000Z",
        "title": "FY 2020 Earnings Release",
        "icsUrl": "https://in.marketscreener.com/api/stateful/agenda/event-async/FY-2020-Earnings-Release-28895662.ics"
      },
      {
        "section": "Past",
        "dateTimeRaw": "30/01/2020 04:30 pm",
        "dateTimeISO": "2020-01-30T11:00:00.000Z",
        "title": "Q3 2020 Earnings Call",
        "icsUrl": "https://in.marketscreener.com/api/stateful/agenda/event-async/Q3-2020-Earnings-Call-29822223.ics"
      },
      {
        "section": "Past",
        "dateTimeRaw": "30/01/2020",
        "dateTimeISO": "2020-01-29T18:30:00.000Z",
        "title": "Q3 2020 Earnings Release",
        "icsUrl": "https://in.marketscreener.com/api/stateful/agenda/event-async/Q3-2020-Earnings-Release-28301442.ics"
      },
      {
        "section": "Past",
        "dateTimeRaw": "13/11/2019",
        "dateTimeISO": "2019-11-12T18:30:00.000Z",
        "title": "Ex-dividend day for dividende intermédiaire",
        "icsUrl": "https://in.marketscreener.com/api/stateful/agenda/event-async/Ex-dividend-day-for-dividende-intermediaire-29557322.ics"
      },
      {
        "section": "Past",
        "dateTimeRaw": "05/11/2019 04:30 pm",
        "dateTimeISO": "2019-11-05T11:00:00.000Z",
        "title": "Interim 2020 Earnings Call",
        "icsUrl": "https://in.marketscreener.com/api/stateful/agenda/event-async/Interim-2020-Earnings-Call-29460258.ics"
      },
      {
        "section": "Past",
        "dateTimeRaw": "30/08/2019 03:30 pm",
        "dateTimeISO": "2019-08-30T10:00:00.000Z",
        "title": "Annual General Meeting",
        "icsUrl": "https://in.marketscreener.com/api/stateful/agenda/event-async/Annual-General-Meeting-28862187.ics"
      },
      {
        "section": "Past",
        "dateTimeRaw": "07/08/2019",
        "dateTimeISO": "2019-08-06T18:30:00.000Z",
        "title": "Ex-dividend day for final dividend",
        "icsUrl": "https://in.marketscreener.com/api/stateful/agenda/event-async/Ex-dividend-day-for-final-dividend-28540276.ics"
      },
      {
        "section": "Past",
        "dateTimeRaw": "19/07/2019 04:30 pm",
        "dateTimeISO": "2019-07-19T11:00:00.000Z",
        "title": "Q1 2020 Earnings Call",
        "icsUrl": "https://in.marketscreener.com/api/stateful/agenda/event-async/Q1-2020-Earnings-Call-28892867.ics"
      },
      {
        "section": "Past",
        "dateTimeRaw": "19/07/2019",
        "dateTimeISO": "2019-07-18T18:30:00.000Z",
        "title": "Q1 2020 Earnings Release",
        "icsUrl": "https://in.marketscreener.com/api/stateful/agenda/event-async/Q1-2020-Earnings-Release-28280007.ics"
      },
      {
        "section": "Past",
        "dateTimeRaw": "02/05/2019 04:30 pm",
        "dateTimeISO": "2019-05-02T11:00:00.000Z",
        "title": "FY 2019 Earnings Call",
        "icsUrl": "https://in.marketscreener.com/api/stateful/agenda/event-async/FY-2019-Earnings-Call-28579175.ics"
      },
      {
        "section": "Past",
        "dateTimeRaw": "02/05/2019",
        "dateTimeISO": "2019-05-01T18:30:00.000Z",
        "title": "FY 2019 Earnings Release",
        "icsUrl": "https://in.marketscreener.com/api/stateful/agenda/event-async/FY-2019-Earnings-Release-25442356.ics"
      },
      {
        "section": "Past",
        "dateTimeRaw": "01/02/2019 04:00 pm",
        "dateTimeISO": "2019-02-01T10:30:00.000Z",
        "title": "Q3 2019 Earnings Call",
        "icsUrl": "https://in.marketscreener.com/api/stateful/agenda/event-async/Q3-2019-Earnings-Call-27888814.ics"
      },
      {
        "section": "Past",
        "dateTimeRaw": "31/01/2019",
        "dateTimeISO": "2019-01-30T18:30:00.000Z",
        "title": "Q3 2019 Earnings Release",
        "icsUrl": "https://in.marketscreener.com/api/stateful/agenda/event-async/Q3-2019-Earnings-Release-25442312.ics"
      },
      {
        "section": "Past",
        "dateTimeRaw": "09/11/2018",
        "dateTimeISO": "2018-11-08T18:30:00.000Z",
        "title": "Ex-dividend day for dividende intermédiaire",
        "icsUrl": "https://in.marketscreener.com/api/stateful/agenda/event-async/Ex-dividend-day-for-dividende-intermediaire-27543839.ics"
      },
      {
        "section": "Past",
        "dateTimeRaw": "31/10/2018 04:00 pm",
        "dateTimeISO": "2018-10-31T10:30:00.000Z",
        "title": "Interim 2019 Earnings Call",
        "icsUrl": "https://in.marketscreener.com/api/stateful/agenda/event-async/Interim-2019-Earnings-Call-27455958.ics"
      },
      {
        "section": "Past",
        "dateTimeRaw": "31/10/2018",
        "dateTimeISO": "2018-10-30T18:30:00.000Z",
        "title": "Interim 2019 Earnings Release",
        "icsUrl": "https://in.marketscreener.com/api/stateful/agenda/event-async/Interim-2019-Earnings-Release-25441861.ics"
      },
      {
        "section": "Past",
        "dateTimeRaw": "01/08/2018 11:00 am",
        "dateTimeISO": "2018-08-01T05:30:00.000Z",
        "title": "Q1 2019 Earnings Call",
        "icsUrl": "https://in.marketscreener.com/api/stateful/agenda/event-async/Q1-2019-Earnings-Call-26968382.ics"
      },
      {
        "section": "Past",
        "dateTimeRaw": "31/07/2018",
        "dateTimeISO": "2018-07-30T18:30:00.000Z",
        "title": "Q1 2019 Earnings Release",
        "icsUrl": "https://in.marketscreener.com/api/stateful/agenda/event-async/Q1-2019-Earnings-Release-25440898.ics"
      },
      {
        "section": "Past",
        "dateTimeRaw": "26/07/2018 11:00 am",
        "dateTimeISO": "2018-07-26T05:30:00.000Z",
        "title": "Annual General Meeting",
        "icsUrl": "https://in.marketscreener.com/api/stateful/agenda/event-async/Annual-General-Meeting-26523329.ics"
      },
      {
        "section": "Past",
        "dateTimeRaw": "04/07/2018",
        "dateTimeISO": "2018-07-03T18:30:00.000Z",
        "title": "Ex-dividend day for final dividend",
        "icsUrl": "https://in.marketscreener.com/api/stateful/agenda/event-async/Ex-dividend-day-for-final-dividend-26525951.ics"
      },
      {
        "section": "Past",
        "dateTimeRaw": "04/07/2018",
        "dateTimeISO": "2018-07-03T18:30:00.000Z",
        "title": "Anniversary bonus dividend",
        "icsUrl": "https://in.marketscreener.com/api/stateful/agenda/event-async/Anniversary-bonus-dividend-26525950.ics"
      },
      {
        "section": "Past",
        "dateTimeRaw": "02/05/2018 11:00 am",
        "dateTimeISO": "2018-05-02T05:30:00.000Z",
        "title": "FY 2018 Earnings Call",
        "icsUrl": "https://in.marketscreener.com/api/stateful/agenda/event-async/FY-2018-Earnings-Call-26298042.ics"
      },
      {
        "section": "Past",
        "dateTimeRaw": "01/05/2018",
        "dateTimeISO": "2018-04-30T18:30:00.000Z",
        "title": "FY 2018 Earnings Release",
        "icsUrl": "https://in.marketscreener.com/api/stateful/agenda/event-async/FY-2018-Earnings-Release-24762781.ics"
      },
      {
        "section": "Past",
        "dateTimeRaw": "31/01/2018 04:00 pm",
        "dateTimeISO": "2018-01-31T10:30:00.000Z",
        "title": "Q3 2018 Earnings Call",
        "icsUrl": "https://in.marketscreener.com/api/stateful/agenda/event-async/Q3-2018-Earnings-Call-25761069.ics"
      },
      {
        "section": "Past",
        "dateTimeRaw": "31/01/2018",
        "dateTimeISO": "2018-01-30T18:30:00.000Z",
        "title": "Q3 2018 Earnings Release",
        "icsUrl": "https://in.marketscreener.com/api/stateful/agenda/event-async/Q3-2018-Earnings-Release-24762774.ics"
      },
      {
        "section": "Past",
        "dateTimeRaw": "07/11/2017",
        "dateTimeISO": "2017-11-06T18:30:00.000Z",
        "title": "Ex-dividend day for dividende intermédiaire",
        "icsUrl": "https://in.marketscreener.com/api/stateful/agenda/event-async/Ex-dividend-day-for-dividende-intermediaire-25443517.ics"
      },
      {
        "section": "Past",
        "dateTimeRaw": "31/10/2017 04:30 pm",
        "dateTimeISO": "2017-10-31T11:00:00.000Z",
        "title": "Interim 2018 Earnings Call",
        "icsUrl": "https://in.marketscreener.com/api/stateful/agenda/event-async/Interim-2018-Earnings-Call-25328642.ics"
      },
      {
        "section": "Past",
        "dateTimeRaw": "31/10/2017",
        "dateTimeISO": "2017-10-30T18:30:00.000Z",
        "title": "Interim 2018 Earnings Release",
        "icsUrl": "https://in.marketscreener.com/api/stateful/agenda/event-async/Interim-2018-Earnings-Release-22786603.ics"
      },
      {
        "section": "Past",
        "dateTimeRaw": "04/08/2017 04:30 pm",
        "dateTimeISO": "2017-08-04T11:00:00.000Z",
        "title": "Q1 2018 Earnings Call",
        "icsUrl": "https://in.marketscreener.com/api/stateful/agenda/event-async/Q1-2018-Earnings-Call-24846646.ics"
      },
      {
        "section": "Past",
        "dateTimeRaw": "04/08/2017",
        "dateTimeISO": "2017-08-03T18:30:00.000Z",
        "title": "Q1 2018 Earnings Release",
        "icsUrl": "https://in.marketscreener.com/api/stateful/agenda/event-async/Q1-2018-Earnings-Release-22786057.ics"
      },
      {
        "section": "Past",
        "dateTimeRaw": "26/07/2017 11:00 am",
        "dateTimeISO": "2017-07-26T05:30:00.000Z",
        "title": "Annual General Meeting",
        "icsUrl": "https://in.marketscreener.com/api/stateful/agenda/event-async/Annual-General-Meeting-24686285.ics"
      },
      {
        "section": "Past",
        "dateTimeRaw": "05/07/2017",
        "dateTimeISO": "2017-07-04T18:30:00.000Z",
        "title": "Ex-dividend day for final dividend",
        "icsUrl": "https://in.marketscreener.com/api/stateful/agenda/event-async/Ex-dividend-day-for-final-dividend-24340919.ics"
      },
      {
        "section": "Past",
        "dateTimeRaw": "01/05/2017 04:30 pm",
        "dateTimeISO": "2017-05-01T11:00:00.000Z",
        "title": "FY 2017 Earnings Call",
        "icsUrl": "https://in.marketscreener.com/api/stateful/agenda/event-async/FY-2017-Earnings-Call-24398692.ics"
      },
      {
        "section": "Past",
        "dateTimeRaw": "01/05/2017",
        "dateTimeISO": "2017-04-30T18:30:00.000Z",
        "title": "FY 2017 Earnings Release",
        "icsUrl": "https://in.marketscreener.com/api/stateful/agenda/event-async/FY-2017-Earnings-Release-22662397.ics"
      },
      {
        "section": "Past",
        "dateTimeRaw": "31/01/2017 04:30 pm",
        "dateTimeISO": "2017-01-31T11:00:00.000Z",
        "title": "Q3 2017 Earnings Call",
        "icsUrl": "https://in.marketscreener.com/api/stateful/agenda/event-async/Q3-2017-Earnings-Call-23696869.ics"
      },
      {
        "section": "Past",
        "dateTimeRaw": "31/01/2017",
        "dateTimeISO": "2017-01-30T18:30:00.000Z",
        "title": "Q3 2017 Earnings Release",
        "icsUrl": "https://in.marketscreener.com/api/stateful/agenda/event-async/Q3-2017-Earnings-Release-21626380.ics"
      },
      {
        "section": "Past",
        "dateTimeRaw": "03/11/2016",
        "dateTimeISO": "2016-11-02T18:30:00.000Z",
        "title": "Ex-dividend day for dividende intermédiaire",
        "icsUrl": "https://in.marketscreener.com/api/stateful/agenda/event-async/Ex-dividend-day-for-dividende-intermediaire-23304649.ics"
      },
      {
        "section": "Past",
        "dateTimeRaw": "26/10/2016 04:00 pm",
        "dateTimeISO": "2016-10-26T10:30:00.000Z",
        "title": "Interim 2017 Earnings Call",
        "icsUrl": "https://in.marketscreener.com/api/stateful/agenda/event-async/Interim-2017-Earnings-Call-23185365.ics"
      },
      {
        "section": "Past",
        "dateTimeRaw": "26/10/2016",
        "dateTimeISO": "2016-10-25T18:30:00.000Z",
        "title": "Interim 2017 Earnings Release",
        "icsUrl": "https://in.marketscreener.com/api/stateful/agenda/event-async/Interim-2017-Earnings-Release-21142357.ics"
      },
      {
        "section": "Past",
        "dateTimeRaw": "27/07/2016 04:30 pm",
        "dateTimeISO": "2016-07-27T11:00:00.000Z",
        "title": "Q1 2017 Earnings Call",
        "icsUrl": "https://in.marketscreener.com/api/stateful/agenda/event-async/Q1-2017-Earnings-Call-22739582.ics"
      },
      {
        "section": "Past",
        "dateTimeRaw": "27/07/2016",
        "dateTimeISO": "2016-07-26T18:30:00.000Z",
        "title": "Q1 2017 Earnings Release",
        "icsUrl": "https://in.marketscreener.com/api/stateful/agenda/event-async/Q1-2017-Earnings-Release-20911379.ics"
      },
      {
        "section": "Past",
        "dateTimeRaw": "19/07/2016 11:00 am",
        "dateTimeISO": "2016-07-19T05:30:00.000Z",
        "title": "Annual General Meeting",
        "icsUrl": "https://in.marketscreener.com/api/stateful/agenda/event-async/Annual-General-Meeting-22274408.ics"
      },
      {
        "section": "Past",
        "dateTimeRaw": "29/06/2016",
        "dateTimeISO": "2016-06-28T18:30:00.000Z",
        "title": "Ex-dividend day for final dividend",
        "icsUrl": "https://in.marketscreener.com/api/stateful/agenda/event-async/Ex-dividend-day-for-final-dividend-22274829.ics"
      },
      {
        "section": "Past",
        "dateTimeRaw": "15/06/2016",
        "dateTimeISO": "2016-06-14T18:30:00.000Z",
        "title": "UBS Asian Consumer Conference",
        "icsUrl": "https://in.marketscreener.com/api/stateful/agenda/event-async/UBS-Asian-Consumer-Conference-22510605.ics"
      },
      {
        "section": "Past",
        "dateTimeRaw": "14/06/2016",
        "dateTimeISO": "2016-06-13T18:30:00.000Z",
        "title": "UBS Asian Consumer Conference",
        "icsUrl": "https://in.marketscreener.com/api/stateful/agenda/event-async/UBS-Asian-Consumer-Conference-22510518.ics"
      },
      {
        "section": "Past",
        "dateTimeRaw": "28/04/2016 04:30 pm",
        "dateTimeISO": "2016-04-28T11:00:00.000Z",
        "title": "FY 2016 Earnings Call",
        "icsUrl": "https://in.marketscreener.com/api/stateful/agenda/event-async/FY-2016-Earnings-Call-22184020.ics"
      },
      {
        "section": "Past",
        "dateTimeRaw": "28/04/2016",
        "dateTimeISO": "2016-04-27T18:30:00.000Z",
        "title": "FY 2016 Earnings Release",
        "icsUrl": "https://in.marketscreener.com/api/stateful/agenda/event-async/FY-2016-Earnings-Release-20907589.ics"
      },
      {
        "section": "Past",
        "dateTimeRaw": "28/01/2016 04:30 pm",
        "dateTimeISO": "2016-01-28T11:00:00.000Z",
        "title": "Q3 2016 Earnings Call",
        "icsUrl": "https://in.marketscreener.com/api/stateful/agenda/event-async/Q3-2016-Earnings-Call-21701679.ics"
      },
      {
        "section": "Past",
        "dateTimeRaw": "28/01/2016",
        "dateTimeISO": "2016-01-27T18:30:00.000Z",
        "title": "Q3 2016 Earnings Release",
        "icsUrl": "https://in.marketscreener.com/api/stateful/agenda/event-async/Q3-2016-Earnings-Release-20903064.ics"
      },
      {
        "section": "Past",
        "dateTimeRaw": "05/11/2015",
        "dateTimeISO": "2015-11-04T18:30:00.000Z",
        "title": "Ex-dividend day for dividende intermédiaire",
        "icsUrl": "https://in.marketscreener.com/api/stateful/agenda/event-async/Ex-dividend-day-for-dividende-intermediaire-21325052.ics"
      },
      {
        "section": "Past",
        "dateTimeRaw": "28/10/2015 04:30 pm",
        "dateTimeISO": "2015-10-28T11:00:00.000Z",
        "title": "Interim 2016 Earnings Call",
        "icsUrl": "https://in.marketscreener.com/api/stateful/agenda/event-async/Interim-2016-Earnings-Call-21217777.ics"
      },
      {
        "section": "Past",
        "dateTimeRaw": "28/10/2015",
        "dateTimeISO": "2015-10-27T18:30:00.000Z",
        "title": "Interim 2016 Earnings Release",
        "icsUrl": "https://in.marketscreener.com/api/stateful/agenda/event-async/Interim-2016-Earnings-Release-19180213.ics"
      },
      {
        "section": "Past",
        "dateTimeRaw": "29/07/2015 04:30 pm",
        "dateTimeISO": "2015-07-29T11:00:00.000Z",
        "title": "Q1 2016 Earnings Call",
        "icsUrl": "https://in.marketscreener.com/api/stateful/agenda/event-async/Q1-2016-Earnings-Call-20676538.ics"
      },
      {
        "section": "Past",
        "dateTimeRaw": "29/07/2015",
        "dateTimeISO": "2015-07-28T18:30:00.000Z",
        "title": "Q1 2016 Earnings Release",
        "icsUrl": "https://in.marketscreener.com/api/stateful/agenda/event-async/Q1-2016-Earnings-Release-18722386.ics"
      },
      {
        "section": "Past",
        "dateTimeRaw": "21/07/2015",
        "dateTimeISO": "2015-07-20T18:30:00.000Z",
        "title": "Annual General Meeting",
        "icsUrl": "https://in.marketscreener.com/api/stateful/agenda/event-async/Annual-General-Meeting-20348949.ics"
      },
      {
        "section": "Past",
        "dateTimeRaw": "29/06/2015",
        "dateTimeISO": "2015-06-28T18:30:00.000Z",
        "title": "Ex-dividend day for final dividend",
        "icsUrl": "https://in.marketscreener.com/api/stateful/agenda/event-async/Ex-dividend-day-for-final-dividend-20349371.ics"
      },
      {
        "section": "Past",
        "dateTimeRaw": "07/05/2015 04:00 pm",
        "dateTimeISO": "2015-05-07T10:30:00.000Z",
        "title": "FY 2015 Earnings Call",
        "icsUrl": "https://in.marketscreener.com/api/stateful/agenda/event-async/FY-2015-Earnings-Call-20176354.ics"
      },
      {
        "section": "Past",
        "dateTimeRaw": "05/05/2015",
        "dateTimeISO": "2015-05-04T18:30:00.000Z",
        "title": "FY 2015 Earnings Release",
        "icsUrl": "https://in.marketscreener.com/api/stateful/agenda/event-async/FY-2015-Earnings-Release-18255314.ics"
      },
      {
        "section": "Past",
        "dateTimeRaw": "30/01/2015 04:45 pm",
        "dateTimeISO": "2015-01-30T11:15:00.000Z",
        "title": "Q3 2015 Earnings Call",
        "icsUrl": "https://in.marketscreener.com/api/stateful/agenda/event-async/Q3-2015-Earnings-Call-19710578.ics"
      },
      {
        "section": "Past",
        "dateTimeRaw": "30/01/2015",
        "dateTimeISO": "2015-01-29T18:30:00.000Z",
        "title": "Q3 2015 Earnings Release",
        "icsUrl": "https://in.marketscreener.com/api/stateful/agenda/event-async/Q3-2015-Earnings-Release-17788055.ics"
      },
      {
        "section": "Past",
        "dateTimeRaw": "19/09/2014",
        "dateTimeISO": "2014-09-18T18:30:00.000Z",
        "title": "Ex-dividend day for dividende intermédiaire",
        "icsUrl": "https://in.marketscreener.com/api/stateful/agenda/event-async/Ex-dividend-day-for-dividende-intermediaire-19078273.ics"
      },
      {
        "section": "Past",
        "dateTimeRaw": "27/06/2014",
        "dateTimeISO": "2014-06-26T18:30:00.000Z",
        "title": "Ex-dividend day for final dividend",
        "icsUrl": "https://in.marketscreener.com/api/stateful/agenda/event-async/Ex-dividend-day-for-final-dividend-18376818.ics"
      },
      {
        "section": "Past",
        "dateTimeRaw": "05/11/2013",
        "dateTimeISO": "2013-11-04T18:30:00.000Z",
        "title": "Ex-dividend day for dividende intermédiaire",
        "icsUrl": "https://in.marketscreener.com/api/stateful/agenda/event-async/Ex-dividend-day-for-dividende-intermediaire-17424017.ics"
      },
      {
        "section": "Past",
        "dateTimeRaw": "21/06/2013",
        "dateTimeISO": "2013-06-20T18:30:00.000Z",
        "title": "Ex-dividend day for final dividend",
        "icsUrl": "https://in.marketscreener.com/api/stateful/agenda/event-async/Ex-dividend-day-for-final-dividend-16811836.ics"
      },
      {
        "section": "Past",
        "dateTimeRaw": "31/10/2012",
        "dateTimeISO": "2012-10-30T18:30:00.000Z",
        "title": "Ex-dividend day for dividende intermédiaire",
        "icsUrl": "https://in.marketscreener.com/api/stateful/agenda/event-async/Ex-dividend-day-for-dividende-intermediaire-15426996.ics"
      },
      {
        "section": "Past",
        "dateTimeRaw": "27/06/2012",
        "dateTimeISO": "2012-06-26T18:30:00.000Z",
        "title": "Ex-dividend day for final dividend",
        "icsUrl": "https://in.marketscreener.com/api/stateful/agenda/event-async/Ex-dividend-day-for-final-dividend-15294250.ics"
      },
      {
        "section": "Past",
        "dateTimeRaw": "04/11/2011",
        "dateTimeISO": "2011-11-03T18:30:00.000Z",
        "title": "Ex-dividend day for dividende intermédiaire",
        "icsUrl": "https://in.marketscreener.com/api/stateful/agenda/event-async/Ex-dividend-day-for-dividende-intermediaire-15294251.ics"
      }
    ]
  },
  "pastDividends": {
    "count": 51,
    "dividends": [
      {
        "section": "Past Dividends",
        "dateRaw": "18/07/2025",
        "dateISO": "2025-07-17T18:30:00.000Z",
        "type": "Final Payment",
        "amount": 5.25,
        "currency": "INR",
        "title": "Final Payment 5.25 INR"
      },
      {
        "section": "Past Dividends",
        "dateRaw": "08/11/2024",
        "dateISO": "2024-11-07T18:30:00.000Z",
        "type": "Interim Payment",
        "amount": 2.75,
        "currency": "INR",
        "title": "Interim Payment 2.75 INR"
      },
      {
        "section": "Past Dividends",
        "dateRaw": "19/07/2024",
        "dateISO": "2024-07-18T18:30:00.000Z",
        "type": "Final Payment",
        "amount": 2.75,
        "currency": "INR",
        "title": "Final Payment 2.75 INR"
      },
      {
        "section": "Past Dividends",
        "dateRaw": "10/11/2023",
        "dateISO": "2023-11-09T18:30:00.000Z",
        "type": "Interim Payment",
        "amount": 2.75,
        "currency": "INR",
        "title": "Interim Payment 2.75 INR"
      },
      {
        "section": "Past Dividends",
        "dateRaw": "21/07/2023",
        "dateISO": "2023-07-20T18:30:00.000Z",
        "type": "Final Payment",
        "amount": 2.7,
        "currency": "INR",
        "title": "Final Payment 2.7 INR"
      },
      {
        "section": "Past Dividends",
        "dateRaw": "03/11/2022",
        "dateISO": "2022-11-02T18:30:00.000Z",
        "type": "Interim Payment",
        "amount": 2.5,
        "currency": "INR",
        "title": "Interim Payment 2.5 INR"
      },
      {
        "section": "Past Dividends",
        "dateRaw": "21/07/2022",
        "dateISO": "2022-07-20T18:30:00.000Z",
        "type": "Final Payment",
        "amount": 2.7,
        "currency": "INR",
        "title": "Final Payment 2.7 INR"
      },
      {
        "section": "Past Dividends",
        "dateRaw": "11/11/2021",
        "dateISO": "2021-11-10T18:30:00.000Z",
        "type": "Interim Payment",
        "amount": 2.5,
        "currency": "INR",
        "title": "Interim Payment 2.5 INR"
      },
      {
        "section": "Past Dividends",
        "dateRaw": "29/07/2021",
        "dateISO": "2021-07-28T18:30:00.000Z",
        "type": "Final Payment",
        "amount": 3,
        "currency": "INR",
        "title": "Final Payment 3 INR"
      },
      {
        "section": "Past Dividends",
        "dateRaw": "11/11/2020",
        "dateISO": "2020-11-10T18:30:00.000Z",
        "type": "Interim Payment",
        "amount": 1.75,
        "currency": "INR",
        "title": "Interim Payment 1.75 INR"
      },
      {
        "section": "Past Dividends",
        "dateRaw": "13/08/2020",
        "dateISO": "2020-08-12T18:30:00.000Z",
        "type": "Final Payment",
        "amount": 1.6,
        "currency": "INR",
        "title": "Final Payment 1.6 INR"
      },
      {
        "section": "Past Dividends",
        "dateRaw": "13/11/2019",
        "dateISO": "2019-11-12T18:30:00.000Z",
        "type": "Interim Payment",
        "amount": 1.4,
        "currency": "INR",
        "title": "Interim Payment 1.4 INR"
      },
      {
        "section": "Past Dividends",
        "dateRaw": "07/08/2019",
        "dateISO": "2019-08-06T18:30:00.000Z",
        "type": "Final Payment",
        "amount": 1.5,
        "currency": "INR",
        "title": "Final Payment 1.5 INR"
      },
      {
        "section": "Past Dividends",
        "dateRaw": "09/11/2018",
        "dateISO": "2018-11-08T18:30:00.000Z",
        "type": "Interim Payment",
        "amount": 1.25,
        "currency": "INR",
        "title": "Interim Payment 1.25 INR"
      },
      {
        "section": "Past Dividends",
        "dateRaw": "04/07/2018",
        "dateISO": "2018-07-03T18:30:00.000Z",
        "type": "Bonus Payment",
        "amount": 5,
        "currency": "INR",
        "title": "Bonus Payment 5 INR"
      },
      {
        "section": "Past Dividends",
        "dateRaw": "04/07/2018",
        "dateISO": "2018-07-03T18:30:00.000Z",
        "type": "Final Payment",
        "amount": 1.25,
        "currency": "INR",
        "title": "Final Payment 1.25 INR"
      },
      {
        "section": "Past Dividends",
        "dateRaw": "07/11/2017",
        "dateISO": "2017-11-06T18:30:00.000Z",
        "type": "Interim Payment",
        "amount": 1.25,
        "currency": "INR",
        "title": "Interim Payment 1.25 INR"
      },
      {
        "section": "Past Dividends",
        "dateRaw": "05/07/2017",
        "dateISO": "2017-07-04T18:30:00.000Z",
        "type": "Final Payment",
        "amount": 1,
        "currency": "INR",
        "title": "Final Payment 1 INR"
      },
      {
        "section": "Past Dividends",
        "dateRaw": "03/11/2016",
        "dateISO": "2016-11-02T18:30:00.000Z",
        "type": "Interim Payment",
        "amount": 1.25,
        "currency": "INR",
        "title": "Interim Payment 1.25 INR"
      },
      {
        "section": "Past Dividends",
        "dateRaw": "29/06/2016",
        "dateISO": "2016-06-28T18:30:00.000Z",
        "type": "Final Payment",
        "amount": 1,
        "currency": "INR",
        "title": "Final Payment 1 INR"
      },
      {
        "section": "Past Dividends",
        "dateRaw": "05/11/2015",
        "dateISO": "2015-11-04T18:30:00.000Z",
        "type": "Interim Payment",
        "amount": 1.25,
        "currency": "INR",
        "title": "Interim Payment 1.25 INR"
      },
      {
        "section": "Past Dividends",
        "dateRaw": "29/06/2015",
        "dateISO": "2015-06-28T18:30:00.000Z",
        "type": "Final Payment",
        "amount": 0.75,
        "currency": "INR",
        "title": "Final Payment 0.75 INR"
      },
      {
        "section": "Past Dividends",
        "dateRaw": "19/09/2014",
        "dateISO": "2014-09-18T18:30:00.000Z",
        "type": "Interim Payment",
        "amount": 1.25,
        "currency": "INR",
        "title": "Interim Payment 1.25 INR"
      },
      {
        "section": "Past Dividends",
        "dateRaw": "27/06/2014",
        "dateISO": "2014-06-26T18:30:00.000Z",
        "type": "Final Payment",
        "amount": 1,
        "currency": "INR",
        "title": "Final Payment 1 INR"
      },
      {
        "section": "Past Dividends",
        "dateRaw": "05/11/2013",
        "dateISO": "2013-11-04T18:30:00.000Z",
        "type": "Interim Payment",
        "amount": 0.75,
        "currency": "INR",
        "title": "Interim Payment 0.75 INR"
      },
      {
        "section": "Past Dividends",
        "dateRaw": "21/06/2013",
        "dateISO": "2013-06-20T18:30:00.000Z",
        "type": "Final Payment",
        "amount": 0.85,
        "currency": "INR",
        "title": "Final Payment 0.85 INR"
      },
      {
        "section": "Past Dividends",
        "dateRaw": "31/10/2012",
        "dateISO": "2012-10-30T18:30:00.000Z",
        "type": "Interim Payment",
        "amount": 0.65,
        "currency": "INR",
        "title": "Interim Payment 0.65 INR"
      },
      {
        "section": "Past Dividends",
        "dateRaw": "27/06/2012",
        "dateISO": "2012-06-26T18:30:00.000Z",
        "type": "Final Payment",
        "amount": 0.75,
        "currency": "INR",
        "title": "Final Payment 0.75 INR"
      },
      {
        "section": "Past Dividends",
        "dateRaw": "04/11/2011",
        "dateISO": "2011-11-03T18:30:00.000Z",
        "type": "Interim Payment",
        "amount": 0.55,
        "currency": "INR",
        "title": "Interim Payment 0.55 INR"
      },
      {
        "section": "Past Dividends",
        "dateRaw": "29/06/2011",
        "dateISO": "2011-06-28T18:30:00.000Z",
        "type": "Final Payment",
        "amount": 0.65,
        "currency": "INR",
        "title": "Final Payment 0.65 INR"
      },
      {
        "section": "Past Dividends",
        "dateRaw": "02/11/2010",
        "dateISO": "2010-11-01T18:30:00.000Z",
        "type": "Interim Payment",
        "amount": 0.5,
        "currency": "INR",
        "title": "Interim Payment 0.5 INR"
      },
      {
        "section": "Past Dividends",
        "dateRaw": "03/08/2010",
        "dateISO": "2010-08-02T18:30:00.000Z",
        "type": "Final Payment",
        "amount": 1.25,
        "currency": "INR",
        "title": "Final Payment 1.25 INR"
      },
      {
        "section": "Past Dividends",
        "dateRaw": "30/10/2009",
        "dateISO": "2009-10-29T18:30:00.000Z",
        "type": "Interim Payment",
        "amount": 0.75,
        "currency": "INR",
        "title": "Interim Payment 0.75 INR"
      },
      {
        "section": "Past Dividends",
        "dateRaw": "29/06/2009",
        "dateISO": "2009-06-28T18:30:00.000Z",
        "type": "Final Payment",
        "amount": 1,
        "currency": "INR",
        "title": "Final Payment 1 INR"
      },
      {
        "section": "Past Dividends",
        "dateRaw": "02/02/2009",
        "dateISO": "2009-02-01T18:30:00.000Z",
        "type": "Interim Payment",
        "amount": 0.75,
        "currency": "INR",
        "title": "Interim Payment 0.75 INR"
      },
      {
        "section": "Past Dividends",
        "dateRaw": "19/06/2008",
