{
  "companyCode": "FORTIS-HEALTHCARE-LIMITED-9059727",
  "timestamp": "2025-10-13T12:23:23.256Z",
  "annualResults": {
    "2023": {
      "Net salesMillion INR": {
        "metric": "Net salesMillion INR",
        "unit": "Million INR",
        "fiscalMonth": "March",
        "year": "2023",
        "released": "62 976",
        "forecast": "63 170",
        "spreadRaw": "-0.31%"
      },
      "EBITDAMillion INR": {
        "metric": "EBITDAMillion INR",
        "unit": "Million INR",
        "fiscalMonth": "March",
        "year": "2023",
        "released": "11 013",
        "forecast": "11 360",
        "spreadRaw": "-3.05%"
      },
      "EBITMillion INR": {
        "metric": "EBITMillion INR",
        "unit": "Million INR",
        "fiscalMonth": "March",
        "year": "2023",
        "released": "7 856",
        "forecast": "8 250",
        "spreadRaw": "-4.77%"
      },
      "Earnings before Tax (EBT)Million INR": {
        "metric": "Earnings before Tax (EBT)Million INR",
        "unit": "Million INR",
        "fiscalMonth": "March",
        "year": "2023",
        "released": "8 137",
        "forecast": "7 893",
        "spreadRaw": "3.09%"
      },
      "Net incomeMillion INR": {
        "metric": "Net incomeMillion INR",
        "unit": "Million INR",
        "fiscalMonth": "March",
        "year": "2023",
        "released": "5 887",
        "forecast": "5 637",
        "spreadRaw": "4.44%"
      },
      "EPS INR": {
        "metric": "EPS INR",
        "unit": "INR",
        "fiscalMonth": "March",
        "year": "2023",
        "released": "7,80",
        "forecast": "7,14",
        "spreadRaw": "9.24%"
      },
      "Announcement Date": {
        "metric": "Announcement Date",
        "unit": null,
        "fiscalMonth": "March",
        "year": "2023",
        "released": "23/05/23",
        "forecast": null,
        "spreadRaw": null
      }
    },
    "2024": {
      "Net salesMillion INR": {
        "metric": "Net salesMillion INR",
        "unit": "Million INR",
        "fiscalMonth": "March",
        "year": "2024",
        "released": "68 929",
        "forecast": "69 640",
        "spreadRaw": "-1.02%"
      },
      "EBITDAMillion INR": {
        "metric": "EBITDAMillion INR",
        "unit": "Million INR",
        "fiscalMonth": "March",
        "year": "2024",
        "released": "12 676",
        "forecast": "12 252",
        "spreadRaw": "3.46%"
      },
      "EBITMillion INR": {
        "metric": "EBITMillion INR",
        "unit": "Million INR",
        "fiscalMonth": "March",
        "year": "2024",
        "released": "9 251",
        "forecast": "8 936",
        "spreadRaw": "3.53%"
      },
      "Earnings before Tax (EBT)Million INR": {
        "metric": "Earnings before Tax (EBT)Million INR",
        "unit": "Million INR",
        "fiscalMonth": "March",
        "year": "2024",
        "released": "8 580",
        "forecast": "8 311",
        "spreadRaw": "3.24%"
      },
      "Net incomeMillion INR": {
        "metric": "Net incomeMillion INR",
        "unit": "Million INR",
        "fiscalMonth": "March",
        "year": "2024",
        "released": "6 011",
        "forecast": "6 062",
        "spreadRaw": "-0.84%"
      },
      "EPS INR": {
        "metric": "EPS INR",
        "unit": "INR",
        "fiscalMonth": "March",
        "year": "2024",
        "released": "7,93",
        "forecast": "8,02",
        "spreadRaw": "-1.09%"
      },
      "Announcement Date": {
        "metric": "Announcement Date",
        "unit": null,
        "fiscalMonth": "March",
        "year": "2024",
        "released": "23/05/24",
        "forecast": null,
        "spreadRaw": null
      }
    },
    "2025": {
      "Net salesMillion INR": {
        "metric": "Net salesMillion INR",
        "unit": "Million INR",
        "fiscalMonth": "March",
        "year": "2025",
        "released": "77 828",
        "forecast": "78 236",
        "spreadRaw": "-0.52%"
      },
      "EBITDAMillion INR": {
        "metric": "EBITDAMillion INR",
        "unit": "Million INR",
        "fiscalMonth": "March",
        "year": "2025",
        "released": "15 879",
        "forecast": "15 927",
        "spreadRaw": "-0.3%"
      },
      "EBITMillion INR": {
        "metric": "EBITMillion INR",
        "unit": "Million INR",
        "fiscalMonth": "March",
        "year": "2025",
        "released": "12 023",
        "forecast": "12 176",
        "spreadRaw": "-1.25%"
      },
      "Earnings before Tax (EBT)Million INR": {
        "metric": "Earnings before Tax (EBT)Million INR",
        "unit": "Million INR",
        "fiscalMonth": "March",
        "year": "2025",
        "released": "10 070",
        "forecast": "10 810",
        "spreadRaw": "-6.84%"
      },
      "Net incomeMillion INR": {
        "metric": "Net incomeMillion INR",
        "unit": "Million INR",
        "fiscalMonth": "March",
        "year": "2025",
        "released": "7 742",
        "forecast": "8 067",
        "spreadRaw": "-4.03%"
      },
      "EPS INR": {
        "metric": "EPS INR",
        "unit": "INR",
        "fiscalMonth": "March",
        "year": "2025",
        "released": "10,3",
        "forecast": "10,7",
        "spreadRaw": "-3.89%"
      },
      "Announcement Date": {
        "metric": "Announcement Date",
        "unit": null,
        "fiscalMonth": "March",
        "year": "2025",
        "released": "20/05/25",
        "forecast": null,
        "spreadRaw": null
      }
    },
    "2026": {
      "Net salesMillion INR": {
        "metric": "Net salesMillion INR",
        "unit": "Million INR",
        "fiscalMonth": "March",
        "year": "2026",
        "released": null,
        "forecast": "92 206",
        "spreadRaw": null
      },
      "EBITDAMillion INR": {
        "metric": "EBITDAMillion INR",
        "unit": "Million INR",
        "fiscalMonth": "March",
        "year": "2026",
        "released": null,
        "forecast": "21 151",
        "spreadRaw": null
      },
      "EBITMillion INR": {
        "metric": "EBITMillion INR",
        "unit": "Million INR",
        "fiscalMonth": "March",
        "year": "2026",
        "released": null,
        "forecast": "17 098",
        "spreadRaw": null
      },
      "Earnings before Tax (EBT)Million INR": {
        "metric": "Earnings before Tax (EBT)Million INR",
        "unit": "Million INR",
        "fiscalMonth": "March",
        "year": "2026",
        "released": null,
        "forecast": "14 942",
        "spreadRaw": null
      },
      "Net incomeMillion INR": {
        "metric": "Net incomeMillion INR",
        "unit": "Million INR",
        "fiscalMonth": "March",
        "year": "2026",
        "released": null,
        "forecast": "11 136",
        "spreadRaw": null
      },
      "EPS INR": {
        "metric": "EPS INR",
        "unit": "INR",
        "fiscalMonth": "March",
        "year": "2026",
        "released": null,
        "forecast": "14,7",
        "spreadRaw": null
      },
      "Announcement Date": {
        "metric": "Announcement Date",
        "unit": null,
        "fiscalMonth": "March",
        "year": "2026",
        "released": "-",
        "forecast": null,
        "spreadRaw": null
      }
    },
    "2027": {
      "Net salesMillion INR": {
        "metric": "Net salesMillion INR",
        "unit": "Million INR",
        "fiscalMonth": "March",
        "year": "2027",
        "released": null,
        "forecast": "107 191",
        "spreadRaw": null
      },
      "EBITDAMillion INR": {
        "metric": "EBITDAMillion INR",
        "unit": "Million INR",
        "fiscalMonth": "March",
        "year": "2027",
        "released": null,
        "forecast": "25 651",
        "spreadRaw": null
      },
      "EBITMillion INR": {
        "metric": "EBITMillion INR",
        "unit": "Million INR",
        "fiscalMonth": "March",
        "year": "2027",
        "released": null,
        "forecast": "21 479",
        "spreadRaw": null
      },
      "Earnings before Tax (EBT)Million INR": {
        "metric": "Earnings before Tax (EBT)Million INR",
        "unit": "Million INR",
        "fiscalMonth": "March",
        "year": "2027",
        "released": null,
        "forecast": "19 389",
        "spreadRaw": null
      },
      "Net incomeMillion INR": {
        "metric": "Net incomeMillion INR",
        "unit": "Million INR",
        "fiscalMonth": "March",
        "year": "2027",
        "released": null,
        "forecast": "14 402",
        "spreadRaw": null
      },
      "EPS INR": {
        "metric": "EPS INR",
        "unit": "INR",
        "fiscalMonth": "March",
        "year": "2027",
        "released": null,
        "forecast": "19,3",
        "spreadRaw": null
      },
      "Announcement Date": {
        "metric": "Announcement Date",
        "unit": null,
        "fiscalMonth": "March",
        "year": "2027",
        "released": null,
        "forecast": null,
        "spreadRaw": null
      }
    },
    "2028": {
      "Net salesMillion INR": {
        "metric": "Net salesMillion INR",
        "unit": "Million INR",
        "fiscalMonth": "March",
        "year": "2028",
        "released": null,
        "forecast": "122 774",
        "spreadRaw": null
      },
      "EBITDAMillion INR": {
        "metric": "EBITDAMillion INR",
        "unit": "Million INR",
        "fiscalMonth": "March",
        "year": "2028",
        "released": null,
        "forecast": "30 066",
        "spreadRaw": null
      },
      "EBITMillion INR": {
        "metric": "EBITMillion INR",
        "unit": "Million INR",
        "fiscalMonth": "March",
        "year": "2028",
        "released": null,
        "forecast": "26 002",
        "spreadRaw": null
      },
      "Earnings before Tax (EBT)Million INR": {
        "metric": "Earnings before Tax (EBT)Million INR",
        "unit": "Million INR",
        "fiscalMonth": "March",
        "year": "2028",
        "released": null,
        "forecast": "24 688",
        "spreadRaw": null
      },
      "Net incomeMillion INR": {
        "metric": "Net incomeMillion INR",
        "unit": "Million INR",
        "fiscalMonth": "March",
        "year": "2028",
        "released": null,
        "forecast": "18 223",
        "spreadRaw": null
      },
      "EPS INR": {
        "metric": "EPS INR",
        "unit": "INR",
        "fiscalMonth": "March",
        "year": "2028",
        "released": null,
        "forecast": "24,9",
        "spreadRaw": null
      },
      "Announcement Date": {
        "metric": "Announcement Date",
        "unit": null,
        "fiscalMonth": "March",
        "year": "2028",
        "released": null,
        "forecast": null,
        "spreadRaw": null
      }
    }
  },
  "quarterlyResults": {
    "2024 Q2": {
      "Net salesMillion INR": {
        "metric": "Net salesMillion INR",
        "unit": "Million INR",
        "fiscalMonth": "March",
        "period": "2024 Q2",
        "released": "17 700",
        "releasedNum": 17700,
        "forecast": "17 668",
        "forecastNum": 17668,
        "spreadRaw": "0.18%",
        "spreadPct": 0.18
      },
      "EBITDAMillion INR": {
        "metric": "EBITDAMillion INR",
        "unit": "Million INR",
        "fiscalMonth": "March",
        "period": "2024 Q2",
        "released": "3 302",
        "releasedNum": 3302,
        "forecast": "3 328",
        "forecastNum": 3328,
        "spreadRaw": "-0.79%",
        "spreadPct": -0.79
      },
      "EBITMillion INR": {
        "metric": "EBITMillion INR",
        "unit": "Million INR",
        "fiscalMonth": "March",
        "period": "2024 Q2",
        "released": "2 461",
        "releasedNum": 2461,
        "forecast": "2 411",
        "forecastNum": 2411,
        "spreadRaw": "2.04%",
        "spreadPct": 2.04
      },
      "Earnings before Tax (EBT)Million INR": {
        "metric": "Earnings before Tax (EBT)Million INR",
        "unit": "Million INR",
        "fiscalMonth": "March",
        "period": "2024 Q2",
        "released": "2 327",
        "releasedNum": 2327,
        "forecast": "2 235",
        "forecastNum": 2235,
        "spreadRaw": "4.12%",
        "spreadPct": 4.12
      },
      "Net incomeMillion INR": {
        "metric": "Net incomeMillion INR",
        "unit": "Million INR",
        "fiscalMonth": "March",
        "period": "2024 Q2",
        "released": "1 737",
        "releasedNum": 1737,
        "forecast": "1 548",
        "forecastNum": 1548,
        "spreadRaw": "12.22%",
        "spreadPct": 12.22
      },
      "EPS INR": {
        "metric": "EPS INR",
        "unit": "INR",
        "fiscalMonth": "March",
        "period": "2024 Q2",
        "released": null,
        "releasedNum": null,
        "forecast": null,
        "forecastNum": null,
        "spreadRaw": null,
        "spreadPct": null
      },
      "Announcement Date": {
        "metric": "Announcement Date",
        "unit": null,
        "fiscalMonth": "March",
        "period": "2024 Q2",
        "released": "10/11/23",
        "releasedDate": "10/11/23",
        "forecast": null,
        "spreadRaw": null,
        "spreadPct": null
      }
    },
    "2024 Q3": {
      "Net salesMillion INR": {
        "metric": "Net salesMillion INR",
        "unit": "Million INR",
        "fiscalMonth": "March",
        "period": "2024 Q3",
        "released": "16 797",
        "releasedNum": 16797,
        "forecast": "17 349",
        "forecastNum": 17349,
        "spreadRaw": "-3.18%",
        "spreadPct": -3.18
      },
      "EBITDAMillion INR": {
        "metric": "EBITDAMillion INR",
        "unit": "Million INR",
        "fiscalMonth": "March",
        "period": "2024 Q3",
        "released": "2 840",
        "releasedNum": 2840,
        "forecast": "3 142",
        "forecastNum": 3142,
        "spreadRaw": "-9.63%",
        "spreadPct": -9.63
      },
      "EBITMillion INR": {
        "metric": "EBITMillion INR",
        "unit": "Million INR",
        "fiscalMonth": "March",
        "period": "2024 Q3",
        "released": "1 971",
        "releasedNum": 1971,
        "forecast": "2 165",
        "forecastNum": 2165,
        "spreadRaw": "-8.98%",
        "spreadPct": -8.98
      },
      "Earnings before Tax (EBT)Million INR": {
        "metric": "Earnings before Tax (EBT)Million INR",
        "unit": "Million INR",
        "fiscalMonth": "March",
        "period": "2024 Q3",
        "released": "1 832",
        "releasedNum": 1832,
        "forecast": "2 399",
        "forecastNum": 2399,
        "spreadRaw": "-23.66%",
        "spreadPct": -23.66
      },
      "Net incomeMillion INR": {
        "metric": "Net incomeMillion INR",
        "unit": "Million INR",
        "fiscalMonth": "March",
        "period": "2024 Q3",
        "released": "1 347",
        "releasedNum": 1347,
        "forecast": "1 611",
        "forecastNum": 1611,
        "spreadRaw": "-16.42%",
        "spreadPct": -16.42
      },
      "EPS INR": {
        "metric": "EPS INR",
        "unit": "INR",
        "fiscalMonth": "March",
        "period": "2024 Q3",
        "released": "1,78",
        "releasedNum": 1.78,
        "forecast": "2,20",
        "forecastNum": 2.2,
        "spreadRaw": "-19.09%",
        "spreadPct": -19.09
      },
      "Announcement Date": {
        "metric": "Announcement Date",
        "unit": null,
        "fiscalMonth": "March",
        "period": "2024 Q3",
        "released": "07/02/24",
        "releasedDate": "07/02/24",
        "forecast": null,
        "spreadRaw": null,
        "spreadPct": null
      }
    },
    "2024 Q4": {
      "Net salesMillion INR": {
        "metric": "Net salesMillion INR",
        "unit": "Million INR",
        "fiscalMonth": "March",
        "period": "2024 Q4",
        "released": "17 859",
        "releasedNum": 17859,
        "forecast": "18 043",
        "forecastNum": 18043,
        "spreadRaw": "-1.02%",
        "spreadPct": -1.02
      },
      "EBITDAMillion INR": {
        "metric": "EBITDAMillion INR",
        "unit": "Million INR",
        "fiscalMonth": "March",
        "period": "2024 Q4",
        "released": "3 810",
        "releasedNum": 3810,
        "forecast": "3 396",
        "forecastNum": 3396,
        "spreadRaw": "12.2%",
        "spreadPct": 12.2
      },
      "EBITMillion INR": {
        "metric": "EBITMillion INR",
        "unit": "Million INR",
        "fiscalMonth": "March",
        "period": "2024 Q4",
        "released": "2 888",
        "releasedNum": 2888,
        "forecast": "2 380",
        "forecastNum": 2380,
        "spreadRaw": "21.36%",
        "spreadPct": 21.36
      },
      "Earnings before Tax (EBT)Million INR": {
        "metric": "Earnings before Tax (EBT)Million INR",
        "unit": "Million INR",
        "fiscalMonth": "March",
        "period": "2024 Q4",
        "released": "2 714",
        "releasedNum": 2714,
        "forecast": "2 630",
        "forecastNum": 2630,
        "spreadRaw": "3.19%",
        "spreadPct": 3.19
      },
      "Net incomeMillion INR": {
        "metric": "Net incomeMillion INR",
        "unit": "Million INR",
        "fiscalMonth": "March",
        "period": "2024 Q4",
        "released": "1 789",
        "releasedNum": 1789,
        "forecast": "1 743",
        "forecastNum": 1743,
        "spreadRaw": "2.64%",
        "spreadPct": 2.64
      },
      "EPS INR": {
        "metric": "EPS INR",
        "unit": "INR",
        "fiscalMonth": "March",
        "period": "2024 Q4",
        "released": null,
        "releasedNum": null,
        "forecast": null,
        "forecastNum": null,
        "spreadRaw": null,
        "spreadPct": null
      },
      "Announcement Date": {
        "metric": "Announcement Date",
        "unit": null,
        "fiscalMonth": "March",
        "period": "2024 Q4",
        "released": "23/05/24",
        "releasedDate": "23/05/24",
        "forecast": null,
        "spreadRaw": null,
        "spreadPct": null
      }
    },
    "2025 Q1": {
      "Net salesMillion INR": {
        "metric": "Net salesMillion INR",
        "unit": "Million INR",
        "fiscalMonth": "March",
        "period": "2025 Q1",
        "released": "18 589",
        "releasedNum": 18589,
        "forecast": "18 372",
        "forecastNum": 18372,
        "spreadRaw": "1.18%",
        "spreadPct": 1.18
      },
      "EBITDAMillion INR": {
        "metric": "EBITDAMillion INR",
        "unit": "Million INR",
        "fiscalMonth": "March",
        "period": "2025 Q1",
        "released": "3 425",
        "releasedNum": 3425,
        "forecast": "3 594",
        "forecastNum": 3594,
        "spreadRaw": "-4.69%",
        "spreadPct": -4.69
      },
      "EBITMillion INR": {
        "metric": "EBITMillion INR",
        "unit": "Million INR",
        "fiscalMonth": "March",
        "period": "2025 Q1",
        "released": "2 515",
        "releasedNum": 2515,
        "forecast": "2 423",
        "forecastNum": 2423,
        "spreadRaw": "3.82%",
        "spreadPct": 3.82
      },
      "Earnings before Tax (EBT)Million INR": {
        "metric": "Earnings before Tax (EBT)Million INR",
        "unit": "Million INR",
        "fiscalMonth": "March",
        "period": "2025 Q1",
        "released": "2 301",
        "releasedNum": 2301,
        "forecast": "2 413",
        "forecastNum": 2413,
        "spreadRaw": "-4.66%",
        "spreadPct": -4.66
      },
      "Net incomeMillion INR": {
        "metric": "Net incomeMillion INR",
        "unit": "Million INR",
        "fiscalMonth": "March",
        "period": "2025 Q1",
        "released": "1 660",
        "releasedNum": 1660,
        "forecast": "1 716",
        "forecastNum": 1716,
        "spreadRaw": "-3.29%",
        "spreadPct": -3.29
      },
      "EPS INR": {
        "metric": "EPS INR",
        "unit": "INR",
        "fiscalMonth": "March",
        "period": "2025 Q1",
        "released": null,
        "releasedNum": null,
        "forecast": null,
        "forecastNum": null,
        "spreadRaw": null,
        "spreadPct": null
      },
      "Announcement Date": {
        "metric": "Announcement Date",
        "unit": null,
        "fiscalMonth": "March",
        "period": "2025 Q1",
        "released": "06/08/24",
        "releasedDate": "06/08/24",
        "forecast": null,
        "spreadRaw": null,
        "spreadPct": null
      }
    },
    "2025 Q2": {
      "Net salesMillion INR": {
        "metric": "Net salesMillion INR",
        "unit": "Million INR",
        "fiscalMonth": "March",
        "period": "2025 Q2",
        "released": "19 884",
        "releasedNum": 19884,
        "forecast": "19 786",
        "forecastNum": 19786,
        "spreadRaw": "0.49%",
        "spreadPct": 0.49
      },
      "EBITDAMillion INR": {
        "metric": "EBITDAMillion INR",
        "unit": "Million INR",
        "fiscalMonth": "March",
        "period": "2025 Q2",
        "released": "4 348",
        "releasedNum": 4348,
        "forecast": "3 928",
        "forecastNum": 3928,
        "spreadRaw": "10.71%",
        "spreadPct": 10.71
      },
      "EBITMillion INR": {
        "metric": "EBITMillion INR",
        "unit": "Million INR",
        "fiscalMonth": "March",
        "period": "2025 Q2",
        "released": "3 398",
        "releasedNum": 3398,
        "forecast": "3 057",
        "forecastNum": 3057,
        "spreadRaw": "11.13%",
        "spreadPct": 11.13
      },
      "Earnings before Tax (EBT)Million INR": {
        "metric": "Earnings before Tax (EBT)Million INR",
        "unit": "Million INR",
        "fiscalMonth": "March",
        "period": "2025 Q2",
        "released": null,
        "releasedNum": null,
        "forecast": null,
        "forecastNum": null,
        "spreadRaw": null,
        "spreadPct": null
      },
      "Net incomeMillion INR": {
        "metric": "Net incomeMillion INR",
        "unit": "Million INR",
        "fiscalMonth": "March",
        "period": "2025 Q2",
        "released": "1 765",
        "releasedNum": 1765,
        "forecast": "1 999",
        "forecastNum": 1999,
        "spreadRaw": "-11.7%",
        "spreadPct": -11.7
      },
      "EPS INR": {
        "metric": "EPS INR",
        "unit": "INR",
        "fiscalMonth": "March",
        "period": "2025 Q2",
        "released": null,
        "releasedNum": null,
        "forecast": null,
        "forecastNum": null,
        "spreadRaw": null,
        "spreadPct": null
      },
      "Announcement Date": {
        "metric": "Announcement Date",
        "unit": null,
        "fiscalMonth": "March",
        "period": "2025 Q2",
        "released": "08/11/24",
        "releasedDate": "08/11/24",
        "forecast": null,
        "spreadRaw": null,
        "spreadPct": null
      }
    },
    "2025 Q3": {
      "Net salesMillion INR": {
        "metric": "Net salesMillion INR",
        "unit": "Million INR",
        "fiscalMonth": "March",
        "period": "2025 Q3",
        "released": "19 283",
        "releasedNum": 19283,
        "forecast": "18 896",
        "forecastNum": 18896,
        "spreadRaw": "2.05%",
        "spreadPct": 2.05
      },
      "EBITDAMillion INR": {
        "metric": "EBITDAMillion INR",
        "unit": "Million INR",
        "fiscalMonth": "March",
        "period": "2025 Q3",
        "released": "3 751",
        "releasedNum": 3751,
        "forecast": "3 684",
        "forecastNum": 3684,
        "spreadRaw": "1.82%",
        "spreadPct": 1.82
      },
      "EBITMillion INR": {
        "metric": "EBITMillion INR",
        "unit": "Million INR",
        "fiscalMonth": "March",
        "period": "2025 Q3",
        "released": "2 778",
        "releasedNum": 2778,
        "forecast": "2 797",
        "forecastNum": 2797,
        "spreadRaw": "-0.7%",
        "spreadPct": -0.7
      },
      "Earnings before Tax (EBT)Million INR": {
        "metric": "Earnings before Tax (EBT)Million INR",
        "unit": "Million INR",
        "fiscalMonth": "March",
        "period": "2025 Q3",
        "released": "2 794",
        "releasedNum": 2794,
        "forecast": "2 526",
        "forecastNum": 2526,
        "spreadRaw": "10.61%",
        "spreadPct": 10.61
      },
      "Net incomeMillion INR": {
        "metric": "Net incomeMillion INR",
        "unit": "Million INR",
        "fiscalMonth": "March",
        "period": "2025 Q3",
        "released": "2 479",
        "releasedNum": 2479,
        "forecast": "1 845",
        "forecastNum": 1845,
        "spreadRaw": "34.38%",
        "spreadPct": 34.38
      },
      "EPS INR": {
        "metric": "EPS INR",
        "unit": "INR",
        "fiscalMonth": "March",
        "period": "2025 Q3",
        "released": "3,28",
        "releasedNum": 3.28,
        "forecast": "2,50",
        "forecastNum": 2.5,
        "spreadRaw": "31.2%",
        "spreadPct": 31.2
      },
      "Announcement Date": {
        "metric": "Announcement Date",
        "unit": null,
        "fiscalMonth": "March",
        "period": "2025 Q3",
        "released": "07/02/25",
        "releasedDate": "07/02/25",
        "forecast": null,
        "spreadRaw": null,
        "spreadPct": null
      }
    },
    "2025 Q4": {
      "Net salesMillion INR": {
        "metric": "Net salesMillion INR",
        "unit": "Million INR",
        "fiscalMonth": "March",
        "period": "2025 Q4",
        "released": "20 072",
        "releasedNum": 20072,
        "forecast": "20 140",
        "forecastNum": 20140,
        "spreadRaw": "-0.34%",
        "spreadPct": -0.34
      },
      "EBITDAMillion INR": {
        "metric": "EBITDAMillion INR",
        "unit": "Million INR",
        "fiscalMonth": "March",
        "period": "2025 Q4",
        "released": "4 355",
        "releasedNum": 4355,
        "forecast": "4 249",
        "forecastNum": 4249,
        "spreadRaw": "2.49%",
        "spreadPct": 2.49
      },
      "EBITMillion INR": {
        "metric": "EBITMillion INR",
        "unit": "Million INR",
        "fiscalMonth": "March",
        "period": "2025 Q4",
        "released": "3 332",
        "releasedNum": 3332,
        "forecast": "3 392",
        "forecastNum": 3392,
        "spreadRaw": "-1.75%",
        "spreadPct": -1.75
      },
      "Earnings before Tax (EBT)Million INR": {
        "metric": "Earnings before Tax (EBT)Million INR",
        "unit": "Million INR",
        "fiscalMonth": "March",
        "period": "2025 Q4",
        "released": "2 366",
        "releasedNum": 2366,
        "forecast": "3 324",
        "forecastNum": 3324,
        "spreadRaw": "-28.84%",
        "spreadPct": -28.84
      },
      "Net incomeMillion INR": {
        "metric": "Net incomeMillion INR",
        "unit": "Million INR",
        "fiscalMonth": "March",
        "period": "2025 Q4",
        "released": "1 839",
        "releasedNum": 1839,
        "forecast": "2 284",
        "forecastNum": 2284,
        "spreadRaw": "-19.48%",
        "spreadPct": -19.48
      },
      "EPS INR": {
        "metric": "EPS INR",
        "unit": "INR",
        "fiscalMonth": "March",
        "period": "2025 Q4",
        "released": null,
        "releasedNum": null,
        "forecast": null,
        "forecastNum": null,
        "spreadRaw": null,
        "spreadPct": null
      },
      "Announcement Date": {
        "metric": "Announcement Date",
        "unit": null,
        "fiscalMonth": "March",
        "period": "2025 Q4",
        "released": "20/05/25",
        "releasedDate": "20/05/25",
        "forecast": null,
        "spreadRaw": null,
        "spreadPct": null
      }
    },
    "2026 Q1": {
      "Net salesMillion INR": {
        "metric": "Net salesMillion INR",
        "unit": "Million INR",
        "fiscalMonth": "March",
        "period": "2026 Q1",
        "released": "21 667",
        "releasedNum": 21667,
        "forecast": "21 136",
        "forecastNum": 21136,
        "spreadRaw": "2.51%",
        "spreadPct": 2.51
      },
      "EBITDAMillion INR": {
        "metric": "EBITDAMillion INR",
        "unit": "Million INR",
        "fiscalMonth": "March",
        "period": "2026 Q1",
        "released": "4 907",
        "releasedNum": 4907,
        "forecast": "4 486",
        "forecastNum": 4486,
        "spreadRaw": "9.39%",
        "spreadPct": 9.39
      },
      "EBITMillion INR": {
        "metric": "EBITMillion INR",
        "unit": "Million INR",
        "fiscalMonth": "March",
        "period": "2026 Q1",
        "released": "3 892",
        "releasedNum": 3892,
        "forecast": "3 313",
        "forecastNum": 3313,
        "spreadRaw": "17.48%",
        "spreadPct": 17.48
      },
      "Earnings before Tax (EBT)Million INR": {
        "metric": "Earnings before Tax (EBT)Million INR",
        "unit": "Million INR",
        "fiscalMonth": "March",
        "period": "2026 Q1",
        "released": "3 506",
        "releasedNum": 3506,
        "forecast": "3 215",
        "forecastNum": 3215,
        "spreadRaw": "9.04%",
        "spreadPct": 9.04
      },
      "Net incomeMillion INR": {
        "metric": "Net incomeMillion INR",
        "unit": "Million INR",
        "fiscalMonth": "March",
        "period": "2026 Q1",
        "released": "2 603",
        "releasedNum": 2603,
        "forecast": "2 267",
        "forecastNum": 2267,
        "spreadRaw": "14.8%",
        "spreadPct": 14.8
      },
      "EPS INR": {
        "metric": "EPS INR",
        "unit": "INR",
        "fiscalMonth": "March",
        "period": "2026 Q1",
        "released": "3,45",
        "releasedNum": 3.45,
        "forecast": "2,80",
        "forecastNum": 2.8,
        "spreadRaw": "23.1%",
        "spreadPct": 23.1
      },
      "Announcement Date": {
        "metric": "Announcement Date",
        "unit": null,
        "fiscalMonth": "March",
        "period": "2026 Q1",
        "released": "06/08/25",
        "releasedDate": "06/08/25",
        "forecast": null,
        "spreadRaw": null,
        "spreadPct": null
      }
    },
    "2026 Q2": {
      "Net salesMillion INR": {
        "metric": "Net salesMillion INR",
        "unit": "Million INR",
        "fiscalMonth": "March",
        "period": "2026 Q2",
        "released": null,
        "releasedNum": null,
        "forecast": "22 996",
        "forecastNum": 22996,
        "spreadRaw": null,
        "spreadPct": null
      },
      "EBITDAMillion INR": {
        "metric": "EBITDAMillion INR",
        "unit": "Million INR",
        "fiscalMonth": "March",
        "period": "2026 Q2",
        "released": null,
        "releasedNum": null,
        "forecast": "5 302",
        "forecastNum": 5302,
        "spreadRaw": null,
        "spreadPct": null
      },
      "EBITMillion INR": {
        "metric": "EBITMillion INR",
        "unit": "Million INR",
        "fiscalMonth": "March",
        "period": "2026 Q2",
        "released": null,
        "releasedNum": null,
        "forecast": "4 482",
        "forecastNum": 4482,
        "spreadRaw": null,
        "spreadPct": null
      },
      "Earnings before Tax (EBT)Million INR": {
        "metric": "Earnings before Tax (EBT)Million INR",
        "unit": "Million INR",
        "fiscalMonth": "March",
        "period": "2026 Q2",
        "released": null,
        "releasedNum": null,
        "forecast": null,
        "forecastNum": null,
        "spreadRaw": null,
        "spreadPct": null
      },
      "Net incomeMillion INR": {
        "metric": "Net incomeMillion INR",
        "unit": "Million INR",
        "fiscalMonth": "March",
        "period": "2026 Q2",
        "released": null,
        "releasedNum": null,
        "forecast": "2 727",
        "forecastNum": 2727,
        "spreadRaw": null,
        "spreadPct": null
      },
      "EPS INR": {
        "metric": "EPS INR",
        "unit": "INR",
        "fiscalMonth": "March",
        "period": "2026 Q2",
        "released": null,
        "releasedNum": null,
        "forecast": "3,22",
        "forecastNum": 3.22,
        "spreadRaw": null,
        "spreadPct": null
      },
      "Announcement Date": {
        "metric": "Announcement Date",
        "unit": null,
        "fiscalMonth": "March",
        "period": "2026 Q2",
        "released": "-",
        "releasedDate": "-",
        "forecast": null,
        "spreadRaw": null,
        "spreadPct": null
      }
    },
    "2026 Q3": {
      "Net salesMillion INR": {
        "metric": "Net salesMillion INR",
        "unit": "Million INR",
        "fiscalMonth": "March",
        "period": "2026 Q3",
        "released": null,
        "releasedNum": null,
        "forecast": "22 286",
        "forecastNum": 22286,
        "spreadRaw": null,
        "spreadPct": null
      },
      "EBITDAMillion INR": {
        "metric": "EBITDAMillion INR",
        "unit": "Million INR",
        "fiscalMonth": "March",
        "period": "2026 Q3",
        "released": null,
        "releasedNum": null,
        "forecast": null,
        "forecastNum": null,
        "spreadRaw": null,
        "spreadPct": null
      },
      "EBITMillion INR": {
        "metric": "EBITMillion INR",
        "unit": "Million INR",
        "fiscalMonth": "March",
        "period": "2026 Q3",
        "released": null,
        "releasedNum": null,
        "forecast": "3 922",
        "forecastNum": 3922,
        "spreadRaw": null,
        "spreadPct": null
      },
      "Earnings before Tax (EBT)Million INR": {
        "metric": "Earnings before Tax (EBT)Million INR",
        "unit": "Million INR",
        "fiscalMonth": "March",
        "period": "2026 Q3",
        "released": null,
        "releasedNum": null,
        "forecast": null,
        "forecastNum": null,
        "spreadRaw": null,
        "spreadPct": null
      },
      "Net incomeMillion INR": {
        "metric": "Net incomeMillion INR",
        "unit": "Million INR",
        "fiscalMonth": "March",
        "period": "2026 Q3",
        "released": null,
        "releasedNum": null,
        "forecast": null,
        "forecastNum": null,
        "spreadRaw": null,
        "spreadPct": null
      },
      "EPS INR": {
        "metric": "EPS INR",
        "unit": "INR",
        "fiscalMonth": "March",
        "period": "2026 Q3",
        "released": null,
        "releasedNum": null,
        "forecast": "3,71",
        "forecastNum": 3.71,
        "spreadRaw": null,
        "spreadPct": null
      },
      "Announcement Date": {
        "metric": "Announcement Date",
        "unit": null,
        "fiscalMonth": "March",
        "period": "2026 Q3",
        "released": "-",
        "releasedDate": "-",
        "forecast": null,
        "spreadRaw": null,
        "spreadPct": null
      }
    },
    "2026 Q4": {
      "Net salesMillion INR": {
        "metric": "Net salesMillion INR",
        "unit": "Million INR",
        "fiscalMonth": "March",
        "period": "2026 Q4",
        "released": null,
        "releasedNum": null,
        "forecast": "23 355",
        "forecastNum": 23355,
        "spreadRaw": null,
        "spreadPct": null
      },
      "EBITDAMillion INR": {
        "metric": "EBITDAMillion INR",
        "unit": "Million INR",
        "fiscalMonth": "March",
        "period": "2026 Q4",
        "released": null,
        "releasedNum": null,
        "forecast": null,
        "forecastNum": null,
        "spreadRaw": null,
        "spreadPct": null
      },
      "EBITMillion INR": {
        "metric": "EBITMillion INR",
        "unit": "Million INR",
        "fiscalMonth": "March",
        "period": "2026 Q4",
        "released": null,
        "releasedNum": null,
        "forecast": "4 526",
        "forecastNum": 4526,
        "spreadRaw": null,
        "spreadPct": null
      },
      "Earnings before Tax (EBT)Million INR": {
        "metric": "Earnings before Tax (EBT)Million INR",
        "unit": "Million INR",
        "fiscalMonth": "March",
        "period": "2026 Q4",
        "released": null,
        "releasedNum": null,
        "forecast": null,
        "forecastNum": null,
        "spreadRaw": null,
        "spreadPct": null
      },
      "Net incomeMillion INR": {
        "metric": "Net incomeMillion INR",
        "unit": "Million INR",
        "fiscalMonth": "March",
        "period": "2026 Q4",
        "released": null,
        "releasedNum": null,
        "forecast": null,
        "forecastNum": null,
        "spreadRaw": null,
        "spreadPct": null
      },
      "EPS INR": {
        "metric": "EPS INR",
        "unit": "INR",
        "fiscalMonth": "March",
        "period": "2026 Q4",
        "released": null,
        "releasedNum": null,
        "forecast": "4,81",
        "forecastNum": 4.81,
        "spreadRaw": null,
        "spreadPct": null
      },
      "Announcement Date": {
        "metric": "Announcement Date",
        "unit": null,
        "fiscalMonth": "March",
        "period": "2026 Q4",
        "released": "-",
        "releasedDate": "-",
        "forecast": null,
        "spreadRaw": null,
        "spreadPct": null
      }
    },
    "2027 Q1": {
      "Net salesMillion INR": {
        "metric": "Net salesMillion INR",
        "unit": "Million INR",
        "fiscalMonth": "March",
        "period": "2027 Q1",
        "released": null,
        "releasedNum": null,
        "forecast": "25 673",
        "forecastNum": 25673,
        "spreadRaw": null,
        "spreadPct": null
      },
      "EBITDAMillion INR": {
        "metric": "EBITDAMillion INR",
        "unit": "Million INR",
        "fiscalMonth": "March",
        "period": "2027 Q1",
        "released": null,
        "releasedNum": null,
        "forecast": null,
        "forecastNum": null,
        "spreadRaw": null,
        "spreadPct": null
      },
      "EBITMillion INR": {
        "metric": "EBITMillion INR",
        "unit": "Million INR",
        "fiscalMonth": "March",
        "period": "2027 Q1",
        "released": null,
        "releasedNum": null,
        "forecast": "4 907",
        "forecastNum": 4907,
        "spreadRaw": null,
        "spreadPct": null
      },
      "Earnings before Tax (EBT)Million INR": {
        "metric": "Earnings before Tax (EBT)Million INR",
        "unit": "Million INR",
        "fiscalMonth": "March",
        "period": "2027 Q1",
        "released": null,
        "releasedNum": null,
        "forecast": null,
        "forecastNum": null,
        "spreadRaw": null,
        "spreadPct": null
      },
      "Net incomeMillion INR": {
        "metric": "Net incomeMillion INR",
        "unit": "Million INR",
        "fiscalMonth": "March",
        "period": "2027 Q1",
        "released": null,
        "releasedNum": null,
        "forecast": null,
        "forecastNum": null,
        "spreadRaw": null,
        "spreadPct": null
      },
      "EPS INR": {
        "metric": "EPS INR",
        "unit": "INR",
        "fiscalMonth": "March",
        "period": "2027 Q1",
        "released": null,
        "releasedNum": null,
        "forecast": null,
        "forecastNum": null,
        "spreadRaw": null,
        "spreadPct": null
      },
      "Announcement Date": {
        "metric": "Announcement Date",
        "unit": null,
        "fiscalMonth": "March",
        "period": "2027 Q1",
        "released": "-",
        "releasedDate": "-",
        "forecast": null,
        "spreadRaw": null,
        "spreadPct": null
      }
    }
  },
  "upcomingEvents": {
    "count": 8,
    "events": [
      {
        "section": "Upcoming",
        "dateTimeRaw": "14/11/2025",
        "dateTimeISO": "2025-11-13T18:30:00.000Z",
        "title": "Q2 2026 Earnings Release",
        "icsUrl": "https://in.marketscreener.com/api/stateful/agenda/event-async/Q2-2026-Earnings-Release-48269952.ics"
      },
      {
        "section": "Upcoming",
        "dateTimeRaw": "14/02/2026",
        "dateTimeISO": "2026-02-13T18:30:00.000Z",
        "title": "Q3 2026 Earnings Release",
        "icsUrl": "https://in.marketscreener.com/api/stateful/agenda/event-async/Q3-2026-Earnings-Release-48922306.ics"
      },
      {
        "section": "Upcoming",
        "dateTimeRaw": "30/05/2026",
        "dateTimeISO": "2026-05-29T18:30:00.000Z",
        "title": "Q4 2026 Earnings Release",
        "icsUrl": "https://in.marketscreener.com/api/stateful/agenda/event-async/Q4-2026-Earnings-Release-49923169.ics"
      },
      {
        "section": "Upcoming",
        "dateTimeRaw": "06/08/2026",
        "dateTimeISO": "2026-08-05T18:30:00.000Z",
        "title": "Q1 2027 Earnings Release (Projected)",
        "icsUrl": "https://in.marketscreener.com/api/stateful/agenda/event-async/Q1-2027-Earnings-Release-Projected-50685107.ics"
      },
      {
        "section": "Upcoming",
        "dateTimeRaw": "30/09/2026",
        "dateTimeISO": "2026-09-29T18:30:00.000Z",
        "title": "Annual General Meeting (Projected)",
        "icsUrl": "https://in.marketscreener.com/api/stateful/agenda/event-async/Annual-General-Meeting-Projected-50766729.ics"
      },
      {
        "section": "Upcoming",
        "dateTimeRaw": "06/11/2026",
        "dateTimeISO": "2026-11-05T18:30:00.000Z",
        "title": "Q2 2027 Earnings Release (Projected)",
        "icsUrl": "https://in.marketscreener.com/api/stateful/agenda/event-async/Q2-2027-Earnings-Release-Projected-50766730.ics"
      },
      {
        "section": "Upcoming",
        "dateTimeRaw": "05/02/2027",
        "dateTimeISO": "2027-02-04T18:30:00.000Z",
        "title": "Q3 2027 Earnings Release (Projected)",
        "icsUrl": "https://in.marketscreener.com/api/stateful/agenda/event-async/Q3-2027-Earnings-Release-Projected-50766733.ics"
      },
      {
        "section": "Upcoming",
        "dateTimeRaw": "25/05/2027",
        "dateTimeISO": "2027-05-24T18:30:00.000Z",
        "title": "Q4 2027 Earnings Release (Projected)",
        "icsUrl": "https://in.marketscreener.com/api/stateful/agenda/event-async/Q4-2027-Earnings-Release-Projected-50766735.ics"
      }
    ]
  },
  "pastEvents": {
    "count": 64,
    "events": [
      {
        "section": "Past",
        "dateTimeRaw": "23/09/2025 09:00 am",
        "dateTimeISO": "2025-09-23T03:30:00.000Z",
        "title": "DAM Capital Healthcare Conference",
        "icsUrl": "https://in.marketscreener.com/api/stateful/agenda/event-async/DAM-Capital-Healthcare-Conference-51139853.ics"
      },
      {
        "section": "Past",
        "dateTimeRaw": "22/09/2025 09:00 am",
        "dateTimeISO": "2025-09-22T03:30:00.000Z",
        "title": "J.P. Morgan India Conference",
        "icsUrl": "https://in.marketscreener.com/api/stateful/agenda/event-async/J-P-Morgan-India-Conference-51139852.ics"
      },
      {
        "section": "Past",
        "dateTimeRaw": "11/08/2025 02:00 pm",
        "dateTimeISO": "2025-08-11T08:30:00.000Z",
        "title": "Annual General Meeting",
        "icsUrl": "https://in.marketscreener.com/api/stateful/agenda/event-async/Annual-General-Meeting-50508083.ics"
      },
      {
        "section": "Past",
        "dateTimeRaw": "07/08/2025 11:00 am",
        "dateTimeISO": "2025-08-07T05:30:00.000Z",
        "title": "Q1 2026 Earnings Call",
        "icsUrl": "https://in.marketscreener.com/api/stateful/agenda/event-async/Q1-2026-Earnings-Call-50697705.ics"
      },
      {
        "section": "Past",
        "dateTimeRaw": "06/08/2025 08:53 pm",
        "dateTimeISO": "2025-08-06T15:23:00.000Z",
        "title": "Q1 2026 Earnings Release",
        "icsUrl": "https://in.marketscreener.com/api/stateful/agenda/event-async/Q1-2026-Earnings-Release-47511890.ics"
      },
      {
        "section": "Past",
        "dateTimeRaw": "25/07/2025",
        "dateTimeISO": "2025-07-24T18:30:00.000Z",
        "title": "Ex-dividend day for final dividend",
        "icsUrl": "https://in.marketscreener.com/api/stateful/agenda/event-async/Ex-dividend-day-for-final-dividend-50618172.ics"
      },
      {
        "section": "Past",
        "dateTimeRaw": "02/06/2025 09:30 am",
        "dateTimeISO": "2025-06-02T04:00:00.000Z",
        "title": "Non-Deal Roadshow",
        "icsUrl": "https://in.marketscreener.com/api/stateful/agenda/event-async/Non-Deal-Roadshow-50084304.ics"
      },
      {
        "section": "Past",
        "dateTimeRaw": "20/05/2025 07:19 pm",
        "dateTimeISO": "2025-05-20T13:49:00.000Z",
        "title": "Q4 2025 Earnings Release",
        "icsUrl": "https://in.marketscreener.com/api/stateful/agenda/event-async/Q4-2025-Earnings-Release-46766152.ics"
      },
      {
        "section": "Past",
        "dateTimeRaw": "21/05/2025 11:00 am",
        "dateTimeISO": "2025-05-21T05:30:00.000Z",
        "title": "Q4 2025 Earnings Call",
        "icsUrl": "https://in.marketscreener.com/api/stateful/agenda/event-async/Q4-2025-Earnings-Call-49923061.ics"
      },
      {
        "section": "Past",
        "dateTimeRaw": "10/02/2025 02:30 pm",
        "dateTimeISO": "2025-02-10T09:00:00.000Z",
        "title": "Q3 2025 Earnings Call",
        "icsUrl": "https://in.marketscreener.com/api/stateful/agenda/event-async/Q3-2025-Earnings-Call-48909918.ics"
      },
      {
        "section": "Past",
        "dateTimeRaw": "07/02/2025 06:26 pm",
        "dateTimeISO": "2025-02-07T12:56:00.000Z",
        "title": "Q3 2025 Earnings Release",
        "icsUrl": "https://in.marketscreener.com/api/stateful/agenda/event-async/Q3-2025-Earnings-Release-46187116.ics"
      },
      {
        "section": "Past",
        "dateTimeRaw": "08/11/2024 06:30 pm",
        "dateTimeISO": "2024-11-08T13:00:00.000Z",
        "title": "Q2 2025 Earnings Call",
        "icsUrl": "https://in.marketscreener.com/api/stateful/agenda/event-async/Q2-2025-Earnings-Call-48269865.ics"
      },
      {
        "section": "Past",
        "dateTimeRaw": "08/11/2024 06:07 pm",
        "dateTimeISO": "2024-11-08T12:37:00.000Z",
        "title": "Q2 2025 Earnings Release",
        "icsUrl": "https://in.marketscreener.com/api/stateful/agenda/event-async/Q2-2025-Earnings-Release-45338399.ics"
      },
      {
        "section": "Past",
        "dateTimeRaw": "25/09/2024 09:30 am",
        "dateTimeISO": "2024-09-25T04:00:00.000Z",
        "title": "Non Deal Roadshow",
        "icsUrl": "https://in.marketscreener.com/api/stateful/agenda/event-async/Non-Deal-Roadshow-47897558.ics"
      },
      {
        "section": "Past",
        "dateTimeRaw": "24/09/2024 09:00 am",
        "dateTimeISO": "2024-09-24T03:30:00.000Z",
        "title": "Non Deal Roadshow",
        "icsUrl": "https://in.marketscreener.com/api/stateful/agenda/event-async/Non-Deal-Roadshow-47897556.ics"
      },
      {
        "section": "Past",
        "dateTimeRaw": "23/09/2024 10:00 am",
        "dateTimeISO": "2024-09-23T04:30:00.000Z",
        "title": "J.P. Morgan India Investor Summit",
        "icsUrl": "https://in.marketscreener.com/api/stateful/agenda/event-async/J-P-Morgan-India-Investor-Summit-47897555.ics"
      },
      {
        "section": "Past",
        "dateTimeRaw": "07/08/2024 11:00 am",
        "dateTimeISO": "2024-08-07T05:30:00.000Z",
        "title": "Q1 2025 Earnings Call",
        "icsUrl": "https://in.marketscreener.com/api/stateful/agenda/event-async/Q1-2025-Earnings-Call-47511775.ics"
      },
      {
        "section": "Past",
        "dateTimeRaw": "06/08/2024 08:30 pm",
        "dateTimeISO": "2024-08-06T15:00:00.000Z",
        "title": "Q1 2025 Earnings Release",
        "icsUrl": "https://in.marketscreener.com/api/stateful/agenda/event-async/Q1-2025-Earnings-Release-44489845.ics"
      },
      {
        "section": "Past",
        "dateTimeRaw": "02/08/2024 02:00 pm",
        "dateTimeISO": "2024-08-02T08:30:00.000Z",
        "title": "Annual General Meeting",
        "icsUrl": "https://in.marketscreener.com/api/stateful/agenda/event-async/Annual-General-Meeting-47375773.ics"
      },
      {
        "section": "Past",
        "dateTimeRaw": "24/07/2024",
        "dateTimeISO": "2024-07-23T18:30:00.000Z",
        "title": "Ex-dividend day for final dividend",
        "icsUrl": "https://in.marketscreener.com/api/stateful/agenda/event-async/Ex-dividend-day-for-final-dividend-47427401.ics"
      },
      {
        "section": "Past",
        "dateTimeRaw": "03/06/2024 06:30 am",
        "dateTimeISO": "2024-06-03T01:00:00.000Z",
        "title": "Nomura Asia Investment Forum",
        "icsUrl": "https://in.marketscreener.com/api/stateful/agenda/event-async/Nomura-Asia-Investment-Forum-46848230.ics"
      },
      {
        "section": "Past",
        "dateTimeRaw": "24/05/2024 11:00 am",
        "dateTimeISO": "2024-05-24T05:30:00.000Z",
        "title": "Q4 2024 Earnings Call",
        "icsUrl": "https://in.marketscreener.com/api/stateful/agenda/event-async/Q4-2024-Earnings-Call-46756259.ics"
      },
      {
        "section": "Past",
        "dateTimeRaw": "23/05/2024 07:10 pm",
        "dateTimeISO": "2024-05-23T13:40:00.000Z",
        "title": "Q4 2024 Earnings Release",
        "icsUrl": "https://in.marketscreener.com/api/stateful/agenda/event-async/Q4-2024-Earnings-Release-43901921.ics"
      },
      {
        "section": "Past",
        "dateTimeRaw": "08/02/2024 11:00 am",
        "dateTimeISO": "2024-02-08T05:30:00.000Z",
        "title": "Q3 2024 Earnings Call",
        "icsUrl": "https://in.marketscreener.com/api/stateful/agenda/event-async/Q3-2024-Earnings-Call-46184823.ics"
      },
      {
        "section": "Past",
        "dateTimeRaw": "07/02/2024 07:45 pm",
        "dateTimeISO": "2024-02-07T14:15:00.000Z",
        "title": "Q3 2024 Earnings Release",
        "icsUrl": "https://in.marketscreener.com/api/stateful/agenda/event-async/Q3-2024-Earnings-Release-42966545.ics"
      },
      {
        "section": "Past",
        "dateTimeRaw": "10/11/2023 07:30 pm",
        "dateTimeISO": "2023-11-10T14:00:00.000Z",
        "title": "Q2 2024 Earnings Call",
        "icsUrl": "https://in.marketscreener.com/api/stateful/agenda/event-async/Q2-2024-Earnings-Call-45336940.ics"
      },
      {
        "section": "Past",
        "dateTimeRaw": "10/11/2023 06:30 pm",
        "dateTimeISO": "2023-11-10T13:00:00.000Z",
        "title": "Q2 2024 Earnings Release",
        "icsUrl": "https://in.marketscreener.com/api/stateful/agenda/event-async/Q2-2024-Earnings-Release-42297311.ics"
      },
      {
        "section": "Past",
        "dateTimeRaw": "07/08/2023 11:00 am",
        "dateTimeISO": "2023-08-07T05:30:00.000Z",
        "title": "Q1 2024 Earnings Call",
        "icsUrl": "https://in.marketscreener.com/api/stateful/agenda/event-async/Q1-2024-Earnings-Call-44530117.ics"
      },
      {
        "section": "Past",
        "dateTimeRaw": "04/08/2023 08:06 pm",
        "dateTimeISO": "2023-08-04T14:36:00.000Z",
        "title": "Q1 2024 Earnings Release",
        "icsUrl": "https://in.marketscreener.com/api/stateful/agenda/event-async/Q1-2024-Earnings-Release-41148046.ics"
      },
      {
        "section": "Past",
        "dateTimeRaw": "01/08/2023 02:00 pm",
        "dateTimeISO": "2023-08-01T08:30:00.000Z",
        "title": "Annual General Meeting",
        "icsUrl": "https://in.marketscreener.com/api/stateful/agenda/event-async/Annual-General-Meeting-44247525.ics"
      },
      {
        "section": "Past",
        "dateTimeRaw": "20/07/2023",
        "dateTimeISO": "2023-07-19T18:30:00.000Z",
        "title": "Ex-dividend day for final dividend",
        "icsUrl": "https://in.marketscreener.com/api/stateful/agenda/event-async/Ex-dividend-day-for-final-dividend-44296417.ics"
      },
      {
        "section": "Past",
        "dateTimeRaw": "06/06/2023",
        "dateTimeISO": "2023-06-05T18:30:00.000Z",
        "title": "Goldman Sachs Non-Deal Roadshow",
        "icsUrl": "https://in.marketscreener.com/api/stateful/agenda/event-async/Goldman-Sachs-Non-Deal-Roadshow-44067451.ics"
      },
      {
        "section": "Past",
        "dateTimeRaw": "24/05/2023 11:00 am",
        "dateTimeISO": "2023-05-24T05:30:00.000Z",
        "title": "Q4 2023 Earnings Call",
        "icsUrl": "https://in.marketscreener.com/api/stateful/agenda/event-async/Q4-2023-Earnings-Call-43942337.ics"
      },
      {
        "section": "Past",
        "dateTimeRaw": "23/05/2023 09:12 pm",
        "dateTimeISO": "2023-05-23T15:42:00.000Z",
        "title": "Q4 2023 Earnings Release",
        "icsUrl": "https://in.marketscreener.com/api/stateful/agenda/event-async/Q4-2023-Earnings-Release-40508064.ics"
      },
      {
        "section": "Past",
        "dateTimeRaw": "13/02/2023 11:00 am",
        "dateTimeISO": "2023-02-13T05:30:00.000Z",
        "title": "Q3 2023 Earnings Call",
        "icsUrl": "https://in.marketscreener.com/api/stateful/agenda/event-async/Q3-2023-Earnings-Call-42966100.ics"
      },
      {
        "section": "Past",
        "dateTimeRaw": "10/02/2023 07:51 pm",
        "dateTimeISO": "2023-02-10T14:21:00.000Z",
        "title": "Q3 2023 Earnings Release",
        "icsUrl": "https://in.marketscreener.com/api/stateful/agenda/event-async/Q3-2023-Earnings-Release-38155562.ics"
      },
      {
        "section": "Past",
        "dateTimeRaw": "14/11/2022 11:00 am",
        "dateTimeISO": "2022-11-14T05:30:00.000Z",
        "title": "Interim 2023 Earnings Call",
        "icsUrl": "https://in.marketscreener.com/api/stateful/agenda/event-async/Interim-2023-Earnings-Call-42296995.ics"
      },
      {
        "section": "Past",
        "dateTimeRaw": "11/11/2022 06:15 pm",
        "dateTimeISO": "2022-11-11T12:45:00.000Z",
        "title": "Interim 2023 Earnings Release",
        "icsUrl": "https://in.marketscreener.com/api/stateful/agenda/event-async/Interim-2023-Earnings-Release-36928793.ics"
      },
      {
        "section": "Past",
        "dateTimeRaw": "24/05/2019",
        "dateTimeISO": "2019-05-23T18:30:00.000Z",
        "title": "FY 2019 Earnings Release",
        "icsUrl": "https://in.marketscreener.com/api/stateful/agenda/event-async/FY-2019-Earnings-Release-28021738.ics"
      },
      {
        "section": "Past",
        "dateTimeRaw": "13/02/2019",
        "dateTimeISO": "2019-02-12T18:30:00.000Z",
        "title": "Q3 2019 Earnings Call",
        "icsUrl": "https://in.marketscreener.com/api/stateful/agenda/event-async/Q3-2019-Earnings-Call-28019885.ics"
      },
      {
        "section": "Past",
        "dateTimeRaw": "05/11/2018",
        "dateTimeISO": "2018-11-04T18:30:00.000Z",
        "title": "Interim 2019 Earnings Release",
        "icsUrl": "https://in.marketscreener.com/api/stateful/agenda/event-async/Interim-2019-Earnings-Release-27538368.ics"
      },
      {
        "section": "Past",
        "dateTimeRaw": "28/09/2018",
        "dateTimeISO": "2018-09-27T18:30:00.000Z",
        "title": "Annual General Meeting",
        "icsUrl": "https://in.marketscreener.com/api/stateful/agenda/event-async/Annual-General-Meeting-27231300.ics"
      },
      {
        "section": "Past",
        "dateTimeRaw": "14/08/2018",
        "dateTimeISO": "2018-08-13T18:30:00.000Z",
        "title": "Q1 2019 Earnings Release",
        "icsUrl": "https://in.marketscreener.com/api/stateful/agenda/event-async/Q1-2019-Earnings-Release-27098260.ics"
      },
      {
        "section": "Past",
        "dateTimeRaw": "13/08/2018",
        "dateTimeISO": "2018-08-12T18:30:00.000Z",
        "title": "Extraordinary Shareholders Meeting",
        "icsUrl": "https://in.marketscreener.com/api/stateful/agenda/event-async/Extraordinary-Shareholders-Meeting-27057920.ics"
      },
      {
        "section": "Past",
        "dateTimeRaw": "30/07/2018",
        "dateTimeISO": "2018-07-29T18:30:00.000Z",
        "title": "Investor Meeting",
        "icsUrl": "https://in.marketscreener.com/api/stateful/agenda/event-async/Investor-Meeting-27131417.ics"
      },
      {
        "section": "Past",
        "dateTimeRaw": "30/05/2018",
        "dateTimeISO": "2018-05-29T18:30:00.000Z",
        "title": "FY 2018 Earnings Release",
        "icsUrl": "https://in.marketscreener.com/api/stateful/agenda/event-async/FY-2018-Earnings-Release-26661831.ics"
      },
      {
        "section": "Past",
        "dateTimeRaw": "13/02/2018",
        "dateTimeISO": "2018-02-12T18:30:00.000Z",
        "title": "Q3 2018 Earnings Release",
        "icsUrl": "https://in.marketscreener.com/api/stateful/agenda/event-async/Q3-2018-Earnings-Release-25967105.ics"
      },
      {
        "section": "Past",
        "dateTimeRaw": "14/11/2017",
        "dateTimeISO": "2017-11-13T18:30:00.000Z",
        "title": "Interim 2018 Earnings Release",
        "icsUrl": "https://in.marketscreener.com/api/stateful/agenda/event-async/Interim-2018-Earnings-Release-25487060.ics"
      },
      {
        "section": "Past",
        "dateTimeRaw": "26/09/2017 11:30 am",
        "dateTimeISO": "2017-09-26T06:00:00.000Z",
        "title": "Annual General Meeting",
        "icsUrl": "https://in.marketscreener.com/api/stateful/agenda/event-async/Annual-General-Meeting-25204396.ics"
      },
      {
        "section": "Past",
        "dateTimeRaw": "04/08/2017",
        "dateTimeISO": "2017-08-03T18:30:00.000Z",
        "title": "Q1 2018 Earnings Release",
        "icsUrl": "https://in.marketscreener.com/api/stateful/agenda/event-async/Q1-2018-Earnings-Release-22854980.ics"
      },
      {
        "section": "Past",
        "dateTimeRaw": "30/05/2017",
        "dateTimeISO": "2017-05-29T18:30:00.000Z",
        "title": "FY 2017 Earnings Release",
        "icsUrl": "https://in.marketscreener.com/api/stateful/agenda/event-async/FY-2017-Earnings-Release-22666009.ics"
      },
      {
        "section": "Past",
        "dateTimeRaw": "14/02/2017",
        "dateTimeISO": "2017-02-13T18:30:00.000Z",
        "title": "Q3 2017 Earnings Release (Projected)",
        "icsUrl": "https://in.marketscreener.com/api/stateful/agenda/event-async/Q3-2017-Earnings-Release-Projected-22658228.ics"
      },
      {
        "section": "Past",
        "dateTimeRaw": "10/11/2016 04:30 pm",
        "dateTimeISO": "2016-11-10T11:00:00.000Z",
        "title": "Interim 2017 Earnings Call",
        "icsUrl": "https://in.marketscreener.com/api/stateful/agenda/event-async/Interim-2017-Earnings-Call-23388414.ics"
      },
      {
        "section": "Past",
        "dateTimeRaw": "10/11/2016",
        "dateTimeISO": "2016-11-09T18:30:00.000Z",
        "title": "Interim 2017 Earnings Release",
        "icsUrl": "https://in.marketscreener.com/api/stateful/agenda/event-async/Interim-2017-Earnings-Release-19673822.ics"
      },
      {
        "section": "Past",
        "dateTimeRaw": "27/09/2016 11:30 am",
        "dateTimeISO": "2016-09-27T06:00:00.000Z",
        "title": "Annual General Meeting",
        "icsUrl": "https://in.marketscreener.com/api/stateful/agenda/event-async/Annual-General-Meeting-22932775.ics"
      },
      {
        "section": "Past",
        "dateTimeRaw": "04/08/2016",
        "dateTimeISO": "2016-08-03T18:30:00.000Z",
        "title": "Analyst Meeting - Q1 2017 Earnings Slides",
        "icsUrl": "https://in.marketscreener.com/api/stateful/agenda/event-async/Analyst-Meeting-Q1-2017-Earnings-Slides-22929559.ics"
      },
      {
        "section": "Past",
        "dateTimeRaw": "04/08/2016",
        "dateTimeISO": "2016-08-03T18:30:00.000Z",
        "title": "Q1 2017 Earnings Release",
        "icsUrl": "https://in.marketscreener.com/api/stateful/agenda/event-async/Q1-2017-Earnings-Release-19666581.ics"
      },
      {
        "section": "Past",
        "dateTimeRaw": "26/05/2016",
        "dateTimeISO": "2016-05-25T18:30:00.000Z",
        "title": "FY 2016 Earnings Release",
        "icsUrl": "https://in.marketscreener.com/api/stateful/agenda/event-async/FY-2016-Earnings-Release-19661332.ics"
      },
      {
        "section": "Past",
        "dateTimeRaw": "04/02/2016",
        "dateTimeISO": "2016-02-03T18:30:00.000Z",
        "title": "Q3 2016 Earnings Release",
        "icsUrl": "https://in.marketscreener.com/api/stateful/agenda/event-async/Q3-2016-Earnings-Release-19649840.ics"
      },
      {
        "section": "Past",
        "dateTimeRaw": "04/11/2015",
        "dateTimeISO": "2015-11-03T18:30:00.000Z",
        "title": "Interim 2016 Earnings Release",
        "icsUrl": "https://in.marketscreener.com/api/stateful/agenda/event-async/Interim-2016-Earnings-Release-19180594.ics"
      },
      {
        "section": "Past",
        "dateTimeRaw": "23/09/2015 11:30 am",
        "dateTimeISO": "2015-09-23T06:00:00.000Z",
        "title": "Annual General Meeting",
        "icsUrl": "https://in.marketscreener.com/api/stateful/agenda/event-async/Annual-General-Meeting-20948697.ics"
      },
      {
        "section": "Past",
        "dateTimeRaw": "06/08/2015",
        "dateTimeISO": "2015-08-05T18:30:00.000Z",
        "title": "Q1 2016 Earnings Release",
        "icsUrl": "https://in.marketscreener.com/api/stateful/agenda/event-async/Q1-2016-Earnings-Release-18726757.ics"
      },
      {
        "section": "Past",
        "dateTimeRaw": "28/05/2015",
        "dateTimeISO": "2015-05-27T18:30:00.000Z",
        "title": "FY 2015 Earnings Release",
        "icsUrl": "https://in.marketscreener.com/api/stateful/agenda/event-async/FY-2015-Earnings-Release-18263592.ics"
      },
      {
        "section": "Past",
        "dateTimeRaw": "13/02/2015",
        "dateTimeISO": "2015-02-12T18:30:00.000Z",
        "title": "Q3 2015 Earnings Release",
        "icsUrl": "https://in.marketscreener.com/api/stateful/agenda/event-async/Q3-2015-Earnings-Release-17791608.ics"
      }
    ]
  },
  "pastDividends": {
    "count": 3,
    "dividends": [
      {
        "section": "Past Dividends",
        "dateRaw": "25/07/2025",
        "dateISO": "2025-07-24T18:30:00.000Z",
        "type": "Annual",
        "amount": 1,
        "currency": "INR",
        "title": "Annual 1 INR"
      },
      {
        "section": "Past Dividends",
        "dateRaw": "24/07/2024",
        "dateISO": "2024-07-23T18:30:00.000Z",
        "type": "Annual",
        "amount": 1,
        "currency": "INR",
        "title": "Annual 1 INR"
      },
      {
        "section": "Past Dividends",
        "dateRaw": "20/07/2023",
        "dateISO": "2023-07-19T18:30:00.000Z",
        "type": "Annual",
        "amount": 1,
        "currency": "INR",
        "title": "Annual 1 INR"
      }
    ]
  }
}