{
  "companyCode": "GODREJ-PROPERTIES-LIMITED-14976317",
  "timestamp": "2025-10-13T12:19:55.416Z",
  "annualResults": {
    "2023": {
      "Net salesMillion INR": {
        "metric": "Net salesMillion INR",
        "unit": "Million INR",
        "fiscalMonth": "March",
        "year": "2023",
        "released": "22 523",
        "forecast": "17 651",
        "spreadRaw": "27.6%"
      },
      "EBITDAMillion INR": {
        "metric": "EBITDAMillion INR",
        "unit": "Million INR",
        "fiscalMonth": "March",
        "year": "2023",
        "released": "2 476",
        "forecast": "1 591",
        "spreadRaw": "55.63%"
      },
      "EBITMillion INR": {
        "metric": "EBITMillion INR",
        "unit": "Million INR",
        "fiscalMonth": "March",
        "year": "2023",
        "released": "2 235",
        "forecast": "1 066",
        "spreadRaw": "109.68%"
      },
      "Earnings before Tax (EBT)Million INR": {
        "metric": "Earnings before Tax (EBT)Million INR",
        "unit": "Million INR",
        "fiscalMonth": "March",
        "year": "2023",
        "released": "8 360",
        "forecast": "5 747",
        "spreadRaw": "45.46%"
      },
      "Net incomeMillion INR": {
        "metric": "Net incomeMillion INR",
        "unit": "Million INR",
        "fiscalMonth": "March",
        "year": "2023",
        "released": "5 714",
        "forecast": "5 473",
        "spreadRaw": "4.4%"
      },
      "EPS INR": {
        "metric": "EPS INR",
        "unit": "INR",
        "fiscalMonth": "March",
        "year": "2023",
        "released": "20,6",
        "forecast": "19,7",
        "spreadRaw": "4.4%"
      },
      "Announcement Date": {
        "metric": "Announcement Date",
        "unit": null,
        "fiscalMonth": "March",
        "year": "2023",
        "released": "03/05/23",
        "forecast": null,
        "spreadRaw": null
      }
    },
    "2024": {
      "Net salesMillion INR": {
        "metric": "Net salesMillion INR",
        "unit": "Million INR",
        "fiscalMonth": "March",
        "year": "2024",
        "released": "30 356",
        "forecast": "26 267",
        "spreadRaw": "15.57%"
      },
      "EBITDAMillion INR": {
        "metric": "EBITDAMillion INR",
        "unit": "Million INR",
        "fiscalMonth": "March",
        "year": "2024",
        "released": "-1 297",
        "forecast": "933",
        "spreadRaw": "-238.99%"
      },
      "EBITMillion INR": {
        "metric": "EBITMillion INR",
        "unit": "Million INR",
        "fiscalMonth": "March",
        "year": "2024",
        "released": "-1 742",
        "forecast": "843",
        "spreadRaw": "-306.69%"
      },
      "Earnings before Tax (EBT)Million INR": {
        "metric": "Earnings before Tax (EBT)Million INR",
        "unit": "Million INR",
        "fiscalMonth": "March",
        "year": "2024",
        "released": "9 723",
        "forecast": "9 496",
        "spreadRaw": "2.38%"
      },
      "Net incomeMillion INR": {
        "metric": "Net incomeMillion INR",
        "unit": "Million INR",
        "fiscalMonth": "March",
        "year": "2024",
        "released": "7 253",
        "forecast": "7 087",
        "spreadRaw": "2.34%"
      },
      "EPS INR": {
        "metric": "EPS INR",
        "unit": "INR",
        "fiscalMonth": "March",
        "year": "2024",
        "released": "26,1",
        "forecast": "26,6",
        "spreadRaw": "-1.82%"
      },
      "Announcement Date": {
        "metric": "Announcement Date",
        "unit": null,
        "fiscalMonth": "March",
        "year": "2024",
        "released": "03/05/24",
        "forecast": null,
        "spreadRaw": null
      }
    },
    "2025": {
      "Net salesMillion INR": {
        "metric": "Net salesMillion INR",
        "unit": "Million INR",
        "fiscalMonth": "March",
        "year": "2025",
        "released": "49 228",
        "forecast": "45 134",
        "spreadRaw": "9.07%"
      },
      "EBITDAMillion INR": {
        "metric": "EBITDAMillion INR",
        "unit": "Million INR",
        "fiscalMonth": "March",
        "year": "2025",
        "released": "444",
        "forecast": "7 727",
        "spreadRaw": "-94.26%"
      },
      "EBITMillion INR": {
        "metric": "EBITMillion INR",
        "unit": "Million INR",
        "fiscalMonth": "March",
        "year": "2025",
        "released": "-293",
        "forecast": "7 655",
        "spreadRaw": "-103.83%"
      },
      "Earnings before Tax (EBT)Million INR": {
        "metric": "Earnings before Tax (EBT)Million INR",
        "unit": "Million INR",
        "fiscalMonth": "March",
        "year": "2025",
        "released": "18 412",
        "forecast": "16 847",
        "spreadRaw": "9.29%"
      },
      "Net incomeMillion INR": {
        "metric": "Net incomeMillion INR",
        "unit": "Million INR",
        "fiscalMonth": "March",
        "year": "2025",
        "released": "13 999",
        "forecast": "13 187",
        "spreadRaw": "6.15%"
      },
      "EPS INR": {
        "metric": "EPS INR",
        "unit": "INR",
        "fiscalMonth": "March",
        "year": "2025",
        "released": "49,0",
        "forecast": "46,0",
        "spreadRaw": "6.58%"
      },
      "Announcement Date": {
        "metric": "Announcement Date",
        "unit": null,
        "fiscalMonth": "March",
        "year": "2025",
        "released": "02/05/25",
        "forecast": null,
        "spreadRaw": null
      }
    },
    "2026": {
      "Net salesMillion INR": {
        "metric": "Net salesMillion INR",
        "unit": "Million INR",
        "fiscalMonth": "March",
        "year": "2026",
        "released": null,
        "forecast": "62 034",
        "spreadRaw": null
      },
      "EBITDAMillion INR": {
        "metric": "EBITDAMillion INR",
        "unit": "Million INR",
        "fiscalMonth": "March",
        "year": "2026",
        "released": null,
        "forecast": "8 779",
        "spreadRaw": null
      },
      "EBITMillion INR": {
        "metric": "EBITMillion INR",
        "unit": "Million INR",
        "fiscalMonth": "March",
        "year": "2026",
        "released": null,
        "forecast": "7 743",
        "spreadRaw": null
      },
      "Earnings before Tax (EBT)Million INR": {
        "metric": "Earnings before Tax (EBT)Million INR",
        "unit": "Million INR",
        "fiscalMonth": "March",
        "year": "2026",
        "released": null,
        "forecast": "24 648",
        "spreadRaw": null
      },
      "Net incomeMillion INR": {
        "metric": "Net incomeMillion INR",
        "unit": "Million INR",
        "fiscalMonth": "March",
        "year": "2026",
        "released": null,
        "forecast": "18 134",
        "spreadRaw": null
      },
      "EPS INR": {
        "metric": "EPS INR",
        "unit": "INR",
        "fiscalMonth": "March",
        "year": "2026",
        "released": null,
        "forecast": "58,8",
        "spreadRaw": null
      },
      "Announcement Date": {
        "metric": "Announcement Date",
        "unit": null,
        "fiscalMonth": "March",
        "year": "2026",
        "released": "-",
        "forecast": null,
        "spreadRaw": null
      }
    },
    "2027": {
      "Net salesMillion INR": {
        "metric": "Net salesMillion INR",
        "unit": "Million INR",
        "fiscalMonth": "March",
        "year": "2027",
        "released": null,
        "forecast": "91 891",
        "spreadRaw": null
      },
      "EBITDAMillion INR": {
        "metric": "EBITDAMillion INR",
        "unit": "Million INR",
        "fiscalMonth": "March",
        "year": "2027",
        "released": null,
        "forecast": "18 244",
        "spreadRaw": null
      },
      "EBITMillion INR": {
        "metric": "EBITMillion INR",
        "unit": "Million INR",
        "fiscalMonth": "March",
        "year": "2027",
        "released": null,
        "forecast": "14 032",
        "spreadRaw": null
      },
      "Earnings before Tax (EBT)Million INR": {
        "metric": "Earnings before Tax (EBT)Million INR",
        "unit": "Million INR",
        "fiscalMonth": "March",
        "year": "2027",
        "released": null,
        "forecast": "34 334",
        "spreadRaw": null
      },
      "Net incomeMillion INR": {
        "metric": "Net incomeMillion INR",
        "unit": "Million INR",
        "fiscalMonth": "March",
        "year": "2027",
        "released": null,
        "forecast": "24 369",
        "spreadRaw": null
      },
      "EPS INR": {
        "metric": "EPS INR",
        "unit": "INR",
        "fiscalMonth": "March",
        "year": "2027",
        "released": null,
        "forecast": "77,6",
        "spreadRaw": null
      },
      "Announcement Date": {
        "metric": "Announcement Date",
        "unit": null,
        "fiscalMonth": "March",
        "year": "2027",
        "released": null,
        "forecast": null,
        "spreadRaw": null
      }
    },
    "2028": {
      "Net salesMillion INR": {
        "metric": "Net salesMillion INR",
        "unit": "Million INR",
        "fiscalMonth": "March",
        "year": "2028",
        "released": null,
        "forecast": "130 694",
        "spreadRaw": null
      },
      "EBITDAMillion INR": {
        "metric": "EBITDAMillion INR",
        "unit": "Million INR",
        "fiscalMonth": "March",
        "year": "2028",
        "released": null,
        "forecast": "27 193",
        "spreadRaw": null
      },
      "EBITMillion INR": {
        "metric": "EBITMillion INR",
        "unit": "Million INR",
        "fiscalMonth": "March",
        "year": "2028",
        "released": null,
        "forecast": "20 648",
        "spreadRaw": null
      },
      "Earnings before Tax (EBT)Million INR": {
        "metric": "Earnings before Tax (EBT)Million INR",
        "unit": "Million INR",
        "fiscalMonth": "March",
        "year": "2028",
        "released": null,
        "forecast": "43 703",
        "spreadRaw": null
      },
      "Net incomeMillion INR": {
        "metric": "Net incomeMillion INR",
        "unit": "Million INR",
        "fiscalMonth": "March",
        "year": "2028",
        "released": null,
        "forecast": "32 923",
        "spreadRaw": null
      },
      "EPS INR": {
        "metric": "EPS INR",
        "unit": "INR",
        "fiscalMonth": "March",
        "year": "2028",
        "released": null,
        "forecast": "117",
        "spreadRaw": null
      },
      "Announcement Date": {
        "metric": "Announcement Date",
        "unit": null,
        "fiscalMonth": "March",
        "year": "2028",
        "released": null,
        "forecast": null,
        "spreadRaw": null
      }
    }
  },
  "quarterlyResults": {
    "2024 Q2": {
      "Net salesMillion INR": {
        "metric": "Net salesMillion INR",
        "unit": "Million INR",
        "fiscalMonth": "March",
        "period": "2024 Q2",
        "released": "3 430",
        "releasedNum": 3430,
        "forecast": "3 456",
        "forecastNum": 3456,
        "spreadRaw": "-0.75%",
        "spreadPct": -0.75
      },
      "EBITDAMillion INR": {
        "metric": "EBITDAMillion INR",
        "unit": "Million INR",
        "fiscalMonth": "March",
        "period": "2024 Q2",
        "released": "-617",
        "releasedNum": -617,
        "forecast": "-891",
        "forecastNum": -891,
        "spreadRaw": "30.8%",
        "spreadPct": 30.8
      },
      "EBITMillion INR": {
        "metric": "EBITMillion INR",
        "unit": "Million INR",
        "fiscalMonth": "March",
        "period": "2024 Q2",
        "released": "-691",
        "releasedNum": -691,
        "forecast": "-1 470",
        "forecastNum": -1470,
        "spreadRaw": "53.03%",
        "spreadPct": 53.03
      },
      "Earnings before Tax (EBT)Million INR": {
        "metric": "Earnings before Tax (EBT)Million INR",
        "unit": "Million INR",
        "fiscalMonth": "March",
        "period": "2024 Q2",
        "released": "1 451",
        "releasedNum": 1451,
        "forecast": "551",
        "forecastNum": 551,
        "spreadRaw": "163.25%",
        "spreadPct": 163.25
      },
      "Net incomeMillion INR": {
        "metric": "Net incomeMillion INR",
        "unit": "Million INR",
        "fiscalMonth": "March",
        "period": "2024 Q2",
        "released": "668",
        "releasedNum": 668,
        "forecast": "1 006",
        "forecastNum": 1006,
        "spreadRaw": "-33.57%",
        "spreadPct": -33.57
      },
      "EPS INR": {
        "metric": "EPS INR",
        "unit": "INR",
        "fiscalMonth": "March",
        "period": "2024 Q2",
        "released": "2,40",
        "releasedNum": 2.4,
        "forecast": "5,49",
        "forecastNum": 5.49,
        "spreadRaw": "-56.24%",
        "spreadPct": -56.24
      },
      "Announcement Date": {
        "metric": "Announcement Date",
        "unit": null,
        "fiscalMonth": "March",
        "period": "2024 Q2",
        "released": "02/11/23",
        "releasedDate": "02/11/23",
        "forecast": null,
        "spreadRaw": null,
        "spreadPct": null
      }
    },
    "2024 Q3": {
      "Net salesMillion INR": {
        "metric": "Net salesMillion INR",
        "unit": "Million INR",
        "fiscalMonth": "March",
        "period": "2024 Q3",
        "released": "3 304",
        "releasedNum": 3304,
        "forecast": "3 023",
        "forecastNum": 3023,
        "spreadRaw": "9.31%",
        "spreadPct": 9.31
      },
      "EBITDAMillion INR": {
        "metric": "EBITDAMillion INR",
        "unit": "Million INR",
        "fiscalMonth": "March",
        "period": "2024 Q3",
        "released": "-416",
        "releasedNum": -416,
        "forecast": "-180",
        "forecastNum": -180,
        "spreadRaw": "-130.94%",
        "spreadPct": -130.94
      },
      "EBITMillion INR": {
        "metric": "EBITMillion INR",
        "unit": "Million INR",
        "fiscalMonth": "March",
        "period": "2024 Q3",
        "released": "-557",
        "releasedNum": -557,
        "forecast": "-320",
        "forecastNum": -320,
        "spreadRaw": "-74.16%",
        "spreadPct": -74.16
      },
      "Earnings before Tax (EBT)Million INR": {
        "metric": "Earnings before Tax (EBT)Million INR",
        "unit": "Million INR",
        "fiscalMonth": "March",
        "period": "2024 Q3",
        "released": "1 192",
        "releasedNum": 1192,
        "forecast": "1 299",
        "forecastNum": 1299,
        "spreadRaw": "-8.22%",
        "spreadPct": -8.22
      },
      "Net incomeMillion INR": {
        "metric": "Net incomeMillion INR",
        "unit": "Million INR",
        "fiscalMonth": "March",
        "period": "2024 Q3",
        "released": "623",
        "releasedNum": 623,
        "forecast": "850",
        "forecastNum": 850,
        "spreadRaw": "-26.71%",
        "spreadPct": -26.71
      },
      "EPS INR": {
        "metric": "EPS INR",
        "unit": "INR",
        "fiscalMonth": "March",
        "period": "2024 Q3",
        "released": "2,24",
        "releasedNum": 2.24,
        "forecast": "7,25",
        "forecastNum": 7.25,
        "spreadRaw": "-69.08%",
        "spreadPct": -69.08
      },
      "Announcement Date": {
        "metric": "Announcement Date",
        "unit": null,
        "fiscalMonth": "March",
        "period": "2024 Q3",
        "released": "06/02/24",
        "releasedDate": "06/02/24",
        "forecast": null,
        "spreadRaw": null,
        "spreadPct": null
      }
    },
    "2024 Q4": {
      "Net salesMillion INR": {
        "metric": "Net salesMillion INR",
        "unit": "Million INR",
        "fiscalMonth": "March",
        "period": "2024 Q4",
        "released": "14 261",
        "releasedNum": 14261,
        "forecast": "10 255",
        "forecastNum": 10255,
        "spreadRaw": "39.07%",
        "spreadPct": 39.07
      },
      "EBITDAMillion INR": {
        "metric": "EBITDAMillion INR",
        "unit": "Million INR",
        "fiscalMonth": "March",
        "period": "2024 Q4",
        "released": "1 228",
        "releasedNum": 1228,
        "forecast": "1 583",
        "forecastNum": 1583,
        "spreadRaw": "-22.46%",
        "spreadPct": -22.46
      },
      "EBITMillion INR": {
        "metric": "EBITMillion INR",
        "unit": "Million INR",
        "fiscalMonth": "March",
        "period": "2024 Q4",
        "released": "1 067",
        "releasedNum": 1067,
        "forecast": "282",
        "forecastNum": 282,
        "spreadRaw": "278.26%",
        "spreadPct": 278.26
      },
      "Earnings before Tax (EBT)Million INR": {
        "metric": "Earnings before Tax (EBT)Million INR",
        "unit": "Million INR",
        "fiscalMonth": "March",
        "period": "2024 Q4",
        "released": "5 639",
        "releasedNum": 5639,
        "forecast": "3 110",
        "forecastNum": 3110,
        "spreadRaw": "81.33%",
        "spreadPct": 81.33
      },
      "Net incomeMillion INR": {
        "metric": "Net incomeMillion INR",
        "unit": "Million INR",
        "fiscalMonth": "March",
        "period": "2024 Q4",
        "released": "4 713",
        "releasedNum": 4713,
        "forecast": "3 733",
        "forecastNum": 3733,
        "spreadRaw": "26.24%",
        "spreadPct": 26.24
      },
      "EPS INR": {
        "metric": "EPS INR",
        "unit": "INR",
        "fiscalMonth": "March",
        "period": "2024 Q4",
        "released": "17,0",
        "releasedNum": 17,
        "forecast": "8,69",
        "forecastNum": 8.69,
        "spreadRaw": "95.13%",
        "spreadPct": 95.13
      },
      "Announcement Date": {
        "metric": "Announcement Date",
        "unit": null,
        "fiscalMonth": "March",
        "period": "2024 Q4",
        "released": "03/05/24",
        "releasedDate": "03/05/24",
        "forecast": null,
        "spreadRaw": null,
        "spreadPct": null
      }
    },
    "2025 Q1": {
      "Net salesMillion INR": {
        "metric": "Net salesMillion INR",
        "unit": "Million INR",
        "fiscalMonth": "March",
        "period": "2025 Q1",
        "released": "7 390",
        "releasedNum": 7390,
        "forecast": "10 914",
        "forecastNum": 10914,
        "spreadRaw": "-32.29%",
        "spreadPct": -32.29
      },
      "EBITDAMillion INR": {
        "metric": "EBITDAMillion INR",
        "unit": "Million INR",
        "fiscalMonth": "March",
        "period": "2025 Q1",
        "released": "-1 869",
        "releasedNum": -1869,
        "forecast": "939",
        "forecastNum": 939,
        "spreadRaw": "-299.03%",
        "spreadPct": -299.03
      },
      "EBITMillion INR": {
        "metric": "EBITMillion INR",
        "unit": "Million INR",
        "fiscalMonth": "March",
        "period": "2025 Q1",
        "released": "-2 035",
        "releasedNum": -2035,
        "forecast": "-1 586",
        "forecastNum": -1586,
        "spreadRaw": "-28.31%",
        "spreadPct": -28.31
      },
      "Earnings before Tax (EBT)Million INR": {
        "metric": "Earnings before Tax (EBT)Million INR",
        "unit": "Million INR",
        "fiscalMonth": "March",
        "period": "2025 Q1",
        "released": "7 162",
        "releasedNum": 7162,
        "forecast": "2 412",
        "forecastNum": 2412,
        "spreadRaw": "196.9%",
        "spreadPct": 196.9
      },
      "Net incomeMillion INR": {
        "metric": "Net incomeMillion INR",
        "unit": "Million INR",
        "fiscalMonth": "March",
        "period": "2025 Q1",
        "released": "5 201",
        "releasedNum": 5201,
        "forecast": "3 725",
        "forecastNum": 3725,
        "spreadRaw": "39.6%",
        "spreadPct": 39.6
      },
      "EPS INR": {
        "metric": "EPS INR",
        "unit": "INR",
        "fiscalMonth": "March",
        "period": "2025 Q1",
        "released": "18,7",
        "releasedNum": 18.7,
        "forecast": "7,24",
        "forecastNum": 7.24,
        "spreadRaw": "158.41%",
        "spreadPct": 158.41
      },
      "Announcement Date": {
        "metric": "Announcement Date",
        "unit": null,
        "fiscalMonth": "March",
        "period": "2025 Q1",
        "released": "31/07/24",
        "releasedDate": "31/07/24",
        "forecast": null,
        "spreadRaw": null,
        "spreadPct": null
      }
    },
    "2025 Q2": {
      "Net salesMillion INR": {
        "metric": "Net salesMillion INR",
        "unit": "Million INR",
        "fiscalMonth": "March",
        "period": "2025 Q2",
        "released": "10 932",
        "releasedNum": 10932,
        "forecast": "7 240",
        "forecastNum": 7240,
        "spreadRaw": "51%",
        "spreadPct": 51
      },
      "EBITDAMillion INR": {
        "metric": "EBITDAMillion INR",
        "unit": "Million INR",
        "fiscalMonth": "March",
        "period": "2025 Q2",
        "released": "288",
        "releasedNum": 288,
        "forecast": "94,7",
        "forecastNum": 94.7,
        "spreadRaw": "203.7%",
        "spreadPct": 203.7
      },
      "EBITMillion INR": {
        "metric": "EBITMillion INR",
        "unit": "Million INR",
        "fiscalMonth": "March",
        "period": "2025 Q2",
        "released": "105",
        "releasedNum": 105,
        "forecast": "-560",
        "forecastNum": -560,
        "spreadRaw": "118.73%",
        "spreadPct": 118.73
      },
      "Earnings before Tax (EBT)Million INR": {
        "metric": "Earnings before Tax (EBT)Million INR",
        "unit": "Million INR",
        "fiscalMonth": "March",
        "period": "2025 Q2",
        "released": "2 193",
        "releasedNum": 2193,
        "forecast": "2 847",
        "forecastNum": 2847,
        "spreadRaw": "-22.99%",
        "spreadPct": -22.99
      },
      "Net incomeMillion INR": {
        "metric": "Net incomeMillion INR",
        "unit": "Million INR",
        "fiscalMonth": "March",
        "period": "2025 Q2",
        "released": "3 352",
        "releasedNum": 3352,
        "forecast": "1 795",
        "forecastNum": 1795,
        "spreadRaw": "86.8%",
        "spreadPct": 86.8
      },
      "EPS INR": {
        "metric": "EPS INR",
        "unit": "INR",
        "fiscalMonth": "March",
        "period": "2025 Q2",
        "released": "12,1",
        "releasedNum": 12.1,
        "forecast": "6,76",
        "forecastNum": 6.76,
        "spreadRaw": "78.25%",
        "spreadPct": 78.25
      },
      "Announcement Date": {
        "metric": "Announcement Date",
        "unit": null,
        "fiscalMonth": "March",
        "period": "2025 Q2",
        "released": "23/10/24",
        "releasedDate": "23/10/24",
        "forecast": null,
        "spreadRaw": null,
        "spreadPct": null
      }
    },
    "2025 Q3": {
      "Net salesMillion INR": {
        "metric": "Net salesMillion INR",
        "unit": "Million INR",
        "fiscalMonth": "March",
        "period": "2025 Q3",
        "released": "9 689",
        "releasedNum": 9689,
        "forecast": "10 272",
        "forecastNum": 10272,
        "spreadRaw": "-5.67%",
        "spreadPct": -5.67
      },
      "EBITDAMillion INR": {
        "metric": "EBITDAMillion INR",
        "unit": "Million INR",
        "fiscalMonth": "March",
        "period": "2025 Q3",
        "released": "276",
        "releasedNum": 276,
        "forecast": "724",
        "forecastNum": 724,
        "spreadRaw": "-61.95%",
        "spreadPct": -61.95
      },
      "EBITMillion INR": {
        "metric": "EBITMillion INR",
        "unit": "Million INR",
        "fiscalMonth": "March",
        "period": "2025 Q3",
        "released": "98,6",
        "releasedNum": 98.6,
        "forecast": "257",
        "forecastNum": 257,
        "spreadRaw": "-61.63%",
        "spreadPct": -61.63
      },
      "Earnings before Tax (EBT)Million INR": {
        "metric": "Earnings before Tax (EBT)Million INR",
        "unit": "Million INR",
        "fiscalMonth": "March",
        "period": "2025 Q3",
        "released": "2 385",
        "releasedNum": 2385,
        "forecast": "3 269",
        "forecastNum": 3269,
        "spreadRaw": "-27.04%",
        "spreadPct": -27.04
      },
      "Net incomeMillion INR": {
        "metric": "Net incomeMillion INR",
        "unit": "Million INR",
        "fiscalMonth": "March",
        "period": "2025 Q3",
        "released": "1 626",
        "releasedNum": 1626,
        "forecast": "2 493",
        "forecastNum": 2493,
        "spreadRaw": "-34.77%",
        "spreadPct": -34.77
      },
      "EPS INR": {
        "metric": "EPS INR",
        "unit": "INR",
        "fiscalMonth": "March",
        "period": "2025 Q3",
        "released": "5,70",
        "releasedNum": 5.7,
        "forecast": "9,36",
        "forecastNum": 9.36,
        "spreadRaw": "-39.1%",
        "spreadPct": -39.1
      },
      "Announcement Date": {
        "metric": "Announcement Date",
        "unit": null,
        "fiscalMonth": "March",
        "period": "2025 Q3",
        "released": "04/02/25",
        "releasedDate": "04/02/25",
        "forecast": null,
        "spreadRaw": null,
        "spreadPct": null
      }
    },
    "2025 Q4": {
      "Net salesMillion INR": {
        "metric": "Net salesMillion INR",
        "unit": "Million INR",
        "fiscalMonth": "March",
        "period": "2025 Q4",
        "released": "21 217",
        "releasedNum": 21217,
        "forecast": "15 211",
        "forecastNum": 15211,
        "spreadRaw": "39.49%",
        "spreadPct": 39.49
      },
      "EBITDAMillion INR": {
        "metric": "EBITDAMillion INR",
        "unit": "Million INR",
        "fiscalMonth": "March",
        "period": "2025 Q4",
        "released": "1 100",
        "releasedNum": 1100,
        "forecast": "3 406",
        "forecastNum": 3406,
        "spreadRaw": "-67.71%",
        "spreadPct": -67.71
      },
      "EBITMillion INR": {
        "metric": "EBITMillion INR",
        "unit": "Million INR",
        "fiscalMonth": "March",
        "period": "2025 Q4",
        "released": "889",
        "releasedNum": 889,
        "forecast": "1 154",
        "forecastNum": 1154,
        "spreadRaw": "-22.97%",
        "spreadPct": -22.97
      },
      "Earnings before Tax (EBT)Million INR": {
        "metric": "Earnings before Tax (EBT)Million INR",
        "unit": "Million INR",
        "fiscalMonth": "March",
        "period": "2025 Q4",
        "released": "6 022",
        "releasedNum": 6022,
        "forecast": "5 819",
        "forecastNum": 5819,
        "spreadRaw": "3.5%",
        "spreadPct": 3.5
      },
      "Net incomeMillion INR": {
        "metric": "Net incomeMillion INR",
        "unit": "Million INR",
        "fiscalMonth": "March",
        "period": "2025 Q4",
        "released": "3 820",
        "releasedNum": 3820,
        "forecast": "4 502",
        "forecastNum": 4502,
        "spreadRaw": "-15.15%",
        "spreadPct": -15.15
      },
      "EPS INR": {
        "metric": "EPS INR",
        "unit": "INR",
        "fiscalMonth": "March",
        "period": "2025 Q4",
        "released": "12,7",
        "releasedNum": 12.7,
        "forecast": "10,3",
        "forecastNum": 10.3,
        "spreadRaw": "22.87%",
        "spreadPct": 22.87
      },
      "Announcement Date": {
        "metric": "Announcement Date",
        "unit": null,
        "fiscalMonth": "March",
        "period": "2025 Q4",
        "released": "02/05/25",
        "releasedDate": "02/05/25",
        "forecast": null,
        "spreadRaw": null,
        "spreadPct": null
      }
    },
    "2026 Q1": {
      "Net salesMillion INR": {
        "metric": "Net salesMillion INR",
        "unit": "Million INR",
        "fiscalMonth": "March",
        "period": "2026 Q1",
        "released": "4 346",
        "releasedNum": 4346,
        "forecast": "11 664",
        "forecastNum": 11664,
        "spreadRaw": "-62.74%",
        "spreadPct": -62.74
      },
      "EBITDAMillion INR": {
        "metric": "EBITDAMillion INR",
        "unit": "Million INR",
        "fiscalMonth": "March",
        "period": "2026 Q1",
        "released": "-2 433",
        "releasedNum": -2433,
        "forecast": "1 698",
        "forecastNum": 1698,
        "spreadRaw": "-243.28%",
        "spreadPct": -243.28
      },
      "EBITMillion INR": {
        "metric": "EBITMillion INR",
        "unit": "Million INR",
        "fiscalMonth": "March",
        "period": "2026 Q1",
        "released": "-2 653",
        "releasedNum": -2653,
        "forecast": "103",
        "forecastNum": 103,
        "spreadRaw": "-2676.02%",
        "spreadPct": -2676.02
      },
      "Earnings before Tax (EBT)Million INR": {
        "metric": "Earnings before Tax (EBT)Million INR",
        "unit": "Million INR",
        "fiscalMonth": "March",
        "period": "2026 Q1",
        "released": "8 878",
        "releasedNum": 8878,
        "forecast": "4 739",
        "forecastNum": 4739,
        "spreadRaw": "87.34%",
        "spreadPct": 87.34
      },
      "Net incomeMillion INR": {
        "metric": "Net incomeMillion INR",
        "unit": "Million INR",
        "fiscalMonth": "March",
        "period": "2026 Q1",
        "released": "6 001",
        "releasedNum": 6001,
        "forecast": "3 381",
        "forecastNum": 3381,
        "spreadRaw": "77.52%",
        "spreadPct": 77.52
      },
      "EPS INR": {
        "metric": "EPS INR",
        "unit": "INR",
        "fiscalMonth": "March",
        "period": "2026 Q1",
        "released": "19,9",
        "releasedNum": 19.9,
        "forecast": "7,96",
        "forecastNum": 7.96,
        "spreadRaw": "150.15%",
        "spreadPct": 150.15
      },
      "Announcement Date": {
        "metric": "Announcement Date",
        "unit": null,
        "fiscalMonth": "March",
        "period": "2026 Q1",
        "released": "01/08/25",
        "releasedDate": "01/08/25",
        "forecast": null,
        "spreadRaw": null,
        "spreadPct": null
      }
    },
    "2026 Q2": {
      "Net salesMillion INR": {
        "metric": "Net salesMillion INR",
        "unit": "Million INR",
        "fiscalMonth": "March",
        "period": "2026 Q2",
        "released": null,
        "releasedNum": null,
        "forecast": "11 247",
        "forecastNum": 11247,
        "spreadRaw": null,
        "spreadPct": null
      },
      "EBITDAMillion INR": {
        "metric": "EBITDAMillion INR",
        "unit": "Million INR",
        "fiscalMonth": "March",
        "period": "2026 Q2",
        "released": null,
        "releasedNum": null,
        "forecast": "1 610",
        "forecastNum": 1610,
        "spreadRaw": null,
        "spreadPct": null
      },
      "EBITMillion INR": {
        "metric": "EBITMillion INR",
        "unit": "Million INR",
        "fiscalMonth": "March",
        "period": "2026 Q2",
        "released": null,
        "releasedNum": null,
        "forecast": "687",
        "forecastNum": 687,
        "spreadRaw": null,
        "spreadPct": null
      },
      "Earnings before Tax (EBT)Million INR": {
        "metric": "Earnings before Tax (EBT)Million INR",
        "unit": "Million INR",
        "fiscalMonth": "March",
        "period": "2026 Q2",
        "released": null,
        "releasedNum": null,
        "forecast": "4 545",
        "forecastNum": 4545,
        "spreadRaw": null,
        "spreadPct": null
      },
      "Net incomeMillion INR": {
        "metric": "Net incomeMillion INR",
        "unit": "Million INR",
        "fiscalMonth": "March",
        "period": "2026 Q2",
        "released": null,
        "releasedNum": null,
        "forecast": "3 467",
        "forecastNum": 3467,
        "spreadRaw": null,
        "spreadPct": null
      },
      "EPS INR": {
        "metric": "EPS INR",
        "unit": "INR",
        "fiscalMonth": "March",
        "period": "2026 Q2",
        "released": null,
        "releasedNum": null,
        "forecast": "10,6",
        "forecastNum": 10.6,
        "spreadRaw": null,
        "spreadPct": null
      },
      "Announcement Date": {
        "metric": "Announcement Date",
        "unit": null,
        "fiscalMonth": "March",
        "period": "2026 Q2",
        "released": "-",
        "releasedDate": "-",
        "forecast": null,
        "spreadRaw": null,
        "spreadPct": null
      }
    },
    "2026 Q3": {
      "Net salesMillion INR": {
        "metric": "Net salesMillion INR",
        "unit": "Million INR",
        "fiscalMonth": "March",
        "period": "2026 Q3",
        "released": null,
        "releasedNum": null,
        "forecast": "13 973",
        "forecastNum": 13973,
        "spreadRaw": null,
        "spreadPct": null
      },
      "EBITDAMillion INR": {
        "metric": "EBITDAMillion INR",
        "unit": "Million INR",
        "fiscalMonth": "March",
        "period": "2026 Q3",
        "released": null,
        "releasedNum": null,
        "forecast": "1 756",
        "forecastNum": 1756,
        "spreadRaw": null,
        "spreadPct": null
      },
      "EBITMillion INR": {
        "metric": "EBITMillion INR",
        "unit": "Million INR",
        "fiscalMonth": "March",
        "period": "2026 Q3",
        "released": null,
        "releasedNum": null,
        "forecast": null,
        "forecastNum": null,
        "spreadRaw": null,
        "spreadPct": null
      },
      "Earnings before Tax (EBT)Million INR": {
        "metric": "Earnings before Tax (EBT)Million INR",
        "unit": "Million INR",
        "fiscalMonth": "March",
        "period": "2026 Q3",
        "released": null,
        "releasedNum": null,
        "forecast": "8 049",
        "forecastNum": 8049,
        "spreadRaw": null,
        "spreadPct": null
      },
      "Net incomeMillion INR": {
        "metric": "Net incomeMillion INR",
        "unit": "Million INR",
        "fiscalMonth": "March",
        "period": "2026 Q3",
        "released": null,
        "releasedNum": null,
        "forecast": "6 444",
        "forecastNum": 6444,
        "spreadRaw": null,
        "spreadPct": null
      },
      "EPS INR": {
        "metric": "EPS INR",
        "unit": "INR",
        "fiscalMonth": "March",
        "period": "2026 Q3",
        "released": null,
        "releasedNum": null,
        "forecast": "14,8",
        "forecastNum": 14.8,
        "spreadRaw": null,
        "spreadPct": null
      },
      "Announcement Date": {
        "metric": "Announcement Date",
        "unit": null,
        "fiscalMonth": "March",
        "period": "2026 Q3",
        "released": "-",
        "releasedDate": "-",
        "forecast": null,
        "spreadRaw": null,
        "spreadPct": null
      }
    },
    "2026 Q4": {
      "Net salesMillion INR": {
        "metric": "Net salesMillion INR",
        "unit": "Million INR",
        "fiscalMonth": "March",
        "period": "2026 Q4",
        "released": null,
        "releasedNum": null,
        "forecast": "24 138",
        "forecastNum": 24138,
        "spreadRaw": null,
        "spreadPct": null
      },
      "EBITDAMillion INR": {
        "metric": "EBITDAMillion INR",
        "unit": "Million INR",
        "fiscalMonth": "March",
        "period": "2026 Q4",
        "released": null,
        "releasedNum": null,
        "forecast": "6 012",
        "forecastNum": 6012,
        "spreadRaw": null,
        "spreadPct": null
      },
      "EBITMillion INR": {
        "metric": "EBITMillion INR",
        "unit": "Million INR",
        "fiscalMonth": "March",
        "period": "2026 Q4",
        "released": null,
        "releasedNum": null,
        "forecast": null,
        "forecastNum": null,
        "spreadRaw": null,
        "spreadPct": null
      },
      "Earnings before Tax (EBT)Million INR": {
        "metric": "Earnings before Tax (EBT)Million INR",
        "unit": "Million INR",
        "fiscalMonth": "March",
        "period": "2026 Q4",
        "released": null,
        "releasedNum": null,
        "forecast": "7 529",
        "forecastNum": 7529,
        "spreadRaw": null,
        "spreadPct": null
      },
      "Net incomeMillion INR": {
        "metric": "Net incomeMillion INR",
        "unit": "Million INR",
        "fiscalMonth": "March",
        "period": "2026 Q4",
        "released": null,
        "releasedNum": null,
        "forecast": "7 153",
        "forecastNum": 7153,
        "spreadRaw": null,
        "spreadPct": null
      },
      "EPS INR": {
        "metric": "EPS INR",
        "unit": "INR",
        "fiscalMonth": "March",
        "period": "2026 Q4",
        "released": null,
        "releasedNum": null,
        "forecast": "16,0",
        "forecastNum": 16,
        "spreadRaw": null,
        "spreadPct": null
      },
      "Announcement Date": {
        "metric": "Announcement Date",
        "unit": null,
        "fiscalMonth": "March",
        "period": "2026 Q4",
        "released": "-",
        "releasedDate": "-",
        "forecast": null,
        "spreadRaw": null,
        "spreadPct": null
      }
    },
    "2027 Q1": {
      "Net salesMillion INR": {
        "metric": "Net salesMillion INR",
        "unit": "Million INR",
        "fiscalMonth": "March",
        "period": "2027 Q1",
        "released": null,
        "releasedNum": null,
        "forecast": null,
        "forecastNum": null,
        "spreadRaw": null,
        "spreadPct": null
      },
      "EBITDAMillion INR": {
        "metric": "EBITDAMillion INR",
        "unit": "Million INR",
        "fiscalMonth": "March",
        "period": "2027 Q1",
        "released": null,
        "releasedNum": null,
        "forecast": null,
        "forecastNum": null,
        "spreadRaw": null,
        "spreadPct": null
      },
      "EBITMillion INR": {
        "metric": "EBITMillion INR",
        "unit": "Million INR",
        "fiscalMonth": "March",
        "period": "2027 Q1",
        "released": null,
        "releasedNum": null,
        "forecast": null,
        "forecastNum": null,
        "spreadRaw": null,
        "spreadPct": null
      },
      "Earnings before Tax (EBT)Million INR": {
        "metric": "Earnings before Tax (EBT)Million INR",
        "unit": "Million INR",
        "fiscalMonth": "March",
        "period": "2027 Q1",
        "released": null,
        "releasedNum": null,
        "forecast": null,
        "forecastNum": null,
        "spreadRaw": null,
        "spreadPct": null
      },
      "Net incomeMillion INR": {
        "metric": "Net incomeMillion INR",
        "unit": "Million INR",
        "fiscalMonth": "March",
        "period": "2027 Q1",
        "released": null,
        "releasedNum": null,
        "forecast": null,
        "forecastNum": null,
        "spreadRaw": null,
        "spreadPct": null
      },
      "EPS INR": {
        "metric": "EPS INR",
        "unit": "INR",
        "fiscalMonth": "March",
        "period": "2027 Q1",
        "released": null,
        "releasedNum": null,
        "forecast": "16,7",
        "forecastNum": 16.7,
        "spreadRaw": null,
        "spreadPct": null
      },
      "Announcement Date": {
        "metric": "Announcement Date",
        "unit": null,
        "fiscalMonth": "March",
        "period": "2027 Q1",
        "released": "-",
        "releasedDate": "-",
        "forecast": null,
        "spreadRaw": null,
        "spreadPct": null
      }
    },
    "2027 Q2": {
      "Net salesMillion INR": {
        "metric": "Net salesMillion INR",
        "unit": "Million INR",
        "fiscalMonth": "March",
        "period": "2027 Q2",
        "released": null,
        "releasedNum": null,
        "forecast": null,
        "forecastNum": null,
        "spreadRaw": null,
        "spreadPct": null
      },
      "EBITDAMillion INR": {
        "metric": "EBITDAMillion INR",
        "unit": "Million INR",
        "fiscalMonth": "March",
        "period": "2027 Q2",
        "released": null,
        "releasedNum": null,
        "forecast": null,
        "forecastNum": null,
        "spreadRaw": null,
        "spreadPct": null
      },
      "EBITMillion INR": {
        "metric": "EBITMillion INR",
        "unit": "Million INR",
        "fiscalMonth": "March",
        "period": "2027 Q2",
        "released": null,
        "releasedNum": null,
        "forecast": null,
        "forecastNum": null,
        "spreadRaw": null,
        "spreadPct": null
      },
      "Earnings before Tax (EBT)Million INR": {
        "metric": "Earnings before Tax (EBT)Million INR",
        "unit": "Million INR",
        "fiscalMonth": "March",
        "period": "2027 Q2",
        "released": null,
        "releasedNum": null,
        "forecast": null,
        "forecastNum": null,
        "spreadRaw": null,
        "spreadPct": null
      },
      "Net incomeMillion INR": {
        "metric": "Net incomeMillion INR",
        "unit": "Million INR",
        "fiscalMonth": "March",
        "period": "2027 Q2",
        "released": null,
        "releasedNum": null,
        "forecast": null,
        "forecastNum": null,
        "spreadRaw": null,
        "spreadPct": null
      },
      "EPS INR": {
        "metric": "EPS INR",
        "unit": "INR",
        "fiscalMonth": "March",
        "period": "2027 Q2",
        "released": null,
        "releasedNum": null,
        "forecast": "19,7",
        "forecastNum": 19.7,
        "spreadRaw": null,
        "spreadPct": null
      },
      "Announcement Date": {
        "metric": "Announcement Date",
        "unit": null,
        "fiscalMonth": "March",
        "period": "2027 Q2",
        "released": "-",
        "releasedDate": "-",
        "forecast": null,
        "spreadRaw": null,
        "spreadPct": null
      }
    },
    "2027 Q3": {
      "Net salesMillion INR": {
        "metric": "Net salesMillion INR",
        "unit": "Million INR",
        "fiscalMonth": "March",
        "period": "2027 Q3",
        "released": null,
        "releasedNum": null,
        "forecast": null,
        "forecastNum": null,
        "spreadRaw": null,
        "spreadPct": null
      },
      "EBITDAMillion INR": {
        "metric": "EBITDAMillion INR",
        "unit": "Million INR",
        "fiscalMonth": "March",
        "period": "2027 Q3",
        "released": null,
        "releasedNum": null,
        "forecast": null,
        "forecastNum": null,
        "spreadRaw": null,
        "spreadPct": null
      },
      "EBITMillion INR": {
        "metric": "EBITMillion INR",
        "unit": "Million INR",
        "fiscalMonth": "March",
        "period": "2027 Q3",
        "released": null,
        "releasedNum": null,
        "forecast": null,
        "forecastNum": null,
        "spreadRaw": null,
        "spreadPct": null
      },
      "Earnings before Tax (EBT)Million INR": {
        "metric": "Earnings before Tax (EBT)Million INR",
        "unit": "Million INR",
        "fiscalMonth": "March",
        "period": "2027 Q3",
        "released": null,
        "releasedNum": null,
        "forecast": null,
        "forecastNum": null,
        "spreadRaw": null,
        "spreadPct": null
      },
      "Net incomeMillion INR": {
        "metric": "Net incomeMillion INR",
        "unit": "Million INR",
        "fiscalMonth": "March",
        "period": "2027 Q3",
        "released": null,
        "releasedNum": null,
        "forecast": null,
        "forecastNum": null,
        "spreadRaw": null,
        "spreadPct": null
      },
      "EPS INR": {
        "metric": "EPS INR",
        "unit": "INR",
        "fiscalMonth": "March",
        "period": "2027 Q3",
        "released": null,
        "releasedNum": null,
        "forecast": "18,2",
        "forecastNum": 18.2,
        "spreadRaw": null,
        "spreadPct": null
      },
      "Announcement Date": {
        "metric": "Announcement Date",
        "unit": null,
        "fiscalMonth": "March",
        "period": "2027 Q3",
        "released": "-",
        "releasedDate": "-",
        "forecast": null,
        "spreadRaw": null,
        "spreadPct": null
      }
    },
    "2027 Q4": {
      "Net salesMillion INR": {
        "metric": "Net salesMillion INR",
        "unit": "Million INR",
        "fiscalMonth": "March",
        "period": "2027 Q4",
        "released": null,
        "releasedNum": null,
        "forecast": null,
        "forecastNum": null,
        "spreadRaw": null,
        "spreadPct": null
      },
      "EBITDAMillion INR": {
        "metric": "EBITDAMillion INR",
        "unit": "Million INR",
        "fiscalMonth": "March",
        "period": "2027 Q4",
        "released": null,
        "releasedNum": null,
        "forecast": null,
        "forecastNum": null,
        "spreadRaw": null,
        "spreadPct": null
      },
      "EBITMillion INR": {
        "metric": "EBITMillion INR",
        "unit": "Million INR",
        "fiscalMonth": "March",
        "period": "2027 Q4",
        "released": null,
        "releasedNum": null,
        "forecast": null,
        "forecastNum": null,
        "spreadRaw": null,
        "spreadPct": null
      },
      "Earnings before Tax (EBT)Million INR": {
        "metric": "Earnings before Tax (EBT)Million INR",
        "unit": "Million INR",
        "fiscalMonth": "March",
        "period": "2027 Q4",
        "released": null,
        "releasedNum": null,
        "forecast": null,
        "forecastNum": null,
        "spreadRaw": null,
        "spreadPct": null
      },
      "Net incomeMillion INR": {
        "metric": "Net incomeMillion INR",
        "unit": "Million INR",
        "fiscalMonth": "March",
        "period": "2027 Q4",
        "released": null,
        "releasedNum": null,
        "forecast": null,
        "forecastNum": null,
        "spreadRaw": null,
        "spreadPct": null
      },
      "EPS INR": {
        "metric": "EPS INR",
        "unit": "INR",
        "fiscalMonth": "March",
        "period": "2027 Q4",
        "released": null,
        "releasedNum": null,
        "forecast": "21,2",
        "forecastNum": 21.2,
        "spreadRaw": null,
        "spreadPct": null
      },
      "Announcement Date": {
        "metric": "Announcement Date",
        "unit": null,
        "fiscalMonth": "March",
        "period": "2027 Q4",
        "released": "-",
        "releasedDate": "-",
        "forecast": null,
        "spreadRaw": null,
        "spreadPct": null
      }
    }
  },
  "upcomingEvents": {
    "count": 4,
    "events": [
      {
        "section": "Upcoming",
        "dateTimeRaw": "05/11/2025",
        "dateTimeISO": "2025-11-04T18:30:00.000Z",
        "title": "Q2 2026 Earnings Release (Projected)",
        "icsUrl": "https://in.marketscreener.com/api/stateful/agenda/event-async/Q2-2026-Earnings-Release-Projected-48029582.ics"
      },
      {
        "section": "Upcoming",
        "dateTimeRaw": "10/02/2026",
        "dateTimeISO": "2026-02-09T18:30:00.000Z",
        "title": "Q3 2026 Earnings Release (Projected)",
        "icsUrl": "https://in.marketscreener.com/api/stateful/agenda/event-async/Q3-2026-Earnings-Release-Projected-48832562.ics"
      },
      {
        "section": "Upcoming",
        "dateTimeRaw": "01/05/2026",
        "dateTimeISO": "2026-04-30T18:30:00.000Z",
        "title": "Q4 2026 Earnings Release (Projected)",
        "icsUrl": "https://in.marketscreener.com/api/stateful/agenda/event-async/Q4-2026-Earnings-Release-Projected-49748023.ics"
      },
      {
        "section": "Upcoming",
        "dateTimeRaw": "04/08/2026",
        "dateTimeISO": "2026-08-03T18:30:00.000Z",
        "title": "Q1 2027 Earnings Release (Projected)",
        "icsUrl": "https://in.marketscreener.com/api/stateful/agenda/event-async/Q1-2027-Earnings-Release-Projected-50486919.ics"
      }
    ]
  },
  "pastEvents": {
    "count": 122,
    "events": [
      {
        "section": "Past",
        "dateTimeRaw": "18/09/2025",
        "dateTimeISO": "2025-09-17T18:30:00.000Z",
        "title": "Jefferies India Forum",
        "icsUrl": "https://in.marketscreener.com/api/stateful/agenda/event-async/Jefferies-India-Forum-51066648.ics"
      },
      {
        "section": "Past",
        "dateTimeRaw": "02/09/2025",
        "dateTimeISO": "2025-09-01T18:30:00.000Z",
        "title": "Ashwamedh Elara India Dialogue Conference",
        "icsUrl": "https://in.marketscreener.com/api/stateful/agenda/event-async/Ashwamedh-Elara-India-Dialogue-Conference-50928374.ics"
      },
      {
        "section": "Past",
        "dateTimeRaw": "01/09/2025",
        "dateTimeISO": "2025-08-31T18:30:00.000Z",
        "title": "Motilal Oswal Global Investor Conference",
        "icsUrl": "https://in.marketscreener.com/api/stateful/agenda/event-async/Motilal-Oswal-Global-Investor-Conference-50928372.ics"
      },
      {
        "section": "Past",
        "dateTimeRaw": "01/08/2025 04:30 pm",
        "dateTimeISO": "2025-08-01T11:00:00.000Z",
        "title": "Q1 2026 Earnings Call",
        "icsUrl": "https://in.marketscreener.com/api/stateful/agenda/event-async/Q1-2026-Earnings-Call-50486877.ics"
      },
      {
        "section": "Past",
        "dateTimeRaw": "01/08/2025 02:30 pm",
        "dateTimeISO": "2025-08-01T09:00:00.000Z",
        "title": "Annual General Meeting",
        "icsUrl": "https://in.marketscreener.com/api/stateful/agenda/event-async/Annual-General-Meeting-50440539.ics"
      },
      {
        "section": "Past",
        "dateTimeRaw": "01/08/2025 12:39 pm",
        "dateTimeISO": "2025-08-01T07:09:00.000Z",
        "title": "Q1 2026 Earnings Release",
        "icsUrl": "https://in.marketscreener.com/api/stateful/agenda/event-async/Q1-2026-Earnings-Release-47409158.ics"
      },
      {
        "section": "Past",
        "dateTimeRaw": "04/06/2025",
        "dateTimeISO": "2025-06-03T18:30:00.000Z",
        "title": "BofA Securities India Limited Investor Conference",
        "icsUrl": "https://in.marketscreener.com/api/stateful/agenda/event-async/BofA-Securities-India-Limited-Investor-Conference-50151392.ics"
      },
      {
        "section": "Past",
        "dateTimeRaw": "02/05/2025 04:30 pm",
        "dateTimeISO": "2025-05-02T11:00:00.000Z",
        "title": "Q4 2025 Earnings Call",
        "icsUrl": "https://in.marketscreener.com/api/stateful/agenda/event-async/Q4-2025-Earnings-Call-49747901.ics"
      },
      {
        "section": "Past",
        "dateTimeRaw": "02/05/2025 12:41 pm",
        "dateTimeISO": "2025-05-02T07:11:00.000Z",
        "title": "Q4 2025 Earnings Release",
        "icsUrl": "https://in.marketscreener.com/api/stateful/agenda/event-async/Q4-2025-Earnings-Release-46511765.ics"
      },
      {
        "section": "Past",
        "dateTimeRaw": "04/02/2025 04:30 pm",
        "dateTimeISO": "2025-02-04T11:00:00.000Z",
        "title": "Q3 2025 Earnings Call",
        "icsUrl": "https://in.marketscreener.com/api/stateful/agenda/event-async/Q3-2025-Earnings-Call-48832531.ics"
      },
      {
        "section": "Past",
        "dateTimeRaw": "04/02/2025 01:19 pm",
        "dateTimeISO": "2025-02-04T07:49:00.000Z",
        "title": "Q3 2025 Earnings Release",
        "icsUrl": "https://in.marketscreener.com/api/stateful/agenda/event-async/Q3-2025-Earnings-Release-45773052.ics"
      },
      {
        "section": "Past",
        "dateTimeRaw": "23/10/2024 04:30 pm",
        "dateTimeISO": "2024-10-23T11:00:00.000Z",
        "title": "Q2 2025 Earnings Call",
        "icsUrl": "https://in.marketscreener.com/api/stateful/agenda/event-async/Q2-2025-Earnings-Call-48029519.ics"
      },
      {
        "section": "Past",
        "dateTimeRaw": "23/10/2024 12:29 pm",
        "dateTimeISO": "2024-10-23T06:59:00.000Z",
        "title": "Q2 2025 Earnings Release",
        "icsUrl": "https://in.marketscreener.com/api/stateful/agenda/event-async/Q2-2025-Earnings-Release-45088029.ics"
      },
      {
        "section": "Past",
        "dateTimeRaw": "17/10/2024",
        "dateTimeISO": "2024-10-16T18:30:00.000Z",
        "title": "Investor Meeting",
        "icsUrl": "https://in.marketscreener.com/api/stateful/agenda/event-async/Investor-Meeting-48039310.ics"
      },
      {
        "section": "Past",
        "dateTimeRaw": "16/10/2024",
        "dateTimeISO": "2024-10-15T18:30:00.000Z",
        "title": "Investor Meeting",
        "icsUrl": "https://in.marketscreener.com/api/stateful/agenda/event-async/Investor-Meeting-48039306.ics"
      },
      {
        "section": "Past",
        "dateTimeRaw": "15/10/2024",
        "dateTimeISO": "2024-10-14T18:30:00.000Z",
        "title": "Investor Meeting",
        "icsUrl": "https://in.marketscreener.com/api/stateful/agenda/event-async/Investor-Meeting-48039305.ics"
      },
      {
        "section": "Past",
        "dateTimeRaw": "14/10/2024",
        "dateTimeISO": "2024-10-13T18:30:00.000Z",
        "title": "Investor Meeting",
        "icsUrl": "https://in.marketscreener.com/api/stateful/agenda/event-async/Investor-Meeting-48039304.ics"
      },
      {
        "section": "Past",
        "dateTimeRaw": "10/10/2024",
        "dateTimeISO": "2024-10-09T18:30:00.000Z",
        "title": "Investor Meeting",
        "icsUrl": "https://in.marketscreener.com/api/stateful/agenda/event-async/Investor-Meeting-47999191.ics"
      },
      {
        "section": "Past",
        "dateTimeRaw": "09/10/2024",
        "dateTimeISO": "2024-10-08T18:30:00.000Z",
        "title": "Investor Meeting",
        "icsUrl": "https://in.marketscreener.com/api/stateful/agenda/event-async/Investor-Meeting-47999189.ics"
      },
      {
        "section": "Past",
        "dateTimeRaw": "08/10/2024",
        "dateTimeISO": "2024-10-07T18:30:00.000Z",
        "title": "Investor Meeting - Multiple Investors",
        "icsUrl": "https://in.marketscreener.com/api/stateful/agenda/event-async/Investor-Meeting-Multiple-Investors-47999186.ics"
      },
      {
        "section": "Past",
        "dateTimeRaw": "18/09/2024",
        "dateTimeISO": "2024-09-17T18:30:00.000Z",
        "title": "Jefferies India Forum",
        "icsUrl": "https://in.marketscreener.com/api/stateful/agenda/event-async/Jefferies-India-Forum-47836242.ics"
      },
      {
        "section": "Past",
        "dateTimeRaw": "03/09/2024",
        "dateTimeISO": "2024-09-02T18:30:00.000Z",
        "title": "Ashwamedh Elara India Dialogue Conference",
        "icsUrl": "https://in.marketscreener.com/api/stateful/agenda/event-async/Ashwamedh-Elara-India-Dialogue-Conference-47779120.ics"
      },
      {
        "section": "Past",
        "dateTimeRaw": "31/07/2024 04:30 pm",
        "dateTimeISO": "2024-07-31T11:00:00.000Z",
        "title": "Q1 2025 Earnings Call",
        "icsUrl": "https://in.marketscreener.com/api/stateful/agenda/event-async/Q1-2025-Earnings-Call-47409111.ics"
      },
      {
        "section": "Past",
        "dateTimeRaw": "31/07/2024 02:30 pm",
        "dateTimeISO": "2024-07-31T09:00:00.000Z",
        "title": "Annual General Meeting",
        "icsUrl": "https://in.marketscreener.com/api/stateful/agenda/event-async/Annual-General-Meeting-46629302.ics"
      },
      {
        "section": "Past",
        "dateTimeRaw": "31/07/2024 11:24 am",
        "dateTimeISO": "2024-07-31T05:54:00.000Z",
        "title": "Q1 2025 Earnings Release",
        "icsUrl": "https://in.marketscreener.com/api/stateful/agenda/event-async/Q1-2025-Earnings-Release-43772059.ics"
      },
      {
        "section": "Past",
        "dateTimeRaw": "03/05/2024 04:00 pm",
        "dateTimeISO": "2024-05-03T10:30:00.000Z",
        "title": "Q4 2024 Earnings Call",
        "icsUrl": "https://in.marketscreener.com/api/stateful/agenda/event-async/Q4-2024-Earnings-Call-46511652.ics"
      },
      {
        "section": "Past",
        "dateTimeRaw": "03/05/2024 12:49 pm",
        "dateTimeISO": "2024-05-03T07:19:00.000Z",
        "title": "Q4 2024 Earnings Release",
        "icsUrl": "https://in.marketscreener.com/api/stateful/agenda/event-async/Q4-2024-Earnings-Release-44354824.ics"
      },
      {
        "section": "Past",
        "dateTimeRaw": "09/04/2024 08:26 am",
        "dateTimeISO": "2024-04-09T02:56:00.000Z",
        "title": "Q4 2024 Sales and Revenue Release",
        "icsUrl": "https://in.marketscreener.com/api/stateful/agenda/event-async/Q4-2024-Sales-and-Revenue-Release-46401997.ics"
      },
      {
        "section": "Past",
        "dateTimeRaw": "15/02/2024",
        "dateTimeISO": "2024-02-14T18:30:00.000Z",
        "title": "IIFL Enterprising India Global Investors Conference",
        "icsUrl": "https://in.marketscreener.com/api/stateful/agenda/event-async/IIFL-Enterprising-India-Global-Investors-Conference-46185025.ics"
      },
      {
        "section": "Past",
        "dateTimeRaw": "14/02/2024",
        "dateTimeISO": "2024-02-13T18:30:00.000Z",
        "title": "Nuvama India Conference",
        "icsUrl": "https://in.marketscreener.com/api/stateful/agenda/event-async/Nuvama-India-Conference-46184970.ics"
      },
      {
        "section": "Past",
        "dateTimeRaw": "13/02/2024",
        "dateTimeISO": "2024-02-12T18:30:00.000Z",
        "title": "Axis Capital India Conference",
        "icsUrl": "https://in.marketscreener.com/api/stateful/agenda/event-async/Axis-Capital-India-Conference-46184929.ics"
      },
      {
        "section": "Past",
        "dateTimeRaw": "06/02/2024 04:00 pm",
        "dateTimeISO": "2024-02-06T10:30:00.000Z",
        "title": "Q3 2024 Earnings Call",
        "icsUrl": "https://in.marketscreener.com/api/stateful/agenda/event-async/Q3-2024-Earnings-Call-45772996.ics"
      },
      {
        "section": "Past",
        "dateTimeRaw": "06/02/2024 12:42 pm",
        "dateTimeISO": "2024-02-06T07:12:00.000Z",
        "title": "Q3 2024 Earnings Release",
        "icsUrl": "https://in.marketscreener.com/api/stateful/agenda/event-async/Q3-2024-Earnings-Release-42737023.ics"
      },
      {
        "section": "Past",
        "dateTimeRaw": "19/12/2023",
        "dateTimeISO": "2023-12-18T18:30:00.000Z",
        "title": "Motilal Oswal Financial Services Investor Conference",
        "icsUrl": "https://in.marketscreener.com/api/stateful/agenda/event-async/Motilal-Oswal-Financial-Services-Investor-Conference-45576356.ics"
      },
      {
        "section": "Past",
        "dateTimeRaw": "18/12/2023",
        "dateTimeISO": "2023-12-17T18:30:00.000Z",
        "title": "Motilal Oswal Financial Services Investor Conference",
        "icsUrl": "https://in.marketscreener.com/api/stateful/agenda/event-async/Motilal-Oswal-Financial-Services-Investor-Conference-45566849.ics"
      },
      {
        "section": "Past",
        "dateTimeRaw": "30/11/2023",
        "dateTimeISO": "2023-11-29T18:30:00.000Z",
        "title": "CITIC CLSA India Forum",
        "icsUrl": "https://in.marketscreener.com/api/stateful/agenda/event-async/CITIC-CLSA-India-Forum-45448167.ics"
      },
      {
        "section": "Past",
        "dateTimeRaw": "02/11/2023 04:00 pm",
        "dateTimeISO": "2023-11-02T10:30:00.000Z",
        "title": "Q2 2024 Earnings Call",
        "icsUrl": "https://in.marketscreener.com/api/stateful/agenda/event-async/Q2-2024-Earnings-Call-45077225.ics"
      },
      {
        "section": "Past",
        "dateTimeRaw": "02/11/2023 12:53 pm",
        "dateTimeISO": "2023-11-02T07:23:00.000Z",
        "title": "Q2 2024 Earnings Release",
        "icsUrl": "https://in.marketscreener.com/api/stateful/agenda/event-async/Q2-2024-Earnings-Release-42152361.ics"
      },
      {
        "section": "Past",
        "dateTimeRaw": "21/08/2023",
        "dateTimeISO": "2023-08-20T18:30:00.000Z",
        "title": "Motilal Oswal Global Investor Conference",
        "icsUrl": "https://in.marketscreener.com/api/stateful/agenda/event-async/Motilal-Oswal-Global-Investor-Conference-44646763.ics"
      },
      {
        "section": "Past",
        "dateTimeRaw": "02/08/2023 04:30 pm",
        "dateTimeISO": "2023-08-02T11:00:00.000Z",
        "title": "Q1 2024 Earnings Call",
        "icsUrl": "https://in.marketscreener.com/api/stateful/agenda/event-async/Q1-2024-Earnings-Call-44407620.ics"
      },
      {
        "section": "Past",
        "dateTimeRaw": "13/07/2023",
        "dateTimeISO": "2023-07-12T18:30:00.000Z",
        "title": "Investor Meeting",
        "icsUrl": "https://in.marketscreener.com/api/stateful/agenda/event-async/Investor-Meeting-44286534.ics"
      },
      {
        "section": "Past",
        "dateTimeRaw": "10/07/2023",
        "dateTimeISO": "2023-07-09T18:30:00.000Z",
        "title": "Investor Meeting",
        "icsUrl": "https://in.marketscreener.com/api/stateful/agenda/event-async/Investor-Meeting-44286529.ics"
      },
      {
        "section": "Past",
        "dateTimeRaw": "03/05/2023 04:00 pm",
        "dateTimeISO": "2023-05-03T10:30:00.000Z",
        "title": "Q4 2023 Earnings Call",
        "icsUrl": "https://in.marketscreener.com/api/stateful/agenda/event-async/Q4-2023-Earnings-Call-43846012.ics"
      },
      {
        "section": "Past",
        "dateTimeRaw": "03/05/2023 12:53 pm",
        "dateTimeISO": "2023-05-03T07:23:00.000Z",
        "title": "Q4 2023 Earnings Release",
        "icsUrl": "https://in.marketscreener.com/api/stateful/agenda/event-async/Q4-2023-Earnings-Release-40072811.ics"
      },
      {
        "section": "Past",
        "dateTimeRaw": "21/03/2023",
        "dateTimeISO": "2023-03-20T18:30:00.000Z",
        "title": "Investor Meeting - ICICI Prudential Asset Management",
        "icsUrl": "https://in.marketscreener.com/api/stateful/agenda/event-async/Investor-Meeting-ICICI-Prudential-Asset-Management-43845958.ics"
      },
      {
        "section": "Past",
        "dateTimeRaw": "15/02/2023",
        "dateTimeISO": "2023-02-14T18:30:00.000Z",
        "title": "Investor Meeting - Eastspring Investments Limited",
        "icsUrl": "https://in.marketscreener.com/api/stateful/agenda/event-async/Investor-Meeting-Eastspring-Investments-Limited-42966149.ics"
      },
      {
        "section": "Past",
        "dateTimeRaw": "13/02/2023",
        "dateTimeISO": "2023-02-12T18:30:00.000Z",
        "title": "Investor Meeting - Aubrey Capital Management",
        "icsUrl": "https://in.marketscreener.com/api/stateful/agenda/event-async/Investor-Meeting-Aubrey-Capital-Management-42966105.ics"
      },
      {
        "section": "Past",
        "dateTimeRaw": "07/02/2023",
        "dateTimeISO": "2023-02-06T18:30:00.000Z",
        "title": "Axis Capital India Conference",
        "icsUrl": "https://in.marketscreener.com/api/stateful/agenda/event-async/Axis-Capital-India-Conference-42966026.ics"
      },
      {
        "section": "Past",
        "dateTimeRaw": "02/02/2023 04:00 pm",
        "dateTimeISO": "2023-02-02T10:30:00.000Z",
        "title": "Q3 2023 Earnings Call",
        "icsUrl": "https://in.marketscreener.com/api/stateful/agenda/event-async/Q3-2023-Earnings-Call-42839974.ics"
      },
      {
        "section": "Past",
        "dateTimeRaw": "02/02/2023 12:56 pm",
        "dateTimeISO": "2023-02-02T07:26:00.000Z",
        "title": "Q3 2023 Earnings Release",
        "icsUrl": "https://in.marketscreener.com/api/stateful/agenda/event-async/Q3-2023-Earnings-Release-37559291.ics"
      },
      {
        "section": "Past",
        "dateTimeRaw": "09/11/2022 05:00 pm",
        "dateTimeISO": "2022-11-09T11:30:00.000Z",
        "title": "Interim 2023 Earnings Call",
        "icsUrl": "https://in.marketscreener.com/api/stateful/agenda/event-async/Interim-2023-Earnings-Call-42220009.ics"
      },
      {
        "section": "Past",
        "dateTimeRaw": "09/11/2022 12:19 pm",
        "dateTimeISO": "2022-11-09T06:49:00.000Z",
        "title": "Interim 2023 Earnings Release",
        "icsUrl": "https://in.marketscreener.com/api/stateful/agenda/event-async/Interim-2023-Earnings-Release-36700091.ics"
      },
      {
        "section": "Past",
        "dateTimeRaw": "02/08/2022 04:30 pm",
        "dateTimeISO": "2022-08-02T11:00:00.000Z",
        "title": "Q1 2023 Earnings Call",
        "icsUrl": "https://in.marketscreener.com/api/stateful/agenda/event-async/Q1-2023-Earnings-Call-41004845.ics"
      },
      {
        "section": "Past",
        "dateTimeRaw": "02/08/2022 02:30 pm",
        "dateTimeISO": "2022-08-02T09:00:00.000Z",
        "title": "Annual General Meeting",
        "icsUrl": "https://in.marketscreener.com/api/stateful/agenda/event-async/Annual-General-Meeting-40945377.ics"
      },
      {
        "section": "Past",
        "dateTimeRaw": "02/08/2022 12:49 pm",
        "dateTimeISO": "2022-08-02T07:19:00.000Z",
        "title": "Q1 2023 Earnings Release",
        "icsUrl": "https://in.marketscreener.com/api/stateful/agenda/event-async/Q1-2023-Earnings-Release-36032666.ics"
      },
      {
        "section": "Past",
        "dateTimeRaw": "21/06/2022",
        "dateTimeISO": "2022-06-20T18:30:00.000Z",
        "title": "Investor Meeting",
        "icsUrl": "https://in.marketscreener.com/api/stateful/agenda/event-async/Investor-Meeting-40761628.ics"
      },
      {
        "section": "Past",
        "dateTimeRaw": "08/06/2022",
        "dateTimeISO": "2022-06-07T18:30:00.000Z",
        "title": "Investor Meeting - Newton Investment Management",
        "icsUrl": "https://in.marketscreener.com/api/stateful/agenda/event-async/Investor-Meeting-Newton-Investment-Management-40701658.ics"
      },
      {
        "section": "Past",
        "dateTimeRaw": "08/06/2022",
        "dateTimeISO": "2022-06-07T18:30:00.000Z",
        "title": "Investor Meeting - BlackRock Asset Management",
        "icsUrl": "https://in.marketscreener.com/api/stateful/agenda/event-async/Investor-Meeting-BlackRock-Asset-Management-40701657.ics"
      },
      {
        "section": "Past",
        "dateTimeRaw": "08/06/2022",
        "dateTimeISO": "2022-06-07T18:30:00.000Z",
        "title": "Investor Meeting - Sands Capital Management",
        "icsUrl": "https://in.marketscreener.com/api/stateful/agenda/event-async/Investor-Meeting-Sands-Capital-Management-40701656.ics"
      },
      {
        "section": "Past",
        "dateTimeRaw": "20/05/2022",
        "dateTimeISO": "2022-05-19T18:30:00.000Z",
        "title": "Investor Meeting",
        "icsUrl": "https://in.marketscreener.com/api/stateful/agenda/event-async/Investor-Meeting-40507078.ics"
      },
      {
        "section": "Past",
        "dateTimeRaw": "03/05/2022 04:00 pm",
        "dateTimeISO": "2022-05-03T10:30:00.000Z",
        "title": "FY 2022 Earnings Call",
        "icsUrl": "https://in.marketscreener.com/api/stateful/agenda/event-async/FY-2022-Earnings-Call-40072300.ics"
      },
      {
        "section": "Past",
        "dateTimeRaw": "03/05/2022 12:25 pm",
        "dateTimeISO": "2022-05-03T06:55:00.000Z",
        "title": "FY 2022 Earnings Release",
        "icsUrl": "https://in.marketscreener.com/api/stateful/agenda/event-async/FY-2022-Earnings-Release-33059476.ics"
      },
      {
        "section": "Past",
        "dateTimeRaw": "24/03/2022",
        "dateTimeISO": "2022-03-23T18:30:00.000Z",
        "title": "SBI CAPS Investec Promoter Conference",
        "icsUrl": "https://in.marketscreener.com/api/stateful/agenda/event-async/SBI-CAPS-Investec-Promoter-Conference-39877311.ics"
      },
      {
        "section": "Past",
        "dateTimeRaw": "16/03/2022",
        "dateTimeISO": "2022-03-15T18:30:00.000Z",
        "title": "Investor Meeting",
        "icsUrl": "https://in.marketscreener.com/api/stateful/agenda/event-async/Investor-Meeting-39877212.ics"
      },
      {
        "section": "Past",
        "dateTimeRaw": "03/02/2022 04:00 pm",
        "dateTimeISO": "2022-02-03T10:30:00.000Z",
        "title": "Q3 2022 Earnings Call",
        "icsUrl": "https://in.marketscreener.com/api/stateful/agenda/event-async/Q3-2022-Earnings-Call-37558970.ics"
      },
      {
        "section": "Past",
        "dateTimeRaw": "03/02/2022 11:55 am",
        "dateTimeISO": "2022-02-03T06:25:00.000Z",
        "title": "Q3 2022 Earnings Release",
        "icsUrl": "https://in.marketscreener.com/api/stateful/agenda/event-async/Q3-2022-Earnings-Release-32319957.ics"
      },
      {
        "section": "Past",
        "dateTimeRaw": "02/11/2021 06:30 pm",
        "dateTimeISO": "2021-11-02T13:00:00.000Z",
        "title": "Interim 2022 Earnings Call",
        "icsUrl": "https://in.marketscreener.com/api/stateful/agenda/event-async/Interim-2022-Earnings-Call-36699894.ics"
      },
      {
        "section": "Past",
        "dateTimeRaw": "02/11/2021 10:58 am",
        "dateTimeISO": "2021-11-02T05:28:00.000Z",
        "title": "Interim 2022 Earnings Release",
        "icsUrl": "https://in.marketscreener.com/api/stateful/agenda/event-async/Interim-2022-Earnings-Release-31560812.ics"
      },
      {
        "section": "Past",
        "dateTimeRaw": "03/08/2021 04:00 pm",
        "dateTimeISO": "2021-08-03T10:30:00.000Z",
        "title": "Q1 2022 Earnings Call",
        "icsUrl": "https://in.marketscreener.com/api/stateful/agenda/event-async/Q1-2022-Earnings-Call-36032301.ics"
      },
      {
        "section": "Past",
        "dateTimeRaw": "03/08/2021 02:30 pm",
        "dateTimeISO": "2021-08-03T09:00:00.000Z",
        "title": "Annual General Meeting",
        "icsUrl": "https://in.marketscreener.com/api/stateful/agenda/event-async/Annual-General-Meeting-36104763.ics"
      },
      {
        "section": "Past",
        "dateTimeRaw": "03/08/2021 01:56 pm",
        "dateTimeISO": "2021-08-03T08:26:00.000Z",
        "title": "Q1 2022 Earnings Release",
        "icsUrl": "https://in.marketscreener.com/api/stateful/agenda/event-async/Q1-2022-Earnings-Release-30575660.ics"
      },
      {
        "section": "Past",
        "dateTimeRaw": "04/05/2021 04:00 pm",
        "dateTimeISO": "2021-05-04T10:30:00.000Z",
        "title": "FY 2021 Earnings Call",
        "icsUrl": "https://in.marketscreener.com/api/stateful/agenda/event-async/FY-2021-Earnings-Call-33058796.ics"
      },
      {
        "section": "Past",
        "dateTimeRaw": "03/05/2021",
        "dateTimeISO": "2021-05-02T18:30:00.000Z",
        "title": "FY 2021 Earnings Release",
        "icsUrl": "https://in.marketscreener.com/api/stateful/agenda/event-async/FY-2021-Earnings-Release-30949212.ics"
      },
      {
        "section": "Past",
        "dateTimeRaw": "04/02/2021 05:00 pm",
        "dateTimeISO": "2021-02-04T11:30:00.000Z",
        "title": "Q3 2021 Earnings Call",
        "icsUrl": "https://in.marketscreener.com/api/stateful/agenda/event-async/Q3-2021-Earnings-Call-32319739.ics"
      },
      {
        "section": "Past",
        "dateTimeRaw": "04/02/2021",
        "dateTimeISO": "2021-02-03T18:30:00.000Z",
        "title": "Q3 2021 Earnings Release",
        "icsUrl": "https://in.marketscreener.com/api/stateful/agenda/event-async/Q3-2021-Earnings-Release-30575587.ics"
      },
      {
        "section": "Past",
        "dateTimeRaw": "03/11/2020 04:00 pm",
        "dateTimeISO": "2020-11-03T10:30:00.000Z",
        "title": "Interim 2021 Earnings Call",
        "icsUrl": "https://in.marketscreener.com/api/stateful/agenda/event-async/Interim-2021-Earnings-Call-31560639.ics"
      },
      {
        "section": "Past",
        "dateTimeRaw": "03/11/2020",
        "dateTimeISO": "2020-11-02T18:30:00.000Z",
        "title": "Interim 2021 Earnings Release",
        "icsUrl": "https://in.marketscreener.com/api/stateful/agenda/event-async/Interim-2021-Earnings-Release-29427324.ics"
      },
      {
        "section": "Past",
        "dateTimeRaw": "05/08/2020 04:30 pm",
        "dateTimeISO": "2020-08-05T11:00:00.000Z",
        "title": "Q1 2021 Earnings Call",
        "icsUrl": "https://in.marketscreener.com/api/stateful/agenda/event-async/Q1-2021-Earnings-Call-30990364.ics"
      },
      {
        "section": "Past",
        "dateTimeRaw": "05/08/2020",
        "dateTimeISO": "2020-08-04T18:30:00.000Z",
        "title": "Q1 2021 Earnings Release",
        "icsUrl": "https://in.marketscreener.com/api/stateful/agenda/event-async/Q1-2021-Earnings-Release-28970837.ics"
      },
      {
        "section": "Past",
        "dateTimeRaw": "12/05/2020",
        "dateTimeISO": "2020-05-11T18:30:00.000Z",
        "title": "FY 2020 Earnings Release",
        "icsUrl": "https://in.marketscreener.com/api/stateful/agenda/event-async/FY-2020-Earnings-Release-30662786.ics"
      },
      {
        "section": "Past",
        "dateTimeRaw": "11/05/2020 05:00 pm",
        "dateTimeISO": "2020-05-11T11:30:00.000Z",
        "title": "FY 2020 Earnings Call",
        "icsUrl": "https://in.marketscreener.com/api/stateful/agenda/event-async/FY-2020-Earnings-Call-30575478.ics"
      },
      {
        "section": "Past",
        "dateTimeRaw": "11/05/2020",
        "dateTimeISO": "2020-05-10T18:30:00.000Z",
        "title": "FY 2020 Earnings Release",
        "icsUrl": "https://in.marketscreener.com/api/stateful/agenda/event-async/FY-2020-Earnings-Release-30575476.ics"
      },
      {
        "section": "Past",
        "dateTimeRaw": "04/02/2020 03:00 pm",
        "dateTimeISO": "2020-02-04T09:30:00.000Z",
        "title": "Q3 2020 Earnings Call",
        "icsUrl": "https://in.marketscreener.com/api/stateful/agenda/event-async/Q3-2020-Earnings-Call-29889847.ics"
      },
      {
        "section": "Past",
        "dateTimeRaw": "03/02/2020",
        "dateTimeISO": "2020-02-02T18:30:00.000Z",
        "title": "Q3 2020 Earnings Release",
        "icsUrl": "https://in.marketscreener.com/api/stateful/agenda/event-async/Q3-2020-Earnings-Release-27922097.ics"
      },
      {
        "section": "Past",
        "dateTimeRaw": "05/11/2019 04:00 pm",
        "dateTimeISO": "2019-11-05T10:30:00.000Z",
        "title": "Interim 2020 Earnings Call",
        "icsUrl": "https://in.marketscreener.com/api/stateful/agenda/event-async/Interim-2020-Earnings-Call-29425405.ics"
      },
      {
        "section": "Past",
        "dateTimeRaw": "05/11/2019",
        "dateTimeISO": "2019-11-04T18:30:00.000Z",
        "title": "Interim 2020 Earnings Release",
        "icsUrl": "https://in.marketscreener.com/api/stateful/agenda/event-async/Interim-2020-Earnings-Release-27922014.ics"
      },
      {
        "section": "Past",
        "dateTimeRaw": "08/08/2019 04:30 pm",
        "dateTimeISO": "2019-08-08T11:00:00.000Z",
        "title": "Q1 2020 Earnings Call",
        "icsUrl": "https://in.marketscreener.com/api/stateful/agenda/event-async/Q1-2020-Earnings-Call-29007531.ics"
      },
      {
        "section": "Past",
        "dateTimeRaw": "08/08/2019",
        "dateTimeISO": "2019-08-07T18:30:00.000Z",
        "title": "Q1 2020 Earnings Release",
        "icsUrl": "https://in.marketscreener.com/api/stateful/agenda/event-async/Q1-2020-Earnings-Release-27921866.ics"
      },
      {
        "section": "Past",
        "dateTimeRaw": "30/04/2019 05:00 pm",
        "dateTimeISO": "2019-04-30T11:30:00.000Z",
        "title": "FY 2019 Earnings Call",
        "icsUrl": "https://in.marketscreener.com/api/stateful/agenda/event-async/FY-2019-Earnings-Call-28535672.ics"
      },
      {
        "section": "Past",
        "dateTimeRaw": "30/04/2019",
        "dateTimeISO": "2019-04-29T18:30:00.000Z",
        "title": "FY 2019 Earnings Release",
        "icsUrl": "https://in.marketscreener.com/api/stateful/agenda/event-async/FY-2019-Earnings-Release-27921692.ics"
      },
      {
        "section": "Past",
        "dateTimeRaw": "28/01/2019 04:30 pm",
        "dateTimeISO": "2019-01-28T11:00:00.000Z",
        "title": "Q3 2019 Earnings Call",
        "icsUrl": "https://in.marketscreener.com/api/stateful/agenda/event-async/Q3-2019-Earnings-Call-27952524.ics"
      },
      {
        "section": "Past",
        "dateTimeRaw": "28/01/2019",
        "dateTimeISO": "2019-01-27T18:30:00.000Z",
        "title": "Q3 2019 Earnings Release",
        "icsUrl": "https://in.marketscreener.com/api/stateful/agenda/event-async/Q3-2019-Earnings-Release-27857827.ics"
      },
      {
        "section": "Past",
        "dateTimeRaw": "02/11/2018 04:30 pm",
        "dateTimeISO": "2018-11-02T11:00:00.000Z",
        "title": "Interim 2019 Earnings Call",
        "icsUrl": "https://in.marketscreener.com/api/stateful/agenda/event-async/Interim-2019-Earnings-Call-27496324.ics"
      },
      {
        "section": "Past",
        "dateTimeRaw": "02/11/2018",
        "dateTimeISO": "2018-11-01T18:30:00.000Z",
        "title": "Interim 2019 Earnings Release",
        "icsUrl": "https://in.marketscreener.com/api/stateful/agenda/event-async/Interim-2019-Earnings-Release-25441970.ics"
      },
      {
        "section": "Past",
        "dateTimeRaw": "03/08/2018 12:00 pm",
        "dateTimeISO": "2018-08-03T06:30:00.000Z",
        "title": "Q1 2019 Earnings Call",
        "icsUrl": "https://in.marketscreener.com/api/stateful/agenda/event-async/Q1-2019-Earnings-Call-27013415.ics"
      },
      {
        "section": "Past",
        "dateTimeRaw": "02/08/2018",
        "dateTimeISO": "2018-08-01T18:30:00.000Z",
        "title": "Q1 2019 Earnings Release",
        "icsUrl": "https://in.marketscreener.com/api/stateful/agenda/event-async/Q1-2019-Earnings-Release-25441035.ics"
      },
      {
        "section": "Past",
        "dateTimeRaw": "04/05/2018 04:30 pm",
        "dateTimeISO": "2018-05-04T11:00:00.000Z",
        "title": "FY 2018 Earnings Call",
        "icsUrl": "https://in.marketscreener.com/api/stateful/agenda/event-async/FY-2018-Earnings-Call-26520858.ics"
      },
      {
        "section": "Past",
        "dateTimeRaw": "04/05/2018",
        "dateTimeISO": "2018-05-03T18:30:00.000Z",
        "title": "FY 2018 Earnings Release",
        "icsUrl": "https://in.marketscreener.com/api/stateful/agenda/event-async/FY-2018-Earnings-Release-25440159.ics"
      },
      {
        "section": "Past",
        "dateTimeRaw": "02/02/2018 04:30 pm",
        "dateTimeISO": "2018-02-02T11:00:00.000Z",
        "title": "Q3 2018 Earnings Call",
        "icsUrl": "https://in.marketscreener.com/api/stateful/agenda/event-async/Q3-2018-Earnings-Call-25881331.ics"
      },
      {
        "section": "Past",
        "dateTimeRaw": "02/02/2018",
        "dateTimeISO": "2018-02-01T18:30:00.000Z",
        "title": "Q3 2018 Earnings Release",
        "icsUrl": "https://in.marketscreener.com/api/stateful/agenda/event-async/Q3-2018-Earnings-Release-25439444.ics"
      },
      {
        "section": "Past",
        "dateTimeRaw": "03/11/2017 04:30 pm",
        "dateTimeISO": "2017-11-03T11:00:00.000Z",
        "title": "Interim 2018 Earnings Call",
        "icsUrl": "https://in.marketscreener.com/api/stateful/agenda/event-async/Interim-2018-Earnings-Call-25384218.ics"
      },
      {
        "section": "Past",
        "dateTimeRaw": "03/11/2017",
        "dateTimeISO": "2017-11-02T18:30:00.000Z",
        "title": "Interim 2018 Earnings Release",
        "icsUrl": "https://in.marketscreener.com/api/stateful/agenda/event-async/Interim-2018-Earnings-Release-25329311.ics"
      },
      {
        "section": "Past",
        "dateTimeRaw": "03/08/2017 03:30 pm",
        "dateTimeISO": "2017-08-03T10:00:00.000Z",
        "title": "Q1 2018 Earnings Call",
        "icsUrl": "https://in.marketscreener.com/api/stateful/agenda/event-async/Q1-2018-Earnings-Call-24846620.ics"
      },
      {
        "section": "Past",
        "dateTimeRaw": "02/08/2017",
        "dateTimeISO": "2017-08-01T18:30:00.000Z",
        "title": "Q1 2018 Earnings Release",
        "icsUrl": "https://in.marketscreener.com/api/stateful/agenda/event-async/Q1-2018-Earnings-Release-22851445.ics"
      },
      {
        "section": "Past",
        "dateTimeRaw": "04/05/2017 04:00 pm",
        "dateTimeISO": "2017-05-04T10:30:00.000Z",
        "title": "FY 2017 Earnings Call",
        "icsUrl": "https://in.marketscreener.com/api/stateful/agenda/event-async/FY-2017-Earnings-Call-24401094.ics"
      },
      {
        "section": "Past",
        "dateTimeRaw": "04/05/2017",
        "dateTimeISO": "2017-05-03T18:30:00.000Z",
        "title": "FY 2017 Earnings Release",
        "icsUrl": "https://in.marketscreener.com/api/stateful/agenda/event-async/FY-2017-Earnings-Release-22843636.ics"
      },
      {
        "section": "Past",
        "dateTimeRaw": "03/02/2017 03:30 pm",
        "dateTimeISO": "2017-02-03T10:00:00.000Z",
        "title": "Q3 2017 Earnings Call",
        "icsUrl": "https://in.marketscreener.com/api/stateful/agenda/event-async/Q3-2017-Earnings-Call-23770967.ics"
      },
      {
        "section": "Past",
        "dateTimeRaw": "02/02/2017",
        "dateTimeISO": "2017-02-01T18:30:00.000Z",
        "title": "Q3 2017 Earnings Release",
        "icsUrl": "https://in.marketscreener.com/api/stateful/agenda/event-async/Q3-2017-Earnings-Release-22830699.ics"
      },
      {
        "section": "Past",
        "dateTimeRaw": "10/11/2016 03:30 pm",
        "dateTimeISO": "2016-11-10T10:00:00.000Z",
        "title": "Interim 2017 Earnings Call",
        "icsUrl": "https://in.marketscreener.com/api/stateful/agenda/event-async/Interim-2017-Earnings-Call-23345992.ics"
      },
      {
        "section": "Past",
        "dateTimeRaw": "09/11/2016",
        "dateTimeISO": "2016-11-08T18:30:00.000Z",
        "title": "Interim 2017 Earnings Release",
        "icsUrl": "https://in.marketscreener.com/api/stateful/agenda/event-async/Interim-2017-Earnings-Release-19673027.ics"
      },
      {
        "section": "Past",
        "dateTimeRaw": "10/08/2016 03:30 pm",
        "dateTimeISO": "2016-08-10T10:00:00.000Z",
        "title": "Q1 2017 Earnings Call",
        "icsUrl": "https://in.marketscreener.com/api/stateful/agenda/event-async/Q1-2017-Earnings-Call-22861996.ics"
      },
      {
        "section": "Past",
        "dateTimeRaw": "09/08/2016",
        "dateTimeISO": "2016-08-08T18:30:00.000Z",
        "title": "Q1 2017 Earnings Release",
        "icsUrl": "https://in.marketscreener.com/api/stateful/agenda/event-async/Q1-2017-Earnings-Release-19663407.ics"
      },
      {
        "section": "Past",
        "dateTimeRaw": "06/05/2016 03:30 pm",
        "dateTimeISO": "2016-05-06T10:00:00.000Z",
        "title": "FY 2016 Earnings Call",
        "icsUrl": "https://in.marketscreener.com/api/stateful/agenda/event-async/FY-2016-Earnings-Call-22315169.ics"
      },
      {
        "section": "Past",
        "dateTimeRaw": "05/05/2016",
        "dateTimeISO": "2016-05-04T18:30:00.000Z",
        "title": "FY 2016 Earnings Release",
        "icsUrl": "https://in.marketscreener.com/api/stateful/agenda/event-async/FY-2016-Earnings-Release-19659107.ics"
      },
      {
        "section": "Past",
        "dateTimeRaw": "22/02/2016",
        "dateTimeISO": "2016-02-21T18:30:00.000Z",
        "title": "Kotak Institutional Equities Chasing Growth Conference",
        "icsUrl": "https://in.marketscreener.com/api/stateful/agenda/event-async/Kotak-Institutional-Equities-Chasing-Growth-Conference-21925350.ics"
      },
      {
        "section": "Past",
        "dateTimeRaw": "03/02/2016 03:30 pm",
        "dateTimeISO": "2016-02-03T10:00:00.000Z",
        "title": "Q3 2016 Earnings Call",
        "icsUrl": "https://in.marketscreener.com/api/stateful/agenda/event-async/Q3-2016-Earnings-Call-21811745.ics"
      },
      {
        "section": "Past",
        "dateTimeRaw": "02/02/2016",
        "dateTimeISO": "2016-02-01T18:30:00.000Z",
        "title": "Q3 2016 Earnings Release",
        "icsUrl": "https://in.marketscreener.com/api/stateful/agenda/event-async/Q3-2016-Earnings-Release-19648241.ics"
      },
      {
        "section": "Past",
        "dateTimeRaw": "04/11/2015",
        "dateTimeISO": "2015-11-03T18:30:00.000Z",
        "title": "Interim 2016 Earnings Release",
        "icsUrl": "https://in.marketscreener.com/api/stateful/agenda/event-async/Interim-2016-Earnings-Release-19179079.ics"
      },
      {
        "section": "Past",
        "dateTimeRaw": "04/08/2015",
        "dateTimeISO": "2015-08-03T18:30:00.000Z",
        "title": "Q1 2016 Earnings Release",
        "icsUrl": "https://in.marketscreener.com/api/stateful/agenda/event-async/Q1-2016-Earnings-Release-18722064.ics"
      },
      {
        "section": "Past",
        "dateTimeRaw": "18/05/2015",
        "dateTimeISO": "2015-05-17T18:30:00.000Z",
        "title": "FY 2015 Earnings Release (Projected)",
        "icsUrl": "https://in.marketscreener.com/api/stateful/agenda/event-async/FY-2015-Earnings-Release-Projected-18258646.ics"
      },
      {
        "section": "Past",
        "dateTimeRaw": "28/01/2015 03:30 pm",
        "dateTimeISO": "2015-01-28T10:00:00.000Z",
        "title": "Q3 2015 Earnings Call",
        "icsUrl": "https://in.marketscreener.com/api/stateful/agenda/event-async/Q3-2015-Earnings-Call-19793974.ics"
      },
      {
        "section": "Past",
        "dateTimeRaw": "27/01/2015",
        "dateTimeISO": "2015-01-26T18:30:00.000Z",
        "title": "Q3 2015 Earnings Release",
        "icsUrl": "https://in.marketscreener.com/api/stateful/agenda/event-async/Q3-2015-Earnings-Release-17787090.ics"
      }
    ]
  },
  "pastDividends": {
    "count": 6,
    "dividends": [
      {
        "section": "Past Dividends",
        "dateRaw": "27/07/2015",
        "dateISO": "2015-07-26T18:30:00.000Z",
        "type": "Annual",
        "amount": 2,
        "currency": "INR",
        "title": "Annual 2 INR"
      },
      {
        "section": "Past Dividends",
        "dateRaw": "28/07/2014",
        "dateISO": "2014-07-27T18:30:00.000Z",
        "type": "Annual",
        "amount": 2,
        "currency": "INR",
        "title": "Annual 2 INR"
      },
      {
        "section": "Past Dividends",
        "dateRaw": "02/07/2013",
        "dateISO": "2013-07-01T18:30:00.000Z",
        "type": "Annual",
        "amount": 4,
        "currency": "INR",
        "title": "Annual 4 INR"
      },
      {
        "section": "Past Dividends",
        "dateRaw": "19/07/2012",
        "dateISO": "2012-07-18T18:30:00.000Z",
        "type": "Annual",
        "amount": 3,
        "currency": "INR",
        "title": "Annual 3 INR"
      },
      {
        "section": "Past Dividends",
        "dateRaw": "14/07/2011",
        "dateISO": "2011-07-13T18:30:00.000Z",
        "type": "Annual",
        "amount": 4.5,
        "currency": "INR",
        "title": "Annual 4.5 INR"
      },
      {
        "section": "Past Dividends",
        "dateRaw": "08/07/2010",
        "dateISO": "2010-07-07T18:30:00.000Z",
        "type": "Annual",
        "amount": 4,
        "currency": "INR",
        "title": "Annual 4 INR"
      }
    ]
  }
}