{
  "companyCode": "JINDAL-STEEL-POWER-LIMITE-9059230",
  "timestamp": "2025-10-13T12:18:29.073Z",
  "annualResults": {
    "2023": {
      "Net salesMillion INR": {
        "metric": "Net salesMillion INR",
        "unit": "Million INR",
        "fiscalMonth": "March",
        "year": "2023",
        "released": "527 112",
        "forecast": "530 630",
        "spreadRaw": "-0.66%"
      },
      "EBITDAMillion INR": {
        "metric": "EBITDAMillion INR",
        "unit": "Million INR",
        "fiscalMonth": "March",
        "year": "2023",
        "released": "99 347",
        "forecast": "100 967",
        "spreadRaw": "-1.6%"
      },
      "EBITMillion INR": {
        "metric": "EBITMillion INR",
        "unit": "Million INR",
        "fiscalMonth": "March",
        "year": "2023",
        "released": "72 438",
        "forecast": "75 540",
        "spreadRaw": "-4.11%"
      },
      "Earnings before Tax (EBT)Million INR": {
        "metric": "Earnings before Tax (EBT)Million INR",
        "unit": "Million INR",
        "fiscalMonth": "March",
        "year": "2023",
        "released": "44 855",
        "forecast": "62 135",
        "spreadRaw": "-27.81%"
      },
      "Net incomeMillion INR": {
        "metric": "Net incomeMillion INR",
        "unit": "Million INR",
        "fiscalMonth": "March",
        "year": "2023",
        "released": "82 550",
        "forecast": "44 429",
        "spreadRaw": "85.8%"
      },
      "EPS INR": {
        "metric": "EPS INR",
        "unit": "INR",
        "fiscalMonth": "March",
        "year": "2023",
        "released": "39,1",
        "forecast": "43,5",
        "spreadRaw": "-10.18%"
      },
      "Announcement Date": {
        "metric": "Announcement Date",
        "unit": null,
        "fiscalMonth": "March",
        "year": "2023",
        "released": "16/05/23",
        "forecast": null,
        "spreadRaw": null
      }
    },
    "2024": {
      "Net salesMillion INR": {
        "metric": "Net salesMillion INR",
        "unit": "Million INR",
        "fiscalMonth": "March",
        "year": "2024",
        "released": "500 268",
        "forecast": "497 646",
        "spreadRaw": "0.53%"
      },
      "EBITDAMillion INR": {
        "metric": "EBITDAMillion INR",
        "unit": "Million INR",
        "fiscalMonth": "March",
        "year": "2024",
        "released": "102 007",
        "forecast": "104 672",
        "spreadRaw": "-2.55%"
      },
      "EBITMillion INR": {
        "metric": "EBITMillion INR",
        "unit": "Million INR",
        "fiscalMonth": "March",
        "year": "2024",
        "released": "73 789",
        "forecast": "78 700",
        "spreadRaw": "-6.24%"
      },
      "Earnings before Tax (EBT)Million INR": {
        "metric": "Earnings before Tax (EBT)Million INR",
        "unit": "Million INR",
        "fiscalMonth": "March",
        "year": "2024",
        "released": "62 413",
        "forecast": "67 253",
        "spreadRaw": "-7.2%"
      },
      "Net incomeMillion INR": {
        "metric": "Net incomeMillion INR",
        "unit": "Million INR",
        "fiscalMonth": "March",
        "year": "2024",
        "released": "59 384",
        "forecast": "55 853",
        "spreadRaw": "6.32%"
      },
      "EPS INR": {
        "metric": "EPS INR",
        "unit": "INR",
        "fiscalMonth": "March",
        "year": "2024",
        "released": "59,2",
        "forecast": "54,5",
        "spreadRaw": "8.47%"
      },
      "Announcement Date": {
        "metric": "Announcement Date",
        "unit": null,
        "fiscalMonth": "March",
        "year": "2024",
        "released": "13/05/24",
        "forecast": null,
        "spreadRaw": null
      }
    },
    "2025": {
      "Net salesMillion INR": {
        "metric": "Net salesMillion INR",
        "unit": "Million INR",
        "fiscalMonth": "March",
        "year": "2025",
        "released": "497 650",
        "forecast": "494 346",
        "spreadRaw": "0.67%"
      },
      "EBITDAMillion INR": {
        "metric": "EBITDAMillion INR",
        "unit": "Million INR",
        "fiscalMonth": "March",
        "year": "2025",
        "released": "94 942",
        "forecast": "97 787",
        "spreadRaw": "-2.91%"
      },
      "EBITMillion INR": {
        "metric": "EBITMillion INR",
        "unit": "Million INR",
        "fiscalMonth": "March",
        "year": "2025",
        "released": "67 266",
        "forecast": "69 899",
        "spreadRaw": "-3.77%"
      },
      "Earnings before Tax (EBT)Million INR": {
        "metric": "Earnings before Tax (EBT)Million INR",
        "unit": "Million INR",
        "fiscalMonth": "March",
        "year": "2025",
        "released": "43 436",
        "forecast": "57 665",
        "spreadRaw": "-24.68%"
      },
      "Net incomeMillion INR": {
        "metric": "Net incomeMillion INR",
        "unit": "Million INR",
        "fiscalMonth": "March",
        "year": "2025",
        "released": "28 121",
        "forecast": "42 636",
        "spreadRaw": "-34.04%"
      },
      "EPS INR": {
        "metric": "EPS INR",
        "unit": "INR",
        "fiscalMonth": "March",
        "year": "2025",
        "released": "27,8",
        "forecast": "42,2",
        "spreadRaw": "-34.01%"
      },
      "Announcement Date": {
        "metric": "Announcement Date",
        "unit": null,
        "fiscalMonth": "March",
        "year": "2025",
        "released": "30/04/25",
        "forecast": null,
        "spreadRaw": null
      }
    },
    "2026": {
      "Net salesMillion INR": {
        "metric": "Net salesMillion INR",
        "unit": "Million INR",
        "fiscalMonth": "March",
        "year": "2026",
        "released": null,
        "forecast": "568 795",
        "spreadRaw": null
      },
      "EBITDAMillion INR": {
        "metric": "EBITDAMillion INR",
        "unit": "Million INR",
        "fiscalMonth": "March",
        "year": "2026",
        "released": null,
        "forecast": "126 150",
        "spreadRaw": null
      },
      "EBITMillion INR": {
        "metric": "EBITMillion INR",
        "unit": "Million INR",
        "fiscalMonth": "March",
        "year": "2026",
        "released": null,
        "forecast": "96 611",
        "spreadRaw": null
      },
      "Earnings before Tax (EBT)Million INR": {
        "metric": "Earnings before Tax (EBT)Million INR",
        "unit": "Million INR",
        "fiscalMonth": "March",
        "year": "2026",
        "released": null,
        "forecast": "85 081",
        "spreadRaw": null
      },
      "Net incomeMillion INR": {
        "metric": "Net incomeMillion INR",
        "unit": "Million INR",
        "fiscalMonth": "March",
        "year": "2026",
        "released": null,
        "forecast": "62 873",
        "spreadRaw": null
      },
      "EPS INR": {
        "metric": "EPS INR",
        "unit": "INR",
        "fiscalMonth": "March",
        "year": "2026",
        "released": null,
        "forecast": "61,7",
        "spreadRaw": null
      },
      "Announcement Date": {
        "metric": "Announcement Date",
        "unit": null,
        "fiscalMonth": "March",
        "year": "2026",
        "released": "-",
        "forecast": null,
        "spreadRaw": null
      }
    },
    "2027": {
      "Net salesMillion INR": {
        "metric": "Net salesMillion INR",
        "unit": "Million INR",
        "fiscalMonth": "March",
        "year": "2027",
        "released": null,
        "forecast": "705 558",
        "spreadRaw": null
      },
      "EBITDAMillion INR": {
        "metric": "EBITDAMillion INR",
        "unit": "Million INR",
        "fiscalMonth": "March",
        "year": "2027",
        "released": null,
        "forecast": "167 295",
        "spreadRaw": null
      },
      "EBITMillion INR": {
        "metric": "EBITMillion INR",
        "unit": "Million INR",
        "fiscalMonth": "March",
        "year": "2027",
        "released": null,
        "forecast": "128 311",
        "spreadRaw": null
      },
      "Earnings before Tax (EBT)Million INR": {
        "metric": "Earnings before Tax (EBT)Million INR",
        "unit": "Million INR",
        "fiscalMonth": "March",
        "year": "2027",
        "released": null,
        "forecast": "124 175",
        "spreadRaw": null
      },
      "Net incomeMillion INR": {
        "metric": "Net incomeMillion INR",
        "unit": "Million INR",
        "fiscalMonth": "March",
        "year": "2027",
        "released": null,
        "forecast": "91 941",
        "spreadRaw": null
      },
      "EPS INR": {
        "metric": "EPS INR",
        "unit": "INR",
        "fiscalMonth": "March",
        "year": "2027",
        "released": null,
        "forecast": "90,9",
        "spreadRaw": null
      },
      "Announcement Date": {
        "metric": "Announcement Date",
        "unit": null,
        "fiscalMonth": "March",
        "year": "2027",
        "released": null,
        "forecast": null,
        "spreadRaw": null
      }
    },
    "2028": {
      "Net salesMillion INR": {
        "metric": "Net salesMillion INR",
        "unit": "Million INR",
        "fiscalMonth": "March",
        "year": "2028",
        "released": null,
        "forecast": "785 011",
        "spreadRaw": null
      },
      "EBITDAMillion INR": {
        "metric": "EBITDAMillion INR",
        "unit": "Million INR",
        "fiscalMonth": "March",
        "year": "2028",
        "released": null,
        "forecast": "186 794",
        "spreadRaw": null
      },
      "EBITMillion INR": {
        "metric": "EBITMillion INR",
        "unit": "Million INR",
        "fiscalMonth": "March",
        "year": "2028",
        "released": null,
        "forecast": "144 222",
        "spreadRaw": null
      },
      "Earnings before Tax (EBT)Million INR": {
        "metric": "Earnings before Tax (EBT)Million INR",
        "unit": "Million INR",
        "fiscalMonth": "March",
        "year": "2028",
        "released": null,
        "forecast": "145 314",
        "spreadRaw": null
      },
      "Net incomeMillion INR": {
        "metric": "Net incomeMillion INR",
        "unit": "Million INR",
        "fiscalMonth": "March",
        "year": "2028",
        "released": null,
        "forecast": "108 066",
        "spreadRaw": null
      },
      "EPS INR": {
        "metric": "EPS INR",
        "unit": "INR",
        "fiscalMonth": "March",
        "year": "2028",
        "released": null,
        "forecast": "106",
        "spreadRaw": null
      },
      "Announcement Date": {
        "metric": "Announcement Date",
        "unit": null,
        "fiscalMonth": "March",
        "year": "2028",
        "released": null,
        "forecast": null,
        "spreadRaw": null
      }
    }
  },
  "quarterlyResults": {
    "2024 Q2": {
      "Net salesMillion INR": {
        "metric": "Net salesMillion INR",
        "unit": "Million INR",
        "fiscalMonth": "March",
        "period": "2024 Q2",
        "released": "122 502",
        "releasedNum": 122502,
        "forecast": "124 491",
        "forecastNum": 124491,
        "spreadRaw": "-1.6%",
        "spreadPct": -1.6
      },
      "EBITDAMillion INR": {
        "metric": "EBITDAMillion INR",
        "unit": "Million INR",
        "fiscalMonth": "March",
        "period": "2024 Q2",
        "released": "22 857",
        "releasedNum": 22857,
        "forecast": "24 120",
        "forecastNum": 24120,
        "spreadRaw": "-5.24%",
        "spreadPct": -5.24
      },
      "EBITMillion INR": {
        "metric": "EBITMillion INR",
        "unit": "Million INR",
        "fiscalMonth": "March",
        "period": "2024 Q2",
        "released": "16 820",
        "releasedNum": 16820,
        "forecast": "18 463",
        "forecastNum": 18463,
        "spreadRaw": "-8.9%",
        "spreadPct": -8.9
      },
      "Earnings before Tax (EBT)Million INR": {
        "metric": "Earnings before Tax (EBT)Million INR",
        "unit": "Million INR",
        "fiscalMonth": "March",
        "period": "2024 Q2",
        "released": "13 843",
        "releasedNum": 13843,
        "forecast": "13 748",
        "forecastNum": 13748,
        "spreadRaw": "0.69%",
        "spreadPct": 0.69
      },
      "Net incomeMillion INR": {
        "metric": "Net incomeMillion INR",
        "unit": "Million INR",
        "fiscalMonth": "March",
        "period": "2024 Q2",
        "released": "13 878",
        "releasedNum": 13878,
        "forecast": "10 223",
        "forecastNum": 10223,
        "spreadRaw": "35.75%",
        "spreadPct": 35.75
      },
      "EPS INR": {
        "metric": "EPS INR",
        "unit": "INR",
        "fiscalMonth": "March",
        "period": "2024 Q2",
        "released": "13,8",
        "releasedNum": 13.8,
        "forecast": null,
        "forecastNum": null,
        "spreadRaw": null,
        "spreadPct": null
      },
      "Announcement Date": {
        "metric": "Announcement Date",
        "unit": null,
        "fiscalMonth": "March",
        "period": "2024 Q2",
        "released": "31/10/23",
        "releasedDate": "31/10/23",
        "forecast": null,
        "spreadRaw": null,
        "spreadPct": null
      }
    },
    "2024 Q3": {
      "Net salesMillion INR": {
        "metric": "Net salesMillion INR",
        "unit": "Million INR",
        "fiscalMonth": "March",
        "period": "2024 Q3",
        "released": "117 013",
        "releasedNum": 117013,
        "forecast": "121 552",
        "forecastNum": 121552,
        "spreadRaw": "-3.73%",
        "spreadPct": -3.73
      },
      "EBITDAMillion INR": {
        "metric": "EBITDAMillion INR",
        "unit": "Million INR",
        "fiscalMonth": "March",
        "period": "2024 Q3",
        "released": "28 426",
        "releasedNum": 28426,
        "forecast": "23 583",
        "forecastNum": 23583,
        "spreadRaw": "20.54%",
        "spreadPct": 20.54
      },
      "EBITMillion INR": {
        "metric": "EBITMillion INR",
        "unit": "Million INR",
        "fiscalMonth": "March",
        "period": "2024 Q3",
        "released": "22 069",
        "releasedNum": 22069,
        "forecast": "18 452",
        "forecastNum": 18452,
        "spreadRaw": "19.6%",
        "spreadPct": 19.6
      },
      "Earnings before Tax (EBT)Million INR": {
        "metric": "Earnings before Tax (EBT)Million INR",
        "unit": "Million INR",
        "fiscalMonth": "March",
        "period": "2024 Q3",
        "released": "19 270",
        "releasedNum": 19270,
        "forecast": "13 890",
        "forecastNum": 13890,
        "spreadRaw": "38.73%",
        "spreadPct": 38.73
      },
      "Net incomeMillion INR": {
        "metric": "Net incomeMillion INR",
        "unit": "Million INR",
        "fiscalMonth": "March",
        "period": "2024 Q3",
        "released": "19 283",
        "releasedNum": 19283,
        "forecast": "10 603",
        "forecastNum": 10603,
        "spreadRaw": "81.87%",
        "spreadPct": 81.87
      },
      "EPS INR": {
        "metric": "EPS INR",
        "unit": "INR",
        "fiscalMonth": "March",
        "period": "2024 Q3",
        "released": "19,2",
        "releasedNum": 19.2,
        "forecast": "11,2",
        "forecastNum": 11.2,
        "spreadRaw": "71.52%",
        "spreadPct": 71.52
      },
      "Announcement Date": {
        "metric": "Announcement Date",
        "unit": null,
        "fiscalMonth": "March",
        "period": "2024 Q3",
        "released": "31/01/24",
        "releasedDate": "31/01/24",
        "forecast": null,
        "spreadRaw": null,
        "spreadPct": null
      }
    },
    "2024 Q4": {
      "Net salesMillion INR": {
        "metric": "Net salesMillion INR",
        "unit": "Million INR",
        "fiscalMonth": "March",
        "period": "2024 Q4",
        "released": "134 870",
        "releasedNum": 134870,
        "forecast": "118 119",
        "forecastNum": 118119,
        "spreadRaw": "14.18%",
        "spreadPct": 14.18
      },
      "EBITDAMillion INR": {
        "metric": "EBITDAMillion INR",
        "unit": "Million INR",
        "fiscalMonth": "March",
        "period": "2024 Q4",
        "released": "24 447",
        "releasedNum": 24447,
        "forecast": "24 162",
        "forecastNum": 24162,
        "spreadRaw": "1.18%",
        "spreadPct": 1.18
      },
      "EBITMillion INR": {
        "metric": "EBITMillion INR",
        "unit": "Million INR",
        "fiscalMonth": "March",
        "period": "2024 Q4",
        "released": "14 498",
        "releasedNum": 14498,
        "forecast": "17 354",
        "forecastNum": 17354,
        "spreadRaw": "-16.46%",
        "spreadPct": -16.46
      },
      "Earnings before Tax (EBT)Million INR": {
        "metric": "Earnings before Tax (EBT)Million INR",
        "unit": "Million INR",
        "fiscalMonth": "March",
        "period": "2024 Q4",
        "released": "11 635",
        "releasedNum": 11635,
        "forecast": "15 249",
        "forecastNum": 15249,
        "spreadRaw": "-23.7%",
        "spreadPct": -23.7
      },
      "Net incomeMillion INR": {
        "metric": "Net incomeMillion INR",
        "unit": "Million INR",
        "fiscalMonth": "March",
        "period": "2024 Q4",
        "released": "9 354",
        "releasedNum": 9354,
        "forecast": "11 683",
        "forecastNum": 11683,
        "spreadRaw": "-19.94%",
        "spreadPct": -19.94
      },
      "EPS INR": {
        "metric": "EPS INR",
        "unit": "INR",
        "fiscalMonth": "March",
        "period": "2024 Q4",
        "released": "9,34",
        "releasedNum": 9.34,
        "forecast": "12,4",
        "forecastNum": 12.4,
        "spreadRaw": "-24.88%",
        "spreadPct": -24.88
      },
      "Announcement Date": {
        "metric": "Announcement Date",
        "unit": null,
        "fiscalMonth": "March",
        "period": "2024 Q4",
        "released": "13/05/24",
        "releasedDate": "13/05/24",
        "forecast": null,
        "spreadRaw": null,
        "spreadPct": null
      }
    },
    "2025 Q1": {
      "Net salesMillion INR": {
        "metric": "Net salesMillion INR",
        "unit": "Million INR",
        "fiscalMonth": "March",
        "period": "2025 Q1",
        "released": "136 178",
        "releasedNum": 136178,
        "forecast": "131 894",
        "forecastNum": 131894,
        "spreadRaw": "3.25%",
        "spreadPct": 3.25
      },
      "EBITDAMillion INR": {
        "metric": "EBITDAMillion INR",
        "unit": "Million INR",
        "fiscalMonth": "March",
        "period": "2025 Q1",
        "released": "28 393",
        "releasedNum": 28393,
        "forecast": "27 095",
        "forecastNum": 27095,
        "spreadRaw": "4.79%",
        "spreadPct": 4.79
      },
      "EBITMillion INR": {
        "metric": "EBITMillion INR",
        "unit": "Million INR",
        "fiscalMonth": "March",
        "period": "2025 Q1",
        "released": "21 564",
        "releasedNum": 21564,
        "forecast": "19 539",
        "forecastNum": 19539,
        "spreadRaw": "10.37%",
        "spreadPct": 10.37
      },
      "Earnings before Tax (EBT)Million INR": {
        "metric": "Earnings before Tax (EBT)Million INR",
        "unit": "Million INR",
        "fiscalMonth": "March",
        "period": "2025 Q1",
        "released": "18 591",
        "releasedNum": 18591,
        "forecast": "17 176",
        "forecastNum": 17176,
        "spreadRaw": "8.24%",
        "spreadPct": 8.24
      },
      "Net incomeMillion INR": {
        "metric": "Net incomeMillion INR",
        "unit": "Million INR",
        "fiscalMonth": "March",
        "period": "2025 Q1",
        "released": "13 402",
        "releasedNum": 13402,
        "forecast": "12 532",
        "forecastNum": 12532,
        "spreadRaw": "6.94%",
        "spreadPct": 6.94
      },
      "EPS INR": {
        "metric": "EPS INR",
        "unit": "INR",
        "fiscalMonth": "March",
        "period": "2025 Q1",
        "released": "13,3",
        "releasedNum": 13.3,
        "forecast": "11,2",
        "forecastNum": 11.2,
        "spreadRaw": "18.84%",
        "spreadPct": 18.84
      },
      "Announcement Date": {
        "metric": "Announcement Date",
        "unit": null,
        "fiscalMonth": "March",
        "period": "2025 Q1",
        "released": "24/07/24",
        "releasedDate": "24/07/24",
        "forecast": null,
        "spreadRaw": null,
        "spreadPct": null
      }
    },
    "2025 Q2": {
      "Net salesMillion INR": {
        "metric": "Net salesMillion INR",
        "unit": "Million INR",
        "fiscalMonth": "March",
        "period": "2025 Q2",
        "released": "112 133",
        "releasedNum": 112133,
        "forecast": "117 808",
        "forecastNum": 117808,
        "spreadRaw": "-4.82%",
        "spreadPct": -4.82
      },
      "EBITDAMillion INR": {
        "metric": "EBITDAMillion INR",
        "unit": "Million INR",
        "fiscalMonth": "March",
        "period": "2025 Q2",
        "released": "22 003",
        "releasedNum": 22003,
        "forecast": "21 277",
        "forecastNum": 21277,
        "spreadRaw": "3.41%",
        "spreadPct": 3.41
      },
      "EBITMillion INR": {
        "metric": "EBITMillion INR",
        "unit": "Million INR",
        "fiscalMonth": "March",
        "period": "2025 Q2",
        "released": "15 043",
        "releasedNum": 15043,
        "forecast": "16 650",
        "forecastNum": 16650,
        "spreadRaw": "-9.65%",
        "spreadPct": -9.65
      },
      "Earnings before Tax (EBT)Million INR": {
        "metric": "Earnings before Tax (EBT)Million INR",
        "unit": "Million INR",
        "fiscalMonth": "March",
        "period": "2025 Q2",
        "released": "12 133",
        "releasedNum": 12133,
        "forecast": "11 287",
        "forecastNum": 11287,
        "spreadRaw": "7.49%",
        "spreadPct": 7.49
      },
      "Net incomeMillion INR": {
        "metric": "Net incomeMillion INR",
        "unit": "Million INR",
        "fiscalMonth": "March",
        "period": "2025 Q2",
        "released": "8 609",
        "releasedNum": 8609,
        "forecast": "8 978",
        "forecastNum": 8978,
        "spreadRaw": "-4.11%",
        "spreadPct": -4.11
      },
      "EPS INR": {
        "metric": "EPS INR",
        "unit": "INR",
        "fiscalMonth": "March",
        "period": "2025 Q2",
        "released": "8,49",
        "releasedNum": 8.49,
        "forecast": "8,03",
        "forecastNum": 8.03,
        "spreadRaw": "5.79%",
        "spreadPct": 5.79
      },
      "Announcement Date": {
        "metric": "Announcement Date",
        "unit": null,
        "fiscalMonth": "March",
        "period": "2025 Q2",
        "released": "06/11/24",
        "releasedDate": "06/11/24",
        "forecast": null,
        "spreadRaw": null,
        "spreadPct": null
      }
    },
    "2025 Q3": {
      "Net salesMillion INR": {
        "metric": "Net salesMillion INR",
        "unit": "Million INR",
        "fiscalMonth": "March",
        "period": "2025 Q3",
        "released": "117 507",
        "releasedNum": 117507,
        "forecast": "116 909",
        "forecastNum": 116909,
        "spreadRaw": "0.51%",
        "spreadPct": 0.51
      },
      "EBITDAMillion INR": {
        "metric": "EBITDAMillion INR",
        "unit": "Million INR",
        "fiscalMonth": "March",
        "period": "2025 Q3",
        "released": "21 839",
        "releasedNum": 21839,
        "forecast": "22 772",
        "forecastNum": 22772,
        "spreadRaw": "-4.1%",
        "spreadPct": -4.1
      },
      "EBITMillion INR": {
        "metric": "EBITMillion INR",
        "unit": "Million INR",
        "fiscalMonth": "March",
        "period": "2025 Q3",
        "released": "14 858",
        "releasedNum": 14858,
        "forecast": "15 280",
        "forecastNum": 15280,
        "spreadRaw": "-2.76%",
        "spreadPct": -2.76
      },
      "Earnings before Tax (EBT)Million INR": {
        "metric": "Earnings before Tax (EBT)Million INR",
        "unit": "Million INR",
        "fiscalMonth": "March",
        "period": "2025 Q3",
        "released": "11 994",
        "releasedNum": 11994,
        "forecast": "13 252",
        "forecastNum": 13252,
        "spreadRaw": "-9.49%",
        "spreadPct": -9.49
      },
      "Net incomeMillion INR": {
        "metric": "Net incomeMillion INR",
        "unit": "Million INR",
        "fiscalMonth": "March",
        "period": "2025 Q3",
        "released": "9 505",
        "releasedNum": 9505,
        "forecast": "9 100",
        "forecastNum": 9100,
        "spreadRaw": "4.45%",
        "spreadPct": 4.45
      },
      "EPS INR": {
        "metric": "EPS INR",
        "unit": "INR",
        "fiscalMonth": "March",
        "period": "2025 Q3",
        "released": "9,39",
        "releasedNum": 9.39,
        "forecast": "8,40",
        "forecastNum": 8.4,
        "spreadRaw": "11.79%",
        "spreadPct": 11.79
      },
      "Announcement Date": {
        "metric": "Announcement Date",
        "unit": null,
        "fiscalMonth": "March",
        "period": "2025 Q3",
        "released": "30/01/25",
        "releasedDate": "30/01/25",
        "forecast": null,
        "spreadRaw": null,
        "spreadPct": null
      }
    },
    "2025 Q4": {
      "Net salesMillion INR": {
        "metric": "Net salesMillion INR",
        "unit": "Million INR",
        "fiscalMonth": "March",
        "period": "2025 Q4",
        "released": "131 831",
        "releasedNum": 131831,
        "forecast": "121 291",
        "forecastNum": 121291,
        "spreadRaw": "8.69%",
        "spreadPct": 8.69
      },
      "EBITDAMillion INR": {
        "metric": "EBITDAMillion INR",
        "unit": "Million INR",
        "fiscalMonth": "March",
        "period": "2025 Q4",
        "released": "22 708",
        "releasedNum": 22708,
        "forecast": "23 296",
        "forecastNum": 23296,
        "spreadRaw": "-2.52%",
        "spreadPct": -2.52
      },
      "EBITMillion INR": {
        "metric": "EBITMillion INR",
        "unit": "Million INR",
        "fiscalMonth": "March",
        "period": "2025 Q4",
        "released": "15 802",
        "releasedNum": 15802,
        "forecast": "16 059",
        "forecastNum": 16059,
        "spreadRaw": "-1.6%",
        "spreadPct": -1.6
      },
      "Earnings before Tax (EBT)Million INR": {
        "metric": "Earnings before Tax (EBT)Million INR",
        "unit": "Million INR",
        "fiscalMonth": "March",
        "period": "2025 Q4",
        "released": "718",
        "releasedNum": 718,
        "forecast": "13 279",
        "forecastNum": 13279,
        "spreadRaw": "-94.59%",
        "spreadPct": -94.59
      },
      "Net incomeMillion INR": {
        "metric": "Net incomeMillion INR",
        "unit": "Million INR",
        "fiscalMonth": "March",
        "period": "2025 Q4",
        "released": "-3 394",
        "releasedNum": -3394,
        "forecast": "9 950",
        "forecastNum": 9950,
        "spreadRaw": "-134.11%",
        "spreadPct": -134.11
      },
      "EPS INR": {
        "metric": "EPS INR",
        "unit": "INR",
        "fiscalMonth": "March",
        "period": "2025 Q4",
        "released": "-3,35",
        "releasedNum": -3.35,
        "forecast": "10,3",
        "forecastNum": 10.3,
        "spreadRaw": "-132.68%",
        "spreadPct": -132.68
      },
      "Announcement Date": {
        "metric": "Announcement Date",
        "unit": null,
        "fiscalMonth": "March",
        "period": "2025 Q4",
        "released": "30/04/25",
        "releasedDate": "30/04/25",
        "forecast": null,
        "spreadRaw": null,
        "spreadPct": null
      }
    },
    "2026 Q1": {
      "Net salesMillion INR": {
        "metric": "Net salesMillion INR",
        "unit": "Million INR",
        "fiscalMonth": "March",
        "period": "2026 Q1",
        "released": "122 945",
        "releasedNum": 122945,
        "forecast": "121 528",
        "forecastNum": 121528,
        "spreadRaw": "1.17%",
        "spreadPct": 1.17
      },
      "EBITDAMillion INR": {
        "metric": "EBITDAMillion INR",
        "unit": "Million INR",
        "fiscalMonth": "March",
        "period": "2026 Q1",
        "released": "30 056",
        "releasedNum": 30056,
        "forecast": "25 521",
        "forecastNum": 25521,
        "spreadRaw": "17.77%",
        "spreadPct": 17.77
      },
      "EBITMillion INR": {
        "metric": "EBITMillion INR",
        "unit": "Million INR",
        "fiscalMonth": "March",
        "period": "2026 Q1",
        "released": "22 841",
        "releasedNum": 22841,
        "forecast": "19 489",
        "forecastNum": 19489,
        "spreadRaw": "17.2%",
        "spreadPct": 17.2
      },
      "Earnings before Tax (EBT)Million INR": {
        "metric": "Earnings before Tax (EBT)Million INR",
        "unit": "Million INR",
        "fiscalMonth": "March",
        "period": "2026 Q1",
        "released": "20 179",
        "releasedNum": 20179,
        "forecast": "16 104",
        "forecastNum": 16104,
        "spreadRaw": "25.31%",
        "spreadPct": 25.31
      },
      "Net incomeMillion INR": {
        "metric": "Net incomeMillion INR",
        "unit": "Million INR",
        "fiscalMonth": "March",
        "period": "2026 Q1",
        "released": "14 940",
        "releasedNum": 14940,
        "forecast": "11 212",
        "forecastNum": 11212,
        "spreadRaw": "33.25%",
        "spreadPct": 33.25
      },
      "EPS INR": {
        "metric": "EPS INR",
        "unit": "INR",
        "fiscalMonth": "March",
        "period": "2026 Q1",
        "released": null,
        "releasedNum": null,
        "forecast": null,
        "forecastNum": null,
        "spreadRaw": null,
        "spreadPct": null
      },
      "Announcement Date": {
        "metric": "Announcement Date",
        "unit": null,
        "fiscalMonth": "March",
        "period": "2026 Q1",
        "released": "12/08/25",
        "releasedDate": "12/08/25",
        "forecast": null,
        "spreadRaw": null,
        "spreadPct": null
      }
    },
    "2026 Q2": {
      "Net salesMillion INR": {
        "metric": "Net salesMillion INR",
        "unit": "Million INR",
        "fiscalMonth": "March",
        "period": "2026 Q2",
        "released": null,
        "releasedNum": null,
        "forecast": "111 912",
        "forecastNum": 111912,
        "spreadRaw": null,
        "spreadPct": null
      },
      "EBITDAMillion INR": {
        "metric": "EBITDAMillion INR",
        "unit": "Million INR",
        "fiscalMonth": "March",
        "period": "2026 Q2",
        "released": null,
        "releasedNum": null,
        "forecast": "19 442",
        "forecastNum": 19442,
        "spreadRaw": null,
        "spreadPct": null
      },
      "EBITMillion INR": {
        "metric": "EBITMillion INR",
        "unit": "Million INR",
        "fiscalMonth": "March",
        "period": "2026 Q2",
        "released": null,
        "releasedNum": null,
        "forecast": "9 700",
        "forecastNum": 9700,
        "spreadRaw": null,
        "spreadPct": null
      },
      "Earnings before Tax (EBT)Million INR": {
        "metric": "Earnings before Tax (EBT)Million INR",
        "unit": "Million INR",
        "fiscalMonth": "March",
        "period": "2026 Q2",
        "released": null,
        "releasedNum": null,
        "forecast": "8 677",
        "forecastNum": 8677,
        "spreadRaw": null,
        "spreadPct": null
      },
      "Net incomeMillion INR": {
        "metric": "Net incomeMillion INR",
        "unit": "Million INR",
        "fiscalMonth": "March",
        "period": "2026 Q2",
        "released": null,
        "releasedNum": null,
        "forecast": "5 871",
        "forecastNum": 5871,
        "spreadRaw": null,
        "spreadPct": null
      },
      "EPS INR": {
        "metric": "EPS INR",
        "unit": "INR",
        "fiscalMonth": "March",
        "period": "2026 Q2",
        "released": null,
        "releasedNum": null,
        "forecast": null,
        "forecastNum": null,
        "spreadRaw": null,
        "spreadPct": null
      },
      "Announcement Date": {
        "metric": "Announcement Date",
        "unit": null,
        "fiscalMonth": "March",
        "period": "2026 Q2",
        "released": "-",
        "releasedDate": "-",
        "forecast": null,
        "spreadRaw": null,
        "spreadPct": null
      }
    },
    "2026 Q3": {
      "Net salesMillion INR": {
        "metric": "Net salesMillion INR",
        "unit": "Million INR",
        "fiscalMonth": "March",
        "period": "2026 Q3",
        "released": null,
        "releasedNum": null,
        "forecast": "162 000",
        "forecastNum": 162000,
        "spreadRaw": null,
        "spreadPct": null
      },
      "EBITDAMillion INR": {
        "metric": "EBITDAMillion INR",
        "unit": "Million INR",
        "fiscalMonth": "March",
        "period": "2026 Q3",
        "released": null,
        "releasedNum": null,
        "forecast": "31 800",
        "forecastNum": 31800,
        "spreadRaw": null,
        "spreadPct": null
      },
      "EBITMillion INR": {
        "metric": "EBITMillion INR",
        "unit": "Million INR",
        "fiscalMonth": "March",
        "period": "2026 Q3",
        "released": null,
        "releasedNum": null,
        "forecast": null,
        "forecastNum": null,
        "spreadRaw": null,
        "spreadPct": null
      },
      "Earnings before Tax (EBT)Million INR": {
        "metric": "Earnings before Tax (EBT)Million INR",
        "unit": "Million INR",
        "fiscalMonth": "March",
        "period": "2026 Q3",
        "released": null,
        "releasedNum": null,
        "forecast": "19 700",
        "forecastNum": 19700,
        "spreadRaw": null,
        "spreadPct": null
      },
      "Net incomeMillion INR": {
        "metric": "Net incomeMillion INR",
        "unit": "Million INR",
        "fiscalMonth": "March",
        "period": "2026 Q3",
        "released": null,
        "releasedNum": null,
        "forecast": "14 700",
        "forecastNum": 14700,
        "spreadRaw": null,
        "spreadPct": null
      },
      "EPS INR": {
        "metric": "EPS INR",
        "unit": "INR",
        "fiscalMonth": "March",
        "period": "2026 Q3",
        "released": null,
        "releasedNum": null,
        "forecast": null,
        "forecastNum": null,
        "spreadRaw": null,
        "spreadPct": null
      },
      "Announcement Date": {
        "metric": "Announcement Date",
        "unit": null,
        "fiscalMonth": "March",
        "period": "2026 Q3",
        "released": "-",
        "releasedDate": "-",
        "forecast": null,
        "spreadRaw": null,
        "spreadPct": null
      }
    },
    "2026 Q4": {
      "Net salesMillion INR": {
        "metric": "Net salesMillion INR",
        "unit": "Million INR",
        "fiscalMonth": "March",
        "period": "2026 Q4",
        "released": null,
        "releasedNum": null,
        "forecast": "183 500",
        "forecastNum": 183500,
        "spreadRaw": null,
        "spreadPct": null
      },
      "EBITDAMillion INR": {
        "metric": "EBITDAMillion INR",
        "unit": "Million INR",
        "fiscalMonth": "March",
        "period": "2026 Q4",
        "released": null,
        "releasedNum": null,
        "forecast": "37 800",
        "forecastNum": 37800,
        "spreadRaw": null,
        "spreadPct": null
      },
      "EBITMillion INR": {
        "metric": "EBITMillion INR",
        "unit": "Million INR",
        "fiscalMonth": "March",
        "period": "2026 Q4",
        "released": null,
        "releasedNum": null,
        "forecast": null,
        "forecastNum": null,
        "spreadRaw": null,
        "spreadPct": null
      },
      "Earnings before Tax (EBT)Million INR": {
        "metric": "Earnings before Tax (EBT)Million INR",
        "unit": "Million INR",
        "fiscalMonth": "March",
        "period": "2026 Q4",
        "released": null,
        "releasedNum": null,
        "forecast": "25 400",
        "forecastNum": 25400,
        "spreadRaw": null,
        "spreadPct": null
      },
      "Net incomeMillion INR": {
        "metric": "Net incomeMillion INR",
        "unit": "Million INR",
        "fiscalMonth": "March",
        "period": "2026 Q4",
        "released": null,
        "releasedNum": null,
        "forecast": "19 000",
        "forecastNum": 19000,
        "spreadRaw": null,
        "spreadPct": null
      },
      "EPS INR": {
        "metric": "EPS INR",
        "unit": "INR",
        "fiscalMonth": "March",
        "period": "2026 Q4",
        "released": null,
        "releasedNum": null,
        "forecast": null,
        "forecastNum": null,
        "spreadRaw": null,
        "spreadPct": null
      },
      "Announcement Date": {
        "metric": "Announcement Date",
        "unit": null,
        "fiscalMonth": "March",
        "period": "2026 Q4",
        "released": "-",
        "releasedDate": "-",
        "forecast": null,
        "spreadRaw": null,
        "spreadPct": null
      }
    }
  },
  "upcomingEvents": {
    "count": 4,
    "events": [
      {
        "section": "Upcoming",
        "dateTimeRaw": "14/11/2025",
        "dateTimeISO": "2025-11-13T18:30:00.000Z",
        "title": "Q2 2026 Earnings Release (Projected)",
        "icsUrl": "https://in.marketscreener.com/api/stateful/agenda/event-async/Q2-2026-Earnings-Release-Projected-47696559.ics"
      },
      {
        "section": "Upcoming",
        "dateTimeRaw": "14/02/2026",
        "dateTimeISO": "2026-02-13T18:30:00.000Z",
        "title": "Q3 2026 Earnings Release (Projected)",
        "icsUrl": "https://in.marketscreener.com/api/stateful/agenda/event-async/Q3-2026-Earnings-Release-Projected-47696561.ics"
      },
      {
        "section": "Upcoming",
        "dateTimeRaw": "30/05/2026",
        "dateTimeISO": "2026-05-29T18:30:00.000Z",
        "title": "Q4 2026 Earnings Release (Projected)",
        "icsUrl": "https://in.marketscreener.com/api/stateful/agenda/event-async/Q4-2026-Earnings-Release-Projected-47696569.ics"
      },
      {
        "section": "Upcoming",
        "dateTimeRaw": "29/07/2026",
        "dateTimeISO": "2026-07-28T18:30:00.000Z",
        "title": "Q1 2027 Earnings Release (Projected)",
        "icsUrl": "https://in.marketscreener.com/api/stateful/agenda/event-async/Q1-2027-Earnings-Release-Projected-50810238.ics"
      }
    ]
  },
  "pastEvents": {
    "count": 198,
    "events": [
      {
        "section": "Past",
        "dateTimeRaw": "03/09/2025",
        "dateTimeISO": "2025-09-02T18:30:00.000Z",
        "title": "Ashwamedh Elara India Dialogue Conference",
        "icsUrl": "https://in.marketscreener.com/api/stateful/agenda/event-async/Ashwamedh-Elara-India-Dialogue-Conference-50966033.ics"
      },
      {
        "section": "Past",
        "dateTimeRaw": "02/09/2025",
        "dateTimeISO": "2025-09-01T18:30:00.000Z",
        "title": "Motilal Oswal Global Investor Conference",
        "icsUrl": "https://in.marketscreener.com/api/stateful/agenda/event-async/Motilal-Oswal-Global-Investor-Conference-50966026.ics"
      },
      {
        "section": "Past",
        "dateTimeRaw": "30/08/2025 11:00 am",
        "dateTimeISO": "2025-08-30T05:30:00.000Z",
        "title": "Annual General Meeting",
        "icsUrl": "https://in.marketscreener.com/api/stateful/agenda/event-async/Annual-General-Meeting-50810191.ics"
      },
      {
        "section": "Past",
        "dateTimeRaw": "26/08/2025",
        "dateTimeISO": "2025-08-25T18:30:00.000Z",
        "title": "Investor Meeting - Dhunseri Investments",
        "icsUrl": "https://in.marketscreener.com/api/stateful/agenda/event-async/Investor-Meeting-Dhunseri-Investments-50904166.ics"
      },
      {
        "section": "Past",
        "dateTimeRaw": "22/08/2025",
        "dateTimeISO": "2025-08-21T18:30:00.000Z",
        "title": "Investor Meeting - Motilal AMC",
        "icsUrl": "https://in.marketscreener.com/api/stateful/agenda/event-async/Investor-Meeting-Motilal-AMC-50880054.ics"
      },
      {
        "section": "Past",
        "dateTimeRaw": "22/08/2025",
        "dateTimeISO": "2025-08-21T18:30:00.000Z",
        "title": "Ex-dividend day for final dividend",
        "icsUrl": "https://in.marketscreener.com/api/stateful/agenda/event-async/Ex-dividend-day-for-final-dividend-50851888.ics"
      },
      {
        "section": "Past",
        "dateTimeRaw": "13/08/2025 02:00 pm",
        "dateTimeISO": "2025-08-13T08:30:00.000Z",
        "title": "Q1 2026 Earnings Call",
        "icsUrl": "https://in.marketscreener.com/api/stateful/agenda/event-async/Q1-2026-Earnings-Call-50810167.ics"
      },
      {
        "section": "Past",
        "dateTimeRaw": "12/08/2025 06:50 pm",
        "dateTimeISO": "2025-08-12T13:20:00.000Z",
        "title": "Q1 2026 Earnings Release",
        "icsUrl": "https://in.marketscreener.com/api/stateful/agenda/event-async/Q1-2026-Earnings-Release-47408476.ics"
      },
      {
        "section": "Past",
        "dateTimeRaw": "14/07/2025",
        "dateTimeISO": "2025-07-13T18:30:00.000Z",
        "title": "Investor Meeting - Axis Mutual Fund",
        "icsUrl": "https://in.marketscreener.com/api/stateful/agenda/event-async/Investor-Meeting-Axis-Mutual-Fund-50444089.ics"
      },
      {
        "section": "Past",
        "dateTimeRaw": "11/07/2025",
        "dateTimeISO": "2025-07-10T18:30:00.000Z",
        "title": "Investor Meeting - SBI Mutual Fund",
        "icsUrl": "https://in.marketscreener.com/api/stateful/agenda/event-async/Investor-Meeting-SBI-Mutual-Fund-50444088.ics"
      },
      {
        "section": "Past",
        "dateTimeRaw": "10/07/2025",
        "dateTimeISO": "2025-07-09T18:30:00.000Z",
        "title": "Investor Meeting",
        "icsUrl": "https://in.marketscreener.com/api/stateful/agenda/event-async/Investor-Meeting-50444087.ics"
      },
      {
        "section": "Past",
        "dateTimeRaw": "25/06/2025",
        "dateTimeISO": "2025-06-24T18:30:00.000Z",
        "title": "Investor Meeting - Systematix Group",
        "icsUrl": "https://in.marketscreener.com/api/stateful/agenda/event-async/Investor-Meeting-Systematix-Group-50281750.ics"
      },
      {
        "section": "Past",
        "dateTimeRaw": "23/06/2025",
        "dateTimeISO": "2025-06-22T18:30:00.000Z",
        "title": "Investor Meeting - Government of Singapore Investment",
        "icsUrl": "https://in.marketscreener.com/api/stateful/agenda/event-async/Investor-Meeting-Government-of-Singapore-Investment-50281720.ics"
      },
      {
        "section": "Past",
        "dateTimeRaw": "01/05/2025 02:00 pm",
        "dateTimeISO": "2025-05-01T08:30:00.000Z",
        "title": "Q4 2025 Earnings Call",
        "icsUrl": "https://in.marketscreener.com/api/stateful/agenda/event-async/Q4-2025-Earnings-Call-49728220.ics"
      },
      {
        "section": "Past",
        "dateTimeRaw": "30/04/2025 08:51 pm",
        "dateTimeISO": "2025-04-30T15:21:00.000Z",
        "title": "Q4 2025 Earnings Release",
        "icsUrl": "https://in.marketscreener.com/api/stateful/agenda/event-async/Q4-2025-Earnings-Release-44572503.ics"
      },
      {
        "section": "Past",
        "dateTimeRaw": "26/03/2025",
        "dateTimeISO": "2025-03-25T18:30:00.000Z",
        "title": "Investor Meeting - Kotak Securities",
        "icsUrl": "https://in.marketscreener.com/api/stateful/agenda/event-async/Investor-Meeting-Kotak-Securities-49394806.ics"
      },
      {
        "section": "Past",
        "dateTimeRaw": "07/03/2025",
        "dateTimeISO": "2025-03-06T18:30:00.000Z",
        "title": "Investor Meeting - Trinity Street AMC",
        "icsUrl": "https://in.marketscreener.com/api/stateful/agenda/event-async/Investor-Meeting-Trinity-Street-AMC-49225258.ics"
      },
      {
        "section": "Past",
        "dateTimeRaw": "18/02/2025",
        "dateTimeISO": "2025-02-17T18:30:00.000Z",
        "title": "Kotak Chasing Growth Conference",
        "icsUrl": "https://in.marketscreener.com/api/stateful/agenda/event-async/Kotak-Chasing-Growth-Conference-49082366.ics"
      },
      {
        "section": "Past",
        "dateTimeRaw": "13/02/2025",
        "dateTimeISO": "2025-02-12T18:30:00.000Z",
        "title": "Antique India Capex Conference",
        "icsUrl": "https://in.marketscreener.com/api/stateful/agenda/event-async/Antique-India-Capex-Conference-49029275.ics"
      },
      {
        "section": "Past",
        "dateTimeRaw": "12/02/2025",
        "dateTimeISO": "2025-02-11T18:30:00.000Z",
        "title": "Investor Meeting - Sundaram Mutual Fund",
        "icsUrl": "https://in.marketscreener.com/api/stateful/agenda/event-async/Investor-Meeting-Sundaram-Mutual-Fund-49029267.ics"
      },
      {
        "section": "Past",
        "dateTimeRaw": "11/02/2025",
        "dateTimeISO": "2025-02-10T18:30:00.000Z",
        "title": "Nuvama India Investor Conference",
        "icsUrl": "https://in.marketscreener.com/api/stateful/agenda/event-async/Nuvama-India-Investor-Conference-48989338.ics"
      },
      {
        "section": "Past",
        "dateTimeRaw": "06/02/2025",
        "dateTimeISO": "2025-02-05T18:30:00.000Z",
        "title": "Investor Meeting",
        "icsUrl": "https://in.marketscreener.com/api/stateful/agenda/event-async/Investor-Meeting-48934787.ics"
      },
      {
        "section": "Past",
        "dateTimeRaw": "05/02/2025",
        "dateTimeISO": "2025-02-04T18:30:00.000Z",
        "title": "Investor Meeting",
        "icsUrl": "https://in.marketscreener.com/api/stateful/agenda/event-async/Investor-Meeting-48934785.ics"
      },
      {
        "section": "Past",
        "dateTimeRaw": "30/01/2025 06:00 pm",
        "dateTimeISO": "2025-01-30T12:30:00.000Z",
        "title": "Q3 2025 Earnings Call",
        "icsUrl": "https://in.marketscreener.com/api/stateful/agenda/event-async/Q3-2025-Earnings-Call-48886484.ics"
      },
      {
        "section": "Past",
        "dateTimeRaw": "30/01/2025 05:20 pm",
        "dateTimeISO": "2025-01-30T11:50:00.000Z",
        "title": "Q3 2025 Earnings Release",
        "icsUrl": "https://in.marketscreener.com/api/stateful/agenda/event-async/Q3-2025-Earnings-Release-44572500.ics"
      },
      {
        "section": "Past",
        "dateTimeRaw": "31/12/2024",
        "dateTimeISO": "2024-12-30T18:30:00.000Z",
        "title": "Investor Meeting - ICICI Direct",
        "icsUrl": "https://in.marketscreener.com/api/stateful/agenda/event-async/Investor-Meeting-ICICI-Direct-48657409.ics"
      },
      {
        "section": "Past",
        "dateTimeRaw": "23/12/2024",
        "dateTimeISO": "2024-12-22T18:30:00.000Z",
        "title": "Investor Meeting - Emkay Global",
        "icsUrl": "https://in.marketscreener.com/api/stateful/agenda/event-async/Investor-Meeting-Emkay-Global-48623390.ics"
      },
      {
        "section": "Past",
        "dateTimeRaw": "20/12/2024",
        "dateTimeISO": "2024-12-19T18:30:00.000Z",
        "title": "Investor Meeting - Geosphere Capital",
        "icsUrl": "https://in.marketscreener.com/api/stateful/agenda/event-async/Investor-Meeting-Geosphere-Capital-48614163.ics"
      },
      {
        "section": "Past",
        "dateTimeRaw": "19/12/2024",
        "dateTimeISO": "2024-12-18T18:30:00.000Z",
        "title": "Investor Meeting - Nuvama Research",
        "icsUrl": "https://in.marketscreener.com/api/stateful/agenda/event-async/Investor-Meeting-Nuvama-Research-48605125.ics"
      },
      {
        "section": "Past",
        "dateTimeRaw": "19/12/2024",
        "dateTimeISO": "2024-12-18T18:30:00.000Z",
        "title": "Investor Meeting - SBI MF ESG Team",
        "icsUrl": "https://in.marketscreener.com/api/stateful/agenda/event-async/Investor-Meeting-SBI-MF-ESG-Team-48605123.ics"
      },
      {
        "section": "Past",
        "dateTimeRaw": "17/12/2024",
        "dateTimeISO": "2024-12-16T18:30:00.000Z",
        "title": "Investor Meeting - Capital Group ESG",
        "icsUrl": "https://in.marketscreener.com/api/stateful/agenda/event-async/Investor-Meeting-Capital-Group-ESG-48585515.ics"
      },
      {
        "section": "Past",
        "dateTimeRaw": "13/12/2024",
        "dateTimeISO": "2024-12-12T18:30:00.000Z",
        "title": "Investor Meeting - Baroda BNP Paribas MF",
        "icsUrl": "https://in.marketscreener.com/api/stateful/agenda/event-async/Investor-Meeting-Baroda-BNP-Paribas-MF-48566218.ics"
      },
      {
        "section": "Past",
        "dateTimeRaw": "29/11/2024",
        "dateTimeISO": "2024-11-28T18:30:00.000Z",
        "title": "Investor Meeting - Edelweiss MF",
        "icsUrl": "https://in.marketscreener.com/api/stateful/agenda/event-async/Investor-Meeting-Edelweiss-MF-48470728.ics"
      },
      {
        "section": "Past",
        "dateTimeRaw": "19/11/2024",
        "dateTimeISO": "2024-11-18T18:30:00.000Z",
        "title": "CITIC CLSA India Forum",
        "icsUrl": "https://in.marketscreener.com/api/stateful/agenda/event-async/CITIC-CLSA-India-Forum-48384378.ics"
      },
      {
        "section": "Past",
        "dateTimeRaw": "12/11/2024 09:30 am",
        "dateTimeISO": "2024-11-12T04:00:00.000Z",
        "title": "Avendus Spark Investor Conference",
        "icsUrl": "https://in.marketscreener.com/api/stateful/agenda/event-async/Avendus-Spark-Investor-Conference-48302062.ics"
      },
      {
        "section": "Past",
        "dateTimeRaw": "06/11/2024 06:30 pm",
        "dateTimeISO": "2024-11-06T13:00:00.000Z",
        "title": "Q2 2025 Earnings Call",
        "icsUrl": "https://in.marketscreener.com/api/stateful/agenda/event-async/Q2-2025-Earnings-Call-48216556.ics"
      },
      {
        "section": "Past",
        "dateTimeRaw": "06/11/2024 04:35 pm",
        "dateTimeISO": "2024-11-06T11:05:00.000Z",
        "title": "Q2 2025 Earnings Release",
        "icsUrl": "https://in.marketscreener.com/api/stateful/agenda/event-async/Q2-2025-Earnings-Release-44572499.ics"
      },
      {
        "section": "Past",
        "dateTimeRaw": "24/09/2024 01:00 pm",
        "dateTimeISO": "2024-09-24T07:30:00.000Z",
        "title": "J.P. Morgan India Investor Summit",
        "icsUrl": "https://in.marketscreener.com/api/stateful/agenda/event-async/J-P-Morgan-India-Investor-Summit-47905245.ics"
      },
      {
        "section": "Past",
        "dateTimeRaw": "10/09/2024 06:30 am",
        "dateTimeISO": "2024-09-10T01:00:00.000Z",
        "title": "CITIC CLSA Flagship Investor Forum",
        "icsUrl": "https://in.marketscreener.com/api/stateful/agenda/event-async/CITIC-CLSA-Flagship-Investor-Forum-47816858.ics"
      },
      {
        "section": "Past",
        "dateTimeRaw": "30/08/2024 11:00 am",
        "dateTimeISO": "2024-08-30T05:30:00.000Z",
        "title": "Annual General Meeting",
        "icsUrl": "https://in.marketscreener.com/api/stateful/agenda/event-async/Annual-General-Meeting-47696320.ics"
      },
      {
        "section": "Past",
        "dateTimeRaw": "22/08/2024 02:00 pm",
        "dateTimeISO": "2024-08-22T08:30:00.000Z",
        "title": "Equirus India Conference",
        "icsUrl": "https://in.marketscreener.com/api/stateful/agenda/event-async/Equirus-India-Conference-47696288.ics"
      },
      {
        "section": "Past",
        "dateTimeRaw": "22/08/2024",
        "dateTimeISO": "2024-08-21T18:30:00.000Z",
        "title": "Ex-dividend day for final dividend",
        "icsUrl": "https://in.marketscreener.com/api/stateful/agenda/event-async/Ex-dividend-day-for-final-dividend-47677458.ics"
      },
      {
        "section": "Past",
        "dateTimeRaw": "24/07/2024 06:00 pm",
        "dateTimeISO": "2024-07-24T12:30:00.000Z",
        "title": "Q1 2025 Earnings Call",
        "icsUrl": "https://in.marketscreener.com/api/stateful/agenda/event-async/Q1-2025-Earnings-Call-47418848.ics"
      },
      {
        "section": "Past",
        "dateTimeRaw": "24/07/2024 05:48 pm",
        "dateTimeISO": "2024-07-24T12:18:00.000Z",
        "title": "Q1 2025 Earnings Release",
        "icsUrl": "https://in.marketscreener.com/api/stateful/agenda/event-async/Q1-2025-Earnings-Release-44385912.ics"
      },
      {
        "section": "Past",
        "dateTimeRaw": "12/06/2024",
        "dateTimeISO": "2024-06-11T18:30:00.000Z",
        "title": "Roadshow - Day 2",
        "icsUrl": "https://in.marketscreener.com/api/stateful/agenda/event-async/Roadshow-Day-2-46925759.ics"
      },
      {
        "section": "Past",
        "dateTimeRaw": "11/06/2024",
        "dateTimeISO": "2024-06-10T18:30:00.000Z",
        "title": "Roadshow - Day 1",
        "icsUrl": "https://in.marketscreener.com/api/stateful/agenda/event-async/Roadshow-Day-1-46925754.ics"
      },
      {
        "section": "Past",
        "dateTimeRaw": "31/05/2024 04:00 pm",
        "dateTimeISO": "2024-05-31T10:30:00.000Z",
        "title": "B&K Securities Trinity Investor Conference - White Oak Capital",
        "icsUrl": "https://in.marketscreener.com/api/stateful/agenda/event-async/B-K-Securities-Trinity-Investor-Conference-White-Oak-Capital-46847270.ics"
      },
      {
        "section": "Past",
        "dateTimeRaw": "31/05/2024 03:00 pm",
        "dateTimeISO": "2024-05-31T09:30:00.000Z",
        "title": "B&K Securities Trinity Investor Conference - Ratnabali Investments Pvt Ltd",
        "icsUrl": "https://in.marketscreener.com/api/stateful/agenda/event-async/B-K-Securities-Trinity-Investor-Conference-Ratnabali-Investments-Pvt-Ltd-46847273.ics"
      },
      {
        "section": "Past",
        "dateTimeRaw": "31/05/2024 02:00 pm",
        "dateTimeISO": "2024-05-31T08:30:00.000Z",
        "title": "B&K Securities Trinity Investor Conference - Abakkus Investments",
        "icsUrl": "https://in.marketscreener.com/api/stateful/agenda/event-async/B-K-Securities-Trinity-Investor-Conference-Abakkus-Investments-46847272.ics"
      },
      {
        "section": "Past",
        "dateTimeRaw": "13/05/2024 06:00 pm",
        "dateTimeISO": "2024-05-13T12:30:00.000Z",
        "title": "Q4 2024 Earnings Call",
        "icsUrl": "https://in.marketscreener.com/api/stateful/agenda/event-async/Q4-2024-Earnings-Call-46673650.ics"
      },
      {
        "section": "Past",
        "dateTimeRaw": "13/05/2024 05:41 pm",
        "dateTimeISO": "2024-05-13T12:11:00.000Z",
        "title": "Q4 2024 Earnings Release",
        "icsUrl": "https://in.marketscreener.com/api/stateful/agenda/event-async/Q4-2024-Earnings-Release-43841311.ics"
      },
      {
        "section": "Past",
        "dateTimeRaw": "22/02/2024 02:00 pm",
        "dateTimeISO": "2024-02-22T08:30:00.000Z",
        "title": "Kotak Chasing Growth Conference - Kotak Asset Mgt",
        "icsUrl": "https://in.marketscreener.com/api/stateful/agenda/event-async/Kotak-Chasing-Growth-Conference-Kotak-Asset-Mgt-45969093.ics"
      },
      {
        "section": "Past",
        "dateTimeRaw": "20/02/2024 04:00 pm",
        "dateTimeISO": "2024-02-20T10:30:00.000Z",
        "title": "Antique Build India New India Conference - SBI MF",
        "icsUrl": "https://in.marketscreener.com/api/stateful/agenda/event-async/Antique-Build-India-New-India-Conference-SBI-MF-45969081.ics"
      },
      {
        "section": "Past",
        "dateTimeRaw": "20/02/2024 03:00 pm",
        "dateTimeISO": "2024-02-20T09:30:00.000Z",
        "title": "Antique Build India New India Conference - HSBC MF",
        "icsUrl": "https://in.marketscreener.com/api/stateful/agenda/event-async/Antique-Build-India-New-India-Conference-HSBC-MF-45969080.ics"
      },
      {
        "section": "Past",
        "dateTimeRaw": "20/02/2024 01:00 pm",
        "dateTimeISO": "2024-02-20T07:30:00.000Z",
        "title": "Antique Build India New India Conference - Anvil",
        "icsUrl": "https://in.marketscreener.com/api/stateful/agenda/event-async/Antique-Build-India-New-India-Conference-Anvil-45969079.ics"
      },
      {
        "section": "Past",
        "dateTimeRaw": "20/02/2024 11:00 am",
        "dateTimeISO": "2024-02-20T05:30:00.000Z",
        "title": "Antique Build India New India Conference - SBI Gen Insurance",
        "icsUrl": "https://in.marketscreener.com/api/stateful/agenda/event-async/Antique-Build-India-New-India-Conference-SBI-Gen-Insurance-45969078.ics"
      },
      {
        "section": "Past",
        "dateTimeRaw": "20/02/2024 10:00 am",
        "dateTimeISO": "2024-02-20T04:30:00.000Z",
        "title": "Antique Build India New India Conference - SBI Pension",
        "icsUrl": "https://in.marketscreener.com/api/stateful/agenda/event-async/Antique-Build-India-New-India-Conference-SBI-Pension-45969077.ics"
      },
      {
        "section": "Past",
        "dateTimeRaw": "31/01/2024 05:09 pm",
        "dateTimeISO": "2024-01-31T11:39:00.000Z",
        "title": "Q3 2024 Earnings Release",
        "icsUrl": "https://in.marketscreener.com/api/stateful/agenda/event-async/Q3-2024-Earnings-Release-42836080.ics"
      },
      {
        "section": "Past",
        "dateTimeRaw": "31/01/2024 05:00 pm",
        "dateTimeISO": "2024-01-31T11:30:00.000Z",
        "title": "Q3 2024 Earnings Call",
        "icsUrl": "https://in.marketscreener.com/api/stateful/agenda/event-async/Q3-2024-Earnings-Call-45818739.ics"
      },
      {
        "section": "Past",
        "dateTimeRaw": "12/12/2023 06:00 pm",
        "dateTimeISO": "2023-12-12T12:30:00.000Z",
        "title": "Systematix Group Investor Conference",
        "icsUrl": "https://in.marketscreener.com/api/stateful/agenda/event-async/Systematix-Group-Investor-Conference-45528413.ics"
      },
      {
        "section": "Past",
        "dateTimeRaw": "29/11/2023 09:00 am",
        "dateTimeISO": "2023-11-29T03:30:00.000Z",
        "title": "CITIC CLSA India Forum",
        "icsUrl": "https://in.marketscreener.com/api/stateful/agenda/event-async/CITIC-CLSA-India-Forum-45390351.ics"
      },
      {
        "section": "Past",
        "dateTimeRaw": "23/11/2023 01:30 pm",
        "dateTimeISO": "2023-11-23T08:00:00.000Z",
        "title": "Investor Meeting - ICICI Prudential MF",
        "icsUrl": "https://in.marketscreener.com/api/stateful/agenda/event-async/Investor-Meeting-ICICI-Prudential-MF-45413679.ics"
      },
      {
        "section": "Past",
        "dateTimeRaw": "23/11/2023 10:30 am",
        "dateTimeISO": "2023-11-23T05:00:00.000Z",
        "title": "Investor Meeting - Nippon India MF",
        "icsUrl": "https://in.marketscreener.com/api/stateful/agenda/event-async/Investor-Meeting-Nippon-India-MF-45413678.ics"
      },
      {
        "section": "Past",
        "dateTimeRaw": "23/11/2023 09:00 am",
        "dateTimeISO": "2023-11-23T03:30:00.000Z",
        "title": "Investor Meeting - 3P India Fund",
        "icsUrl": "https://in.marketscreener.com/api/stateful/agenda/event-async/Investor-Meeting-3P-India-Fund-45413677.ics"
      },
      {
        "section": "Past",
        "dateTimeRaw": "22/11/2023",
        "dateTimeISO": "2023-11-21T18:30:00.000Z",
        "title": "JM Financial India Conference",
        "icsUrl": "https://in.marketscreener.com/api/stateful/agenda/event-async/JM-Financial-India-Conference-45390343.ics"
      },
      {
        "section": "Past",
        "dateTimeRaw": "31/10/2023 05:30 pm",
        "dateTimeISO": "2023-10-31T12:00:00.000Z",
        "title": "Q2 2024 Earnings Call",
        "icsUrl": "https://in.marketscreener.com/api/stateful/agenda/event-async/Q2-2024-Earnings-Call-45318399.ics"
      },
      {
        "section": "Past",
        "dateTimeRaw": "31/10/2023 05:07 pm",
        "dateTimeISO": "2023-10-31T11:37:00.000Z",
        "title": "Q2 2024 Earnings Release",
        "icsUrl": "https://in.marketscreener.com/api/stateful/agenda/event-async/Q2-2024-Earnings-Release-42140806.ics"
      },
      {
        "section": "Past",
        "dateTimeRaw": "25/09/2023 09:00 am",
        "dateTimeISO": "2023-09-25T03:30:00.000Z",
        "title": "J.P. Morgan India Investor Summit",
        "icsUrl": "https://in.marketscreener.com/api/stateful/agenda/event-async/J-P-Morgan-India-Investor-Summit-44857743.ics"
      },
      {
        "section": "Past",
        "dateTimeRaw": "06/09/2023",
        "dateTimeISO": "2023-09-05T18:30:00.000Z",
        "title": "Investor Meeting - GIC",
        "icsUrl": "https://in.marketscreener.com/api/stateful/agenda/event-async/Investor-Meeting-GIC-44768788.ics"
      },
      {
        "section": "Past",
        "dateTimeRaw": "05/09/2023 01:00 pm",
        "dateTimeISO": "2023-09-05T07:30:00.000Z",
        "title": "Investor Meeting - Sundaram Mutual Fund",
        "icsUrl": "https://in.marketscreener.com/api/stateful/agenda/event-async/Investor-Meeting-Sundaram-Mutual-Fund-44759177.ics"
      },
      {
        "section": "Past",
        "dateTimeRaw": "28/08/2023 11:00 am",
        "dateTimeISO": "2023-08-28T05:30:00.000Z",
        "title": "Annual General Meeting",
        "icsUrl": "https://in.marketscreener.com/api/stateful/agenda/event-async/Annual-General-Meeting-44543365.ics"
      },
      {
        "section": "Past",
        "dateTimeRaw": "28/08/2023",
        "dateTimeISO": "2023-08-27T18:30:00.000Z",
        "title": "Investor Meeting - Torq Capital",
        "icsUrl": "https://in.marketscreener.com/api/stateful/agenda/event-async/Investor-Meeting-Torq-Capital-44685227.ics"
      },
      {
        "section": "Past",
        "dateTimeRaw": "23/08/2023",
        "dateTimeISO": "2023-08-22T18:30:00.000Z",
        "title": "Investor Meeting - Nippon India MF",
        "icsUrl": "https://in.marketscreener.com/api/stateful/agenda/event-async/Investor-Meeting-Nippon-India-MF-44654116.ics"
      },
      {
        "section": "Past",
        "dateTimeRaw": "23/08/2023",
        "dateTimeISO": "2023-08-22T18:30:00.000Z",
        "title": "Investor Meeting - Capital Group",
        "icsUrl": "https://in.marketscreener.com/api/stateful/agenda/event-async/Investor-Meeting-Capital-Group-44654115.ics"
      },
      {
        "section": "Past",
        "dateTimeRaw": "22/08/2023",
        "dateTimeISO": "2023-08-21T18:30:00.000Z",
        "title": "Motilal Oswal Global Investor Conference",
        "icsUrl": "https://in.marketscreener.com/api/stateful/agenda/event-async/Motilal-Oswal-Global-Investor-Conference-44646047.ics"
      },
      {
        "section": "Past",
        "dateTimeRaw": "18/08/2023",
        "dateTimeISO": "2023-08-17T18:30:00.000Z",
        "title": "Ex-dividend day for final dividend",
        "icsUrl": "https://in.marketscreener.com/api/stateful/agenda/event-async/Ex-dividend-day-for-final-dividend-44706300.ics"
      },
      {
        "section": "Past",
        "dateTimeRaw": "11/08/2023 05:15 pm",
        "dateTimeISO": "2023-08-11T11:45:00.000Z",
        "title": "Q1 2024 Earnings Call",
        "icsUrl": "https://in.marketscreener.com/api/stateful/agenda/event-async/Q1-2024-Earnings-Call-44572422.ics"
      },
      {
        "section": "Past",
        "dateTimeRaw": "11/08/2023 03:57 pm",
        "dateTimeISO": "2023-08-11T10:27:00.000Z",
        "title": "Q1 2024 Earnings Release",
        "icsUrl": "https://in.marketscreener.com/api/stateful/agenda/event-async/Q1-2024-Earnings-Release-40936753.ics"
      },
      {
        "section": "Past",
        "dateTimeRaw": "26/06/2023",
        "dateTimeISO": "2023-06-25T18:30:00.000Z",
        "title": "Investor Meeting - Balysny Asset Management",
        "icsUrl": "https://in.marketscreener.com/api/stateful/agenda/event-async/Investor-Meeting-Balysny-Asset-Management-44199709.ics"
      },
      {
        "section": "Past",
        "dateTimeRaw": "31/05/2023",
        "dateTimeISO": "2023-05-30T18:30:00.000Z",
        "title": "B&K Securities Institutional Conference",
        "icsUrl": "https://in.marketscreener.com/api/stateful/agenda/event-async/B-K-Securities-Institutional-Conference-44008226.ics"
      },
      {
        "section": "Past",
        "dateTimeRaw": "30/05/2023",
        "dateTimeISO": "2023-05-29T18:30:00.000Z",
        "title": "Investor Meeting - HDFC Life",
        "icsUrl": "https://in.marketscreener.com/api/stateful/agenda/event-async/Investor-Meeting-HDFC-Life-44008223.ics"
      },
      {
        "section": "Past",
        "dateTimeRaw": "30/05/2023",
        "dateTimeISO": "2023-05-29T18:30:00.000Z",
        "title": "Investor Meeting - ICICI Prudential AMC",
        "icsUrl": "https://in.marketscreener.com/api/stateful/agenda/event-async/Investor-Meeting-ICICI-Prudential-AMC-44008222.ics"
      },
      {
        "section": "Past",
        "dateTimeRaw": "16/05/2023 05:57 pm",
        "dateTimeISO": "2023-05-16T12:27:00.000Z",
        "title": "Q4 2023 Earnings Release",
        "icsUrl": "https://in.marketscreener.com/api/stateful/agenda/event-async/Q4-2023-Earnings-Release-40502957.ics"
      },
      {
        "section": "Past",
        "dateTimeRaw": "16/05/2023 05:30 pm",
        "dateTimeISO": "2023-05-16T12:00:00.000Z",
        "title": "Q4 2023 Earnings Call",
        "icsUrl": "https://in.marketscreener.com/api/stateful/agenda/event-async/Q4-2023-Earnings-Call-43895571.ics"
      },
      {
        "section": "Past",
        "dateTimeRaw": "21/02/2023",
        "dateTimeISO": "2023-02-20T18:30:00.000Z",
        "title": "Kotak Chasing Growth Conference",
        "icsUrl": "https://in.marketscreener.com/api/stateful/agenda/event-async/Kotak-Chasing-Growth-Conference-42961382.ics"
      },
      {
        "section": "Past",
        "dateTimeRaw": "15/02/2023",
        "dateTimeISO": "2023-02-14T18:30:00.000Z",
        "title": "IIFL Securities Enterprising India Conference",
        "icsUrl": "https://in.marketscreener.com/api/stateful/agenda/event-async/IIFL-Securities-Enterprising-India-Conference-42961333.ics"
      },
      {
        "section": "Past",
        "dateTimeRaw": "10/02/2023",
        "dateTimeISO": "2023-02-09T18:30:00.000Z",
        "title": "Nuvama India Conference",
        "icsUrl": "https://in.marketscreener.com/api/stateful/agenda/event-async/Nuvama-India-Conference-42961277.ics"
      },
      {
        "section": "Past",
        "dateTimeRaw": "09/02/2023",
        "dateTimeISO": "2023-02-08T18:30:00.000Z",
        "title": "Axis Capital India Conference",
        "icsUrl": "https://in.marketscreener.com/api/stateful/agenda/event-async/Axis-Capital-India-Conference-42961255.ics"
      },
      {
        "section": "Past",
        "dateTimeRaw": "08/02/2023",
        "dateTimeISO": "2023-02-07T18:30:00.000Z",
        "title": "Antique Build India Investor Conference",
        "icsUrl": "https://in.marketscreener.com/api/stateful/agenda/event-async/Antique-Build-India-Investor-Conference-42961234.ics"
      },
      {
        "section": "Past",
        "dateTimeRaw": "31/01/2023 05:30 pm",
        "dateTimeISO": "2023-01-31T12:00:00.000Z",
        "title": "Q3 2023 Earnings Call",
        "icsUrl": "https://in.marketscreener.com/api/stateful/agenda/event-async/Q3-2023-Earnings-Call-42835760.ics"
      },
      {
        "section": "Past",
        "dateTimeRaw": "31/01/2023 04:39 pm",
        "dateTimeISO": "2023-01-31T11:09:00.000Z",
        "title": "Q3 2023 Earnings Release",
        "icsUrl": "https://in.marketscreener.com/api/stateful/agenda/event-async/Q3-2023-Earnings-Release-37614913.ics"
      },
      {
        "section": "Past",
        "dateTimeRaw": "14/12/2022",
        "dateTimeISO": "2022-12-13T18:30:00.000Z",
        "title": "Investor Meeting - Invesco MF",
        "icsUrl": "https://in.marketscreener.com/api/stateful/agenda/event-async/Investor-Meeting-Invesco-MF-42570671.ics"
      },
      {
        "section": "Past",
        "dateTimeRaw": "10/11/2022 05:30 pm",
        "dateTimeISO": "2022-11-10T12:00:00.000Z",
        "title": "Interim 2023 Earnings Call",
        "icsUrl": "https://in.marketscreener.com/api/stateful/agenda/event-async/Interim-2023-Earnings-Call-42291637.ics"
      },
      {
        "section": "Past",
        "dateTimeRaw": "10/11/2022 04:48 pm",
        "dateTimeISO": "2022-11-10T11:18:00.000Z",
        "title": "Interim 2023 Earnings Release",
        "icsUrl": "https://in.marketscreener.com/api/stateful/agenda/event-async/Interim-2023-Earnings-Release-36838199.ics"
      },
      {
        "section": "Past",
        "dateTimeRaw": "07/10/2022",
        "dateTimeISO": "2022-10-06T18:30:00.000Z",
        "title": "Investor Meeting",
        "icsUrl": "https://in.marketscreener.com/api/stateful/agenda/event-async/Investor-Meeting-41956912.ics"
      },
      {
        "section": "Past",
        "dateTimeRaw": "06/10/2022",
        "dateTimeISO": "2022-10-05T18:30:00.000Z",
        "title": "Investor Meeting",
        "icsUrl": "https://in.marketscreener.com/api/stateful/agenda/event-async/Investor-Meeting-41956904.ics"
      },
      {
        "section": "Past",
        "dateTimeRaw": "30/09/2022 11:00 am",
        "dateTimeISO": "2022-09-30T05:30:00.000Z",
        "title": "Annual General Meeting",
        "icsUrl": "https://in.marketscreener.com/api/stateful/agenda/event-async/Annual-General-Meeting-41686600.ics"
      },
      {
        "section": "Past",
        "dateTimeRaw": "21/09/2022",
        "dateTimeISO": "2022-09-20T18:30:00.000Z",
        "title": "JP Morgan India Investor Summit",
        "icsUrl": "https://in.marketscreener.com/api/stateful/agenda/event-async/JP-Morgan-India-Investor-Summit-41852086.ics"
      },
      {
        "section": "Past",
        "dateTimeRaw": "20/09/2022",
        "dateTimeISO": "2022-09-19T18:30:00.000Z",
        "title": "Ex-dividend day for final dividend",
        "icsUrl": "https://in.marketscreener.com/api/stateful/agenda/event-async/Ex-dividend-day-for-final-dividend-41693221.ics"
      },
      {
        "section": "Past",
        "dateTimeRaw": "19/09/2022",
        "dateTimeISO": "2022-09-18T18:30:00.000Z",
        "title": "Motilal Oswal Global Investor Conference",
        "icsUrl": "https://in.marketscreener.com/api/stateful/agenda/event-async/Motilal-Oswal-Global-Investor-Conference-41852040.ics"
      },
      {
        "section": "Past",
        "dateTimeRaw": "09/09/2022",
        "dateTimeISO": "2022-09-08T18:30:00.000Z",
        "title": "Ashwamedh Elara India Dialogue Conference",
        "icsUrl": "https://in.marketscreener.com/api/stateful/agenda/event-async/Ashwamedh-Elara-India-Dialogue-Conference-41739051.ics"
      },
      {
        "section": "Past",
        "dateTimeRaw": "08/09/2022",
        "dateTimeISO": "2022-09-07T18:30:00.000Z",
        "title": "ENAnnual meeting for shareholders Holdings Conference",
        "icsUrl": "https://in.marketscreener.com/api/stateful/agenda/event-async/ENAnnual-meeting-for-shareholders-Holdings-Conference-41739042.ics"
      },
      {
        "section": "Past",
        "dateTimeRaw": "08/09/2022",
        "dateTimeISO": "2022-09-07T18:30:00.000Z",
        "title": "ICICI Prudential Annual meeting for shareholdersC Conference",
        "icsUrl": "https://in.marketscreener.com/api/stateful/agenda/event-async/ICICI-Prudential-Annual-meeting-for-shareholdersC-Conference-41739041.ics"
      },
      {
        "section": "Past",
        "dateTimeRaw": "07/09/2022",
        "dateTimeISO": "2022-09-06T18:30:00.000Z",
        "title": "Spark Capital Investor Conference",
        "icsUrl": "https://in.marketscreener.com/api/stateful/agenda/event-async/Spark-Capital-Investor-Conference-41739010.ics"
      },
      {
        "section": "Past",
        "dateTimeRaw": "15/07/2022 05:33 pm",
        "dateTimeISO": "2022-07-15T12:03:00.000Z",
        "title": "Q1 2023 Earnings Release",
        "icsUrl": "https://in.marketscreener.com/api/stateful/agenda/event-async/Q1-2023-Earnings-Release-36100923.ics"
      },
      {
        "section": "Past",
        "dateTimeRaw": "15/07/2022 05:30 pm",
        "dateTimeISO": "2022-07-15T12:00:00.000Z",
        "title": "Q1 2023 Earnings Call",
        "icsUrl": "https://in.marketscreener.com/api/stateful/agenda/event-async/Q1-2023-Earnings-Call-41001539.ics"
      },
      {
        "section": "Past",
        "dateTimeRaw": "03/06/2022",
        "dateTimeISO": "2022-06-02T18:30:00.000Z",
        "title": "B & K Securities Conference",
        "icsUrl": "https://in.marketscreener.com/api/stateful/agenda/event-async/B-K-Securities-Conference-40639904.ics"
      },
      {
        "section": "Past",
        "dateTimeRaw": "31/05/2022 12:00 pm",
        "dateTimeISO": "2022-05-31T06:30:00.000Z",
        "title": "FY 2022 Earnings Call",
        "icsUrl": "https://in.marketscreener.com/api/stateful/agenda/event-async/FY-2022-Earnings-Call-40639857.ics"
      },
      {
        "section": "Past",
        "dateTimeRaw": "30/05/2022 07:36 pm",
        "dateTimeISO": "2022-05-30T14:06:00.000Z",
        "title": "FY 2022 Earnings Release",
        "icsUrl": "https://in.marketscreener.com/api/stateful/agenda/event-async/FY-2022-Earnings-Release-33199528.ics"
      },
      {
        "section": "Past",
        "dateTimeRaw": "04/04/2022",
        "dateTimeISO": "2022-04-03T18:30:00.000Z",
        "title": "Centrum Conference",
        "icsUrl": "https://in.marketscreener.com/api/stateful/agenda/event-async/Centrum-Conference-40009497.ics"
      },
      {
        "section": "Past",
        "dateTimeRaw": "28/03/2022 11:00 am",
        "dateTimeISO": "2022-03-28T05:30:00.000Z",
        "title": "Extraordinary Shareholders Meeting",
        "icsUrl": "https://in.marketscreener.com/api/stateful/agenda/event-async/Extraordinary-Shareholders-Meeting-39741224.ics"
      },
      {
        "section": "Past",
        "dateTimeRaw": "16/03/2022",
        "dateTimeISO": "2022-03-15T18:30:00.000Z",
        "title": "Ex-dividend day for dividende intermdiaire",
        "icsUrl": "https://in.marketscreener.com/api/stateful/agenda/event-async/Ex-dividend-day-for-dividende-intermediaire-39749815.ics"
      },
      {
        "section": "Past",
        "dateTimeRaw": "15/03/2022",
        "dateTimeISO": "2022-03-14T18:30:00.000Z",
        "title": "Investor Meeting",
        "icsUrl": "https://in.marketscreener.com/api/stateful/agenda/event-async/Investor-Meeting-39870300.ics"
      },
      {
        "section": "Past",
        "dateTimeRaw": "10/03/2022 03:13 pm",
        "dateTimeISO": "2022-03-10T09:43:00.000Z",
        "title": "February 2022 Sales and Revenue Release - Production Results",
        "icsUrl": "https://in.marketscreener.com/api/stateful/agenda/event-async/February-2022-Sales-and-Revenue-Release-Production-Results-39741070.ics"
      },
      {
        "section": "Past",
        "dateTimeRaw": "23/02/2022",
        "dateTimeISO": "2022-02-22T18:30:00.000Z",
        "title": "Kotak Conference",
        "icsUrl": "https://in.marketscreener.com/api/stateful/agenda/event-async/Kotak-Conference-39672323.ics"
      },
      {
        "section": "Past",
        "dateTimeRaw": "14/02/2022",
        "dateTimeISO": "2022-02-13T18:30:00.000Z",
        "title": "Investor Meeting",
        "icsUrl": "https://in.marketscreener.com/api/stateful/agenda/event-async/Investor-Meeting-39522087.ics"
      },
      {
        "section": "Past",
        "dateTimeRaw": "11/02/2022",
        "dateTimeISO": "2022-02-10T18:30:00.000Z",
        "title": "Antique Investor Conference",
        "icsUrl": "https://in.marketscreener.com/api/stateful/agenda/event-async/Antique-Investor-Conference-38148525.ics"
      },
      {
        "section": "Past",
        "dateTimeRaw": "10/02/2022",
        "dateTimeISO": "2022-02-09T18:30:00.000Z",
        "title": "Edelweiss India Conference",
        "icsUrl": "https://in.marketscreener.com/api/stateful/agenda/event-async/Edelweiss-India-Conference-38148491.ics"
      },
      {
        "section": "Past",
        "dateTimeRaw": "09/02/2022 02:45 pm",
        "dateTimeISO": "2022-02-09T09:15:00.000Z",
        "title": "Q3 2022 Earnings Call",
        "icsUrl": "https://in.marketscreener.com/api/stateful/agenda/event-async/Q3-2022-Earnings-Call-38148423.ics"
      },
      {
        "section": "Past",
        "dateTimeRaw": "08/02/2022 03:49 pm",
        "dateTimeISO": "2022-02-08T10:19:00.000Z",
        "title": "Q3 2022 Earnings Release",
        "icsUrl": "https://in.marketscreener.com/api/stateful/agenda/event-async/Q3-2022-Earnings-Release-32211021.ics"
      },
      {
        "section": "Past",
        "dateTimeRaw": "22/12/2021",
        "dateTimeISO": "2021-12-21T18:30:00.000Z",
        "title": "Investor Meeting - Investec - Fireside Chat",
        "icsUrl": "https://in.marketscreener.com/api/stateful/agenda/event-async/Investor-Meeting-Investec-Fireside-Chat-37417630.ics"
      },
      {
        "section": "Past",
        "dateTimeRaw": "18/11/2021",
        "dateTimeISO": "2021-11-17T18:30:00.000Z",
        "title": "Centrum Investor Conference",
        "icsUrl": "https://in.marketscreener.com/api/stateful/agenda/event-async/Centrum-Investor-Conference-37090104.ics"
      },
      {
        "section": "Past",
        "dateTimeRaw": "18/11/2021",
        "dateTimeISO": "2021-11-17T18:30:00.000Z",
        "title": "Morgan Stanley Asia Pacific Summit",
        "icsUrl": "https://in.marketscreener.com/api/stateful/agenda/event-async/Morgan-Stanley-Asia-Pacific-Summit-37090102.ics"
      },
      {
        "section": "Past",
        "dateTimeRaw": "17/11/2021",
        "dateTimeISO": "2021-11-16T18:30:00.000Z",
        "title": "CITIC CLSA India Forum",
        "icsUrl": "https://in.marketscreener.com/api/stateful/agenda/event-async/CITIC-CLSA-India-Forum-37090086.ics"
      },
      {
        "section": "Past",
        "dateTimeRaw": "02/11/2021 05:00 pm",
        "dateTimeISO": "2021-11-02T11:30:00.000Z",
        "title": "Interim 2022 Earnings Call",
        "icsUrl": "https://in.marketscreener.com/api/stateful/agenda/event-async/Interim-2022-Earnings-Call-36922385.ics"
      },
      {
        "section": "Past",
        "dateTimeRaw": "02/11/2021 02:11 pm",
        "dateTimeISO": "2021-11-02T08:41:00.000Z",
        "title": "Interim 2022 Earnings Release",
        "icsUrl": "https://in.marketscreener.com/api/stateful/agenda/event-async/Interim-2022-Earnings-Release-31657496.ics"
      },
      {
        "section": "Past",
        "dateTimeRaw": "22/10/2021",
        "dateTimeISO": "2021-10-21T18:30:00.000Z",
        "title": "Investor Meeting - Capital World Investors",
        "icsUrl": "https://in.marketscreener.com/api/stateful/agenda/event-async/Investor-Meeting-Capital-World-Investors-36761984.ics"
      },
      {
        "section": "Past",
        "dateTimeRaw": "30/09/2021 11:00 am",
        "dateTimeISO": "2021-09-30T05:30:00.000Z",
        "title": "Annual General Meeting",
        "icsUrl": "https://in.marketscreener.com/api/stateful/agenda/event-async/Annual-General-Meeting-36401386.ics"
      },
      {
        "section": "Past",
        "dateTimeRaw": "23/09/2021",
        "dateTimeISO": "2021-09-22T18:30:00.000Z",
        "title": "Investor Meeting - Fidelity Management & Research",
        "icsUrl": "https://in.marketscreener.com/api/stateful/agenda/event-async/Investor-Meeting-Fidelity-Management-Research-36517449.ics"
      },
      {
        "section": "Past",
        "dateTimeRaw": "21/09/2021",
        "dateTimeISO": "2021-09-20T18:30:00.000Z",
        "title": "Phillip Capital Resurgent India Virtual Conference",
        "icsUrl": "https://in.marketscreener.com/api/stateful/agenda/event-async/Phillip-Capital-Resurgent-India-Virtual-Conference-36517424.ics"
      },
      {
        "section": "Past",
        "dateTimeRaw": "14/09/2021",
        "dateTimeISO": "2021-09-13T18:30:00.000Z",
        "title": "Motilal Oswal Global Investor Conference",
        "icsUrl": "https://in.marketscreener.com/api/stateful/agenda/event-async/Motilal-Oswal-Global-Investor-Conference-36401215.ics"
      },
      {
        "section": "Past",
        "dateTimeRaw": "09/09/2021",
        "dateTimeISO": "2021-09-08T18:30:00.000Z",
        "title": "Ashwamedh - Elara India Dialogue",
        "icsUrl": "https://in.marketscreener.com/api/stateful/agenda/event-async/Ashwamedh-Elara-India-Dialogue-36401129.ics"
      },
      {
        "section": "Past",
        "dateTimeRaw": "03/09/2021 11:00 am",
        "dateTimeISO": "2021-09-03T05:30:00.000Z",
        "title": "Extraordinary Shareholders Meeting",
        "icsUrl": "https://in.marketscreener.com/api/stateful/agenda/event-async/Extraordinary-Shareholders-Meeting-36322702.ics"
      },
      {
        "section": "Past",
        "dateTimeRaw": "10/08/2021 05:30 pm",
        "dateTimeISO": "2021-08-10T12:00:00.000Z",
        "title": "Q1 2022 Earnings Call",
        "icsUrl": "https://in.marketscreener.com/api/stateful/agenda/event-async/Q1-2022-Earnings-Call-36322269.ics"
      },
      {
        "section": "Past",
        "dateTimeRaw": "10/08/2021 02:14 pm",
        "dateTimeISO": "2021-08-10T08:44:00.000Z",
        "title": "Q1 2022 Earnings Release",
        "icsUrl": "https://in.marketscreener.com/api/stateful/agenda/event-async/Q1-2022-Earnings-Release-30946380.ics"
      },
      {
        "section": "Past",
        "dateTimeRaw": "24/05/2021 11:30 am",
        "dateTimeISO": "2021-05-24T06:00:00.000Z",
        "title": "Extraordinary Shareholders Meeting",
        "icsUrl": "https://in.marketscreener.com/api/stateful/agenda/event-async/Extraordinary-Shareholders-Meeting-33326244.ics"
      },
      {
        "section": "Past",
        "dateTimeRaw": "13/05/2021 12:00 pm",
        "dateTimeISO": "2021-05-13T06:30:00.000Z",
        "title": "FY 2021 Earnings Call",
        "icsUrl": "https://in.marketscreener.com/api/stateful/agenda/event-async/FY-2021-Earnings-Call-33265511.ics"
      },
      {
        "section": "Past",
        "dateTimeRaw": "12/05/2021",
        "dateTimeISO": "2021-05-11T18:30:00.000Z",
        "title": "FY 2021 Earnings Release",
        "icsUrl": "https://in.marketscreener.com/api/stateful/agenda/event-async/FY-2021-Earnings-Release-30946247.ics"
      },
      {
        "section": "Past",
        "dateTimeRaw": "22/01/2021 12:00 pm",
        "dateTimeISO": "2021-01-22T06:30:00.000Z",
        "title": "Q3 2021 Earnings Call",
        "icsUrl": "https://in.marketscreener.com/api/stateful/agenda/event-async/Q3-2021-Earnings-Call-32258578.ics"
      },
      {
        "section": "Past",
        "dateTimeRaw": "21/01/2021",
        "dateTimeISO": "2021-01-20T18:30:00.000Z",
        "title": "Q3 2021 Earnings Release",
        "icsUrl": "https://in.marketscreener.com/api/stateful/agenda/event-async/Q3-2021-Earnings-Release-29892029.ics"
      },
      {
        "section": "Past",
        "dateTimeRaw": "30/10/2020",
        "dateTimeISO": "2020-10-29T18:30:00.000Z",
        "title": "Interim 2021 Earnings Release",
        "icsUrl": "https://in.marketscreener.com/api/stateful/agenda/event-async/Interim-2021-Earnings-Release-29462743.ics"
      },
      {
        "section": "Past",
        "dateTimeRaw": "28/07/2020 10:30 am",
        "dateTimeISO": "2020-07-28T05:00:00.000Z",
        "title": "Extraordinary General Meeting",
        "icsUrl": "https://in.marketscreener.com/api/stateful/agenda/event-async/Extraordinary-General-Meeting-30910383.ics"
      },
      {
        "section": "Past",
        "dateTimeRaw": "23/07/2020 12:00 pm",
        "dateTimeISO": "2020-07-23T06:30:00.000Z",
        "title": "Q1 2021 Earnings Call",
        "icsUrl": "https://in.marketscreener.com/api/stateful/agenda/event-async/Q1-2021-Earnings-Call-30987243.ics"
      },
      {
        "section": "Past",
        "dateTimeRaw": "22/07/2020",
        "dateTimeISO": "2020-07-21T18:30:00.000Z",
        "title": "Q1 2021 Earnings Release",
        "icsUrl": "https://in.marketscreener.com/api/stateful/agenda/event-async/Q1-2021-Earnings-Release-29048087.ics"
      },
      {
        "section": "Past",
        "dateTimeRaw": "25/05/2020",
        "dateTimeISO": "2020-05-24T18:30:00.000Z",
        "title": "FY 2020 Earnings Release",
        "icsUrl": "https://in.marketscreener.com/api/stateful/agenda/event-async/FY-2020-Earnings-Release-27956467.ics"
      },
      {
        "section": "Past",
        "dateTimeRaw": "20/01/2020 12:00 pm",
        "dateTimeISO": "2020-01-20T06:30:00.000Z",
        "title": "Q3 2020 Earnings Call",
        "icsUrl": "https://in.marketscreener.com/api/stateful/agenda/event-async/Q3-2020-Earnings-Call-29889124.ics"
      },
      {
        "section": "Past",
        "dateTimeRaw": "18/01/2020",
        "dateTimeISO": "2020-01-17T18:30:00.000Z",
        "title": "Q3 2020 Earnings Release",
        "icsUrl": "https://in.marketscreener.com/api/stateful/agenda/event-async/Q3-2020-Earnings-Release-27956389.ics"
      },
      {
        "section": "Past",
        "dateTimeRaw": "06/11/2019 12:00 pm",
        "dateTimeISO": "2019-11-06T06:30:00.000Z",
        "title": "Interim 2020 Earnings Call",
        "icsUrl": "https://in.marketscreener.com/api/stateful/agenda/event-async/Interim-2020-Earnings-Call-29548214.ics"
      },
      {
        "section": "Past",
        "dateTimeRaw": "05/11/2019",
        "dateTimeISO": "2019-11-04T18:30:00.000Z",
        "title": "Interim 2020 Earnings Release",
        "icsUrl": "https://in.marketscreener.com/api/stateful/agenda/event-async/Interim-2020-Earnings-Release-27956247.ics"
      },
      {
        "section": "Past",
        "dateTimeRaw": "27/09/2019 11:30 am",
        "dateTimeISO": "2019-09-27T06:00:00.000Z",
        "title": "Annual General Meeting",
        "icsUrl": "https://in.marketscreener.com/api/stateful/agenda/event-async/Annual-General-Meeting-29173202.ics"
      },
      {
        "section": "Past",
        "dateTimeRaw": "16/08/2019 11:00 am",
        "dateTimeISO": "2019-08-16T05:30:00.000Z",
        "title": "Q1 2020 Earnings Call",
        "icsUrl": "https://in.marketscreener.com/api/stateful/agenda/event-async/Q1-2020-Earnings-Call-29079210.ics"
      },
      {
        "section": "Past",
        "dateTimeRaw": "14/08/2019",
        "dateTimeISO": "2019-08-13T18:30:00.000Z",
        "title": "Q1 2020 Earnings Release",
        "icsUrl": "https://in.marketscreener.com/api/stateful/agenda/event-async/Q1-2020-Earnings-Release-26524043.ics"
      },
      {
        "section": "Past",
        "dateTimeRaw": "04/06/2019",
        "dateTimeISO": "2019-06-03T18:30:00.000Z",
        "title": "Citi India Investor Conference",
        "icsUrl": "https://in.marketscreener.com/api/stateful/agenda/event-async/Citi-India-Investor-Conference-28657433.ics"
      },
      {
        "section": "Past",
        "dateTimeRaw": "22/05/2019 12:00 pm",
        "dateTimeISO": "2019-05-22T06:30:00.000Z",
        "title": "FY 2019 Earnings Call",
        "icsUrl": "https://in.marketscreener.com/api/stateful/agenda/event-async/FY-2019-Earnings-Call-28656307.ics"
      },
      {
        "section": "Past",
        "dateTimeRaw": "21/05/2019",
        "dateTimeISO": "2019-05-20T18:30:00.000Z",
        "title": "FY 2019 Earnings Release",
        "icsUrl": "https://in.marketscreener.com/api/stateful/agenda/event-async/FY-2019-Earnings-Release-26523781.ics"
      },
      {
        "section": "Past",
        "dateTimeRaw": "04/02/2019 12:00 pm",
        "dateTimeISO": "2019-02-04T06:30:00.000Z",
        "title": "Q3 2019 Earnings Call",
        "icsUrl": "https://in.marketscreener.com/api/stateful/agenda/event-async/Q3-2019-Earnings-Call-27985832.ics"
      },
      {
        "section": "Past",
        "dateTimeRaw": "02/02/2019",
        "dateTimeISO": "2019-02-01T18:30:00.000Z",
        "title": "Q3 2019 Earnings Release",
        "icsUrl": "https://in.marketscreener.com/api/stateful/agenda/event-async/Q3-2019-Earnings-Release-26502658.ics"
      },
      {
        "section": "Past",
        "dateTimeRaw": "14/11/2018 01:00 pm",
        "dateTimeISO": "2018-11-14T07:30:00.000Z",
        "title": "Interim 2019 Earnings Call",
        "icsUrl": "https://in.marketscreener.com/api/stateful/agenda/event-async/Interim-2019-Earnings-Call-27622823.ics"
      },
      {
        "section": "Past",
        "dateTimeRaw": "13/11/2018",
        "dateTimeISO": "2018-11-12T18:30:00.000Z",
        "title": "Interim 2019 Earnings Release",
        "icsUrl": "https://in.marketscreener.com/api/stateful/agenda/event-async/Interim-2019-Earnings-Release-26501031.ics"
      },
      {
        "section": "Past",
        "dateTimeRaw": "28/09/2018 11:30 am",
        "dateTimeISO": "2018-09-28T06:00:00.000Z",
        "title": "Annual General Meeting",
        "icsUrl": "https://in.marketscreener.com/api/stateful/agenda/event-async/Annual-General-Meeting-27231295.ics"
      },
      {
        "section": "Past",
        "dateTimeRaw": "10/08/2018 12:00 pm",
        "dateTimeISO": "2018-08-10T06:30:00.000Z",
        "title": "Q1 2019 Earnings Call",
        "icsUrl": "https://in.marketscreener.com/api/stateful/agenda/event-async/Q1-2019-Earnings-Call-27097941.ics"
      },
      {
        "section": "Past",
        "dateTimeRaw": "09/08/2018",
        "dateTimeISO": "2018-08-08T18:30:00.000Z",
        "title": "Q1 2019 Earnings Release",
        "icsUrl": "https://in.marketscreener.com/api/stateful/agenda/event-async/Q1-2019-Earnings-Release-26496539.ics"
      },
      {
        "section": "Past",
        "dateTimeRaw": "10/05/2018 11:00 am",
        "dateTimeISO": "2018-05-10T05:30:00.000Z",
        "title": "FY 2018 Earnings Call",
        "icsUrl": "https://in.marketscreener.com/api/stateful/agenda/event-async/FY-2018-Earnings-Call-26570716.ics"
      },
      {
        "section": "Past",
        "dateTimeRaw": "09/05/2018",
        "dateTimeISO": "2018-05-08T18:30:00.000Z",
        "title": "FY 2018 Earnings Release",
        "icsUrl": "https://in.marketscreener.com/api/stateful/agenda/event-async/FY-2018-Earnings-Release-26475325.ics"
      },
      {
        "section": "Past",
        "dateTimeRaw": "29/01/2018 11:00 am",
        "dateTimeISO": "2018-01-29T05:30:00.000Z",
        "title": "Q3 2018 Earnings Call",
        "icsUrl": "https://in.marketscreener.com/api/stateful/agenda/event-async/Q3-2018-Earnings-Call-25881054.ics"
      },
      {
        "section": "Past",
        "dateTimeRaw": "25/01/2018",
        "dateTimeISO": "2018-01-24T18:30:00.000Z",
        "title": "Q3 2018 Earnings Release",
        "icsUrl": "https://in.marketscreener.com/api/stateful/agenda/event-async/Q3-2018-Earnings-Release-23860393.ics"
      },
      {
        "section": "Past",
        "dateTimeRaw": "10/11/2017 03:30 pm",
        "dateTimeISO": "2017-11-10T10:00:00.000Z",
        "title": "Interim 2018 Earnings Call",
        "icsUrl": "https://in.marketscreener.com/api/stateful/agenda/event-async/Interim-2018-Earnings-Call-25486568.ics"
      },
      {
        "section": "Past",
        "dateTimeRaw": "09/11/2017",
        "dateTimeISO": "2017-11-08T18:30:00.000Z",
        "title": "Interim 2018 Earnings Release",
        "icsUrl": "https://in.marketscreener.com/api/stateful/agenda/event-async/Interim-2018-Earnings-Release-23859200.ics"
      },
      {
        "section": "Past",
        "dateTimeRaw": "22/09/2017 12:00 pm",
        "dateTimeISO": "2017-09-22T06:30:00.000Z",
        "title": "Annual General Meeting",
        "icsUrl": "https://in.marketscreener.com/api/stateful/agenda/event-async/Annual-General-Meeting-25165253.ics"
      },
      {
        "section": "Past",
        "dateTimeRaw": "09/08/2017 12:00 pm",
        "dateTimeISO": "2017-08-09T06:30:00.000Z",
        "title": "Q1 2018 Earnings Call",
        "icsUrl": "https://in.marketscreener.com/api/stateful/agenda/event-async/Q1-2018-Earnings-Call-24935379.ics"
      },
      {
        "section": "Past",
        "dateTimeRaw": "08/08/2017",
        "dateTimeISO": "2017-08-07T18:30:00.000Z",
        "title": "Q1 2018 Earnings Release",
        "icsUrl": "https://in.marketscreener.com/api/stateful/agenda/event-async/Q1-2018-Earnings-Release-22851891.ics"
      },
      {
        "section": "Past",
        "dateTimeRaw": "24/05/2017 10:00 am",
        "dateTimeISO": "2017-05-24T04:30:00.000Z",
        "title": "FY 2017 Earnings Call",
        "icsUrl": "https://in.marketscreener.com/api/stateful/agenda/event-async/FY-2017-Earnings-Call-24499214.ics"
      },
      {
        "section": "Past",
        "dateTimeRaw": "23/05/2017",
        "dateTimeISO": "2017-05-22T18:30:00.000Z",
        "title": "FY 2017 Earnings Release",
        "icsUrl": "https://in.marketscreener.com/api/stateful/agenda/event-async/FY-2017-Earnings-Release-22840548.ics"
      },
      {
        "section": "Past",
        "dateTimeRaw": "15/02/2017 11:00 am",
        "dateTimeISO": "2017-02-15T05:30:00.000Z",
        "title": "Q3 2017 Earnings Call",
        "icsUrl": "https://in.marketscreener.com/api/stateful/agenda/event-async/Q3-2017-Earnings-Call-23900125.ics"
      },
      {
        "section": "Past",
        "dateTimeRaw": "14/02/2017",
        "dateTimeISO": "2017-02-13T18:30:00.000Z",
        "title": "Q3 2017 Earnings Release",
        "icsUrl": "https://in.marketscreener.com/api/stateful/agenda/event-async/Q3-2017-Earnings-Release-22830578.ics"
      },
      {
        "section": "Past",
        "dateTimeRaw": "09/12/2016",
        "dateTimeISO": "2016-12-08T18:30:00.000Z",
        "title": "Interim 2017 Earnings Call",
        "icsUrl": "https://in.marketscreener.com/api/stateful/agenda/event-async/Interim-2017-Earnings-Call-23532400.ics"
      },
      {
        "section": "Past",
        "dateTimeRaw": "08/12/2016",
        "dateTimeISO": "2016-12-07T18:30:00.000Z",
        "title": "Interim 2017 Earnings Release",
        "icsUrl": "https://in.marketscreener.com/api/stateful/agenda/event-async/Interim-2017-Earnings-Release-23532370.ics"
      },
      {
        "section": "Past",
        "dateTimeRaw": "09/09/2016 03:30 pm",
        "dateTimeISO": "2016-09-09T10:00:00.000Z",
        "title": "Q1 2017 Earnings Call",
        "icsUrl": "https://in.marketscreener.com/api/stateful/agenda/event-async/Q1-2017-Earnings-Call-23036094.ics"
      },
      {
        "section": "Past",
        "dateTimeRaw": "08/09/2016",
        "dateTimeISO": "2016-09-07T18:30:00.000Z",
        "title": "Q1 2017 Earnings Release",
        "icsUrl": "https://in.marketscreener.com/api/stateful/agenda/event-async/Q1-2017-Earnings-Release-19720076.ics"
      },
      {
        "section": "Past",
        "dateTimeRaw": "01/08/2016 11:30 am",
        "dateTimeISO": "2016-08-01T06:00:00.000Z",
        "title": "Annual General Meeting",
        "icsUrl": "https://in.marketscreener.com/api/stateful/agenda/event-async/Annual-General-Meeting-22655022.ics"
      },
      {
        "section": "Past",
        "dateTimeRaw": "05/05/2016 03:30 pm",
        "dateTimeISO": "2016-05-05T10:00:00.000Z",
        "title": "FY 2016 Earnings Call",
        "icsUrl": "https://in.marketscreener.com/api/stateful/agenda/event-async/FY-2016-Earnings-Call-22315030.ics"
      },
      {
        "section": "Past",
        "dateTimeRaw": "04/05/2016",
        "dateTimeISO": "2016-05-03T18:30:00.000Z",
        "title": "FY 2016 Earnings Release",
        "icsUrl": "https://in.marketscreener.com/api/stateful/agenda/event-async/FY-2016-Earnings-Release-19716343.ics"
      },
      {
        "section": "Past",
        "dateTimeRaw": "24/02/2016",
        "dateTimeISO": "2016-02-23T18:30:00.000Z",
        "title": "Kotak Institutional Equities Chasing Growth Conference",
        "icsUrl": "https://in.marketscreener.com/api/stateful/agenda/event-async/Kotak-Institutional-Equities-Chasing-Growth-Conference-21925557.ics"
      },
      {
        "section": "Past",
        "dateTimeRaw": "15/02/2016 03:30 pm",
        "dateTimeISO": "2016-02-15T10:00:00.000Z",
        "title": "Q3 2016 Earnings Call",
        "icsUrl": "https://in.marketscreener.com/api/stateful/agenda/event-async/Q3-2016-Earnings-Call-21849706.ics"
      },
      {
        "section": "Past",
        "dateTimeRaw": "13/02/2016",
        "dateTimeISO": "2016-02-12T18:30:00.000Z",
        "title": "Q3 2016 Earnings Release",
        "icsUrl": "https://in.marketscreener.com/api/stateful/agenda/event-async/Q3-2016-Earnings-Release-19712645.ics"
      },
      {
        "section": "Past",
        "dateTimeRaw": "16/11/2015 03:00 pm",
        "dateTimeISO": "2015-11-16T09:30:00.000Z",
        "title": "Interim 2016 Earnings Call",
        "icsUrl": "https://in.marketscreener.com/api/stateful/agenda/event-async/Interim-2016-Earnings-Call-21409403.ics"
      },
      {
        "section": "Past",
        "dateTimeRaw": "14/11/2015",
        "dateTimeISO": "2015-11-13T18:30:00.000Z",
        "title": "Interim 2016 Earnings Release",
        "icsUrl": "https://in.marketscreener.com/api/stateful/agenda/event-async/Interim-2016-Earnings-Release-19177873.ics"
      },
      {
        "section": "Past",
        "dateTimeRaw": "18/09/2015 11:30 am",
        "dateTimeISO": "2015-09-18T06:00:00.000Z",
        "title": "Annual General Meeting",
        "icsUrl": "https://in.marketscreener.com/api/stateful/agenda/event-async/Annual-General-Meeting-21032571.ics"
      },
      {
        "section": "Past",
        "dateTimeRaw": "13/08/2015 03:30 pm",
        "dateTimeISO": "2015-08-13T10:00:00.000Z",
        "title": "Q1 2016 Earnings Call",
        "icsUrl": "https://in.marketscreener.com/api/stateful/agenda/event-async/Q1-2016-Earnings-Call-20869898.ics"
      },
      {
        "section": "Past",
        "dateTimeRaw": "12/08/2015",
        "dateTimeISO": "2015-08-11T18:30:00.000Z",
        "title": "Q1 2016 Earnings Release",
        "icsUrl": "https://in.marketscreener.com/api/stateful/agenda/event-async/Q1-2016-Earnings-Release-18723305.ics"
      },
      {
        "section": "Past",
        "dateTimeRaw": "28/05/2015 11:30 am",
        "dateTimeISO": "2015-05-28T06:00:00.000Z",
        "title": "FY 2015 Earnings Call",
        "icsUrl": "https://in.marketscreener.com/api/stateful/agenda/event-async/FY-2015-Earnings-Call-20462138.ics"
      },
      {
        "section": "Past",
        "dateTimeRaw": "27/05/2015",
        "dateTimeISO": "2015-05-26T18:30:00.000Z",
        "title": "FY 2015 Earnings Release",
        "icsUrl": "https://in.marketscreener.com/api/stateful/agenda/event-async/FY-2015-Earnings-Release-18254306.ics"
      },
      {
        "section": "Past",
        "dateTimeRaw": "06/04/2015 12:00 pm",
        "dateTimeISO": "2015-04-06T06:30:00.000Z",
        "title": "Extraordinary General Meeting",
        "icsUrl": "https://in.marketscreener.com/api/stateful/agenda/event-async/Extraordinary-General-Meeting-20028994.ics"
      },
      {
        "section": "Past",
        "dateTimeRaw": "03/02/2015",
        "dateTimeISO": "2015-02-02T18:30:00.000Z",
        "title": "Q3 2015 Earnings Release",
        "icsUrl": "https://in.marketscreener.com/api/stateful/agenda/event-async/Q3-2015-Earnings-Release-17791545.ics"
      },
      {
        "section": "Past",
        "dateTimeRaw": "11/07/2014",
        "dateTimeISO": "2014-07-10T18:30:00.000Z",
        "title": "Ex-dividend day for final dividend",
        "icsUrl": "https://in.marketscreener.com/api/stateful/agenda/event-async/Ex-dividend-day-for-final-dividend-18686714.ics"
      },
      {
        "section": "Past",
        "dateTimeRaw": "13/09/2013",
        "dateTimeISO": "2013-09-12T18:30:00.000Z",
        "title": "Ex-dividend day for final dividend",
        "icsUrl": "https://in.marketscreener.com/api/stateful/agenda/event-async/Ex-dividend-day-for-final-dividend-17231527.ics"
      },
      {
        "section": "Past",
        "dateTimeRaw": "10/09/2012",
        "dateTimeISO": "2012-09-09T18:30:00.000Z",
        "title": "Ex-dividend day for final dividend",
