{
  "companyCode": "JUBILANT-FOODWORKS-LIMITE-9059999",
  "timestamp": "2025-10-13T12:23:57.513Z",
  "annualResults": {
    "2023": {
      "Net salesMillion INR": {
        "metric": "Net salesMillion INR",
        "unit": "Million INR",
        "fiscalMonth": "March",
        "year": "2023",
        "released": "51 582",
        "forecast": "51 783",
        "spreadRaw": "-0.39%"
      },
      "EBITDAMillion INR": {
        "metric": "EBITDAMillion INR",
        "unit": "Million INR",
        "fiscalMonth": "March",
        "year": "2023",
        "released": "11 516",
        "forecast": "12 026",
        "spreadRaw": "-4.25%"
      },
      "EBITMillion INR": {
        "metric": "EBITMillion INR",
        "unit": "Million INR",
        "fiscalMonth": "March",
        "year": "2023",
        "released": "6 657",
        "forecast": "7 346",
        "spreadRaw": "-9.38%"
      },
      "Earnings before Tax (EBT)Million INR": {
        "metric": "Earnings before Tax (EBT)Million INR",
        "unit": "Million INR",
        "fiscalMonth": "March",
        "year": "2023",
        "released": "4 887",
        "forecast": "5 805",
        "spreadRaw": "-15.81%"
      },
      "Net incomeMillion INR": {
        "metric": "Net incomeMillion INR",
        "unit": "Million INR",
        "fiscalMonth": "March",
        "year": "2023",
        "released": "3 532",
        "forecast": "4 428",
        "spreadRaw": "-20.24%"
      },
      "EPS INR": {
        "metric": "EPS INR",
        "unit": "INR",
        "fiscalMonth": "March",
        "year": "2023",
        "released": "5,35",
        "forecast": "6,92",
        "spreadRaw": "-22.68%"
      },
      "Announcement Date": {
        "metric": "Announcement Date",
        "unit": null,
        "fiscalMonth": "March",
        "year": "2023",
        "released": "17/05/23",
        "forecast": null,
        "spreadRaw": null
      }
    },
    "2024": {
      "Net salesMillion INR": {
        "metric": "Net salesMillion INR",
        "unit": "Million INR",
        "fiscalMonth": "March",
        "year": "2024",
        "released": "56 541",
        "forecast": "54 121",
        "spreadRaw": "4.47%"
      },
      "EBITDAMillion INR": {
        "metric": "EBITDAMillion INR",
        "unit": "Million INR",
        "fiscalMonth": "March",
        "year": "2024",
        "released": "11 435",
        "forecast": "11 191",
        "spreadRaw": "2.18%"
      },
      "EBITMillion INR": {
        "metric": "EBITMillion INR",
        "unit": "Million INR",
        "fiscalMonth": "March",
        "year": "2024",
        "released": "5 455",
        "forecast": "5 468",
        "spreadRaw": "-0.24%"
      },
      "Earnings before Tax (EBT)Million INR": {
        "metric": "Earnings before Tax (EBT)Million INR",
        "unit": "Million INR",
        "fiscalMonth": "March",
        "year": "2024",
        "released": "4 857",
        "forecast": "3 742",
        "spreadRaw": "29.81%"
      },
      "Net incomeMillion INR": {
        "metric": "Net incomeMillion INR",
        "unit": "Million INR",
        "fiscalMonth": "March",
        "year": "2024",
        "released": "3 993",
        "forecast": "2 690",
        "spreadRaw": "48.45%"
      },
      "EPS INR": {
        "metric": "EPS INR",
        "unit": "INR",
        "fiscalMonth": "March",
        "year": "2024",
        "released": "6,05",
        "forecast": "4,04",
        "spreadRaw": "49.83%"
      },
      "Announcement Date": {
        "metric": "Announcement Date",
        "unit": null,
        "fiscalMonth": "March",
        "year": "2024",
        "released": "22/05/24",
        "forecast": null,
        "spreadRaw": null
      }
    },
    "2025": {
      "Net salesMillion INR": {
        "metric": "Net salesMillion INR",
        "unit": "Million INR",
        "fiscalMonth": "March",
        "year": "2025",
        "released": "81 417",
        "forecast": "80 890",
        "spreadRaw": "0.65%"
      },
      "EBITDAMillion INR": {
        "metric": "EBITDAMillion INR",
        "unit": "Million INR",
        "fiscalMonth": "March",
        "year": "2025",
        "released": "15 722",
        "forecast": "15 904",
        "spreadRaw": "-1.14%"
      },
      "EBITMillion INR": {
        "metric": "EBITMillion INR",
        "unit": "Million INR",
        "fiscalMonth": "March",
        "year": "2025",
        "released": "7 657",
        "forecast": "8 037",
        "spreadRaw": "-4.72%"
      },
      "Earnings before Tax (EBT)Million INR": {
        "metric": "Earnings before Tax (EBT)Million INR",
        "unit": "Million INR",
        "fiscalMonth": "March",
        "year": "2025",
        "released": "3 094",
        "forecast": "3 561",
        "spreadRaw": "-13.1%"
      },
      "Net incomeMillion INR": {
        "metric": "Net incomeMillion INR",
        "unit": "Million INR",
        "fiscalMonth": "March",
        "year": "2025",
        "released": "2 108",
        "forecast": "2 691",
        "spreadRaw": "-21.68%"
      },
      "EPS INR": {
        "metric": "EPS INR",
        "unit": "INR",
        "fiscalMonth": "March",
        "year": "2025",
        "released": "3,19",
        "forecast": "4,28",
        "spreadRaw": "-25.51%"
      },
      "Announcement Date": {
        "metric": "Announcement Date",
        "unit": null,
        "fiscalMonth": "March",
        "year": "2025",
        "released": "14/05/25",
        "forecast": null,
        "spreadRaw": null
      }
    },
    "2026": {
      "Net salesMillion INR": {
        "metric": "Net salesMillion INR",
        "unit": "Million INR",
        "fiscalMonth": "March",
        "year": "2026",
        "released": null,
        "forecast": "93 345",
        "spreadRaw": null
      },
      "EBITDAMillion INR": {
        "metric": "EBITDAMillion INR",
        "unit": "Million INR",
        "fiscalMonth": "March",
        "year": "2026",
        "released": null,
        "forecast": "18 468",
        "spreadRaw": null
      },
      "EBITMillion INR": {
        "metric": "EBITMillion INR",
        "unit": "Million INR",
        "fiscalMonth": "March",
        "year": "2026",
        "released": null,
        "forecast": "9 381",
        "spreadRaw": null
      },
      "Earnings before Tax (EBT)Million INR": {
        "metric": "Earnings before Tax (EBT)Million INR",
        "unit": "Million INR",
        "fiscalMonth": "March",
        "year": "2026",
        "released": null,
        "forecast": "5 029",
        "spreadRaw": null
      },
      "Net incomeMillion INR": {
        "metric": "Net incomeMillion INR",
        "unit": "Million INR",
        "fiscalMonth": "March",
        "year": "2026",
        "released": null,
        "forecast": "3 782",
        "spreadRaw": null
      },
      "EPS INR": {
        "metric": "EPS INR",
        "unit": "INR",
        "fiscalMonth": "March",
        "year": "2026",
        "released": null,
        "forecast": "5,92",
        "spreadRaw": null
      },
      "Announcement Date": {
        "metric": "Announcement Date",
        "unit": null,
        "fiscalMonth": "March",
        "year": "2026",
        "released": "-",
        "forecast": null,
        "spreadRaw": null
      }
    },
    "2027": {
      "Net salesMillion INR": {
        "metric": "Net salesMillion INR",
        "unit": "Million INR",
        "fiscalMonth": "March",
        "year": "2027",
        "released": null,
        "forecast": "106 606",
        "spreadRaw": null
      },
      "EBITDAMillion INR": {
        "metric": "EBITDAMillion INR",
        "unit": "Million INR",
        "fiscalMonth": "March",
        "year": "2027",
        "released": null,
        "forecast": "21 958",
        "spreadRaw": null
      },
      "EBITMillion INR": {
        "metric": "EBITMillion INR",
        "unit": "Million INR",
        "fiscalMonth": "March",
        "year": "2027",
        "released": null,
        "forecast": "11 621",
        "spreadRaw": null
      },
      "Earnings before Tax (EBT)Million INR": {
        "metric": "Earnings before Tax (EBT)Million INR",
        "unit": "Million INR",
        "fiscalMonth": "March",
        "year": "2027",
        "released": null,
        "forecast": "7 103",
        "spreadRaw": null
      },
      "Net incomeMillion INR": {
        "metric": "Net incomeMillion INR",
        "unit": "Million INR",
        "fiscalMonth": "March",
        "year": "2027",
        "released": null,
        "forecast": "5 334",
        "spreadRaw": null
      },
      "EPS INR": {
        "metric": "EPS INR",
        "unit": "INR",
        "fiscalMonth": "March",
        "year": "2027",
        "released": null,
        "forecast": "8,30",
        "spreadRaw": null
      },
      "Announcement Date": {
        "metric": "Announcement Date",
        "unit": null,
        "fiscalMonth": "March",
        "year": "2027",
        "released": null,
        "forecast": null,
        "spreadRaw": null
      }
    },
    "2028": {
      "Net salesMillion INR": {
        "metric": "Net salesMillion INR",
        "unit": "Million INR",
        "fiscalMonth": "March",
        "year": "2028",
        "released": null,
        "forecast": "120 522",
        "spreadRaw": null
      },
      "EBITDAMillion INR": {
        "metric": "EBITDAMillion INR",
        "unit": "Million INR",
        "fiscalMonth": "March",
        "year": "2028",
        "released": null,
        "forecast": "25 458",
        "spreadRaw": null
      },
      "EBITMillion INR": {
        "metric": "EBITMillion INR",
        "unit": "Million INR",
        "fiscalMonth": "March",
        "year": "2028",
        "released": null,
        "forecast": "13 963",
        "spreadRaw": null
      },
      "Earnings before Tax (EBT)Million INR": {
        "metric": "Earnings before Tax (EBT)Million INR",
        "unit": "Million INR",
        "fiscalMonth": "March",
        "year": "2028",
        "released": null,
        "forecast": "9 402",
        "spreadRaw": null
      },
      "Net incomeMillion INR": {
        "metric": "Net incomeMillion INR",
        "unit": "Million INR",
        "fiscalMonth": "March",
        "year": "2028",
        "released": null,
        "forecast": "7 061",
        "spreadRaw": null
      },
      "EPS INR": {
        "metric": "EPS INR",
        "unit": "INR",
        "fiscalMonth": "March",
        "year": "2028",
        "released": null,
        "forecast": "11,0",
        "spreadRaw": null
      },
      "Announcement Date": {
        "metric": "Announcement Date",
        "unit": null,
        "fiscalMonth": "March",
        "year": "2028",
        "released": null,
        "forecast": null,
        "spreadRaw": null
      }
    }
  },
  "quarterlyResults": {
    "2024 Q2": {
      "Net salesMillion INR": {
        "metric": "Net salesMillion INR",
        "unit": "Million INR",
        "fiscalMonth": "March",
        "period": "2024 Q2",
        "released": "13 686",
        "releasedNum": 13686,
        "forecast": "13 582",
        "forecastNum": 13582,
        "spreadRaw": "0.77%",
        "spreadPct": 0.77
      },
      "EBITDAMillion INR": {
        "metric": "EBITDAMillion INR",
        "unit": "Million INR",
        "fiscalMonth": "March",
        "period": "2024 Q2",
        "released": "2 772",
        "releasedNum": 2772,
        "forecast": "2 847",
        "forecastNum": 2847,
        "spreadRaw": "-2.64%",
        "spreadPct": -2.64
      },
      "EBITMillion INR": {
        "metric": "EBITMillion INR",
        "unit": "Million INR",
        "fiscalMonth": "March",
        "period": "2024 Q2",
        "released": "1 353",
        "releasedNum": 1353,
        "forecast": "1 382",
        "forecastNum": 1382,
        "spreadRaw": "-2.08%",
        "spreadPct": -2.08
      },
      "Earnings before Tax (EBT)Million INR": {
        "metric": "Earnings before Tax (EBT)Million INR",
        "unit": "Million INR",
        "fiscalMonth": "March",
        "period": "2024 Q2",
        "released": null,
        "releasedNum": null,
        "forecast": null,
        "forecastNum": null,
        "spreadRaw": null,
        "spreadPct": null
      },
      "Net incomeMillion INR": {
        "metric": "Net incomeMillion INR",
        "unit": "Million INR",
        "fiscalMonth": "March",
        "period": "2024 Q2",
        "released": null,
        "releasedNum": null,
        "forecast": null,
        "forecastNum": null,
        "spreadRaw": null,
        "spreadPct": null
      },
      "EPS INR": {
        "metric": "EPS INR",
        "unit": "INR",
        "fiscalMonth": "March",
        "period": "2024 Q2",
        "released": "1,47",
        "releasedNum": 1.47,
        "forecast": "1,06",
        "forecastNum": 1.06,
        "spreadRaw": "38.68%",
        "spreadPct": 38.68
      },
      "Announcement Date": {
        "metric": "Announcement Date",
        "unit": null,
        "fiscalMonth": "March",
        "period": "2024 Q2",
        "released": "25/10/23",
        "releasedDate": "25/10/23",
        "forecast": null,
        "spreadRaw": null,
        "spreadPct": null
      }
    },
    "2024 Q3": {
      "Net salesMillion INR": {
        "metric": "Net salesMillion INR",
        "unit": "Million INR",
        "fiscalMonth": "March",
        "period": "2024 Q3",
        "released": "13 781",
        "releasedNum": 13781,
        "forecast": "14 104",
        "forecastNum": 14104,
        "spreadRaw": "-2.29%",
        "spreadPct": -2.29
      },
      "EBITDAMillion INR": {
        "metric": "EBITDAMillion INR",
        "unit": "Million INR",
        "fiscalMonth": "March",
        "period": "2024 Q3",
        "released": "2 956",
        "releasedNum": 2956,
        "forecast": "3 147",
        "forecastNum": 3147,
        "spreadRaw": "-6.05%",
        "spreadPct": -6.05
      },
      "EBITMillion INR": {
        "metric": "EBITMillion INR",
        "unit": "Million INR",
        "fiscalMonth": "March",
        "period": "2024 Q3",
        "released": "1 441",
        "releasedNum": 1441,
        "forecast": "1 279",
        "forecastNum": 1279,
        "spreadRaw": "12.68%",
        "spreadPct": 12.68
      },
      "Earnings before Tax (EBT)Million INR": {
        "metric": "Earnings before Tax (EBT)Million INR",
        "unit": "Million INR",
        "fiscalMonth": "March",
        "period": "2024 Q3",
        "released": null,
        "releasedNum": null,
        "forecast": null,
        "forecastNum": null,
        "spreadRaw": null,
        "spreadPct": null
      },
      "Net incomeMillion INR": {
        "metric": "Net incomeMillion INR",
        "unit": "Million INR",
        "fiscalMonth": "March",
        "period": "2024 Q3",
        "released": "657",
        "releasedNum": 657,
        "forecast": "1 132",
        "forecastNum": 1132,
        "spreadRaw": "-41.95%",
        "spreadPct": -41.95
      },
      "EPS INR": {
        "metric": "EPS INR",
        "unit": "INR",
        "fiscalMonth": "March",
        "period": "2024 Q3",
        "released": "1,00",
        "releasedNum": 1,
        "forecast": "1,00",
        "forecastNum": 1,
        "spreadRaw": "0%",
        "spreadPct": 0
      },
      "Announcement Date": {
        "metric": "Announcement Date",
        "unit": null,
        "fiscalMonth": "March",
        "period": "2024 Q3",
        "released": "31/01/24",
        "releasedDate": "31/01/24",
        "forecast": null,
        "spreadRaw": null,
        "spreadPct": null
      }
    },
    "2024 Q4": {
      "Net salesMillion INR": {
        "metric": "Net salesMillion INR",
        "unit": "Million INR",
        "fiscalMonth": "March",
        "period": "2024 Q4",
        "released": "15 728",
        "releasedNum": 15728,
        "forecast": "13 219",
        "forecastNum": 13219,
        "spreadRaw": "18.98%",
        "spreadPct": 18.98
      },
      "EBITDAMillion INR": {
        "metric": "EBITDAMillion INR",
        "unit": "Million INR",
        "fiscalMonth": "March",
        "period": "2024 Q4",
        "released": "3 103",
        "releasedNum": 3103,
        "forecast": "2 280",
        "forecastNum": 2280,
        "spreadRaw": "36.1%",
        "spreadPct": 36.1
      },
      "EBITMillion INR": {
        "metric": "EBITMillion INR",
        "unit": "Million INR",
        "fiscalMonth": "March",
        "period": "2024 Q4",
        "released": "1 415",
        "releasedNum": 1415,
        "forecast": "954",
        "forecastNum": 954,
        "spreadRaw": "48.27%",
        "spreadPct": 48.27
      },
      "Earnings before Tax (EBT)Million INR": {
        "metric": "Earnings before Tax (EBT)Million INR",
        "unit": "Million INR",
        "fiscalMonth": "March",
        "period": "2024 Q4",
        "released": null,
        "releasedNum": null,
        "forecast": null,
        "forecastNum": null,
        "spreadRaw": null,
        "spreadPct": null
      },
      "Net incomeMillion INR": {
        "metric": "Net incomeMillion INR",
        "unit": "Million INR",
        "fiscalMonth": "March",
        "period": "2024 Q4",
        "released": "2 075",
        "releasedNum": 2075,
        "forecast": "382",
        "forecastNum": 382,
        "spreadRaw": "443.95%",
        "spreadPct": 443.95
      },
      "EPS INR": {
        "metric": "EPS INR",
        "unit": "INR",
        "fiscalMonth": "March",
        "period": "2024 Q4",
        "released": "3,14",
        "releasedNum": 3.14,
        "forecast": "0,57",
        "forecastNum": 0.57,
        "spreadRaw": "447.68%",
        "spreadPct": 447.68
      },
      "Announcement Date": {
        "metric": "Announcement Date",
        "unit": null,
        "fiscalMonth": "March",
        "period": "2024 Q4",
        "released": "22/05/24",
        "releasedDate": "22/05/24",
        "forecast": null,
        "spreadRaw": null,
        "spreadPct": null
      }
    },
    "2025 Q1": {
      "Net salesMillion INR": {
        "metric": "Net salesMillion INR",
        "unit": "Million INR",
        "fiscalMonth": "March",
        "period": "2025 Q1",
        "released": "19 331",
        "releasedNum": 19331,
        "forecast": "16 434",
        "forecastNum": 16434,
        "spreadRaw": "17.63%",
        "spreadPct": 17.63
      },
      "EBITDAMillion INR": {
        "metric": "EBITDAMillion INR",
        "unit": "Million INR",
        "fiscalMonth": "March",
        "period": "2025 Q1",
        "released": "3 831",
        "releasedNum": 3831,
        "forecast": "3 285",
        "forecastNum": 3285,
        "spreadRaw": "16.62%",
        "spreadPct": 16.62
      },
      "EBITMillion INR": {
        "metric": "EBITMillion INR",
        "unit": "Million INR",
        "fiscalMonth": "March",
        "period": "2025 Q1",
        "released": "1 995",
        "releasedNum": 1995,
        "forecast": "1 978",
        "forecastNum": 1978,
        "spreadRaw": "0.87%",
        "spreadPct": 0.87
      },
      "Earnings before Tax (EBT)Million INR": {
        "metric": "Earnings before Tax (EBT)Million INR",
        "unit": "Million INR",
        "fiscalMonth": "March",
        "period": "2025 Q1",
        "released": "796",
        "releasedNum": 796,
        "forecast": "804",
        "forecastNum": 804,
        "spreadRaw": "-0.95%",
        "spreadPct": -0.95
      },
      "Net incomeMillion INR": {
        "metric": "Net incomeMillion INR",
        "unit": "Million INR",
        "fiscalMonth": "March",
        "period": "2025 Q1",
        "released": "558",
        "releasedNum": 558,
        "forecast": "606",
        "forecastNum": 606,
        "spreadRaw": "-7.92%",
        "spreadPct": -7.92
      },
      "EPS INR": {
        "metric": "EPS INR",
        "unit": "INR",
        "fiscalMonth": "March",
        "period": "2025 Q1",
        "released": "0,85",
        "releasedNum": 0.85,
        "forecast": "0,90",
        "forecastNum": 0.9,
        "spreadRaw": "-5.56%",
        "spreadPct": -5.56
      },
      "Announcement Date": {
        "metric": "Announcement Date",
        "unit": null,
        "fiscalMonth": "March",
        "period": "2025 Q1",
        "released": "09/08/24",
        "releasedDate": "09/08/24",
        "forecast": null,
        "spreadRaw": null,
        "spreadPct": null
      }
    },
    "2025 Q2": {
      "Net salesMillion INR": {
        "metric": "Net salesMillion INR",
        "unit": "Million INR",
        "fiscalMonth": "March",
        "period": "2025 Q2",
        "released": "19 547",
        "releasedNum": 19547,
        "forecast": "18 850",
        "forecastNum": 18850,
        "spreadRaw": "3.7%",
        "spreadPct": 3.7
      },
      "EBITDAMillion INR": {
        "metric": "EBITDAMillion INR",
        "unit": "Million INR",
        "fiscalMonth": "March",
        "period": "2025 Q2",
        "released": "3 986",
        "releasedNum": 3986,
        "forecast": "3 899",
        "forecastNum": 3899,
        "spreadRaw": "2.24%",
        "spreadPct": 2.24
      },
      "EBITMillion INR": {
        "metric": "EBITMillion INR",
        "unit": "Million INR",
        "fiscalMonth": "March",
        "period": "2025 Q2",
        "released": "1 971",
        "releasedNum": 1971,
        "forecast": "2 170",
        "forecastNum": 2170,
        "spreadRaw": "-9.17%",
        "spreadPct": -9.17
      },
      "Earnings before Tax (EBT)Million INR": {
        "metric": "Earnings before Tax (EBT)Million INR",
        "unit": "Million INR",
        "fiscalMonth": "March",
        "period": "2025 Q2",
        "released": null,
        "releasedNum": null,
        "forecast": null,
        "forecastNum": null,
        "spreadRaw": null,
        "spreadPct": null
      },
      "Net incomeMillion INR": {
        "metric": "Net incomeMillion INR",
        "unit": "Million INR",
        "fiscalMonth": "March",
        "period": "2025 Q2",
        "released": "640",
        "releasedNum": 640,
        "forecast": "955",
        "forecastNum": 955,
        "spreadRaw": "-32.9%",
        "spreadPct": -32.9
      },
      "EPS INR": {
        "metric": "EPS INR",
        "unit": "INR",
        "fiscalMonth": "March",
        "period": "2025 Q2",
        "released": "0,97",
        "releasedNum": 0.97,
        "forecast": "1,51",
        "forecastNum": 1.51,
        "spreadRaw": "-35.76%",
        "spreadPct": -35.76
      },
      "Announcement Date": {
        "metric": "Announcement Date",
        "unit": null,
        "fiscalMonth": "March",
        "period": "2025 Q2",
        "released": "11/11/24",
        "releasedDate": "11/11/24",
        "forecast": null,
        "spreadRaw": null,
        "spreadPct": null
      }
    },
    "2025 S1": {
      "Net salesMillion INR": {
        "metric": "Net salesMillion INR",
        "unit": "Million INR",
        "fiscalMonth": "March",
        "period": "2025 S1",
        "released": "38 878",
        "releasedNum": 38878,
        "forecast": null,
        "forecastNum": null,
        "spreadRaw": null,
        "spreadPct": null
      },
      "EBITDAMillion INR": {
        "metric": "EBITDAMillion INR",
        "unit": "Million INR",
        "fiscalMonth": "March",
        "period": "2025 S1",
        "released": null,
        "releasedNum": null,
        "forecast": null,
        "forecastNum": null,
        "spreadRaw": null,
        "spreadPct": null
      },
      "EBITMillion INR": {
        "metric": "EBITMillion INR",
        "unit": "Million INR",
        "fiscalMonth": "March",
        "period": "2025 S1",
        "released": null,
        "releasedNum": null,
        "forecast": null,
        "forecastNum": null,
        "spreadRaw": null,
        "spreadPct": null
      },
      "Earnings before Tax (EBT)Million INR": {
        "metric": "Earnings before Tax (EBT)Million INR",
        "unit": "Million INR",
        "fiscalMonth": "March",
        "period": "2025 S1",
        "released": null,
        "releasedNum": null,
        "forecast": null,
        "forecastNum": null,
        "spreadRaw": null,
        "spreadPct": null
      },
      "Net incomeMillion INR": {
        "metric": "Net incomeMillion INR",
        "unit": "Million INR",
        "fiscalMonth": "March",
        "period": "2025 S1",
        "released": null,
        "releasedNum": null,
        "forecast": null,
        "forecastNum": null,
        "spreadRaw": null,
        "spreadPct": null
      },
      "EPS INR": {
        "metric": "EPS INR",
        "unit": "INR",
        "fiscalMonth": "March",
        "period": "2025 S1",
        "released": null,
        "releasedNum": null,
        "forecast": null,
        "forecastNum": null,
        "spreadRaw": null,
        "spreadPct": null
      },
      "Announcement Date": {
        "metric": "Announcement Date",
        "unit": null,
        "fiscalMonth": "March",
        "period": "2025 S1",
        "released": "11/11/24",
        "releasedDate": "11/11/24",
        "forecast": null,
        "spreadRaw": null,
        "spreadPct": null
      }
    },
    "2025 Q3": {
      "Net salesMillion INR": {
        "metric": "Net salesMillion INR",
        "unit": "Million INR",
        "fiscalMonth": "March",
        "period": "2025 Q3",
        "released": "21 508",
        "releasedNum": 21508,
        "forecast": "19 240",
        "forecastNum": 19240,
        "spreadRaw": "11.79%",
        "spreadPct": 11.79
      },
      "EBITDAMillion INR": {
        "metric": "EBITDAMillion INR",
        "unit": "Million INR",
        "fiscalMonth": "March",
        "period": "2025 Q3",
        "released": "4 020",
        "releasedNum": 4020,
        "forecast": "3 899",
        "forecastNum": 3899,
        "spreadRaw": "3.11%",
        "spreadPct": 3.11
      },
      "EBITMillion INR": {
        "metric": "EBITMillion INR",
        "unit": "Million INR",
        "fiscalMonth": "March",
        "period": "2025 Q3",
        "released": "1 942",
        "releasedNum": 1942,
        "forecast": "2 246",
        "forecastNum": 2246,
        "spreadRaw": "-13.54%",
        "spreadPct": -13.54
      },
      "Earnings before Tax (EBT)Million INR": {
        "metric": "Earnings before Tax (EBT)Million INR",
        "unit": "Million INR",
        "fiscalMonth": "March",
        "period": "2025 Q3",
        "released": null,
        "releasedNum": null,
        "forecast": null,
        "forecastNum": null,
        "spreadRaw": null,
        "spreadPct": null
      },
      "Net incomeMillion INR": {
        "metric": "Net incomeMillion INR",
        "unit": "Million INR",
        "fiscalMonth": "March",
        "period": "2025 Q3",
        "released": null,
        "releasedNum": null,
        "forecast": null,
        "forecastNum": null,
        "spreadRaw": null,
        "spreadPct": null
      },
      "EPS INR": {
        "metric": "EPS INR",
        "unit": "INR",
        "fiscalMonth": "March",
        "period": "2025 Q3",
        "released": "0,65",
        "releasedNum": 0.65,
        "forecast": "1,71",
        "forecastNum": 1.71,
        "spreadRaw": "-61.99%",
        "spreadPct": -61.99
      },
      "Announcement Date": {
        "metric": "Announcement Date",
        "unit": null,
        "fiscalMonth": "March",
        "period": "2025 Q3",
        "released": "12/02/25",
        "releasedDate": "12/02/25",
        "forecast": null,
        "spreadRaw": null,
        "spreadPct": null
      }
    },
    "2025 Q4": {
      "Net salesMillion INR": {
        "metric": "Net salesMillion INR",
        "unit": "Million INR",
        "fiscalMonth": "March",
        "period": "2025 Q4",
        "released": "21 032",
        "releasedNum": 21032,
        "forecast": "19 673",
        "forecastNum": 19673,
        "spreadRaw": "6.91%",
        "spreadPct": 6.91
      },
      "EBITDAMillion INR": {
        "metric": "EBITDAMillion INR",
        "unit": "Million INR",
        "fiscalMonth": "March",
        "period": "2025 Q4",
        "released": "3 886",
        "releasedNum": 3886,
        "forecast": "3 401",
        "forecastNum": 3401,
        "spreadRaw": "14.27%",
        "spreadPct": 14.27
      },
      "EBITMillion INR": {
        "metric": "EBITMillion INR",
        "unit": "Million INR",
        "fiscalMonth": "March",
        "period": "2025 Q4",
        "released": "1 749",
        "releasedNum": 1749,
        "forecast": "1 447",
        "forecastNum": 1447,
        "spreadRaw": "20.86%",
        "spreadPct": 20.86
      },
      "Earnings before Tax (EBT)Million INR": {
        "metric": "Earnings before Tax (EBT)Million INR",
        "unit": "Million INR",
        "fiscalMonth": "March",
        "period": "2025 Q4",
        "released": "695",
        "releasedNum": 695,
        "forecast": "484",
        "forecastNum": 484,
        "spreadRaw": "43.64%",
        "spreadPct": 43.64
      },
      "Net incomeMillion INR": {
        "metric": "Net incomeMillion INR",
        "unit": "Million INR",
        "fiscalMonth": "March",
        "period": "2025 Q4",
        "released": "480",
        "releasedNum": 480,
        "forecast": "425",
        "forecastNum": 425,
        "spreadRaw": "12.95%",
        "spreadPct": 12.95
      },
      "EPS INR": {
        "metric": "EPS INR",
        "unit": "INR",
        "fiscalMonth": "March",
        "period": "2025 Q4",
        "released": "0,73",
        "releasedNum": 0.73,
        "forecast": "0,64",
        "forecastNum": 0.64,
        "spreadRaw": "14.96%",
        "spreadPct": 14.96
      },
      "Announcement Date": {
        "metric": "Announcement Date",
        "unit": null,
        "fiscalMonth": "March",
        "period": "2025 Q4",
        "released": "14/05/25",
        "releasedDate": "14/05/25",
        "forecast": null,
        "spreadRaw": null,
        "spreadPct": null
      }
    },
    "2026 Q1": {
      "Net salesMillion INR": {
        "metric": "Net salesMillion INR",
        "unit": "Million INR",
        "fiscalMonth": "March",
        "period": "2026 Q1",
        "released": "22 609",
        "releasedNum": 22609,
        "forecast": "20 919",
        "forecastNum": 20919,
        "spreadRaw": "8.08%",
        "spreadPct": 8.08
      },
      "EBITDAMillion INR": {
        "metric": "EBITDAMillion INR",
        "unit": "Million INR",
        "fiscalMonth": "March",
        "period": "2026 Q1",
        "released": "4 380",
        "releasedNum": 4380,
        "forecast": "3 598",
        "forecastNum": 3598,
        "spreadRaw": "21.73%",
        "spreadPct": 21.73
      },
      "EBITMillion INR": {
        "metric": "EBITMillion INR",
        "unit": "Million INR",
        "fiscalMonth": "March",
        "period": "2026 Q1",
        "released": "2 178",
        "releasedNum": 2178,
        "forecast": "1 966",
        "forecastNum": 1966,
        "spreadRaw": "10.79%",
        "spreadPct": 10.79
      },
      "Earnings before Tax (EBT)Million INR": {
        "metric": "Earnings before Tax (EBT)Million INR",
        "unit": "Million INR",
        "fiscalMonth": "March",
        "period": "2026 Q1",
        "released": "1 289",
        "releasedNum": 1289,
        "forecast": "872",
        "forecastNum": 872,
        "spreadRaw": "47.77%",
        "spreadPct": 47.77
      },
      "Net incomeMillion INR": {
        "metric": "Net incomeMillion INR",
        "unit": "Million INR",
        "fiscalMonth": "March",
        "period": "2026 Q1",
        "released": "918",
        "releasedNum": 918,
        "forecast": "636",
        "forecastNum": 636,
        "spreadRaw": "44.27%",
        "spreadPct": 44.27
      },
      "EPS INR": {
        "metric": "EPS INR",
        "unit": "INR",
        "fiscalMonth": "March",
        "period": "2026 Q1",
        "released": "1,39",
        "releasedNum": 1.39,
        "forecast": "1,26",
        "forecastNum": 1.26,
        "spreadRaw": "10.32%",
        "spreadPct": 10.32
      },
      "Announcement Date": {
        "metric": "Announcement Date",
        "unit": null,
        "fiscalMonth": "March",
        "period": "2026 Q1",
        "released": "13/08/25",
        "releasedDate": "13/08/25",
        "forecast": null,
        "spreadRaw": null,
        "spreadPct": null
      }
    },
    "2026 Q2": {
      "Net salesMillion INR": {
        "metric": "Net salesMillion INR",
        "unit": "Million INR",
        "fiscalMonth": "March",
        "period": "2026 Q2",
        "released": null,
        "releasedNum": null,
        "forecast": "23 136",
        "forecastNum": 23136,
        "spreadRaw": null,
        "spreadPct": null
      },
      "EBITDAMillion INR": {
        "metric": "EBITDAMillion INR",
        "unit": "Million INR",
        "fiscalMonth": "March",
        "period": "2026 Q2",
        "released": null,
        "releasedNum": null,
        "forecast": "4 479",
        "forecastNum": 4479,
        "spreadRaw": null,
        "spreadPct": null
      },
      "EBITMillion INR": {
        "metric": "EBITMillion INR",
        "unit": "Million INR",
        "fiscalMonth": "March",
        "period": "2026 Q2",
        "released": null,
        "releasedNum": null,
        "forecast": "2 168",
        "forecastNum": 2168,
        "spreadRaw": null,
        "spreadPct": null
      },
      "Earnings before Tax (EBT)Million INR": {
        "metric": "Earnings before Tax (EBT)Million INR",
        "unit": "Million INR",
        "fiscalMonth": "March",
        "period": "2026 Q2",
        "released": null,
        "releasedNum": null,
        "forecast": null,
        "forecastNum": null,
        "spreadRaw": null,
        "spreadPct": null
      },
      "Net incomeMillion INR": {
        "metric": "Net incomeMillion INR",
        "unit": "Million INR",
        "fiscalMonth": "March",
        "period": "2026 Q2",
        "released": null,
        "releasedNum": null,
        "forecast": "778",
        "forecastNum": 778,
        "spreadRaw": null,
        "spreadPct": null
      },
      "EPS INR": {
        "metric": "EPS INR",
        "unit": "INR",
        "fiscalMonth": "March",
        "period": "2026 Q2",
        "released": null,
        "releasedNum": null,
        "forecast": "1,58",
        "forecastNum": 1.58,
        "spreadRaw": null,
        "spreadPct": null
      },
      "Announcement Date": {
        "metric": "Announcement Date",
        "unit": null,
        "fiscalMonth": "March",
        "period": "2026 Q2",
        "released": "-",
        "releasedDate": "-",
        "forecast": null,
        "spreadRaw": null,
        "spreadPct": null
      }
    },
    "2026 Q3": {
      "Net salesMillion INR": {
        "metric": "Net salesMillion INR",
        "unit": "Million INR",
        "fiscalMonth": "March",
        "period": "2026 Q3",
        "released": null,
        "releasedNum": null,
        "forecast": "24 099",
        "forecastNum": 24099,
        "spreadRaw": null,
        "spreadPct": null
      },
      "EBITDAMillion INR": {
        "metric": "EBITDAMillion INR",
        "unit": "Million INR",
        "fiscalMonth": "March",
        "period": "2026 Q3",
        "released": null,
        "releasedNum": null,
        "forecast": "4 469",
        "forecastNum": 4469,
        "spreadRaw": null,
        "spreadPct": null
      },
      "EBITMillion INR": {
        "metric": "EBITMillion INR",
        "unit": "Million INR",
        "fiscalMonth": "March",
        "period": "2026 Q3",
        "released": null,
        "releasedNum": null,
        "forecast": "2 135",
        "forecastNum": 2135,
        "spreadRaw": null,
        "spreadPct": null
      },
      "Earnings before Tax (EBT)Million INR": {
        "metric": "Earnings before Tax (EBT)Million INR",
        "unit": "Million INR",
        "fiscalMonth": "March",
        "period": "2026 Q3",
        "released": null,
        "releasedNum": null,
        "forecast": null,
        "forecastNum": null,
        "spreadRaw": null,
        "spreadPct": null
      },
      "Net incomeMillion INR": {
        "metric": "Net incomeMillion INR",
        "unit": "Million INR",
        "fiscalMonth": "March",
        "period": "2026 Q3",
        "released": null,
        "releasedNum": null,
        "forecast": null,
        "forecastNum": null,
        "spreadRaw": null,
        "spreadPct": null
      },
      "EPS INR": {
        "metric": "EPS INR",
        "unit": "INR",
        "fiscalMonth": "March",
        "period": "2026 Q3",
        "released": null,
        "releasedNum": null,
        "forecast": "1,60",
        "forecastNum": 1.6,
        "spreadRaw": null,
        "spreadPct": null
      },
      "Announcement Date": {
        "metric": "Announcement Date",
        "unit": null,
        "fiscalMonth": "March",
        "period": "2026 Q3",
        "released": "-",
        "releasedDate": "-",
        "forecast": null,
        "spreadRaw": null,
        "spreadPct": null
      }
    },
    "2026 Q4": {
      "Net salesMillion INR": {
        "metric": "Net salesMillion INR",
        "unit": "Million INR",
        "fiscalMonth": "March",
        "period": "2026 Q4",
        "released": null,
        "releasedNum": null,
        "forecast": "21 116",
        "forecastNum": 21116,
        "spreadRaw": null,
        "spreadPct": null
      },
      "EBITDAMillion INR": {
        "metric": "EBITDAMillion INR",
        "unit": "Million INR",
        "fiscalMonth": "March",
        "period": "2026 Q4",
        "released": null,
        "releasedNum": null,
        "forecast": "4 198",
        "forecastNum": 4198,
        "spreadRaw": null,
        "spreadPct": null
      },
      "EBITMillion INR": {
        "metric": "EBITMillion INR",
        "unit": "Million INR",
        "fiscalMonth": "March",
        "period": "2026 Q4",
        "released": null,
        "releasedNum": null,
        "forecast": "1 938",
        "forecastNum": 1938,
        "spreadRaw": null,
        "spreadPct": null
      },
      "Earnings before Tax (EBT)Million INR": {
        "metric": "Earnings before Tax (EBT)Million INR",
        "unit": "Million INR",
        "fiscalMonth": "March",
        "period": "2026 Q4",
        "released": null,
        "releasedNum": null,
        "forecast": null,
        "forecastNum": null,
        "spreadRaw": null,
        "spreadPct": null
      },
      "Net incomeMillion INR": {
        "metric": "Net incomeMillion INR",
        "unit": "Million INR",
        "fiscalMonth": "March",
        "period": "2026 Q4",
        "released": null,
        "releasedNum": null,
        "forecast": null,
        "forecastNum": null,
        "spreadRaw": null,
        "spreadPct": null
      },
      "EPS INR": {
        "metric": "EPS INR",
        "unit": "INR",
        "fiscalMonth": "March",
        "period": "2026 Q4",
        "released": null,
        "releasedNum": null,
        "forecast": "1,77",
        "forecastNum": 1.77,
        "spreadRaw": null,
        "spreadPct": null
      },
      "Announcement Date": {
        "metric": "Announcement Date",
        "unit": null,
        "fiscalMonth": "March",
        "period": "2026 Q4",
        "released": "-",
        "releasedDate": "-",
        "forecast": null,
        "spreadRaw": null,
        "spreadPct": null
      }
    },
    "2027 Q1": {
      "Net salesMillion INR": {
        "metric": "Net salesMillion INR",
        "unit": "Million INR",
        "fiscalMonth": "March",
        "period": "2027 Q1",
        "released": null,
        "releasedNum": null,
        "forecast": null,
        "forecastNum": null,
        "spreadRaw": null,
        "spreadPct": null
      },
      "EBITDAMillion INR": {
        "metric": "EBITDAMillion INR",
        "unit": "Million INR",
        "fiscalMonth": "March",
        "period": "2027 Q1",
        "released": null,
        "releasedNum": null,
        "forecast": null,
        "forecastNum": null,
        "spreadRaw": null,
        "spreadPct": null
      },
      "EBITMillion INR": {
        "metric": "EBITMillion INR",
        "unit": "Million INR",
        "fiscalMonth": "March",
        "period": "2027 Q1",
        "released": null,
        "releasedNum": null,
        "forecast": null,
        "forecastNum": null,
        "spreadRaw": null,
        "spreadPct": null
      },
      "Earnings before Tax (EBT)Million INR": {
        "metric": "Earnings before Tax (EBT)Million INR",
        "unit": "Million INR",
        "fiscalMonth": "March",
        "period": "2027 Q1",
        "released": null,
        "releasedNum": null,
        "forecast": null,
        "forecastNum": null,
        "spreadRaw": null,
        "spreadPct": null
      },
      "Net incomeMillion INR": {
        "metric": "Net incomeMillion INR",
        "unit": "Million INR",
        "fiscalMonth": "March",
        "period": "2027 Q1",
        "released": null,
        "releasedNum": null,
        "forecast": null,
        "forecastNum": null,
        "spreadRaw": null,
        "spreadPct": null
      },
      "EPS INR": {
        "metric": "EPS INR",
        "unit": "INR",
        "fiscalMonth": "March",
        "period": "2027 Q1",
        "released": null,
        "releasedNum": null,
        "forecast": "2,42",
        "forecastNum": 2.42,
        "spreadRaw": null,
        "spreadPct": null
      },
      "Announcement Date": {
        "metric": "Announcement Date",
        "unit": null,
        "fiscalMonth": "March",
        "period": "2027 Q1",
        "released": "-",
        "releasedDate": "-",
        "forecast": null,
        "spreadRaw": null,
        "spreadPct": null
      }
    },
    "2027 Q2": {
      "Net salesMillion INR": {
        "metric": "Net salesMillion INR",
        "unit": "Million INR",
        "fiscalMonth": "March",
        "period": "2027 Q2",
        "released": null,
        "releasedNum": null,
        "forecast": null,
        "forecastNum": null,
        "spreadRaw": null,
        "spreadPct": null
      },
      "EBITDAMillion INR": {
        "metric": "EBITDAMillion INR",
        "unit": "Million INR",
        "fiscalMonth": "March",
        "period": "2027 Q2",
        "released": null,
        "releasedNum": null,
        "forecast": null,
        "forecastNum": null,
        "spreadRaw": null,
        "spreadPct": null
      },
      "EBITMillion INR": {
        "metric": "EBITMillion INR",
        "unit": "Million INR",
        "fiscalMonth": "March",
        "period": "2027 Q2",
        "released": null,
        "releasedNum": null,
        "forecast": null,
        "forecastNum": null,
        "spreadRaw": null,
        "spreadPct": null
      },
      "Earnings before Tax (EBT)Million INR": {
        "metric": "Earnings before Tax (EBT)Million INR",
        "unit": "Million INR",
        "fiscalMonth": "March",
        "period": "2027 Q2",
        "released": null,
        "releasedNum": null,
        "forecast": null,
        "forecastNum": null,
        "spreadRaw": null,
        "spreadPct": null
      },
      "Net incomeMillion INR": {
        "metric": "Net incomeMillion INR",
        "unit": "Million INR",
        "fiscalMonth": "March",
        "period": "2027 Q2",
        "released": null,
        "releasedNum": null,
        "forecast": null,
        "forecastNum": null,
        "spreadRaw": null,
        "spreadPct": null
      },
      "EPS INR": {
        "metric": "EPS INR",
        "unit": "INR",
        "fiscalMonth": "March",
        "period": "2027 Q2",
        "released": null,
        "releasedNum": null,
        "forecast": "2,63",
        "forecastNum": 2.63,
        "spreadRaw": null,
        "spreadPct": null
      },
      "Announcement Date": {
        "metric": "Announcement Date",
        "unit": null,
        "fiscalMonth": "March",
        "period": "2027 Q2",
        "released": "-",
        "releasedDate": "-",
        "forecast": null,
        "spreadRaw": null,
        "spreadPct": null
      }
    },
    "2027 Q3": {
      "Net salesMillion INR": {
        "metric": "Net salesMillion INR",
        "unit": "Million INR",
        "fiscalMonth": "March",
        "period": "2027 Q3",
        "released": null,
        "releasedNum": null,
        "forecast": null,
        "forecastNum": null,
        "spreadRaw": null,
        "spreadPct": null
      },
      "EBITDAMillion INR": {
        "metric": "EBITDAMillion INR",
        "unit": "Million INR",
        "fiscalMonth": "March",
        "period": "2027 Q3",
        "released": null,
        "releasedNum": null,
        "forecast": null,
        "forecastNum": null,
        "spreadRaw": null,
        "spreadPct": null
      },
      "EBITMillion INR": {
        "metric": "EBITMillion INR",
        "unit": "Million INR",
        "fiscalMonth": "March",
        "period": "2027 Q3",
        "released": null,
        "releasedNum": null,
        "forecast": null,
        "forecastNum": null,
        "spreadRaw": null,
        "spreadPct": null
      },
      "Earnings before Tax (EBT)Million INR": {
        "metric": "Earnings before Tax (EBT)Million INR",
        "unit": "Million INR",
        "fiscalMonth": "March",
        "period": "2027 Q3",
        "released": null,
        "releasedNum": null,
        "forecast": null,
        "forecastNum": null,
        "spreadRaw": null,
        "spreadPct": null
      },
      "Net incomeMillion INR": {
        "metric": "Net incomeMillion INR",
        "unit": "Million INR",
        "fiscalMonth": "March",
        "period": "2027 Q3",
        "released": null,
        "releasedNum": null,
        "forecast": null,
        "forecastNum": null,
        "spreadRaw": null,
        "spreadPct": null
      },
      "EPS INR": {
        "metric": "EPS INR",
        "unit": "INR",
        "fiscalMonth": "March",
        "period": "2027 Q3",
        "released": null,
        "releasedNum": null,
        "forecast": "2,63",
        "forecastNum": 2.63,
        "spreadRaw": null,
        "spreadPct": null
      },
      "Announcement Date": {
        "metric": "Announcement Date",
        "unit": null,
        "fiscalMonth": "March",
        "period": "2027 Q3",
        "released": "-",
        "releasedDate": "-",
        "forecast": null,
        "spreadRaw": null,
        "spreadPct": null
      }
    },
    "2027 Q4": {
      "Net salesMillion INR": {
        "metric": "Net salesMillion INR",
        "unit": "Million INR",
        "fiscalMonth": "March",
        "period": "2027 Q4",
        "released": null,
        "releasedNum": null,
        "forecast": null,
        "forecastNum": null,
        "spreadRaw": null,
        "spreadPct": null
      },
      "EBITDAMillion INR": {
        "metric": "EBITDAMillion INR",
        "unit": "Million INR",
        "fiscalMonth": "March",
        "period": "2027 Q4",
        "released": null,
        "releasedNum": null,
        "forecast": null,
        "forecastNum": null,
        "spreadRaw": null,
        "spreadPct": null
      },
      "EBITMillion INR": {
        "metric": "EBITMillion INR",
        "unit": "Million INR",
        "fiscalMonth": "March",
        "period": "2027 Q4",
        "released": null,
        "releasedNum": null,
        "forecast": null,
        "forecastNum": null,
        "spreadRaw": null,
        "spreadPct": null
      },
      "Earnings before Tax (EBT)Million INR": {
        "metric": "Earnings before Tax (EBT)Million INR",
        "unit": "Million INR",
        "fiscalMonth": "March",
        "period": "2027 Q4",
        "released": null,
        "releasedNum": null,
        "forecast": null,
        "forecastNum": null,
        "spreadRaw": null,
        "spreadPct": null
      },
      "Net incomeMillion INR": {
        "metric": "Net incomeMillion INR",
        "unit": "Million INR",
        "fiscalMonth": "March",
        "period": "2027 Q4",
        "released": null,
        "releasedNum": null,
        "forecast": null,
        "forecastNum": null,
        "spreadRaw": null,
        "spreadPct": null
      },
      "EPS INR": {
        "metric": "EPS INR",
        "unit": "INR",
        "fiscalMonth": "March",
        "period": "2027 Q4",
        "released": null,
        "releasedNum": null,
        "forecast": "2,84",
        "forecastNum": 2.84,
        "spreadRaw": null,
        "spreadPct": null
      },
      "Announcement Date": {
        "metric": "Announcement Date",
        "unit": null,
        "fiscalMonth": "March",
        "period": "2027 Q4",
        "released": "-",
        "releasedDate": "-",
        "forecast": null,
        "spreadRaw": null,
        "spreadPct": null
      }
    }
  },
  "upcomingEvents": {
    "count": 4,
    "events": [
      {
        "section": "Upcoming",
        "dateTimeRaw": "22/10/2025",
        "dateTimeISO": "2025-10-21T18:30:00.000Z",
        "title": "Q2 2026 Earnings Release (Projected)",
        "icsUrl": "https://in.marketscreener.com/api/stateful/agenda/event-async/Q2-2026-Earnings-Release-Projected-48285728.ics"
      },
      {
        "section": "Upcoming",
        "dateTimeRaw": "04/02/2026",
        "dateTimeISO": "2026-02-03T18:30:00.000Z",
        "title": "Q3 2026 Earnings Release (Projected)",
        "icsUrl": "https://in.marketscreener.com/api/stateful/agenda/event-async/Q3-2026-Earnings-Release-Projected-48331143.ics"
      },
      {
        "section": "Upcoming",
        "dateTimeRaw": "20/05/2026",
        "dateTimeISO": "2026-05-19T18:30:00.000Z",
        "title": "Q4 2026 Earnings Release (Projected)",
        "icsUrl": "https://in.marketscreener.com/api/stateful/agenda/event-async/Q4-2026-Earnings-Release-Projected-48331151.ics"
      },
      {
        "section": "Upcoming",
        "dateTimeRaw": "29/07/2026",
        "dateTimeISO": "2026-07-28T18:30:00.000Z",
        "title": "Q1 2027 Earnings Release (Projected)",
        "icsUrl": "https://in.marketscreener.com/api/stateful/agenda/event-async/Q1-2027-Earnings-Release-Projected-50685377.ics"
      }
    ]
  },
  "pastEvents": {
    "count": 127,
    "events": [
      {
        "section": "Past",
        "dateTimeRaw": "22/09/2025",
        "dateTimeISO": "2025-09-21T18:30:00.000Z",
        "title": "J.P. Morgan India Conference",
        "icsUrl": "https://in.marketscreener.com/api/stateful/agenda/event-async/J-P-Morgan-India-Conference-51129724.ics"
      },
      {
        "section": "Past",
        "dateTimeRaw": "18/09/2025",
        "dateTimeISO": "2025-09-17T18:30:00.000Z",
        "title": "Jefferies India Forum",
        "icsUrl": "https://in.marketscreener.com/api/stateful/agenda/event-async/Jefferies-India-Forum-51108996.ics"
      },
      {
        "section": "Past",
        "dateTimeRaw": "28/08/2025 11:00 am",
        "dateTimeISO": "2025-08-28T05:30:00.000Z",
        "title": "Annual General Meeting",
        "icsUrl": "https://in.marketscreener.com/api/stateful/agenda/event-async/Annual-General-Meeting-50766963.ics"
      },
      {
        "section": "Past",
        "dateTimeRaw": "13/08/2025 05:30 pm",
        "dateTimeISO": "2025-08-13T12:00:00.000Z",
        "title": "Q1 2026 Earnings Call",
        "icsUrl": "https://in.marketscreener.com/api/stateful/agenda/event-async/Q1-2026-Earnings-Call-50766953.ics"
      },
      {
        "section": "Past",
        "dateTimeRaw": "13/08/2025 03:49 pm",
        "dateTimeISO": "2025-08-13T10:19:00.000Z",
        "title": "Q1 2026 Earnings Release",
        "icsUrl": "https://in.marketscreener.com/api/stateful/agenda/event-async/Q1-2026-Earnings-Release-47329671.ics"
      },
      {
        "section": "Past",
        "dateTimeRaw": "18/07/2025",
        "dateTimeISO": "2025-07-17T18:30:00.000Z",
        "title": "Ex-dividend day for final dividend",
        "icsUrl": "https://in.marketscreener.com/api/stateful/agenda/event-async/Ex-dividend-day-for-final-dividend-50618194.ics"
      },
      {
        "section": "Past",
        "dateTimeRaw": "14/05/2025 05:00 pm",
        "dateTimeISO": "2025-05-14T11:30:00.000Z",
        "title": "Q4 2025 Earnings Call",
        "icsUrl": "https://in.marketscreener.com/api/stateful/agenda/event-async/Q4-2025-Earnings-Call-49889306.ics"
      },
      {
        "section": "Past",
        "dateTimeRaw": "14/05/2025 04:28 pm",
        "dateTimeISO": "2025-05-14T10:58:00.000Z",
        "title": "Q4 2025 Earnings Release",
        "icsUrl": "https://in.marketscreener.com/api/stateful/agenda/event-async/Q4-2025-Earnings-Release-44530537.ics"
      },
      {
        "section": "Past",
        "dateTimeRaw": "18/03/2025",
        "dateTimeISO": "2025-03-17T18:30:00.000Z",
        "title": "Jefferies Asia Forum",
        "icsUrl": "https://in.marketscreener.com/api/stateful/agenda/event-async/Jefferies-Asia-Forum-49308561.ics"
      },
      {
        "section": "Past",
        "dateTimeRaw": "27/02/2025 10:00 am",
        "dateTimeISO": "2025-02-27T04:30:00.000Z",
        "title": "Investor Day",
        "icsUrl": "https://in.marketscreener.com/api/stateful/agenda/event-async/Investor-Day-48887130.ics"
      },
      {
        "section": "Past",
        "dateTimeRaw": "12/02/2025 05:00 pm",
        "dateTimeISO": "2025-02-12T11:30:00.000Z",
        "title": "Q3 2025 Earnings Call",
        "icsUrl": "https://in.marketscreener.com/api/stateful/agenda/event-async/Q3-2025-Earnings-Call-48932187.ics"
      },
      {
        "section": "Past",
        "dateTimeRaw": "12/02/2025 03:12 pm",
        "dateTimeISO": "2025-02-12T09:42:00.000Z",
        "title": "Q3 2025 Earnings Release",
        "icsUrl": "https://in.marketscreener.com/api/stateful/agenda/event-async/Q3-2025-Earnings-Release-44530534.ics"
      },
      {
        "section": "Past",
        "dateTimeRaw": "20/11/2024",
        "dateTimeISO": "2024-11-19T18:30:00.000Z",
        "title": "Morgan Stanley Asia Pacific Summit",
        "icsUrl": "https://in.marketscreener.com/api/stateful/agenda/event-async/Morgan-Stanley-Asia-Pacific-Summit-48392230.ics"
      },
      {
        "section": "Past",
        "dateTimeRaw": "11/11/2024 06:00 pm",
        "dateTimeISO": "2024-11-11T12:30:00.000Z",
        "title": "Q2 2025 Earnings Call",
        "icsUrl": "https://in.marketscreener.com/api/stateful/agenda/event-async/Q2-2025-Earnings-Call-48285619.ics"
      },
      {
        "section": "Past",
        "dateTimeRaw": "11/11/2024 03:42 pm",
        "dateTimeISO": "2024-11-11T10:12:00.000Z",
        "title": "Q2 2025 Earnings Release",
        "icsUrl": "https://in.marketscreener.com/api/stateful/agenda/event-async/Q2-2025-Earnings-Release-44530532.ics"
      },
      {
        "section": "Past",
        "dateTimeRaw": "23/09/2024",
        "dateTimeISO": "2024-09-22T18:30:00.000Z",
        "title": "J.P. Morgan India Investor Summit",
        "icsUrl": "https://in.marketscreener.com/api/stateful/agenda/event-async/J-P-Morgan-India-Investor-Summit-47856217.ics"
      },
      {
        "section": "Past",
        "dateTimeRaw": "17/09/2024",
        "dateTimeISO": "2024-09-16T18:30:00.000Z",
        "title": "Jefferies India Forum",
        "icsUrl": "https://in.marketscreener.com/api/stateful/agenda/event-async/Jefferies-India-Forum-47856200.ics"
      },
      {
        "section": "Past",
        "dateTimeRaw": "09/08/2024 05:00 pm",
        "dateTimeISO": "2024-08-09T11:30:00.000Z",
        "title": "Q1 2025 Earnings Call",
        "icsUrl": "https://in.marketscreener.com/api/stateful/agenda/event-async/Q1-2025-Earnings-Call-47578783.ics"
      },
      {
        "section": "Past",
        "dateTimeRaw": "09/08/2024 04:07 pm",
        "dateTimeISO": "2024-08-09T10:37:00.000Z",
        "title": "Q1 2025 Earnings Release",
        "icsUrl": "https://in.marketscreener.com/api/stateful/agenda/event-async/Q1-2025-Earnings-Release-44174857.ics"
      },
      {
        "section": "Past",
        "dateTimeRaw": "12/07/2024",
        "dateTimeISO": "2024-07-11T18:30:00.000Z",
        "title": "Ex-dividend day for final dividend",
        "icsUrl": "https://in.marketscreener.com/api/stateful/agenda/event-async/Ex-dividend-day-for-final-dividend-47271569.ics"
      },
      {
        "section": "Past",
        "dateTimeRaw": "03/06/2024",
        "dateTimeISO": "2024-06-02T18:30:00.000Z",
        "title": "BofA India Conference",
        "icsUrl": "https://in.marketscreener.com/api/stateful/agenda/event-async/BofA-India-Conference-46848498.ics"
      },
      {
        "section": "Past",
        "dateTimeRaw": "22/05/2024 05:00 pm",
        "dateTimeISO": "2024-05-22T11:30:00.000Z",
        "title": "Q4 2024 Earnings Call",
        "icsUrl": "https://in.marketscreener.com/api/stateful/agenda/event-async/Q4-2024-Earnings-Call-46766410.ics"
      },
      {
        "section": "Past",
        "dateTimeRaw": "22/05/2024 03:43 pm",
        "dateTimeISO": "2024-05-22T10:13:00.000Z",
        "title": "Q4 2024 Earnings Release",
        "icsUrl": "https://in.marketscreener.com/api/stateful/agenda/event-async/Q4-2024-Earnings-Release-43772963.ics"
      },
      {
        "section": "Past",
        "dateTimeRaw": "12/03/2024 03:30 pm",
        "dateTimeISO": "2024-03-12T10:00:00.000Z",
        "title": "Business Update Call",
        "icsUrl": "https://in.marketscreener.com/api/stateful/agenda/event-async/Business-Update-Call-46193719.ics"
      },
      {
        "section": "Past",
        "dateTimeRaw": "27/02/2024",
        "dateTimeISO": "2024-02-26T18:30:00.000Z",
        "title": "HSBC MENAT Conference",
        "icsUrl": "https://in.marketscreener.com/api/stateful/agenda/event-async/HSBC-MENAT-Conference-46192963.ics"
      },
      {
        "section": "Past",
        "dateTimeRaw": "20/02/2024",
        "dateTimeISO": "2024-02-19T18:30:00.000Z",
        "title": "Roadshow - UBS",
        "icsUrl": "https://in.marketscreener.com/api/stateful/agenda/event-async/Roadshow-UBS-46192703.ics"
      },
      {
        "section": "Past",
        "dateTimeRaw": "20/02/2024",
        "dateTimeISO": "2024-02-19T18:30:00.000Z",
        "title": "Kotak Chasing Growth Conference",
        "icsUrl": "https://in.marketscreener.com/api/stateful/agenda/event-async/Kotak-Chasing-Growth-Conference-46192701.ics"
      },
      {
        "section": "Past",
        "dateTimeRaw": "31/01/2024 05:00 pm",
        "dateTimeISO": "2024-01-31T11:30:00.000Z",
        "title": "Q3 2024 Earnings Call",
        "icsUrl": "https://in.marketscreener.com/api/stateful/agenda/event-async/Q3-2024-Earnings-Call-45790254.ics"
      },
      {
        "section": "Past",
        "dateTimeRaw": "31/01/2024 03:07 pm",
        "dateTimeISO": "2024-01-31T09:37:00.000Z",
        "title": "Q3 2024 Earnings Release",
        "icsUrl": "https://in.marketscreener.com/api/stateful/agenda/event-async/Q3-2024-Earnings-Release-42841455.ics"
      },
      {
        "section": "Past",
        "dateTimeRaw": "05/12/2023",
        "dateTimeISO": "2023-12-04T18:30:00.000Z",
        "title": "HSBC Great India Consumer Trip",
        "icsUrl": "https://in.marketscreener.com/api/stateful/agenda/event-async/HSBC-Great-India-Consumer-Trip-45391111.ics"
      },
      {
        "section": "Past",
        "dateTimeRaw": "22/11/2023",
        "dateTimeISO": "2023-11-21T18:30:00.000Z",
        "title": "Goldman Sachs India CIO Tour",
        "icsUrl": "https://in.marketscreener.com/api/stateful/agenda/event-async/Goldman-Sachs-India-CIO-Tour-45391099.ics"
      },
      {
        "section": "Past",
        "dateTimeRaw": "15/11/2023",
        "dateTimeISO": "2023-11-14T18:30:00.000Z",
        "title": "Morgan Stanley Asia Pacific Summit",
        "icsUrl": "https://in.marketscreener.com/api/stateful/agenda/event-async/Morgan-Stanley-Asia-Pacific-Summit-45342578.ics"
      },
      {
        "section": "Past",
        "dateTimeRaw": "25/10/2023 06:00 pm",
        "dateTimeISO": "2023-10-25T12:30:00.000Z",
        "title": "Q2 2024 Earnings Call",
        "icsUrl": "https://in.marketscreener.com/api/stateful/agenda/event-async/Q2-2024-Earnings-Call-45341634.ics"
      },
      {
        "section": "Past",
        "dateTimeRaw": "25/10/2023 04:19 pm",
        "dateTimeISO": "2023-10-25T10:49:00.000Z",
        "title": "Q2 2024 Earnings Release",
        "icsUrl": "https://in.marketscreener.com/api/stateful/agenda/event-async/Q2-2024-Earnings-Release-42155693.ics"
      },
      {
        "section": "Past",
        "dateTimeRaw": "29/09/2023",
        "dateTimeISO": "2023-09-28T18:30:00.000Z",
        "title": "J.P. Morgan India Investor Summit",
        "icsUrl": "https://in.marketscreener.com/api/stateful/agenda/event-async/J-P-Morgan-India-Investor-Summit-44909775.ics"
      },
      {
        "section": "Past",
        "dateTimeRaw": "25/07/2023 05:00 pm",
        "dateTimeISO": "2023-07-25T11:30:00.000Z",
        "title": "Q1 2024 Earnings Call",
        "icsUrl": "https://in.marketscreener.com/api/stateful/agenda/event-async/Q1-2024-Earnings-Call-44375466.ics"
      },
      {
        "section": "Past",
        "dateTimeRaw": "25/07/2023 02:23 pm",
        "dateTimeISO": "2023-07-25T08:53:00.000Z",
        "title": "Q1 2024 Earnings Release",
        "icsUrl": "https://in.marketscreener.com/api/stateful/agenda/event-async/Q1-2024-Earnings-Release-41006048.ics"
      },
      {
        "section": "Past",
        "dateTimeRaw": "12/07/2023",
        "dateTimeISO": "2023-07-11T18:30:00.000Z",
        "title": "Ex-dividend day for final dividend",
        "icsUrl": "https://in.marketscreener.com/api/stateful/agenda/event-async/Ex-dividend-day-for-final-dividend-44296436.ics"
      },
      {
        "section": "Past",
        "dateTimeRaw": "02/06/2023",
        "dateTimeISO": "2023-06-01T18:30:00.000Z",
        "title": "Roadshow - Day 2",
        "icsUrl": "https://in.marketscreener.com/api/stateful/agenda/event-async/Roadshow-Day-2-43916239.ics"
      },
      {
        "section": "Past",
        "dateTimeRaw": "01/06/2023",
        "dateTimeISO": "2023-05-31T18:30:00.000Z",
        "title": "Roadshow - hosted by HSBC",
        "icsUrl": "https://in.marketscreener.com/api/stateful/agenda/event-async/Roadshow-hosted-by-HSBC-43916238.ics"
      },
      {
        "section": "Past",
        "dateTimeRaw": "23/05/2023",
        "dateTimeISO": "2023-05-22T18:30:00.000Z",
        "title": "Jefferies India Summit",
        "icsUrl": "https://in.marketscreener.com/api/stateful/agenda/event-async/Jefferies-India-Summit-43916209.ics"
      },
      {
        "section": "Past",
        "dateTimeRaw": "17/05/2023 05:00 pm",
        "dateTimeISO": "2023-05-17T11:30:00.000Z",
        "title": "Q4 2023 Earnings Call",
        "icsUrl": "https://in.marketscreener.com/api/stateful/agenda/event-async/Q4-2023-Earnings-Call-43903085.ics"
      },
      {
        "section": "Past",
        "dateTimeRaw": "17/05/2023 12:57 pm",
        "dateTimeISO": "2023-05-17T07:27:00.000Z",
        "title": "Q4 2023 Earnings Release",
        "icsUrl": "https://in.marketscreener.com/api/stateful/agenda/event-async/Q4-2023-Earnings-Release-40508699.ics"
      },
      {
        "section": "Past",
        "dateTimeRaw": "23/02/2023",
        "dateTimeISO": "2023-02-22T18:30:00.000Z",
        "title": "Investor Meeting - HSBC",
        "icsUrl": "https://in.marketscreener.com/api/stateful/agenda/event-async/Investor-Meeting-HSBC-43092463.ics"
      },
      {
        "section": "Past",
        "dateTimeRaw": "01/02/2023 05:00 pm",
        "dateTimeISO": "2023-02-01T11:30:00.000Z",
        "title": "Q3 2023 Earnings Call",
        "icsUrl": "https://in.marketscreener.com/api/stateful/agenda/event-async/Q3-2023-Earnings-Call-42841176.ics"
      },
      {
        "section": "Past",
        "dateTimeRaw": "01/02/2023 01:52 pm",
        "dateTimeISO": "2023-02-01T08:22:00.000Z",
        "title": "Q3 2023 Earnings Release",
        "icsUrl": "https://in.marketscreener.com/api/stateful/agenda/event-async/Q3-2023-Earnings-Release-37560478.ics"
      },
      {
        "section": "Past",
        "dateTimeRaw": "08/11/2022 05:00 pm",
        "dateTimeISO": "2022-11-08T11:30:00.000Z",
        "title": "Interim 2023 Earnings Call",
        "icsUrl": "https://in.marketscreener.com/api/stateful/agenda/event-async/Interim-2023-Earnings-Call-42221434.ics"
      },
      {
        "section": "Past",
        "dateTimeRaw": "08/11/2022 01:23 pm",
        "dateTimeISO": "2022-11-08T07:53:00.000Z",
        "title": "Interim 2023 Earnings Release",
        "icsUrl": "https://in.marketscreener.com/api/stateful/agenda/event-async/Interim-2023-Earnings-Release-36701028.ics"
      },
      {
        "section": "Past",
        "dateTimeRaw": "21/09/2022",
        "dateTimeISO": "2022-09-20T18:30:00.000Z",
        "title": "JP Morgan India Investor Summit",
        "icsUrl": "https://in.marketscreener.com/api/stateful/agenda/event-async/JP-Morgan-India-Investor-Summit-41801215.ics"
      },
      {
        "section": "Past",
        "dateTimeRaw": "19/09/2022",
        "dateTimeISO": "2022-09-18T18:30:00.000Z",
        "title": "Motilal Oswal Global Investor Conference",
        "icsUrl": "https://in.marketscreener.com/api/stateful/agenda/event-async/Motilal-Oswal-Global-Investor-Conference-41801195.ics"
      },
      {
        "section": "Past",
        "dateTimeRaw": "30/08/2022 11:00 am",
        "dateTimeISO": "2022-08-30T05:30:00.000Z",
        "title": "Annual General Meeting",
        "icsUrl": "https://in.marketscreener.com/api/stateful/agenda/event-async/Annual-General-Meeting-41148496.ics"
      },
      {
        "section": "Past",
        "dateTimeRaw": "28/07/2022 05:00 pm",
        "dateTimeISO": "2022-07-28T11:30:00.000Z",
        "title": "Q1 2023 Earnings Call",
        "icsUrl": "https://in.marketscreener.com/api/stateful/agenda/event-async/Q1-2023-Earnings-Call-41069341.ics"
      },
      {
        "section": "Past",
        "dateTimeRaw": "28/07/2022 12:29 pm",
        "dateTimeISO": "2022-07-28T06:59:00.000Z",
        "title": "Q1 2023 Earnings Release",
        "icsUrl": "https://in.marketscreener.com/api/stateful/agenda/event-async/Q1-2023-Earnings-Release-35977283.ics"
      },
      {
        "section": "Past",
        "dateTimeRaw": "08/07/2022",
        "dateTimeISO": "2022-07-07T18:30:00.000Z",
        "title": "Ex-dividend day for final dividend",
        "icsUrl": "https://in.marketscreener.com/api/stateful/agenda/event-async/Ex-dividend-day-for-final-dividend-40762839.ics"
      },
      {
        "section": "Past",
        "dateTimeRaw": "30/05/2022 05:00 pm",
        "dateTimeISO": "2022-05-30T11:30:00.000Z",
        "title": "FY 2022 Earnings Call",
        "icsUrl": "https://in.marketscreener.com/api/stateful/agenda/event-async/FY-2022-Earnings-Call-40579368.ics"
      },
      {
        "section": "Past",
        "dateTimeRaw": "30/05/2022 02:08 pm",
        "dateTimeISO": "2022-05-30T08:38:00.000Z",
        "title": "FY 2022 Earnings Release",
        "icsUrl": "https://in.marketscreener.com/api/stateful/agenda/event-async/FY-2022-Earnings-Release-31719359.ics"
      },
      {
        "section": "Past",
        "dateTimeRaw": "19/04/2022",
        "dateTimeISO": "2022-04-18T18:30:00.000Z",
        "title": "Split: 5 of 1",
        "icsUrl": "https://in.marketscreener.com/api/stateful/agenda/event-async/Split-5-of-1-40136314.ics"
      },
      {
        "section": "Past",
        "dateTimeRaw": "02/02/2022 05:00 pm",
        "dateTimeISO": "2022-02-02T11:30:00.000Z",
        "title": "Q3 2022 Earnings Call",
        "icsUrl": "https://in.marketscreener.com/api/stateful/agenda/event-async/Q3-2022-Earnings-Call-37687731.ics"
      },
      {
        "section": "Past",
        "dateTimeRaw": "02/02/2022 02:13 pm",
        "dateTimeISO": "2022-02-02T08:43:00.000Z",
        "title": "Q3 2022 Earnings Release",
        "icsUrl": "https://in.marketscreener.com/api/stateful/agenda/event-async/Q3-2022-Earnings-Release-31719346.ics"
      },
      {
        "section": "Past",
        "dateTimeRaw": "20/10/2021 05:00 pm",
        "dateTimeISO": "2021-10-20T11:30:00.000Z",
        "title": "Interim 2022 Earnings Call",
        "icsUrl": "https://in.marketscreener.com/api/stateful/agenda/event-async/Interim-2022-Earnings-Call-36700760.ics"
      },
      {
        "section": "Past",
        "dateTimeRaw": "17/09/2021 11:00 am",
        "dateTimeISO": "2021-09-17T05:30:00.000Z",
        "title": "Annual General Meeting",
        "icsUrl": "https://in.marketscreener.com/api/stateful/agenda/event-async/Annual-General-Meeting-36334870.ics"
      },
      {
        "section": "Past",
        "dateTimeRaw": "06/09/2021",
        "dateTimeISO": "2021-09-05T18:30:00.000Z",
        "title": "Motilal Oswal Global Investor Conference",
        "icsUrl": "https://in.marketscreener.com/api/stateful/agenda/event-async/Motilal-Oswal-Global-Investor-Conference-36405425.ics"
      },
      {
        "section": "Past",
        "dateTimeRaw": "21/07/2021 05:00 pm",
        "dateTimeISO": "2021-07-21T11:30:00.000Z",
        "title": "Q1 2022 Earnings Call",
        "icsUrl": "https://in.marketscreener.com/api/stateful/agenda/event-async/Q1-2022-Earnings-Call-35976251.ics"
      },
      {
        "section": "Past",
        "dateTimeRaw": "21/07/2021",
        "dateTimeISO": "2021-07-20T18:30:00.000Z",
        "title": "Q1 2022 Earnings Release",
        "icsUrl": "https://in.marketscreener.com/api/stateful/agenda/event-async/Q1-2022-Earnings-Release-30664851.ics"
      },
      {
        "section": "Past",
        "dateTimeRaw": "15/06/2021 05:00 pm",
        "dateTimeISO": "2021-06-15T11:30:00.000Z",
        "title": "FY 2021 Earnings Call",
        "icsUrl": "https://in.marketscreener.com/api/stateful/agenda/event-async/FY-2021-Earnings-Call-35593116.ics"
      },
      {
        "section": "Past",
        "dateTimeRaw": "15/06/2021",
        "dateTimeISO": "2021-06-14T18:30:00.000Z",
        "title": "FY 2021 Earnings Release",
        "icsUrl": "https://in.marketscreener.com/api/stateful/agenda/event-async/FY-2021-Earnings-Release-31162908.ics"
      },
      {
        "section": "Past",
        "dateTimeRaw": "03/02/2021 05:00 pm",
        "dateTimeISO": "2021-02-03T11:30:00.000Z",
        "title": "Q3 2021 Earnings Call",
        "icsUrl": "https://in.marketscreener.com/api/stateful/agenda/event-async/Q3-2021-Earnings-Call-32320693.ics"
      },
      {
        "section": "Past",
        "dateTimeRaw": "03/02/2021",
        "dateTimeISO": "2021-02-02T18:30:00.000Z",
        "title": "Q3 2021 Earnings Release",
        "icsUrl": "https://in.marketscreener.com/api/stateful/agenda/event-async/Q3-2021-Earnings-Release-29892033.ics"
      },
      {
        "section": "Past",
        "dateTimeRaw": "12/11/2020 05:00 pm",
        "dateTimeISO": "2020-11-12T11:30:00.000Z",
        "title": "Interim 2021 Earnings Call",
        "icsUrl": "https://in.marketscreener.com/api/stateful/agenda/event-async/Interim-2021-Earnings-Call-31718918.ics"
      },
      {
        "section": "Past",
        "dateTimeRaw": "12/11/2020",
        "dateTimeISO": "2020-11-11T18:30:00.000Z",
        "title": "Interim 2021 Earnings Release",
        "icsUrl": "https://in.marketscreener.com/api/stateful/agenda/event-async/Interim-2021-Earnings-Release-29404491.ics"
      },
      {
        "section": "Past",
        "dateTimeRaw": "02/09/2020 05:00 pm",
        "dateTimeISO": "2020-09-02T11:30:00.000Z",
        "title": "Q1 2021 Earnings Call",
        "icsUrl": "https://in.marketscreener.com/api/stateful/agenda/event-async/Q1-2021-Earnings-Call-31203055.ics"
      },
      {
        "section": "Past",
        "dateTimeRaw": "02/09/2020",
        "dateTimeISO": "2020-09-01T18:30:00.000Z",
        "title": "Q1 2021 Earnings Release",
        "icsUrl": "https://in.marketscreener.com/api/stateful/agenda/event-async/Q1-2021-Earnings-Release-28898071.ics"
      },
      {
        "section": "Past",
        "dateTimeRaw": "20/05/2020 05:00 pm",
        "dateTimeISO": "2020-05-20T11:30:00.000Z",
        "title": "FY 2020 Earnings Call",
        "icsUrl": "https://in.marketscreener.com/api/stateful/agenda/event-async/FY-2020-Earnings-Call-30664259.ics"
      },
      {
        "section": "Past",
        "dateTimeRaw": "20/05/2020",
        "dateTimeISO": "2020-05-19T18:30:00.000Z",
        "title": "FY 2020 Earnings Release",
        "icsUrl": "https://in.marketscreener.com/api/stateful/agenda/event-async/FY-2020-Earnings-Release-28316875.ics"
      },
      {
        "section": "Past",
        "dateTimeRaw": "09/03/2020",
        "dateTimeISO": "2020-03-08T18:30:00.000Z",
        "title": "Ex-dividend day for dividende intermdiaire",
        "icsUrl": "https://in.marketscreener.com/api/stateful/agenda/event-async/Ex-dividend-day-for-dividende-intermediaire-30090152.ics"
      },
      {
        "section": "Past",
        "dateTimeRaw": "29/01/2020 05:00 pm",
        "dateTimeISO": "2020-01-29T11:30:00.000Z",
        "title": "Q3 2020 Earnings Call",
        "icsUrl": "https://in.marketscreener.com/api/stateful/agenda/event-async/Q3-2020-Earnings-Call-29889644.ics"
      },
      {
        "section": "Past",
        "dateTimeRaw": "29/01/2020",
        "dateTimeISO": "2020-01-28T18:30:00.000Z",
        "title": "Q3 2020 Earnings Release",
        "icsUrl": "https://in.marketscreener.com/api/stateful/agenda/event-async/Q3-2020-Earnings-Release-28302912.ics"
      },
      {
        "section": "Past",
        "dateTimeRaw": "22/10/2019 05:00 pm",
        "dateTimeISO": "2019-10-22T11:30:00.000Z",
        "title": "Interim 2020 Earnings Call",
        "icsUrl": "https://in.marketscreener.com/api/stateful/agenda/event-async/Interim-2020-Earnings-Call-29424480.ics"
      },
      {
        "section": "Past",
        "dateTimeRaw": "22/10/2019",
        "dateTimeISO": "2019-10-21T18:30:00.000Z",
        "title": "Interim 2020 Earnings Release",
        "icsUrl": "https://in.marketscreener.com/api/stateful/agenda/event-async/Interim-2020-Earnings-Release-28289841.ics"
      },
      {
        "section": "Past",
        "dateTimeRaw": "24/09/2019 10:30 am",
        "dateTimeISO": "2019-09-24T05:00:00.000Z",
        "title": "Annual General Meeting",
        "icsUrl": "https://in.marketscreener.com/api/stateful/agenda/event-async/Annual-General-Meeting-29173096.ics"
      },
      {
        "section": "Past",
        "dateTimeRaw": "16/09/2019",
        "dateTimeISO": "2019-09-15T18:30:00.000Z",
        "title": "Ex-dividend day for final dividend",
        "icsUrl": "https://in.marketscreener.com/api/stateful/agenda/event-async/Ex-dividend-day-for-final-dividend-29144192.ics"
      },
      {
        "section": "Past",
        "dateTimeRaw": "24/07/2019 05:00 pm",
        "dateTimeISO": "2019-07-24T11:30:00.000Z",
        "title": "Q1 2020 Earnings Call",
        "icsUrl": "https://in.marketscreener.com/api/stateful/agenda/event-async/Q1-2020-Earnings-Call-28932404.ics"
      },
      {
        "section": "Past",
        "dateTimeRaw": "24/07/2019",
        "dateTimeISO": "2019-07-23T18:30:00.000Z",
        "title": "Q1 2020 Earnings Release",
        "icsUrl": "https://in.marketscreener.com/api/stateful/agenda/event-async/Q1-2020-Earnings-Release-26401118.ics"
      },
      {
        "section": "Past",
        "dateTimeRaw": "15/05/2019",
        "dateTimeISO": "2019-05-14T18:30:00.000Z",
        "title": "FY 2019 Earnings Release",
        "icsUrl": "https://in.marketscreener.com/api/stateful/agenda/event-async/FY-2019-Earnings-Release-25392411.ics"
      },
      {
        "section": "Past",
        "dateTimeRaw": "30/01/2019 04:30 pm",
        "dateTimeISO": "2019-01-30T11:00:00.000Z",
        "title": "Q3 2019 Earnings Call",
        "icsUrl": "https://in.marketscreener.com/api/stateful/agenda/event-async/Q3-2019-Earnings-Call-27857913.ics"
      },
      {
        "section": "Past",
        "dateTimeRaw": "30/01/2019",
        "dateTimeISO": "2019-01-29T18:30:00.000Z",
        "title": "Q3 2019 Earnings Release",
        "icsUrl": "https://in.marketscreener.com/api/stateful/agenda/event-async/Q3-2019-Earnings-Release-25392161.ics"
      },
      {
        "section": "Past",
        "dateTimeRaw": "24/10/2018 04:30 pm",
        "dateTimeISO": "2018-10-24T11:00:00.000Z",
        "title": "Interim 2019 Earnings Call",
        "icsUrl": "https://in.marketscreener.com/api/stateful/agenda/event-async/Interim-2019-Earnings-Call-27416055.ics"
      },
      {
        "section": "Past",
        "dateTimeRaw": "24/10/2018",
        "dateTimeISO": "2018-10-23T18:30:00.000Z",
        "title": "Interim 2019 Earnings Release",
        "icsUrl": "https://in.marketscreener.com/api/stateful/agenda/event-async/Interim-2019-Earnings-Release-25391584.ics"
      },
      {
        "section": "Past",
        "dateTimeRaw": "27/09/2018 10:30 am",
        "dateTimeISO": "2018-09-27T05:00:00.000Z",
        "title": "Annual General Meeting",
        "icsUrl": "https://in.marketscreener.com/api/stateful/agenda/event-async/Annual-General-Meeting-27265417.ics"
      },
      {
        "section": "Past",
        "dateTimeRaw": "18/09/2018",
        "dateTimeISO": "2018-09-17T18:30:00.000Z",
        "title": "Ex-dividend day for final dividend",
        "icsUrl": "https://in.marketscreener.com/api/stateful/agenda/event-async/Ex-dividend-day-for-final-dividend-27198787.ics"
      },
      {
        "section": "Past",
        "dateTimeRaw": "25/07/2018 04:30 pm",
        "dateTimeISO": "2018-07-25T11:00:00.000Z",
        "title": "Q1 2019 Earnings Call",
        "icsUrl": "https://in.marketscreener.com/api/stateful/agenda/event-async/Q1-2019-Earnings-Call-26930115.ics"
      },
      {
        "section": "Past",
        "dateTimeRaw": "25/07/2018",
        "dateTimeISO": "2018-07-24T18:30:00.000Z",
        "title": "Q1 2019 Earnings Release",
        "icsUrl": "https://in.marketscreener.com/api/stateful/agenda/event-async/Q1-2019-Earnings-Release-25389040.ics"
      },
      {
        "section": "Past",
        "dateTimeRaw": "21/06/2018",
        "dateTimeISO": "2018-06-20T18:30:00.000Z",
        "title": "Bonus Issue: 1 new share for 1 existing share",
        "icsUrl": "https://in.marketscreener.com/api/stateful/agenda/event-async/Bonus-Issue-1-new-share-for-1-existing-share-26817542.ics"
      },
      {
        "section": "Past",
        "dateTimeRaw": "08/05/2018 04:30 pm",
        "dateTimeISO": "2018-05-08T11:00:00.000Z",
        "title": "FY 2018 Earnings Call",
        "icsUrl": "https://in.marketscreener.com/api/stateful/agenda/event-async/FY-2018-Earnings-Call-26492812.ics"
      },
      {
        "section": "Past",
        "dateTimeRaw": "08/05/2018",
        "dateTimeISO": "2018-05-07T18:30:00.000Z",
        "title": "FY 2018 Earnings Release",
        "icsUrl": "https://in.marketscreener.com/api/stateful/agenda/event-async/FY-2018-Earnings-Release-24936779.ics"
      },
      {
        "section": "Past",
        "dateTimeRaw": "19/01/2018 04:30 pm",
        "dateTimeISO": "2018-01-19T11:00:00.000Z",
        "title": "Q3 2018 Earnings Call",
        "icsUrl": "https://in.marketscreener.com/api/stateful/agenda/event-async/Q3-2018-Earnings-Call-25821606.ics"
      },
      {
        "section": "Past",
        "dateTimeRaw": "19/01/2018",
        "dateTimeISO": "2018-01-18T18:30:00.000Z",
        "title": "Q3 2018 Earnings Release",
        "icsUrl": "https://in.marketscreener.com/api/stateful/agenda/event-async/Q3-2018-Earnings-Release-23769617.ics"
      },
      {
        "section": "Past",
        "dateTimeRaw": "26/10/2017 04:30 pm",
        "dateTimeISO": "2017-10-26T11:00:00.000Z",
        "title": "Interim 2018 Earnings Call",
        "icsUrl": "https://in.marketscreener.com/api/stateful/agenda/event-async/Interim-2018-Earnings-Call-25327453.ics"
      },
      {
        "section": "Past",
        "dateTimeRaw": "26/10/2017",
        "dateTimeISO": "2017-10-25T18:30:00.000Z",
        "title": "Interim 2018 Earnings Release",
        "icsUrl": "https://in.marketscreener.com/api/stateful/agenda/event-async/Interim-2018-Earnings-Release-23769570.ics"
      },
      {
        "section": "Past",
        "dateTimeRaw": "28/08/2017",
        "dateTimeISO": "2017-08-27T18:30:00.000Z",
        "title": "Annual General Meeting",
        "icsUrl": "https://in.marketscreener.com/api/stateful/agenda/event-async/Annual-General-Meeting-24936248.ics"
      },
      {
        "section": "Past",
        "dateTimeRaw": "18/08/2017",
        "dateTimeISO": "2017-08-17T18:30:00.000Z",
        "title": "Ex-dividend day for final dividend",
        "icsUrl": "https://in.marketscreener.com/api/stateful/agenda/event-async/Ex-dividend-day-for-final-dividend-24896622.ics"
      },
      {
        "section": "Past",
        "dateTimeRaw": "17/07/2017 04:00 pm",
        "dateTimeISO": "2017-07-17T10:30:00.000Z",
        "title": "Q1 2018 Earnings Call",
        "icsUrl": "https://in.marketscreener.com/api/stateful/agenda/event-async/Q1-2018-Earnings-Call-24758436.ics"
      },
      {
        "section": "Past",
        "dateTimeRaw": "17/07/2017",
        "dateTimeISO": "2017-07-16T18:30:00.000Z",
        "title": "Q1 2018 Earnings Release",
        "icsUrl": "https://in.marketscreener.com/api/stateful/agenda/event-async/Q1-2018-Earnings-Release-23769529.ics"
      },
      {
        "section": "Past",
        "dateTimeRaw": "29/05/2017 04:00 pm",
        "dateTimeISO": "2017-05-29T10:30:00.000Z",
        "title": "FY 2017 Earnings Call",
        "icsUrl": "https://in.marketscreener.com/api/stateful/agenda/event-async/FY-2017-Earnings-Call-24480640.ics"
      },
      {
        "section": "Past",
        "dateTimeRaw": "29/05/2017",
        "dateTimeISO": "2017-05-28T18:30:00.000Z",
        "title": "FY 2017 Earnings Release",
        "icsUrl": "https://in.marketscreener.com/api/stateful/agenda/event-async/FY-2017-Earnings-Release-20963341.ics"
      },
      {
        "section": "Past",
        "dateTimeRaw": "06/02/2017 04:30 pm",
        "dateTimeISO": "2017-02-06T11:00:00.000Z",
        "title": "Q3 2017 Earnings Call",
        "icsUrl": "https://in.marketscreener.com/api/stateful/agenda/event-async/Q3-2017-Earnings-Call-23770994.ics"
      },
      {
        "section": "Past",
        "dateTimeRaw": "06/02/2017",
        "dateTimeISO": "2017-02-05T18:30:00.000Z",
        "title": "Q3 2017 Earnings Release",
        "icsUrl": "https://in.marketscreener.com/api/stateful/agenda/event-async/Q3-2017-Earnings-Release-20962069.ics"
      },
      {
        "section": "Past",
        "dateTimeRaw": "26/10/2016 05:00 pm",
        "dateTimeISO": "2016-10-26T11:30:00.000Z",
        "title": "Interim 2017 Earnings Call",
        "icsUrl": "https://in.marketscreener.com/api/stateful/agenda/event-async/Interim-2017-Earnings-Call-23185315.ics"
      },
      {
        "section": "Past",
        "dateTimeRaw": "26/10/2016",
        "dateTimeISO": "2016-10-25T18:30:00.000Z",
        "title": "Interim 2017 Earnings Release",
        "icsUrl": "https://in.marketscreener.com/api/stateful/agenda/event-async/Interim-2017-Earnings-Release-19672943.ics"
      },
      {
        "section": "Past",
        "dateTimeRaw": "06/09/2016 02:00 pm",
        "dateTimeISO": "2016-09-06T08:30:00.000Z",
        "title": "Q1 2017 Earnings Call",
        "icsUrl": "https://in.marketscreener.com/api/stateful/agenda/event-async/Q1-2017-Earnings-Call-22965828.ics"
      },
      {
        "section": "Past",
        "dateTimeRaw": "03/09/2016",
        "dateTimeISO": "2016-09-02T18:30:00.000Z",
        "title": "Q1 2017 Earnings Release",
        "icsUrl": "https://in.marketscreener.com/api/stateful/agenda/event-async/Q1-2017-Earnings-Release-19664969.ics"
      },
      {
        "section": "Past",
        "dateTimeRaw": "01/09/2016 10:30 am",
        "dateTimeISO": "2016-09-01T05:00:00.000Z",
        "title": "Annual General Meeting",
        "icsUrl": "https://in.marketscreener.com/api/stateful/agenda/event-async/Annual-General-Meeting-22862992.ics"
      },
      {
        "section": "Past",
        "dateTimeRaw": "24/08/2016",
        "dateTimeISO": "2016-08-23T18:30:00.000Z",
        "title": "Ex-dividend day for final dividend",
        "icsUrl": "https://in.marketscreener.com/api/stateful/agenda/event-async/Ex-dividend-day-for-final-dividend-22864204.ics"
      },
      {
        "section": "Past",
        "dateTimeRaw": "30/05/2016 04:00 pm",
        "dateTimeISO": "2016-05-30T10:30:00.000Z",
        "title": "FY 2016 Earnings Call",
        "icsUrl": "https://in.marketscreener.com/api/stateful/agenda/event-async/FY-2016-Earnings-Call-22399282.ics"
      },
      {
        "section": "Past",
        "dateTimeRaw": "28/05/2016",
        "dateTimeISO": "2016-05-27T18:30:00.000Z",
        "title": "FY 2016 Earnings Release",
        "icsUrl": "https://in.marketscreener.com/api/stateful/agenda/event-async/FY-2016-Earnings-Release-19658970.ics"
      },
      {
        "section": "Past",
        "dateTimeRaw": "11/02/2016 04:30 pm",
        "dateTimeISO": "2016-02-11T11:00:00.000Z",
        "title": "Q3 2016 Earnings Call",
        "icsUrl": "https://in.marketscreener.com/api/stateful/agenda/event-async/Q3-2016-Earnings-Call-21772844.ics"
      },
      {
        "section": "Past",
        "dateTimeRaw": "11/02/2016",
        "dateTimeISO": "2016-02-10T18:30:00.000Z",
        "title": "Q3 2016 Earnings Release",
        "icsUrl": "https://in.marketscreener.com/api/stateful/agenda/event-async/Q3-2016-Earnings-Release-19649573.ics"
      },
      {
        "section": "Past",
        "dateTimeRaw": "05/11/2015 04:30 pm",
        "dateTimeISO": "2015-11-05T11:00:00.000Z",
        "title": "Interim 2016 Earnings Call",
        "icsUrl": "https://in.marketscreener.com/api/stateful/agenda/event-async/Interim-2016-Earnings-Call-21258242.ics"
      },
      {
        "section": "Past",
        "dateTimeRaw": "05/11/2015",
        "dateTimeISO": "2015-11-04T18:30:00.000Z",
        "title": "Interim 2016 Earnings Release",
        "icsUrl": "https://in.marketscreener.com/api/stateful/agenda/event-async/Interim-2016-Earnings-Release-19181773.ics"
      },
      {
        "section": "Past",
        "dateTimeRaw": "03/09/2015 10:30 am",
        "dateTimeISO": "2015-09-03T05:00:00.000Z",
        "title": "Annual General Meeting",
        "icsUrl": "https://in.marketscreener.com/api/stateful/agenda/event-async/Annual-General-Meeting-20870667.ics"
      },
      {
        "section": "Past",
        "dateTimeRaw": "26/08/2015",
        "dateTimeISO": "2015-08-25T18:30:00.000Z",
        "title": "Ex-dividend day for final dividend",
        "icsUrl": "https://in.marketscreener.com/api/stateful/agenda/event-async/Ex-dividend-day-for-final-dividend-20834994.ics"
      },
      {
        "section": "Past",
        "dateTimeRaw": "14/08/2015 04:00 pm",
        "dateTimeISO": "2015-08-14T10:30:00.000Z",
        "title": "Q1 2016 Earnings Call",
        "icsUrl": "https://in.marketscreener.com/api/stateful/agenda/event-async/Q1-2016-Earnings-Call-20791278.ics"
      },
      {
        "section": "Past",
        "dateTimeRaw": "13/08/2015",
        "dateTimeISO": "2015-08-12T18:30:00.000Z",
        "title": "Q1 2016 Earnings Release",
        "icsUrl": "https://in.marketscreener.com/api/stateful/agenda/event-async/Q1-2016-Earnings-Release-18724309.ics"
      },
      {
        "section": "Past",
        "dateTimeRaw": "14/05/2015 04:00 pm",
        "dateTimeISO": "2015-05-14T10:30:00.000Z",
        "title": "FY 2015 Earnings Call",
        "icsUrl": "https://in.marketscreener.com/api/stateful/agenda/event-async/FY-2015-Earnings-Call-20347787.ics"
      },
      {
        "section": "Past",
        "dateTimeRaw": "14/05/2015",
        "dateTimeISO": "2015-05-13T18:30:00.000Z",
        "title": "FY 2015 Earnings Release",
        "icsUrl": "https://in.marketscreener.com/api/stateful/agenda/event-async/FY-2015-Earnings-Release-18258644.ics"
      },
      {
        "section": "Past",
        "dateTimeRaw": "05/02/2015 04:00 pm",
        "dateTimeISO": "2015-02-05T10:30:00.000Z",
        "title": "Q3 2015 Earnings Call",
        "icsUrl": "https://in.marketscreener.com/api/stateful/agenda/event-async/Q3-2015-Earnings-Call-19794398.ics"
      },
      {
        "section": "Past",
        "dateTimeRaw": "05/02/2015",
        "dateTimeISO": "2015-02-04T18:30:00.000Z",
        "title": "Q3 2015 Earnings Release",
        "icsUrl": "https://in.marketscreener.com/api/stateful/agenda/event-async/Q3-2015-Earnings-Release-17791282.ics"
      }
    ]
  },
  "pastDividends": {
    "count": 11,
    "dividends": [
      {
        "section": "Past Dividends",
        "dateRaw": "18/07/2025",
        "dateISO": "2025-07-17T18:30:00.000Z",
        "type": "Annual",
        "amount": 1.2,
        "currency": "INR",
        "title": "Annual 1.2 INR"
      },
      {
        "section": "Past Dividends",
        "dateRaw": "12/07/2024",
        "dateISO": "2024-07-11T18:30:00.000Z",
        "type": "Annual",
        "amount": 1.2,
        "currency": "INR",
        "title": "Annual 1.2 INR"
      },
      {
        "section": "Past Dividends",
        "dateRaw": "12/07/2023",
        "dateISO": "2023-07-11T18:30:00.000Z",
        "type": "Annual",
        "amount": 1.2,
        "currency": "INR",
        "title": "Annual 1.2 INR"
      },
      {
        "section": "Past Dividends",
        "dateRaw": "08/07/2022",
        "dateISO": "2022-07-07T18:30:00.000Z",
        "type": "Annual",
        "amount": 1.2,
        "currency": "INR",
        "title": "Annual 1.2 INR"
      },
      {
        "section": "Past Dividends",
        "dateRaw": "06/08/2021",
        "dateISO": "2021-08-05T18:30:00.000Z",
        "type": "Annual",
        "amount": 6,
        "currency": "INR",
        "title": "Annual 6 INR"
      },
      {
        "section": "Past Dividends",
        "dateRaw": "09/03/2020",
        "dateISO": "2020-03-08T18:30:00.000Z",
        "type": "Interim Payment",
        "amount": 6,
        "currency": "INR",
        "title": "Interim Payment 6 INR"
      },
      {
        "section": "Past Dividends",
        "dateRaw": "16/09/2019",
        "dateISO": "2019-09-15T18:30:00.000Z",
        "type": "Annual",
        "amount": 5,
        "currency": "INR",
        "title": "Annual 5 INR"
      },
      {
        "section": "Past Dividends",
        "dateRaw": "18/09/2018",
        "dateISO": "2018-09-17T18:30:00.000Z",
        "type": "Annual",
        "amount": 2.5,
        "currency": "INR",
        "title": "Annual 2.5 INR"
      },
      {
        "section": "Past Dividends",
        "dateRaw": "18/08/2017",
        "dateISO": "2017-08-17T18:30:00.000Z",
        "type": "Annual",
        "amount": 2.5,
        "currency": "INR",
        "title": "Annual 2.5 INR"
      },
      {
        "section": "Past Dividends",
        "dateRaw": "24/08/2016",
        "dateISO": "2016-08-23T18:30:00.000Z",
        "type": "Annual",
        "amount": 2.5,
        "currency": "INR",
        "title": "Annual 2.5 INR"
      },
      {
        "section": "Past Dividends",
        "dateRaw": "26/08/2015",
        "dateISO": "2015-08-25T18:30:00.000Z",
        "type": "Annual",
        "amount": 2.5,
        "currency": "INR",
        "title": "Annual 2.5 INR"
      }
    ]
  }
}