{
  "companyCode": "KEI-INDUSTRIES-LIMITED-6498805",
  "timestamp": "2025-10-13T12:27:31.210Z",
  "annualResults": {
    "2023": {
      "Net salesMillion INR": {
        "metric": "Net salesMillion INR",
        "unit": "Million INR",
        "fiscalMonth": "March",
        "year": "2023",
        "released": "69 123",
        "forecast": "68 855",
        "spreadRaw": "0.39%"
      },
      "EBITDAMillion INR": {
        "metric": "EBITDAMillion INR",
        "unit": "Million INR",
        "fiscalMonth": "March",
        "year": "2023",
        "released": "7 062",
        "forecast": "7 133",
        "spreadRaw": "-1%"
      },
      "EBITMillion INR": {
        "metric": "EBITMillion INR",
        "unit": "Million INR",
        "fiscalMonth": "March",
        "year": "2023",
        "released": "6 491",
        "forecast": "6 599",
        "spreadRaw": "-1.63%"
      },
      "Earnings before Tax (EBT)Million INR": {
        "metric": "Earnings before Tax (EBT)Million INR",
        "unit": "Million INR",
        "fiscalMonth": "March",
        "year": "2023",
        "released": "6 420",
        "forecast": "6 457",
        "spreadRaw": "-0.56%"
      },
      "Net incomeMillion INR": {
        "metric": "Net incomeMillion INR",
        "unit": "Million INR",
        "fiscalMonth": "March",
        "year": "2023",
        "released": "4 774",
        "forecast": "4 816",
        "spreadRaw": "-0.88%"
      },
      "EPS INR": {
        "metric": "EPS INR",
        "unit": "INR",
        "fiscalMonth": "March",
        "year": "2023",
        "released": "52,9",
        "forecast": "53,3",
        "spreadRaw": "-0.73%"
      },
      "Announcement Date": {
        "metric": "Announcement Date",
        "unit": null,
        "fiscalMonth": "March",
        "year": "2023",
        "released": "02/05/23",
        "forecast": null,
        "spreadRaw": null
      }
    },
    "2024": {
      "Net salesMillion INR": {
        "metric": "Net salesMillion INR",
        "unit": "Million INR",
        "fiscalMonth": "March",
        "year": "2024",
        "released": "81 041",
        "forecast": "81 424",
        "spreadRaw": "-0.47%"
      },
      "EBITDAMillion INR": {
        "metric": "EBITDAMillion INR",
        "unit": "Million INR",
        "fiscalMonth": "March",
        "year": "2024",
        "released": "8 375",
        "forecast": "8 553",
        "spreadRaw": "-2.08%"
      },
      "EBITMillion INR": {
        "metric": "EBITMillion INR",
        "unit": "Million INR",
        "fiscalMonth": "March",
        "year": "2024",
        "released": "7 762",
        "forecast": "7 996",
        "spreadRaw": "-2.93%"
      },
      "Earnings before Tax (EBT)Million INR": {
        "metric": "Earnings before Tax (EBT)Million INR",
        "unit": "Million INR",
        "fiscalMonth": "March",
        "year": "2024",
        "released": "7 813",
        "forecast": "7 926",
        "spreadRaw": "-1.43%"
      },
      "Net incomeMillion INR": {
        "metric": "Net incomeMillion INR",
        "unit": "Million INR",
        "fiscalMonth": "March",
        "year": "2024",
        "released": "5 811",
        "forecast": "5 899",
        "spreadRaw": "-1.51%"
      },
      "EPS INR": {
        "metric": "EPS INR",
        "unit": "INR",
        "fiscalMonth": "March",
        "year": "2024",
        "released": "64,3",
        "forecast": "65,3",
        "spreadRaw": "-1.58%"
      },
      "Announcement Date": {
        "metric": "Announcement Date",
        "unit": null,
        "fiscalMonth": "March",
        "year": "2024",
        "released": "02/05/24",
        "forecast": null,
        "spreadRaw": null
      }
    },
    "2025": {
      "Net salesMillion INR": {
        "metric": "Net salesMillion INR",
        "unit": "Million INR",
        "fiscalMonth": "March",
        "year": "2025",
        "released": "97 359",
        "forecast": "95 473",
        "spreadRaw": "1.97%"
      },
      "EBITDAMillion INR": {
        "metric": "EBITDAMillion INR",
        "unit": "Million INR",
        "fiscalMonth": "March",
        "year": "2025",
        "released": "9 910",
        "forecast": "9 817",
        "spreadRaw": "0.94%"
      },
      "EBITMillion INR": {
        "metric": "EBITMillion INR",
        "unit": "Million INR",
        "fiscalMonth": "March",
        "year": "2025",
        "released": "9 208",
        "forecast": "9 168",
        "spreadRaw": "0.44%"
      },
      "Earnings before Tax (EBT)Million INR": {
        "metric": "Earnings before Tax (EBT)Million INR",
        "unit": "Million INR",
        "fiscalMonth": "March",
        "year": "2025",
        "released": "9 370",
        "forecast": "9 157",
        "spreadRaw": "2.33%"
      },
      "Net incomeMillion INR": {
        "metric": "Net incomeMillion INR",
        "unit": "Million INR",
        "fiscalMonth": "March",
        "year": "2025",
        "released": "6 964",
        "forecast": "6 723",
        "spreadRaw": "3.59%"
      },
      "EPS INR": {
        "metric": "EPS INR",
        "unit": "INR",
        "fiscalMonth": "March",
        "year": "2025",
        "released": "75,6",
        "forecast": "73,6",
        "spreadRaw": "2.69%"
      },
      "Announcement Date": {
        "metric": "Announcement Date",
        "unit": null,
        "fiscalMonth": "March",
        "year": "2025",
        "released": "06/05/25",
        "forecast": null,
        "spreadRaw": null
      }
    },
    "2026": {
      "Net salesMillion INR": {
        "metric": "Net salesMillion INR",
        "unit": "Million INR",
        "fiscalMonth": "March",
        "year": "2026",
        "released": null,
        "forecast": "116 629",
        "spreadRaw": null
      },
      "EBITDAMillion INR": {
        "metric": "EBITDAMillion INR",
        "unit": "Million INR",
        "fiscalMonth": "March",
        "year": "2026",
        "released": null,
        "forecast": "12 239",
        "spreadRaw": null
      },
      "EBITMillion INR": {
        "metric": "EBITMillion INR",
        "unit": "Million INR",
        "fiscalMonth": "March",
        "year": "2026",
        "released": null,
        "forecast": "11 352",
        "spreadRaw": null
      },
      "Earnings before Tax (EBT)Million INR": {
        "metric": "Earnings before Tax (EBT)Million INR",
        "unit": "Million INR",
        "fiscalMonth": "March",
        "year": "2026",
        "released": null,
        "forecast": "11 423",
        "spreadRaw": null
      },
      "Net incomeMillion INR": {
        "metric": "Net incomeMillion INR",
        "unit": "Million INR",
        "fiscalMonth": "March",
        "year": "2026",
        "released": null,
        "forecast": "8 565",
        "spreadRaw": null
      },
      "EPS INR": {
        "metric": "EPS INR",
        "unit": "INR",
        "fiscalMonth": "March",
        "year": "2026",
        "released": null,
        "forecast": "90,7",
        "spreadRaw": null
      },
      "Announcement Date": {
        "metric": "Announcement Date",
        "unit": null,
        "fiscalMonth": "March",
        "year": "2026",
        "released": "-",
        "forecast": null,
        "spreadRaw": null
      }
    },
    "2027": {
      "Net salesMillion INR": {
        "metric": "Net salesMillion INR",
        "unit": "Million INR",
        "fiscalMonth": "March",
        "year": "2027",
        "released": null,
        "forecast": "139 837",
        "spreadRaw": null
      },
      "EBITDAMillion INR": {
        "metric": "EBITDAMillion INR",
        "unit": "Million INR",
        "fiscalMonth": "March",
        "year": "2027",
        "released": null,
        "forecast": "15 491",
        "spreadRaw": null
      },
      "EBITMillion INR": {
        "metric": "EBITMillion INR",
        "unit": "Million INR",
        "fiscalMonth": "March",
        "year": "2027",
        "released": null,
        "forecast": "14 263",
        "spreadRaw": null
      },
      "Earnings before Tax (EBT)Million INR": {
        "metric": "Earnings before Tax (EBT)Million INR",
        "unit": "Million INR",
        "fiscalMonth": "March",
        "year": "2027",
        "released": null,
        "forecast": "14 104",
        "spreadRaw": null
      },
      "Net incomeMillion INR": {
        "metric": "Net incomeMillion INR",
        "unit": "Million INR",
        "fiscalMonth": "March",
        "year": "2027",
        "released": null,
        "forecast": "10 520",
        "spreadRaw": null
      },
      "EPS INR": {
        "metric": "EPS INR",
        "unit": "INR",
        "fiscalMonth": "March",
        "year": "2027",
        "released": null,
        "forecast": "112",
        "spreadRaw": null
      },
      "Announcement Date": {
        "metric": "Announcement Date",
        "unit": null,
        "fiscalMonth": "March",
        "year": "2027",
        "released": null,
        "forecast": null,
        "spreadRaw": null
      }
    },
    "2028": {
      "Net salesMillion INR": {
        "metric": "Net salesMillion INR",
        "unit": "Million INR",
        "fiscalMonth": "March",
        "year": "2028",
        "released": null,
        "forecast": "167 238",
        "spreadRaw": null
      },
      "EBITDAMillion INR": {
        "metric": "EBITDAMillion INR",
        "unit": "Million INR",
        "fiscalMonth": "March",
        "year": "2028",
        "released": null,
        "forecast": "18 973",
        "spreadRaw": null
      },
      "EBITMillion INR": {
        "metric": "EBITMillion INR",
        "unit": "Million INR",
        "fiscalMonth": "March",
        "year": "2028",
        "released": null,
        "forecast": "17 233",
        "spreadRaw": null
      },
      "Earnings before Tax (EBT)Million INR": {
        "metric": "Earnings before Tax (EBT)Million INR",
        "unit": "Million INR",
        "fiscalMonth": "March",
        "year": "2028",
        "released": null,
        "forecast": "17 077",
        "spreadRaw": null
      },
      "Net incomeMillion INR": {
        "metric": "Net incomeMillion INR",
        "unit": "Million INR",
        "fiscalMonth": "March",
        "year": "2028",
        "released": null,
        "forecast": "12 740",
        "spreadRaw": null
      },
      "EPS INR": {
        "metric": "EPS INR",
        "unit": "INR",
        "fiscalMonth": "March",
        "year": "2028",
        "released": null,
        "forecast": "136",
        "spreadRaw": null
      },
      "Announcement Date": {
        "metric": "Announcement Date",
        "unit": null,
        "fiscalMonth": "March",
        "year": "2028",
        "released": null,
        "forecast": null,
        "spreadRaw": null
      }
    }
  },
  "quarterlyResults": {
    "2024 Q2": {
      "Net salesMillion INR": {
        "metric": "Net salesMillion INR",
        "unit": "Million INR",
        "fiscalMonth": "March",
        "period": "2024 Q2",
        "released": "19 466",
        "releasedNum": 19466,
        "forecast": "18 586",
        "forecastNum": 18586,
        "spreadRaw": "4.73%",
        "spreadPct": 4.73
      },
      "EBITDAMillion INR": {
        "metric": "EBITDAMillion INR",
        "unit": "Million INR",
        "fiscalMonth": "March",
        "period": "2024 Q2",
        "released": "2 039",
        "releasedNum": 2039,
        "forecast": "1 944",
        "forecastNum": 1944,
        "spreadRaw": "4.89%",
        "spreadPct": 4.89
      },
      "EBITMillion INR": {
        "metric": "EBITMillion INR",
        "unit": "Million INR",
        "fiscalMonth": "March",
        "period": "2024 Q2",
        "released": "1 883",
        "releasedNum": 1883,
        "forecast": "1 902",
        "forecastNum": 1902,
        "spreadRaw": "-1%",
        "spreadPct": -1
      },
      "Earnings before Tax (EBT)Million INR": {
        "metric": "Earnings before Tax (EBT)Million INR",
        "unit": "Million INR",
        "fiscalMonth": "March",
        "period": "2024 Q2",
        "released": "1 884",
        "releasedNum": 1884,
        "forecast": "1 892",
        "forecastNum": 1892,
        "spreadRaw": "-0.41%",
        "spreadPct": -0.41
      },
      "Net incomeMillion INR": {
        "metric": "Net incomeMillion INR",
        "unit": "Million INR",
        "fiscalMonth": "March",
        "period": "2024 Q2",
        "released": "1 402",
        "releasedNum": 1402,
        "forecast": "1 323",
        "forecastNum": 1323,
        "spreadRaw": "5.96%",
        "spreadPct": 5.96
      },
      "EPS INR": {
        "metric": "EPS INR",
        "unit": "INR",
        "fiscalMonth": "March",
        "period": "2024 Q2",
        "released": "15,5",
        "releasedNum": 15.5,
        "forecast": "14,0",
        "forecastNum": 14,
        "spreadRaw": "10.79%",
        "spreadPct": 10.79
      },
      "Announcement Date": {
        "metric": "Announcement Date",
        "unit": null,
        "fiscalMonth": "March",
        "period": "2024 Q2",
        "released": "31/10/23",
        "releasedDate": "31/10/23",
        "forecast": null,
        "spreadRaw": null,
        "spreadPct": null
      }
    },
    "2024 Q3": {
      "Net salesMillion INR": {
        "metric": "Net salesMillion INR",
        "unit": "Million INR",
        "fiscalMonth": "March",
        "period": "2024 Q3",
        "released": "20 617",
        "releasedNum": 20617,
        "forecast": "20 806",
        "forecastNum": 20806,
        "spreadRaw": "-0.91%",
        "spreadPct": -0.91
      },
      "EBITDAMillion INR": {
        "metric": "EBITDAMillion INR",
        "unit": "Million INR",
        "fiscalMonth": "March",
        "period": "2024 Q3",
        "released": "2 169",
        "releasedNum": 2169,
        "forecast": "2 203",
        "forecastNum": 2203,
        "spreadRaw": "-1.53%",
        "spreadPct": -1.53
      },
      "EBITMillion INR": {
        "metric": "EBITMillion INR",
        "unit": "Million INR",
        "fiscalMonth": "March",
        "period": "2024 Q3",
        "released": "2 015",
        "releasedNum": 2015,
        "forecast": "2 010",
        "forecastNum": 2010,
        "spreadRaw": "0.27%",
        "spreadPct": 0.27
      },
      "Earnings before Tax (EBT)Million INR": {
        "metric": "Earnings before Tax (EBT)Million INR",
        "unit": "Million INR",
        "fiscalMonth": "March",
        "period": "2024 Q3",
        "released": "2 024",
        "releasedNum": 2024,
        "forecast": "1 927",
        "forecastNum": 1927,
        "spreadRaw": "5.05%",
        "spreadPct": 5.05
      },
      "Net incomeMillion INR": {
        "metric": "Net incomeMillion INR",
        "unit": "Million INR",
        "fiscalMonth": "March",
        "period": "2024 Q3",
        "released": "1 507",
        "releasedNum": 1507,
        "forecast": "1 522",
        "forecastNum": 1522,
        "spreadRaw": "-0.98%",
        "spreadPct": -0.98
      },
      "EPS INR": {
        "metric": "EPS INR",
        "unit": "INR",
        "fiscalMonth": "March",
        "period": "2024 Q3",
        "released": "16,7",
        "releasedNum": 16.7,
        "forecast": "16,8",
        "forecastNum": 16.8,
        "spreadRaw": "-0.51%",
        "spreadPct": -0.51
      },
      "Announcement Date": {
        "metric": "Announcement Date",
        "unit": null,
        "fiscalMonth": "March",
        "period": "2024 Q3",
        "released": "23/01/24",
        "releasedDate": "23/01/24",
        "forecast": null,
        "spreadRaw": null,
        "spreadPct": null
      }
    },
    "2024 Q4": {
      "Net salesMillion INR": {
        "metric": "Net salesMillion INR",
        "unit": "Million INR",
        "fiscalMonth": "March",
        "period": "2024 Q4",
        "released": "23 193",
        "releasedNum": 23193,
        "forecast": "22 841",
        "forecastNum": 22841,
        "spreadRaw": "1.54%",
        "spreadPct": 1.54
      },
      "EBITDAMillion INR": {
        "metric": "EBITDAMillion INR",
        "unit": "Million INR",
        "fiscalMonth": "March",
        "period": "2024 Q4",
        "released": "2 446",
        "releasedNum": 2446,
        "forecast": "2 403",
        "forecastNum": 2403,
        "spreadRaw": "1.77%",
        "spreadPct": 1.77
      },
      "EBITMillion INR": {
        "metric": "EBITMillion INR",
        "unit": "Million INR",
        "fiscalMonth": "March",
        "period": "2024 Q4",
        "released": "2 288",
        "releasedNum": 2288,
        "forecast": "2 265",
        "forecastNum": 2265,
        "spreadRaw": "1.01%",
        "spreadPct": 1.01
      },
      "Earnings before Tax (EBT)Million INR": {
        "metric": "Earnings before Tax (EBT)Million INR",
        "unit": "Million INR",
        "fiscalMonth": "March",
        "period": "2024 Q4",
        "released": "2 274",
        "releasedNum": 2274,
        "forecast": "2 256",
        "forecastNum": 2256,
        "spreadRaw": "0.81%",
        "spreadPct": 0.81
      },
      "Net incomeMillion INR": {
        "metric": "Net incomeMillion INR",
        "unit": "Million INR",
        "fiscalMonth": "March",
        "period": "2024 Q4",
        "released": "1 688",
        "releasedNum": 1688,
        "forecast": "1 711",
        "forecastNum": 1711,
        "spreadRaw": "-1.34%",
        "spreadPct": -1.34
      },
      "EPS INR": {
        "metric": "EPS INR",
        "unit": "INR",
        "fiscalMonth": "March",
        "period": "2024 Q4",
        "released": "18,7",
        "releasedNum": 18.7,
        "forecast": "18,7",
        "forecastNum": 18.7,
        "spreadRaw": "-0.16%",
        "spreadPct": -0.16
      },
      "Announcement Date": {
        "metric": "Announcement Date",
        "unit": null,
        "fiscalMonth": "March",
        "period": "2024 Q4",
        "released": "02/05/24",
        "releasedDate": "02/05/24",
        "forecast": null,
        "spreadRaw": null,
        "spreadPct": null
      }
    },
    "2025 Q1": {
      "Net salesMillion INR": {
        "metric": "Net salesMillion INR",
        "unit": "Million INR",
        "fiscalMonth": "March",
        "period": "2025 Q1",
        "released": "20 605",
        "releasedNum": 20605,
        "forecast": "20 763",
        "forecastNum": 20763,
        "spreadRaw": "-0.76%",
        "spreadPct": -0.76
      },
      "EBITDAMillion INR": {
        "metric": "EBITDAMillion INR",
        "unit": "Million INR",
        "fiscalMonth": "March",
        "period": "2025 Q1",
        "released": "2 146",
        "releasedNum": 2146,
        "forecast": "2 132",
        "forecastNum": 2132,
        "spreadRaw": "0.63%",
        "spreadPct": 0.63
      },
      "EBITMillion INR": {
        "metric": "EBITMillion INR",
        "unit": "Million INR",
        "fiscalMonth": "March",
        "period": "2025 Q1",
        "released": "1 991",
        "releasedNum": 1991,
        "forecast": "1 990",
        "forecastNum": 1990,
        "spreadRaw": "0.03%",
        "spreadPct": 0.03
      },
      "Earnings before Tax (EBT)Million INR": {
        "metric": "Earnings before Tax (EBT)Million INR",
        "unit": "Million INR",
        "fiscalMonth": "March",
        "period": "2025 Q1",
        "released": "2 027",
        "releasedNum": 2027,
        "forecast": "1 925",
        "forecastNum": 1925,
        "spreadRaw": "5.35%",
        "spreadPct": 5.35
      },
      "Net incomeMillion INR": {
        "metric": "Net incomeMillion INR",
        "unit": "Million INR",
        "fiscalMonth": "March",
        "period": "2025 Q1",
        "released": "1 502",
        "releasedNum": 1502,
        "forecast": "1 462",
        "forecastNum": 1462,
        "spreadRaw": "2.77%",
        "spreadPct": 2.77
      },
      "EPS INR": {
        "metric": "EPS INR",
        "unit": "INR",
        "fiscalMonth": "March",
        "period": "2025 Q1",
        "released": "16,6",
        "releasedNum": 16.6,
        "forecast": "16,9",
        "forecastNum": 16.9,
        "spreadRaw": "-1.66%",
        "spreadPct": -1.66
      },
      "Announcement Date": {
        "metric": "Announcement Date",
        "unit": null,
        "fiscalMonth": "March",
        "period": "2025 Q1",
        "released": "29/07/24",
        "releasedDate": "29/07/24",
        "forecast": null,
        "spreadRaw": null,
        "spreadPct": null
      }
    },
    "2025 Q2": {
      "Net salesMillion INR": {
        "metric": "Net salesMillion INR",
        "unit": "Million INR",
        "fiscalMonth": "March",
        "period": "2025 Q2",
        "released": "22 796",
        "releasedNum": 22796,
        "forecast": "22 693",
        "forecastNum": 22693,
        "spreadRaw": "0.46%",
        "spreadPct": 0.46
      },
      "EBITDAMillion INR": {
        "metric": "EBITDAMillion INR",
        "unit": "Million INR",
        "fiscalMonth": "March",
        "period": "2025 Q2",
        "released": "2 206",
        "releasedNum": 2206,
        "forecast": "2 346",
        "forecastNum": 2346,
        "spreadRaw": "-5.97%",
        "spreadPct": -5.97
      },
      "EBITMillion INR": {
        "metric": "EBITMillion INR",
        "unit": "Million INR",
        "fiscalMonth": "March",
        "period": "2025 Q2",
        "released": "2 043",
        "releasedNum": 2043,
        "forecast": "2 223",
        "forecastNum": 2223,
        "spreadRaw": "-8.11%",
        "spreadPct": -8.11
      },
      "Earnings before Tax (EBT)Million INR": {
        "metric": "Earnings before Tax (EBT)Million INR",
        "unit": "Million INR",
        "fiscalMonth": "March",
        "period": "2025 Q2",
        "released": "2 079",
        "releasedNum": 2079,
        "forecast": "2 184",
        "forecastNum": 2184,
        "spreadRaw": "-4.82%",
        "spreadPct": -4.82
      },
      "Net incomeMillion INR": {
        "metric": "Net incomeMillion INR",
        "unit": "Million INR",
        "fiscalMonth": "March",
        "period": "2025 Q2",
        "released": "1 548",
        "releasedNum": 1548,
        "forecast": "1 657",
        "forecastNum": 1657,
        "spreadRaw": "-6.56%",
        "spreadPct": -6.56
      },
      "EPS INR": {
        "metric": "EPS INR",
        "unit": "INR",
        "fiscalMonth": "March",
        "period": "2025 Q2",
        "released": "17,1",
        "releasedNum": 17.1,
        "forecast": "18,7",
        "forecastNum": 18.7,
        "spreadRaw": "-8.4%",
        "spreadPct": -8.4
      },
      "Announcement Date": {
        "metric": "Announcement Date",
        "unit": null,
        "fiscalMonth": "March",
        "period": "2025 Q2",
        "released": "15/10/24",
        "releasedDate": "15/10/24",
        "forecast": null,
        "spreadRaw": null,
        "spreadPct": null
      }
    },
    "2025 Q3": {
      "Net salesMillion INR": {
        "metric": "Net salesMillion INR",
        "unit": "Million INR",
        "fiscalMonth": "March",
        "period": "2025 Q3",
        "released": "24 673",
        "releasedNum": 24673,
        "forecast": "24 373",
        "forecastNum": 24373,
        "spreadRaw": "1.23%",
        "spreadPct": 1.23
      },
      "EBITDAMillion INR": {
        "metric": "EBITDAMillion INR",
        "unit": "Million INR",
        "fiscalMonth": "March",
        "period": "2025 Q3",
        "released": "2 408",
        "releasedNum": 2408,
        "forecast": "2 473",
        "forecastNum": 2473,
        "spreadRaw": "-2.61%",
        "spreadPct": -2.61
      },
      "EBITMillion INR": {
        "metric": "EBITMillion INR",
        "unit": "Million INR",
        "fiscalMonth": "March",
        "period": "2025 Q3",
        "released": null,
        "releasedNum": null,
        "forecast": null,
        "forecastNum": null,
        "spreadRaw": null,
        "spreadPct": null
      },
      "Earnings before Tax (EBT)Million INR": {
        "metric": "Earnings before Tax (EBT)Million INR",
        "unit": "Million INR",
        "fiscalMonth": "March",
        "period": "2025 Q3",
        "released": "2 212",
        "releasedNum": 2212,
        "forecast": "2 345",
        "forecastNum": 2345,
        "spreadRaw": "-5.67%",
        "spreadPct": -5.67
      },
      "Net incomeMillion INR": {
        "metric": "Net incomeMillion INR",
        "unit": "Million INR",
        "fiscalMonth": "March",
        "period": "2025 Q3",
        "released": "1 648",
        "releasedNum": 1648,
        "forecast": "1 750",
        "forecastNum": 1750,
        "spreadRaw": "-5.84%",
        "spreadPct": -5.84
      },
      "EPS INR": {
        "metric": "EPS INR",
        "unit": "INR",
        "fiscalMonth": "March",
        "period": "2025 Q3",
        "released": "17,9",
        "releasedNum": 17.9,
        "forecast": "19,6",
        "forecastNum": 19.6,
        "spreadRaw": "-8.9%",
        "spreadPct": -8.9
      },
      "Announcement Date": {
        "metric": "Announcement Date",
        "unit": null,
        "fiscalMonth": "March",
        "period": "2025 Q3",
        "released": "21/01/25",
        "releasedDate": "21/01/25",
        "forecast": null,
        "spreadRaw": null,
        "spreadPct": null
      }
    },
    "2025 Q4": {
      "Net salesMillion INR": {
        "metric": "Net salesMillion INR",
        "unit": "Million INR",
        "fiscalMonth": "March",
        "period": "2025 Q4",
        "released": "29 148",
        "releasedNum": 29148,
        "forecast": "27 556",
        "forecastNum": 27556,
        "spreadRaw": "5.78%",
        "spreadPct": 5.78
      },
      "EBITDAMillion INR": {
        "metric": "EBITDAMillion INR",
        "unit": "Million INR",
        "fiscalMonth": "March",
        "period": "2025 Q4",
        "released": "3 013",
        "releasedNum": 3013,
        "forecast": "2 943",
        "forecastNum": 2943,
        "spreadRaw": "2.37%",
        "spreadPct": 2.37
      },
      "EBITMillion INR": {
        "metric": "EBITMillion INR",
        "unit": "Million INR",
        "fiscalMonth": "March",
        "period": "2025 Q4",
        "released": "2 819",
        "releasedNum": 2819,
        "forecast": "2 646",
        "forecastNum": 2646,
        "spreadRaw": "6.56%",
        "spreadPct": 6.56
      },
      "Earnings before Tax (EBT)Million INR": {
        "metric": "Earnings before Tax (EBT)Million INR",
        "unit": "Million INR",
        "fiscalMonth": "March",
        "period": "2025 Q4",
        "released": "3 052",
        "releasedNum": 3052,
        "forecast": "2 733",
        "forecastNum": 2733,
        "spreadRaw": "11.68%",
        "spreadPct": 11.68
      },
      "Net incomeMillion INR": {
        "metric": "Net incomeMillion INR",
        "unit": "Million INR",
        "fiscalMonth": "March",
        "period": "2025 Q4",
        "released": "2 265",
        "releasedNum": 2265,
        "forecast": "2 061",
        "forecastNum": 2061,
        "spreadRaw": "9.93%",
        "spreadPct": 9.93
      },
      "EPS INR": {
        "metric": "EPS INR",
        "unit": "INR",
        "fiscalMonth": "March",
        "period": "2025 Q4",
        "released": "23,7",
        "releasedNum": 23.7,
        "forecast": "20,7",
        "forecastNum": 20.7,
        "spreadRaw": "14.49%",
        "spreadPct": 14.49
      },
      "Announcement Date": {
        "metric": "Announcement Date",
        "unit": null,
        "fiscalMonth": "March",
        "period": "2025 Q4",
        "released": "06/05/25",
        "releasedDate": "06/05/25",
        "forecast": null,
        "spreadRaw": null,
        "spreadPct": null
      }
    },
    "2026 Q1": {
      "Net salesMillion INR": {
        "metric": "Net salesMillion INR",
        "unit": "Million INR",
        "fiscalMonth": "March",
        "period": "2026 Q1",
        "released": "25 903",
        "releasedNum": 25903,
        "forecast": "24 106",
        "forecastNum": 24106,
        "spreadRaw": "7.46%",
        "spreadPct": 7.46
      },
      "EBITDAMillion INR": {
        "metric": "EBITDAMillion INR",
        "unit": "Million INR",
        "fiscalMonth": "March",
        "period": "2026 Q1",
        "released": "2 580",
        "releasedNum": 2580,
        "forecast": "2 468",
        "forecastNum": 2468,
        "spreadRaw": "4.53%",
        "spreadPct": 4.53
      },
      "EBITMillion INR": {
        "metric": "EBITMillion INR",
        "unit": "Million INR",
        "fiscalMonth": "March",
        "period": "2026 Q1",
        "released": "2 381",
        "releasedNum": 2381,
        "forecast": "2 301",
        "forecastNum": 2301,
        "spreadRaw": "3.49%",
        "spreadPct": 3.49
      },
      "Earnings before Tax (EBT)Million INR": {
        "metric": "Earnings before Tax (EBT)Million INR",
        "unit": "Million INR",
        "fiscalMonth": "March",
        "period": "2026 Q1",
        "released": "2 632",
        "releasedNum": 2632,
        "forecast": "2 421",
        "forecastNum": 2421,
        "spreadRaw": "8.73%",
        "spreadPct": 8.73
      },
      "Net incomeMillion INR": {
        "metric": "Net incomeMillion INR",
        "unit": "Million INR",
        "fiscalMonth": "March",
        "period": "2026 Q1",
        "released": "1 957",
        "releasedNum": 1957,
        "forecast": "1 772",
        "forecastNum": 1772,
        "spreadRaw": "10.47%",
        "spreadPct": 10.47
      },
      "EPS INR": {
        "metric": "EPS INR",
        "unit": "INR",
        "fiscalMonth": "March",
        "period": "2026 Q1",
        "released": "20,5",
        "releasedNum": 20.5,
        "forecast": "19,4",
        "forecastNum": 19.4,
        "spreadRaw": "5.52%",
        "spreadPct": 5.52
      },
      "Announcement Date": {
        "metric": "Announcement Date",
        "unit": null,
        "fiscalMonth": "March",
        "period": "2026 Q1",
        "released": "22/07/25",
        "releasedDate": "22/07/25",
        "forecast": null,
        "spreadRaw": null,
        "spreadPct": null
      }
    },
    "2026 Q2": {
      "Net salesMillion INR": {
        "metric": "Net salesMillion INR",
        "unit": "Million INR",
        "fiscalMonth": "March",
        "period": "2026 Q2",
        "released": null,
        "releasedNum": null,
        "forecast": "27 306",
        "forecastNum": 27306,
        "spreadRaw": null,
        "spreadPct": null
      },
      "EBITDAMillion INR": {
        "metric": "EBITDAMillion INR",
        "unit": "Million INR",
        "fiscalMonth": "March",
        "period": "2026 Q2",
        "released": null,
        "releasedNum": null,
        "forecast": "2 732",
        "forecastNum": 2732,
        "spreadRaw": null,
        "spreadPct": null
      },
      "EBITMillion INR": {
        "metric": "EBITMillion INR",
        "unit": "Million INR",
        "fiscalMonth": "March",
        "period": "2026 Q2",
        "released": null,
        "releasedNum": null,
        "forecast": "2 711",
        "forecastNum": 2711,
        "spreadRaw": null,
        "spreadPct": null
      },
      "Earnings before Tax (EBT)Million INR": {
        "metric": "Earnings before Tax (EBT)Million INR",
        "unit": "Million INR",
        "fiscalMonth": "March",
        "period": "2026 Q2",
        "released": null,
        "releasedNum": null,
        "forecast": "2 774",
        "forecastNum": 2774,
        "spreadRaw": null,
        "spreadPct": null
      },
      "Net incomeMillion INR": {
        "metric": "Net incomeMillion INR",
        "unit": "Million INR",
        "fiscalMonth": "March",
        "period": "2026 Q2",
        "released": null,
        "releasedNum": null,
        "forecast": "2 391",
        "forecastNum": 2391,
        "spreadRaw": null,
        "spreadPct": null
      },
      "EPS INR": {
        "metric": "EPS INR",
        "unit": "INR",
        "fiscalMonth": "March",
        "period": "2026 Q2",
        "released": null,
        "releasedNum": null,
        "forecast": "22,2",
        "forecastNum": 22.2,
        "spreadRaw": null,
        "spreadPct": null
      },
      "Announcement Date": {
        "metric": "Announcement Date",
        "unit": null,
        "fiscalMonth": "March",
        "period": "2026 Q2",
        "released": "-",
        "releasedDate": "-",
        "forecast": null,
        "spreadRaw": null,
        "spreadPct": null
      }
    },
    "2026 Q3": {
      "Net salesMillion INR": {
        "metric": "Net salesMillion INR",
        "unit": "Million INR",
        "fiscalMonth": "March",
        "period": "2026 Q3",
        "released": null,
        "releasedNum": null,
        "forecast": "29 544",
        "forecastNum": 29544,
        "spreadRaw": null,
        "spreadPct": null
      },
      "EBITDAMillion INR": {
        "metric": "EBITDAMillion INR",
        "unit": "Million INR",
        "fiscalMonth": "March",
        "period": "2026 Q3",
        "released": null,
        "releasedNum": null,
        "forecast": "3 004",
        "forecastNum": 3004,
        "spreadRaw": null,
        "spreadPct": null
      },
      "EBITMillion INR": {
        "metric": "EBITMillion INR",
        "unit": "Million INR",
        "fiscalMonth": "March",
        "period": "2026 Q3",
        "released": null,
        "releasedNum": null,
        "forecast": "2 788",
        "forecastNum": 2788,
        "spreadRaw": null,
        "spreadPct": null
      },
      "Earnings before Tax (EBT)Million INR": {
        "metric": "Earnings before Tax (EBT)Million INR",
        "unit": "Million INR",
        "fiscalMonth": "March",
        "period": "2026 Q3",
        "released": null,
        "releasedNum": null,
        "forecast": "2 843",
        "forecastNum": 2843,
        "spreadRaw": null,
        "spreadPct": null
      },
      "Net incomeMillion INR": {
        "metric": "Net incomeMillion INR",
        "unit": "Million INR",
        "fiscalMonth": "March",
        "period": "2026 Q3",
        "released": null,
        "releasedNum": null,
        "forecast": "2 126",
        "forecastNum": 2126,
        "spreadRaw": null,
        "spreadPct": null
      },
      "EPS INR": {
        "metric": "EPS INR",
        "unit": "INR",
        "fiscalMonth": "March",
        "period": "2026 Q3",
        "released": null,
        "releasedNum": null,
        "forecast": "23,3",
        "forecastNum": 23.3,
        "spreadRaw": null,
        "spreadPct": null
      },
      "Announcement Date": {
        "metric": "Announcement Date",
        "unit": null,
        "fiscalMonth": "March",
        "period": "2026 Q3",
        "released": "-",
        "releasedDate": "-",
        "forecast": null,
        "spreadRaw": null,
        "spreadPct": null
      }
    },
    "2026 Q4": {
      "Net salesMillion INR": {
        "metric": "Net salesMillion INR",
        "unit": "Million INR",
        "fiscalMonth": "March",
        "period": "2026 Q4",
        "released": null,
        "releasedNum": null,
        "forecast": "35 018",
        "forecastNum": 35018,
        "spreadRaw": null,
        "spreadPct": null
      },
      "EBITDAMillion INR": {
        "metric": "EBITDAMillion INR",
        "unit": "Million INR",
        "fiscalMonth": "March",
        "period": "2026 Q4",
        "released": null,
        "releasedNum": null,
        "forecast": "3 878",
        "forecastNum": 3878,
        "spreadRaw": null,
        "spreadPct": null
      },
      "EBITMillion INR": {
        "metric": "EBITMillion INR",
        "unit": "Million INR",
        "fiscalMonth": "March",
        "period": "2026 Q4",
        "released": null,
        "releasedNum": null,
        "forecast": "3 662",
        "forecastNum": 3662,
        "spreadRaw": null,
        "spreadPct": null
      },
      "Earnings before Tax (EBT)Million INR": {
        "metric": "Earnings before Tax (EBT)Million INR",
        "unit": "Million INR",
        "fiscalMonth": "March",
        "period": "2026 Q4",
        "released": null,
        "releasedNum": null,
        "forecast": "3 716",
        "forecastNum": 3716,
        "spreadRaw": null,
        "spreadPct": null
      },
      "Net incomeMillion INR": {
        "metric": "Net incomeMillion INR",
        "unit": "Million INR",
        "fiscalMonth": "March",
        "period": "2026 Q4",
        "released": null,
        "releasedNum": null,
        "forecast": "2 780",
        "forecastNum": 2780,
        "spreadRaw": null,
        "spreadPct": null
      },
      "EPS INR": {
        "metric": "EPS INR",
        "unit": "INR",
        "fiscalMonth": "March",
        "period": "2026 Q4",
        "released": null,
        "releasedNum": null,
        "forecast": "27,6",
        "forecastNum": 27.6,
        "spreadRaw": null,
        "spreadPct": null
      },
      "Announcement Date": {
        "metric": "Announcement Date",
        "unit": null,
        "fiscalMonth": "March",
        "period": "2026 Q4",
        "released": "-",
        "releasedDate": "-",
        "forecast": null,
        "spreadRaw": null,
        "spreadPct": null
      }
    }
  },
  "upcomingEvents": {
    "count": 6,
    "events": [
      {
        "section": "Upcoming",
        "dateTimeRaw": "15/10/2025",
        "dateTimeISO": "2025-10-14T18:30:00.000Z",
        "title": "Q2 2026 Earnings Release",
        "icsUrl": "https://in.marketscreener.com/api/stateful/agenda/event-async/Q2-2026-Earnings-Release-48063533.ics"
      },
      {
        "section": "Upcoming",
        "dateTimeRaw": "16/10/2025 12:00 pm",
        "dateTimeISO": "2025-10-16T06:30:00.000Z",
        "title": "Q2 2026 Earnings Call",
        "icsUrl": "https://in.marketscreener.com/api/stateful/agenda/event-async/Q2-2026-Earnings-Call-51295467.ics"
      },
      {
        "section": "Upcoming",
        "dateTimeRaw": "26/01/2026",
        "dateTimeISO": "2026-01-25T18:30:00.000Z",
        "title": "Q3 2026 Earnings Release (Projected)",
        "icsUrl": "https://in.marketscreener.com/api/stateful/agenda/event-async/Q3-2026-Earnings-Release-Projected-48678735.ics"
      },
      {
        "section": "Upcoming",
        "dateTimeRaw": "12/05/2026",
        "dateTimeISO": "2026-05-11T18:30:00.000Z",
        "title": "Q4 2026 Earnings Release (Projected)",
        "icsUrl": "https://in.marketscreener.com/api/stateful/agenda/event-async/Q4-2026-Earnings-Release-Projected-49747661.ics"
      },
      {
        "section": "Upcoming",
        "dateTimeRaw": "28/07/2026",
        "dateTimeISO": "2026-07-27T18:30:00.000Z",
        "title": "Q1 2027 Earnings Release (Projected)",
        "icsUrl": "https://in.marketscreener.com/api/stateful/agenda/event-async/Q1-2027-Earnings-Release-Projected-50578961.ics"
      },
      {
        "section": "Upcoming",
        "dateTimeRaw": "21/10/2026",
        "dateTimeISO": "2026-10-20T18:30:00.000Z",
        "title": "Q2 2027 Earnings Release (Projected)",
        "icsUrl": "https://in.marketscreener.com/api/stateful/agenda/event-async/Q2-2027-Earnings-Release-Projected-51295512.ics"
      }
    ]
  },
  "pastEvents": {
    "count": 181,
    "events": [
      {
        "section": "Past",
        "dateTimeRaw": "18/09/2025 10:00 am",
        "dateTimeISO": "2025-09-18T04:30:00.000Z",
        "title": "Investor Meeting - Axis Capital Limited",
        "icsUrl": "https://in.marketscreener.com/api/stateful/agenda/event-async/Investor-Meeting-Axis-Capital-Limited-51066446.ics"
      },
      {
        "section": "Past",
        "dateTimeRaw": "18/09/2025 10:00 am",
        "dateTimeISO": "2025-09-18T04:30:00.000Z",
        "title": "Investor Meeting - Jefferies India Private Limited",
        "icsUrl": "https://in.marketscreener.com/api/stateful/agenda/event-async/Investor-Meeting-Jefferies-India-Private-Limited-51066445.ics"
      },
      {
        "section": "Past",
        "dateTimeRaw": "04/09/2025 07:30 am",
        "dateTimeISO": "2025-09-04T02:00:00.000Z",
        "title": "Investor Meeting - Goldman Sachs (India) Securities Pvt. Ltd",
        "icsUrl": "https://in.marketscreener.com/api/stateful/agenda/event-async/Investor-Meeting-Goldman-Sachs-India-Securities-Pvt-Ltd-50941186.ics"
      },
      {
        "section": "Past",
        "dateTimeRaw": "03/09/2025 10:00 am",
        "dateTimeISO": "2025-09-03T04:30:00.000Z",
        "title": "Investor Meeting - Elara Securities (India) Private Limited",
        "icsUrl": "https://in.marketscreener.com/api/stateful/agenda/event-async/Investor-Meeting-Elara-Securities-India-Private-Limited-50941180.ics"
      },
      {
        "section": "Past",
        "dateTimeRaw": "02/09/2025 10:00 am",
        "dateTimeISO": "2025-09-02T04:30:00.000Z",
        "title": "Investor Meeting - Motilal Oswal Financial Services Ltd",
        "icsUrl": "https://in.marketscreener.com/api/stateful/agenda/event-async/Investor-Meeting-Motilal-Oswal-Financial-Services-Ltd-50941175.ics"
      },
      {
        "section": "Past",
        "dateTimeRaw": "21/08/2025 03:45 pm",
        "dateTimeISO": "2025-08-21T10:15:00.000Z",
        "title": "Investor Meeting - Jefferies India Private Limited",
        "icsUrl": "https://in.marketscreener.com/api/stateful/agenda/event-async/Investor-Meeting-Jefferies-India-Private-Limited-50811014.ics"
      },
      {
        "section": "Past",
        "dateTimeRaw": "21/08/2025 02:00 pm",
        "dateTimeISO": "2025-08-21T08:30:00.000Z",
        "title": "Investor Meeting - Centrum Broking Limited",
        "icsUrl": "https://in.marketscreener.com/api/stateful/agenda/event-async/Investor-Meeting-Centrum-Broking-Limited-50811015.ics"
      },
      {
        "section": "Past",
        "dateTimeRaw": "20/08/2025 02:00 pm",
        "dateTimeISO": "2025-08-20T08:30:00.000Z",
        "title": "Investor Meeting - Antique Stock Broking Limited",
        "icsUrl": "https://in.marketscreener.com/api/stateful/agenda/event-async/Investor-Meeting-Antique-Stock-Broking-Limited-50811012.ics"
      },
      {
        "section": "Past",
        "dateTimeRaw": "20/08/2025 09:00 am",
        "dateTimeISO": "2025-08-20T03:30:00.000Z",
        "title": "Investor Meeting - Equirus Securities Private Limited",
        "icsUrl": "https://in.marketscreener.com/api/stateful/agenda/event-async/Investor-Meeting-Equirus-Securities-Private-Limited-50811011.ics"
      },
      {
        "section": "Past",
        "dateTimeRaw": "14/08/2025",
        "dateTimeISO": "2025-08-13T18:30:00.000Z",
        "title": "Investor Meeting - Emkay Global Financial Services Limited",
        "icsUrl": "https://in.marketscreener.com/api/stateful/agenda/event-async/Investor-Meeting-Emkay-Global-Financial-Services-Limited-50632962.ics"
      },
      {
        "section": "Past",
        "dateTimeRaw": "08/08/2025",
        "dateTimeISO": "2025-08-07T18:30:00.000Z",
        "title": "Investor Meeting - Nuvama Wealth Management Limited",
        "icsUrl": "https://in.marketscreener.com/api/stateful/agenda/event-async/Investor-Meeting-Nuvama-Wealth-Management-Limited-50632950.ics"
      },
      {
        "section": "Past",
        "dateTimeRaw": "07/08/2025",
        "dateTimeISO": "2025-08-06T18:30:00.000Z",
        "title": "Investor Meeting - Nuvama Wealth Management Limited",
        "icsUrl": "https://in.marketscreener.com/api/stateful/agenda/event-async/Investor-Meeting-Nuvama-Wealth-Management-Limited-50632947.ics"
      },
      {
        "section": "Past",
        "dateTimeRaw": "06/08/2025",
        "dateTimeISO": "2025-08-05T18:30:00.000Z",
        "title": "Investor Meeting - Nuvama Wealth Management Limited",
        "icsUrl": "https://in.marketscreener.com/api/stateful/agenda/event-async/Investor-Meeting-Nuvama-Wealth-Management-Limited-50632944.ics"
      },
      {
        "section": "Past",
        "dateTimeRaw": "30/07/2025 03:30 pm",
        "dateTimeISO": "2025-07-30T10:00:00.000Z",
        "title": "Annual General Meeting",
        "icsUrl": "https://in.marketscreener.com/api/stateful/agenda/event-async/Annual-General-Meeting-50327860.ics"
      },
      {
        "section": "Past",
        "dateTimeRaw": "23/07/2025 12:00 pm",
        "dateTimeISO": "2025-07-23T06:30:00.000Z",
        "title": "Q1 2026 Earnings Call",
        "icsUrl": "https://in.marketscreener.com/api/stateful/agenda/event-async/Q1-2026-Earnings-Call-50551811.ics"
      },
      {
        "section": "Past",
        "dateTimeRaw": "22/07/2025 05:26 pm",
        "dateTimeISO": "2025-07-22T11:56:00.000Z",
        "title": "Q1 2026 Earnings Release",
        "icsUrl": "https://in.marketscreener.com/api/stateful/agenda/event-async/Q1-2026-Earnings-Release-47387794.ics"
      },
      {
        "section": "Past",
        "dateTimeRaw": "20/06/2025 02:00 pm",
        "dateTimeISO": "2025-06-20T08:30:00.000Z",
        "title": "Investor Meeting - Elara Securities",
        "icsUrl": "https://in.marketscreener.com/api/stateful/agenda/event-async/Investor-Meeting-Elara-Securities-50241691.ics"
      },
      {
        "section": "Past",
        "dateTimeRaw": "20/06/2025 11:00 am",
        "dateTimeISO": "2025-06-20T05:30:00.000Z",
        "title": "Investor Meeting - Elara Securities",
        "icsUrl": "https://in.marketscreener.com/api/stateful/agenda/event-async/Investor-Meeting-Elara-Securities-50241692.ics"
      },
      {
        "section": "Past",
        "dateTimeRaw": "19/06/2025 12:15 pm",
        "dateTimeISO": "2025-06-19T06:45:00.000Z",
        "title": "Investor Meeting - Citigroup Global",
        "icsUrl": "https://in.marketscreener.com/api/stateful/agenda/event-async/Investor-Meeting-Citigroup-Global-50241689.ics"
      },
      {
        "section": "Past",
        "dateTimeRaw": "19/06/2025 09:00 am",
        "dateTimeISO": "2025-06-19T03:30:00.000Z",
        "title": "Investor Meeting - Emkay Global",
        "icsUrl": "https://in.marketscreener.com/api/stateful/agenda/event-async/Investor-Meeting-Emkay-Global-50241690.ics"
      },
      {
        "section": "Past",
        "dateTimeRaw": "11/06/2025 06:30 pm",
        "dateTimeISO": "2025-06-11T13:00:00.000Z",
        "title": "Investor Meeting - Nuvama Wealth Management Limited",
        "icsUrl": "https://in.marketscreener.com/api/stateful/agenda/event-async/Investor-Meeting-Nuvama-Wealth-Management-Limited-49901843.ics"
      },
      {
        "section": "Past",
        "dateTimeRaw": "09/06/2025 01:30 pm",
        "dateTimeISO": "2025-06-09T08:00:00.000Z",
        "title": "Investor Meeting - Nuvama Wealth Management Limited",
        "icsUrl": "https://in.marketscreener.com/api/stateful/agenda/event-async/Investor-Meeting-Nuvama-Wealth-Management-Limited-49901840.ics"
      },
      {
        "section": "Past",
        "dateTimeRaw": "03/06/2025",
        "dateTimeISO": "2025-06-02T18:30:00.000Z",
        "title": "Investor Meeting - Axis Capital Limited",
        "icsUrl": "https://in.marketscreener.com/api/stateful/agenda/event-async/Investor-Meeting-Axis-Capital-Limited-49901835.ics"
      },
      {
        "section": "Past",
        "dateTimeRaw": "02/06/2025 11:30 am",
        "dateTimeISO": "2025-06-02T06:00:00.000Z",
        "title": "Investor Meeting - Morgan Stanley India Company Private Limited",
        "icsUrl": "https://in.marketscreener.com/api/stateful/agenda/event-async/Investor-Meeting-Morgan-Stanley-India-Company-Private-Limited-49901833.ics"
      },
      {
        "section": "Past",
        "dateTimeRaw": "02/06/2025 08:30 am",
        "dateTimeISO": "2025-06-02T03:00:00.000Z",
        "title": "Investor Meeting - UBS Securities India Private Ltd.",
        "icsUrl": "https://in.marketscreener.com/api/stateful/agenda/event-async/Investor-Meeting-UBS-Securities-India-Private-Ltd-49901832.ics"
      },
      {
        "section": "Past",
        "dateTimeRaw": "28/05/2025 09:00 am",
        "dateTimeISO": "2025-05-28T03:30:00.000Z",
        "title": "Investor Meeting - Batlivala & Karani Securities India Pvt. Ltd",
        "icsUrl": "https://in.marketscreener.com/api/stateful/agenda/event-async/Investor-Meeting-Batlivala-Karani-Securities-India-Pvt-Ltd-49901827.ics"
      },
      {
        "section": "Past",
        "dateTimeRaw": "07/05/2025 02:00 pm",
        "dateTimeISO": "2025-05-07T08:30:00.000Z",
        "title": "Q4 2025 Earnings Call",
        "icsUrl": "https://in.marketscreener.com/api/stateful/agenda/event-async/Q4-2025-Earnings-Call-49747548.ics"
      },
      {
        "section": "Past",
        "dateTimeRaw": "06/05/2025 05:43 pm",
        "dateTimeISO": "2025-05-06T12:13:00.000Z",
        "title": "Q4 2025 Earnings Release",
        "icsUrl": "https://in.marketscreener.com/api/stateful/agenda/event-async/Q4-2025-Earnings-Release-46541616.ics"
      },
      {
        "section": "Past",
        "dateTimeRaw": "28/03/2025",
        "dateTimeISO": "2025-03-27T18:30:00.000Z",
        "title": "Investor Meeting - Day 4",
        "icsUrl": "https://in.marketscreener.com/api/stateful/agenda/event-async/Investor-Meeting-Day-4-49395850.ics"
      },
      {
        "section": "Past",
        "dateTimeRaw": "27/03/2025",
        "dateTimeISO": "2025-03-26T18:30:00.000Z",
        "title": "Investor Meeting - Day 3",
        "icsUrl": "https://in.marketscreener.com/api/stateful/agenda/event-async/Investor-Meeting-Day-3-49395843.ics"
      },
      {
        "section": "Past",
        "dateTimeRaw": "26/03/2025",
        "dateTimeISO": "2025-03-25T18:30:00.000Z",
        "title": "Investor Meeting - Day 2",
        "icsUrl": "https://in.marketscreener.com/api/stateful/agenda/event-async/Investor-Meeting-Day-2-49395833.ics"
      },
      {
        "section": "Past",
        "dateTimeRaw": "25/03/2025 10:45 am",
        "dateTimeISO": "2025-03-25T05:15:00.000Z",
        "title": "Investor Meeting - Jefferies India Private Limited",
        "icsUrl": "https://in.marketscreener.com/api/stateful/agenda/event-async/Investor-Meeting-Jefferies-India-Private-Limited-49395824.ics"
      },
      {
        "section": "Past",
        "dateTimeRaw": "24/03/2025",
        "dateTimeISO": "2025-03-23T18:30:00.000Z",
        "title": "Investor Meeting - Day 1",
        "icsUrl": "https://in.marketscreener.com/api/stateful/agenda/event-async/Investor-Meeting-Day-1-49395815.ics"
      },
      {
        "section": "Past",
        "dateTimeRaw": "12/03/2025 02:30 pm",
        "dateTimeISO": "2025-03-12T09:00:00.000Z",
        "title": "Investor Meeting - Day 2",
        "icsUrl": "https://in.marketscreener.com/api/stateful/agenda/event-async/Investor-Meeting-Day-2-49137581.ics"
      },
      {
        "section": "Past",
        "dateTimeRaw": "11/03/2025 02:30 pm",
        "dateTimeISO": "2025-03-11T09:00:00.000Z",
        "title": "Investor Meeting - Day 1",
        "icsUrl": "https://in.marketscreener.com/api/stateful/agenda/event-async/Investor-Meeting-Day-1-49137580.ics"
      },
      {
        "section": "Past",
        "dateTimeRaw": "07/03/2025 07:30 pm",
        "dateTimeISO": "2025-03-07T14:00:00.000Z",
        "title": "Investor Meeting - Day 5",
        "icsUrl": "https://in.marketscreener.com/api/stateful/agenda/event-async/Investor-Meeting-Day-5-49137579.ics"
      },
      {
        "section": "Past",
        "dateTimeRaw": "06/03/2025 07:30 pm",
        "dateTimeISO": "2025-03-06T14:00:00.000Z",
        "title": "Investor Meeting - Day 4",
        "icsUrl": "https://in.marketscreener.com/api/stateful/agenda/event-async/Investor-Meeting-Day-4-49137578.ics"
      },
      {
        "section": "Past",
        "dateTimeRaw": "05/03/2025 07:30 pm",
        "dateTimeISO": "2025-03-05T14:00:00.000Z",
        "title": "Investor Meeting - Day 3",
        "icsUrl": "https://in.marketscreener.com/api/stateful/agenda/event-async/Investor-Meeting-Day-3-49137576.ics"
      },
      {
        "section": "Past",
        "dateTimeRaw": "04/03/2025 07:30 pm",
        "dateTimeISO": "2025-03-04T14:00:00.000Z",
        "title": "Investor Meeting - Day 2",
        "icsUrl": "https://in.marketscreener.com/api/stateful/agenda/event-async/Investor-Meeting-Day-2-49137575.ics"
      },
      {
        "section": "Past",
        "dateTimeRaw": "04/03/2025 05:00 pm",
        "dateTimeISO": "2025-03-04T11:30:00.000Z",
        "title": "Investor Meeting - Goldman Sachs Securities Private Limited",
        "icsUrl": "https://in.marketscreener.com/api/stateful/agenda/event-async/Investor-Meeting-Goldman-Sachs-Securities-Private-Limited-49194785.ics"
      },
      {
        "section": "Past",
        "dateTimeRaw": "18/02/2025",
        "dateTimeISO": "2025-02-17T18:30:00.000Z",
        "title": "Kotak Securities Chasing Growth Conference",
        "icsUrl": "https://in.marketscreener.com/api/stateful/agenda/event-async/Kotak-Securities-Chasing-Growth-Conference-49000754.ics"
      },
      {
        "section": "Past",
        "dateTimeRaw": "17/02/2025",
        "dateTimeISO": "2025-02-16T18:30:00.000Z",
        "title": "Kotak Chasing Growth Conference",
        "icsUrl": "https://in.marketscreener.com/api/stateful/agenda/event-async/Kotak-Chasing-Growth-Conference-48946490.ics"
      },
      {
        "section": "Past",
        "dateTimeRaw": "11/02/2025 11:00 am",
        "dateTimeISO": "2025-02-11T05:30:00.000Z",
        "title": "Axis Capital India Flagship Conference",
        "icsUrl": "https://in.marketscreener.com/api/stateful/agenda/event-async/Axis-Capital-India-Flagship-Conference-48946473.ics"
      },
      {
        "section": "Past",
        "dateTimeRaw": "10/02/2025 09:00 am",
        "dateTimeISO": "2025-02-10T03:30:00.000Z",
        "title": "Nuvama India Investor Conference",
        "icsUrl": "https://in.marketscreener.com/api/stateful/agenda/event-async/Nuvama-India-Investor-Conference-48946470.ics"
      },
      {
        "section": "Past",
        "dateTimeRaw": "27/01/2025",
        "dateTimeISO": "2025-01-26T18:30:00.000Z",
        "title": "Ex-dividend day for dividende intermdiaire",
        "icsUrl": "https://in.marketscreener.com/api/stateful/agenda/event-async/Ex-dividend-day-for-dividende-intermediaire-48932397.ics"
      },
      {
        "section": "Past",
        "dateTimeRaw": "22/01/2025 12:00 pm",
        "dateTimeISO": "2025-01-22T06:30:00.000Z",
        "title": "Q3 2025 Earnings Call",
        "icsUrl": "https://in.marketscreener.com/api/stateful/agenda/event-async/Q3-2025-Earnings-Call-48735683.ics"
      },
      {
        "section": "Past",
        "dateTimeRaw": "21/01/2025 05:19 pm",
        "dateTimeISO": "2025-01-21T11:49:00.000Z",
        "title": "Q3 2025 Earnings Release",
        "icsUrl": "https://in.marketscreener.com/api/stateful/agenda/event-async/Q3-2025-Earnings-Release-45744885.ics"
      },
      {
        "section": "Past",
        "dateTimeRaw": "21/11/2024 10:00 am",
        "dateTimeISO": "2024-11-21T04:30:00.000Z",
        "title": "Investor Meeting - Kotak Securities Limited",
        "icsUrl": "https://in.marketscreener.com/api/stateful/agenda/event-async/Investor-Meeting-Kotak-Securities-Limited-48392108.ics"
      },
      {
        "section": "Past",
        "dateTimeRaw": "06/11/2024",
        "dateTimeISO": "2024-11-05T18:30:00.000Z",
        "title": "Investor Meeting",
        "icsUrl": "https://in.marketscreener.com/api/stateful/agenda/event-async/Investor-Meeting-48187131.ics"
      },
      {
        "section": "Past",
        "dateTimeRaw": "04/11/2024",
        "dateTimeISO": "2024-11-03T18:30:00.000Z",
        "title": "Investor Meeting",
        "icsUrl": "https://in.marketscreener.com/api/stateful/agenda/event-async/Investor-Meeting-48187125.ics"
      },
      {
        "section": "Past",
        "dateTimeRaw": "16/10/2024 12:00 pm",
        "dateTimeISO": "2024-10-16T06:30:00.000Z",
        "title": "Q2 2025 Earnings Call",
        "icsUrl": "https://in.marketscreener.com/api/stateful/agenda/event-async/Q2-2025-Earnings-Call-48063505.ics"
      },
      {
        "section": "Past",
        "dateTimeRaw": "15/10/2024 05:56 pm",
        "dateTimeISO": "2024-10-15T12:26:00.000Z",
        "title": "Q2 2025 Earnings Release",
        "icsUrl": "https://in.marketscreener.com/api/stateful/agenda/event-async/Q2-2025-Earnings-Release-45098874.ics"
      },
      {
        "section": "Past",
        "dateTimeRaw": "19/09/2024",
        "dateTimeISO": "2024-09-18T18:30:00.000Z",
        "title": "Investor Meeting - Dolat Capital Market Pvt. Ltd",
        "icsUrl": "https://in.marketscreener.com/api/stateful/agenda/event-async/Investor-Meeting-Dolat-Capital-Market-Pvt-Ltd-47836052.ics"
      },
      {
        "section": "Past",
        "dateTimeRaw": "17/09/2024 09:00 am",
        "dateTimeISO": "2024-09-17T03:30:00.000Z",
        "title": "Investor Meeting - Jefferies India Private Limited",
        "icsUrl": "https://in.marketscreener.com/api/stateful/agenda/event-async/Investor-Meeting-Jefferies-India-Private-Limited-47836049.ics"
      },
      {
        "section": "Past",
        "dateTimeRaw": "11/09/2024 03:30 pm",
        "dateTimeISO": "2024-09-11T10:00:00.000Z",
        "title": "Annual General Meeting",
        "icsUrl": "https://in.marketscreener.com/api/stateful/agenda/event-async/Annual-General-Meeting-47499161.ics"
      },
      {
        "section": "Past",
        "dateTimeRaw": "05/09/2024 10:00 am",
        "dateTimeISO": "2024-09-05T04:30:00.000Z",
        "title": "Investor Meeting - Elara Securities (India) Private limited",
        "icsUrl": "https://in.marketscreener.com/api/stateful/agenda/event-async/Investor-Meeting-Elara-Securities-India-Private-limited-47797744.ics"
      },
      {
        "section": "Past",
        "dateTimeRaw": "22/08/2024 10:00 am",
        "dateTimeISO": "2024-08-22T04:30:00.000Z",
        "title": "Investor Meeting - Equirus Securities Private Limited",
        "icsUrl": "https://in.marketscreener.com/api/stateful/agenda/event-async/Investor-Meeting-Equirus-Securities-Private-Limited-47698567.ics"
      },
      {
        "section": "Past",
        "dateTimeRaw": "22/08/2024",
        "dateTimeISO": "2024-08-21T18:30:00.000Z",
        "title": "Investor Meeting - Ambit Capital Private Limited",
        "icsUrl": "https://in.marketscreener.com/api/stateful/agenda/event-async/Investor-Meeting-Ambit-Capital-Private-Limited-47698566.ics"
      },
      {
        "section": "Past",
        "dateTimeRaw": "21/08/2024 09:00 am",
        "dateTimeISO": "2024-08-21T03:30:00.000Z",
        "title": "Investor Meeting",
        "icsUrl": "https://in.marketscreener.com/api/stateful/agenda/event-async/Investor-Meeting-47698558.ics"
      },
      {
        "section": "Past",
        "dateTimeRaw": "21/08/2024 09:00 am",
        "dateTimeISO": "2024-08-21T03:30:00.000Z",
        "title": "Investor Meeting - Motilal Oswal Financial Services Ltd.",
        "icsUrl": "https://in.marketscreener.com/api/stateful/agenda/event-async/Investor-Meeting-Motilal-Oswal-Financial-Services-Ltd-47698557.ics"
      },
      {
        "section": "Past",
        "dateTimeRaw": "14/08/2024",
        "dateTimeISO": "2024-08-13T18:30:00.000Z",
        "title": "Investor Meeting",
        "icsUrl": "https://in.marketscreener.com/api/stateful/agenda/event-async/Investor-Meeting-47593230.ics"
      },
      {
        "section": "Past",
        "dateTimeRaw": "12/08/2024",
        "dateTimeISO": "2024-08-11T18:30:00.000Z",
        "title": "Nuvama India Conference",
        "icsUrl": "https://in.marketscreener.com/api/stateful/agenda/event-async/Nuvama-India-Conference-47593206.ics"
      },
      {
        "section": "Past",
        "dateTimeRaw": "30/07/2024 12:00 pm",
        "dateTimeISO": "2024-07-30T06:30:00.000Z",
        "title": "Q1 2025 Earnings Call",
        "icsUrl": "https://in.marketscreener.com/api/stateful/agenda/event-async/Q1-2025-Earnings-Call-47387755.ics"
      },
      {
        "section": "Past",
        "dateTimeRaw": "29/07/2024 05:12 pm",
        "dateTimeISO": "2024-07-29T11:42:00.000Z",
        "title": "Q1 2025 Earnings Release",
        "icsUrl": "https://in.marketscreener.com/api/stateful/agenda/event-async/Q1-2025-Earnings-Release-44364439.ics"
      },
      {
        "section": "Past",
        "dateTimeRaw": "06/06/2024",
        "dateTimeISO": "2024-06-05T18:30:00.000Z",
        "title": "Investor Meeting - Day 2",
        "icsUrl": "https://in.marketscreener.com/api/stateful/agenda/event-async/Investor-Meeting-Day-2-46644630.ics"
      },
      {
        "section": "Past",
        "dateTimeRaw": "05/06/2024",
        "dateTimeISO": "2024-06-04T18:30:00.000Z",
        "title": "Investor Meeting - Mirae Asset Capital Markets (India) Pvt. Ltd",
        "icsUrl": "https://in.marketscreener.com/api/stateful/agenda/event-async/Investor-Meeting-Mirae-Asset-Capital-Markets-India-Pvt-Ltd-46644628.ics"
      },
      {
        "section": "Past",
        "dateTimeRaw": "03/06/2024",
        "dateTimeISO": "2024-06-02T18:30:00.000Z",
        "title": "Investor Meeting - Nuvama Wealth Management Limited",
        "icsUrl": "https://in.marketscreener.com/api/stateful/agenda/event-async/Investor-Meeting-Nuvama-Wealth-Management-Limited-46644627.ics"
      },
      {
        "section": "Past",
        "dateTimeRaw": "29/05/2024",
        "dateTimeISO": "2024-05-28T18:30:00.000Z",
        "title": "Investor Meeting - Batlivala & Karani Securities India Pvt. Ltd.",
        "icsUrl": "https://in.marketscreener.com/api/stateful/agenda/event-async/Investor-Meeting-Batlivala-Karani-Securities-India-Pvt-Ltd-46644624.ics"
      },
      {
        "section": "Past",
        "dateTimeRaw": "24/05/2024",
        "dateTimeISO": "2024-05-23T18:30:00.000Z",
        "title": "Investor Meeting - Day 2",
        "icsUrl": "https://in.marketscreener.com/api/stateful/agenda/event-async/Investor-Meeting-Day-2-46644623.ics"
      },
      {
        "section": "Past",
        "dateTimeRaw": "23/05/2024",
        "dateTimeISO": "2024-05-22T18:30:00.000Z",
        "title": "Investor Meeting - Day 1",
        "icsUrl": "https://in.marketscreener.com/api/stateful/agenda/event-async/Investor-Meeting-Day-1-46644622.ics"
      },
      {
        "section": "Past",
        "dateTimeRaw": "22/05/2024",
        "dateTimeISO": "2024-05-21T18:30:00.000Z",
        "title": "Investor Meeting - Kotak Securities Limited",
        "icsUrl": "https://in.marketscreener.com/api/stateful/agenda/event-async/Investor-Meeting-Kotak-Securities-Limited-46633362.ics"
      },
      {
        "section": "Past",
        "dateTimeRaw": "03/05/2024 12:00 pm",
        "dateTimeISO": "2024-05-03T06:30:00.000Z",
        "title": "Q4 2024 Earnings Call",
        "icsUrl": "https://in.marketscreener.com/api/stateful/agenda/event-async/Q4-2024-Earnings-Call-46541513.ics"
      },
      {
        "section": "Past",
        "dateTimeRaw": "02/05/2024 05:59 pm",
        "dateTimeISO": "2024-05-02T12:29:00.000Z",
        "title": "Q4 2024 Earnings Release",
        "icsUrl": "https://in.marketscreener.com/api/stateful/agenda/event-async/Q4-2024-Earnings-Release-43694293.ics"
      },
      {
        "section": "Past",
        "dateTimeRaw": "19/03/2024",
        "dateTimeISO": "2024-03-18T18:30:00.000Z",
        "title": "Ex-dividend day for dividende intermdiaire",
        "icsUrl": "https://in.marketscreener.com/api/stateful/agenda/event-async/Ex-dividend-day-for-dividende-intermediaire-46229342.ics"
      },
      {
        "section": "Past",
        "dateTimeRaw": "18/03/2024",
        "dateTimeISO": "2024-03-17T18:30:00.000Z",
        "title": "Investor Meeting - Motilal Oswal Financial Services Limited",
        "icsUrl": "https://in.marketscreener.com/api/stateful/agenda/event-async/Investor-Meeting-Motilal-Oswal-Financial-Services-Limited-46178662.ics"
      },
      {
        "section": "Past",
        "dateTimeRaw": "29/02/2024",
        "dateTimeISO": "2024-02-28T18:30:00.000Z",
        "title": "Investor Meeting - JM Financial Institutional Securities Limited",
        "icsUrl": "https://in.marketscreener.com/api/stateful/agenda/event-async/Investor-Meeting-JM-Financial-Institutional-Securities-Limited-46177939.ics"
      },
      {
        "section": "Past",
        "dateTimeRaw": "28/02/2024",
        "dateTimeISO": "2024-02-27T18:30:00.000Z",
        "title": "Investor Meeting - Investec Capital Services (India) Private Limited",
        "icsUrl": "https://in.marketscreener.com/api/stateful/agenda/event-async/Investor-Meeting-Investec-Capital-Services-India-Private-Limited-46177870.ics"
      },
      {
        "section": "Past",
        "dateTimeRaw": "27/02/2024 11:00 am",
        "dateTimeISO": "2024-02-27T05:30:00.000Z",
        "title": "Investor Meeting - BOB Capital Markets Limited",
        "icsUrl": "https://in.marketscreener.com/api/stateful/agenda/event-async/Investor-Meeting-BOB-Capital-Markets-Limited-46177805.ics"
      },
      {
        "section": "Past",
        "dateTimeRaw": "14/02/2024",
        "dateTimeISO": "2024-02-13T18:30:00.000Z",
        "title": "Investor Meeting - IIFL Securities Limited",
        "icsUrl": "https://in.marketscreener.com/api/stateful/agenda/event-async/Investor-Meeting-IIFL-Securities-Limited-46177416.ics"
      },
      {
        "section": "Past",
        "dateTimeRaw": "13/02/2024",
        "dateTimeISO": "2024-02-12T18:30:00.000Z",
        "title": "Investor Meeting - Axis Capital Limited",
        "icsUrl": "https://in.marketscreener.com/api/stateful/agenda/event-async/Investor-Meeting-Axis-Capital-Limited-46177370.ics"
      },
      {
        "section": "Past",
        "dateTimeRaw": "12/02/2024",
        "dateTimeISO": "2024-02-11T18:30:00.000Z",
        "title": "Investor Meeting - Nuvama Wealth Management Limited",
        "icsUrl": "https://in.marketscreener.com/api/stateful/agenda/event-async/Investor-Meeting-Nuvama-Wealth-Management-Limited-46177344.ics"
      },
      {
        "section": "Past",
        "dateTimeRaw": "24/01/2024 12:00 pm",
        "dateTimeISO": "2024-01-24T06:30:00.000Z",
        "title": "Q3 2024 Earnings Call",
        "icsUrl": "https://in.marketscreener.com/api/stateful/agenda/event-async/Q3-2024-Earnings-Call-45754450.ics"
      },
      {
        "section": "Past",
        "dateTimeRaw": "23/01/2024 06:21 pm",
        "dateTimeISO": "2024-01-23T12:51:00.000Z",
        "title": "Q3 2024 Earnings Release",
        "icsUrl": "https://in.marketscreener.com/api/stateful/agenda/event-async/Q3-2024-Earnings-Release-42736004.ics"
      },
      {
        "section": "Past",
        "dateTimeRaw": "01/12/2023",
        "dateTimeISO": "2023-11-30T18:30:00.000Z",
        "title": "Investor Meeting - CLSA India Private Limited",
        "icsUrl": "https://in.marketscreener.com/api/stateful/agenda/event-async/Investor-Meeting-CLSA-India-Private-Limited-45447938.ics"
      },
      {
        "section": "Past",
        "dateTimeRaw": "24/11/2023",
        "dateTimeISO": "2023-11-23T18:30:00.000Z",
        "title": "Investor Meeting - Kotak Securities Limited",
        "icsUrl": "https://in.marketscreener.com/api/stateful/agenda/event-async/Investor-Meeting-Kotak-Securities-Limited-45332096.ics"
      },
      {
        "section": "Past",
        "dateTimeRaw": "23/11/2023",
        "dateTimeISO": "2023-11-22T18:30:00.000Z",
        "title": "Investor Meeting - Kotak Securities Limited",
        "icsUrl": "https://in.marketscreener.com/api/stateful/agenda/event-async/Investor-Meeting-Kotak-Securities-Limited-45332084.ics"
      },
      {
        "section": "Past",
        "dateTimeRaw": "22/11/2023",
        "dateTimeISO": "2023-11-21T18:30:00.000Z",
        "title": "Investor Meeting - Kotak Securities Limited",
        "icsUrl": "https://in.marketscreener.com/api/stateful/agenda/event-async/Investor-Meeting-Kotak-Securities-Limited-45332071.ics"
      },
      {
        "section": "Past",
        "dateTimeRaw": "09/11/2023",
        "dateTimeISO": "2023-11-08T18:30:00.000Z",
        "title": "Investor Meeting - UBS Securities India Private Limited",
        "icsUrl": "https://in.marketscreener.com/api/stateful/agenda/event-async/Investor-Meeting-UBS-Securities-India-Private-Limited-45331636.ics"
      },
      {
        "section": "Past",
        "dateTimeRaw": "06/11/2023",
        "dateTimeISO": "2023-11-05T18:30:00.000Z",
        "title": "Investor Meeting - Anand Rathi Share and Stock Brokers Limited",
        "icsUrl": "https://in.marketscreener.com/api/stateful/agenda/event-async/Investor-Meeting-Anand-Rathi-Share-and-Stock-Brokers-Limited-45331419.ics"
      },
      {
        "section": "Past",
        "dateTimeRaw": "01/11/2023 12:00 pm",
        "dateTimeISO": "2023-11-01T06:30:00.000Z",
        "title": "Q2 2024 Earnings Call",
        "icsUrl": "https://in.marketscreener.com/api/stateful/agenda/event-async/Q2-2024-Earnings-Call-45331308.ics"
      },
      {
        "section": "Past",
        "dateTimeRaw": "31/10/2023 06:22 pm",
        "dateTimeISO": "2023-10-31T12:52:00.000Z",
        "title": "Q2 2024 Earnings Release",
        "icsUrl": "https://in.marketscreener.com/api/stateful/agenda/event-async/Q2-2024-Earnings-Release-42149147.ics"
      },
      {
        "section": "Past",
        "dateTimeRaw": "12/09/2023",
        "dateTimeISO": "2023-09-11T18:30:00.000Z",
        "title": "Investor Meeting - Kotak Securities Limited",
        "icsUrl": "https://in.marketscreener.com/api/stateful/agenda/event-async/Investor-Meeting-Kotak-Securities-Limited-44728460.ics"
      },
      {
        "section": "Past",
        "dateTimeRaw": "11/09/2023 05:30 pm",
        "dateTimeISO": "2023-09-11T12:00:00.000Z",
        "title": "Investor Meeting - Jefferies India Private Limited",
        "icsUrl": "https://in.marketscreener.com/api/stateful/agenda/event-async/Investor-Meeting-Jefferies-India-Private-Limited-44728457.ics"
      },
      {
        "section": "Past",
        "dateTimeRaw": "11/09/2023 12:00 pm",
        "dateTimeISO": "2023-09-11T06:30:00.000Z",
        "title": "Investor Meeting - Nomura Financial Advisory & Securities (India) Private Limited",
        "icsUrl": "https://in.marketscreener.com/api/stateful/agenda/event-async/Investor-Meeting-Nomura-Financial-Advisory-Securities-India-Private-Limited-44728458.ics"
      },
      {
        "section": "Past",
        "dateTimeRaw": "01/09/2023 03:30 pm",
        "dateTimeISO": "2023-09-01T10:00:00.000Z",
        "title": "Annual General Meeting",
        "icsUrl": "https://in.marketscreener.com/api/stateful/agenda/event-async/Annual-General-Meeting-44476013.ics"
      },
      {
        "section": "Past",
        "dateTimeRaw": "30/08/2023 04:00 pm",
        "dateTimeISO": "2023-08-30T10:30:00.000Z",
        "title": "Investor Meeting - Jefferies India Private Limited",
        "icsUrl": "https://in.marketscreener.com/api/stateful/agenda/event-async/Investor-Meeting-Jefferies-India-Private-Limited-44705286.ics"
      },
      {
        "section": "Past",
        "dateTimeRaw": "30/08/2023 01:00 pm",
        "dateTimeISO": "2023-08-30T07:30:00.000Z",
        "title": "Investor Meeting - Nirmal Bang Equities Private Limited",
        "icsUrl": "https://in.marketscreener.com/api/stateful/agenda/event-async/Investor-Meeting-Nirmal-Bang-Equities-Private-Limited-44705287.ics"
      },
      {
        "section": "Past",
        "dateTimeRaw": "24/08/2023",
        "dateTimeISO": "2023-08-23T18:30:00.000Z",
        "title": "Investor Meeting - Axis Capital Limited",
        "icsUrl": "https://in.marketscreener.com/api/stateful/agenda/event-async/Investor-Meeting-Axis-Capital-Limited-44666020.ics"
      },
      {
        "section": "Past",
        "dateTimeRaw": "23/08/2023",
        "dateTimeISO": "2023-08-22T18:30:00.000Z",
        "title": "Investor Meeting - Motilal Oswal Financial Services Ltd",
        "icsUrl": "https://in.marketscreener.com/api/stateful/agenda/event-async/Investor-Meeting-Motilal-Oswal-Financial-Services-Ltd-44573076.ics"
      },
      {
        "section": "Past",
        "dateTimeRaw": "22/08/2023",
        "dateTimeISO": "2023-08-21T18:30:00.000Z",
        "title": "Investor Meeting - Ambit Capital Private Ltd",
        "icsUrl": "https://in.marketscreener.com/api/stateful/agenda/event-async/Investor-Meeting-Ambit-Capital-Private-Ltd-44573074.ics"
      },
      {
        "section": "Past",
        "dateTimeRaw": "18/08/2023",
        "dateTimeISO": "2023-08-17T18:30:00.000Z",
        "title": "Investor Meeting - Emkay Global Financial Services Ltd",
        "icsUrl": "https://in.marketscreener.com/api/stateful/agenda/event-async/Investor-Meeting-Emkay-Global-Financial-Services-Ltd-44573073.ics"
      },
      {
        "section": "Past",
        "dateTimeRaw": "18/08/2023",
        "dateTimeISO": "2023-08-17T18:30:00.000Z",
        "title": "Investor Meeting - Nuvama Wealth Management Ltd",
        "icsUrl": "https://in.marketscreener.com/api/stateful/agenda/event-async/Investor-Meeting-Nuvama-Wealth-Management-Ltd-44573072.ics"
      },
      {
        "section": "Past",
        "dateTimeRaw": "17/08/2023",
        "dateTimeISO": "2023-08-16T18:30:00.000Z",
        "title": "Investor Meeting - Nuvama Wealth Management Ltd",
        "icsUrl": "https://in.marketscreener.com/api/stateful/agenda/event-async/Investor-Meeting-Nuvama-Wealth-Management-Ltd-44573071.ics"
      },
      {
        "section": "Past",
        "dateTimeRaw": "16/08/2023",
        "dateTimeISO": "2023-08-15T18:30:00.000Z",
        "title": "Investor Meeting - Nuvama Wealth Management Ltd",
        "icsUrl": "https://in.marketscreener.com/api/stateful/agenda/event-async/Investor-Meeting-Nuvama-Wealth-Management-Ltd-44573069.ics"
      },
      {
        "section": "Past",
        "dateTimeRaw": "07/08/2023",
        "dateTimeISO": "2023-08-06T18:30:00.000Z",
        "title": "Investor Meeting - PhillipCapital (India) Pvt. Ltd.",
        "icsUrl": "https://in.marketscreener.com/api/stateful/agenda/event-async/Investor-Meeting-PhillipCapital-India-Pvt-Ltd-44558509.ics"
      },
      {
        "section": "Past",
        "dateTimeRaw": "01/08/2023 12:00 pm",
        "dateTimeISO": "2023-08-01T06:30:00.000Z",
        "title": "Q1 2024 Earnings Call",
        "icsUrl": "https://in.marketscreener.com/api/stateful/agenda/event-async/Q1-2024-Earnings-Call-44375096.ics"
      },
      {
        "section": "Past",
        "dateTimeRaw": "31/07/2023 05:59 pm",
        "dateTimeISO": "2023-07-31T12:29:00.000Z",
        "title": "Q1 2024 Earnings Release",
        "icsUrl": "https://in.marketscreener.com/api/stateful/agenda/event-async/Q1-2024-Earnings-Release-41004223.ics"
      },
      {
        "section": "Past",
        "dateTimeRaw": "16/06/2023",
        "dateTimeISO": "2023-06-15T18:30:00.000Z",
        "title": "Investor Meeting - Investec Capital Services (India) Private Limited",
        "icsUrl": "https://in.marketscreener.com/api/stateful/agenda/event-async/Investor-Meeting-Investec-Capital-Services-India-Private-Limited-43930555.ics"
      },
      {
        "section": "Past",
        "dateTimeRaw": "15/06/2023",
        "dateTimeISO": "2023-06-14T18:30:00.000Z",
        "title": "Investor Meeting - Investec Capital Services (India) Private Limited",
        "icsUrl": "https://in.marketscreener.com/api/stateful/agenda/event-async/Investor-Meeting-Investec-Capital-Services-India-Private-Limited-43930550.ics"
      },
      {
        "section": "Past",
        "dateTimeRaw": "07/06/2023",
        "dateTimeISO": "2023-06-06T18:30:00.000Z",
        "title": "Investor Meeting - Nuvama Wealth Management Limited",
        "icsUrl": "https://in.marketscreener.com/api/stateful/agenda/event-async/Investor-Meeting-Nuvama-Wealth-Management-Limited-43930539.ics"
      },
      {
        "section": "Past",
        "dateTimeRaw": "05/06/2023",
        "dateTimeISO": "2023-06-04T18:30:00.000Z",
        "title": "Investor Meeting - Nuvama Wealth Management Limited",
        "icsUrl": "https://in.marketscreener.com/api/stateful/agenda/event-async/Investor-Meeting-Nuvama-Wealth-Management-Limited-43930532.ics"
      },
      {
        "section": "Past",
        "dateTimeRaw": "31/05/2023",
        "dateTimeISO": "2023-05-30T18:30:00.000Z",
        "title": "Investor Meeting - Batlivala & Karani Securities India Pvt. Ltd",
        "icsUrl": "https://in.marketscreener.com/api/stateful/agenda/event-async/Investor-Meeting-Batlivala-Karani-Securities-India-Pvt-Ltd-43930524.ics"
      },
      {
        "section": "Past",
        "dateTimeRaw": "30/05/2023 11:00 am",
        "dateTimeISO": "2023-05-30T05:30:00.000Z",
        "title": "Investor Meeting - Nuvama Wealth Management Limited",
        "icsUrl": "https://in.marketscreener.com/api/stateful/agenda/event-async/Investor-Meeting-Nuvama-Wealth-Management-Limited-43969340.ics"
      },
      {
        "section": "Past",
        "dateTimeRaw": "25/05/2023 08:00 pm",
        "dateTimeISO": "2023-05-25T14:30:00.000Z",
        "title": "Investor Meeting - Equirus Securities (P) Limited",
        "icsUrl": "https://in.marketscreener.com/api/stateful/agenda/event-async/Investor-Meeting-Equirus-Securities-P-Limited-43930502.ics"
      },
      {
        "section": "Past",
        "dateTimeRaw": "23/05/2023",
        "dateTimeISO": "2023-05-22T18:30:00.000Z",
        "title": "Investor Meeting - Jefferies India Private Limited",
        "icsUrl": "https://in.marketscreener.com/api/stateful/agenda/event-async/Investor-Meeting-Jefferies-India-Private-Limited-43930477.ics"
      },
      {
        "section": "Past",
        "dateTimeRaw": "16/05/2023 04:00 pm",
        "dateTimeISO": "2023-05-16T10:30:00.000Z",
        "title": "Investor Meeting - Equirus Securities (P) Limited",
        "icsUrl": "https://in.marketscreener.com/api/stateful/agenda/event-async/Investor-Meeting-Equirus-Securities-P-Limited-43930443.ics"
      },
      {
        "section": "Past",
        "dateTimeRaw": "03/05/2023 12:00 pm",
        "dateTimeISO": "2023-05-03T06:30:00.000Z",
        "title": "Q4 2023 Earnings Call",
        "icsUrl": "https://in.marketscreener.com/api/stateful/agenda/event-async/Q4-2023-Earnings-Call-43693782.ics"
      },
      {
        "section": "Past",
        "dateTimeRaw": "02/05/2023 07:19 pm",
        "dateTimeISO": "2023-05-02T13:49:00.000Z",
        "title": "Q4 2023 Earnings Release",
        "icsUrl": "https://in.marketscreener.com/api/stateful/agenda/event-async/Q4-2023-Earnings-Release-41004108.ics"
      },
      {
        "section": "Past",
        "dateTimeRaw": "02/03/2023",
        "dateTimeISO": "2023-03-01T18:30:00.000Z",
        "title": "Investor Meeting - Investec Capital Services (India) Private Limited - Day 2",
        "icsUrl": "https://in.marketscreener.com/api/stateful/agenda/event-async/Investor-Meeting-Investec-Capital-Services-India-Private-Limited-Day-2-43161291.ics"
      },
      {
        "section": "Past",
        "dateTimeRaw": "01/03/2023",
        "dateTimeISO": "2023-02-28T18:30:00.000Z",
        "title": "Investor Meeting - Investec Capital Services (India) Private Limited - Day 1",
        "icsUrl": "https://in.marketscreener.com/api/stateful/agenda/event-async/Investor-Meeting-Investec-Capital-Services-India-Private-Limited-Day-1-43161265.ics"
      },
      {
        "section": "Past",
        "dateTimeRaw": "27/02/2023",
        "dateTimeISO": "2023-02-26T18:30:00.000Z",
        "title": "Investor Meeting - Motilal Oswal Financial Services Ltd",
        "icsUrl": "https://in.marketscreener.com/api/stateful/agenda/event-async/Investor-Meeting-Motilal-Oswal-Financial-Services-Ltd-43090277.ics"
      },
      {
        "section": "Past",
        "dateTimeRaw": "20/02/2023 03:00 pm",
        "dateTimeISO": "2023-02-20T09:30:00.000Z",
        "title": "Investor Meeting - Jefferies India Private Limited",
        "icsUrl": "https://in.marketscreener.com/api/stateful/agenda/event-async/Investor-Meeting-Jefferies-India-Private-Limited-43028417.ics"
      },
      {
        "section": "Past",
        "dateTimeRaw": "17/02/2023 02:00 pm",
        "dateTimeISO": "2023-02-17T08:30:00.000Z",
        "title": "Investor Meeting - Dolat Capital Market Private Limited",
        "icsUrl": "https://in.marketscreener.com/api/stateful/agenda/event-async/Investor-Meeting-Dolat-Capital-Market-Private-Limited-43028402.ics"
      },
      {
        "section": "Past",
        "dateTimeRaw": "13/02/2023",
        "dateTimeISO": "2023-02-12T18:30:00.000Z",
        "title": "Investor Meeting - UBS Securities India Private Limited",
        "icsUrl": "https://in.marketscreener.com/api/stateful/agenda/event-async/Investor-Meeting-UBS-Securities-India-Private-Limited-42964727.ics"
      },
      {
        "section": "Past",
        "dateTimeRaw": "09/02/2023",
        "dateTimeISO": "2023-02-08T18:30:00.000Z",
        "title": "Investor Meeting - Nuvama Wealth Management Limited",
        "icsUrl": "https://in.marketscreener.com/api/stateful/agenda/event-async/Investor-Meeting-Nuvama-Wealth-Management-Limited-42900897.ics"
      },
      {
        "section": "Past",
        "dateTimeRaw": "06/02/2023",
        "dateTimeISO": "2023-02-05T18:30:00.000Z",
        "title": "Investor Meeting - Antique Stock Broking Ltd",
        "icsUrl": "https://in.marketscreener.com/api/stateful/agenda/event-async/Investor-Meeting-Antique-Stock-Broking-Ltd-42900852.ics"
      },
      {
        "section": "Past",
        "dateTimeRaw": "03/02/2023",
        "dateTimeISO": "2023-02-02T18:30:00.000Z",
        "title": "Ex-dividend day for dividende intermdiaire",
        "icsUrl": "https://in.marketscreener.com/api/stateful/agenda/event-async/Ex-dividend-day-for-dividende-intermediaire-42895171.ics"
      },
      {
        "section": "Past",
        "dateTimeRaw": "24/01/2023 12:00 pm",
        "dateTimeISO": "2023-01-24T06:30:00.000Z",
        "title": "Q3 2023 Earnings Call",
        "icsUrl": "https://in.marketscreener.com/api/stateful/agenda/event-async/Q3-2023-Earnings-Call-42784961.ics"
      },
      {
        "section": "Past",
        "dateTimeRaw": "23/01/2023",
        "dateTimeISO": "2023-01-22T18:30:00.000Z",
        "title": "Q3 2023 Earnings Release",
        "icsUrl": "https://in.marketscreener.com/api/stateful/agenda/event-async/Q3-2023-Earnings-Release-37616877.ics"
      },
      {
        "section": "Past",
        "dateTimeRaw": "07/12/2022",
        "dateTimeISO": "2022-12-06T18:30:00.000Z",
        "title": "Investor Meeting - Motilal Oswal Financial Services Ltd.",
        "icsUrl": "https://in.marketscreener.com/api/stateful/agenda/event-async/Investor-Meeting-Motilal-Oswal-Financial-Services-Ltd-42470778.ics"
      },
      {
        "section": "Past",
        "dateTimeRaw": "21/11/2022",
        "dateTimeISO": "2022-11-20T18:30:00.000Z",
        "title": "Investor Meeting",
        "icsUrl": "https://in.marketscreener.com/api/stateful/agenda/event-async/Investor-Meeting-42365799.ics"
      },
      {
        "section": "Past",
        "dateTimeRaw": "18/11/2022",
        "dateTimeISO": "2022-11-17T18:30:00.000Z",
        "title": "Investor Meeting - Centrum Broking Limited",
        "icsUrl": "https://in.marketscreener.com/api/stateful/agenda/event-async/Investor-Meeting-Centrum-Broking-Limited-42365776.ics"
      },
      {
        "section": "Past",
        "dateTimeRaw": "14/11/2022",
        "dateTimeISO": "2022-11-13T18:30:00.000Z",
        "title": "Investor Meeting - Axis Capital Limited",
        "icsUrl": "https://in.marketscreener.com/api/stateful/agenda/event-async/Investor-Meeting-Axis-Capital-Limited-42294987.ics"
      },
      {
        "section": "Past",
        "dateTimeRaw": "21/10/2022 12:00 pm",
        "dateTimeISO": "2022-10-21T06:30:00.000Z",
        "title": "Interim 2023 Earnings Call",
        "icsUrl": "https://in.marketscreener.com/api/stateful/agenda/event-async/Interim-2023-Earnings-Call-42147791.ics"
      },
      {
        "section": "Past",
        "dateTimeRaw": "20/10/2022 05:44 pm",
        "dateTimeISO": "2022-10-20T12:14:00.000Z",
        "title": "Interim 2023 Earnings Release",
        "icsUrl": "https://in.marketscreener.com/api/stateful/agenda/event-async/Interim-2023-Earnings-Release-36699186.ics"
      },
      {
        "section": "Past",
        "dateTimeRaw": "26/09/2022 12:00 pm",
        "dateTimeISO": "2022-09-26T06:30:00.000Z",
        "title": "Investor Meeting - Equirus Securities (P) Limited",
        "icsUrl": "https://in.marketscreener.com/api/stateful/agenda/event-async/Investor-Meeting-Equirus-Securities-P-Limited-41853815.ics"
      },
      {
        "section": "Past",
        "dateTimeRaw": "16/09/2022 02:00 pm",
        "dateTimeISO": "2022-09-16T08:30:00.000Z",
        "title": "Investor Meeting - Asian Markets Securities Private Limited",
        "icsUrl": "https://in.marketscreener.com/api/stateful/agenda/event-async/Investor-Meeting-Asian-Markets-Securities-Private-Limited-41799601.ics"
      },
      {
        "section": "Past",
        "dateTimeRaw": "13/09/2022 10:00 am",
        "dateTimeISO": "2022-09-13T04:30:00.000Z",
        "title": "Investor Meeting - Incred Research Services Private Limited",
        "icsUrl": "https://in.marketscreener.com/api/stateful/agenda/event-async/Investor-Meeting-Incred-Research-Services-Private-Limited-41799533.ics"
      },
      {
        "section": "Past",
        "dateTimeRaw": "08/09/2022 02:00 pm",
        "dateTimeISO": "2022-09-08T08:30:00.000Z",
        "title": "Investor Meeting - Elara Securities (India) Private Limited",
        "icsUrl": "https://in.marketscreener.com/api/stateful/agenda/event-async/Investor-Meeting-Elara-Securities-India-Private-Limited-41632891.ics"
      },
      {
        "section": "Past",
        "dateTimeRaw": "07/09/2022 03:30 pm",
        "dateTimeISO": "2022-09-07T10:00:00.000Z",
        "title": "Annual General Meeting",
        "icsUrl": "https://in.marketscreener.com/api/stateful/agenda/event-async/Annual-General-Meeting-41145993.ics"
      },
      {
        "section": "Past",
        "dateTimeRaw": "06/09/2022 09:00 am",
        "dateTimeISO": "2022-09-06T03:30:00.000Z",
        "title": "Investor Meeting - Spark Capital Advisors (India) Private Limited",
        "icsUrl": "https://in.marketscreener.com/api/stateful/agenda/event-async/Investor-Meeting-Spark-Capital-Advisors-India-Private-Limited-41632859.ics"
      },
      {
        "section": "Past",
        "dateTimeRaw": "02/09/2022 02:30 pm",
        "dateTimeISO": "2022-09-02T09:00:00.000Z",
        "title": "Investor Meeting - Somerset Capital Management Singapore Pte. Ltd",
        "icsUrl": "https://in.marketscreener.com/api/stateful/agenda/event-async/Investor-Meeting-Somerset-Capital-Management-Singapore-Pte-Ltd-41632854.ics"
      },
      {
        "section": "Past",
        "dateTimeRaw": "30/08/2022 01:00 pm",
        "dateTimeISO": "2022-08-30T07:30:00.000Z",
        "title": "Investor Meeting - CLSA India Private Limited",
        "icsUrl": "https://in.marketscreener.com/api/stateful/agenda/event-async/Investor-Meeting-CLSA-India-Private-Limited-41632836.ics"
      },
      {
        "section": "Past",
        "dateTimeRaw": "24/08/2022",
        "dateTimeISO": "2022-08-23T18:30:00.000Z",
        "title": "DART India Conference",
        "icsUrl": "https://in.marketscreener.com/api/stateful/agenda/event-async/DART-India-Conference-41626226.ics"
      },
      {
        "section": "Past",
        "dateTimeRaw": "18/08/2022",
        "dateTimeISO": "2022-08-17T18:30:00.000Z",
        "title": "Edelweiss India Conference",
        "icsUrl": "https://in.marketscreener.com/api/stateful/agenda/event-async/Edelweiss-India-Conference-41626193.ics"
      },
      {
        "section": "Past",
        "dateTimeRaw": "10/08/2022",
        "dateTimeISO": "2022-08-09T18:30:00.000Z",
        "title": "Investor Meeting",
        "icsUrl": "https://in.marketscreener.com/api/stateful/agenda/event-async/Investor-Meeting-41307346.ics"
      },
      {
        "section": "Past",
        "dateTimeRaw": "08/08/2022 01:00 pm",
        "dateTimeISO": "2022-08-08T07:30:00.000Z",
        "title": "Investor Meeting",
        "icsUrl": "https://in.marketscreener.com/api/stateful/agenda/event-async/Investor-Meeting-41307327.ics"
      },
      {
        "section": "Past",
        "dateTimeRaw": "27/07/2022 12:00 pm",
        "dateTimeISO": "2022-07-27T06:30:00.000Z",
        "title": "Q1 2023 Earnings Call",
        "icsUrl": "https://in.marketscreener.com/api/stateful/agenda/event-async/Q1-2023-Earnings-Call-41067335.ics"
      },
      {
        "section": "Past",
        "dateTimeRaw": "26/07/2022 05:59 pm",
        "dateTimeISO": "2022-07-26T12:29:00.000Z",
        "title": "Q1 2023 Earnings Release",
        "icsUrl": "https://in.marketscreener.com/api/stateful/agenda/event-async/Q1-2023-Earnings-Release-36031455.ics"
      },
      {
        "section": "Past",
        "dateTimeRaw": "23/06/2022 03:00 pm",
        "dateTimeISO": "2022-06-23T09:30:00.000Z",
        "title": "Investor Meeting",
        "icsUrl": "https://in.marketscreener.com/api/stateful/agenda/event-async/Investor-Meeting-40814952.ics"
      },
      {
        "section": "Past",
        "dateTimeRaw": "10/05/2022 12:00 pm",
        "dateTimeISO": "2022-05-10T06:30:00.000Z",
        "title": "FY 2022 Earnings Call",
        "icsUrl": "https://in.marketscreener.com/api/stateful/agenda/event-async/FY-2022-Earnings-Call-40308667.ics"
      },
      {
        "section": "Past",
        "dateTimeRaw": "09/05/2022 06:47 pm",
        "dateTimeISO": "2022-05-09T13:17:00.000Z",
        "title": "FY 2022 Earnings Release",
        "icsUrl": "https://in.marketscreener.com/api/stateful/agenda/event-async/FY-2022-Earnings-Release-33330131.ics"
      },
      {
        "section": "Past",
        "dateTimeRaw": "24/03/2022 10:00 am",
        "dateTimeISO": "2022-03-24T04:30:00.000Z",
        "title": "Investor Meeting",
        "icsUrl": "https://in.marketscreener.com/api/stateful/agenda/event-async/Investor-Meeting-39875283.ics"
      },
      {
        "section": "Past",
        "dateTimeRaw": "16/03/2022 12:00 pm",
        "dateTimeISO": "2022-03-16T06:30:00.000Z",
        "title": "Investor Meeting - One-On-One Meeting",
        "icsUrl": "https://in.marketscreener.com/api/stateful/agenda/event-async/Investor-Meeting-One-On-One-Meeting-39744638.ics"
      },
      {
        "section": "Past",
        "dateTimeRaw": "15/03/2022",
        "dateTimeISO": "2022-03-14T18:30:00.000Z",
        "title": "Investor Meeting - One-On-One Meeting",
        "icsUrl": "https://in.marketscreener.com/api/stateful/agenda/event-async/Investor-Meeting-One-On-One-Meeting-39744621.ics"
      },
      {
        "section": "Past",
        "dateTimeRaw": "07/02/2022",
        "dateTimeISO": "2022-02-06T18:30:00.000Z",
        "title": "Ex-dividend day for dividende intermdiaire",
        "icsUrl": "https://in.marketscreener.com/api/stateful/agenda/event-async/Ex-dividend-day-for-dividende-intermediaire-37690444.ics"
      },
      {
        "section": "Past",
        "dateTimeRaw": "28/01/2022 12:00 pm",
        "dateTimeISO": "2022-01-28T06:30:00.000Z",
        "title": "Q3 2022 Earnings Call",
        "icsUrl": "https://in.marketscreener.com/api/stateful/agenda/event-async/Q3-2022-Earnings-Call-37616676.ics"
      },
      {
        "section": "Past",
        "dateTimeRaw": "27/01/2022 05:07 pm",
        "dateTimeISO": "2022-01-27T11:37:00.000Z",
        "title": "Q3 2022 Earnings Release",
        "icsUrl": "https://in.marketscreener.com/api/stateful/agenda/event-async/Q3-2022-Earnings-Release-32212983.ics"
      },
      {
        "section": "Past",
        "dateTimeRaw": "15/11/2021",
        "dateTimeISO": "2021-11-14T18:30:00.000Z",
        "title": "Investor Meeting - Centrum Broking Limited",
        "icsUrl": "https://in.marketscreener.com/api/stateful/agenda/event-async/Investor-Meeting-Centrum-Broking-Limited-37092481.ics"
      },
      {
        "section": "Past",
        "dateTimeRaw": "28/10/2021 12:00 pm",
        "dateTimeISO": "2021-10-28T06:30:00.000Z",
        "title": "Interim 2022 Earnings Call",
        "icsUrl": "https://in.marketscreener.com/api/stateful/agenda/event-async/Interim-2022-Earnings-Call-36841495.ics"
      },
      {
        "section": "Past",
        "dateTimeRaw": "08/09/2021 02:00 pm",
        "dateTimeISO": "2021-09-08T08:30:00.000Z",
        "title": "Annual General Meeting",
        "icsUrl": "https://in.marketscreener.com/api/stateful/agenda/event-async/Annual-General-Meeting-36329582.ics"
      },
      {
        "section": "Past",
        "dateTimeRaw": "06/09/2021 11:30 am",
        "dateTimeISO": "2021-09-06T06:00:00.000Z",
        "title": "Investor Meeting - Dolat Capital Market Private Limited",
        "icsUrl": "https://in.marketscreener.com/api/stateful/agenda/event-async/Investor-Meeting-Dolat-Capital-Market-Private-Limited-36403463.ics"
      },
      {
        "section": "Past",
        "dateTimeRaw": "02/08/2021 12:00 pm",
        "dateTimeISO": "2021-08-02T06:30:00.000Z",
        "title": "Q1 2022 Earnings Call",
        "icsUrl": "https://in.marketscreener.com/api/stateful/agenda/event-async/Q1-2022-Earnings-Call-36031019.ics"
      },
      {
        "section": "Past",
        "dateTimeRaw": "31/07/2021",
        "dateTimeISO": "2021-07-30T18:30:00.000Z",
        "title": "Q1 2022 Earnings Release",
        "icsUrl": "https://in.marketscreener.com/api/stateful/agenda/event-async/Q1-2022-Earnings-Release-31037963.ics"
      },
      {
        "section": "Past",
        "dateTimeRaw": "31/05/2021 12:00 pm",
        "dateTimeISO": "2021-05-31T06:30:00.000Z",
        "title": "FY 2021 Earnings Call",
        "icsUrl": "https://in.marketscreener.com/api/stateful/agenda/event-async/FY-2021-Earnings-Call-35055595.ics"
      },
      {
        "section": "Past",
        "dateTimeRaw": "29/05/2021",
        "dateTimeISO": "2021-05-28T18:30:00.000Z",
        "title": "FY 2021 Earnings Release",
        "icsUrl": "https://in.marketscreener.com/api/stateful/agenda/event-async/FY-2021-Earnings-Release-30662030.ics"
      },
      {
        "section": "Past",
        "dateTimeRaw": "09/03/2021",
        "dateTimeISO": "2021-03-08T18:30:00.000Z",
        "title": "Ex-dividend day for dividende intermdiaire",
        "icsUrl": "https://in.marketscreener.com/api/stateful/agenda/event-async/Ex-dividend-day-for-dividende-intermediaire-32558873.ics"
      },
      {
        "section": "Past",
        "dateTimeRaw": "29/01/2021 12:00 pm",
        "dateTimeISO": "2021-01-29T06:30:00.000Z",
        "title": "Q3 2021 Earnings Call",
        "icsUrl": "https://in.marketscreener.com/api/stateful/agenda/event-async/Q3-2021-Earnings-Call-32318674.ics"
      },
      {
        "section": "Past",
        "dateTimeRaw": "28/01/2021",
        "dateTimeISO": "2021-01-27T18:30:00.000Z",
        "title": "Q3 2021 Earnings Release",
        "icsUrl": "https://in.marketscreener.com/api/stateful/agenda/event-async/Q3-2021-Earnings-Release-29891679.ics"
      },
      {
        "section": "Past",
        "dateTimeRaw": "03/11/2020 04:00 pm",
        "dateTimeISO": "2020-11-03T10:30:00.000Z",
        "title": "Interim 2021 Earnings Call",
        "icsUrl": "https://in.marketscreener.com/api/stateful/agenda/event-async/Interim-2021-Earnings-Call-31716151.ics"
      },
      {
        "section": "Past",
        "dateTimeRaw": "02/11/2020",
        "dateTimeISO": "2020-11-01T18:30:00.000Z",
        "title": "Interim 2021 Earnings Release",
        "icsUrl": "https://in.marketscreener.com/api/stateful/agenda/event-async/Interim-2021-Earnings-Release-29598264.ics"
      },
      {
        "section": "Past",
        "dateTimeRaw": "07/08/2020 12:00 pm",
        "dateTimeISO": "2020-08-07T06:30:00.000Z",
        "title": "Q1 2021 Earnings Call",
        "icsUrl": "https://in.marketscreener.com/api/stateful/agenda/event-async/Q1-2021-Earnings-Call-31084849.ics"
      },
      {
        "section": "Past",
        "dateTimeRaw": "06/08/2020",
        "dateTimeISO": "2020-08-05T18:30:00.000Z",
        "title": "Q1 2021 Earnings Release",
        "icsUrl": "https://in.marketscreener.com/api/stateful/agenda/event-async/Q1-2021-Earnings-Release-29010155.ics"
      },
      {
        "section": "Past",
        "dateTimeRaw": "30/05/2020",
        "dateTimeISO": "2020-05-29T18:30:00.000Z",
        "title": "FY 2020 Earnings Call",
        "icsUrl": "https://in.marketscreener.com/api/stateful/agenda/event-async/FY-2020-Earnings-Call-30699229.ics"
      },
      {
        "section": "Past",
        "dateTimeRaw": "30/05/2020",
        "dateTimeISO": "2020-05-29T18:30:00.000Z",
        "title": "FY 2020 Earnings Release",
        "icsUrl": "https://in.marketscreener.com/api/stateful/agenda/event-async/FY-2020-Earnings-Release-30661583.ics"
      },
      {
        "section": "Past",
        "dateTimeRaw": "19/03/2020",
        "dateTimeISO": "2020-03-18T18:30:00.000Z",
        "title": "Ex-dividend day for dividende intermdiaire",
        "icsUrl": "https://in.marketscreener.com/api/stateful/agenda/event-async/Ex-dividend-day-for-dividende-intermediaire-30164221.ics"
      },
      {
        "section": "Past",
        "dateTimeRaw": "20/01/2020",
        "dateTimeISO": "2020-01-19T18:30:00.000Z",
        "title": "Q3 2020 Earnings Release",
        "icsUrl": "https://in.marketscreener.com/api/stateful/agenda/event-async/Q3-2020-Earnings-Release-28306156.ics"
      },
      {
        "section": "Past",
        "dateTimeRaw": "13/11/2019 11:30 am",
        "dateTimeISO": "2019-11-13T06:00:00.000Z",
        "title": "Interim 2020 Earnings Call",
        "icsUrl": "https://in.marketscreener.com/api/stateful/agenda/event-async/Interim-2020-Earnings-Call-29589758.ics"
      },
      {
        "section": "Past",
        "dateTimeRaw": "13/11/2019",
        "dateTimeISO": "2019-11-12T18:30:00.000Z",
        "title": "Interim 2020 Earnings Release",
        "icsUrl": "https://in.marketscreener.com/api/stateful/agenda/event-async/Interim-2020-Earnings-Release-28293725.ics"
      },
      {
        "section": "Past",
        "dateTimeRaw": "06/08/2019 12:00 pm",
        "dateTimeISO": "2019-08-06T06:30:00.000Z",
        "title": "Q1 2020 Earnings Call",
        "icsUrl": "https://in.marketscreener.com/api/stateful/agenda/event-async/Q1-2020-Earnings-Call-29007321.ics"
      },
      {
        "section": "Past",
        "dateTimeRaw": "05/08/2019",
        "dateTimeISO": "2019-08-04T18:30:00.000Z",
        "title": "Q1 2020 Earnings Release",
        "icsUrl": "https://in.marketscreener.com/api/stateful/agenda/event-async/Q1-2020-Earnings-Release-28282230.ics"
      }
    ]
  },
  "pastDividends": {
    "count": 21,
    "dividends": [
      {
        "section": "Past Dividends",
        "dateRaw": "27/01/2025",
        "dateISO": "2025-01-26T18:30:00.000Z",
        "type": "Interim Payment",
        "amount": 4,
        "currency": "INR",
        "title": "Interim Payment 4 INR"
      },
      {
        "section": "Past Dividends",
        "dateRaw": "19/03/2024",
        "dateISO": "2024-03-18T18:30:00.000Z",
        "type": "Interim Payment",
        "amount": 3.5,
        "currency": "INR",
        "title": "Interim Payment 3.5 INR"
      },
      {
        "section": "Past Dividends",
        "dateRaw": "03/02/2023",
        "dateISO": "2023-02-02T18:30:00.000Z",
        "type": "Interim Payment",
        "amount": 3,
        "currency": "INR",
        "title": "Interim Payment 3 INR"
      },
      {
        "section": "Past Dividends",
        "dateRaw": "07/02/2022",
        "dateISO": "2022-02-06T18:30:00.000Z",
        "type": "Interim Payment",
        "amount": 2.5,
        "currency": "INR",
        "title": "Interim Payment 2.5 INR"
      },
      {
        "section": "Past Dividends",
        "dateRaw": "09/03/2021",
        "dateISO": "2021-03-08T18:30:00.000Z",
        "type": "Interim Payment",
        "amount": 2,
        "currency": "INR",
        "title": "Interim Payment 2 INR"
      },
      {
