{
  "companyCode": "MUTHOOT-FINANCE-LIMITED-9743895",
  "timestamp": "2025-10-13T12:16:56.468Z",
  "annualResults": {
    "2023": {
      "Net salesMillion INR": {
        "metric": "Net salesMillion INR",
        "unit": "Million INR",
        "fiscalMonth": "March",
        "year": "2023",
        "released": "105 148",
        "forecast": "74 346",
        "spreadRaw": "41.43%"
      },
      "EBITDA": {
        "metric": "EBITDA",
        "unit": null,
        "fiscalMonth": "March",
        "year": "2023",
        "released": "0,00",
        "forecast": "0,00",
        "spreadRaw": "-"
      },
      "EBITMillion INR": {
        "metric": "EBITMillion INR",
        "unit": "Million INR",
        "fiscalMonth": "March",
        "year": "2023",
        "released": "47 270",
        "forecast": "47 538",
        "spreadRaw": "-0.56%"
      },
      "Earnings before Tax (EBT)Million INR": {
        "metric": "Earnings before Tax (EBT)Million INR",
        "unit": "Million INR",
        "fiscalMonth": "March",
        "year": "2023",
        "released": "46 664",
        "forecast": "47 085",
        "spreadRaw": "-0.89%"
      },
      "Net incomeMillion INR": {
        "metric": "Net incomeMillion INR",
        "unit": "Million INR",
        "fiscalMonth": "March",
        "year": "2023",
        "released": "34 735",
        "forecast": "35 167",
        "spreadRaw": "-1.23%"
      },
      "EPS INR": {
        "metric": "EPS INR",
        "unit": "INR",
        "fiscalMonth": "March",
        "year": "2023",
        "released": "86,5",
        "forecast": "87,5",
        "spreadRaw": "-1.14%"
      },
      "Announcement Date": {
        "metric": "Announcement Date",
        "unit": null,
        "fiscalMonth": "March",
        "year": "2023",
        "released": "19/05/23",
        "forecast": null,
        "spreadRaw": null
      }
    },
    "2024": {
      "Net salesMillion INR": {
        "metric": "Net salesMillion INR",
        "unit": "Million INR",
        "fiscalMonth": "March",
        "year": "2024",
        "released": "126 350",
        "forecast": "78 663",
        "spreadRaw": "60.62%"
      },
      "EBITDA": {
        "metric": "EBITDA",
        "unit": null,
        "fiscalMonth": "March",
        "year": "2024",
        "released": "0,00",
        "forecast": "0,00",
        "spreadRaw": "-"
      },
      "EBITMillion INR": {
        "metric": "EBITMillion INR",
        "unit": "Million INR",
        "fiscalMonth": "March",
        "year": "2024",
        "released": "56 466",
        "forecast": "55 193",
        "spreadRaw": "2.31%"
      },
      "Earnings before Tax (EBT)Million INR": {
        "metric": "Earnings before Tax (EBT)Million INR",
        "unit": "Million INR",
        "fiscalMonth": "March",
        "year": "2024",
        "released": "54 488",
        "forecast": "53 835",
        "spreadRaw": "1.21%"
      },
      "Net incomeMillion INR": {
        "metric": "Net incomeMillion INR",
        "unit": "Million INR",
        "fiscalMonth": "March",
        "year": "2024",
        "released": "40 497",
        "forecast": "40 046",
        "spreadRaw": "1.12%"
      },
      "EPS INR": {
        "metric": "EPS INR",
        "unit": "INR",
        "fiscalMonth": "March",
        "year": "2024",
        "released": "101",
        "forecast": "99,8",
        "spreadRaw": "1.11%"
      },
      "Announcement Date": {
        "metric": "Announcement Date",
        "unit": null,
        "fiscalMonth": "March",
        "year": "2024",
        "released": "30/05/24",
        "forecast": null,
        "spreadRaw": null
      }
    },
    "2025": {
      "Net salesMillion INR": {
        "metric": "Net salesMillion INR",
        "unit": "Million INR",
        "fiscalMonth": "March",
        "year": "2025",
        "released": "170 991",
        "forecast": "105 647",
        "spreadRaw": "61.85%"
      },
      "EBITDA": {
        "metric": "EBITDA",
        "unit": null,
        "fiscalMonth": "March",
        "year": "2025",
        "released": "0,00",
        "forecast": "0,00",
        "spreadRaw": "-"
      },
      "EBITMillion INR": {
        "metric": "EBITMillion INR",
        "unit": "Million INR",
        "fiscalMonth": "March",
        "year": "2025",
        "released": "78 373",
        "forecast": "77 097",
        "spreadRaw": "1.66%"
      },
      "Earnings before Tax (EBT)Million INR": {
        "metric": "Earnings before Tax (EBT)Million INR",
        "unit": "Million INR",
        "fiscalMonth": "March",
        "year": "2025",
        "released": "70 706",
        "forecast": "69 544",
        "spreadRaw": "1.67%"
      },
      "Net incomeMillion INR": {
        "metric": "Net incomeMillion INR",
        "unit": "Million INR",
        "fiscalMonth": "March",
        "year": "2025",
        "released": "52 008",
        "forecast": "51 584",
        "spreadRaw": "0.82%"
      },
      "EPS INR": {
        "metric": "EPS INR",
        "unit": "INR",
        "fiscalMonth": "March",
        "year": "2025",
        "released": "130",
        "forecast": "129",
        "spreadRaw": "0.8%"
      },
      "Announcement Date": {
        "metric": "Announcement Date",
        "unit": null,
        "fiscalMonth": "March",
        "year": "2025",
        "released": "14/05/25",
        "forecast": null,
        "spreadRaw": null
      }
    },
    "2026": {
      "Net salesMillion INR": {
        "metric": "Net salesMillion INR",
        "unit": "Million INR",
        "fiscalMonth": "March",
        "year": "2026",
        "released": null,
        "forecast": "142 687",
        "spreadRaw": null
      },
      "EBITDA": {
        "metric": "EBITDA",
        "unit": null,
        "fiscalMonth": "March",
        "year": "2026",
        "released": null,
        "forecast": "0,00",
        "spreadRaw": null
      },
      "EBITMillion INR": {
        "metric": "EBITMillion INR",
        "unit": "Million INR",
        "fiscalMonth": "March",
        "year": "2026",
        "released": null,
        "forecast": "105 850",
        "spreadRaw": null
      },
      "Earnings before Tax (EBT)Million INR": {
        "metric": "Earnings before Tax (EBT)Million INR",
        "unit": "Million INR",
        "fiscalMonth": "March",
        "year": "2026",
        "released": null,
        "forecast": "102 962",
        "spreadRaw": null
      },
      "Net incomeMillion INR": {
        "metric": "Net incomeMillion INR",
        "unit": "Million INR",
        "fiscalMonth": "March",
        "year": "2026",
        "released": null,
        "forecast": "75 647",
        "spreadRaw": null
      },
      "EPS INR": {
        "metric": "EPS INR",
        "unit": "INR",
        "fiscalMonth": "March",
        "year": "2026",
        "released": null,
        "forecast": "188",
        "spreadRaw": null
      },
      "Announcement Date": {
        "metric": "Announcement Date",
        "unit": null,
        "fiscalMonth": "March",
        "year": "2026",
        "released": "-",
        "forecast": null,
        "spreadRaw": null
      }
    },
    "2027": {
      "Net salesMillion INR": {
        "metric": "Net salesMillion INR",
        "unit": "Million INR",
        "fiscalMonth": "March",
        "year": "2027",
        "released": null,
        "forecast": "162 933",
        "spreadRaw": null
      },
      "EBITDA": {
        "metric": "EBITDA",
        "unit": null,
        "fiscalMonth": "March",
        "year": "2027",
        "released": null,
        "forecast": "0,00",
        "spreadRaw": null
      },
      "EBITMillion INR": {
        "metric": "EBITMillion INR",
        "unit": "Million INR",
        "fiscalMonth": "March",
        "year": "2027",
        "released": null,
        "forecast": "119 426",
        "spreadRaw": null
      },
      "Earnings before Tax (EBT)Million INR": {
        "metric": "Earnings before Tax (EBT)Million INR",
        "unit": "Million INR",
        "fiscalMonth": "March",
        "year": "2027",
        "released": null,
        "forecast": "115 958",
        "spreadRaw": null
      },
      "Net incomeMillion INR": {
        "metric": "Net incomeMillion INR",
        "unit": "Million INR",
        "fiscalMonth": "March",
        "year": "2027",
        "released": null,
        "forecast": "85 274",
        "spreadRaw": null
      },
      "EPS INR": {
        "metric": "EPS INR",
        "unit": "INR",
        "fiscalMonth": "March",
        "year": "2027",
        "released": null,
        "forecast": "213",
        "spreadRaw": null
      },
      "Announcement Date": {
        "metric": "Announcement Date",
        "unit": null,
        "fiscalMonth": "March",
        "year": "2027",
        "released": null,
        "forecast": null,
        "spreadRaw": null
      }
    },
    "2028": {
      "Net salesMillion INR": {
        "metric": "Net salesMillion INR",
        "unit": "Million INR",
        "fiscalMonth": "March",
        "year": "2028",
        "released": null,
        "forecast": "184 743",
        "spreadRaw": null
      },
      "EBITDA": {
        "metric": "EBITDA",
        "unit": null,
        "fiscalMonth": "March",
        "year": "2028",
        "released": null,
        "forecast": "0,00",
        "spreadRaw": null
      },
      "EBITMillion INR": {
        "metric": "EBITMillion INR",
        "unit": "Million INR",
        "fiscalMonth": "March",
        "year": "2028",
        "released": null,
        "forecast": "132 803",
        "spreadRaw": null
      },
      "Earnings before Tax (EBT)Million INR": {
        "metric": "Earnings before Tax (EBT)Million INR",
        "unit": "Million INR",
        "fiscalMonth": "March",
        "year": "2028",
        "released": null,
        "forecast": "129 202",
        "spreadRaw": null
      },
      "Net incomeMillion INR": {
        "metric": "Net incomeMillion INR",
        "unit": "Million INR",
        "fiscalMonth": "March",
        "year": "2028",
        "released": null,
        "forecast": "93 912",
        "spreadRaw": null
      },
      "EPS INR": {
        "metric": "EPS INR",
        "unit": "INR",
        "fiscalMonth": "March",
        "year": "2028",
        "released": null,
        "forecast": "236",
        "spreadRaw": null
      },
      "Announcement Date": {
        "metric": "Announcement Date",
        "unit": null,
        "fiscalMonth": "March",
        "year": "2028",
        "released": null,
        "forecast": null,
        "spreadRaw": null
      }
    }
  },
  "quarterlyResults": {
    "2024 Q2": {
      "Net salesMillion INR": {
        "metric": "Net salesMillion INR",
        "unit": "Million INR",
        "fiscalMonth": "March",
        "period": "2024 Q2",
        "released": "30 597",
        "releasedNum": 30597,
        "forecast": "31 279",
        "forecastNum": 31279,
        "spreadRaw": "-2.18%",
        "spreadPct": -2.18
      },
      "EBITMillion INR": {
        "metric": "EBITMillion INR",
        "unit": "Million INR",
        "fiscalMonth": "March",
        "period": "2024 Q2",
        "released": "13 422",
        "releasedNum": 13422,
        "forecast": "14 527",
        "forecastNum": 14527,
        "spreadRaw": "-7.6%",
        "spreadPct": -7.6
      },
      "Earnings before Tax (EBT)Million INR": {
        "metric": "Earnings before Tax (EBT)Million INR",
        "unit": "Million INR",
        "fiscalMonth": "March",
        "period": "2024 Q2",
        "released": "13 302",
        "releasedNum": 13302,
        "forecast": "14 011",
        "forecastNum": 14011,
        "spreadRaw": "-5.06%",
        "spreadPct": -5.06
      },
      "Net incomeMillion INR": {
        "metric": "Net incomeMillion INR",
        "unit": "Million INR",
        "fiscalMonth": "March",
        "period": "2024 Q2",
        "released": "9 910",
        "releasedNum": 9910,
        "forecast": "10 436",
        "forecastNum": 10436,
        "spreadRaw": "-5.04%",
        "spreadPct": -5.04
      },
      "EPS INR": {
        "metric": "EPS INR",
        "unit": "INR",
        "fiscalMonth": "March",
        "period": "2024 Q2",
        "released": "24,7",
        "releasedNum": 24.7,
        "forecast": "25,9",
        "forecastNum": 25.9,
        "spreadRaw": "-4.83%",
        "spreadPct": -4.83
      },
      "Announcement Date": {
        "metric": "Announcement Date",
        "unit": null,
        "fiscalMonth": "March",
        "period": "2024 Q2",
        "released": "09/11/23",
        "releasedDate": "09/11/23",
        "forecast": null,
        "spreadRaw": null,
        "spreadPct": null
      }
    },
    "2024 Q3": {
      "Net salesMillion INR": {
        "metric": "Net salesMillion INR",
        "unit": "Million INR",
        "fiscalMonth": "March",
        "period": "2024 Q3",
        "released": "31 677",
        "releasedNum": 31677,
        "forecast": "23 828",
        "forecastNum": 23828,
        "spreadRaw": "32.94%",
        "spreadPct": 32.94
      },
      "EBITMillion INR": {
        "metric": "EBITMillion INR",
        "unit": "Million INR",
        "fiscalMonth": "March",
        "period": "2024 Q3",
        "released": "13 942",
        "releasedNum": 13942,
        "forecast": "13 839",
        "forecastNum": 13839,
        "spreadRaw": "0.75%",
        "spreadPct": 0.75
      },
      "Earnings before Tax (EBT)Million INR": {
        "metric": "Earnings before Tax (EBT)Million INR",
        "unit": "Million INR",
        "fiscalMonth": "March",
        "period": "2024 Q3",
        "released": "13 805",
        "releasedNum": 13805,
        "forecast": "13 612",
        "forecastNum": 13612,
        "spreadRaw": "1.41%",
        "spreadPct": 1.41
      },
      "Net incomeMillion INR": {
        "metric": "Net incomeMillion INR",
        "unit": "Million INR",
        "fiscalMonth": "March",
        "period": "2024 Q3",
        "released": "10 273",
        "releasedNum": 10273,
        "forecast": "10 088",
        "forecastNum": 10088,
        "spreadRaw": "1.83%",
        "spreadPct": 1.83
      },
      "EPS INR": {
        "metric": "EPS INR",
        "unit": "INR",
        "fiscalMonth": "March",
        "period": "2024 Q3",
        "released": "25,6",
        "releasedNum": 25.6,
        "forecast": "25,5",
        "forecastNum": 25.5,
        "spreadRaw": "0.35%",
        "spreadPct": 0.35
      },
      "Announcement Date": {
        "metric": "Announcement Date",
        "unit": null,
        "fiscalMonth": "March",
        "period": "2024 Q3",
        "released": "14/02/24",
        "releasedDate": "14/02/24",
        "forecast": null,
        "spreadRaw": null,
        "spreadPct": null
      }
    },
    "2024 Q4": {
      "Net salesMillion INR": {
        "metric": "Net salesMillion INR",
        "unit": "Million INR",
        "fiscalMonth": "March",
        "period": "2024 Q4",
        "released": "34 089",
        "releasedNum": 34089,
        "forecast": "26 509",
        "forecastNum": 26509,
        "spreadRaw": "28.59%",
        "spreadPct": 28.59
      },
      "EBITMillion INR": {
        "metric": "EBITMillion INR",
        "unit": "Million INR",
        "fiscalMonth": "March",
        "period": "2024 Q4",
        "released": "15 095",
        "releasedNum": 15095,
        "forecast": "14 110",
        "forecastNum": 14110,
        "spreadRaw": "6.99%",
        "spreadPct": 6.99
      },
      "Earnings before Tax (EBT)Million INR": {
        "metric": "Earnings before Tax (EBT)Million INR",
        "unit": "Million INR",
        "fiscalMonth": "March",
        "period": "2024 Q4",
        "released": "14 236",
        "releasedNum": 14236,
        "forecast": "13 962",
        "forecastNum": 13962,
        "spreadRaw": "1.96%",
        "spreadPct": 1.96
      },
      "Net incomeMillion INR": {
        "metric": "Net incomeMillion INR",
        "unit": "Million INR",
        "fiscalMonth": "March",
        "period": "2024 Q4",
        "released": "10 563",
        "releasedNum": 10563,
        "forecast": "10 306",
        "forecastNum": 10306,
        "spreadRaw": "2.49%",
        "spreadPct": 2.49
      },
      "EPS INR": {
        "metric": "EPS INR",
        "unit": "INR",
        "fiscalMonth": "March",
        "period": "2024 Q4",
        "released": "26,3",
        "releasedNum": 26.3,
        "forecast": "25,5",
        "forecastNum": 25.5,
        "spreadRaw": "3.1%",
        "spreadPct": 3.1
      },
      "Announcement Date": {
        "metric": "Announcement Date",
        "unit": null,
        "fiscalMonth": "March",
        "period": "2024 Q4",
        "released": "30/05/24",
        "releasedDate": "30/05/24",
        "forecast": null,
        "spreadRaw": null,
        "spreadPct": null
      }
    },
    "2025 Q1": {
      "Net salesMillion INR": {
        "metric": "Net salesMillion INR",
        "unit": "Million INR",
        "fiscalMonth": "March",
        "period": "2025 Q1",
        "released": "37 038",
        "releasedNum": 37038,
        "forecast": "22 888",
        "forecastNum": 22888,
        "spreadRaw": "61.82%",
        "spreadPct": 61.82
      },
      "EBITMillion INR": {
        "metric": "EBITMillion INR",
        "unit": "Million INR",
        "fiscalMonth": "March",
        "period": "2025 Q1",
        "released": "17 153",
        "releasedNum": 17153,
        "forecast": "16 494",
        "forecastNum": 16494,
        "spreadRaw": "3.99%",
        "spreadPct": 3.99
      },
      "Earnings before Tax (EBT)Million INR": {
        "metric": "Earnings before Tax (EBT)Million INR",
        "unit": "Million INR",
        "fiscalMonth": "March",
        "period": "2025 Q1",
        "released": "14 917",
        "releasedNum": 14917,
        "forecast": "15 870",
        "forecastNum": 15870,
        "spreadRaw": "-6.01%",
        "spreadPct": -6.01
      },
      "Net incomeMillion INR": {
        "metric": "Net incomeMillion INR",
        "unit": "Million INR",
        "fiscalMonth": "March",
        "period": "2025 Q1",
        "released": "10 787",
        "releasedNum": 10787,
        "forecast": "11 689",
        "forecastNum": 11689,
        "spreadRaw": "-7.71%",
        "spreadPct": -7.71
      },
      "EPS INR": {
        "metric": "EPS INR",
        "unit": "INR",
        "fiscalMonth": "March",
        "period": "2025 Q1",
        "released": "26,9",
        "releasedNum": 26.9,
        "forecast": "29,7",
        "forecastNum": 29.7,
        "spreadRaw": "-9.38%",
        "spreadPct": -9.38
      },
      "Announcement Date": {
        "metric": "Announcement Date",
        "unit": null,
        "fiscalMonth": "March",
        "period": "2025 Q1",
        "released": "13/08/24",
        "releasedDate": "13/08/24",
        "forecast": null,
        "spreadRaw": null,
        "spreadPct": null
      }
    },
    "2025 Q2": {
      "Net salesMillion INR": {
        "metric": "Net salesMillion INR",
        "unit": "Million INR",
        "fiscalMonth": "March",
        "period": "2025 Q2",
        "released": "41 174",
        "releasedNum": 41174,
        "forecast": "32 155",
        "forecastNum": 32155,
        "spreadRaw": "28.05%",
        "spreadPct": 28.05
      },
      "EBITMillion INR": {
        "metric": "EBITMillion INR",
        "unit": "Million INR",
        "fiscalMonth": "March",
        "period": "2025 Q2",
        "released": "19 150",
        "releasedNum": 19150,
        "forecast": "18 155",
        "forecastNum": 18155,
        "spreadRaw": "5.48%",
        "spreadPct": 5.48
      },
      "Earnings before Tax (EBT)Million INR": {
        "metric": "Earnings before Tax (EBT)Million INR",
        "unit": "Million INR",
        "fiscalMonth": "March",
        "period": "2025 Q2",
        "released": "17 080",
        "releasedNum": 17080,
        "forecast": "17 420",
        "forecastNum": 17420,
        "spreadRaw": "-1.95%",
        "spreadPct": -1.95
      },
      "Net incomeMillion INR": {
        "metric": "Net incomeMillion INR",
        "unit": "Million INR",
        "fiscalMonth": "March",
        "period": "2025 Q2",
        "released": "12 511",
        "releasedNum": 12511,
        "forecast": "12 538",
        "forecastNum": 12538,
        "spreadRaw": "-0.21%",
        "spreadPct": -0.21
      },
      "EPS INR": {
        "metric": "EPS INR",
        "unit": "INR",
        "fiscalMonth": "March",
        "period": "2025 Q2",
        "released": "31,2",
        "releasedNum": 31.2,
        "forecast": "31,6",
        "forecastNum": 31.6,
        "spreadRaw": "-1.24%",
        "spreadPct": -1.24
      },
      "Announcement Date": {
        "metric": "Announcement Date",
        "unit": null,
        "fiscalMonth": "March",
        "period": "2025 Q2",
        "released": "14/11/24",
        "releasedDate": "14/11/24",
        "forecast": null,
        "spreadRaw": null,
        "spreadPct": null
      }
    },
    "2025 Q3": {
      "Net salesMillion INR": {
        "metric": "Net salesMillion INR",
        "unit": "Million INR",
        "fiscalMonth": "March",
        "period": "2025 Q3",
        "released": "44 235",
        "releasedNum": 44235,
        "forecast": "24 987",
        "forecastNum": 24987,
        "spreadRaw": "77.03%",
        "spreadPct": 77.03
      },
      "EBITMillion INR": {
        "metric": "EBITMillion INR",
        "unit": "Million INR",
        "fiscalMonth": "March",
        "period": "2025 Q3",
        "released": "20 593",
        "releasedNum": 20593,
        "forecast": "19 800",
        "forecastNum": 19800,
        "spreadRaw": "4%",
        "spreadPct": 4
      },
      "Earnings before Tax (EBT)Million INR": {
        "metric": "Earnings before Tax (EBT)Million INR",
        "unit": "Million INR",
        "fiscalMonth": "March",
        "period": "2025 Q3",
        "released": "18 505",
        "releasedNum": 18505,
        "forecast": "18 217",
        "forecastNum": 18217,
        "spreadRaw": "1.58%",
        "spreadPct": 1.58
      },
      "Net incomeMillion INR": {
        "metric": "Net incomeMillion INR",
        "unit": "Million INR",
        "fiscalMonth": "March",
        "period": "2025 Q3",
        "released": "13 631",
        "releasedNum": 13631,
        "forecast": "13 249",
        "forecastNum": 13249,
        "spreadRaw": "2.88%",
        "spreadPct": 2.88
      },
      "EPS INR": {
        "metric": "EPS INR",
        "unit": "INR",
        "fiscalMonth": "March",
        "period": "2025 Q3",
        "released": "34,0",
        "releasedNum": 34,
        "forecast": "33,6",
        "forecastNum": 33.6,
        "spreadRaw": "1.1%",
        "spreadPct": 1.1
      },
      "Announcement Date": {
        "metric": "Announcement Date",
        "unit": null,
        "fiscalMonth": "March",
        "period": "2025 Q3",
        "released": "12/02/25",
        "releasedDate": "12/02/25",
        "forecast": null,
        "spreadRaw": null,
        "spreadPct": null
      }
    },
    "2025 Q4": {
      "Net salesMillion INR": {
        "metric": "Net salesMillion INR",
        "unit": "Million INR",
        "fiscalMonth": "March",
        "period": "2025 Q4",
        "released": "48 544",
        "releasedNum": 48544,
        "forecast": "36 016",
        "forecastNum": 36016,
        "spreadRaw": "34.78%",
        "spreadPct": 34.78
      },
      "EBITMillion INR": {
        "metric": "EBITMillion INR",
        "unit": "Million INR",
        "fiscalMonth": "March",
        "period": "2025 Q4",
        "released": "21 478",
        "releasedNum": 21478,
        "forecast": "22 236",
        "forecastNum": 22236,
        "spreadRaw": "-3.41%",
        "spreadPct": -3.41
      },
      "Earnings before Tax (EBT)Million INR": {
        "metric": "Earnings before Tax (EBT)Million INR",
        "unit": "Million INR",
        "fiscalMonth": "March",
        "period": "2025 Q4",
        "released": "20 204",
        "releasedNum": 20204,
        "forecast": "20 022",
        "forecastNum": 20022,
        "spreadRaw": "0.91%",
        "spreadPct": 0.91
      },
      "Net incomeMillion INR": {
        "metric": "Net incomeMillion INR",
        "unit": "Million INR",
        "fiscalMonth": "March",
        "period": "2025 Q4",
        "released": "15 078",
        "releasedNum": 15078,
        "forecast": "15 018",
        "forecastNum": 15018,
        "spreadRaw": "0.4%",
        "spreadPct": 0.4
      },
      "EPS INR": {
        "metric": "EPS INR",
        "unit": "INR",
        "fiscalMonth": "March",
        "period": "2025 Q4",
        "released": "37,6",
        "releasedNum": 37.6,
        "forecast": "37,9",
        "forecastNum": 37.9,
        "spreadRaw": "-0.77%",
        "spreadPct": -0.77
      },
      "Announcement Date": {
        "metric": "Announcement Date",
        "unit": null,
        "fiscalMonth": "March",
        "period": "2025 Q4",
        "released": "14/05/25",
        "releasedDate": "14/05/25",
        "forecast": null,
        "spreadRaw": null,
        "spreadPct": null
      }
    },
    "2026 Q1": {
      "Net salesMillion INR": {
        "metric": "Net salesMillion INR",
        "unit": "Million INR",
        "fiscalMonth": "March",
        "period": "2026 Q1",
        "released": "57 033",
        "releasedNum": 57033,
        "forecast": "39 070",
        "forecastNum": 39070,
        "spreadRaw": "45.98%",
        "spreadPct": 45.98
      },
      "EBITMillion INR": {
        "metric": "EBITMillion INR",
        "unit": "Million INR",
        "fiscalMonth": "March",
        "period": "2026 Q1",
        "released": "27 887",
        "releasedNum": 27887,
        "forecast": "23 745",
        "forecastNum": 23745,
        "spreadRaw": "17.44%",
        "spreadPct": 17.44
      },
      "Earnings before Tax (EBT)Million INR": {
        "metric": "Earnings before Tax (EBT)Million INR",
        "unit": "Million INR",
        "fiscalMonth": "March",
        "period": "2026 Q1",
        "released": "27 455",
        "releasedNum": 27455,
        "forecast": "22 193",
        "forecastNum": 22193,
        "spreadRaw": "23.71%",
        "spreadPct": 23.71
      },
      "Net incomeMillion INR": {
        "metric": "Net incomeMillion INR",
        "unit": "Million INR",
        "fiscalMonth": "March",
        "period": "2026 Q1",
        "released": "20 463",
        "releasedNum": 20463,
        "forecast": "16 478",
        "forecastNum": 16478,
        "spreadRaw": "24.19%",
        "spreadPct": 24.19
      },
      "EPS INR": {
        "metric": "EPS INR",
        "unit": "INR",
        "fiscalMonth": "March",
        "period": "2026 Q1",
        "released": "51,0",
        "releasedNum": 51,
        "forecast": "40,6",
        "forecastNum": 40.6,
        "spreadRaw": "25.54%",
        "spreadPct": 25.54
      },
      "Announcement Date": {
        "metric": "Announcement Date",
        "unit": null,
        "fiscalMonth": "March",
        "period": "2026 Q1",
        "released": "13/08/25",
        "releasedDate": "13/08/25",
        "forecast": null,
        "spreadRaw": null,
        "spreadPct": null
      }
    },
    "2026 Q2": {
      "Net salesMillion INR": {
        "metric": "Net salesMillion INR",
        "unit": "Million INR",
        "fiscalMonth": "March",
        "period": "2026 Q2",
        "released": null,
        "releasedNum": null,
        "forecast": "40 797",
        "forecastNum": 40797,
        "spreadRaw": null,
        "spreadPct": null
      },
      "EBITMillion INR": {
        "metric": "EBITMillion INR",
        "unit": "Million INR",
        "fiscalMonth": "March",
        "period": "2026 Q2",
        "released": null,
        "releasedNum": null,
        "forecast": "27 712",
        "forecastNum": 27712,
        "spreadRaw": null,
        "spreadPct": null
      },
      "Earnings before Tax (EBT)Million INR": {
        "metric": "Earnings before Tax (EBT)Million INR",
        "unit": "Million INR",
        "fiscalMonth": "March",
        "period": "2026 Q2",
        "released": null,
        "releasedNum": null,
        "forecast": "26 696",
        "forecastNum": 26696,
        "spreadRaw": null,
        "spreadPct": null
      },
      "Net incomeMillion INR": {
        "metric": "Net incomeMillion INR",
        "unit": "Million INR",
        "fiscalMonth": "March",
        "period": "2026 Q2",
        "released": null,
        "releasedNum": null,
        "forecast": "19 793",
        "forecastNum": 19793,
        "spreadRaw": null,
        "spreadPct": null
      },
      "EPS INR": {
        "metric": "EPS INR",
        "unit": "INR",
        "fiscalMonth": "March",
        "period": "2026 Q2",
        "released": null,
        "releasedNum": null,
        "forecast": "49,9",
        "forecastNum": 49.9,
        "spreadRaw": null,
        "spreadPct": null
      },
      "Announcement Date": {
        "metric": "Announcement Date",
        "unit": null,
        "fiscalMonth": "March",
        "period": "2026 Q2",
        "released": "-",
        "releasedDate": "-",
        "forecast": null,
        "spreadRaw": null,
        "spreadPct": null
      }
    },
    "2026 Q3": {
      "Net salesMillion INR": {
        "metric": "Net salesMillion INR",
        "unit": "Million INR",
        "fiscalMonth": "March",
        "period": "2026 Q3",
        "released": null,
        "releasedNum": null,
        "forecast": "47 379",
        "forecastNum": 47379,
        "spreadRaw": null,
        "spreadPct": null
      },
      "EBITMillion INR": {
        "metric": "EBITMillion INR",
        "unit": "Million INR",
        "fiscalMonth": "March",
        "period": "2026 Q3",
        "released": null,
        "releasedNum": null,
        "forecast": "26 365",
        "forecastNum": 26365,
        "spreadRaw": null,
        "spreadPct": null
      },
      "Earnings before Tax (EBT)Million INR": {
        "metric": "Earnings before Tax (EBT)Million INR",
        "unit": "Million INR",
        "fiscalMonth": "March",
        "period": "2026 Q3",
        "released": null,
        "releasedNum": null,
        "forecast": "26 047",
        "forecastNum": 26047,
        "spreadRaw": null,
        "spreadPct": null
      },
      "Net incomeMillion INR": {
        "metric": "Net incomeMillion INR",
        "unit": "Million INR",
        "fiscalMonth": "March",
        "period": "2026 Q3",
        "released": null,
        "releasedNum": null,
        "forecast": "18 240",
        "forecastNum": 18240,
        "spreadRaw": null,
        "spreadPct": null
      },
      "EPS INR": {
        "metric": "EPS INR",
        "unit": "INR",
        "fiscalMonth": "March",
        "period": "2026 Q3",
        "released": null,
        "releasedNum": null,
        "forecast": null,
        "forecastNum": null,
        "spreadRaw": null,
        "spreadPct": null
      },
      "Announcement Date": {
        "metric": "Announcement Date",
        "unit": null,
        "fiscalMonth": "March",
        "period": "2026 Q3",
        "released": "-",
        "releasedDate": "-",
        "forecast": null,
        "spreadRaw": null,
        "spreadPct": null
      }
    },
    "2026 Q4": {
      "Net salesMillion INR": {
        "metric": "Net salesMillion INR",
        "unit": "Million INR",
        "fiscalMonth": "March",
        "period": "2026 Q4",
        "released": null,
        "releasedNum": null,
        "forecast": "49 683",
        "forecastNum": 49683,
        "spreadRaw": null,
        "spreadPct": null
      },
      "EBITMillion INR": {
        "metric": "EBITMillion INR",
        "unit": "Million INR",
        "fiscalMonth": "March",
        "period": "2026 Q4",
        "released": null,
        "releasedNum": null,
        "forecast": "26 879",
        "forecastNum": 26879,
        "spreadRaw": null,
        "spreadPct": null
      },
      "Earnings before Tax (EBT)Million INR": {
        "metric": "Earnings before Tax (EBT)Million INR",
        "unit": "Million INR",
        "fiscalMonth": "March",
        "period": "2026 Q4",
        "released": null,
        "releasedNum": null,
        "forecast": "26 758",
        "forecastNum": 26758,
        "spreadRaw": null,
        "spreadPct": null
      },
      "Net incomeMillion INR": {
        "metric": "Net incomeMillion INR",
        "unit": "Million INR",
        "fiscalMonth": "March",
        "period": "2026 Q4",
        "released": null,
        "releasedNum": null,
        "forecast": "18 293",
        "forecastNum": 18293,
        "spreadRaw": null,
        "spreadPct": null
      },
      "EPS INR": {
        "metric": "EPS INR",
        "unit": "INR",
        "fiscalMonth": "March",
        "period": "2026 Q4",
        "released": null,
        "releasedNum": null,
        "forecast": null,
        "forecastNum": null,
        "spreadRaw": null,
        "spreadPct": null
      },
      "Announcement Date": {
        "metric": "Announcement Date",
        "unit": null,
        "fiscalMonth": "March",
        "period": "2026 Q4",
        "released": "-",
        "releasedDate": "-",
        "forecast": null,
        "spreadRaw": null,
        "spreadPct": null
      }
    }
  },
  "upcomingEvents": {
    "count": 4,
    "events": [
      {
        "section": "Upcoming",
        "dateTimeRaw": "06/11/2025",
        "dateTimeISO": "2025-11-05T18:30:00.000Z",
        "title": "Q2 2026 Earnings Release (Projected)",
        "icsUrl": "https://in.marketscreener.com/api/stateful/agenda/event-async/Q2-2026-Earnings-Release-Projected-48330057.ics"
      },
      {
        "section": "Upcoming",
        "dateTimeRaw": "18/02/2026",
        "dateTimeISO": "2026-02-17T18:30:00.000Z",
        "title": "Q3 2026 Earnings Release (Projected)",
        "icsUrl": "https://in.marketscreener.com/api/stateful/agenda/event-async/Q3-2026-Earnings-Release-Projected-48921854.ics"
      },
      {
        "section": "Upcoming",
        "dateTimeRaw": "28/05/2026",
        "dateTimeISO": "2026-05-27T18:30:00.000Z",
        "title": "Q4 2026 Earnings Release (Projected)",
        "icsUrl": "https://in.marketscreener.com/api/stateful/agenda/event-async/Q4-2026-Earnings-Release-Projected-49901919.ics"
      },
      {
        "section": "Upcoming",
        "dateTimeRaw": "07/08/2026",
        "dateTimeISO": "2026-08-06T18:30:00.000Z",
        "title": "Q1 2027 Earnings Release (Projected)",
        "icsUrl": "https://in.marketscreener.com/api/stateful/agenda/event-async/Q1-2027-Earnings-Release-Projected-50731678.ics"
      }
    ]
  },
  "pastEvents": {
    "count": 105,
    "events": [
      {
        "section": "Past",
        "dateTimeRaw": "30/08/2025 03:30 pm",
        "dateTimeISO": "2025-08-30T10:00:00.000Z",
        "title": "Annual General Meeting",
        "icsUrl": "https://in.marketscreener.com/api/stateful/agenda/event-async/Annual-General-Meeting-50632971.ics"
      },
      {
        "section": "Past",
        "dateTimeRaw": "13/08/2025 05:00 pm",
        "dateTimeISO": "2025-08-13T11:30:00.000Z",
        "title": "Q1 2026 Earnings Call",
        "icsUrl": "https://in.marketscreener.com/api/stateful/agenda/event-async/Q1-2026-Earnings-Call-50731628.ics"
      },
      {
        "section": "Past",
        "dateTimeRaw": "13/08/2025 04:03 pm",
        "dateTimeISO": "2025-08-13T10:33:00.000Z",
        "title": "Q1 2026 Earnings Release",
        "icsUrl": "https://in.marketscreener.com/api/stateful/agenda/event-async/Q1-2026-Earnings-Release-47593377.ics"
      },
      {
        "section": "Past",
        "dateTimeRaw": "14/05/2025 05:00 pm",
        "dateTimeISO": "2025-05-14T11:30:00.000Z",
        "title": "Q4 2025 Earnings Call",
        "icsUrl": "https://in.marketscreener.com/api/stateful/agenda/event-async/Q4-2025-Earnings-Call-49901819.ics"
      },
      {
        "section": "Past",
        "dateTimeRaw": "14/05/2025 04:39 pm",
        "dateTimeISO": "2025-05-14T11:09:00.000Z",
        "title": "Q4 2025 Earnings Release",
        "icsUrl": "https://in.marketscreener.com/api/stateful/agenda/event-async/Q4-2025-Earnings-Release-46814272.ics"
      },
      {
        "section": "Past",
        "dateTimeRaw": "25/04/2025",
        "dateTimeISO": "2025-04-24T18:30:00.000Z",
        "title": "Ex-dividend day for dividende intermédiaire",
        "icsUrl": "https://in.marketscreener.com/api/stateful/agenda/event-async/Ex-dividend-day-for-dividende-intermediaire-49816044.ics"
      },
      {
        "section": "Past",
        "dateTimeRaw": "12/02/2025 04:30 pm",
        "dateTimeISO": "2025-02-12T11:00:00.000Z",
        "title": "Q3 2025 Earnings Call",
        "icsUrl": "https://in.marketscreener.com/api/stateful/agenda/event-async/Q3-2025-Earnings-Call-48960660.ics"
      },
      {
        "section": "Past",
        "dateTimeRaw": "12/02/2025 03:46 pm",
        "dateTimeISO": "2025-02-12T10:16:00.000Z",
        "title": "Q3 2025 Earnings Release",
        "icsUrl": "https://in.marketscreener.com/api/stateful/agenda/event-async/Q3-2025-Earnings-Release-46179396.ics"
      },
      {
        "section": "Past",
        "dateTimeRaw": "14/11/2024 05:00 pm",
        "dateTimeISO": "2024-11-14T11:30:00.000Z",
        "title": "Q2 2025 Earnings Call",
        "icsUrl": "https://in.marketscreener.com/api/stateful/agenda/event-async/Q2-2025-Earnings-Call-48329974.ics"
      },
      {
        "section": "Past",
        "dateTimeRaw": "14/11/2024 03:56 pm",
        "dateTimeISO": "2024-11-14T10:26:00.000Z",
        "title": "Q2 2025 Earnings Release",
        "icsUrl": "https://in.marketscreener.com/api/stateful/agenda/event-async/Q2-2025-Earnings-Release-45332851.ics"
      },
      {
        "section": "Past",
        "dateTimeRaw": "30/09/2024 03:30 pm",
        "dateTimeISO": "2024-09-30T10:00:00.000Z",
        "title": "Annual General Meeting",
        "icsUrl": "https://in.marketscreener.com/api/stateful/agenda/event-async/Annual-General-Meeting-47807819.ics"
      },
      {
        "section": "Past",
        "dateTimeRaw": "13/08/2024 05:00 pm",
        "dateTimeISO": "2024-08-13T11:30:00.000Z",
        "title": "Q1 2025 Earnings Call",
        "icsUrl": "https://in.marketscreener.com/api/stateful/agenda/event-async/Q1-2025-Earnings-Call-47618154.ics"
      },
      {
        "section": "Past",
        "dateTimeRaw": "13/08/2024 03:52 pm",
        "dateTimeISO": "2024-08-13T10:22:00.000Z",
        "title": "Q1 2025 Earnings Release",
        "icsUrl": "https://in.marketscreener.com/api/stateful/agenda/event-async/Q1-2025-Earnings-Release-44518984.ics"
      },
      {
        "section": "Past",
        "dateTimeRaw": "31/05/2024",
        "dateTimeISO": "2024-05-30T18:30:00.000Z",
        "title": "Ex-dividend day for dividende intermédiaire",
        "icsUrl": "https://in.marketscreener.com/api/stateful/agenda/event-async/Ex-dividend-day-for-dividende-intermediaire-46881506.ics"
      },
      {
        "section": "Past",
        "dateTimeRaw": "30/05/2024 05:00 pm",
        "dateTimeISO": "2024-05-30T11:30:00.000Z",
        "title": "Q4 2024 Earnings Call",
        "icsUrl": "https://in.marketscreener.com/api/stateful/agenda/event-async/Q4-2024-Earnings-Call-46825223.ics"
      },
      {
        "section": "Past",
        "dateTimeRaw": "30/05/2024 04:08 pm",
        "dateTimeISO": "2024-05-30T10:38:00.000Z",
        "title": "Q4 2024 Earnings Release",
        "icsUrl": "https://in.marketscreener.com/api/stateful/agenda/event-async/Q4-2024-Earnings-Release-43900344.ics"
      },
      {
        "section": "Past",
        "dateTimeRaw": "14/02/2024 05:01 pm",
        "dateTimeISO": "2024-02-14T11:31:00.000Z",
        "title": "Q3 2024 Earnings Release",
        "icsUrl": "https://in.marketscreener.com/api/stateful/agenda/event-async/Q3-2024-Earnings-Release-42901219.ics"
      },
      {
        "section": "Past",
        "dateTimeRaw": "14/02/2024 05:00 pm",
        "dateTimeISO": "2024-02-14T11:30:00.000Z",
        "title": "Q3 2024 Earnings Call",
        "icsUrl": "https://in.marketscreener.com/api/stateful/agenda/event-async/Q3-2024-Earnings-Call-46177445.ics"
      },
      {
        "section": "Past",
        "dateTimeRaw": "09/11/2023 05:51 pm",
        "dateTimeISO": "2023-11-09T12:21:00.000Z",
        "title": "Q2 2024 Earnings Release",
        "icsUrl": "https://in.marketscreener.com/api/stateful/agenda/event-async/Q2-2024-Earnings-Release-42149066.ics"
      },
      {
        "section": "Past",
        "dateTimeRaw": "09/11/2023 05:30 pm",
        "dateTimeISO": "2023-11-09T12:00:00.000Z",
        "title": "Q2 2024 Earnings Call",
        "icsUrl": "https://in.marketscreener.com/api/stateful/agenda/event-async/Q2-2024-Earnings-Call-45331660.ics"
      },
      {
        "section": "Past",
        "dateTimeRaw": "29/09/2023 03:30 pm",
        "dateTimeISO": "2023-09-29T10:00:00.000Z",
        "title": "Annual General Meeting",
        "icsUrl": "https://in.marketscreener.com/api/stateful/agenda/event-async/Annual-General-Meeting-44614235.ics"
      },
      {
        "section": "Past",
        "dateTimeRaw": "11/08/2023 05:00 pm",
        "dateTimeISO": "2023-08-11T11:30:00.000Z",
        "title": "Q1 2024 Earnings Call",
        "icsUrl": "https://in.marketscreener.com/api/stateful/agenda/event-async/Q1-2024-Earnings-Call-44573057.ics"
      },
      {
        "section": "Past",
        "dateTimeRaw": "11/08/2023 04:53 pm",
        "dateTimeISO": "2023-08-11T11:23:00.000Z",
        "title": "Q1 2024 Earnings Release",
        "icsUrl": "https://in.marketscreener.com/api/stateful/agenda/event-async/Q1-2024-Earnings-Release-41307738.ics"
      },
      {
        "section": "Past",
        "dateTimeRaw": "19/05/2023 05:24 pm",
        "dateTimeISO": "2023-05-19T11:54:00.000Z",
        "title": "Q4 2023 Earnings Release",
        "icsUrl": "https://in.marketscreener.com/api/stateful/agenda/event-async/Q4-2023-Earnings-Release-40506117.ics"
      },
      {
        "section": "Past",
        "dateTimeRaw": "19/05/2023 05:00 pm",
        "dateTimeISO": "2023-05-19T11:30:00.000Z",
        "title": "Q4 2023 Earnings Call",
        "icsUrl": "https://in.marketscreener.com/api/stateful/agenda/event-async/Q4-2023-Earnings-Call-43930467.ics"
      },
      {
        "section": "Past",
        "dateTimeRaw": "18/04/2023",
        "dateTimeISO": "2023-04-17T18:30:00.000Z",
        "title": "Ex-dividend day for dividende intermédiaire",
        "icsUrl": "https://in.marketscreener.com/api/stateful/agenda/event-async/Ex-dividend-day-for-dividende-intermediaire-43499463.ics"
      },
      {
        "section": "Past",
        "dateTimeRaw": "07/02/2023 04:00 pm",
        "dateTimeISO": "2023-02-07T10:30:00.000Z",
        "title": "Q3 2023 Earnings Call",
        "icsUrl": "https://in.marketscreener.com/api/stateful/agenda/event-async/Q3-2023-Earnings-Call-42964637.ics"
      },
      {
        "section": "Past",
        "dateTimeRaw": "06/02/2023 05:58 pm",
        "dateTimeISO": "2023-02-06T12:28:00.000Z",
        "title": "Q3 2023 Earnings Release",
        "icsUrl": "https://in.marketscreener.com/api/stateful/agenda/event-async/Q3-2023-Earnings-Release-38152861.ics"
      },
      {
        "section": "Past",
        "dateTimeRaw": "10/11/2022 06:30 pm",
        "dateTimeISO": "2022-11-10T13:00:00.000Z",
        "title": "Interim 2023 Earnings Call",
        "icsUrl": "https://in.marketscreener.com/api/stateful/agenda/event-async/Interim-2023-Earnings-Call-42294910.ics"
      },
      {
        "section": "Past",
        "dateTimeRaw": "10/11/2022 04:32 pm",
        "dateTimeISO": "2022-11-10T11:02:00.000Z",
        "title": "Interim 2023 Earnings Release",
        "icsUrl": "https://in.marketscreener.com/api/stateful/agenda/event-async/Interim-2023-Earnings-Release-36926296.ics"
      },
      {
        "section": "Past",
        "dateTimeRaw": "31/08/2022 03:30 pm",
        "dateTimeISO": "2022-08-31T10:00:00.000Z",
        "title": "Annual General Meeting",
        "icsUrl": "https://in.marketscreener.com/api/stateful/agenda/event-async/Annual-General-Meeting-41307541.ics"
      },
      {
        "section": "Past",
        "dateTimeRaw": "12/08/2022 05:00 pm",
        "dateTimeISO": "2022-08-12T11:30:00.000Z",
        "title": "Q1 2023 Earnings Call",
        "icsUrl": "https://in.marketscreener.com/api/stateful/agenda/event-async/Q1-2023-Earnings-Call-41307412.ics"
      },
      {
        "section": "Past",
        "dateTimeRaw": "12/08/2022 04:30 pm",
        "dateTimeISO": "2022-08-12T11:00:00.000Z",
        "title": "Q1 2023 Earnings Release",
        "icsUrl": "https://in.marketscreener.com/api/stateful/agenda/event-async/Q1-2023-Earnings-Release-36103911.ics"
      },
      {
        "section": "Past",
        "dateTimeRaw": "26/05/2022 05:00 pm",
        "dateTimeISO": "2022-05-26T11:30:00.000Z",
        "title": "FY 2022 Earnings Call",
        "icsUrl": "https://in.marketscreener.com/api/stateful/agenda/event-async/FY-2022-Earnings-Call-40575775.ics"
      },
      {
        "section": "Past",
        "dateTimeRaw": "26/05/2022 03:43 pm",
        "dateTimeISO": "2022-05-26T10:13:00.000Z",
        "title": "FY 2022 Earnings Release",
        "icsUrl": "https://in.marketscreener.com/api/stateful/agenda/event-async/FY-2022-Earnings-Release-35527585.ics"
      },
      {
        "section": "Past",
        "dateTimeRaw": "25/04/2022",
        "dateTimeISO": "2022-04-24T18:30:00.000Z",
        "title": "Ex-dividend day for dividende intermédiaire",
        "icsUrl": "https://in.marketscreener.com/api/stateful/agenda/event-async/Ex-dividend-day-for-dividende-intermediaire-40136313.ics"
      },
      {
        "section": "Past",
        "dateTimeRaw": "14/02/2022 03:30 pm",
        "dateTimeISO": "2022-02-14T10:00:00.000Z",
        "title": "Q3 2022 Earnings Call",
        "icsUrl": "https://in.marketscreener.com/api/stateful/agenda/event-async/Q3-2022-Earnings-Call-39524830.ics"
      },
      {
        "section": "Past",
        "dateTimeRaw": "12/02/2022 02:11 pm",
        "dateTimeISO": "2022-02-12T08:41:00.000Z",
        "title": "Q3 2022 Earnings Release",
        "icsUrl": "https://in.marketscreener.com/api/stateful/agenda/event-async/Q3-2022-Earnings-Release-32318978.ics"
      },
      {
        "section": "Past",
        "dateTimeRaw": "08/11/2021 04:00 pm",
        "dateTimeISO": "2021-11-08T10:30:00.000Z",
        "title": "Interim 2022 Earnings Call",
        "icsUrl": "https://in.marketscreener.com/api/stateful/agenda/event-async/Interim-2022-Earnings-Call-36925922.ics"
      },
      {
        "section": "Past",
        "dateTimeRaw": "04/11/2021 02:15 pm",
        "dateTimeISO": "2021-11-04T08:45:00.000Z",
        "title": "Interim 2022 Earnings Release",
        "icsUrl": "https://in.marketscreener.com/api/stateful/agenda/event-async/Interim-2022-Earnings-Release-31661834.ics"
      },
      {
        "section": "Past",
        "dateTimeRaw": "18/09/2021 03:30 pm",
        "dateTimeISO": "2021-09-18T10:00:00.000Z",
        "title": "Annual General Meeting",
        "icsUrl": "https://in.marketscreener.com/api/stateful/agenda/event-async/Annual-General-Meeting-36103771.ics"
      },
      {
        "section": "Past",
        "dateTimeRaw": "06/08/2021 05:00 pm",
        "dateTimeISO": "2021-08-06T11:30:00.000Z",
        "title": "Q1 2022 Earnings Call",
        "icsUrl": "https://in.marketscreener.com/api/stateful/agenda/event-async/Q1-2022-Earnings-Call-36103570.ics"
      },
      {
        "section": "Past",
        "dateTimeRaw": "06/08/2021 02:31 pm",
        "dateTimeISO": "2021-08-06T09:01:00.000Z",
        "title": "Q1 2022 Earnings Release",
        "icsUrl": "https://in.marketscreener.com/api/stateful/agenda/event-async/Q1-2022-Earnings-Release-30767338.ics"
      },
      {
        "section": "Past",
        "dateTimeRaw": "02/06/2021 05:00 pm",
        "dateTimeISO": "2021-06-02T11:30:00.000Z",
        "title": "FY 2021 Earnings Call",
        "icsUrl": "https://in.marketscreener.com/api/stateful/agenda/event-async/FY-2021-Earnings-Call-35527307.ics"
      },
      {
        "section": "Past",
        "dateTimeRaw": "02/06/2021 02:55 pm",
        "dateTimeISO": "2021-06-02T09:25:00.000Z",
        "title": "FY 2021 Earnings Release",
        "icsUrl": "https://in.marketscreener.com/api/stateful/agenda/event-async/FY-2021-Earnings-Release-31125923.ics"
      },
      {
        "section": "Past",
        "dateTimeRaw": "22/04/2021",
        "dateTimeISO": "2021-04-21T18:30:00.000Z",
        "title": "Ex-dividend day for dividende intermédiaire",
        "icsUrl": "https://in.marketscreener.com/api/stateful/agenda/event-async/Ex-dividend-day-for-dividende-intermediaire-32992328.ics"
      },
      {
        "section": "Past",
        "dateTimeRaw": "09/02/2021 05:00 pm",
        "dateTimeISO": "2021-02-09T11:30:00.000Z",
        "title": "Q3 2021 Earnings Call",
        "icsUrl": "https://in.marketscreener.com/api/stateful/agenda/event-async/Q3-2021-Earnings-Call-32436629.ics"
      },
      {
        "section": "Past",
        "dateTimeRaw": "09/02/2021",
        "dateTimeISO": "2021-02-08T18:30:00.000Z",
        "title": "Q3 2021 Earnings Release",
        "icsUrl": "https://in.marketscreener.com/api/stateful/agenda/event-async/Q3-2021-Earnings-Release-29927031.ics"
      },
      {
        "section": "Past",
        "dateTimeRaw": "03/11/2020 05:00 pm",
        "dateTimeISO": "2020-11-03T11:30:00.000Z",
        "title": "Interim 2021 Earnings Call",
        "icsUrl": "https://in.marketscreener.com/api/stateful/agenda/event-async/Interim-2021-Earnings-Call-31716154.ics"
      },
      {
        "section": "Past",
        "dateTimeRaw": "03/11/2020",
        "dateTimeISO": "2020-11-02T18:30:00.000Z",
        "title": "Interim 2021 Earnings Release",
        "icsUrl": "https://in.marketscreener.com/api/stateful/agenda/event-async/Interim-2021-Earnings-Release-29598352.ics"
      },
      {
        "section": "Past",
        "dateTimeRaw": "19/08/2020",
        "dateTimeISO": "2020-08-18T18:30:00.000Z",
        "title": "Q1 2021 Earnings Release",
        "icsUrl": "https://in.marketscreener.com/api/stateful/agenda/event-async/Q1-2021-Earnings-Release-29049296.ics"
      },
      {
        "section": "Past",
        "dateTimeRaw": "17/06/2020",
        "dateTimeISO": "2020-06-16T18:30:00.000Z",
        "title": "FY 2020 Earnings Release",
        "icsUrl": "https://in.marketscreener.com/api/stateful/agenda/event-async/FY-2020-Earnings-Release-30800432.ics"
      },
      {
        "section": "Past",
        "dateTimeRaw": "23/03/2020",
        "dateTimeISO": "2020-03-22T18:30:00.000Z",
        "title": "Ex-dividend day for dividende intermédiaire",
        "icsUrl": "https://in.marketscreener.com/api/stateful/agenda/event-async/Ex-dividend-day-for-dividende-intermediaire-30378276.ics"
      },
      {
        "section": "Past",
        "dateTimeRaw": "14/02/2020 05:00 pm",
        "dateTimeISO": "2020-02-14T11:30:00.000Z",
        "title": "Q3 2020 Earnings Call",
        "icsUrl": "https://in.marketscreener.com/api/stateful/agenda/event-async/Q3-2020-Earnings-Call-30045358.ics"
      },
      {
        "section": "Past",
        "dateTimeRaw": "14/02/2020",
        "dateTimeISO": "2020-02-13T18:30:00.000Z",
        "title": "Q3 2020 Earnings Release",
        "icsUrl": "https://in.marketscreener.com/api/stateful/agenda/event-async/Q3-2020-Earnings-Release-27988999.ics"
      },
      {
        "section": "Past",
        "dateTimeRaw": "13/11/2019 05:00 pm",
        "dateTimeISO": "2019-11-13T11:30:00.000Z",
        "title": "Interim 2020 Earnings Call",
        "icsUrl": "https://in.marketscreener.com/api/stateful/agenda/event-async/Interim-2020-Earnings-Call-29590226.ics"
      },
      {
        "section": "Past",
        "dateTimeRaw": "13/11/2019",
        "dateTimeISO": "2019-11-12T18:30:00.000Z",
        "title": "Interim 2020 Earnings Release",
        "icsUrl": "https://in.marketscreener.com/api/stateful/agenda/event-async/Interim-2020-Earnings-Release-27988898.ics"
      },
      {
        "section": "Past",
        "dateTimeRaw": "13/08/2019 02:30 pm",
        "dateTimeISO": "2019-08-13T09:00:00.000Z",
        "title": "Q1 2020 Earnings Call",
        "icsUrl": "https://in.marketscreener.com/api/stateful/agenda/event-async/Q1-2020-Earnings-Call-29078655.ics"
      },
      {
        "section": "Past",
        "dateTimeRaw": "12/08/2019",
        "dateTimeISO": "2019-08-11T18:30:00.000Z",
        "title": "Q1 2020 Earnings Release",
        "icsUrl": "https://in.marketscreener.com/api/stateful/agenda/event-async/Q1-2020-Earnings-Release-26573165.ics"
      },
      {
        "section": "Past",
        "dateTimeRaw": "13/05/2019",
        "dateTimeISO": "2019-05-12T18:30:00.000Z",
        "title": "FY 2019 Earnings Call",
        "icsUrl": "https://in.marketscreener.com/api/stateful/agenda/event-async/FY-2019-Earnings-Call-28618742.ics"
      },
      {
        "section": "Past",
        "dateTimeRaw": "11/04/2019",
        "dateTimeISO": "2019-04-10T18:30:00.000Z",
        "title": "Ex-dividend day for dividende intermédiaire",
        "icsUrl": "https://in.marketscreener.com/api/stateful/agenda/event-async/Ex-dividend-day-for-dividende-intermediaire-28366733.ics"
      },
      {
        "section": "Past",
        "dateTimeRaw": "06/02/2019 04:00 pm",
        "dateTimeISO": "2019-02-06T10:30:00.000Z",
        "title": "Q3 2019 Earnings Call",
        "icsUrl": "https://in.marketscreener.com/api/stateful/agenda/event-async/Q3-2019-Earnings-Call-27986069.ics"
      },
      {
        "section": "Past",
        "dateTimeRaw": "06/02/2019",
        "dateTimeISO": "2019-02-05T18:30:00.000Z",
        "title": "Q3 2019 Earnings Release",
        "icsUrl": "https://in.marketscreener.com/api/stateful/agenda/event-async/Q3-2019-Earnings-Release-25883138.ics"
      },
      {
        "section": "Past",
        "dateTimeRaw": "06/12/2018",
        "dateTimeISO": "2018-12-05T18:30:00.000Z",
        "title": "Interim 2019 Earnings Release",
        "icsUrl": "https://in.marketscreener.com/api/stateful/agenda/event-async/Interim-2019-Earnings-Release-25733838.ics"
      },
      {
        "section": "Past",
        "dateTimeRaw": "05/09/2018 02:30 pm",
        "dateTimeISO": "2018-09-05T09:00:00.000Z",
        "title": "Q1 2019 Earnings Call",
        "icsUrl": "https://in.marketscreener.com/api/stateful/agenda/event-async/Q1-2019-Earnings-Call-27230187.ics"
      },
      {
        "section": "Past",
        "dateTimeRaw": "04/09/2018",
        "dateTimeISO": "2018-09-03T18:30:00.000Z",
        "title": "Q1 2019 Earnings Release",
        "icsUrl": "https://in.marketscreener.com/api/stateful/agenda/event-async/Q1-2019-Earnings-Release-27196033.ics"
      },
      {
        "section": "Past",
        "dateTimeRaw": "27/07/2018",
        "dateTimeISO": "2018-07-26T18:30:00.000Z",
        "title": "Q1 2019 Earnings Release (Projected)",
        "icsUrl": "https://in.marketscreener.com/api/stateful/agenda/event-async/Q1-2019-Earnings-Release-Projected-25285582.ics"
      },
      {
        "section": "Past",
        "dateTimeRaw": "17/05/2018 02:00 pm",
        "dateTimeISO": "2018-05-17T08:30:00.000Z",
        "title": "FY 2018 Earnings Call",
        "icsUrl": "https://in.marketscreener.com/api/stateful/agenda/event-async/FY-2018-Earnings-Call-26618768.ics"
      },
      {
        "section": "Past",
        "dateTimeRaw": "17/05/2018",
        "dateTimeISO": "2018-05-16T18:30:00.000Z",
        "title": "FY 2018 Earnings Release",
        "icsUrl": "https://in.marketscreener.com/api/stateful/agenda/event-async/FY-2018-Earnings-Release-25285087.ics"
      },
      {
        "section": "Past",
        "dateTimeRaw": "15/02/2018",
        "dateTimeISO": "2018-02-14T18:30:00.000Z",
        "title": "Ex-dividend day for dividende intermédiaire",
        "icsUrl": "https://in.marketscreener.com/api/stateful/agenda/event-async/Ex-dividend-day-for-dividende-intermediaire-25973910.ics"
      },
      {
        "section": "Past",
        "dateTimeRaw": "09/02/2018 02:30 pm",
        "dateTimeISO": "2018-02-09T09:00:00.000Z",
        "title": "Q3 2018 Earnings Call",
        "icsUrl": "https://in.marketscreener.com/api/stateful/agenda/event-async/Q3-2018-Earnings-Call-25966706.ics"
      },
      {
        "section": "Past",
        "dateTimeRaw": "08/02/2018",
        "dateTimeISO": "2018-02-07T18:30:00.000Z",
        "title": "Q3 2018 Earnings Release",
        "icsUrl": "https://in.marketscreener.com/api/stateful/agenda/event-async/Q3-2018-Earnings-Release-23902117.ics"
      },
      {
        "section": "Past",
        "dateTimeRaw": "09/11/2017 02:30 pm",
        "dateTimeISO": "2017-11-09T09:00:00.000Z",
        "title": "Interim 2018 Earnings Call",
        "icsUrl": "https://in.marketscreener.com/api/stateful/agenda/event-async/Interim-2018-Earnings-Call-25486333.ics"
      },
      {
        "section": "Past",
        "dateTimeRaw": "08/11/2017",
        "dateTimeISO": "2017-11-07T18:30:00.000Z",
        "title": "Interim 2018 Earnings Release",
        "icsUrl": "https://in.marketscreener.com/api/stateful/agenda/event-async/Interim-2018-Earnings-Release-23901744.ics"
      },
      {
        "section": "Past",
        "dateTimeRaw": "20/09/2017",
        "dateTimeISO": "2017-09-19T18:30:00.000Z",
        "title": "Annual General Meeting",
        "icsUrl": "https://in.marketscreener.com/api/stateful/agenda/event-async/Annual-General-Meeting-25204108.ics"
      },
      {
        "section": "Past",
        "dateTimeRaw": "09/08/2017 02:30 pm",
        "dateTimeISO": "2017-08-09T09:00:00.000Z",
        "title": "Q1 2018 Earnings Call",
        "icsUrl": "https://in.marketscreener.com/api/stateful/agenda/event-async/Q1-2018-Earnings-Call-24935403.ics"
      },
      {
        "section": "Past",
        "dateTimeRaw": "08/08/2017",
        "dateTimeISO": "2017-08-07T18:30:00.000Z",
        "title": "Q1 2018 Earnings Release",
        "icsUrl": "https://in.marketscreener.com/api/stateful/agenda/event-async/Q1-2018-Earnings-Release-22850693.ics"
      },
      {
        "section": "Past",
        "dateTimeRaw": "19/05/2017 03:00 pm",
        "dateTimeISO": "2017-05-19T09:30:00.000Z",
        "title": "FY 2017 Earnings Call",
        "icsUrl": "https://in.marketscreener.com/api/stateful/agenda/event-async/FY-2017-Earnings-Call-24480101.ics"
      },
      {
        "section": "Past",
        "dateTimeRaw": "18/05/2017",
        "dateTimeISO": "2017-05-17T18:30:00.000Z",
        "title": "FY 2017 Earnings Release",
        "icsUrl": "https://in.marketscreener.com/api/stateful/agenda/event-async/FY-2017-Earnings-Release-22843006.ics"
      },
      {
        "section": "Past",
        "dateTimeRaw": "30/03/2017",
        "dateTimeISO": "2017-03-29T18:30:00.000Z",
        "title": "Ex-dividend day for dividende intermédiaire",
        "icsUrl": "https://in.marketscreener.com/api/stateful/agenda/event-async/Ex-dividend-day-for-dividende-intermediaire-24104734.ics"
      },
      {
        "section": "Past",
        "dateTimeRaw": "14/02/2017 02:30 pm",
        "dateTimeISO": "2017-02-14T09:00:00.000Z",
        "title": "Q3 2017 Earnings Call",
        "icsUrl": "https://in.marketscreener.com/api/stateful/agenda/event-async/Q3-2017-Earnings-Call-23900057.ics"
      },
      {
        "section": "Past",
        "dateTimeRaw": "14/02/2017",
        "dateTimeISO": "2017-02-13T18:30:00.000Z",
        "title": "Q3 2017 Earnings Release",
        "icsUrl": "https://in.marketscreener.com/api/stateful/agenda/event-async/Q3-2017-Earnings-Release-22830188.ics"
      },
      {
        "section": "Past",
        "dateTimeRaw": "11/11/2016 02:00 pm",
        "dateTimeISO": "2016-11-11T08:30:00.000Z",
        "title": "Interim 2017 Earnings Call",
        "icsUrl": "https://in.marketscreener.com/api/stateful/agenda/event-async/Interim-2017-Earnings-Call-23388518.ics"
      },
      {
        "section": "Past",
        "dateTimeRaw": "11/11/2016",
        "dateTimeISO": "2016-11-10T18:30:00.000Z",
        "title": "Interim 2017 Earnings Release",
        "icsUrl": "https://in.marketscreener.com/api/stateful/agenda/event-async/Interim-2017-Earnings-Release-19674203.ics"
      },
      {
        "section": "Past",
        "dateTimeRaw": "28/07/2016",
        "dateTimeISO": "2016-07-27T18:30:00.000Z",
        "title": "Q1 2017 Earnings Release",
        "icsUrl": "https://in.marketscreener.com/api/stateful/agenda/event-async/Q1-2017-Earnings-Release-19664295.ics"
      },
      {
        "section": "Past",
        "dateTimeRaw": "27/05/2016 05:30 pm",
        "dateTimeISO": "2016-05-27T12:00:00.000Z",
        "title": "FY 2016 Earnings Call",
        "icsUrl": "https://in.marketscreener.com/api/stateful/agenda/event-async/FY-2016-Earnings-Call-22435062.ics"
      },
      {
        "section": "Past",
        "dateTimeRaw": "27/05/2016",
        "dateTimeISO": "2016-05-26T18:30:00.000Z",
        "title": "FY 2016 Earnings Release",
        "icsUrl": "https://in.marketscreener.com/api/stateful/agenda/event-async/FY-2016-Earnings-Release-19660057.ics"
      },
      {
        "section": "Past",
        "dateTimeRaw": "16/03/2016",
        "dateTimeISO": "2016-03-15T18:30:00.000Z",
        "title": "Ex-dividend day for dividende intermédiaire",
        "icsUrl": "https://in.marketscreener.com/api/stateful/agenda/event-async/Ex-dividend-day-for-dividende-intermediaire-22006192.ics"
      },
      {
        "section": "Past",
        "dateTimeRaw": "22/02/2016",
        "dateTimeISO": "2016-02-21T18:30:00.000Z",
        "title": "Kotak Institutional Equities Chasing Growth Conference",
        "icsUrl": "https://in.marketscreener.com/api/stateful/agenda/event-async/Kotak-Institutional-Equities-Chasing-Growth-Conference-21925361.ics"
      },
      {
        "section": "Past",
        "dateTimeRaw": "29/01/2016 02:00 pm",
        "dateTimeISO": "2016-01-29T08:30:00.000Z",
        "title": "Q3 2016 Earnings Call",
        "icsUrl": "https://in.marketscreener.com/api/stateful/agenda/event-async/Q3-2016-Earnings-Call-21772186.ics"
      },
      {
        "section": "Past",
        "dateTimeRaw": "28/01/2016",
        "dateTimeISO": "2016-01-27T18:30:00.000Z",
        "title": "Q3 2016 Earnings Release",
        "icsUrl": "https://in.marketscreener.com/api/stateful/agenda/event-async/Q3-2016-Earnings-Release-19647424.ics"
      },
      {
        "section": "Past",
        "dateTimeRaw": "05/11/2015",
        "dateTimeISO": "2015-11-04T18:30:00.000Z",
        "title": "Ex-dividend day for dividende intermédiaire",
        "icsUrl": "https://in.marketscreener.com/api/stateful/agenda/event-async/Ex-dividend-day-for-dividende-intermediaire-21325063.ics"
      },
      {
        "section": "Past",
        "dateTimeRaw": "30/10/2015 02:00 pm",
        "dateTimeISO": "2015-10-30T08:30:00.000Z",
        "title": "Interim 2016 Earnings Call",
        "icsUrl": "https://in.marketscreener.com/api/stateful/agenda/event-async/Interim-2016-Earnings-Call-21321105.ics"
      },
      {
        "section": "Past",
        "dateTimeRaw": "29/10/2015",
        "dateTimeISO": "2015-10-28T18:30:00.000Z",
        "title": "Interim 2016 Earnings Release",
        "icsUrl": "https://in.marketscreener.com/api/stateful/agenda/event-async/Interim-2016-Earnings-Release-19186810.ics"
      },
      {
        "section": "Past",
        "dateTimeRaw": "22/09/2015",
        "dateTimeISO": "2015-09-21T18:30:00.000Z",
        "title": "Ex-dividend day for final dividend",
        "icsUrl": "https://in.marketscreener.com/api/stateful/agenda/event-async/Ex-dividend-day-for-final-dividend-21000027.ics"
      },
      {
        "section": "Past",
        "dateTimeRaw": "23/07/2015 02:00 pm",
        "dateTimeISO": "2015-07-23T08:30:00.000Z",
        "title": "Q1 2016 Earnings Call",
        "icsUrl": "https://in.marketscreener.com/api/stateful/agenda/event-async/Q1-2016-Earnings-Call-20748446.ics"
      },
      {
        "section": "Past",
        "dateTimeRaw": "22/07/2015",
        "dateTimeISO": "2015-07-21T18:30:00.000Z",
        "title": "Q1 2016 Earnings Release",
        "icsUrl": "https://in.marketscreener.com/api/stateful/agenda/event-async/Q1-2016-Earnings-Release-18722214.ics"
      },
      {
        "section": "Past",
        "dateTimeRaw": "06/05/2015 02:30 pm",
        "dateTimeISO": "2015-05-06T09:00:00.000Z",
        "title": "FY 2015 Earnings Call",
        "icsUrl": "https://in.marketscreener.com/api/stateful/agenda/event-async/FY-2015-Earnings-Call-20346757.ics"
      },
      {
        "section": "Past",
        "dateTimeRaw": "06/05/2015",
        "dateTimeISO": "2015-05-05T18:30:00.000Z",
        "title": "FY 2015 Earnings Release",
        "icsUrl": "https://in.marketscreener.com/api/stateful/agenda/event-async/FY-2015-Earnings-Release-18263319.ics"
      },
      {
        "section": "Past",
        "dateTimeRaw": "23/01/2015 02:30 pm",
        "dateTimeISO": "2015-01-23T09:00:00.000Z",
        "title": "Q3 2015 Earnings Call",
        "icsUrl": "https://in.marketscreener.com/api/stateful/agenda/event-async/Q3-2015-Earnings-Call-19758098.ics"
      },
      {
        "section": "Past",
        "dateTimeRaw": "22/01/2015",
        "dateTimeISO": "2015-01-21T18:30:00.000Z",
        "title": "Q3 2015 Earnings Release",
        "icsUrl": "https://in.marketscreener.com/api/stateful/agenda/event-async/Q3-2015-Earnings-Release-17786967.ics"
      },
      {
        "section": "Past",
        "dateTimeRaw": "22/10/2014",
        "dateTimeISO": "2014-10-21T18:30:00.000Z",
        "title": "Ex-dividend day for dividende intermédiaire",
        "icsUrl": "https://in.marketscreener.com/api/stateful/agenda/event-async/Ex-dividend-day-for-dividende-intermediaire-19143840.ics"
      },
      {
        "section": "Past",
        "dateTimeRaw": "04/02/2014",
        "dateTimeISO": "2014-02-03T18:30:00.000Z",
        "title": "Ex-dividend day for dividende intermédiaire",
        "icsUrl": "https://in.marketscreener.com/api/stateful/agenda/event-async/Ex-dividend-day-for-dividende-intermediaire-17885632.ics"
      },
      {
        "section": "Past",
        "dateTimeRaw": "05/11/2013",
        "dateTimeISO": "2013-11-04T18:30:00.000Z",
        "title": "Ex-dividend day for dividende intermédiaire",
        "icsUrl": "https://in.marketscreener.com/api/stateful/agenda/event-async/Ex-dividend-day-for-dividende-intermediaire-17424032.ics"
      },
      {
        "section": "Past",
        "dateTimeRaw": "12/09/2013",
        "dateTimeISO": "2013-09-11T18:30:00.000Z",
        "title": "Ex-dividend day for final dividend",
        "icsUrl": "https://in.marketscreener.com/api/stateful/agenda/event-async/Ex-dividend-day-for-final-dividend-17249171.ics"
      }
    ]
  },
  "pastDividends": {
    "count": 18,
    "dividends": [
      {
        "section": "Past Dividends",
        "dateRaw": "25/04/2025",
        "dateISO": "2025-04-24T18:30:00.000Z",
        "type": "Interim Payment",
        "amount": 26,
        "currency": "INR",
        "title": "Interim Payment 26 INR"
      },
      {
        "section": "Past Dividends",
        "dateRaw": "31/05/2024",
        "dateISO": "2024-05-30T18:30:00.000Z",
        "type": "Interim Payment",
        "amount": 24,
        "currency": "INR",
        "title": "Interim Payment 24 INR"
      },
      {
        "section": "Past Dividends",
        "dateRaw": "18/04/2023",
        "dateISO": "2023-04-17T18:30:00.000Z",
        "type": "Interim Payment",
        "amount": 22,
        "currency": "INR",
        "title": "Interim Payment 22 INR"
      },
      {
        "section": "Past Dividends",
        "dateRaw": "25/04/2022",
        "dateISO": "2022-04-24T18:30:00.000Z",
        "type": "Interim Payment",
        "amount": 20,
        "currency": "INR",
        "title": "Interim Payment 20 INR"
      },
      {
        "section": "Past Dividends",
        "dateRaw": "22/04/2021",
        "dateISO": "2021-04-21T18:30:00.000Z",
        "type": "Interim Payment",
        "amount": 20,
        "currency": "INR",
        "title": "Interim Payment 20 INR"
      },
      {
        "section": "Past Dividends",
        "dateRaw": "23/03/2020",
        "dateISO": "2020-03-22T18:30:00.000Z",
        "type": "Interim Payment",
        "amount": 15,
        "currency": "INR",
        "title": "Interim Payment 15 INR"
      },
      {
        "section": "Past Dividends",
        "dateRaw": "11/04/2019",
        "dateISO": "2019-04-10T18:30:00.000Z",
        "type": "Interim Payment",
        "amount": 12,
        "currency": "INR",
        "title": "Interim Payment 12 INR"
      },
      {
        "section": "Past Dividends",
        "dateRaw": "15/02/2018",
        "dateISO": "2018-02-14T18:30:00.000Z",
        "type": "Interim Payment",
        "amount": 10,
        "currency": "INR",
        "title": "Interim Payment 10 INR"
      },
      {
        "section": "Past Dividends",
        "dateRaw": "30/03/2017",
        "dateISO": "2017-03-29T18:30:00.000Z",
        "type": "Interim Payment",
        "amount": 6,
        "currency": "INR",
        "title": "Interim Payment 6 INR"
      },
      {
        "section": "Past Dividends",
        "dateRaw": "16/03/2016",
        "dateISO": "2016-03-15T18:30:00.000Z",
        "type": "Interim Payment",
        "amount": 2,
        "currency": "INR",
        "title": "Interim Payment 2 INR"
      },
      {
        "section": "Past Dividends",
        "dateRaw": "05/11/2015",
        "dateISO": "2015-11-04T18:30:00.000Z",
        "type": "Interim Payment",
        "amount": 4,
        "currency": "INR",
        "title": "Interim Payment 4 INR"
      },
      {
        "section": "Past Dividends",
        "dateRaw": "22/09/2015",
        "dateISO": "2015-09-21T18:30:00.000Z",
        "type": "Final Payment",
        "amount": 2,
        "currency": "INR",
        "title": "Final Payment 2 INR"
      },
      {
        "section": "Past Dividends",
        "dateRaw": "22/10/2014",
        "dateISO": "2014-10-21T18:30:00.000Z",
        "type": "Interim Payment",
        "amount": 4,
        "currency": "INR",
        "title": "Interim Payment 4 INR"
      },
      {
        "section": "Past Dividends",
        "dateRaw": "10/09/2014",
        "dateISO": "2014-09-09T18:30:00.000Z",
        "type": "Final Payment",
        "amount": 1,
        "currency": "INR",
        "title": "Final Payment 1 INR"
      },
      {
        "section": "Past Dividends",
        "dateRaw": "04/02/2014",
        "dateISO": "2014-02-03T18:30:00.000Z",
        "type": "Interim Payment",
        "amount": 2,
        "currency": "INR",
        "title": "Interim Payment 2 INR"
      },
      {
        "section": "Past Dividends",
        "dateRaw": "05/11/2013",
        "dateISO": "2013-11-04T18:30:00.000Z",
        "type": "Interim Payment",
        "amount": 3,
        "currency": "INR",
        "title": "Interim Payment 3 INR"
      },
      {
        "section": "Past Dividends",
        "dateRaw": "12/09/2013",
        "dateISO": "2013-09-11T18:30:00.000Z",
        "type": "Annual",
        "amount": 4.5,
        "currency": "INR",
        "title": "Annual 4.5 INR"
      },
      {
        "section": "Past Dividends",
        "dateRaw": "16/08/2012",
        "dateISO": "2012-08-15T18:30:00.000Z",
        "type": "Annual",
        "amount": 4,
        "currency": "INR",
        "title": "Annual 4 INR"
      }
    ]
  }
}