{
  "companyCode": "PETRONET-LNG-LIMITED-9059291",
  "timestamp": "2025-10-13T12:24:06.545Z",
  "annualResults": {
    "2023": {
      "Net salesMillion INR": {
        "metric": "Net salesMillion INR",
        "unit": "Million INR",
        "fiscalMonth": "March",
        "year": "2023",
        "released": "598 994",
        "forecast": "582 213",
        "spreadRaw": "2.88%"
      },
      "EBITDAMillion INR": {
        "metric": "EBITDAMillion INR",
        "unit": "Million INR",
        "fiscalMonth": "March",
        "year": "2023",
        "released": "48 560",
        "forecast": "47 356",
        "spreadRaw": "2.54%"
      },
      "EBITMillion INR": {
        "metric": "EBITMillion INR",
        "unit": "Million INR",
        "fiscalMonth": "March",
        "year": "2023",
        "released": "40 914",
        "forecast": "39 632",
        "spreadRaw": "3.23%"
      },
      "Earnings before Tax (EBT)Million INR": {
        "metric": "Earnings before Tax (EBT)Million INR",
        "unit": "Million INR",
        "fiscalMonth": "March",
        "year": "2023",
        "released": "43 345",
        "forecast": "41 650",
        "spreadRaw": "4.07%"
      },
      "Net incomeMillion INR": {
        "metric": "Net incomeMillion INR",
        "unit": "Million INR",
        "fiscalMonth": "March",
        "year": "2023",
        "released": "32 399",
        "forecast": "31 484",
        "spreadRaw": "2.91%"
      },
      "EPS INR": {
        "metric": "EPS INR",
        "unit": "INR",
        "fiscalMonth": "March",
        "year": "2023",
        "released": "21,6",
        "forecast": "20,7",
        "spreadRaw": "4.42%"
      },
      "Announcement Date": {
        "metric": "Announcement Date",
        "unit": null,
        "fiscalMonth": "March",
        "year": "2023",
        "released": "03/05/23",
        "forecast": null,
        "spreadRaw": null
      }
    },
    "2024": {
      "Net salesMillion INR": {
        "metric": "Net salesMillion INR",
        "unit": "Million INR",
        "fiscalMonth": "March",
        "year": "2024",
        "released": "527 284",
        "forecast": "543 911",
        "spreadRaw": "-3.06%"
      },
      "EBITDAMillion INR": {
        "metric": "EBITDAMillion INR",
        "unit": "Million INR",
        "fiscalMonth": "March",
        "year": "2024",
        "released": "52 065",
        "forecast": "51 385",
        "spreadRaw": "1.32%"
      },
      "EBITMillion INR": {
        "metric": "EBITMillion INR",
        "unit": "Million INR",
        "fiscalMonth": "March",
        "year": "2024",
        "released": "44 300",
        "forecast": "43 600",
        "spreadRaw": "1.6%"
      },
      "Earnings before Tax (EBT)Million INR": {
        "metric": "Earnings before Tax (EBT)Million INR",
        "unit": "Million INR",
        "fiscalMonth": "March",
        "year": "2024",
        "released": "47 570",
        "forecast": "46 581",
        "spreadRaw": "2.12%"
      },
      "Net incomeMillion INR": {
        "metric": "Net incomeMillion INR",
        "unit": "Million INR",
        "fiscalMonth": "March",
        "year": "2024",
        "released": "35 362",
        "forecast": "34 891",
        "spreadRaw": "1.35%"
      },
      "EPS INR": {
        "metric": "EPS INR",
        "unit": "INR",
        "fiscalMonth": "March",
        "year": "2024",
        "released": "23,6",
        "forecast": "23,2",
        "spreadRaw": "1.77%"
      },
      "Announcement Date": {
        "metric": "Announcement Date",
        "unit": null,
        "fiscalMonth": "March",
        "year": "2024",
        "released": "22/05/24",
        "forecast": null,
        "spreadRaw": null
      }
    },
    "2025": {
      "Net salesMillion INR": {
        "metric": "Net salesMillion INR",
        "unit": "Million INR",
        "fiscalMonth": "March",
        "year": "2025",
        "released": "509 796",
        "forecast": "531 136",
        "spreadRaw": "-4.02%"
      },
      "EBITDAMillion INR": {
        "metric": "EBITDAMillion INR",
        "unit": "Million INR",
        "fiscalMonth": "March",
        "year": "2025",
        "released": "55 241",
        "forecast": "54 828",
        "spreadRaw": "0.75%"
      },
      "EBITMillion INR": {
        "metric": "EBITMillion INR",
        "unit": "Million INR",
        "fiscalMonth": "March",
        "year": "2025",
        "released": "47 179",
        "forecast": "47 367",
        "spreadRaw": "-0.4%"
      },
      "Earnings before Tax (EBT)Million INR": {
        "metric": "Earnings before Tax (EBT)Million INR",
        "unit": "Million INR",
        "fiscalMonth": "March",
        "year": "2025",
        "released": "52 752",
        "forecast": "51 727",
        "spreadRaw": "1.98%"
      },
      "Net incomeMillion INR": {
        "metric": "Net incomeMillion INR",
        "unit": "Million INR",
        "fiscalMonth": "March",
        "year": "2025",
        "released": "39 264",
        "forecast": "38 156",
        "spreadRaw": "2.9%"
      },
      "EPS INR": {
        "metric": "EPS INR",
        "unit": "INR",
        "fiscalMonth": "March",
        "year": "2025",
        "released": "26,2",
        "forecast": "25,4",
        "spreadRaw": "3.23%"
      },
      "Announcement Date": {
        "metric": "Announcement Date",
        "unit": null,
        "fiscalMonth": "March",
        "year": "2025",
        "released": "19/05/25",
        "forecast": null,
        "spreadRaw": null
      }
    },
    "2026": {
      "Net salesMillion INR": {
        "metric": "Net salesMillion INR",
        "unit": "Million INR",
        "fiscalMonth": "March",
        "year": "2026",
        "released": null,
        "forecast": "509 095",
        "spreadRaw": null
      },
      "EBITDAMillion INR": {
        "metric": "EBITDAMillion INR",
        "unit": "Million INR",
        "fiscalMonth": "March",
        "year": "2026",
        "released": null,
        "forecast": "56 551",
        "spreadRaw": null
      },
      "EBITMillion INR": {
        "metric": "EBITMillion INR",
        "unit": "Million INR",
        "fiscalMonth": "March",
        "year": "2026",
        "released": null,
        "forecast": "47 483",
        "spreadRaw": null
      },
      "Earnings before Tax (EBT)Million INR": {
        "metric": "Earnings before Tax (EBT)Million INR",
        "unit": "Million INR",
        "fiscalMonth": "March",
        "year": "2026",
        "released": null,
        "forecast": "52 635",
        "spreadRaw": null
      },
      "Net incomeMillion INR": {
        "metric": "Net incomeMillion INR",
        "unit": "Million INR",
        "fiscalMonth": "March",
        "year": "2026",
        "released": null,
        "forecast": "39 406",
        "spreadRaw": null
      },
      "EPS INR": {
        "metric": "EPS INR",
        "unit": "INR",
        "fiscalMonth": "March",
        "year": "2026",
        "released": null,
        "forecast": "26,1",
        "spreadRaw": null
      },
      "Announcement Date": {
        "metric": "Announcement Date",
        "unit": null,
        "fiscalMonth": "March",
        "year": "2026",
        "released": "-",
        "forecast": null,
        "spreadRaw": null
      }
    },
    "2027": {
      "Net salesMillion INR": {
        "metric": "Net salesMillion INR",
        "unit": "Million INR",
        "fiscalMonth": "March",
        "year": "2027",
        "released": null,
        "forecast": "554 889",
        "spreadRaw": null
      },
      "EBITDAMillion INR": {
        "metric": "EBITDAMillion INR",
        "unit": "Million INR",
        "fiscalMonth": "March",
        "year": "2027",
        "released": null,
        "forecast": "64 347",
        "spreadRaw": null
      },
      "EBITMillion INR": {
        "metric": "EBITMillion INR",
        "unit": "Million INR",
        "fiscalMonth": "March",
        "year": "2027",
        "released": null,
        "forecast": "53 734",
        "spreadRaw": null
      },
      "Earnings before Tax (EBT)Million INR": {
        "metric": "Earnings before Tax (EBT)Million INR",
        "unit": "Million INR",
        "fiscalMonth": "March",
        "year": "2027",
        "released": null,
        "forecast": "57 317",
        "spreadRaw": null
      },
      "Net incomeMillion INR": {
        "metric": "Net incomeMillion INR",
        "unit": "Million INR",
        "fiscalMonth": "March",
        "year": "2027",
        "released": null,
        "forecast": "42 898",
        "spreadRaw": null
      },
      "EPS INR": {
        "metric": "EPS INR",
        "unit": "INR",
        "fiscalMonth": "March",
        "year": "2027",
        "released": null,
        "forecast": "28,6",
        "spreadRaw": null
      },
      "Announcement Date": {
        "metric": "Announcement Date",
        "unit": null,
        "fiscalMonth": "March",
        "year": "2027",
        "released": null,
        "forecast": null,
        "spreadRaw": null
      }
    },
    "2028": {
      "Net salesMillion INR": {
        "metric": "Net salesMillion INR",
        "unit": "Million INR",
        "fiscalMonth": "March",
        "year": "2028",
        "released": null,
        "forecast": "612 889",
        "spreadRaw": null
      },
      "EBITDAMillion INR": {
        "metric": "EBITDAMillion INR",
        "unit": "Million INR",
        "fiscalMonth": "March",
        "year": "2028",
        "released": null,
        "forecast": "69 359",
        "spreadRaw": null
      },
      "EBITMillion INR": {
        "metric": "EBITMillion INR",
        "unit": "Million INR",
        "fiscalMonth": "March",
        "year": "2028",
        "released": null,
        "forecast": "58 676",
        "spreadRaw": null
      },
      "Earnings before Tax (EBT)Million INR": {
        "metric": "Earnings before Tax (EBT)Million INR",
        "unit": "Million INR",
        "fiscalMonth": "March",
        "year": "2028",
        "released": null,
        "forecast": "60 944",
        "spreadRaw": null
      },
      "Net incomeMillion INR": {
        "metric": "Net incomeMillion INR",
        "unit": "Million INR",
        "fiscalMonth": "March",
        "year": "2028",
        "released": null,
        "forecast": "45 358",
        "spreadRaw": null
      },
      "EPS INR": {
        "metric": "EPS INR",
        "unit": "INR",
        "fiscalMonth": "March",
        "year": "2028",
        "released": null,
        "forecast": "30,4",
        "spreadRaw": null
      },
      "Announcement Date": {
        "metric": "Announcement Date",
        "unit": null,
        "fiscalMonth": "March",
        "year": "2028",
        "released": null,
        "forecast": null,
        "spreadRaw": null
      }
    }
  },
  "quarterlyResults": {
    "2024 Q2": {
      "Net salesMillion INR": {
        "metric": "Net salesMillion INR",
        "unit": "Million INR",
        "fiscalMonth": "March",
        "period": "2024 Q2",
        "released": "125 320",
        "releasedNum": 125320,
        "forecast": "121 219",
        "forecastNum": 121219,
        "spreadRaw": "3.38%",
        "spreadPct": 3.38
      },
      "EBITDAMillion INR": {
        "metric": "EBITDAMillion INR",
        "unit": "Million INR",
        "fiscalMonth": "March",
        "period": "2024 Q2",
        "released": "12 147",
        "releasedNum": 12147,
        "forecast": "11 297",
        "forecastNum": 11297,
        "spreadRaw": "7.53%",
        "spreadPct": 7.53
      },
      "EBITMillion INR": {
        "metric": "EBITMillion INR",
        "unit": "Million INR",
        "fiscalMonth": "March",
        "period": "2024 Q2",
        "released": "10 199",
        "releasedNum": 10199,
        "forecast": "10 086",
        "forecastNum": 10086,
        "spreadRaw": "1.12%",
        "spreadPct": 1.12
      },
      "Earnings before Tax (EBT)Million INR": {
        "metric": "Earnings before Tax (EBT)Million INR",
        "unit": "Million INR",
        "fiscalMonth": "March",
        "period": "2024 Q2",
        "released": "11 020",
        "releasedNum": 11020,
        "forecast": "9 347",
        "forecastNum": 9347,
        "spreadRaw": "17.9%",
        "spreadPct": 17.9
      },
      "Net incomeMillion INR": {
        "metric": "Net incomeMillion INR",
        "unit": "Million INR",
        "fiscalMonth": "March",
        "period": "2024 Q2",
        "released": "8 181",
        "releasedNum": 8181,
        "forecast": "7 604",
        "forecastNum": 7604,
        "spreadRaw": "7.59%",
        "spreadPct": 7.59
      },
      "EPS INR": {
        "metric": "EPS INR",
        "unit": "INR",
        "fiscalMonth": "March",
        "period": "2024 Q2",
        "released": "5,45",
        "releasedNum": 5.45,
        "forecast": "4,78",
        "forecastNum": 4.78,
        "spreadRaw": "14.1%",
        "spreadPct": 14.1
      },
      "Announcement Date": {
        "metric": "Announcement Date",
        "unit": null,
        "fiscalMonth": "March",
        "period": "2024 Q2",
        "released": "30/10/23",
        "releasedDate": "30/10/23",
        "forecast": null,
        "spreadRaw": null,
        "spreadPct": null
      }
    },
    "2024 Q3": {
      "Net salesMillion INR": {
        "metric": "Net salesMillion INR",
        "unit": "Million INR",
        "fiscalMonth": "March",
        "period": "2024 Q3",
        "released": "147 472",
        "releasedNum": 147472,
        "forecast": "132 084",
        "forecastNum": 132084,
        "spreadRaw": "11.65%",
        "spreadPct": 11.65
      },
      "EBITDAMillion INR": {
        "metric": "EBITDAMillion INR",
        "unit": "Million INR",
        "fiscalMonth": "March",
        "period": "2024 Q3",
        "released": "17 060",
        "releasedNum": 17060,
        "forecast": "12 255",
        "forecastNum": 12255,
        "spreadRaw": "39.21%",
        "spreadPct": 39.21
      },
      "EBITMillion INR": {
        "metric": "EBITMillion INR",
        "unit": "Million INR",
        "fiscalMonth": "March",
        "period": "2024 Q3",
        "released": "15 105",
        "releasedNum": 15105,
        "forecast": "10 027",
        "forecastNum": 10027,
        "spreadRaw": "50.64%",
        "spreadPct": 50.64
      },
      "Earnings before Tax (EBT)Million INR": {
        "metric": "Earnings before Tax (EBT)Million INR",
        "unit": "Million INR",
        "fiscalMonth": "March",
        "period": "2024 Q3",
        "released": "15 973",
        "releasedNum": 15973,
        "forecast": "11 279",
        "forecastNum": 11279,
        "spreadRaw": "41.62%",
        "spreadPct": 41.62
      },
      "Net incomeMillion INR": {
        "metric": "Net incomeMillion INR",
        "unit": "Million INR",
        "fiscalMonth": "March",
        "period": "2024 Q3",
        "released": "11 907",
        "releasedNum": 11907,
        "forecast": "8 405",
        "forecastNum": 8405,
        "spreadRaw": "41.66%",
        "spreadPct": 41.66
      },
      "EPS INR": {
        "metric": "EPS INR",
        "unit": "INR",
        "fiscalMonth": "March",
        "period": "2024 Q3",
        "released": "7,94",
        "releasedNum": 7.94,
        "forecast": "5,34",
        "forecastNum": 5.34,
        "spreadRaw": "48.58%",
        "spreadPct": 48.58
      },
      "Announcement Date": {
        "metric": "Announcement Date",
        "unit": null,
        "fiscalMonth": "March",
        "period": "2024 Q3",
        "released": "29/01/24",
        "releasedDate": "29/01/24",
        "forecast": null,
        "spreadRaw": null,
        "spreadPct": null
      }
    },
    "2024 Q4": {
      "Net salesMillion INR": {
        "metric": "Net salesMillion INR",
        "unit": "Million INR",
        "fiscalMonth": "March",
        "period": "2024 Q4",
        "released": "137 932",
        "releasedNum": 137932,
        "forecast": "134 912",
        "forecastNum": 134912,
        "spreadRaw": "2.24%",
        "spreadPct": 2.24
      },
      "EBITDAMillion INR": {
        "metric": "EBITDAMillion INR",
        "unit": "Million INR",
        "fiscalMonth": "March",
        "period": "2024 Q4",
        "released": "11 040",
        "releasedNum": 11040,
        "forecast": "12 711",
        "forecastNum": 12711,
        "spreadRaw": "-13.14%",
        "spreadPct": -13.14
      },
      "EBITMillion INR": {
        "metric": "EBITMillion INR",
        "unit": "Million INR",
        "fiscalMonth": "March",
        "period": "2024 Q4",
        "released": "9 096",
        "releasedNum": 9096,
        "forecast": "10 639",
        "forecastNum": 10639,
        "spreadRaw": "-14.5%",
        "spreadPct": -14.5
      },
      "Earnings before Tax (EBT)Million INR": {
        "metric": "Earnings before Tax (EBT)Million INR",
        "unit": "Million INR",
        "fiscalMonth": "March",
        "period": "2024 Q4",
        "released": "9 957",
        "releasedNum": 9957,
        "forecast": "11 572",
        "forecastNum": 11572,
        "spreadRaw": "-13.96%",
        "spreadPct": -13.96
      },
      "Net incomeMillion INR": {
        "metric": "Net incomeMillion INR",
        "unit": "Million INR",
        "fiscalMonth": "March",
        "period": "2024 Q4",
        "released": "7 375",
        "releasedNum": 7375,
        "forecast": "8 546",
        "forecastNum": 8546,
        "spreadRaw": "-13.71%",
        "spreadPct": -13.71
      },
      "EPS INR": {
        "metric": "EPS INR",
        "unit": "INR",
        "fiscalMonth": "March",
        "period": "2024 Q4",
        "released": "4,92",
        "releasedNum": 4.92,
        "forecast": "5,72",
        "forecastNum": 5.72,
        "spreadRaw": "-13.99%",
        "spreadPct": -13.99
      },
      "Announcement Date": {
        "metric": "Announcement Date",
        "unit": null,
        "fiscalMonth": "March",
        "period": "2024 Q4",
        "released": "22/05/24",
        "releasedDate": "22/05/24",
        "forecast": null,
        "spreadRaw": null,
        "spreadPct": null
      }
    },
    "2025 Q1": {
      "Net salesMillion INR": {
        "metric": "Net salesMillion INR",
        "unit": "Million INR",
        "fiscalMonth": "March",
        "period": "2025 Q1",
        "released": "134 151",
        "releasedNum": 134151,
        "forecast": "138 092",
        "forecastNum": 138092,
        "spreadRaw": "-2.85%",
        "spreadPct": -2.85
      },
      "EBITDAMillion INR": {
        "metric": "EBITDAMillion INR",
        "unit": "Million INR",
        "fiscalMonth": "March",
        "period": "2025 Q1",
        "released": "15 630",
        "releasedNum": 15630,
        "forecast": "13 429",
        "forecastNum": 13429,
        "spreadRaw": "16.39%",
        "spreadPct": 16.39
      },
      "EBITMillion INR": {
        "metric": "EBITMillion INR",
        "unit": "Million INR",
        "fiscalMonth": "March",
        "period": "2025 Q1",
        "released": "13 684",
        "releasedNum": 13684,
        "forecast": "10 664",
        "forecastNum": 10664,
        "spreadRaw": "28.32%",
        "spreadPct": 28.32
      },
      "Earnings before Tax (EBT)Million INR": {
        "metric": "Earnings before Tax (EBT)Million INR",
        "unit": "Million INR",
        "fiscalMonth": "March",
        "period": "2025 Q1",
        "released": "15 199",
        "releasedNum": 15199,
        "forecast": "12 425",
        "forecastNum": 12425,
        "spreadRaw": "22.32%",
        "spreadPct": 22.32
      },
      "Net incomeMillion INR": {
        "metric": "Net incomeMillion INR",
        "unit": "Million INR",
        "fiscalMonth": "March",
        "period": "2025 Q1",
        "released": "11 416",
        "releasedNum": 11416,
        "forecast": "8 887",
        "forecastNum": 8887,
        "spreadRaw": "28.46%",
        "spreadPct": 28.46
      },
      "EPS INR": {
        "metric": "EPS INR",
        "unit": "INR",
        "fiscalMonth": "March",
        "period": "2025 Q1",
        "released": "7,61",
        "releasedNum": 7.61,
        "forecast": "5,86",
        "forecastNum": 5.86,
        "spreadRaw": "29.86%",
        "spreadPct": 29.86
      },
      "Announcement Date": {
        "metric": "Announcement Date",
        "unit": null,
        "fiscalMonth": "March",
        "period": "2025 Q1",
        "released": "24/07/24",
        "releasedDate": "24/07/24",
        "forecast": null,
        "spreadRaw": null,
        "spreadPct": null
      }
    },
    "2025 Q2": {
      "Net salesMillion INR": {
        "metric": "Net salesMillion INR",
        "unit": "Million INR",
        "fiscalMonth": "March",
        "period": "2025 Q2",
        "released": "130 218",
        "releasedNum": 130218,
        "forecast": "132 359",
        "forecastNum": 132359,
        "spreadRaw": "-1.62%",
        "spreadPct": -1.62
      },
      "EBITDAMillion INR": {
        "metric": "EBITDAMillion INR",
        "unit": "Million INR",
        "fiscalMonth": "March",
        "period": "2025 Q2",
        "released": "12 005",
        "releasedNum": 12005,
        "forecast": "13 213",
        "forecastNum": 13213,
        "spreadRaw": "-9.14%",
        "spreadPct": -9.14
      },
      "EBITMillion INR": {
        "metric": "EBITMillion INR",
        "unit": "Million INR",
        "fiscalMonth": "March",
        "period": "2025 Q2",
        "released": "10 042",
        "releasedNum": 10042,
        "forecast": "12 045",
        "forecastNum": 12045,
        "spreadRaw": "-16.62%",
        "spreadPct": -16.62
      },
      "Earnings before Tax (EBT)Million INR": {
        "metric": "Earnings before Tax (EBT)Million INR",
        "unit": "Million INR",
        "fiscalMonth": "March",
        "period": "2025 Q2",
        "released": "11 404",
        "releasedNum": 11404,
        "forecast": "12 279",
        "forecastNum": 12279,
        "spreadRaw": "-7.13%",
        "spreadPct": -7.13
      },
      "Net incomeMillion INR": {
        "metric": "Net incomeMillion INR",
        "unit": "Million INR",
        "fiscalMonth": "March",
        "period": "2025 Q2",
        "released": "8 476",
        "releasedNum": 8476,
        "forecast": "9 083",
        "forecastNum": 9083,
        "spreadRaw": "-6.68%",
        "spreadPct": -6.68
      },
      "EPS INR": {
        "metric": "EPS INR",
        "unit": "INR",
        "fiscalMonth": "March",
        "period": "2025 Q2",
        "released": "5,65",
        "releasedNum": 5.65,
        "forecast": "6,07",
        "forecastNum": 6.07,
        "spreadRaw": "-6.87%",
        "spreadPct": -6.87
      },
      "Announcement Date": {
        "metric": "Announcement Date",
        "unit": null,
        "fiscalMonth": "March",
        "period": "2025 Q2",
        "released": "24/10/24",
        "releasedDate": "24/10/24",
        "forecast": null,
        "spreadRaw": null,
        "spreadPct": null
      }
    },
    "2025 Q3": {
      "Net salesMillion INR": {
        "metric": "Net salesMillion INR",
        "unit": "Million INR",
        "fiscalMonth": "March",
        "period": "2025 Q3",
        "released": "122 269",
        "releasedNum": 122269,
        "forecast": "128 024",
        "forecastNum": 128024,
        "spreadRaw": "-4.5%",
        "spreadPct": -4.5
      },
      "EBITDAMillion INR": {
        "metric": "EBITDAMillion INR",
        "unit": "Million INR",
        "fiscalMonth": "March",
        "period": "2025 Q3",
        "released": "12 477",
        "releasedNum": 12477,
        "forecast": "12 645",
        "forecastNum": 12645,
        "spreadRaw": "-1.33%",
        "spreadPct": -1.33
      },
      "EBITMillion INR": {
        "metric": "EBITMillion INR",
        "unit": "Million INR",
        "fiscalMonth": "March",
        "period": "2025 Q3",
        "released": "10 381",
        "releasedNum": 10381,
        "forecast": "10 900",
        "forecastNum": 10900,
        "spreadRaw": "-4.76%",
        "spreadPct": -4.76
      },
      "Earnings before Tax (EBT)Million INR": {
        "metric": "Earnings before Tax (EBT)Million INR",
        "unit": "Million INR",
        "fiscalMonth": "March",
        "period": "2025 Q3",
        "released": "11 691",
        "releasedNum": 11691,
        "forecast": "11 718",
        "forecastNum": 11718,
        "spreadRaw": "-0.23%",
        "spreadPct": -0.23
      },
      "Net incomeMillion INR": {
        "metric": "Net incomeMillion INR",
        "unit": "Million INR",
        "fiscalMonth": "March",
        "period": "2025 Q3",
        "released": "8 670",
        "releasedNum": 8670,
        "forecast": "8 852",
        "forecastNum": 8852,
        "spreadRaw": "-2.05%",
        "spreadPct": -2.05
      },
      "EPS INR": {
        "metric": "EPS INR",
        "unit": "INR",
        "fiscalMonth": "March",
        "period": "2025 Q3",
        "released": "5,78",
        "releasedNum": 5.78,
        "forecast": "6,01",
        "forecastNum": 6.01,
        "spreadRaw": "-3.9%",
        "spreadPct": -3.9
      },
      "Announcement Date": {
        "metric": "Announcement Date",
        "unit": null,
        "fiscalMonth": "March",
        "period": "2025 Q3",
        "released": "27/01/25",
        "releasedDate": "27/01/25",
        "forecast": null,
        "spreadRaw": null,
        "spreadPct": null
      }
    },
    "2025 Q4": {
      "Net salesMillion INR": {
        "metric": "Net salesMillion INR",
        "unit": "Million INR",
        "fiscalMonth": "March",
        "period": "2025 Q4",
        "released": "123 158",
        "releasedNum": 123158,
        "forecast": "119 021",
        "forecastNum": 119021,
        "spreadRaw": "3.48%",
        "spreadPct": 3.48
      },
      "EBITDAMillion INR": {
        "metric": "EBITDAMillion INR",
        "unit": "Million INR",
        "fiscalMonth": "March",
        "period": "2025 Q4",
        "released": "15 129",
        "releasedNum": 15129,
        "forecast": "11 943",
        "forecastNum": 11943,
        "spreadRaw": "26.68%",
        "spreadPct": 26.68
      },
      "EBITMillion INR": {
        "metric": "EBITMillion INR",
        "unit": "Million INR",
        "fiscalMonth": "March",
        "period": "2025 Q4",
        "released": "13 071",
        "releasedNum": 13071,
        "forecast": "10 583",
        "forecastNum": 10583,
        "spreadRaw": "23.52%",
        "spreadPct": 23.52
      },
      "Earnings before Tax (EBT)Million INR": {
        "metric": "Earnings before Tax (EBT)Million INR",
        "unit": "Million INR",
        "fiscalMonth": "March",
        "period": "2025 Q4",
        "released": "14 458",
        "releasedNum": 14458,
        "forecast": "11 469",
        "forecastNum": 11469,
        "spreadRaw": "26.06%",
        "spreadPct": 26.06
      },
      "Net incomeMillion INR": {
        "metric": "Net incomeMillion INR",
        "unit": "Million INR",
        "fiscalMonth": "March",
        "period": "2025 Q4",
        "released": "10 702",
        "releasedNum": 10702,
        "forecast": "8 319",
        "forecastNum": 8319,
        "spreadRaw": "28.65%",
        "spreadPct": 28.65
      },
      "EPS INR": {
        "metric": "EPS INR",
        "unit": "INR",
        "fiscalMonth": "March",
        "period": "2025 Q4",
        "released": "7,13",
        "releasedNum": 7.13,
        "forecast": "6,00",
        "forecastNum": 6,
        "spreadRaw": "18.75%",
        "spreadPct": 18.75
      },
      "Announcement Date": {
        "metric": "Announcement Date",
        "unit": null,
        "fiscalMonth": "March",
        "period": "2025 Q4",
        "released": "19/05/25",
        "releasedDate": "19/05/25",
        "forecast": null,
        "spreadRaw": null,
        "spreadPct": null
      }
    },
    "2026 Q1": {
      "Net salesMillion INR": {
        "metric": "Net salesMillion INR",
        "unit": "Million INR",
        "fiscalMonth": "March",
        "period": "2026 Q1",
        "released": "118 799",
        "releasedNum": 118799,
        "forecast": "115 400",
        "forecastNum": 115400,
        "spreadRaw": "2.94%",
        "spreadPct": 2.94
      },
      "EBITDAMillion INR": {
        "metric": "EBITDAMillion INR",
        "unit": "Million INR",
        "fiscalMonth": "March",
        "period": "2026 Q1",
        "released": "11 597",
        "releasedNum": 11597,
        "forecast": "12 490",
        "forecastNum": 12490,
        "spreadRaw": "-7.15%",
        "spreadPct": -7.15
      },
      "EBITMillion INR": {
        "metric": "EBITMillion INR",
        "unit": "Million INR",
        "fiscalMonth": "March",
        "period": "2026 Q1",
        "released": "9 528",
        "releasedNum": 9528,
        "forecast": "10 975",
        "forecastNum": 10975,
        "spreadRaw": "-13.19%",
        "spreadPct": -13.19
      },
      "Earnings before Tax (EBT)Million INR": {
        "metric": "Earnings before Tax (EBT)Million INR",
        "unit": "Million INR",
        "fiscalMonth": "March",
        "period": "2026 Q1",
        "released": "11 361",
        "releasedNum": 11361,
        "forecast": "12 264",
        "forecastNum": 12264,
        "spreadRaw": "-7.36%",
        "spreadPct": -7.36
      },
      "Net incomeMillion INR": {
        "metric": "Net incomeMillion INR",
        "unit": "Million INR",
        "fiscalMonth": "March",
        "period": "2026 Q1",
        "released": "8 506",
        "releasedNum": 8506,
        "forecast": "8 840",
        "forecastNum": 8840,
        "spreadRaw": "-3.78%",
        "spreadPct": -3.78
      },
      "EPS INR": {
        "metric": "EPS INR",
        "unit": "INR",
        "fiscalMonth": "March",
        "period": "2026 Q1",
        "released": "5,67",
        "releasedNum": 5.67,
        "forecast": "5,85",
        "forecastNum": 5.85,
        "spreadRaw": "-3.08%",
        "spreadPct": -3.08
      },
      "Announcement Date": {
        "metric": "Announcement Date",
        "unit": null,
        "fiscalMonth": "March",
        "period": "2026 Q1",
        "released": "25/07/25",
        "releasedDate": "25/07/25",
        "forecast": null,
        "spreadRaw": null,
        "spreadPct": null
      }
    },
    "2026 Q2": {
      "Net salesMillion INR": {
        "metric": "Net salesMillion INR",
        "unit": "Million INR",
        "fiscalMonth": "March",
        "period": "2026 Q2",
        "released": null,
        "releasedNum": null,
        "forecast": "119 520",
        "forecastNum": 119520,
        "spreadRaw": null,
        "spreadPct": null
      },
      "EBITDAMillion INR": {
        "metric": "EBITDAMillion INR",
        "unit": "Million INR",
        "fiscalMonth": "March",
        "period": "2026 Q2",
        "released": null,
        "releasedNum": null,
        "forecast": "12 289",
        "forecastNum": 12289,
        "spreadRaw": null,
        "spreadPct": null
      },
      "EBITMillion INR": {
        "metric": "EBITMillion INR",
        "unit": "Million INR",
        "fiscalMonth": "March",
        "period": "2026 Q2",
        "released": null,
        "releasedNum": null,
        "forecast": "10 132",
        "forecastNum": 10132,
        "spreadRaw": null,
        "spreadPct": null
      },
      "Earnings before Tax (EBT)Million INR": {
        "metric": "Earnings before Tax (EBT)Million INR",
        "unit": "Million INR",
        "fiscalMonth": "March",
        "period": "2026 Q2",
        "released": null,
        "releasedNum": null,
        "forecast": "12 183",
        "forecastNum": 12183,
        "spreadRaw": null,
        "spreadPct": null
      },
      "Net incomeMillion INR": {
        "metric": "Net incomeMillion INR",
        "unit": "Million INR",
        "fiscalMonth": "March",
        "period": "2026 Q2",
        "released": null,
        "releasedNum": null,
        "forecast": "8 772",
        "forecastNum": 8772,
        "spreadRaw": null,
        "spreadPct": null
      },
      "EPS INR": {
        "metric": "EPS INR",
        "unit": "INR",
        "fiscalMonth": "March",
        "period": "2026 Q2",
        "released": null,
        "releasedNum": null,
        "forecast": "5,69",
        "forecastNum": 5.69,
        "spreadRaw": null,
        "spreadPct": null
      },
      "Announcement Date": {
        "metric": "Announcement Date",
        "unit": null,
        "fiscalMonth": "March",
        "period": "2026 Q2",
        "released": "-",
        "releasedDate": "-",
        "forecast": null,
        "spreadRaw": null,
        "spreadPct": null
      }
    },
    "2026 Q3": {
      "Net salesMillion INR": {
        "metric": "Net salesMillion INR",
        "unit": "Million INR",
        "fiscalMonth": "March",
        "period": "2026 Q3",
        "released": null,
        "releasedNum": null,
        "forecast": "124 358",
        "forecastNum": 124358,
        "spreadRaw": null,
        "spreadPct": null
      },
      "EBITDAMillion INR": {
        "metric": "EBITDAMillion INR",
        "unit": "Million INR",
        "fiscalMonth": "March",
        "period": "2026 Q3",
        "released": null,
        "releasedNum": null,
        "forecast": "12 774",
        "forecastNum": 12774,
        "spreadRaw": null,
        "spreadPct": null
      },
      "EBITMillion INR": {
        "metric": "EBITMillion INR",
        "unit": "Million INR",
        "fiscalMonth": "March",
        "period": "2026 Q3",
        "released": null,
        "releasedNum": null,
        "forecast": "9 156",
        "forecastNum": 9156,
        "spreadRaw": null,
        "spreadPct": null
      },
      "Earnings before Tax (EBT)Million INR": {
        "metric": "Earnings before Tax (EBT)Million INR",
        "unit": "Million INR",
        "fiscalMonth": "March",
        "period": "2026 Q3",
        "released": null,
        "releasedNum": null,
        "forecast": "11 804",
        "forecastNum": 11804,
        "spreadRaw": null,
        "spreadPct": null
      },
      "Net incomeMillion INR": {
        "metric": "Net incomeMillion INR",
        "unit": "Million INR",
        "fiscalMonth": "March",
        "period": "2026 Q3",
        "released": null,
        "releasedNum": null,
        "forecast": "8 819",
        "forecastNum": 8819,
        "spreadRaw": null,
        "spreadPct": null
      },
      "EPS INR": {
        "metric": "EPS INR",
        "unit": "INR",
        "fiscalMonth": "March",
        "period": "2026 Q3",
        "released": null,
        "releasedNum": null,
        "forecast": null,
        "forecastNum": null,
        "spreadRaw": null,
        "spreadPct": null
      },
      "Announcement Date": {
        "metric": "Announcement Date",
        "unit": null,
        "fiscalMonth": "March",
        "period": "2026 Q3",
        "released": "-",
        "releasedDate": "-",
        "forecast": null,
        "spreadRaw": null,
        "spreadPct": null
      }
    },
    "2026 Q4": {
      "Net salesMillion INR": {
        "metric": "Net salesMillion INR",
        "unit": "Million INR",
        "fiscalMonth": "March",
        "period": "2026 Q4",
        "released": null,
        "releasedNum": null,
        "forecast": "125 843",
        "forecastNum": 125843,
        "spreadRaw": null,
        "spreadPct": null
      },
      "EBITDAMillion INR": {
        "metric": "EBITDAMillion INR",
        "unit": "Million INR",
        "fiscalMonth": "March",
        "period": "2026 Q4",
        "released": null,
        "releasedNum": null,
        "forecast": "16 563",
        "forecastNum": 16563,
        "spreadRaw": null,
        "spreadPct": null
      },
      "EBITMillion INR": {
        "metric": "EBITMillion INR",
        "unit": "Million INR",
        "fiscalMonth": "March",
        "period": "2026 Q4",
        "released": null,
        "releasedNum": null,
        "forecast": "15 311",
        "forecastNum": 15311,
        "spreadRaw": null,
        "spreadPct": null
      },
      "Earnings before Tax (EBT)Million INR": {
        "metric": "Earnings before Tax (EBT)Million INR",
        "unit": "Million INR",
        "fiscalMonth": "March",
        "period": "2026 Q4",
        "released": null,
        "releasedNum": null,
        "forecast": "15 391",
        "forecastNum": 15391,
        "spreadRaw": null,
        "spreadPct": null
      },
      "Net incomeMillion INR": {
        "metric": "Net incomeMillion INR",
        "unit": "Million INR",
        "fiscalMonth": "March",
        "period": "2026 Q4",
        "released": null,
        "releasedNum": null,
        "forecast": "11 530",
        "forecastNum": 11530,
        "spreadRaw": null,
        "spreadPct": null
      },
      "EPS INR": {
        "metric": "EPS INR",
        "unit": "INR",
        "fiscalMonth": "March",
        "period": "2026 Q4",
        "released": null,
        "releasedNum": null,
        "forecast": null,
        "forecastNum": null,
        "spreadRaw": null,
        "spreadPct": null
      },
      "Announcement Date": {
        "metric": "Announcement Date",
        "unit": null,
        "fiscalMonth": "March",
        "period": "2026 Q4",
        "released": "-",
        "releasedDate": "-",
        "forecast": null,
        "spreadRaw": null,
        "spreadPct": null
      }
    }
  },
  "upcomingEvents": {
    "count": 4,
    "events": [
      {
        "section": "Upcoming",
        "dateTimeRaw": "05/11/2025",
        "dateTimeISO": "2025-11-04T18:30:00.000Z",
        "title": "Q2 2026 Earnings Release (Projected)",
        "icsUrl": "https://in.marketscreener.com/api/stateful/agenda/event-async/Q2-2026-Earnings-Release-Projected-48038727.ics"
      },
      {
        "section": "Upcoming",
        "dateTimeRaw": "05/02/2026",
        "dateTimeISO": "2026-02-04T18:30:00.000Z",
        "title": "Q3 2026 Earnings Release (Projected)",
        "icsUrl": "https://in.marketscreener.com/api/stateful/agenda/event-async/Q3-2026-Earnings-Release-Projected-48897130.ics"
      },
      {
        "section": "Upcoming",
        "dateTimeRaw": "26/05/2026",
        "dateTimeISO": "2026-05-25T18:30:00.000Z",
        "title": "Q4 2026 Earnings Release (Projected)",
        "icsUrl": "https://in.marketscreener.com/api/stateful/agenda/event-async/Q4-2026-Earnings-Release-Projected-49851050.ics"
      },
      {
        "section": "Upcoming",
        "dateTimeRaw": "05/08/2026",
        "dateTimeISO": "2026-08-04T18:30:00.000Z",
        "title": "Q1 2027 Earnings Release (Projected)",
        "icsUrl": "https://in.marketscreener.com/api/stateful/agenda/event-async/Q1-2027-Earnings-Release-Projected-50349675.ics"
      }
    ]
  },
  "pastEvents": {
    "count": 130,
    "events": [
      {
        "section": "Past",
        "dateTimeRaw": "24/09/2025 03:30 pm",
        "dateTimeISO": "2025-09-24T10:00:00.000Z",
        "title": "Annual General Meeting",
        "icsUrl": "https://in.marketscreener.com/api/stateful/agenda/event-async/Annual-General-Meeting-50839869.ics"
      },
      {
        "section": "Past",
        "dateTimeRaw": "22/09/2025",
        "dateTimeISO": "2025-09-21T18:30:00.000Z",
        "title": "J.P. Morgan India Conference",
        "icsUrl": "https://in.marketscreener.com/api/stateful/agenda/event-async/J-P-Morgan-India-Conference-50913437.ics"
      },
      {
        "section": "Past",
        "dateTimeRaw": "04/09/2025",
        "dateTimeISO": "2025-09-03T18:30:00.000Z",
        "title": "Ashwamedh Elara India Dialogue Conference",
        "icsUrl": "https://in.marketscreener.com/api/stateful/agenda/event-async/Ashwamedh-Elara-India-Dialogue-Conference-50913411.ics"
      },
      {
        "section": "Past",
        "dateTimeRaw": "20/08/2025",
        "dateTimeISO": "2025-08-19T18:30:00.000Z",
        "title": "Antique Flagship India Conference - Build India, New India",
        "icsUrl": "https://in.marketscreener.com/api/stateful/agenda/event-async/Antique-Flagship-India-Conference-Build-India-New-India-50713804.ics"
      },
      {
        "section": "Past",
        "dateTimeRaw": "13/08/2025",
        "dateTimeISO": "2025-08-12T18:30:00.000Z",
        "title": "EMKAY Confluence Conference - India Ascending the Next Leap",
        "icsUrl": "https://in.marketscreener.com/api/stateful/agenda/event-async/EMKAY-Confluence-Conference-India-Ascending-the-Next-Leap-50713795.ics"
      },
      {
        "section": "Past",
        "dateTimeRaw": "06/08/2025",
        "dateTimeISO": "2025-08-05T18:30:00.000Z",
        "title": "Nuvama Institutional Equites India Conference",
        "icsUrl": "https://in.marketscreener.com/api/stateful/agenda/event-async/Nuvama-Institutional-Equites-India-Conference-50551485.ics"
      },
      {
        "section": "Past",
        "dateTimeRaw": "28/07/2025 11:00 am",
        "dateTimeISO": "2025-07-28T05:30:00.000Z",
        "title": "Q1 2026 Earnings Call",
        "icsUrl": "https://in.marketscreener.com/api/stateful/agenda/event-async/Q1-2026-Earnings-Call-50542493.ics"
      },
      {
        "section": "Past",
        "dateTimeRaw": "28/07/2025",
        "dateTimeISO": "2025-07-27T18:30:00.000Z",
        "title": "Analyst Meeting - ICICI Securities",
        "icsUrl": "https://in.marketscreener.com/api/stateful/agenda/event-async/Analyst-Meeting-ICICI-Securities-50542492.ics"
      },
      {
        "section": "Past",
        "dateTimeRaw": "25/07/2025 06:58 pm",
        "dateTimeISO": "2025-07-25T13:28:00.000Z",
        "title": "Q1 2026 Earnings Release",
        "icsUrl": "https://in.marketscreener.com/api/stateful/agenda/event-async/Q1-2026-Earnings-Release-47418977.ics"
      },
      {
        "section": "Past",
        "dateTimeRaw": "04/07/2025",
        "dateTimeISO": "2025-07-03T18:30:00.000Z",
        "title": "Final dividend",
        "icsUrl": "https://in.marketscreener.com/api/stateful/agenda/event-async/Final-dividend-50441518.ics"
      },
      {
        "section": "Past",
        "dateTimeRaw": "03/06/2025",
        "dateTimeISO": "2025-06-02T18:30:00.000Z",
        "title": "Bank of America Securities India Conference",
        "icsUrl": "https://in.marketscreener.com/api/stateful/agenda/event-async/Bank-of-America-Securities-India-Conference-50046394.ics"
      },
      {
        "section": "Past",
        "dateTimeRaw": "19/05/2025 05:33 pm",
        "dateTimeISO": "2025-05-19T12:03:00.000Z",
        "title": "Q4 2025 Earnings Release",
        "icsUrl": "https://in.marketscreener.com/api/stateful/agenda/event-async/Q4-2025-Earnings-Release-46742036.ics"
      },
      {
        "section": "Past",
        "dateTimeRaw": "20/05/2025 11:00 am",
        "dateTimeISO": "2025-05-20T05:30:00.000Z",
        "title": "Q4 2025 Earnings Call",
        "icsUrl": "https://in.marketscreener.com/api/stateful/agenda/event-async/Q4-2025-Earnings-Call-49922013.ics"
      },
      {
        "section": "Past",
        "dateTimeRaw": "05/03/2025",
        "dateTimeISO": "2025-03-04T18:30:00.000Z",
        "title": "UBS Emerging India Mid Caps Corporate Day",
        "icsUrl": "https://in.marketscreener.com/api/stateful/agenda/event-async/UBS-Emerging-India-Mid-Caps-Corporate-Day-49206648.ics"
      },
      {
        "section": "Past",
        "dateTimeRaw": "30/01/2025 03:37 pm",
        "dateTimeISO": "2025-01-30T10:07:00.000Z",
        "title": "Q3 2025 Earnings Release",
        "icsUrl": "https://in.marketscreener.com/api/stateful/agenda/event-async/Q3-2025-Earnings-Release-45662965.ics"
      },
      {
        "section": "Past",
        "dateTimeRaw": "28/01/2025 11:00 am",
        "dateTimeISO": "2025-01-28T05:30:00.000Z",
        "title": "Q3 2025 Earnings Call",
        "icsUrl": "https://in.marketscreener.com/api/stateful/agenda/event-async/Q3-2025-Earnings-Call-48809514.ics"
      },
      {
        "section": "Past",
        "dateTimeRaw": "21/11/2024",
        "dateTimeISO": "2024-11-20T18:30:00.000Z",
        "title": "Kotak Midcap Conference",
        "icsUrl": "https://in.marketscreener.com/api/stateful/agenda/event-async/Kotak-Midcap-Conference-48328950.ics"
      },
      {
        "section": "Past",
        "dateTimeRaw": "20/11/2024",
        "dateTimeISO": "2024-11-19T18:30:00.000Z",
        "title": "CITIC CLSA India Forum",
        "icsUrl": "https://in.marketscreener.com/api/stateful/agenda/event-async/CITIC-CLSA-India-Forum-48328948.ics"
      },
      {
        "section": "Past",
        "dateTimeRaw": "13/11/2024",
        "dateTimeISO": "2024-11-12T18:30:00.000Z",
        "title": "UBS India Summit",
        "icsUrl": "https://in.marketscreener.com/api/stateful/agenda/event-async/UBS-India-Summit-47845055.ics"
      },
      {
        "section": "Past",
        "dateTimeRaw": "08/11/2024",
        "dateTimeISO": "2024-11-07T18:30:00.000Z",
        "title": "Ex-dividend day for dividende intermédiaire",
        "icsUrl": "https://in.marketscreener.com/api/stateful/agenda/event-async/Ex-dividend-day-for-dividende-intermediaire-48240410.ics"
      },
      {
        "section": "Past",
        "dateTimeRaw": "24/10/2024 05:45 pm",
        "dateTimeISO": "2024-10-24T12:15:00.000Z",
        "title": "Q2 2025 Earnings Call",
        "icsUrl": "https://in.marketscreener.com/api/stateful/agenda/event-async/Q2-2025-Earnings-Call-48124672.ics"
      },
      {
        "section": "Past",
        "dateTimeRaw": "24/10/2024 04:25 pm",
        "dateTimeISO": "2024-10-24T10:55:00.000Z",
        "title": "Q2 2025 Earnings Release",
        "icsUrl": "https://in.marketscreener.com/api/stateful/agenda/event-async/Q2-2025-Earnings-Release-45076660.ics"
      },
      {
        "section": "Past",
        "dateTimeRaw": "23/09/2024",
        "dateTimeISO": "2024-09-22T18:30:00.000Z",
        "title": "J.P. Morgan India Investor Summit",
        "icsUrl": "https://in.marketscreener.com/api/stateful/agenda/event-async/J-P-Morgan-India-Investor-Summit-47845043.ics"
      },
      {
        "section": "Past",
        "dateTimeRaw": "18/09/2024",
        "dateTimeISO": "2024-09-17T18:30:00.000Z",
        "title": "Dolat Capital BFSI Conference",
        "icsUrl": "https://in.marketscreener.com/api/stateful/agenda/event-async/Dolat-Capital-BFSI-Conference-47845032.ics"
      },
      {
        "section": "Past",
        "dateTimeRaw": "06/09/2024 03:30 pm",
        "dateTimeISO": "2024-09-06T10:00:00.000Z",
        "title": "Annual General Meeting",
        "icsUrl": "https://in.marketscreener.com/api/stateful/agenda/event-async/Annual-General-Meeting-47486723.ics"
      },
      {
        "section": "Past",
        "dateTimeRaw": "30/08/2024",
        "dateTimeISO": "2024-08-29T18:30:00.000Z",
        "title": "Investor Meeting - Morgan Stanley",
        "icsUrl": "https://in.marketscreener.com/api/stateful/agenda/event-async/Investor-Meeting-Morgan-Stanley-47708859.ics"
      },
      {
        "section": "Past",
        "dateTimeRaw": "28/08/2024",
        "dateTimeISO": "2024-08-27T18:30:00.000Z",
        "title": "Citigroup Global Markets Corporate Day",
        "icsUrl": "https://in.marketscreener.com/api/stateful/agenda/event-async/Citigroup-Global-Markets-Corporate-Day-47708853.ics"
      },
      {
        "section": "Past",
        "dateTimeRaw": "13/08/2024",
        "dateTimeISO": "2024-08-12T18:30:00.000Z",
        "title": "Investor Meeting - Emkay Global",
        "icsUrl": "https://in.marketscreener.com/api/stateful/agenda/event-async/Investor-Meeting-Emkay-Global-46687155.ics"
      },
      {
        "section": "Past",
        "dateTimeRaw": "24/07/2024 05:30 pm",
        "dateTimeISO": "2024-07-24T12:00:00.000Z",
        "title": "Q1 2025 Earnings Call",
        "icsUrl": "https://in.marketscreener.com/api/stateful/agenda/event-async/Q1-2025-Earnings-Call-47418915.ics"
      },
      {
        "section": "Past",
        "dateTimeRaw": "24/07/2024 02:08 pm",
        "dateTimeISO": "2024-07-24T08:38:00.000Z",
        "title": "Q1 2025 Earnings Release",
        "icsUrl": "https://in.marketscreener.com/api/stateful/agenda/event-async/Q1-2025-Earnings-Release-44386047.ics"
      },
      {
        "section": "Past",
        "dateTimeRaw": "12/07/2024",
        "dateTimeISO": "2024-07-11T18:30:00.000Z",
        "title": "Final dividend",
        "icsUrl": "https://in.marketscreener.com/api/stateful/agenda/event-async/Final-dividend-47330295.ics"
      },
      {
        "section": "Past",
        "dateTimeRaw": "21/06/2024",
        "dateTimeISO": "2024-06-20T18:30:00.000Z",
        "title": "Investor Meeting - Philip Capital",
        "icsUrl": "https://in.marketscreener.com/api/stateful/agenda/event-async/Investor-Meeting-Philip-Capital-46836934.ics"
      },
      {
        "section": "Past",
        "dateTimeRaw": "29/05/2024",
        "dateTimeISO": "2024-05-28T18:30:00.000Z",
        "title": "Investor Meeting - B&K Securities",
        "icsUrl": "https://in.marketscreener.com/api/stateful/agenda/event-async/Investor-Meeting-B-K-Securities-46687133.ics"
      },
      {
        "section": "Past",
        "dateTimeRaw": "28/05/2024",
        "dateTimeISO": "2024-05-27T18:30:00.000Z",
        "title": "Investor Meeting - Nirmal Bang Securities",
        "icsUrl": "https://in.marketscreener.com/api/stateful/agenda/event-async/Investor-Meeting-Nirmal-Bang-Securities-46687128.ics"
      },
      {
        "section": "Past",
        "dateTimeRaw": "23/05/2024 12:00 pm",
        "dateTimeISO": "2024-05-23T06:30:00.000Z",
        "title": "Q4 2024 Earnings Call",
        "icsUrl": "https://in.marketscreener.com/api/stateful/agenda/event-async/Q4-2024-Earnings-Call-46778954.ics"
      },
      {
        "section": "Past",
        "dateTimeRaw": "22/05/2024 04:36 pm",
        "dateTimeISO": "2024-05-22T11:06:00.000Z",
        "title": "Q4 2024 Earnings Release",
        "icsUrl": "https://in.marketscreener.com/api/stateful/agenda/event-async/Q4-2024-Earnings-Release-43753173.ics"
      },
      {
        "section": "Past",
        "dateTimeRaw": "22/02/2024",
        "dateTimeISO": "2024-02-21T18:30:00.000Z",
        "title": "Investor Meeting - Kotak Securities Ltd",
        "icsUrl": "https://in.marketscreener.com/api/stateful/agenda/event-async/Investor-Meeting-Kotak-Securities-Ltd-45957211.ics"
      },
      {
        "section": "Past",
        "dateTimeRaw": "12/02/2024",
        "dateTimeISO": "2024-02-11T18:30:00.000Z",
        "title": "Investor Meeting - Phillip Capital",
        "icsUrl": "https://in.marketscreener.com/api/stateful/agenda/event-async/Investor-Meeting-Phillip-Capital-45957054.ics"
      },
      {
        "section": "Past",
        "dateTimeRaw": "30/01/2024 11:15 am",
        "dateTimeISO": "2024-01-30T05:45:00.000Z",
        "title": "Q3 2024 Earnings Call",
        "icsUrl": "https://in.marketscreener.com/api/stateful/agenda/event-async/Q3-2024-Earnings-Call-45808520.ics"
      },
      {
        "section": "Past",
        "dateTimeRaw": "29/01/2024 05:18 pm",
        "dateTimeISO": "2024-01-29T11:48:00.000Z",
        "title": "Q3 2024 Earnings Release",
        "icsUrl": "https://in.marketscreener.com/api/stateful/agenda/event-async/Q3-2024-Earnings-Release-42679864.ics"
      },
      {
        "section": "Past",
        "dateTimeRaw": "22/11/2023",
        "dateTimeISO": "2023-11-21T18:30:00.000Z",
        "title": "Investor Meeting",
        "icsUrl": "https://in.marketscreener.com/api/stateful/agenda/event-async/Investor-Meeting-45321821.ics"
      },
      {
        "section": "Past",
        "dateTimeRaw": "10/11/2023",
        "dateTimeISO": "2023-11-09T18:30:00.000Z",
        "title": "Ex-dividend day for dividende intermédiaire",
        "icsUrl": "https://in.marketscreener.com/api/stateful/agenda/event-async/Ex-dividend-day-for-dividende-intermediaire-45305172.ics"
      },
      {
        "section": "Past",
        "dateTimeRaw": "03/11/2023 04:00 pm",
        "dateTimeISO": "2023-11-03T10:30:00.000Z",
        "title": "Investor Meeting",
        "icsUrl": "https://in.marketscreener.com/api/stateful/agenda/event-async/Investor-Meeting-45321114.ics"
      },
      {
        "section": "Past",
        "dateTimeRaw": "30/10/2023 05:30 pm",
        "dateTimeISO": "2023-10-30T12:00:00.000Z",
        "title": "Q2 2024 Earnings Call",
        "icsUrl": "https://in.marketscreener.com/api/stateful/agenda/event-async/Q2-2024-Earnings-Call-45320895.ics"
      },
      {
        "section": "Past",
        "dateTimeRaw": "30/10/2023 01:58 pm",
        "dateTimeISO": "2023-10-30T08:28:00.000Z",
        "title": "Q2 2024 Earnings Release",
        "icsUrl": "https://in.marketscreener.com/api/stateful/agenda/event-async/Q2-2024-Earnings-Release-42142372.ics"
      },
      {
        "section": "Past",
        "dateTimeRaw": "28/09/2023 03:00 pm",
        "dateTimeISO": "2023-09-28T09:30:00.000Z",
        "title": "Annual General Meeting",
        "icsUrl": "https://in.marketscreener.com/api/stateful/agenda/event-async/Annual-General-Meeting-44613669.ics"
      },
      {
        "section": "Past",
        "dateTimeRaw": "18/08/2023",
        "dateTimeISO": "2023-08-17T18:30:00.000Z",
        "title": "Ex-dividend day for final dividend",
        "icsUrl": "https://in.marketscreener.com/api/stateful/agenda/event-async/Ex-dividend-day-for-final-dividend-44706277.ics"
      },
      {
        "section": "Past",
        "dateTimeRaw": "17/08/2023",
        "dateTimeISO": "2023-08-16T18:30:00.000Z",
        "title": "Investor Meeting",
        "icsUrl": "https://in.marketscreener.com/api/stateful/agenda/event-async/Investor-Meeting-44572550.ics"
      },
      {
        "section": "Past",
        "dateTimeRaw": "31/07/2023 06:30 pm",
        "dateTimeISO": "2023-07-31T13:00:00.000Z",
        "title": "Q1 2024 Earnings Call",
        "icsUrl": "https://in.marketscreener.com/api/stateful/agenda/event-async/Q1-2024-Earnings-Call-44557891.ics"
      },
      {
        "section": "Past",
        "dateTimeRaw": "31/07/2023 04:31 pm",
        "dateTimeISO": "2023-07-31T11:01:00.000Z",
        "title": "Q1 2024 Earnings Release",
        "icsUrl": "https://in.marketscreener.com/api/stateful/agenda/event-async/Q1-2024-Earnings-Release-41002344.ics"
      },
      {
        "section": "Past",
        "dateTimeRaw": "03/05/2023 06:30 pm",
        "dateTimeISO": "2023-05-03T13:00:00.000Z",
        "title": "Q4 2023 Earnings Call",
        "icsUrl": "https://in.marketscreener.com/api/stateful/agenda/event-async/Q4-2023-Earnings-Call-43753091.ics"
      },
      {
        "section": "Past",
        "dateTimeRaw": "03/05/2023 04:53 pm",
        "dateTimeISO": "2023-05-03T11:23:00.000Z",
        "title": "Q4 2023 Earnings Release",
        "icsUrl": "https://in.marketscreener.com/api/stateful/agenda/event-async/Q4-2023-Earnings-Release-40306487.ics"
      },
      {
        "section": "Past",
        "dateTimeRaw": "20/01/2023 06:30 pm",
        "dateTimeISO": "2023-01-20T13:00:00.000Z",
        "title": "Q3 2023 Earnings Call",
        "icsUrl": "https://in.marketscreener.com/api/stateful/agenda/event-async/Q3-2023-Earnings-Call-42782898.ics"
      },
      {
        "section": "Past",
        "dateTimeRaw": "20/01/2023 05:40 pm",
        "dateTimeISO": "2023-01-20T12:10:00.000Z",
        "title": "Q3 2023 Earnings Release",
        "icsUrl": "https://in.marketscreener.com/api/stateful/agenda/event-async/Q3-2023-Earnings-Release-37680171.ics"
      },
      {
        "section": "Past",
        "dateTimeRaw": "21/11/2022",
        "dateTimeISO": "2022-11-20T18:30:00.000Z",
        "title": "Ex-dividend day for extraordinary dividend",
        "icsUrl": "https://in.marketscreener.com/api/stateful/agenda/event-async/Ex-dividend-day-for-extraordinary-dividend-42298593.ics"
      },
      {
        "section": "Past",
        "dateTimeRaw": "10/11/2022 12:30 pm",
        "dateTimeISO": "2022-11-10T07:00:00.000Z",
        "title": "Interim 2023 Earnings Call",
        "icsUrl": "https://in.marketscreener.com/api/stateful/agenda/event-async/Interim-2023-Earnings-Call-42292231.ics"
      },
      {
        "section": "Past",
        "dateTimeRaw": "09/11/2022 07:17 pm",
        "dateTimeISO": "2022-11-09T13:47:00.000Z",
        "title": "Interim 2023 Earnings Release",
        "icsUrl": "https://in.marketscreener.com/api/stateful/agenda/event-async/Interim-2023-Earnings-Release-37008191.ics"
      },
      {
        "section": "Past",
        "dateTimeRaw": "21/09/2022 07:30 pm",
        "dateTimeISO": "2022-09-21T14:00:00.000Z",
        "title": "Annual General Meeting",
        "icsUrl": "https://in.marketscreener.com/api/stateful/agenda/event-async/Annual-General-Meeting-41687246.ics"
      },
      {
        "section": "Past",
        "dateTimeRaw": "05/08/2022 06:15 pm",
        "dateTimeISO": "2022-08-05T12:45:00.000Z",
        "title": "Q1 2023 Earnings Call",
        "icsUrl": "https://in.marketscreener.com/api/stateful/agenda/event-async/Q1-2023-Earnings-Call-41226745.ics"
      },
      {
        "section": "Past",
        "dateTimeRaw": "05/08/2022 04:25 pm",
        "dateTimeISO": "2022-08-05T10:55:00.000Z",
        "title": "Q1 2023 Earnings Release",
        "icsUrl": "https://in.marketscreener.com/api/stateful/agenda/event-async/Q1-2023-Earnings-Release-36028879.ics"
      },
      {
        "section": "Past",
        "dateTimeRaw": "04/07/2022",
        "dateTimeISO": "2022-07-03T18:30:00.000Z",
        "title": "Ex-dividend day for final dividend",
        "icsUrl": "https://in.marketscreener.com/api/stateful/agenda/event-async/Ex-dividend-day-for-final-dividend-40817063.ics"
      },
      {
        "section": "Past",
        "dateTimeRaw": "12/05/2022 02:30 pm",
        "dateTimeISO": "2022-05-12T09:00:00.000Z",
        "title": "FY 2022 Earnings Call",
        "icsUrl": "https://in.marketscreener.com/api/stateful/agenda/event-async/FY-2022-Earnings-Call-40497256.ics"
      },
      {
        "section": "Past",
        "dateTimeRaw": "11/05/2022 06:42 pm",
        "dateTimeISO": "2022-05-11T13:12:00.000Z",
        "title": "FY 2022 Earnings Release",
        "icsUrl": "https://in.marketscreener.com/api/stateful/agenda/event-async/FY-2022-Earnings-Release-35525746.ics"
      },
      {
        "section": "Past",
        "dateTimeRaw": "10/02/2022 02:30 pm",
        "dateTimeISO": "2022-02-10T09:00:00.000Z",
        "title": "Q3 2022 Earnings Call",
        "icsUrl": "https://in.marketscreener.com/api/stateful/agenda/event-async/Q3-2022-Earnings-Call-37789160.ics"
      },
      {
        "section": "Past",
        "dateTimeRaw": "09/02/2022 05:46 pm",
        "dateTimeISO": "2022-02-09T12:16:00.000Z",
        "title": "Q3 2022 Earnings Release",
        "icsUrl": "https://in.marketscreener.com/api/stateful/agenda/event-async/Q3-2022-Earnings-Release-32316923.ics"
      },
      {
        "section": "Past",
        "dateTimeRaw": "17/11/2021",
        "dateTimeISO": "2021-11-16T18:30:00.000Z",
        "title": "Ex-dividend day for extraordinary dividend",
        "icsUrl": "https://in.marketscreener.com/api/stateful/agenda/event-async/Ex-dividend-day-for-extraordinary-dividend-37015389.ics"
      },
      {
        "section": "Past",
        "dateTimeRaw": "10/11/2021 02:30 pm",
        "dateTimeISO": "2021-11-10T09:00:00.000Z",
        "title": "Interim 2022 Earnings Call",
        "icsUrl": "https://in.marketscreener.com/api/stateful/agenda/event-async/Interim-2022-Earnings-Call-37007795.ics"
      },
      {
        "section": "Past",
        "dateTimeRaw": "09/11/2021 06:22 pm",
        "dateTimeISO": "2021-11-09T12:52:00.000Z",
        "title": "Interim 2022 Earnings Release",
        "icsUrl": "https://in.marketscreener.com/api/stateful/agenda/event-async/Interim-2022-Earnings-Release-31608878.ics"
      },
      {
        "section": "Past",
        "dateTimeRaw": "28/09/2021 03:00 pm",
        "dateTimeISO": "2021-09-28T09:30:00.000Z",
        "title": "Annual General Meeting",
        "icsUrl": "https://in.marketscreener.com/api/stateful/agenda/event-async/Annual-General-Meeting-36324188.ics"
      },
      {
        "section": "Past",
        "dateTimeRaw": "16/08/2021 02:30 pm",
        "dateTimeISO": "2021-08-16T09:00:00.000Z",
        "title": "Q1 2022 Earnings Call",
        "icsUrl": "https://in.marketscreener.com/api/stateful/agenda/event-async/Q1-2022-Earnings-Call-36323838.ics"
      },
      {
        "section": "Past",
        "dateTimeRaw": "13/08/2021 09:00 pm",
        "dateTimeISO": "2021-08-13T15:30:00.000Z",
        "title": "Q1 2022 Earnings Release",
        "icsUrl": "https://in.marketscreener.com/api/stateful/agenda/event-async/Q1-2022-Earnings-Release-31124482.ics"
      },
      {
        "section": "Past",
        "dateTimeRaw": "01/07/2021",
        "dateTimeISO": "2021-06-30T18:30:00.000Z",
        "title": "Ex-dividend day for final dividend",
        "icsUrl": "https://in.marketscreener.com/api/stateful/agenda/event-async/Ex-dividend-day-for-final-dividend-35707670.ics"
      },
      {
        "section": "Past",
        "dateTimeRaw": "09/06/2021 12:30 pm",
        "dateTimeISO": "2021-06-09T07:00:00.000Z",
        "title": "FY 2021 Earnings Call",
        "icsUrl": "https://in.marketscreener.com/api/stateful/agenda/event-async/FY-2021-Earnings-Call-35590241.ics"
      },
      {
        "section": "Past",
        "dateTimeRaw": "08/06/2021",
        "dateTimeISO": "2021-06-07T18:30:00.000Z",
        "title": "FY 2021 Earnings Release",
        "icsUrl": "https://in.marketscreener.com/api/stateful/agenda/event-async/FY-2021-Earnings-Release-30834002.ics"
      },
      {
        "section": "Past",
        "dateTimeRaw": "12/02/2021 12:30 pm",
        "dateTimeISO": "2021-02-12T07:00:00.000Z",
        "title": "Q3 2021 Earnings Call",
        "icsUrl": "https://in.marketscreener.com/api/stateful/agenda/event-async/Q3-2021-Earnings-Call-32434311.ics"
      },
      {
        "section": "Past",
        "dateTimeRaw": "11/02/2021",
        "dateTimeISO": "2021-02-10T18:30:00.000Z",
        "title": "Q3 2021 Earnings Release",
        "icsUrl": "https://in.marketscreener.com/api/stateful/agenda/event-async/Q3-2021-Earnings-Release-29965435.ics"
      },
      {
        "section": "Past",
        "dateTimeRaw": "23/11/2020",
        "dateTimeISO": "2020-11-22T18:30:00.000Z",
        "title": "Ex-dividend day for extraordinary dividend",
        "icsUrl": "https://in.marketscreener.com/api/stateful/agenda/event-async/Ex-dividend-day-for-extraordinary-dividend-31786269.ics"
      },
      {
        "section": "Past",
        "dateTimeRaw": "04/11/2020",
        "dateTimeISO": "2020-11-03T18:30:00.000Z",
        "title": "Interim 2021 Earnings Release",
        "icsUrl": "https://in.marketscreener.com/api/stateful/agenda/event-async/Interim-2021-Earnings-Release-29462817.ics"
      },
      {
        "section": "Past",
        "dateTimeRaw": "10/09/2020 02:00 pm",
        "dateTimeISO": "2020-09-10T08:30:00.000Z",
        "title": "Annual General Meeting",
        "icsUrl": "https://in.marketscreener.com/api/stateful/agenda/event-async/Annual-General-Meeting-31083126.ics"
      },
      {
        "section": "Past",
        "dateTimeRaw": "18/08/2020 11:00 am",
        "dateTimeISO": "2020-08-18T05:30:00.000Z",
        "title": "Q1 2021 Earnings Call",
        "icsUrl": "https://in.marketscreener.com/api/stateful/agenda/event-async/Q1-2021-Earnings-Call-31159292.ics"
      },
      {
        "section": "Past",
        "dateTimeRaw": "17/08/2020",
        "dateTimeISO": "2020-08-16T18:30:00.000Z",
        "title": "Q1 2021 Earnings Release",
        "icsUrl": "https://in.marketscreener.com/api/stateful/agenda/event-async/Q1-2021-Earnings-Release-28970984.ics"
      },
      {
        "section": "Past",
        "dateTimeRaw": "15/07/2020",
        "dateTimeISO": "2020-07-14T18:30:00.000Z",
        "title": "Ex-dividend day for final dividend",
        "icsUrl": "https://in.marketscreener.com/api/stateful/agenda/event-async/Ex-dividend-day-for-final-dividend-30879343.ics"
      },
      {
        "section": "Past",
        "dateTimeRaw": "30/06/2020 11:00 am",
        "dateTimeISO": "2020-06-30T05:30:00.000Z",
        "title": "FY 2020 Earnings Call",
        "icsUrl": "https://in.marketscreener.com/api/stateful/agenda/event-async/FY-2020-Earnings-Call-30833868.ics"
      },
      {
        "section": "Past",
        "dateTimeRaw": "29/06/2020",
        "dateTimeISO": "2020-06-28T18:30:00.000Z",
        "title": "FY 2020 Earnings Release",
        "icsUrl": "https://in.marketscreener.com/api/stateful/agenda/event-async/FY-2020-Earnings-Release-30833843.ics"
      },
      {
        "section": "Past",
        "dateTimeRaw": "11/02/2020 09:00 am",
        "dateTimeISO": "2020-02-11T03:30:00.000Z",
        "title": "Q3 2020 Earnings Call",
        "icsUrl": "https://in.marketscreener.com/api/stateful/agenda/event-async/Q3-2020-Earnings-Call-29963142.ics"
      },
      {
        "section": "Past",
        "dateTimeRaw": "10/02/2020",
        "dateTimeISO": "2020-02-09T18:30:00.000Z",
        "title": "Q3 2020 Earnings Release",
        "icsUrl": "https://in.marketscreener.com/api/stateful/agenda/event-async/Q3-2020-Earnings-Release-27956343.ics"
      },
      {
        "section": "Past",
        "dateTimeRaw": "07/11/2019",
        "dateTimeISO": "2019-11-06T18:30:00.000Z",
        "title": "Ex-dividend day for extraordinary dividend",
        "icsUrl": "https://in.marketscreener.com/api/stateful/agenda/event-async/Ex-dividend-day-for-extraordinary-dividend-29507216.ics"
      },
      {
        "section": "Past",
        "dateTimeRaw": "30/10/2019 11:00 am",
        "dateTimeISO": "2019-10-30T05:30:00.000Z",
        "title": "Interim 2020 Earnings Call",
        "icsUrl": "https://in.marketscreener.com/api/stateful/agenda/event-async/Interim-2020-Earnings-Call-29460013.ics"
      },
      {
        "section": "Past",
        "dateTimeRaw": "29/10/2019",
        "dateTimeISO": "2019-10-28T18:30:00.000Z",
        "title": "Interim 2020 Earnings Release",
        "icsUrl": "https://in.marketscreener.com/api/stateful/agenda/event-async/Interim-2020-Earnings-Release-27956206.ics"
      },
      {
        "section": "Past",
        "dateTimeRaw": "13/10/2019",
        "dateTimeISO": "2019-10-12T18:30:00.000Z",
        "title": "IHS Markit CERAWeek India Energy Forum",
        "icsUrl": "https://in.marketscreener.com/api/stateful/agenda/event-async/IHS-Markit-CERAWeek-India-Energy-Forum-29394370.ics"
      },
      {
        "section": "Past",
        "dateTimeRaw": "27/08/2019",
        "dateTimeISO": "2019-08-26T18:30:00.000Z",
        "title": "Annual General Meeting",
        "icsUrl": "https://in.marketscreener.com/api/stateful/agenda/event-async/Annual-General-Meeting-29008306.ics"
      },
      {
        "section": "Past",
        "dateTimeRaw": "19/08/2019",
        "dateTimeISO": "2019-08-18T18:30:00.000Z",
        "title": "Ex-dividend day for final dividend",
        "icsUrl": "https://in.marketscreener.com/api/stateful/agenda/event-async/Ex-dividend-day-for-final-dividend-28972648.ics"
      },
      {
        "section": "Past",
        "dateTimeRaw": "08/08/2019 10:30 am",
        "dateTimeISO": "2019-08-08T05:00:00.000Z",
        "title": "Q1 2020 Earnings Call",
        "icsUrl": "https://in.marketscreener.com/api/stateful/agenda/event-async/Q1-2020-Earnings-Call-29044557.ics"
      },
      {
        "section": "Past",
        "dateTimeRaw": "07/08/2019",
        "dateTimeISO": "2019-08-06T18:30:00.000Z",
        "title": "Q1 2020 Earnings Release",
        "icsUrl": "https://in.marketscreener.com/api/stateful/agenda/event-async/Q1-2020-Earnings-Release-27955962.ics"
      },
      {
        "section": "Past",
        "dateTimeRaw": "04/06/2019",
        "dateTimeISO": "2019-06-03T18:30:00.000Z",
        "title": "Citi India Investor Conference",
        "icsUrl": "https://in.marketscreener.com/api/stateful/agenda/event-async/Citi-India-Investor-Conference-28657439.ics"
      },
      {
        "section": "Past",
        "dateTimeRaw": "15/05/2019",
        "dateTimeISO": "2019-05-14T18:30:00.000Z",
        "title": "FY 2019 Earnings Release",
        "icsUrl": "https://in.marketscreener.com/api/stateful/agenda/event-async/FY-2019-Earnings-Release-27955887.ics"
      },
      {
        "section": "Past",
        "dateTimeRaw": "01/02/2019 10:00 am",
        "dateTimeISO": "2019-02-01T04:30:00.000Z",
        "title": "Q3 2019 Earnings Call",
        "icsUrl": "https://in.marketscreener.com/api/stateful/agenda/event-async/Q3-2019-Earnings-Call-27953615.ics"
      },
      {
        "section": "Past",
        "dateTimeRaw": "31/01/2019",
        "dateTimeISO": "2019-01-30T18:30:00.000Z",
        "title": "Q3 2019 Earnings Release",
        "icsUrl": "https://in.marketscreener.com/api/stateful/agenda/event-async/Q3-2019-Earnings-Release-27918195.ics"
      },
      {
        "section": "Past",
        "dateTimeRaw": "15/11/2018",
        "dateTimeISO": "2018-11-14T18:30:00.000Z",
        "title": "Ex-dividend day for extraordinary dividend",
        "icsUrl": "https://in.marketscreener.com/api/stateful/agenda/event-async/Ex-dividend-day-for-extraordinary-dividend-27543855.ics"
      },
      {
        "section": "Past",
        "dateTimeRaw": "05/11/2018 10:30 am",
        "dateTimeISO": "2018-11-05T05:00:00.000Z",
        "title": "Interim 2019 Earnings Call",
        "icsUrl": "https://in.marketscreener.com/api/stateful/agenda/event-async/Interim-2019-Earnings-Call-27538336.ics"
      },
      {
        "section": "Past",
        "dateTimeRaw": "14/10/2018",
        "dateTimeISO": "2018-10-13T18:30:00.000Z",
        "title": "CERAWeek India Energy Forum",
        "icsUrl": "https://in.marketscreener.com/api/stateful/agenda/event-async/CERAWeek-India-Energy-Forum-27415319.ics"
      },
      {
        "section": "Past",
        "dateTimeRaw": "14/09/2018 09:30 am",
        "dateTimeISO": "2018-09-14T04:00:00.000Z",
        "title": "Annual General Meeting",
        "icsUrl": "https://in.marketscreener.com/api/stateful/agenda/event-async/Annual-General-Meeting-27230905.ics"
      },
      {
        "section": "Past",
        "dateTimeRaw": "06/09/2018",
        "dateTimeISO": "2018-09-05T18:30:00.000Z",
        "title": "Ex-dividend day for final dividend",
        "icsUrl": "https://in.marketscreener.com/api/stateful/agenda/event-async/Ex-dividend-day-for-final-dividend-27165906.ics"
      },
      {
        "section": "Past",
        "dateTimeRaw": "26/07/2018",
        "dateTimeISO": "2018-07-25T18:30:00.000Z",
        "title": "Q1 2019 Earnings Release",
        "icsUrl": "https://in.marketscreener.com/api/stateful/agenda/event-async/Q1-2019-Earnings-Release-26968082.ics"
      },
      {
        "section": "Past",
        "dateTimeRaw": "22/05/2018 10:30 am",
        "dateTimeISO": "2018-05-22T05:00:00.000Z",
        "title": "FY 2018 Earnings Call",
        "icsUrl": "https://in.marketscreener.com/api/stateful/agenda/event-async/FY-2018-Earnings-Call-26661075.ics"
      },
      {
        "section": "Past",
        "dateTimeRaw": "21/05/2018",
        "dateTimeISO": "2018-05-20T18:30:00.000Z",
        "title": "FY 2018 Earnings Release",
        "icsUrl": "https://in.marketscreener.com/api/stateful/agenda/event-async/FY-2018-Earnings-Release-26570688.ics"
      },
      {
        "section": "Past",
        "dateTimeRaw": "09/02/2018 10:00 am",
        "dateTimeISO": "2018-02-09T04:30:00.000Z",
        "title": "Q3 2018 Earnings Call",
        "icsUrl": "https://in.marketscreener.com/api/stateful/agenda/event-async/Q3-2018-Earnings-Call-25966694.ics"
      },
      {
        "section": "Past",
        "dateTimeRaw": "08/02/2018",
        "dateTimeISO": "2018-02-07T18:30:00.000Z",
        "title": "Q3 2018 Earnings Release",
        "icsUrl": "https://in.marketscreener.com/api/stateful/agenda/event-async/Q3-2018-Earnings-Release-23816394.ics"
      },
      {
        "section": "Past",
        "dateTimeRaw": "08/11/2017",
        "dateTimeISO": "2017-11-07T18:30:00.000Z",
        "title": "Interim 2018 Earnings Release",
        "icsUrl": "https://in.marketscreener.com/api/stateful/agenda/event-async/Interim-2018-Earnings-Release-23814545.ics"
      },
      {
        "section": "Past",
        "dateTimeRaw": "15/09/2017",
        "dateTimeISO": "2017-09-14T18:30:00.000Z",
        "title": "Annual General Meeting",
        "icsUrl": "https://in.marketscreener.com/api/stateful/agenda/event-async/Annual-General-Meeting-24975125.ics"
      },
      {
        "section": "Past",
        "dateTimeRaw": "07/09/2017",
        "dateTimeISO": "2017-09-06T18:30:00.000Z",
        "title": "Ex-dividend day for final dividend",
        "icsUrl": "https://in.marketscreener.com/api/stateful/agenda/event-async/Ex-dividend-day-for-final-dividend-24977872.ics"
      },
      {
        "section": "Past",
        "dateTimeRaw": "10/08/2017",
        "dateTimeISO": "2017-08-09T18:30:00.000Z",
        "title": "Q1 2018 Earnings Release",
        "icsUrl": "https://in.marketscreener.com/api/stateful/agenda/event-async/Q1-2018-Earnings-Release-22851920.ics"
      },
      {
        "section": "Past",
        "dateTimeRaw": "03/07/2017",
        "dateTimeISO": "2017-07-02T18:30:00.000Z",
        "title": "Bonus Issue: 1 new share for 1 existing share",
        "icsUrl": "https://in.marketscreener.com/api/stateful/agenda/event-async/Bonus-Issue-1-new-share-for-1-existing-share-24688679.ics"
      },
      {
        "section": "Past",
        "dateTimeRaw": "09/05/2017",
        "dateTimeISO": "2017-05-08T18:30:00.000Z",
        "title": "FY 2017 Earnings Release",
        "icsUrl": "https://in.marketscreener.com/api/stateful/agenda/event-async/FY-2017-Earnings-Release-22841336.ics"
      },
      {
        "section": "Past",
        "dateTimeRaw": "13/02/2017",
        "dateTimeISO": "2017-02-12T18:30:00.000Z",
        "title": "Q3 2017 Earnings Release",
        "icsUrl": "https://in.marketscreener.com/api/stateful/agenda/event-async/Q3-2017-Earnings-Release-22830083.ics"
      },
      {
        "section": "Past",
        "dateTimeRaw": "17/11/2016",
        "dateTimeISO": "2016-11-16T18:30:00.000Z",
        "title": "Interim 2017 Earnings Release",
        "icsUrl": "https://in.marketscreener.com/api/stateful/agenda/event-async/Interim-2017-Earnings-Release-21181393.ics"
      },
      {
        "section": "Past",
        "dateTimeRaw": "21/09/2016 09:30 am",
        "dateTimeISO": "2016-09-21T04:00:00.000Z",
        "title": "Annual General Meeting",
        "icsUrl": "https://in.marketscreener.com/api/stateful/agenda/event-async/Annual-General-Meeting-23036694.ics"
      },
      {
        "section": "Past",
        "dateTimeRaw": "12/09/2016",
        "dateTimeISO": "2016-09-11T18:30:00.000Z",
        "title": "Ex-dividend day for final dividend",
        "icsUrl": "https://in.marketscreener.com/api/stateful/agenda/event-async/Ex-dividend-day-for-final-dividend-22967027.ics"
      },
      {
        "section": "Past",
        "dateTimeRaw": "05/09/2016",
        "dateTimeISO": "2016-09-04T18:30:00.000Z",
        "title": "Q1 2017 Earnings Release",
        "icsUrl": "https://in.marketscreener.com/api/stateful/agenda/event-async/Q1-2017-Earnings-Release-20958333.ics"
      },
      {
        "section": "Past",
        "dateTimeRaw": "16/05/2016",
        "dateTimeISO": "2016-05-15T18:30:00.000Z",
        "title": "FY 2016 Earnings Release",
        "icsUrl": "https://in.marketscreener.com/api/stateful/agenda/event-async/FY-2016-Earnings-Release-20954485.ics"
      },
      {
        "section": "Past",
        "dateTimeRaw": "10/02/2016",
        "dateTimeISO": "2016-02-09T18:30:00.000Z",
        "title": "Q3 2016 Earnings Release",
        "icsUrl": "https://in.marketscreener.com/api/stateful/agenda/event-async/Q3-2016-Earnings-Release-20949803.ics"
      },
      {
        "section": "Past",
        "dateTimeRaw": "19/10/2015",
        "dateTimeISO": "2015-10-18T18:30:00.000Z",
        "title": "Interim 2016 Earnings Release",
        "icsUrl": "https://in.marketscreener.com/api/stateful/agenda/event-async/Interim-2016-Earnings-Release-19176031.ics"
      },
      {
        "section": "Past",
        "dateTimeRaw": "24/09/2015 09:30 am",
        "dateTimeISO": "2015-09-24T04:00:00.000Z",
        "title": "Annual General Meeting",
        "icsUrl": "https://in.marketscreener.com/api/stateful/agenda/event-async/Annual-General-Meeting-20997796.ics"
      },
      {
        "section": "Past",
        "dateTimeRaw": "15/09/2015",
        "dateTimeISO": "2015-09-14T18:30:00.000Z",
        "title": "Ex-dividend day for final dividend",
        "icsUrl": "https://in.marketscreener.com/api/stateful/agenda/event-async/Ex-dividend-day-for-final-dividend-21000025.ics"
      },
      {
        "section": "Past",
        "dateTimeRaw": "30/07/2015",
        "dateTimeISO": "2015-07-29T18:30:00.000Z",
        "title": "Q1 2016 Earnings Release",
        "icsUrl": "https://in.marketscreener.com/api/stateful/agenda/event-async/Q1-2016-Earnings-Release-18722797.ics"
      },
      {
        "section": "Past",
        "dateTimeRaw": "25/04/2015 04:00 pm",
        "dateTimeISO": "2015-04-25T10:30:00.000Z",
        "title": "FY 2015 Earnings Call",
        "icsUrl": "https://in.marketscreener.com/api/stateful/agenda/event-async/FY-2015-Earnings-Call-20257167.ics"
      },
      {
        "section": "Past",
        "dateTimeRaw": "25/04/2015",
        "dateTimeISO": "2015-04-24T18:30:00.000Z",
        "title": "FY 2015 Earnings Release",
        "icsUrl": "https://in.marketscreener.com/api/stateful/agenda/event-async/FY-2015-Earnings-Release-18255440.ics"
      },
      {
        "section": "Past",
        "dateTimeRaw": "05/02/2015",
        "dateTimeISO": "2015-02-04T18:30:00.000Z",
        "title": "Q3 2015 Earnings Release",
        "icsUrl": "https://in.marketscreener.com/api/stateful/agenda/event-async/Q3-2015-Earnings-Release-17787295.ics"
      },
      {
        "section": "Past",
        "dateTimeRaw": "20/06/2013",
        "dateTimeISO": "2013-06-19T18:30:00.000Z",
        "title": "Ex-dividend day for final dividend",
        "icsUrl": "https://in.marketscreener.com/api/stateful/agenda/event-async/Ex-dividend-day-for-final-dividend-17046008.ics"
      },
      {
        "section": "Past",
        "dateTimeRaw": "21/06/2012",
        "dateTimeISO": "2012-06-20T18:30:00.000Z",
        "title": "Ex-dividend day for final dividend",
        "icsUrl": "https://in.marketscreener.com/api/stateful/agenda/event-async/Ex-dividend-day-for-final-dividend-15307463.ics"
      }
    ]
  },
  "pastDividends": {
    "count": 26,
    "dividends": [
      {
        "section": "Past Dividends",
        "dateRaw": "04/07/2025",
        "dateISO": "2025-07-03T18:30:00.000Z",
        "type": "Final Payment",
        "amount": 3,
        "currency": "INR",
        "title": "Final Payment 3 INR"
      },
      {
        "section": "Past Dividends",
        "dateRaw": "08/11/2024",
        "dateISO": "2024-11-07T18:30:00.000Z",
        "type": "Interim Payment",
        "amount": 7,
        "currency": "INR",
        "title": "Interim Payment 7 INR"
      },
      {
        "section": "Past Dividends",
        "dateRaw": "12/07/2024",
        "dateISO": "2024-07-11T18:30:00.000Z",
        "type": "Final Payment",
        "amount": 3,
        "currency": "INR",
        "title": "Final Payment 3 INR"
      },
      {
        "section": "Past Dividends",
        "dateRaw": "10/11/2023",
        "dateISO": "2023-11-09T18:30:00.000Z",
        "type": "Interim Payment",
        "amount": 7,
        "currency": "INR",
        "title": "Interim Payment 7 INR"
      },
      {
        "section": "Past Dividends",
        "dateRaw": "18/08/2023",
        "dateISO": "2023-08-17T18:30:00.000Z",
        "type": "Annual",
        "amount": 3,
        "currency": "INR",
        "title": "Annual 3 INR"
      },
      {
        "section": "Past Dividends",
        "dateRaw": "21/11/2022",
        "dateISO": "2022-11-20T18:30:00.000Z",
        "type": "Bonus Payment",
        "amount": 7,
        "currency": "INR",
        "title": "Bonus Payment 7 INR"
      },
      {
        "section": "Past Dividends",
        "dateRaw": "04/07/2022",
        "dateISO": "2022-07-03T18:30:00.000Z",
        "type": "Annual",
        "amount": 4.5,
        "currency": "INR",
        "title": "Annual 4.5 INR"
      },
      {
        "section": "Past Dividends",
        "dateRaw": "17/11/2021",
        "dateISO": "2021-11-16T18:30:00.000Z",
        "type": "Bonus Payment",
        "amount": 7,
        "currency": "INR",
        "title": "Bonus Payment 7 INR"
      },
      {
        "section": "Past Dividends",
        "dateRaw": "01/07/2021",
        "dateISO": "2021-06-30T18:30:00.000Z",
        "type": "Annual",
        "amount": 3.5,
        "currency": "INR",
        "title": "Annual 3.5 INR"
      },
      {
        "section": "Past Dividends",
        "dateRaw": "23/11/2020",
        "dateISO": "2020-11-22T18:30:00.000Z",
        "type": "Bonus Payment",
        "amount": 8,
        "currency": "INR",
        "title": "Bonus Payment 8 INR"
      },
      {
        "section": "Past Dividends",
        "dateRaw": "15/07/2020",
        "dateISO": "2020-07-14T18:30:00.000Z",
        "type": "Annual",
        "amount": 7,
        "currency": "INR",
        "title": "Annual 7 INR"
      },
      {
        "section": "Past Dividends",
        "dateRaw": "07/11/2019",
        "dateISO": "2019-11-06T18:30:00.000Z",
        "type": "Bonus Payment",
        "amount": 5.5,
        "currency": "INR",
        "title": "Bonus Payment 5.5 INR"
      },
      {
        "section": "Past Dividends",
        "dateRaw": "19/08/2019",
        "dateISO": "2019-08-18T18:30:00.000Z",
        "type": "Annual",
        "amount": 4.5,
        "currency": "INR",
        "title": "Annual 4.5 INR"
      },
      {
        "section": "Past Dividends",
        "dateRaw": "15/11/2018",
        "dateISO": "2018-11-14T18:30:00.000Z",
        "type": "Bonus Payment",
        "amount": 5.5,
        "currency": "INR",
        "title": "Bonus Payment 5.5 INR"
      },
      {
        "section": "Past Dividends",
        "dateRaw": "06/09/2018",
        "dateISO": "2018-09-05T18:30:00.000Z",
        "type": "Annual",
        "amount": 4.5,
        "currency": "INR",
        "title": "Annual 4.5 INR"
      },
      {
        "section": "Past Dividends",
        "dateRaw": "07/09/2017",
        "dateISO": "2017-09-06T18:30:00.000Z",
        "type": "Annual",
        "amount": 2.5,
        "currency": "INR",
        "title": "Annual 2.5 INR"
      },
      {
        "section": "Past Dividends",
        "dateRaw": "12/09/2016",
        "dateISO": "2016-09-11T18:30:00.000Z",
        "type": "Annual",
        "amount": 2.5,
        "currency": "INR",
        "title": "Annual 2.5 INR"
      },
      {
        "section": "Past Dividends",
        "dateRaw": "15/09/2015",
        "dateISO": "2015-09-14T18:30:00.000Z",
        "type": "Annual",
        "amount": 2,
        "currency": "INR",
        "title": "Annual 2 INR"
      },
      {
        "section": "Past Dividends",
        "dateRaw": "04/09/2014",
        "dateISO": "2014-09-03T18:30:00.000Z",
        "type": "Annual",
        "amount": 2,
        "currency": "INR",
        "title": "Annual 2 INR"
      },
      {
        "section": "Past Dividends",
        "dateRaw": "20/06/2013",
        "dateISO": "2013-06-19T18:30:00.000Z",
        "type": "Annual",
        "amount": 2.5,
        "currency": "INR",
        "title": "Annual 2.5 INR"
      },
      {
        "section": "Past Dividends",
        "dateRaw": "21/06/2012",
        "dateISO": "2012-06-20T18:30:00.000Z",
        "type": "Annual",
        "amount": 2.5,
        "currency": "INR",
        "title": "Annual 2.5 INR"
      },
      {
        "section": "Past Dividends",
        "dateRaw": "16/06/2011",
        "dateISO": "2011-06-15T18:30:00.000Z",
        "type": "Annual",
        "amount": 2,
        "currency": "INR",
        "title": "Annual 2 INR"
      },
      {
        "section": "Past Dividends",
        "dateRaw": "10/06/2010",
        "dateISO": "2010-06-09T18:30:00.000Z",
        "type": "Annual",
        "amount": 1.75,
        "currency": "INR",
        "title": "Annual 1.75 INR"
      },
      {
        "section": "Past Dividends",
        "dateRaw": "11/06/2009",
        "dateISO": "2009-06-10T18:30:00.000Z",
        "type": "Annual",
        "amount": 1.75,
        "currency": "INR",
        "title": "Annual 1.75 INR"
      },
      {
        "section": "Past Dividends",
        "dateRaw": "22/05/2008",
        "dateISO": "2008-05-21T18:30:00.000Z",
        "type": "Annual",
        "amount": 1.5,
        "currency": "INR",
        "title": "Annual 1.5 INR"
      },
      {
        "section": "Past Dividends",
        "dateRaw": "30/05/2007",
        "dateISO": "2007-05-29T18:30:00.000Z",
        "type": "Annual",
        "amount": 1.25,
        "currency": "INR",
        "title": "Annual 1.25 INR"
      }
    ]
  }
}