{
  "companyCode": "SJVN-LIMITED-8435226",
  "timestamp": "2025-10-13T12:27:17.137Z",
  "annualResults": {
    "2023": {
      "Net salesMillion INR": {
        "metric": "Net salesMillion INR",
        "unit": "Million INR",
        "fiscalMonth": "March",
        "year": "2023",
        "released": "29 364",
        "forecast": "25 285",
        "spreadRaw": "16.13%"
      },
      "EBITDAMillion INR": {
        "metric": "EBITDAMillion INR",
        "unit": "Million INR",
        "fiscalMonth": "March",
        "year": "2023",
        "released": "22 344",
        "forecast": "17 985",
        "spreadRaw": "24.23%"
      },
      "EBITMillion INR": {
        "metric": "EBITMillion INR",
        "unit": "Million INR",
        "fiscalMonth": "March",
        "year": "2023",
        "released": "18 380",
        "forecast": "13 391",
        "spreadRaw": "37.26%"
      },
      "Earnings before Tax (EBT)Million INR": {
        "metric": "Earnings before Tax (EBT)Million INR",
        "unit": "Million INR",
        "fiscalMonth": "March",
        "year": "2023",
        "released": "17 377",
        "forecast": "13 869",
        "spreadRaw": "25.29%"
      },
      "Net incomeMillion INR": {
        "metric": "Net incomeMillion INR",
        "unit": "Million INR",
        "fiscalMonth": "March",
        "year": "2023",
        "released": "13 593",
        "forecast": "10 480",
        "spreadRaw": "29.71%"
      },
      "EPS INR": {
        "metric": "EPS INR",
        "unit": "INR",
        "fiscalMonth": "March",
        "year": "2023",
        "released": "3,46",
        "forecast": "2,67",
        "spreadRaw": "29.75%"
      },
      "Announcement Date": {
        "metric": "Announcement Date",
        "unit": null,
        "fiscalMonth": "March",
        "year": "2023",
        "released": "22/05/23",
        "forecast": null,
        "spreadRaw": null
      }
    },
    "2024": {
      "Net salesMillion INR": {
        "metric": "Net salesMillion INR",
        "unit": "Million INR",
        "fiscalMonth": "March",
        "year": "2024",
        "released": "25 794",
        "forecast": "30 904",
        "spreadRaw": "-16.54%"
      },
      "EBITDAMillion INR": {
        "metric": "EBITDAMillion INR",
        "unit": "Million INR",
        "fiscalMonth": "March",
        "year": "2024",
        "released": "18 170",
        "forecast": "23 236",
        "spreadRaw": "-21.8%"
      },
      "EBITMillion INR": {
        "metric": "EBITMillion INR",
        "unit": "Million INR",
        "fiscalMonth": "March",
        "year": "2024",
        "released": "12 599",
        "forecast": "18 430",
        "spreadRaw": "-31.64%"
      },
      "Earnings before Tax (EBT)Million INR": {
        "metric": "Earnings before Tax (EBT)Million INR",
        "unit": "Million INR",
        "fiscalMonth": "March",
        "year": "2024",
        "released": "11 824",
        "forecast": "16 402",
        "spreadRaw": "-27.92%"
      },
      "Net incomeMillion INR": {
        "metric": "Net incomeMillion INR",
        "unit": "Million INR",
        "fiscalMonth": "March",
        "year": "2024",
        "released": "9 114",
        "forecast": "12 548",
        "spreadRaw": "-27.37%"
      },
      "EPS INR": {
        "metric": "EPS INR",
        "unit": "INR",
        "fiscalMonth": "March",
        "year": "2024",
        "released": "2,32",
        "forecast": "3,19",
        "spreadRaw": "-27.36%"
      },
      "Announcement Date": {
        "metric": "Announcement Date",
        "unit": null,
        "fiscalMonth": "March",
        "year": "2024",
        "released": "29/05/24",
        "forecast": null,
        "spreadRaw": null
      }
    },
    "2025": {
      "Net salesMillion INR": {
        "metric": "Net salesMillion INR",
        "unit": "Million INR",
        "fiscalMonth": "March",
        "year": "2025",
        "released": "30 720",
        "forecast": "31 252",
        "spreadRaw": "-1.7%"
      },
      "EBITDAMillion INR": {
        "metric": "EBITDAMillion INR",
        "unit": "Million INR",
        "fiscalMonth": "March",
        "year": "2025",
        "released": "22 211",
        "forecast": "22 757",
        "spreadRaw": "-2.4%"
      },
      "EBITMillion INR": {
        "metric": "EBITMillion INR",
        "unit": "Million INR",
        "fiscalMonth": "March",
        "year": "2025",
        "released": "15 506",
        "forecast": "17 057",
        "spreadRaw": "-9.09%"
      },
      "Earnings before Tax (EBT)Million INR": {
        "metric": "Earnings before Tax (EBT)Million INR",
        "unit": "Million INR",
        "fiscalMonth": "March",
        "year": "2025",
        "released": "11 117",
        "forecast": "15 002",
        "spreadRaw": "-25.9%"
      },
      "Net incomeMillion INR": {
        "metric": "Net incomeMillion INR",
        "unit": "Million INR",
        "fiscalMonth": "March",
        "year": "2025",
        "released": "8 197",
        "forecast": "11 048",
        "spreadRaw": "-25.81%"
      },
      "EPS INR": {
        "metric": "EPS INR",
        "unit": "INR",
        "fiscalMonth": "March",
        "year": "2025",
        "released": "2,08",
        "forecast": "2,82",
        "spreadRaw": "-26.17%"
      },
      "Announcement Date": {
        "metric": "Announcement Date",
        "unit": null,
        "fiscalMonth": "March",
        "year": "2025",
        "released": "29/05/25",
        "forecast": null,
        "spreadRaw": null
      }
    },
    "2026": {
      "Net salesMillion INR": {
        "metric": "Net salesMillion INR",
        "unit": "Million INR",
        "fiscalMonth": "March",
        "year": "2026",
        "released": null,
        "forecast": "50 553",
        "spreadRaw": null
      },
      "EBITDAMillion INR": {
        "metric": "EBITDAMillion INR",
        "unit": "Million INR",
        "fiscalMonth": "March",
        "year": "2026",
        "released": null,
        "forecast": "32 978",
        "spreadRaw": null
      },
      "EBITMillion INR": {
        "metric": "EBITMillion INR",
        "unit": "Million INR",
        "fiscalMonth": "March",
        "year": "2026",
        "released": null,
        "forecast": "22 991",
        "spreadRaw": null
      },
      "Earnings before Tax (EBT)Million INR": {
        "metric": "Earnings before Tax (EBT)Million INR",
        "unit": "Million INR",
        "fiscalMonth": "March",
        "year": "2026",
        "released": null,
        "forecast": "15 612",
        "spreadRaw": null
      },
      "Net incomeMillion INR": {
        "metric": "Net incomeMillion INR",
        "unit": "Million INR",
        "fiscalMonth": "March",
        "year": "2026",
        "released": null,
        "forecast": "11 889",
        "spreadRaw": null
      },
      "EPS INR": {
        "metric": "EPS INR",
        "unit": "INR",
        "fiscalMonth": "March",
        "year": "2026",
        "released": null,
        "forecast": "3,03",
        "spreadRaw": null
      },
      "Announcement Date": {
        "metric": "Announcement Date",
        "unit": null,
        "fiscalMonth": "March",
        "year": "2026",
        "released": "-",
        "forecast": null,
        "spreadRaw": null
      }
    },
    "2027": {
      "Net salesMillion INR": {
        "metric": "Net salesMillion INR",
        "unit": "Million INR",
        "fiscalMonth": "March",
        "year": "2027",
        "released": null,
        "forecast": "79 493",
        "spreadRaw": null
      },
      "EBITDAMillion INR": {
        "metric": "EBITDAMillion INR",
        "unit": "Million INR",
        "fiscalMonth": "March",
        "year": "2027",
        "released": null,
        "forecast": "49 487",
        "spreadRaw": null
      },
      "EBITMillion INR": {
        "metric": "EBITMillion INR",
        "unit": "Million INR",
        "fiscalMonth": "March",
        "year": "2027",
        "released": null,
        "forecast": "35 451",
        "spreadRaw": null
      },
      "Earnings before Tax (EBT)Million INR": {
        "metric": "Earnings before Tax (EBT)Million INR",
        "unit": "Million INR",
        "fiscalMonth": "March",
        "year": "2027",
        "released": null,
        "forecast": "23 910",
        "spreadRaw": null
      },
      "Net incomeMillion INR": {
        "metric": "Net incomeMillion INR",
        "unit": "Million INR",
        "fiscalMonth": "March",
        "year": "2027",
        "released": null,
        "forecast": "18 234",
        "spreadRaw": null
      },
      "EPS INR": {
        "metric": "EPS INR",
        "unit": "INR",
        "fiscalMonth": "March",
        "year": "2027",
        "released": null,
        "forecast": "4,64",
        "spreadRaw": null
      },
      "Announcement Date": {
        "metric": "Announcement Date",
        "unit": null,
        "fiscalMonth": "March",
        "year": "2027",
        "released": null,
        "forecast": null,
        "spreadRaw": null
      }
    },
    "2028": {
      "Net salesMillion INR": {
        "metric": "Net salesMillion INR",
        "unit": "Million INR",
        "fiscalMonth": "March",
        "year": "2028",
        "released": null,
        "forecast": "92 256",
        "spreadRaw": null
      },
      "EBITDAMillion INR": {
        "metric": "EBITDAMillion INR",
        "unit": "Million INR",
        "fiscalMonth": "March",
        "year": "2028",
        "released": null,
        "forecast": "58 895",
        "spreadRaw": null
      },
      "EBITMillion INR": {
        "metric": "EBITMillion INR",
        "unit": "Million INR",
        "fiscalMonth": "March",
        "year": "2028",
        "released": null,
        "forecast": "41 239",
        "spreadRaw": null
      },
      "Earnings before Tax (EBT)Million INR": {
        "metric": "Earnings before Tax (EBT)Million INR",
        "unit": "Million INR",
        "fiscalMonth": "March",
        "year": "2028",
        "released": null,
        "forecast": "27 681",
        "spreadRaw": null
      },
      "Net incomeMillion INR": {
        "metric": "Net incomeMillion INR",
        "unit": "Million INR",
        "fiscalMonth": "March",
        "year": "2028",
        "released": null,
        "forecast": "21 157",
        "spreadRaw": null
      },
      "EPS INR": {
        "metric": "EPS INR",
        "unit": "INR",
        "fiscalMonth": "March",
        "year": "2028",
        "released": null,
        "forecast": "5,39",
        "spreadRaw": null
      },
      "Announcement Date": {
        "metric": "Announcement Date",
        "unit": null,
        "fiscalMonth": "March",
        "year": "2028",
        "released": null,
        "forecast": null,
        "spreadRaw": null
      }
    }
  },
  "quarterlyResults": {
    "2024 Q2": {
      "Net salesMillion INR": {
        "metric": "Net salesMillion INR",
        "unit": "Million INR",
        "fiscalMonth": "March",
        "period": "2024 Q2",
        "released": "8 784",
        "releasedNum": 8784,
        "forecast": "9 241",
        "forecastNum": 9241,
        "spreadRaw": "-4.95%",
        "spreadPct": -4.95
      },
      "EBITDAMillion INR": {
        "metric": "EBITDAMillion INR",
        "unit": "Million INR",
        "fiscalMonth": "March",
        "period": "2024 Q2",
        "released": "7 062",
        "releasedNum": 7062,
        "forecast": "7 206",
        "forecastNum": 7206,
        "spreadRaw": "-2%",
        "spreadPct": -2
      },
      "EBITMillion INR": {
        "metric": "EBITMillion INR",
        "unit": "Million INR",
        "fiscalMonth": "March",
        "period": "2024 Q2",
        "released": "6 043",
        "releasedNum": 6043,
        "forecast": "6 261",
        "forecastNum": 6261,
        "spreadRaw": "-3.48%",
        "spreadPct": -3.48
      },
      "Earnings before Tax (EBT)Million INR": {
        "metric": "Earnings before Tax (EBT)Million INR",
        "unit": "Million INR",
        "fiscalMonth": "March",
        "period": "2024 Q2",
        "released": null,
        "releasedNum": null,
        "forecast": null,
        "forecastNum": null,
        "spreadRaw": null,
        "spreadPct": null
      },
      "Net incomeMillion INR": {
        "metric": "Net incomeMillion INR",
        "unit": "Million INR",
        "fiscalMonth": "March",
        "period": "2024 Q2",
        "released": "4 396",
        "releasedNum": 4396,
        "forecast": "4 843",
        "forecastNum": 4843,
        "spreadRaw": "-9.22%",
        "spreadPct": -9.22
      },
      "EPS INR": {
        "metric": "EPS INR",
        "unit": "INR",
        "fiscalMonth": "March",
        "period": "2024 Q2",
        "released": "1,08",
        "releasedNum": 1.08,
        "forecast": "1,20",
        "forecastNum": 1.2,
        "spreadRaw": "-10%",
        "spreadPct": -10
      },
      "Announcement Date": {
        "metric": "Announcement Date",
        "unit": null,
        "fiscalMonth": "March",
        "period": "2024 Q2",
        "released": "09/11/23",
        "releasedDate": "09/11/23",
        "forecast": null,
        "spreadRaw": null,
        "spreadPct": null
      }
    },
    "2024 Q3": {
      "Net salesMillion INR": {
        "metric": "Net salesMillion INR",
        "unit": "Million INR",
        "fiscalMonth": "March",
        "period": "2024 Q3",
        "released": "5 433",
        "releasedNum": 5433,
        "forecast": "5 766",
        "forecastNum": 5766,
        "spreadRaw": "-5.78%",
        "spreadPct": -5.78
      },
      "EBITDAMillion INR": {
        "metric": "EBITDAMillion INR",
        "unit": "Million INR",
        "fiscalMonth": "March",
        "period": "2024 Q3",
        "released": "3 685",
        "releasedNum": 3685,
        "forecast": "4 165",
        "forecastNum": 4165,
        "spreadRaw": "-11.53%",
        "spreadPct": -11.53
      },
      "EBITMillion INR": {
        "metric": "EBITMillion INR",
        "unit": "Million INR",
        "fiscalMonth": "March",
        "period": "2024 Q3",
        "released": "2 564",
        "releasedNum": 2564,
        "forecast": "2 616",
        "forecastNum": 2616,
        "spreadRaw": "-2.02%",
        "spreadPct": -2.02
      },
      "Earnings before Tax (EBT)Million INR": {
        "metric": "Earnings before Tax (EBT)Million INR",
        "unit": "Million INR",
        "fiscalMonth": "March",
        "period": "2024 Q3",
        "released": "1 745",
        "releasedNum": 1745,
        "forecast": "3 719",
        "forecastNum": 3719,
        "spreadRaw": "-53.09%",
        "spreadPct": -53.09
      },
      "Net incomeMillion INR": {
        "metric": "Net incomeMillion INR",
        "unit": "Million INR",
        "fiscalMonth": "March",
        "period": "2024 Q3",
        "released": "1 390",
        "releasedNum": 1390,
        "forecast": "2 975",
        "forecastNum": 2975,
        "spreadRaw": "-53.29%",
        "spreadPct": -53.29
      },
      "EPS INR": {
        "metric": "EPS INR",
        "unit": "INR",
        "fiscalMonth": "March",
        "period": "2024 Q3",
        "released": null,
        "releasedNum": null,
        "forecast": null,
        "forecastNum": null,
        "spreadRaw": null,
        "spreadPct": null
      },
      "Announcement Date": {
        "metric": "Announcement Date",
        "unit": null,
        "fiscalMonth": "March",
        "period": "2024 Q3",
        "released": "09/02/24",
        "releasedDate": "09/02/24",
        "forecast": null,
        "spreadRaw": null,
        "spreadPct": null
      }
    },
    "2024 Q4": {
      "Net salesMillion INR": {
        "metric": "Net salesMillion INR",
        "unit": "Million INR",
        "fiscalMonth": "March",
        "period": "2024 Q4",
        "released": "4 829",
        "releasedNum": 4829,
        "forecast": "5 711",
        "forecastNum": 5711,
        "spreadRaw": "-15.45%",
        "spreadPct": -15.45
      },
      "EBITDAMillion INR": {
        "metric": "EBITDAMillion INR",
        "unit": "Million INR",
        "fiscalMonth": "March",
        "period": "2024 Q4",
        "released": "2 397",
        "releasedNum": 2397,
        "forecast": "3 725",
        "forecastNum": 3725,
        "spreadRaw": "-35.65%",
        "spreadPct": -35.65
      },
      "EBITMillion INR": {
        "metric": "EBITMillion INR",
        "unit": "Million INR",
        "fiscalMonth": "March",
        "period": "2024 Q4",
        "released": "-27,3",
        "releasedNum": -27.3,
        "forecast": "3 443",
        "forecastNum": 3443,
        "spreadRaw": "-100.79%",
        "spreadPct": -100.79
      },
      "Earnings before Tax (EBT)Million INR": {
        "metric": "Earnings before Tax (EBT)Million INR",
        "unit": "Million INR",
        "fiscalMonth": "March",
        "period": "2024 Q4",
        "released": null,
        "releasedNum": null,
        "forecast": null,
        "forecastNum": null,
        "spreadRaw": null,
        "spreadPct": null
      },
      "Net incomeMillion INR": {
        "metric": "Net incomeMillion INR",
        "unit": "Million INR",
        "fiscalMonth": "March",
        "period": "2024 Q4",
        "released": "611",
        "releasedNum": 611,
        "forecast": "1 947",
        "forecastNum": 1947,
        "spreadRaw": "-68.63%",
        "spreadPct": -68.63
      },
      "EPS INR": {
        "metric": "EPS INR",
        "unit": "INR",
        "fiscalMonth": "March",
        "period": "2024 Q4",
        "released": "0,16",
        "releasedNum": 0.16,
        "forecast": "0,45",
        "forecastNum": 0.45,
        "spreadRaw": "-64.44%",
        "spreadPct": -64.44
      },
      "Announcement Date": {
        "metric": "Announcement Date",
        "unit": null,
        "fiscalMonth": "March",
        "period": "2024 Q4",
        "released": "29/05/24",
        "releasedDate": "29/05/24",
        "forecast": null,
        "spreadRaw": null,
        "spreadPct": null
      }
    },
    "2025 Q1": {
      "Net salesMillion INR": {
        "metric": "Net salesMillion INR",
        "unit": "Million INR",
        "fiscalMonth": "March",
        "period": "2025 Q1",
        "released": "8 704",
        "releasedNum": 8704,
        "forecast": "7 288",
        "forecastNum": 7288,
        "spreadRaw": "19.43%",
        "spreadPct": 19.43
      },
      "EBITDAMillion INR": {
        "metric": "EBITDAMillion INR",
        "unit": "Million INR",
        "fiscalMonth": "March",
        "period": "2025 Q1",
        "released": "6 675",
        "releasedNum": 6675,
        "forecast": "5 382",
        "forecastNum": 5382,
        "spreadRaw": "24.02%",
        "spreadPct": 24.02
      },
      "EBITMillion INR": {
        "metric": "EBITMillion INR",
        "unit": "Million INR",
        "fiscalMonth": "March",
        "period": "2025 Q1",
        "released": null,
        "releasedNum": null,
        "forecast": null,
        "forecastNum": null,
        "spreadRaw": null,
        "spreadPct": null
      },
      "Earnings before Tax (EBT)Million INR": {
        "metric": "Earnings before Tax (EBT)Million INR",
        "unit": "Million INR",
        "fiscalMonth": "March",
        "period": "2025 Q1",
        "released": null,
        "releasedNum": null,
        "forecast": null,
        "forecastNum": null,
        "spreadRaw": null,
        "spreadPct": null
      },
      "Net incomeMillion INR": {
        "metric": "Net incomeMillion INR",
        "unit": "Million INR",
        "fiscalMonth": "March",
        "period": "2025 Q1",
        "released": "3 571",
        "releasedNum": 3571,
        "forecast": "3 218",
        "forecastNum": 3218,
        "spreadRaw": "10.97%",
        "spreadPct": 10.97
      },
      "EPS INR": {
        "metric": "EPS INR",
        "unit": "INR",
        "fiscalMonth": "March",
        "period": "2025 Q1",
        "released": "0,96",
        "releasedNum": 0.96,
        "forecast": "0,82",
        "forecastNum": 0.82,
        "spreadRaw": "17.07%",
        "spreadPct": 17.07
      },
      "Announcement Date": {
        "metric": "Announcement Date",
        "unit": null,
        "fiscalMonth": "March",
        "period": "2025 Q1",
        "released": "13/08/24",
        "releasedDate": "13/08/24",
        "forecast": null,
        "spreadRaw": null,
        "spreadPct": null
      }
    },
    "2025 Q2": {
      "Net salesMillion INR": {
        "metric": "Net salesMillion INR",
        "unit": "Million INR",
        "fiscalMonth": "March",
        "period": "2025 Q2",
        "released": "10 263",
        "releasedNum": 10263,
        "forecast": "10 296",
        "forecastNum": 10296,
        "spreadRaw": "-0.33%",
        "spreadPct": -0.33
      },
      "EBITDAMillion INR": {
        "metric": "EBITDAMillion INR",
        "unit": "Million INR",
        "fiscalMonth": "March",
        "period": "2025 Q2",
        "released": "8 284",
        "releasedNum": 8284,
        "forecast": "8 064",
        "forecastNum": 8064,
        "spreadRaw": "2.73%",
        "spreadPct": 2.73
      },
      "EBITMillion INR": {
        "metric": "EBITMillion INR",
        "unit": "Million INR",
        "fiscalMonth": "March",
        "period": "2025 Q2",
        "released": null,
        "releasedNum": null,
        "forecast": null,
        "forecastNum": null,
        "spreadRaw": null,
        "spreadPct": null
      },
      "Earnings before Tax (EBT)Million INR": {
        "metric": "Earnings before Tax (EBT)Million INR",
        "unit": "Million INR",
        "fiscalMonth": "March",
        "period": "2025 Q2",
        "released": "5 806",
        "releasedNum": 5806,
        "forecast": "6 968",
        "forecastNum": 6968,
        "spreadRaw": "-16.68%",
        "spreadPct": -16.68
      },
      "Net incomeMillion INR": {
        "metric": "Net incomeMillion INR",
        "unit": "Million INR",
        "fiscalMonth": "March",
        "period": "2025 Q2",
        "released": "4 411",
        "releasedNum": 4411,
        "forecast": "5 009",
        "forecastNum": 5009,
        "spreadRaw": "-11.93%",
        "spreadPct": -11.93
      },
      "EPS INR": {
        "metric": "EPS INR",
        "unit": "INR",
        "fiscalMonth": "March",
        "period": "2025 Q2",
        "released": "1,12",
        "releasedNum": 1.12,
        "forecast": "1,20",
        "forecastNum": 1.2,
        "spreadRaw": "-6.67%",
        "spreadPct": -6.67
      },
      "Announcement Date": {
        "metric": "Announcement Date",
        "unit": null,
        "fiscalMonth": "March",
        "period": "2025 Q2",
        "released": "05/11/24",
        "releasedDate": "05/11/24",
        "forecast": null,
        "spreadRaw": null,
        "spreadPct": null
      }
    },
    "2025 Q3": {
      "Net salesMillion INR": {
        "metric": "Net salesMillion INR",
        "unit": "Million INR",
        "fiscalMonth": "March",
        "period": "2025 Q3",
        "released": "6 710",
        "releasedNum": 6710,
        "forecast": "5 958",
        "forecastNum": 5958,
        "spreadRaw": "12.62%",
        "spreadPct": 12.62
      },
      "EBITDAMillion INR": {
        "metric": "EBITDAMillion INR",
        "unit": "Million INR",
        "fiscalMonth": "March",
        "period": "2025 Q3",
        "released": "4 629",
        "releasedNum": 4629,
        "forecast": "3 986",
        "forecastNum": 3986,
        "spreadRaw": "16.13%",
        "spreadPct": 16.13
      },
      "EBITMillion INR": {
        "metric": "EBITMillion INR",
        "unit": "Million INR",
        "fiscalMonth": "March",
        "period": "2025 Q3",
        "released": null,
        "releasedNum": null,
        "forecast": null,
        "forecastNum": null,
        "spreadRaw": null,
        "spreadPct": null
      },
      "Earnings before Tax (EBT)Million INR": {
        "metric": "Earnings before Tax (EBT)Million INR",
        "unit": "Million INR",
        "fiscalMonth": "March",
        "period": "2025 Q3",
        "released": "1 946",
        "releasedNum": 1946,
        "forecast": "1 491",
        "forecastNum": 1491,
        "spreadRaw": "30.53%",
        "spreadPct": 30.53
      },
      "Net incomeMillion INR": {
        "metric": "Net incomeMillion INR",
        "unit": "Million INR",
        "fiscalMonth": "March",
        "period": "2025 Q3",
        "released": "1 490",
        "releasedNum": 1490,
        "forecast": "1 144",
        "forecastNum": 1144,
        "spreadRaw": "30.27%",
        "spreadPct": 30.27
      },
      "EPS INR": {
        "metric": "EPS INR",
        "unit": "INR",
        "fiscalMonth": "March",
        "period": "2025 Q3",
        "released": "0,38",
        "releasedNum": 0.38,
        "forecast": "0,30",
        "forecastNum": 0.3,
        "spreadRaw": "26.67%",
        "spreadPct": 26.67
      },
      "Announcement Date": {
        "metric": "Announcement Date",
        "unit": null,
        "fiscalMonth": "March",
        "period": "2025 Q3",
        "released": "13/02/25",
        "releasedDate": "13/02/25",
        "forecast": null,
        "spreadRaw": null,
        "spreadPct": null
      }
    },
    "2025 Q4": {
      "Net salesMillion INR": {
        "metric": "Net salesMillion INR",
        "unit": "Million INR",
        "fiscalMonth": "March",
        "period": "2025 Q4",
        "released": "5 044",
        "releasedNum": 5044,
        "forecast": "5 485",
        "forecastNum": 5485,
        "spreadRaw": "-8.04%",
        "spreadPct": -8.04
      },
      "EBITDAMillion INR": {
        "metric": "EBITDAMillion INR",
        "unit": "Million INR",
        "fiscalMonth": "March",
        "period": "2025 Q4",
        "released": "2 409",
        "releasedNum": 2409,
        "forecast": "3 090",
        "forecastNum": 3090,
        "spreadRaw": "-22.05%",
        "spreadPct": -22.05
      },
      "EBITMillion INR": {
        "metric": "EBITMillion INR",
        "unit": "Million INR",
        "fiscalMonth": "March",
        "period": "2025 Q4",
        "released": null,
        "releasedNum": null,
        "forecast": null,
        "forecastNum": null,
        "spreadRaw": null,
        "spreadPct": null
      },
      "Earnings before Tax (EBT)Million INR": {
        "metric": "Earnings before Tax (EBT)Million INR",
        "unit": "Million INR",
        "fiscalMonth": "March",
        "period": "2025 Q4",
        "released": null,
        "releasedNum": null,
        "forecast": null,
        "forecastNum": null,
        "spreadRaw": null,
        "spreadPct": null
      },
      "Net incomeMillion INR": {
        "metric": "Net incomeMillion INR",
        "unit": "Million INR",
        "fiscalMonth": "March",
        "period": "2025 Q4",
        "released": "-1 276",
        "releasedNum": -1276,
        "forecast": "242",
        "forecastNum": 242,
        "spreadRaw": "-627.27%",
        "spreadPct": -627.27
      },
      "EPS INR": {
        "metric": "EPS INR",
        "unit": "INR",
        "fiscalMonth": "March",
        "period": "2025 Q4",
        "released": "-0,32",
        "releasedNum": -0.32,
        "forecast": "0,10",
        "forecastNum": 0.1,
        "spreadRaw": "-420%",
        "spreadPct": -420
      },
      "Announcement Date": {
        "metric": "Announcement Date",
        "unit": null,
        "fiscalMonth": "March",
        "period": "2025 Q4",
        "released": "29/05/25",
        "releasedDate": "29/05/25",
        "forecast": null,
        "spreadRaw": null,
        "spreadPct": null
      }
    },
    "2026 Q2": {
      "Net salesMillion INR": {
        "metric": "Net salesMillion INR",
        "unit": "Million INR",
        "fiscalMonth": "March",
        "period": "2026 Q2",
        "released": null,
        "releasedNum": null,
        "forecast": "9 774",
        "forecastNum": 9774,
        "spreadRaw": null,
        "spreadPct": null
      },
      "EBITDAMillion INR": {
        "metric": "EBITDAMillion INR",
        "unit": "Million INR",
        "fiscalMonth": "March",
        "period": "2026 Q2",
        "released": null,
        "releasedNum": null,
        "forecast": "7 827",
        "forecastNum": 7827,
        "spreadRaw": null,
        "spreadPct": null
      },
      "EBITMillion INR": {
        "metric": "EBITMillion INR",
        "unit": "Million INR",
        "fiscalMonth": "March",
        "period": "2026 Q2",
        "released": null,
        "releasedNum": null,
        "forecast": null,
        "forecastNum": null,
        "spreadRaw": null,
        "spreadPct": null
      },
      "Earnings before Tax (EBT)Million INR": {
        "metric": "Earnings before Tax (EBT)Million INR",
        "unit": "Million INR",
        "fiscalMonth": "March",
        "period": "2026 Q2",
        "released": null,
        "releasedNum": null,
        "forecast": null,
        "forecastNum": null,
        "spreadRaw": null,
        "spreadPct": null
      },
      "Net incomeMillion INR": {
        "metric": "Net incomeMillion INR",
        "unit": "Million INR",
        "fiscalMonth": "March",
        "period": "2026 Q2",
        "released": null,
        "releasedNum": null,
        "forecast": "3 930",
        "forecastNum": 3930,
        "spreadRaw": null,
        "spreadPct": null
      },
      "EPS INR": {
        "metric": "EPS INR",
        "unit": "INR",
        "fiscalMonth": "March",
        "period": "2026 Q2",
        "released": null,
        "releasedNum": null,
        "forecast": null,
        "forecastNum": null,
        "spreadRaw": null,
        "spreadPct": null
      },
      "Announcement Date": {
        "metric": "Announcement Date",
        "unit": null,
        "fiscalMonth": "March",
        "period": "2026 Q2",
        "released": "-",
        "releasedDate": "-",
        "forecast": null,
        "spreadRaw": null,
        "spreadPct": null
      }
    }
  },
  "upcomingEvents": {
    "count": 4,
    "events": [
      {
        "section": "Upcoming",
        "dateTimeRaw": "07/11/2025",
        "dateTimeISO": "2025-11-06T18:30:00.000Z",
        "title": "Q2 2026 Earnings Release (Projected)",
        "icsUrl": "https://in.marketscreener.com/api/stateful/agenda/event-async/Q2-2026-Earnings-Release-Projected-48172637.ics"
      },
      {
        "section": "Upcoming",
        "dateTimeRaw": "06/02/2026",
        "dateTimeISO": "2026-02-05T18:30:00.000Z",
        "title": "Q3 2026 Earnings Release (Projected)",
        "icsUrl": "https://in.marketscreener.com/api/stateful/agenda/event-async/Q3-2026-Earnings-Release-Projected-48976248.ics"
      },
      {
        "section": "Upcoming",
        "dateTimeRaw": "03/06/2026",
        "dateTimeISO": "2026-06-02T18:30:00.000Z",
        "title": "Q4 2026 Earnings Release (Projected)",
        "icsUrl": "https://in.marketscreener.com/api/stateful/agenda/event-async/Q4-2026-Earnings-Release-Projected-48402714.ics"
      },
      {
        "section": "Upcoming",
        "dateTimeRaw": "07/08/2026",
        "dateTimeISO": "2026-08-06T18:30:00.000Z",
        "title": "Q1 2027 Earnings Release (Projected)",
        "icsUrl": "https://in.marketscreener.com/api/stateful/agenda/event-async/Q1-2027-Earnings-Release-Projected-50684969.ics"
      }
    ]
  },
  "pastEvents": {
    "count": 75,
    "events": [
      {
        "section": "Past",
        "dateTimeRaw": "25/09/2025 03:00 pm",
        "dateTimeISO": "2025-09-25T09:30:00.000Z",
        "title": "Annual General Meeting",
        "icsUrl": "https://in.marketscreener.com/api/stateful/agenda/event-async/Annual-General-Meeting-51005687.ics"
      },
      {
        "section": "Past",
        "dateTimeRaw": "11/08/2025 03:24 pm",
        "dateTimeISO": "2025-08-11T09:54:00.000Z",
        "title": "Q1 2026 Earnings Release",
        "icsUrl": "https://in.marketscreener.com/api/stateful/agenda/event-async/Q1-2026-Earnings-Release-47511695.ics"
      },
      {
        "section": "Past",
        "dateTimeRaw": "30/05/2025",
        "dateTimeISO": "2025-05-29T18:30:00.000Z",
        "title": "Q4 2025 Earnings Call",
        "icsUrl": "https://in.marketscreener.com/api/stateful/agenda/event-async/Q4-2025-Earnings-Call-50005927.ics"
      },
      {
        "section": "Past",
        "dateTimeRaw": "29/05/2025 08:01 pm",
        "dateTimeISO": "2025-05-29T14:31:00.000Z",
        "title": "Q4 2025 Earnings Release",
        "icsUrl": "https://in.marketscreener.com/api/stateful/agenda/event-async/Q4-2025-Earnings-Release-46814657.ics"
      },
      {
        "section": "Past",
        "dateTimeRaw": "14/02/2025",
        "dateTimeISO": "2025-02-13T18:30:00.000Z",
        "title": "Q3 2025 Earnings Call",
        "icsUrl": "https://in.marketscreener.com/api/stateful/agenda/event-async/Q3-2025-Earnings-Call-48990388.ics"
      },
      {
        "section": "Past",
        "dateTimeRaw": "13/02/2025 07:17 pm",
        "dateTimeISO": "2025-02-13T13:47:00.000Z",
        "title": "Q3 2025 Earnings Release",
        "icsUrl": "https://in.marketscreener.com/api/stateful/agenda/event-async/Q3-2025-Earnings-Release-46183285.ics"
      },
      {
        "section": "Past",
        "dateTimeRaw": "19/11/2024",
        "dateTimeISO": "2024-11-18T18:30:00.000Z",
        "title": "JM Financial India Conference",
        "icsUrl": "https://in.marketscreener.com/api/stateful/agenda/event-async/JM-Financial-India-Conference-48402595.ics"
      },
      {
        "section": "Past",
        "dateTimeRaw": "05/11/2024 02:46 pm",
        "dateTimeISO": "2024-11-05T09:16:00.000Z",
        "title": "Q2 2025 Earnings Release",
        "icsUrl": "https://in.marketscreener.com/api/stateful/agenda/event-async/Q2-2025-Earnings-Release-45335672.ics"
      },
      {
        "section": "Past",
        "dateTimeRaw": "05/11/2024",
        "dateTimeISO": "2024-11-04T18:30:00.000Z",
        "title": "Q2 2025 Earnings Call",
        "icsUrl": "https://in.marketscreener.com/api/stateful/agenda/event-async/Q2-2025-Earnings-Call-48269740.ics"
      },
      {
        "section": "Past",
        "dateTimeRaw": "19/09/2024 03:00 pm",
        "dateTimeISO": "2024-09-19T09:30:00.000Z",
        "title": "Annual General Meeting",
        "icsUrl": "https://in.marketscreener.com/api/stateful/agenda/event-async/Annual-General-Meeting-47745718.ics"
      },
      {
        "section": "Past",
        "dateTimeRaw": "16/08/2024 04:30 pm",
        "dateTimeISO": "2024-08-16T11:00:00.000Z",
        "title": "Q1 2025 Earnings Call",
        "icsUrl": "https://in.marketscreener.com/api/stateful/agenda/event-async/Q1-2025-Earnings-Call-44503658.ics"
      },
      {
        "section": "Past",
        "dateTimeRaw": "13/08/2024 05:48 pm",
        "dateTimeISO": "2024-08-13T12:18:00.000Z",
        "title": "Q1 2025 Earnings Release",
        "icsUrl": "https://in.marketscreener.com/api/stateful/agenda/event-async/Q1-2025-Earnings-Release-47511630.ics"
      },
      {
        "section": "Past",
        "dateTimeRaw": "29/05/2024 04:30 pm",
        "dateTimeISO": "2024-05-29T11:00:00.000Z",
        "title": "Q4 2024 Earnings Call",
        "icsUrl": "https://in.marketscreener.com/api/stateful/agenda/event-async/Q4-2024-Earnings-Call-46814475.ics"
      },
      {
        "section": "Past",
        "dateTimeRaw": "29/05/2024 03:51 pm",
        "dateTimeISO": "2024-05-29T10:21:00.000Z",
        "title": "Q4 2024 Earnings Release",
        "icsUrl": "https://in.marketscreener.com/api/stateful/agenda/event-async/Q4-2024-Earnings-Release-43901119.ics"
      },
      {
        "section": "Past",
        "dateTimeRaw": "09/02/2024 03:48 pm",
        "dateTimeISO": "2024-02-09T10:18:00.000Z",
        "title": "Q3 2024 Earnings Release",
        "icsUrl": "https://in.marketscreener.com/api/stateful/agenda/event-async/Q3-2024-Earnings-Release-42839675.ics"
      },
      {
        "section": "Past",
        "dateTimeRaw": "09/02/2024",
        "dateTimeISO": "2024-02-08T18:30:00.000Z",
        "title": "Q3 2024 Earnings Call",
        "icsUrl": "https://in.marketscreener.com/api/stateful/agenda/event-async/Q3-2024-Earnings-Call-46180974.ics"
      },
      {
        "section": "Past",
        "dateTimeRaw": "22/11/2023",
        "dateTimeISO": "2023-11-21T18:30:00.000Z",
        "title": "JM Financial India Conference",
        "icsUrl": "https://in.marketscreener.com/api/stateful/agenda/event-async/JM-Financial-India-Conference-45404284.ics"
      },
      {
        "section": "Past",
        "dateTimeRaw": "09/11/2023 03:03 pm",
        "dateTimeISO": "2023-11-09T09:33:00.000Z",
        "title": "Q2 2024 Earnings Release",
        "icsUrl": "https://in.marketscreener.com/api/stateful/agenda/event-async/Q2-2024-Earnings-Release-42219691.ics"
      },
      {
        "section": "Past",
        "dateTimeRaw": "09/11/2023",
        "dateTimeISO": "2023-11-08T18:30:00.000Z",
        "title": "Q2 2024 Earnings Call",
        "icsUrl": "https://in.marketscreener.com/api/stateful/agenda/event-async/Q2-2024-Earnings-Call-45334240.ics"
      },
      {
        "section": "Past",
        "dateTimeRaw": "28/09/2023 03:00 pm",
        "dateTimeISO": "2023-09-28T09:30:00.000Z",
        "title": "Annual General Meeting",
        "icsUrl": "https://in.marketscreener.com/api/stateful/agenda/event-async/Annual-General-Meeting-44717669.ics"
      },
      {
        "section": "Past",
        "dateTimeRaw": "10/08/2023",
        "dateTimeISO": "2023-08-09T18:30:00.000Z",
        "title": "Q1 2024 Earnings Call",
        "icsUrl": "https://in.marketscreener.com/api/stateful/agenda/event-async/Q1-2024-Earnings-Call-44598469.ics"
      },
      {
        "section": "Past",
        "dateTimeRaw": "09/08/2023 02:30 pm",
        "dateTimeISO": "2023-08-09T09:00:00.000Z",
        "title": "Q1 2024 Earnings Release",
        "icsUrl": "https://in.marketscreener.com/api/stateful/agenda/event-async/Q1-2024-Earnings-Release-41230465.ics"
      },
      {
        "section": "Past",
        "dateTimeRaw": "06/06/2023",
        "dateTimeISO": "2023-06-05T18:30:00.000Z",
        "title": "Roadshow - Day 2",
        "icsUrl": "https://in.marketscreener.com/api/stateful/agenda/event-async/Roadshow-Day-2-44077882.ics"
      },
      {
        "section": "Past",
        "dateTimeRaw": "05/06/2023",
        "dateTimeISO": "2023-06-04T18:30:00.000Z",
        "title": "Roadshow - Day 1",
        "icsUrl": "https://in.marketscreener.com/api/stateful/agenda/event-async/Roadshow-Day-1-44067276.ics"
      },
      {
        "section": "Past",
        "dateTimeRaw": "23/05/2023",
        "dateTimeISO": "2023-05-22T18:30:00.000Z",
        "title": "Q4 2023 Earnings Call",
        "icsUrl": "https://in.marketscreener.com/api/stateful/agenda/event-async/Q4-2023-Earnings-Call-43969485.ics"
      },
      {
        "section": "Past",
        "dateTimeRaw": "22/05/2023 09:04 pm",
        "dateTimeISO": "2023-05-22T15:34:00.000Z",
        "title": "Q4 2023 Earnings Release",
        "icsUrl": "https://in.marketscreener.com/api/stateful/agenda/event-async/Q4-2023-Earnings-Release-40506867.ics"
      },
      {
        "section": "Past",
        "dateTimeRaw": "07/02/2023",
        "dateTimeISO": "2023-02-06T18:30:00.000Z",
        "title": "Q3 2023 Earnings Call",
        "icsUrl": "https://in.marketscreener.com/api/stateful/agenda/event-async/Q3-2023-Earnings-Call-42901592.ics"
      },
      {
        "section": "Past",
        "dateTimeRaw": "06/02/2023 06:56 pm",
        "dateTimeISO": "2023-02-06T13:26:00.000Z",
        "title": "Q3 2023 Earnings Release",
        "icsUrl": "https://in.marketscreener.com/api/stateful/agenda/event-async/Q3-2023-Earnings-Release-37792591.ics"
      },
      {
        "section": "Past",
        "dateTimeRaw": "11/11/2022 08:01 pm",
        "dateTimeISO": "2022-11-11T14:31:00.000Z",
        "title": "Interim 2023 Earnings Release",
        "icsUrl": "https://in.marketscreener.com/api/stateful/agenda/event-async/Interim-2023-Earnings-Release-36927079.ics"
      },
      {
        "section": "Past",
        "dateTimeRaw": "11/11/2022 05:00 pm",
        "dateTimeISO": "2022-11-11T11:30:00.000Z",
        "title": "Interim 2023 Earnings Call",
        "icsUrl": "https://in.marketscreener.com/api/stateful/agenda/event-async/Interim-2023-Earnings-Call-42295606.ics"
      },
      {
        "section": "Past",
        "dateTimeRaw": "29/09/2022 03:00 pm",
        "dateTimeISO": "2022-09-29T09:30:00.000Z",
        "title": "Annual General Meeting",
        "icsUrl": "https://in.marketscreener.com/api/stateful/agenda/event-async/Annual-General-Meeting-41690495.ics"
      },
      {
        "section": "Past",
        "dateTimeRaw": "12/08/2022 04:00 pm",
        "dateTimeISO": "2022-08-12T10:30:00.000Z",
        "title": "Q1 2023 Earnings Call",
        "icsUrl": "https://in.marketscreener.com/api/stateful/agenda/event-async/Q1-2023-Earnings-Call-41308041.ics"
      },
      {
        "section": "Past",
        "dateTimeRaw": "12/08/2022 02:38 pm",
        "dateTimeISO": "2022-08-12T09:08:00.000Z",
        "title": "Q1 2023 Earnings Release",
        "icsUrl": "https://in.marketscreener.com/api/stateful/agenda/event-async/Q1-2023-Earnings-Release-35652275.ics"
      },
      {
        "section": "Past",
        "dateTimeRaw": "25/05/2022 04:30 pm",
        "dateTimeISO": "2022-05-25T11:00:00.000Z",
        "title": "FY 2022 Earnings Call",
        "icsUrl": "https://in.marketscreener.com/api/stateful/agenda/event-async/FY-2022-Earnings-Call-40576705.ics"
      },
      {
        "section": "Past",
        "dateTimeRaw": "25/05/2022 03:27 pm",
        "dateTimeISO": "2022-05-25T09:57:00.000Z",
        "title": "FY 2022 Earnings Release",
        "icsUrl": "https://in.marketscreener.com/api/stateful/agenda/event-async/FY-2022-Earnings-Release-36104480.ics"
      },
      {
        "section": "Past",
        "dateTimeRaw": "11/02/2022 12:15 pm",
        "dateTimeISO": "2022-02-11T06:45:00.000Z",
        "title": "Q3 2022 Earnings Call",
        "icsUrl": "https://in.marketscreener.com/api/stateful/agenda/event-async/Q3-2022-Earnings-Call-38153294.ics"
      },
      {
        "section": "Past",
        "dateTimeRaw": "10/02/2022 03:44 pm",
        "dateTimeISO": "2022-02-10T10:14:00.000Z",
        "title": "Q3 2022 Earnings Release",
        "icsUrl": "https://in.marketscreener.com/api/stateful/agenda/event-async/Q3-2022-Earnings-Release-32378155.ics"
      },
      {
        "section": "Past",
        "dateTimeRaw": "15/11/2021 03:30 pm",
        "dateTimeISO": "2021-11-15T10:00:00.000Z",
        "title": "Interim 2022 Earnings Call",
        "icsUrl": "https://in.marketscreener.com/api/stateful/agenda/event-async/Interim-2022-Earnings-Call-37010605.ics"
      },
      {
        "section": "Past",
        "dateTimeRaw": "12/11/2021 02:54 pm",
        "dateTimeISO": "2021-11-12T09:24:00.000Z",
        "title": "Interim 2022 Earnings Release",
        "icsUrl": "https://in.marketscreener.com/api/stateful/agenda/event-async/Interim-2022-Earnings-Release-31717256.ics"
      },
      {
        "section": "Past",
        "dateTimeRaw": "29/09/2021 03:00 pm",
        "dateTimeISO": "2021-09-29T09:30:00.000Z",
        "title": "Annual General Meeting",
        "icsUrl": "https://in.marketscreener.com/api/stateful/agenda/event-async/Annual-General-Meeting-36347231.ics"
      },
      {
        "section": "Past",
        "dateTimeRaw": "16/08/2021",
        "dateTimeISO": "2021-08-15T18:30:00.000Z",
        "title": "Q1 2022 Earnings Call",
        "icsUrl": "https://in.marketscreener.com/api/stateful/agenda/event-async/Q1-2022-Earnings-Call-36330647.ics"
      },
      {
        "section": "Past",
        "dateTimeRaw": "14/08/2021",
        "dateTimeISO": "2021-08-13T18:30:00.000Z",
        "title": "Q1 2022 Earnings Release",
        "icsUrl": "https://in.marketscreener.com/api/stateful/agenda/event-async/Q1-2022-Earnings-Release-31161735.ics"
      },
      {
        "section": "Past",
        "dateTimeRaw": "26/06/2021",
        "dateTimeISO": "2021-06-25T18:30:00.000Z",
        "title": "FY 2021 Earnings Release",
        "icsUrl": "https://in.marketscreener.com/api/stateful/agenda/event-async/FY-2021-Earnings-Release-30767564.ics"
      },
      {
        "section": "Past",
        "dateTimeRaw": "12/02/2021 03:30 pm",
        "dateTimeISO": "2021-02-12T10:00:00.000Z",
        "title": "Q3 2021 Earnings Call",
        "icsUrl": "https://in.marketscreener.com/api/stateful/agenda/event-async/Q3-2021-Earnings-Call-32437247.ics"
      },
      {
        "section": "Past",
        "dateTimeRaw": "12/02/2021",
        "dateTimeISO": "2021-02-11T18:30:00.000Z",
        "title": "Q3 2021 Earnings Release",
        "icsUrl": "https://in.marketscreener.com/api/stateful/agenda/event-async/Q3-2021-Earnings-Release-29965289.ics"
      },
      {
        "section": "Past",
        "dateTimeRaw": "10/11/2020",
        "dateTimeISO": "2020-11-09T18:30:00.000Z",
        "title": "Interim 2021 Earnings Release",
        "icsUrl": "https://in.marketscreener.com/api/stateful/agenda/event-async/Interim-2021-Earnings-Release-29965004.ics"
      },
      {
        "section": "Past",
        "dateTimeRaw": "28/08/2020 04:30 pm",
        "dateTimeISO": "2020-08-28T11:00:00.000Z",
        "title": "Q1 2021 Earnings Call",
        "icsUrl": "https://in.marketscreener.com/api/stateful/agenda/event-async/Q1-2021-Earnings-Call-31201535.ics"
      },
      {
        "section": "Past",
        "dateTimeRaw": "28/08/2020",
        "dateTimeISO": "2020-08-27T18:30:00.000Z",
        "title": "Q1 2021 Earnings Release",
        "icsUrl": "https://in.marketscreener.com/api/stateful/agenda/event-async/Q1-2021-Earnings-Release-29009772.ics"
      },
      {
        "section": "Past",
        "dateTimeRaw": "29/06/2020",
        "dateTimeISO": "2020-06-28T18:30:00.000Z",
        "title": "FY 2020 Earnings Release",
        "icsUrl": "https://in.marketscreener.com/api/stateful/agenda/event-async/FY-2020-Earnings-Release-29009387.ics"
      },
      {
        "section": "Past",
        "dateTimeRaw": "13/02/2020 10:30 am",
        "dateTimeISO": "2020-02-13T05:00:00.000Z",
        "title": "Q3 2020 Earnings Call",
        "icsUrl": "https://in.marketscreener.com/api/stateful/agenda/event-async/Q3-2020-Earnings-Call-30045967.ics"
      },
      {
        "section": "Past",
        "dateTimeRaw": "13/02/2020",
        "dateTimeISO": "2020-02-12T18:30:00.000Z",
        "title": "Q3 2020 Earnings Release",
        "icsUrl": "https://in.marketscreener.com/api/stateful/agenda/event-async/Q3-2020-Earnings-Release-28303544.ics"
      },
      {
        "section": "Past",
        "dateTimeRaw": "11/11/2019",
        "dateTimeISO": "2019-11-10T18:30:00.000Z",
        "title": "Interim 2020 Earnings Release",
        "icsUrl": "https://in.marketscreener.com/api/stateful/agenda/event-async/Interim-2020-Earnings-Release-27625667.ics"
      },
      {
        "section": "Past",
        "dateTimeRaw": "12/08/2019",
        "dateTimeISO": "2019-08-11T18:30:00.000Z",
        "title": "Q1 2020 Earnings Release",
        "icsUrl": "https://in.marketscreener.com/api/stateful/agenda/event-async/Q1-2020-Earnings-Release-27541442.ics"
      },
      {
        "section": "Past",
        "dateTimeRaw": "29/05/2019",
        "dateTimeISO": "2019-05-28T18:30:00.000Z",
        "title": "FY 2019 Earnings Release",
        "icsUrl": "https://in.marketscreener.com/api/stateful/agenda/event-async/FY-2019-Earnings-Release-27541255.ics"
      },
      {
        "section": "Past",
        "dateTimeRaw": "08/02/2019",
        "dateTimeISO": "2019-02-07T18:30:00.000Z",
        "title": "Q3 2019 Earnings Release",
        "icsUrl": "https://in.marketscreener.com/api/stateful/agenda/event-async/Q3-2019-Earnings-Release-26144299.ics"
      },
      {
        "section": "Past",
        "dateTimeRaw": "12/11/2018",
        "dateTimeISO": "2018-11-11T18:30:00.000Z",
        "title": "Interim 2019 Earnings Release",
        "icsUrl": "https://in.marketscreener.com/api/stateful/agenda/event-async/Interim-2019-Earnings-Release-25534537.ics"
      },
      {
        "section": "Past",
        "dateTimeRaw": "03/08/2018",
        "dateTimeISO": "2018-08-02T18:30:00.000Z",
        "title": "Q1 2019 Earnings Release",
        "icsUrl": "https://in.marketscreener.com/api/stateful/agenda/event-async/Q1-2019-Earnings-Release-25533143.ics"
      },
      {
        "section": "Past",
        "dateTimeRaw": "28/05/2018",
        "dateTimeISO": "2018-05-27T18:30:00.000Z",
        "title": "FY 2018 Earnings Release",
        "icsUrl": "https://in.marketscreener.com/api/stateful/agenda/event-async/FY-2018-Earnings-Release-25532727.ics"
      },
      {
        "section": "Past",
        "dateTimeRaw": "09/02/2018",
        "dateTimeISO": "2018-02-08T18:30:00.000Z",
        "title": "Q3 2018 Earnings Release",
        "icsUrl": "https://in.marketscreener.com/api/stateful/agenda/event-async/Q3-2018-Earnings-Release-23860099.ics"
      },
      {
        "section": "Past",
        "dateTimeRaw": "13/11/2017",
        "dateTimeISO": "2017-11-12T18:30:00.000Z",
        "title": "Interim 2018 Earnings Release",
        "icsUrl": "https://in.marketscreener.com/api/stateful/agenda/event-async/Interim-2018-Earnings-Release-23859342.ics"
      },
      {
        "section": "Past",
        "dateTimeRaw": "14/08/2017 09:30 am",
        "dateTimeISO": "2017-08-14T04:00:00.000Z",
        "title": "Q1 2018 Earnings Call",
        "icsUrl": "https://in.marketscreener.com/api/stateful/agenda/event-async/Q1-2018-Earnings-Call-24973391.ics"
      },
      {
        "section": "Past",
        "dateTimeRaw": "11/08/2017",
        "dateTimeISO": "2017-08-10T18:30:00.000Z",
        "title": "Q1 2018 Earnings Release",
        "icsUrl": "https://in.marketscreener.com/api/stateful/agenda/event-async/Q1-2018-Earnings-Release-20963983.ics"
      },
      {
        "section": "Past",
        "dateTimeRaw": "29/05/2017",
        "dateTimeISO": "2017-05-28T18:30:00.000Z",
        "title": "FY 2017 Earnings Release",
        "icsUrl": "https://in.marketscreener.com/api/stateful/agenda/event-async/FY-2017-Earnings-Release-22848513.ics"
      },
      {
        "section": "Past",
        "dateTimeRaw": "15/02/2017 04:00 pm",
        "dateTimeISO": "2017-02-15T10:30:00.000Z",
        "title": "Q3 2017 Earnings Call",
        "icsUrl": "https://in.marketscreener.com/api/stateful/agenda/event-async/Q3-2017-Earnings-Call-23856810.ics"
      },
      {
        "section": "Past",
        "dateTimeRaw": "15/02/2017",
        "dateTimeISO": "2017-02-14T18:30:00.000Z",
        "title": "Q3 2017 Earnings Release",
        "icsUrl": "https://in.marketscreener.com/api/stateful/agenda/event-async/Q3-2017-Earnings-Release-22832117.ics"
      },
      {
        "section": "Past",
        "dateTimeRaw": "09/12/2016 03:15 pm",
        "dateTimeISO": "2016-12-09T09:45:00.000Z",
        "title": "Interim 2017 Earnings Call",
        "icsUrl": "https://in.marketscreener.com/api/stateful/agenda/event-async/Interim-2017-Earnings-Call-23532388.ics"
      },
      {
        "section": "Past",
        "dateTimeRaw": "09/12/2016",
        "dateTimeISO": "2016-12-08T18:30:00.000Z",
        "title": "Interim 2017 Earnings Release",
        "icsUrl": "https://in.marketscreener.com/api/stateful/agenda/event-async/Interim-2017-Earnings-Release-20999454.ics"
      },
      {
        "section": "Past",
        "dateTimeRaw": "25/07/2016",
        "dateTimeISO": "2016-07-24T18:30:00.000Z",
        "title": "Q1 2017 Earnings Release (Projected)",
        "icsUrl": "https://in.marketscreener.com/api/stateful/agenda/event-async/Q1-2017-Earnings-Release-Projected-20958180.ics"
      },
      {
        "section": "Past",
        "dateTimeRaw": "27/05/2016 02:30 pm",
        "dateTimeISO": "2016-05-27T09:00:00.000Z",
        "title": "FY 2016 Earnings Call",
        "icsUrl": "https://in.marketscreener.com/api/stateful/agenda/event-async/FY-2016-Earnings-Call-22435045.ics"
      },
      {
        "section": "Past",
        "dateTimeRaw": "27/05/2016",
        "dateTimeISO": "2016-05-26T18:30:00.000Z",
        "title": "FY 2016 Earnings Release",
        "icsUrl": "https://in.marketscreener.com/api/stateful/agenda/event-async/FY-2016-Earnings-Release-19662018.ics"
      },
      {
        "section": "Past",
        "dateTimeRaw": "04/02/2016",
        "dateTimeISO": "2016-02-03T18:30:00.000Z",
        "title": "Q3 2016 Earnings Release",
        "icsUrl": "https://in.marketscreener.com/api/stateful/agenda/event-async/Q3-2016-Earnings-Release-19649115.ics"
      },
      {
        "section": "Past",
        "dateTimeRaw": "05/11/2015",
        "dateTimeISO": "2015-11-04T18:30:00.000Z",
        "title": "Interim 2016 Earnings Release",
        "icsUrl": "https://in.marketscreener.com/api/stateful/agenda/event-async/Interim-2016-Earnings-Release-21258183.ics"
      },
      {
        "section": "Past",
        "dateTimeRaw": "30/07/2015",
        "dateTimeISO": "2015-07-29T18:30:00.000Z",
        "title": "Q1 2016 Earnings Release",
        "icsUrl": "https://in.marketscreener.com/api/stateful/agenda/event-async/Q1-2016-Earnings-Release-20676410.ics"
      },
      {
        "section": "Past",
        "dateTimeRaw": "01/07/2015",
        "dateTimeISO": "2015-06-30T18:30:00.000Z",
        "title": "FY 2015 Earnings Release (Projected)",
        "icsUrl": "https://in.marketscreener.com/api/stateful/agenda/event-async/FY-2015-Earnings-Release-Projected-19286898.ics"
      },
      {
        "section": "Past",
        "dateTimeRaw": "05/02/2015",
        "dateTimeISO": "2015-02-04T18:30:00.000Z",
        "title": "Q3 2015 Earnings Release",
        "icsUrl": "https://in.marketscreener.com/api/stateful/agenda/event-async/Q3-2015-Earnings-Release-19280566.ics"
      }
    ]
  },
  "pastDividends": {
    "count": 27,
    "dividends": [
      {
        "section": "Past Dividends",
        "dateRaw": "18/09/2025",
        "dateISO": "2025-09-17T18:30:00.000Z",
        "type": "Final Payment",
        "amount": 0.31,
        "currency": "INR",
        "title": "Final Payment 0.31 INR"
      },
      {
        "section": "Past Dividends",
        "dateRaw": "21/02/2025",
        "dateISO": "2025-02-20T18:30:00.000Z",
        "type": "Interim Payment",
        "amount": 1.15,
        "currency": "INR",
        "title": "Interim Payment 1.15 INR"
      },
      {
        "section": "Past Dividends",
        "dateRaw": "12/09/2024",
        "dateISO": "2024-09-11T18:30:00.000Z",
        "type": "Final Payment",
        "amount": 0.65,
        "currency": "INR",
        "title": "Final Payment 0.65 INR"
      },
      {
        "section": "Past Dividends",
        "dateRaw": "21/02/2024",
        "dateISO": "2024-02-20T18:30:00.000Z",
        "type": "Interim Payment",
        "amount": 1.15,
        "currency": "INR",
        "title": "Interim Payment 1.15 INR"
      },
      {
        "section": "Past Dividends",
        "dateRaw": "21/09/2023",
        "dateISO": "2023-09-20T18:30:00.000Z",
        "type": "Final Payment",
        "amount": 0.62,
        "currency": "INR",
        "title": "Final Payment 0.62 INR"
      },
      {
        "section": "Past Dividends",
        "dateRaw": "17/02/2023",
        "dateISO": "2023-02-16T18:30:00.000Z",
        "type": "Interim Payment",
        "amount": 1.15,
        "currency": "INR",
        "title": "Interim Payment 1.15 INR"
      },
      {
        "section": "Past Dividends",
        "dateRaw": "21/09/2022",
        "dateISO": "2022-09-20T18:30:00.000Z",
        "type": "Final Payment",
        "amount": 0.55,
        "currency": "INR",
        "title": "Final Payment 0.55 INR"
      },
      {
        "section": "Past Dividends",
        "dateRaw": "21/02/2022",
        "dateISO": "2022-02-20T18:30:00.000Z",
        "type": "Interim Payment",
        "amount": 1.15,
        "currency": "INR",
        "title": "Interim Payment 1.15 INR"
      },
      {
        "section": "Past Dividends",
        "dateRaw": "21/09/2021",
        "dateISO": "2021-09-20T18:30:00.000Z",
        "type": "Final Payment",
        "amount": 0.4,
        "currency": "INR",
        "title": "Final Payment 0.4 INR"
      },
      {
        "section": "Past Dividends",
        "dateRaw": "23/02/2021",
        "dateISO": "2021-02-22T18:30:00.000Z",
        "type": "Interim Payment",
        "amount": 1.8,
        "currency": "INR",
        "title": "Interim Payment 1.8 INR"
      },
      {
        "section": "Past Dividends",
        "dateRaw": "21/09/2020",
        "dateISO": "2020-09-20T18:30:00.000Z",
        "type": "Final Payment",
        "amount": 0.5,
        "currency": "INR",
        "title": "Final Payment 0.5 INR"
      },
      {
        "section": "Past Dividends",
        "dateRaw": "25/02/2020",
        "dateISO": "2020-02-24T18:30:00.000Z",
        "type": "Interim Payment",
        "amount": 1.7,
        "currency": "INR",
        "title": "Interim Payment 1.7 INR"
      },
      {
        "section": "Past Dividends",
        "dateRaw": "19/09/2019",
        "dateISO": "2019-09-18T18:30:00.000Z",
        "type": "Final Payment",
        "amount": 0.65,
        "currency": "INR",
        "title": "Final Payment 0.65 INR"
      },
      {
        "section": "Past Dividends",
        "dateRaw": "18/02/2019",
        "dateISO": "2019-02-17T18:30:00.000Z",
        "type": "Interim Payment",
        "amount": 1.5,
        "currency": "INR",
        "title": "Interim Payment 1.5 INR"
      },
      {
        "section": "Past Dividends",
        "dateRaw": "17/09/2018",
        "dateISO": "2018-09-16T18:30:00.000Z",
        "type": "Final Payment",
        "amount": 0.2,
        "currency": "INR",
        "title": "Final Payment 0.2 INR"
      },
      {
        "section": "Past Dividends",
        "dateRaw": "21/02/2018",
        "dateISO": "2018-02-20T18:30:00.000Z",
        "type": "Interim Payment",
        "amount": 1.9,
        "currency": "INR",
        "title": "Interim Payment 1.9 INR"
      },
      {
        "section": "Past Dividends",
        "dateRaw": "14/09/2017",
        "dateISO": "2017-09-13T18:30:00.000Z",
        "type": "Final Payment",
        "amount": 0.5,
        "currency": "INR",
        "title": "Final Payment 0.5 INR"
      },
      {
        "section": "Past Dividends",
        "dateRaw": "22/02/2017",
        "dateISO": "2017-02-21T18:30:00.000Z",
        "type": "Interim Payment",
        "amount": 2.25,
        "currency": "INR",
        "title": "Interim Payment 2.25 INR"
      },
      {
        "section": "Past Dividends",
        "dateRaw": "14/09/2016",
        "dateISO": "2016-09-13T18:30:00.000Z",
        "type": "Final Payment",
        "amount": 0.47,
        "currency": "INR",
        "title": "Final Payment 0.47 INR"
      },
      {
        "section": "Past Dividends",
        "dateRaw": "16/02/2016",
        "dateISO": "2016-02-15T18:30:00.000Z",
        "type": "Interim Payment",
        "amount": 0.63,
        "currency": "INR",
        "title": "Interim Payment 0.63 INR"
      },
      {
        "section": "Past Dividends",
        "dateRaw": "14/09/2015",
        "dateISO": "2015-09-13T18:30:00.000Z",
        "type": "0.42 INR",
        "amount": null,
        "currency": null,
        "title": "0.42 INR"
      },
      {
        "section": "Past Dividends",
        "dateRaw": "16/02/2015",
        "dateISO": "2015-02-15T18:30:00.000Z",
        "type": "0.63 INR",
        "amount": null,
        "currency": null,
        "title": "0.63 INR"
      },
      {
        "section": "Past Dividends",
        "dateRaw": "01/09/2014",
        "dateISO": "2014-08-31T18:30:00.000Z",
        "type": "Annual",
        "amount": 0.98,
        "currency": "INR",
        "title": "Annual 0.98 INR"
      },
      {
        "section": "Past Dividends",
        "dateRaw": "04/09/2013",
        "dateISO": "2013-09-03T18:30:00.000Z",
        "type": "Annual",
        "amount": 0.96,
        "currency": "INR",
        "title": "Annual 0.96 INR"
      },
      {
        "section": "Past Dividends",
        "dateRaw": "24/08/2012",
        "dateISO": "2012-08-23T18:30:00.000Z",
        "type": "Annual",
        "amount": 0.94,
        "currency": "INR",
        "title": "Annual 0.94 INR"
      },
      {
        "section": "Past Dividends",
        "dateRaw": "17/08/2011",
        "dateISO": "2011-08-16T18:30:00.000Z",
        "type": "Annual",
        "amount": 0.8,
        "currency": "INR",
        "title": "Annual 0.8 INR"
      },
      {
        "section": "Past Dividends",
        "dateRaw": "01/09/2010",
        "dateISO": "2010-08-31T18:30:00.000Z",
        "type": "Annual",
        "amount": 0.6,
        "currency": "INR",
        "title": "Annual 0.6 INR"
      }
    ]
  }
}