{
  "companyCode": "THE-PHOENIX-MILLS-LIMITED-6498526",
  "timestamp": "2025-10-13T12:21:00.049Z",
  "annualResults": {
    "2023": {
      "Net salesMillion INR": {
        "metric": "Net salesMillion INR",
        "unit": "Million INR",
        "fiscalMonth": "March",
        "year": "2023",
        "released": "26 383",
        "forecast": "26 266",
        "spreadRaw": "0.45%"
      },
      "EBITDAMillion INR": {
        "metric": "EBITDAMillion INR",
        "unit": "Million INR",
        "fiscalMonth": "March",
        "year": "2023",
        "released": "15 189",
        "forecast": "14 862",
        "spreadRaw": "2.2%"
      },
      "EBITMillion INR": {
        "metric": "EBITMillion INR",
        "unit": "Million INR",
        "fiscalMonth": "March",
        "year": "2023",
        "released": "12 911",
        "forecast": "12 702",
        "spreadRaw": "1.65%"
      },
      "Earnings before Tax (EBT)Million INR": {
        "metric": "Earnings before Tax (EBT)Million INR",
        "unit": "Million INR",
        "fiscalMonth": "March",
        "year": "2023",
        "released": "16 714",
        "forecast": "14 275",
        "spreadRaw": "17.09%"
      },
      "Net incomeMillion INR": {
        "metric": "Net incomeMillion INR",
        "unit": "Million INR",
        "fiscalMonth": "March",
        "year": "2023",
        "released": "13 350",
        "forecast": "11 877",
        "spreadRaw": "12.4%"
      },
      "EPS INR": {
        "metric": "EPS INR",
        "unit": "INR",
        "fiscalMonth": "March",
        "year": "2023",
        "released": "37,4",
        "forecast": "27,4",
        "spreadRaw": "36.5%"
      },
      "Announcement Date": {
        "metric": "Announcement Date",
        "unit": null,
        "fiscalMonth": "March",
        "year": "2023",
        "released": "24/05/23",
        "forecast": null,
        "spreadRaw": null
      }
    },
    "2024": {
      "Net salesMillion INR": {
        "metric": "Net salesMillion INR",
        "unit": "Million INR",
        "fiscalMonth": "March",
        "year": "2024",
        "released": "39 777",
        "forecast": "36 063",
        "spreadRaw": "10.3%"
      },
      "EBITDAMillion INR": {
        "metric": "EBITDAMillion INR",
        "unit": "Million INR",
        "fiscalMonth": "March",
        "year": "2024",
        "released": "22 833",
        "forecast": "21 021",
        "spreadRaw": "8.62%"
      },
      "EBITMillion INR": {
        "metric": "EBITMillion INR",
        "unit": "Million INR",
        "fiscalMonth": "March",
        "year": "2024",
        "released": "20 131",
        "forecast": "18 574",
        "spreadRaw": "8.38%"
      },
      "Earnings before Tax (EBT)Million INR": {
        "metric": "Earnings before Tax (EBT)Million INR",
        "unit": "Million INR",
        "fiscalMonth": "March",
        "year": "2024",
        "released": "16 429",
        "forecast": "15 411",
        "spreadRaw": "6.6%"
      },
      "Net incomeMillion INR": {
        "metric": "Net incomeMillion INR",
        "unit": "Million INR",
        "fiscalMonth": "March",
        "year": "2024",
        "released": "10 992",
        "forecast": "10 369",
        "spreadRaw": "6.01%"
      },
      "EPS INR": {
        "metric": "EPS INR",
        "unit": "INR",
        "fiscalMonth": "March",
        "year": "2024",
        "released": "30,7",
        "forecast": "29,0",
        "spreadRaw": "5.56%"
      },
      "Announcement Date": {
        "metric": "Announcement Date",
        "unit": null,
        "fiscalMonth": "March",
        "year": "2024",
        "released": "17/05/24",
        "forecast": null,
        "spreadRaw": null
      }
    },
    "2025": {
      "Net salesMillion INR": {
        "metric": "Net salesMillion INR",
        "unit": "Million INR",
        "fiscalMonth": "March",
        "year": "2025",
        "released": "38 136",
        "forecast": "40 952",
        "spreadRaw": "-6.88%"
      },
      "EBITDAMillion INR": {
        "metric": "EBITDAMillion INR",
        "unit": "Million INR",
        "fiscalMonth": "March",
        "year": "2025",
        "released": "21 612",
        "forecast": "23 860",
        "spreadRaw": "-9.42%"
      },
      "EBITMillion INR": {
        "metric": "EBITMillion INR",
        "unit": "Million INR",
        "fiscalMonth": "March",
        "year": "2025",
        "released": "18 347",
        "forecast": "20 875",
        "spreadRaw": "-12.11%"
      },
      "Earnings before Tax (EBT)Million INR": {
        "metric": "Earnings before Tax (EBT)Million INR",
        "unit": "Million INR",
        "fiscalMonth": "March",
        "year": "2025",
        "released": "15 951",
        "forecast": "17 633",
        "spreadRaw": "-9.54%"
      },
      "Net incomeMillion INR": {
        "metric": "Net incomeMillion INR",
        "unit": "Million INR",
        "fiscalMonth": "March",
        "year": "2025",
        "released": "9 842",
        "forecast": "11 388",
        "spreadRaw": "-13.58%"
      },
      "EPS INR": {
        "metric": "EPS INR",
        "unit": "INR",
        "fiscalMonth": "March",
        "year": "2025",
        "released": "27,5",
        "forecast": "32,4",
        "spreadRaw": "-15.14%"
      },
      "Announcement Date": {
        "metric": "Announcement Date",
        "unit": null,
        "fiscalMonth": "March",
        "year": "2025",
        "released": "30/04/25",
        "forecast": null,
        "spreadRaw": null
      }
    },
    "2026": {
      "Net salesMillion INR": {
        "metric": "Net salesMillion INR",
        "unit": "Million INR",
        "fiscalMonth": "March",
        "year": "2026",
        "released": null,
        "forecast": "44 757",
        "spreadRaw": null
      },
      "EBITDAMillion INR": {
        "metric": "EBITDAMillion INR",
        "unit": "Million INR",
        "fiscalMonth": "March",
        "year": "2026",
        "released": null,
        "forecast": "26 035",
        "spreadRaw": null
      },
      "EBITMillion INR": {
        "metric": "EBITMillion INR",
        "unit": "Million INR",
        "fiscalMonth": "March",
        "year": "2026",
        "released": null,
        "forecast": "22 675",
        "spreadRaw": null
      },
      "Earnings before Tax (EBT)Million INR": {
        "metric": "Earnings before Tax (EBT)Million INR",
        "unit": "Million INR",
        "fiscalMonth": "March",
        "year": "2026",
        "released": null,
        "forecast": "19 422",
        "spreadRaw": null
      },
      "Net incomeMillion INR": {
        "metric": "Net incomeMillion INR",
        "unit": "Million INR",
        "fiscalMonth": "March",
        "year": "2026",
        "released": null,
        "forecast": "13 582",
        "spreadRaw": null
      },
      "EPS INR": {
        "metric": "EPS INR",
        "unit": "INR",
        "fiscalMonth": "March",
        "year": "2026",
        "released": null,
        "forecast": "36,7",
        "spreadRaw": null
      },
      "Announcement Date": {
        "metric": "Announcement Date",
        "unit": null,
        "fiscalMonth": "March",
        "year": "2026",
        "released": "-",
        "forecast": null,
        "spreadRaw": null
      }
    },
    "2027": {
      "Net salesMillion INR": {
        "metric": "Net salesMillion INR",
        "unit": "Million INR",
        "fiscalMonth": "March",
        "year": "2027",
        "released": null,
        "forecast": "51 720",
        "spreadRaw": null
      },
      "EBITDAMillion INR": {
        "metric": "EBITDAMillion INR",
        "unit": "Million INR",
        "fiscalMonth": "March",
        "year": "2027",
        "released": null,
        "forecast": "30 489",
        "spreadRaw": null
      },
      "EBITMillion INR": {
        "metric": "EBITMillion INR",
        "unit": "Million INR",
        "fiscalMonth": "March",
        "year": "2027",
        "released": null,
        "forecast": "26 864",
        "spreadRaw": null
      },
      "Earnings before Tax (EBT)Million INR": {
        "metric": "Earnings before Tax (EBT)Million INR",
        "unit": "Million INR",
        "fiscalMonth": "March",
        "year": "2027",
        "released": null,
        "forecast": "23 618",
        "spreadRaw": null
      },
      "Net incomeMillion INR": {
        "metric": "Net incomeMillion INR",
        "unit": "Million INR",
        "fiscalMonth": "March",
        "year": "2027",
        "released": null,
        "forecast": "16 636",
        "spreadRaw": null
      },
      "EPS INR": {
        "metric": "EPS INR",
        "unit": "INR",
        "fiscalMonth": "March",
        "year": "2027",
        "released": null,
        "forecast": "46,2",
        "spreadRaw": null
      },
      "Announcement Date": {
        "metric": "Announcement Date",
        "unit": null,
        "fiscalMonth": "March",
        "year": "2027",
        "released": null,
        "forecast": null,
        "spreadRaw": null
      }
    },
    "2028": {
      "Net salesMillion INR": {
        "metric": "Net salesMillion INR",
        "unit": "Million INR",
        "fiscalMonth": "March",
        "year": "2028",
        "released": null,
        "forecast": "57 209",
        "spreadRaw": null
      },
      "EBITDAMillion INR": {
        "metric": "EBITDAMillion INR",
        "unit": "Million INR",
        "fiscalMonth": "March",
        "year": "2028",
        "released": null,
        "forecast": "34 421",
        "spreadRaw": null
      },
      "EBITMillion INR": {
        "metric": "EBITMillion INR",
        "unit": "Million INR",
        "fiscalMonth": "March",
        "year": "2028",
        "released": null,
        "forecast": "30 249",
        "spreadRaw": null
      },
      "Earnings before Tax (EBT)Million INR": {
        "metric": "Earnings before Tax (EBT)Million INR",
        "unit": "Million INR",
        "fiscalMonth": "March",
        "year": "2028",
        "released": null,
        "forecast": "26 670",
        "spreadRaw": null
      },
      "Net incomeMillion INR": {
        "metric": "Net incomeMillion INR",
        "unit": "Million INR",
        "fiscalMonth": "March",
        "year": "2028",
        "released": null,
        "forecast": "18 856",
        "spreadRaw": null
      },
      "EPS INR": {
        "metric": "EPS INR",
        "unit": "INR",
        "fiscalMonth": "March",
        "year": "2028",
        "released": null,
        "forecast": "53,0",
        "spreadRaw": null
      },
      "Announcement Date": {
        "metric": "Announcement Date",
        "unit": null,
        "fiscalMonth": "March",
        "year": "2028",
        "released": null,
        "forecast": null,
        "spreadRaw": null
      }
    }
  },
  "quarterlyResults": {
    "2024 Q2": {
      "Net salesMillion INR": {
        "metric": "Net salesMillion INR",
        "unit": "Million INR",
        "fiscalMonth": "March",
        "period": "2024 Q2",
        "released": "8 750",
        "releasedNum": 8750,
        "forecast": "8 008",
        "forecastNum": 8008,
        "spreadRaw": "9.27%",
        "spreadPct": 9.27
      },
      "EBITDAMillion INR": {
        "metric": "EBITDAMillion INR",
        "unit": "Million INR",
        "fiscalMonth": "March",
        "period": "2024 Q2",
        "released": "5 060",
        "releasedNum": 5060,
        "forecast": "4 813",
        "forecastNum": 4813,
        "spreadRaw": "5.12%",
        "spreadPct": 5.12
      },
      "EBITMillion INR": {
        "metric": "EBITMillion INR",
        "unit": "Million INR",
        "fiscalMonth": "March",
        "period": "2024 Q2",
        "released": "4 401",
        "releasedNum": 4401,
        "forecast": "4 213",
        "forecastNum": 4213,
        "spreadRaw": "4.44%",
        "spreadPct": 4.44
      },
      "Earnings before Tax (EBT)Million INR": {
        "metric": "Earnings before Tax (EBT)Million INR",
        "unit": "Million INR",
        "fiscalMonth": "March",
        "period": "2024 Q2",
        "released": "3 752",
        "releasedNum": 3752,
        "forecast": "3 458",
        "forecastNum": 3458,
        "spreadRaw": "8.51%",
        "spreadPct": 8.51
      },
      "Net incomeMillion INR": {
        "metric": "Net incomeMillion INR",
        "unit": "Million INR",
        "fiscalMonth": "March",
        "period": "2024 Q2",
        "released": "2 526",
        "releasedNum": 2526,
        "forecast": "2 250",
        "forecastNum": 2250,
        "spreadRaw": "12.26%",
        "spreadPct": 12.26
      },
      "EPS INR": {
        "metric": "EPS INR",
        "unit": "INR",
        "fiscalMonth": "March",
        "period": "2024 Q2",
        "released": "7,08",
        "releasedNum": 7.08,
        "forecast": "6,43",
        "forecastNum": 6.43,
        "spreadRaw": "10.03%",
        "spreadPct": 10.03
      },
      "Announcement Date": {
        "metric": "Announcement Date",
        "unit": null,
        "fiscalMonth": "March",
        "period": "2024 Q2",
        "released": "08/11/23",
        "releasedDate": "08/11/23",
        "forecast": null,
        "spreadRaw": null,
        "spreadPct": null
      }
    },
    "2024 Q3": {
      "Net salesMillion INR": {
        "metric": "Net salesMillion INR",
        "unit": "Million INR",
        "fiscalMonth": "March",
        "period": "2024 Q3",
        "released": "9 861",
        "releasedNum": 9861,
        "forecast": "9 307",
        "forecastNum": 9307,
        "spreadRaw": "5.95%",
        "spreadPct": 5.95
      },
      "EBITDAMillion INR": {
        "metric": "EBITDAMillion INR",
        "unit": "Million INR",
        "fiscalMonth": "March",
        "period": "2024 Q3",
        "released": "5 518",
        "releasedNum": 5518,
        "forecast": "5 372",
        "forecastNum": 5372,
        "spreadRaw": "2.72%",
        "spreadPct": 2.72
      },
      "EBITMillion INR": {
        "metric": "EBITMillion INR",
        "unit": "Million INR",
        "fiscalMonth": "March",
        "period": "2024 Q3",
        "released": "4 862",
        "releasedNum": 4862,
        "forecast": "4 902",
        "forecastNum": 4902,
        "spreadRaw": "-0.81%",
        "spreadPct": -0.81
      },
      "Earnings before Tax (EBT)Million INR": {
        "metric": "Earnings before Tax (EBT)Million INR",
        "unit": "Million INR",
        "fiscalMonth": "March",
        "period": "2024 Q3",
        "released": "4 164",
        "releasedNum": 4164,
        "forecast": "4 036",
        "forecastNum": 4036,
        "spreadRaw": "3.16%",
        "spreadPct": 3.16
      },
      "Net incomeMillion INR": {
        "metric": "Net incomeMillion INR",
        "unit": "Million INR",
        "fiscalMonth": "March",
        "period": "2024 Q3",
        "released": "2 794",
        "releasedNum": 2794,
        "forecast": "2 689",
        "forecastNum": 2689,
        "spreadRaw": "3.87%",
        "spreadPct": 3.87
      },
      "EPS INR": {
        "metric": "EPS INR",
        "unit": "INR",
        "fiscalMonth": "March",
        "period": "2024 Q3",
        "released": "7,83",
        "releasedNum": 7.83,
        "forecast": "7,76",
        "forecastNum": 7.76,
        "spreadRaw": "0.97%",
        "spreadPct": 0.97
      },
      "Announcement Date": {
        "metric": "Announcement Date",
        "unit": null,
        "fiscalMonth": "March",
        "period": "2024 Q3",
        "released": "12/02/24",
        "releasedDate": "12/02/24",
        "forecast": null,
        "spreadRaw": null,
        "spreadPct": null
      }
    },
    "2024 Q4": {
      "Net salesMillion INR": {
        "metric": "Net salesMillion INR",
        "unit": "Million INR",
        "fiscalMonth": "March",
        "period": "2024 Q4",
        "released": "13 059",
        "releasedNum": 13059,
        "forecast": "9 750",
        "forecastNum": 9750,
        "spreadRaw": "33.94%",
        "spreadPct": 33.94
      },
      "EBITDAMillion INR": {
        "metric": "EBITDAMillion INR",
        "unit": "Million INR",
        "fiscalMonth": "March",
        "period": "2024 Q4",
        "released": "6 267",
        "releasedNum": 6267,
        "forecast": "5 643",
        "forecastNum": 5643,
        "spreadRaw": "11.07%",
        "spreadPct": 11.07
      },
      "EBITMillion INR": {
        "metric": "EBITMillion INR",
        "unit": "Million INR",
        "fiscalMonth": "March",
        "period": "2024 Q4",
        "released": "5 510",
        "releasedNum": 5510,
        "forecast": "5 421",
        "forecastNum": 5421,
        "spreadRaw": "1.65%",
        "spreadPct": 1.65
      },
      "Earnings before Tax (EBT)Million INR": {
        "metric": "Earnings before Tax (EBT)Million INR",
        "unit": "Million INR",
        "fiscalMonth": "March",
        "period": "2024 Q4",
        "released": "4 886",
        "releasedNum": 4886,
        "forecast": "4 531",
        "forecastNum": 4531,
        "spreadRaw": "7.86%",
        "spreadPct": 7.86
      },
      "Net incomeMillion INR": {
        "metric": "Net incomeMillion INR",
        "unit": "Million INR",
        "fiscalMonth": "March",
        "period": "2024 Q4",
        "released": "3 267",
        "releasedNum": 3267,
        "forecast": "3 140",
        "forecastNum": 3140,
        "spreadRaw": "4.07%",
        "spreadPct": 4.07
      },
      "EPS INR": {
        "metric": "EPS INR",
        "unit": "INR",
        "fiscalMonth": "March",
        "period": "2024 Q4",
        "released": "9,03",
        "releasedNum": 9.03,
        "forecast": "7,58",
        "forecastNum": 7.58,
        "spreadRaw": "19.21%",
        "spreadPct": 19.21
      },
      "Announcement Date": {
        "metric": "Announcement Date",
        "unit": null,
        "fiscalMonth": "March",
        "period": "2024 Q4",
        "released": "17/05/24",
        "releasedDate": "17/05/24",
        "forecast": null,
        "spreadRaw": null,
        "spreadPct": null
      }
    },
    "2025 Q1": {
      "Net salesMillion INR": {
        "metric": "Net salesMillion INR",
        "unit": "Million INR",
        "fiscalMonth": "March",
        "period": "2025 Q1",
        "released": "9 041",
        "releasedNum": 9041,
        "forecast": "9 788",
        "forecastNum": 9788,
        "spreadRaw": "-7.62%",
        "spreadPct": -7.62
      },
      "EBITDAMillion INR": {
        "metric": "EBITDAMillion INR",
        "unit": "Million INR",
        "fiscalMonth": "March",
        "period": "2025 Q1",
        "released": "5 310",
        "releasedNum": 5310,
        "forecast": "5 734",
        "forecastNum": 5734,
        "spreadRaw": "-7.39%",
        "spreadPct": -7.39
      },
      "EBITMillion INR": {
        "metric": "EBITMillion INR",
        "unit": "Million INR",
        "fiscalMonth": "March",
        "period": "2025 Q1",
        "released": "4 535",
        "releasedNum": 4535,
        "forecast": "5 275",
        "forecastNum": 5275,
        "spreadRaw": "-14.01%",
        "spreadPct": -14.01
      },
      "Earnings before Tax (EBT)Million INR": {
        "metric": "Earnings before Tax (EBT)Million INR",
        "unit": "Million INR",
        "fiscalMonth": "March",
        "period": "2025 Q1",
        "released": "3 882",
        "releasedNum": 3882,
        "forecast": "4 286",
        "forecastNum": 4286,
        "spreadRaw": "-9.43%",
        "spreadPct": -9.43
      },
      "Net incomeMillion INR": {
        "metric": "Net incomeMillion INR",
        "unit": "Million INR",
        "fiscalMonth": "March",
        "period": "2025 Q1",
        "released": "2 325",
        "releasedNum": 2325,
        "forecast": "2 821",
        "forecastNum": 2821,
        "spreadRaw": "-17.57%",
        "spreadPct": -17.57
      },
      "EPS INR": {
        "metric": "EPS INR",
        "unit": "INR",
        "fiscalMonth": "March",
        "period": "2025 Q1",
        "released": "6,50",
        "releasedNum": 6.5,
        "forecast": "9,73",
        "forecastNum": 9.73,
        "spreadRaw": "-33.16%",
        "spreadPct": -33.16
      },
      "Announcement Date": {
        "metric": "Announcement Date",
        "unit": null,
        "fiscalMonth": "March",
        "period": "2025 Q1",
        "released": "31/07/24",
        "releasedDate": "31/07/24",
        "forecast": null,
        "spreadRaw": null,
        "spreadPct": null
      }
    },
    "2025 Q2": {
      "Net salesMillion INR": {
        "metric": "Net salesMillion INR",
        "unit": "Million INR",
        "fiscalMonth": "March",
        "period": "2025 Q2",
        "released": "9 180",
        "releasedNum": 9180,
        "forecast": "9 726",
        "forecastNum": 9726,
        "spreadRaw": "-5.62%",
        "spreadPct": -5.62
      },
      "EBITDAMillion INR": {
        "metric": "EBITDAMillion INR",
        "unit": "Million INR",
        "fiscalMonth": "March",
        "period": "2025 Q2",
        "released": "5 177",
        "releasedNum": 5177,
        "forecast": "5 638",
        "forecastNum": 5638,
        "spreadRaw": "-8.17%",
        "spreadPct": -8.17
      },
      "EBITMillion INR": {
        "metric": "EBITMillion INR",
        "unit": "Million INR",
        "fiscalMonth": "March",
        "period": "2025 Q2",
        "released": "4 402",
        "releasedNum": 4402,
        "forecast": "5 189",
        "forecastNum": 5189,
        "spreadRaw": "-15.18%",
        "spreadPct": -15.18
      },
      "Earnings before Tax (EBT)Million INR": {
        "metric": "Earnings before Tax (EBT)Million INR",
        "unit": "Million INR",
        "fiscalMonth": "March",
        "period": "2025 Q2",
        "released": "3 741",
        "releasedNum": 3741,
        "forecast": "4 326",
        "forecastNum": 4326,
        "spreadRaw": "-13.52%",
        "spreadPct": -13.52
      },
      "Net incomeMillion INR": {
        "metric": "Net incomeMillion INR",
        "unit": "Million INR",
        "fiscalMonth": "March",
        "period": "2025 Q2",
        "released": "2 181",
        "releasedNum": 2181,
        "forecast": "2 610",
        "forecastNum": 2610,
        "spreadRaw": "-16.42%",
        "spreadPct": -16.42
      },
      "EPS INR": {
        "metric": "EPS INR",
        "unit": "INR",
        "fiscalMonth": "March",
        "period": "2025 Q2",
        "released": "8,17",
        "releasedNum": 8.17,
        "forecast": "8,79",
        "forecastNum": 8.79,
        "spreadRaw": "-7.05%",
        "spreadPct": -7.05
      },
      "Announcement Date": {
        "metric": "Announcement Date",
        "unit": null,
        "fiscalMonth": "March",
        "period": "2025 Q2",
        "released": "25/10/24",
        "releasedDate": "25/10/24",
        "forecast": null,
        "spreadRaw": null,
        "spreadPct": null
      }
    },
    "2025 Q3": {
      "Net salesMillion INR": {
        "metric": "Net salesMillion INR",
        "unit": "Million INR",
        "fiscalMonth": "March",
        "period": "2025 Q3",
        "released": "9 751",
        "releasedNum": 9751,
        "forecast": "10 687",
        "forecastNum": 10687,
        "spreadRaw": "-8.76%",
        "spreadPct": -8.76
      },
      "EBITDAMillion INR": {
        "metric": "EBITDAMillion INR",
        "unit": "Million INR",
        "fiscalMonth": "March",
        "period": "2025 Q3",
        "released": "5 528",
        "releasedNum": 5528,
        "forecast": "6 063",
        "forecastNum": 6063,
        "spreadRaw": "-8.82%",
        "spreadPct": -8.82
      },
      "EBITMillion INR": {
        "metric": "EBITMillion INR",
        "unit": "Million INR",
        "fiscalMonth": "March",
        "period": "2025 Q3",
        "released": "4 716",
        "releasedNum": 4716,
        "forecast": "5 549",
        "forecastNum": 5549,
        "spreadRaw": "-15.03%",
        "spreadPct": -15.03
      },
      "Earnings before Tax (EBT)Million INR": {
        "metric": "Earnings before Tax (EBT)Million INR",
        "unit": "Million INR",
        "fiscalMonth": "March",
        "period": "2025 Q3",
        "released": "4 151",
        "releasedNum": 4151,
        "forecast": "4 654",
        "forecastNum": 4654,
        "spreadRaw": "-10.82%",
        "spreadPct": -10.82
      },
      "Net incomeMillion INR": {
        "metric": "Net incomeMillion INR",
        "unit": "Million INR",
        "fiscalMonth": "March",
        "period": "2025 Q3",
        "released": "2 648",
        "releasedNum": 2648,
        "forecast": "2 820",
        "forecastNum": 2820,
        "spreadRaw": "-6.13%",
        "spreadPct": -6.13
      },
      "EPS INR": {
        "metric": "EPS INR",
        "unit": "INR",
        "fiscalMonth": "March",
        "period": "2025 Q3",
        "released": "7,40",
        "releasedNum": 7.4,
        "forecast": "12,9",
        "forecastNum": 12.9,
        "spreadRaw": "-42.46%",
        "spreadPct": -42.46
      },
      "Announcement Date": {
        "metric": "Announcement Date",
        "unit": null,
        "fiscalMonth": "March",
        "period": "2025 Q3",
        "released": "30/01/25",
        "releasedDate": "30/01/25",
        "forecast": null,
        "spreadRaw": null,
        "spreadPct": null
      }
    },
    "2025 Q4": {
      "Net salesMillion INR": {
        "metric": "Net salesMillion INR",
        "unit": "Million INR",
        "fiscalMonth": "March",
        "period": "2025 Q4",
        "released": "10 163",
        "releasedNum": 10163,
        "forecast": "11 758",
        "forecastNum": 11758,
        "spreadRaw": "-13.56%",
        "spreadPct": -13.56
      },
      "EBITDAMillion INR": {
        "metric": "EBITDAMillion INR",
        "unit": "Million INR",
        "fiscalMonth": "March",
        "period": "2025 Q4",
        "released": "5 597",
        "releasedNum": 5597,
        "forecast": "6 462",
        "forecastNum": 6462,
        "spreadRaw": "-13.4%",
        "spreadPct": -13.4
      },
      "EBITMillion INR": {
        "metric": "EBITMillion INR",
        "unit": "Million INR",
        "fiscalMonth": "March",
        "period": "2025 Q4",
        "released": "4 694",
        "releasedNum": 4694,
        "forecast": "5 616",
        "forecastNum": 5616,
        "spreadRaw": "-16.41%",
        "spreadPct": -16.41
      },
      "Earnings before Tax (EBT)Million INR": {
        "metric": "Earnings before Tax (EBT)Million INR",
        "unit": "Million INR",
        "fiscalMonth": "March",
        "period": "2025 Q4",
        "released": "4 177",
        "releasedNum": 4177,
        "forecast": "5 340",
        "forecastNum": 5340,
        "spreadRaw": "-21.77%",
        "spreadPct": -21.77
      },
      "Net incomeMillion INR": {
        "metric": "Net incomeMillion INR",
        "unit": "Million INR",
        "fiscalMonth": "March",
        "period": "2025 Q4",
        "released": "2 688",
        "releasedNum": 2688,
        "forecast": "2 947",
        "forecastNum": 2947,
        "spreadRaw": "-8.77%",
        "spreadPct": -8.77
      },
      "EPS INR": {
        "metric": "EPS INR",
        "unit": "INR",
        "fiscalMonth": "March",
        "period": "2025 Q4",
        "released": "7,52",
        "releasedNum": 7.52,
        "forecast": "11,2",
        "forecastNum": 11.2,
        "spreadRaw": "-32.68%",
        "spreadPct": -32.68
      },
      "Announcement Date": {
        "metric": "Announcement Date",
        "unit": null,
        "fiscalMonth": "March",
        "period": "2025 Q4",
        "released": "30/04/25",
        "releasedDate": "30/04/25",
        "forecast": null,
        "spreadRaw": null,
        "spreadPct": null
      }
    },
    "2026 Q1": {
      "Net salesMillion INR": {
        "metric": "Net salesMillion INR",
        "unit": "Million INR",
        "fiscalMonth": "March",
        "period": "2026 Q1",
        "released": "9 530",
        "releasedNum": 9530,
        "forecast": "10 198",
        "forecastNum": 10198,
        "spreadRaw": "-6.56%",
        "spreadPct": -6.56
      },
      "EBITDAMillion INR": {
        "metric": "EBITDAMillion INR",
        "unit": "Million INR",
        "fiscalMonth": "March",
        "period": "2026 Q1",
        "released": "5 643",
        "releasedNum": 5643,
        "forecast": "5 649",
        "forecastNum": 5649,
        "spreadRaw": "-0.11%",
        "spreadPct": -0.11
      },
      "EBITMillion INR": {
        "metric": "EBITMillion INR",
        "unit": "Million INR",
        "fiscalMonth": "March",
        "period": "2026 Q1",
        "released": "4 708",
        "releasedNum": 4708,
        "forecast": "5 092",
        "forecastNum": 5092,
        "spreadRaw": "-7.53%",
        "spreadPct": -7.53
      },
      "Earnings before Tax (EBT)Million INR": {
        "metric": "Earnings before Tax (EBT)Million INR",
        "unit": "Million INR",
        "fiscalMonth": "March",
        "period": "2026 Q1",
        "released": "4 072",
        "releasedNum": 4072,
        "forecast": "4 748",
        "forecastNum": 4748,
        "spreadRaw": "-14.23%",
        "spreadPct": -14.23
      },
      "Net incomeMillion INR": {
        "metric": "Net incomeMillion INR",
        "unit": "Million INR",
        "fiscalMonth": "March",
        "period": "2026 Q1",
        "released": "2 407",
        "releasedNum": 2407,
        "forecast": "2 910",
        "forecastNum": 2910,
        "spreadRaw": "-17.28%",
        "spreadPct": -17.28
      },
      "EPS INR": {
        "metric": "EPS INR",
        "unit": "INR",
        "fiscalMonth": "March",
        "period": "2026 Q1",
        "released": "6,73",
        "releasedNum": 6.73,
        "forecast": "7,34",
        "forecastNum": 7.34,
        "spreadRaw": "-8.25%",
        "spreadPct": -8.25
      },
      "Announcement Date": {
        "metric": "Announcement Date",
        "unit": null,
        "fiscalMonth": "March",
        "period": "2026 Q1",
        "released": "24/07/25",
        "releasedDate": "24/07/25",
        "forecast": null,
        "spreadRaw": null,
        "spreadPct": null
      }
    },
    "2026 Q2": {
      "Net salesMillion INR": {
        "metric": "Net salesMillion INR",
        "unit": "Million INR",
        "fiscalMonth": "March",
        "period": "2026 Q2",
        "released": null,
        "releasedNum": null,
        "forecast": "10 151",
        "forecastNum": 10151,
        "spreadRaw": null,
        "spreadPct": null
      },
      "EBITDAMillion INR": {
        "metric": "EBITDAMillion INR",
        "unit": "Million INR",
        "fiscalMonth": "March",
        "period": "2026 Q2",
        "released": null,
        "releasedNum": null,
        "forecast": "5 761",
        "forecastNum": 5761,
        "spreadRaw": null,
        "spreadPct": null
      },
      "EBITMillion INR": {
        "metric": "EBITMillion INR",
        "unit": "Million INR",
        "fiscalMonth": "March",
        "period": "2026 Q2",
        "released": null,
        "releasedNum": null,
        "forecast": "4 848",
        "forecastNum": 4848,
        "spreadRaw": null,
        "spreadPct": null
      },
      "Earnings before Tax (EBT)Million INR": {
        "metric": "Earnings before Tax (EBT)Million INR",
        "unit": "Million INR",
        "fiscalMonth": "March",
        "period": "2026 Q2",
        "released": null,
        "releasedNum": null,
        "forecast": "4 573",
        "forecastNum": 4573,
        "spreadRaw": null,
        "spreadPct": null
      },
      "Net incomeMillion INR": {
        "metric": "Net incomeMillion INR",
        "unit": "Million INR",
        "fiscalMonth": "March",
        "period": "2026 Q2",
        "released": null,
        "releasedNum": null,
        "forecast": "3 066",
        "forecastNum": 3066,
        "spreadRaw": null,
        "spreadPct": null
      },
      "EPS INR": {
        "metric": "EPS INR",
        "unit": "INR",
        "fiscalMonth": "March",
        "period": "2026 Q2",
        "released": null,
        "releasedNum": null,
        "forecast": "8,65",
        "forecastNum": 8.65,
        "spreadRaw": null,
        "spreadPct": null
      },
      "Announcement Date": {
        "metric": "Announcement Date",
        "unit": null,
        "fiscalMonth": "March",
        "period": "2026 Q2",
        "released": "-",
        "releasedDate": "-",
        "forecast": null,
        "spreadRaw": null,
        "spreadPct": null
      }
    },
    "2026 Q3": {
      "Net salesMillion INR": {
        "metric": "Net salesMillion INR",
        "unit": "Million INR",
        "fiscalMonth": "March",
        "period": "2026 Q3",
        "released": null,
        "releasedNum": null,
        "forecast": "11 773",
        "forecastNum": 11773,
        "spreadRaw": null,
        "spreadPct": null
      },
      "EBITDAMillion INR": {
        "metric": "EBITDAMillion INR",
        "unit": "Million INR",
        "fiscalMonth": "March",
        "period": "2026 Q3",
        "released": null,
        "releasedNum": null,
        "forecast": "6 371",
        "forecastNum": 6371,
        "spreadRaw": null,
        "spreadPct": null
      },
      "EBITMillion INR": {
        "metric": "EBITMillion INR",
        "unit": "Million INR",
        "fiscalMonth": "March",
        "period": "2026 Q3",
        "released": null,
        "releasedNum": null,
        "forecast": "5 573",
        "forecastNum": 5573,
        "spreadRaw": null,
        "spreadPct": null
      },
      "Earnings before Tax (EBT)Million INR": {
        "metric": "Earnings before Tax (EBT)Million INR",
        "unit": "Million INR",
        "fiscalMonth": "March",
        "period": "2026 Q3",
        "released": null,
        "releasedNum": null,
        "forecast": "5 429",
        "forecastNum": 5429,
        "spreadRaw": null,
        "spreadPct": null
      },
      "Net incomeMillion INR": {
        "metric": "Net incomeMillion INR",
        "unit": "Million INR",
        "fiscalMonth": "March",
        "period": "2026 Q3",
        "released": null,
        "releasedNum": null,
        "forecast": "4 356",
        "forecastNum": 4356,
        "spreadRaw": null,
        "spreadPct": null
      },
      "EPS INR": {
        "metric": "EPS INR",
        "unit": "INR",
        "fiscalMonth": "March",
        "period": "2026 Q3",
        "released": null,
        "releasedNum": null,
        "forecast": "11,4",
        "forecastNum": 11.4,
        "spreadRaw": null,
        "spreadPct": null
      },
      "Announcement Date": {
        "metric": "Announcement Date",
        "unit": null,
        "fiscalMonth": "March",
        "period": "2026 Q3",
        "released": "-",
        "releasedDate": "-",
        "forecast": null,
        "spreadRaw": null,
        "spreadPct": null
      }
    },
    "2026 Q4": {
      "Net salesMillion INR": {
        "metric": "Net salesMillion INR",
        "unit": "Million INR",
        "fiscalMonth": "March",
        "period": "2026 Q4",
        "released": null,
        "releasedNum": null,
        "forecast": "15 206",
        "forecastNum": 15206,
        "spreadRaw": null,
        "spreadPct": null
      },
      "EBITDAMillion INR": {
        "metric": "EBITDAMillion INR",
        "unit": "Million INR",
        "fiscalMonth": "March",
        "period": "2026 Q4",
        "released": null,
        "releasedNum": null,
        "forecast": "8 595",
        "forecastNum": 8595,
        "spreadRaw": null,
        "spreadPct": null
      },
      "EBITMillion INR": {
        "metric": "EBITMillion INR",
        "unit": "Million INR",
        "fiscalMonth": "March",
        "period": "2026 Q4",
        "released": null,
        "releasedNum": null,
        "forecast": "7 310",
        "forecastNum": 7310,
        "spreadRaw": null,
        "spreadPct": null
      },
      "Earnings before Tax (EBT)Million INR": {
        "metric": "Earnings before Tax (EBT)Million INR",
        "unit": "Million INR",
        "fiscalMonth": "March",
        "period": "2026 Q4",
        "released": null,
        "releasedNum": null,
        "forecast": "7 055",
        "forecastNum": 7055,
        "spreadRaw": null,
        "spreadPct": null
      },
      "Net incomeMillion INR": {
        "metric": "Net incomeMillion INR",
        "unit": "Million INR",
        "fiscalMonth": "March",
        "period": "2026 Q4",
        "released": null,
        "releasedNum": null,
        "forecast": "6 384",
        "forecastNum": 6384,
        "spreadRaw": null,
        "spreadPct": null
      },
      "EPS INR": {
        "metric": "EPS INR",
        "unit": "INR",
        "fiscalMonth": "March",
        "period": "2026 Q4",
        "released": null,
        "releasedNum": null,
        "forecast": null,
        "forecastNum": null,
        "spreadRaw": null,
        "spreadPct": null
      },
      "Announcement Date": {
        "metric": "Announcement Date",
        "unit": null,
        "fiscalMonth": "March",
        "period": "2026 Q4",
        "released": "-",
        "releasedDate": "-",
        "forecast": null,
        "spreadRaw": null,
        "spreadPct": null
      }
    }
  },
  "upcomingEvents": {
    "count": 4,
    "events": [
      {
        "section": "Upcoming",
        "dateTimeRaw": "05/11/2025",
        "dateTimeISO": "2025-11-04T18:30:00.000Z",
        "title": "Q2 2026 Earnings Release (Projected)",
        "icsUrl": "https://in.marketscreener.com/api/stateful/agenda/event-async/Q2-2026-Earnings-Release-Projected-48845899.ics"
      },
      {
        "section": "Upcoming",
        "dateTimeRaw": "11/02/2026",
        "dateTimeISO": "2026-02-10T18:30:00.000Z",
        "title": "Q3 2026 Earnings Release (Projected)",
        "icsUrl": "https://in.marketscreener.com/api/stateful/agenda/event-async/Q3-2026-Earnings-Release-Projected-48845923.ics"
      },
      {
        "section": "Upcoming",
        "dateTimeRaw": "27/05/2026",
        "dateTimeISO": "2026-05-26T18:30:00.000Z",
        "title": "Q4 2026 Earnings Release (Projected)",
        "icsUrl": "https://in.marketscreener.com/api/stateful/agenda/event-async/Q4-2026-Earnings-Release-Projected-49717148.ics"
      },
      {
        "section": "Upcoming",
        "dateTimeRaw": "05/08/2026",
        "dateTimeISO": "2026-08-04T18:30:00.000Z",
        "title": "Q1 2027 Earnings Release (Projected)",
        "icsUrl": "https://in.marketscreener.com/api/stateful/agenda/event-async/Q1-2027-Earnings-Release-Projected-50543064.ics"
      }
    ]
  },
  "pastEvents": {
    "count": 200,
    "events": [
      {
        "section": "Past",
        "dateTimeRaw": "10/10/2025",
        "dateTimeISO": "2025-10-09T18:30:00.000Z",
        "title": "Investor Meeting - Motilal Oswal",
        "icsUrl": "https://in.marketscreener.com/api/stateful/agenda/event-async/Investor-Meeting-Motilal-Oswal-51295581.ics"
      },
      {
        "section": "Past",
        "dateTimeRaw": "29/09/2025 02:30 pm",
        "dateTimeISO": "2025-09-29T09:00:00.000Z",
        "title": "Annual General Meeting",
        "icsUrl": "https://in.marketscreener.com/api/stateful/agenda/event-async/Annual-General-Meeting-51005705.ics"
      },
      {
        "section": "Past",
        "dateTimeRaw": "25/09/2025",
        "dateTimeISO": "2025-09-24T18:30:00.000Z",
        "title": "Investor Meeting - Nuvama Institutional Equities",
        "icsUrl": "https://in.marketscreener.com/api/stateful/agenda/event-async/Investor-Meeting-Nuvama-Institutional-Equities-51175556.ics"
      },
      {
        "section": "Past",
        "dateTimeRaw": "24/09/2025",
        "dateTimeISO": "2025-09-23T18:30:00.000Z",
        "title": "Arihant Capital Markets Bharat Connect Conference",
        "icsUrl": "https://in.marketscreener.com/api/stateful/agenda/event-async/Arihant-Capital-Markets-Bharat-Connect-Conference-51147663.ics"
      },
      {
        "section": "Past",
        "dateTimeRaw": "17/09/2025",
        "dateTimeISO": "2025-09-16T18:30:00.000Z",
        "title": "Jefferies India Forum",
        "icsUrl": "https://in.marketscreener.com/api/stateful/agenda/event-async/Jefferies-India-Forum-51087434.ics"
      },
      {
        "section": "Past",
        "dateTimeRaw": "15/09/2025",
        "dateTimeISO": "2025-09-14T18:30:00.000Z",
        "title": "Ex-dividend day for final dividend",
        "icsUrl": "https://in.marketscreener.com/api/stateful/agenda/event-async/Ex-dividend-day-for-final-dividend-51095699.ics"
      },
      {
        "section": "Past",
        "dateTimeRaw": "04/09/2025",
        "dateTimeISO": "2025-09-03T18:30:00.000Z",
        "title": "Ashwamedh Elara India Dialogue Conference",
        "icsUrl": "https://in.marketscreener.com/api/stateful/agenda/event-async/Ashwamedh-Elara-India-Dialogue-Conference-51005622.ics"
      },
      {
        "section": "Past",
        "dateTimeRaw": "03/09/2025",
        "dateTimeISO": "2025-09-02T18:30:00.000Z",
        "title": "Motilal Oswal Global Investor Conference",
        "icsUrl": "https://in.marketscreener.com/api/stateful/agenda/event-async/Motilal-Oswal-Global-Investor-Conference-50992297.ics"
      },
      {
        "section": "Past",
        "dateTimeRaw": "22/08/2025",
        "dateTimeISO": "2025-08-21T18:30:00.000Z",
        "title": "Antique Flagship India Conference",
        "icsUrl": "https://in.marketscreener.com/api/stateful/agenda/event-async/Antique-Flagship-India-Conference-50881097.ics"
      },
      {
        "section": "Past",
        "dateTimeRaw": "24/07/2025 06:00 pm",
        "dateTimeISO": "2025-07-24T12:30:00.000Z",
        "title": "Q1 2026 Earnings Call",
        "icsUrl": "https://in.marketscreener.com/api/stateful/agenda/event-async/Q1-2026-Earnings-Call-50566110.ics"
      },
      {
        "section": "Past",
        "dateTimeRaw": "24/07/2025 05:25 pm",
        "dateTimeISO": "2025-07-24T11:55:00.000Z",
        "title": "Q1 2026 Earnings Release",
        "icsUrl": "https://in.marketscreener.com/api/stateful/agenda/event-async/Q1-2026-Earnings-Release-47478166.ics"
      },
      {
        "section": "Past",
        "dateTimeRaw": "04/06/2025",
        "dateTimeISO": "2025-06-03T18:30:00.000Z",
        "title": "Morgan Stanley India Investment Forum",
        "icsUrl": "https://in.marketscreener.com/api/stateful/agenda/event-async/Morgan-Stanley-India-Investment-Forum-50084190.ics"
      },
      {
        "section": "Past",
        "dateTimeRaw": "02/06/2025",
        "dateTimeISO": "2025-06-01T18:30:00.000Z",
        "title": "Bank of America Securities India Conference",
        "icsUrl": "https://in.marketscreener.com/api/stateful/agenda/event-async/Bank-of-America-Securities-India-Conference-50084179.ics"
      },
      {
        "section": "Past",
        "dateTimeRaw": "29/05/2025",
        "dateTimeISO": "2025-05-28T18:30:00.000Z",
        "title": "B&K Securities Trinity India Investor Conference",
        "icsUrl": "https://in.marketscreener.com/api/stateful/agenda/event-async/B-K-Securities-Trinity-India-Investor-Conference-50057757.ics"
      },
      {
        "section": "Past",
        "dateTimeRaw": "21/05/2025",
        "dateTimeISO": "2025-05-20T18:30:00.000Z",
        "title": "Centrum Broking Nakshatra Investor Conference",
        "icsUrl": "https://in.marketscreener.com/api/stateful/agenda/event-async/Centrum-Broking-Nakshatra-Investor-Conference-49959137.ics"
      },
      {
        "section": "Past",
        "dateTimeRaw": "20/05/2025",
        "dateTimeISO": "2025-05-19T18:30:00.000Z",
        "title": "Non Deal Roadshow - Day 2",
        "icsUrl": "https://in.marketscreener.com/api/stateful/agenda/event-async/Non-Deal-Roadshow-Day-2-49959129.ics"
      },
      {
        "section": "Past",
        "dateTimeRaw": "20/05/2025",
        "dateTimeISO": "2025-05-19T18:30:00.000Z",
        "title": "Non Deal Roadshow - Day 1",
        "icsUrl": "https://in.marketscreener.com/api/stateful/agenda/event-async/Non-Deal-Roadshow-Day-1-49959128.ics"
      },
      {
        "section": "Past",
        "dateTimeRaw": "19/05/2025",
        "dateTimeISO": "2025-05-18T18:30:00.000Z",
        "title": "Non Deal Roadshow - Motilal Oswal",
        "icsUrl": "https://in.marketscreener.com/api/stateful/agenda/event-async/Non-Deal-Roadshow-Motilal-Oswal-50005878.ics"
      },
      {
        "section": "Past",
        "dateTimeRaw": "01/05/2025 04:00 pm",
        "dateTimeISO": "2025-05-01T10:30:00.000Z",
        "title": "Q4 2025 Earnings Call",
        "icsUrl": "https://in.marketscreener.com/api/stateful/agenda/event-async/Q4-2025-Earnings-Call-49717044.ics"
      },
      {
        "section": "Past",
        "dateTimeRaw": "30/04/2025 07:13 pm",
        "dateTimeISO": "2025-04-30T13:43:00.000Z",
        "title": "Q4 2025 Earnings Release",
        "icsUrl": "https://in.marketscreener.com/api/stateful/agenda/event-async/Q4-2025-Earnings-Release-46727942.ics"
      },
      {
        "section": "Past",
        "dateTimeRaw": "26/03/2025",
        "dateTimeISO": "2025-03-25T18:30:00.000Z",
        "title": "HSBC Global Investment Summit",
        "icsUrl": "https://in.marketscreener.com/api/stateful/agenda/event-async/HSBC-Global-Investment-Summit-49396098.ics"
      },
      {
        "section": "Past",
        "dateTimeRaw": "25/03/2025",
        "dateTimeISO": "2025-03-24T18:30:00.000Z",
        "title": "HSBC Global Investment Summit",
        "icsUrl": "https://in.marketscreener.com/api/stateful/agenda/event-async/HSBC-Global-Investment-Summit-49396086.ics"
      },
      {
        "section": "Past",
        "dateTimeRaw": "20/03/2025",
        "dateTimeISO": "2025-03-19T18:30:00.000Z",
        "title": "Investor Meeting - Knysna Advisory",
        "icsUrl": "https://in.marketscreener.com/api/stateful/agenda/event-async/Investor-Meeting-Knysna-Advisory-49343476.ics"
      },
      {
        "section": "Past",
        "dateTimeRaw": "25/02/2025",
        "dateTimeISO": "2025-02-24T18:30:00.000Z",
        "title": "IIFL Enterprising India Global Investor Conference",
        "icsUrl": "https://in.marketscreener.com/api/stateful/agenda/event-async/IIFL-Enterprising-India-Global-Investor-Conference-49132691.ics"
      },
      {
        "section": "Past",
        "dateTimeRaw": "18/02/2025",
        "dateTimeISO": "2025-02-17T18:30:00.000Z",
        "title": "Kotak Chasing Growth Conference",
        "icsUrl": "https://in.marketscreener.com/api/stateful/agenda/event-async/Kotak-Chasing-Growth-Conference-48990394.ics"
      },
      {
        "section": "Past",
        "dateTimeRaw": "14/02/2025",
        "dateTimeISO": "2025-02-13T18:30:00.000Z",
        "title": "Citi India Investor Conference",
        "icsUrl": "https://in.marketscreener.com/api/stateful/agenda/event-async/Citi-India-Investor-Conference-48990387.ics"
      },
      {
        "section": "Past",
        "dateTimeRaw": "13/02/2025",
        "dateTimeISO": "2025-02-12T18:30:00.000Z",
        "title": "Axis Capital India Conference",
        "icsUrl": "https://in.marketscreener.com/api/stateful/agenda/event-async/Axis-Capital-India-Conference-48990382.ics"
      },
      {
        "section": "Past",
        "dateTimeRaw": "11/02/2025",
        "dateTimeISO": "2025-02-10T18:30:00.000Z",
        "title": "Nuvama India Conference",
        "icsUrl": "https://in.marketscreener.com/api/stateful/agenda/event-async/Nuvama-India-Conference-48990367.ics"
      },
      {
        "section": "Past",
        "dateTimeRaw": "31/01/2025 11:00 am",
        "dateTimeISO": "2025-01-31T05:30:00.000Z",
        "title": "Q3 2025 Earnings Call",
        "icsUrl": "https://in.marketscreener.com/api/stateful/agenda/event-async/Q3-2025-Earnings-Call-48876154.ics"
      },
      {
        "section": "Past",
        "dateTimeRaw": "30/01/2025 06:38 pm",
        "dateTimeISO": "2025-01-30T13:08:00.000Z",
        "title": "Q3 2025 Earnings Release",
        "icsUrl": "https://in.marketscreener.com/api/stateful/agenda/event-async/Q3-2025-Earnings-Release-46183252.ics"
      },
      {
        "section": "Past",
        "dateTimeRaw": "06/12/2024",
        "dateTimeISO": "2024-12-05T18:30:00.000Z",
        "title": "Investor Meeting - Tokio Marine Asset Management",
        "icsUrl": "https://in.marketscreener.com/api/stateful/agenda/event-async/Investor-Meeting-Tokio-Marine-Asset-Management-48518378.ics"
      },
      {
        "section": "Past",
        "dateTimeRaw": "21/11/2024",
        "dateTimeISO": "2024-11-20T18:30:00.000Z",
        "title": "JM Financial India Conference",
        "icsUrl": "https://in.marketscreener.com/api/stateful/agenda/event-async/JM-Financial-India-Conference-48330276.ics"
      },
      {
        "section": "Past",
        "dateTimeRaw": "19/11/2024",
        "dateTimeISO": "2024-11-18T18:30:00.000Z",
        "title": "CITIC CLSA India Forum",
        "icsUrl": "https://in.marketscreener.com/api/stateful/agenda/event-async/CITIC-CLSA-India-Forum-48330267.ics"
      },
      {
        "section": "Past",
        "dateTimeRaw": "18/11/2024",
        "dateTimeISO": "2024-11-17T18:30:00.000Z",
        "title": "Investor Meeting - ICICI Securities",
        "icsUrl": "https://in.marketscreener.com/api/stateful/agenda/event-async/Investor-Meeting-ICICI-Securities-48330261.ics"
      },
      {
        "section": "Past",
        "dateTimeRaw": "15/11/2024",
        "dateTimeISO": "2024-11-14T18:30:00.000Z",
        "title": "Investor Meeting - Nuvama Institutional Equities",
        "icsUrl": "https://in.marketscreener.com/api/stateful/agenda/event-async/Investor-Meeting-Nuvama-Institutional-Equities-48330255.ics"
      },
      {
        "section": "Past",
        "dateTimeRaw": "14/11/2024",
        "dateTimeISO": "2024-11-13T18:30:00.000Z",
        "title": "Avendus Spark Investor Conference",
        "icsUrl": "https://in.marketscreener.com/api/stateful/agenda/event-async/Avendus-Spark-Investor-Conference-48330248.ics"
      },
      {
        "section": "Past",
        "dateTimeRaw": "26/10/2024 11:00 am",
        "dateTimeISO": "2024-10-26T05:30:00.000Z",
        "title": "Q2 2025 Earnings Call",
        "icsUrl": "https://in.marketscreener.com/api/stateful/agenda/event-async/Q2-2025-Earnings-Call-48125353.ics"
      },
      {
        "section": "Past",
        "dateTimeRaw": "25/10/2024 06:53 pm",
        "dateTimeISO": "2024-10-25T13:23:00.000Z",
        "title": "Q2 2025 Earnings Release",
        "icsUrl": "https://in.marketscreener.com/api/stateful/agenda/event-async/Q2-2025-Earnings-Release-45335327.ics"
      },
      {
        "section": "Past",
        "dateTimeRaw": "20/09/2024",
        "dateTimeISO": "2024-09-19T18:30:00.000Z",
        "title": "Bonus Issue: 1 new share for 1 existing share",
        "icsUrl": "https://in.marketscreener.com/api/stateful/agenda/event-async/Bonus-Issue-1-new-share-for-1-existing-share-47871598.ics"
      },
      {
        "section": "Past",
        "dateTimeRaw": "13/09/2024 03:30 pm",
        "dateTimeISO": "2024-09-13T10:00:00.000Z",
        "title": "Annual General Meeting",
        "icsUrl": "https://in.marketscreener.com/api/stateful/agenda/event-async/Annual-General-Meeting-47577558.ics"
      },
      {
        "section": "Past",
        "dateTimeRaw": "11/09/2024",
        "dateTimeISO": "2024-09-10T18:30:00.000Z",
        "title": "Investor Meeting",
        "icsUrl": "https://in.marketscreener.com/api/stateful/agenda/event-async/Investor-Meeting-47824880.ics"
      },
      {
        "section": "Past",
        "dateTimeRaw": "21/08/2024",
        "dateTimeISO": "2024-08-20T18:30:00.000Z",
        "title": "Motilal Oswal Global Investor Conference",
        "icsUrl": "https://in.marketscreener.com/api/stateful/agenda/event-async/Motilal-Oswal-Global-Investor-Conference-47699051.ics"
      },
      {
        "section": "Past",
        "dateTimeRaw": "20/08/2024",
        "dateTimeISO": "2024-08-19T18:30:00.000Z",
        "title": "Ex-dividend day for final dividend",
        "icsUrl": "https://in.marketscreener.com/api/stateful/agenda/event-async/Ex-dividend-day-for-final-dividend-47677434.ics"
      },
      {
        "section": "Past",
        "dateTimeRaw": "12/08/2024",
        "dateTimeISO": "2024-08-11T18:30:00.000Z",
        "title": "Nuvama India Conference",
        "icsUrl": "https://in.marketscreener.com/api/stateful/agenda/event-async/Nuvama-India-Conference-47618273.ics"
      },
      {
        "section": "Past",
        "dateTimeRaw": "01/08/2024 12:00 pm",
        "dateTimeISO": "2024-08-01T06:30:00.000Z",
        "title": "Q1 2025 Earnings Call",
        "icsUrl": "https://in.marketscreener.com/api/stateful/agenda/event-async/Q1-2025-Earnings-Call-47487156.ics"
      },
      {
        "section": "Past",
        "dateTimeRaw": "31/07/2024 07:42 pm",
        "dateTimeISO": "2024-07-31T14:12:00.000Z",
        "title": "Q1 2025 Earnings Release",
        "icsUrl": "https://in.marketscreener.com/api/stateful/agenda/event-async/Q1-2025-Earnings-Release-44503643.ics"
      },
      {
        "section": "Past",
        "dateTimeRaw": "12/06/2024",
        "dateTimeISO": "2024-06-11T18:30:00.000Z",
        "title": "Morgan Stanley India Investment Forum",
        "icsUrl": "https://in.marketscreener.com/api/stateful/agenda/event-async/Morgan-Stanley-India-Investment-Forum-46926160.ics"
      },
      {
        "section": "Past",
        "dateTimeRaw": "04/06/2024",
        "dateTimeISO": "2024-06-03T18:30:00.000Z",
        "title": "BofA India Conference",
        "icsUrl": "https://in.marketscreener.com/api/stateful/agenda/event-async/BofA-India-Conference-46896108.ics"
      },
      {
        "section": "Past",
        "dateTimeRaw": "30/05/2024",
        "dateTimeISO": "2024-05-29T18:30:00.000Z",
        "title": "B&K Securities Trinity Investor Conference",
        "icsUrl": "https://in.marketscreener.com/api/stateful/agenda/event-async/B-K-Securities-Trinity-Investor-Conference-46825435.ics"
      },
      {
        "section": "Past",
        "dateTimeRaw": "21/05/2024",
        "dateTimeISO": "2024-05-20T18:30:00.000Z",
        "title": "Investor Meeting - Polar Capital",
        "icsUrl": "https://in.marketscreener.com/api/stateful/agenda/event-async/Investor-Meeting-Polar-Capital-46765897.ics"
      },
      {
        "section": "Past",
        "dateTimeRaw": "18/05/2024 11:00 am",
        "dateTimeISO": "2024-05-18T05:30:00.000Z",
        "title": "Q4 2024 Earnings Call",
        "icsUrl": "https://in.marketscreener.com/api/stateful/agenda/event-async/Q4-2024-Earnings-Call-46727804.ics"
      },
      {
        "section": "Past",
        "dateTimeRaw": "17/05/2024 08:27 pm",
        "dateTimeISO": "2024-05-17T14:57:00.000Z",
        "title": "Q4 2024 Earnings Release",
        "icsUrl": "https://in.marketscreener.com/api/stateful/agenda/event-async/Q4-2024-Earnings-Release-43901091.ics"
      },
      {
        "section": "Past",
        "dateTimeRaw": "09/05/2024",
        "dateTimeISO": "2024-05-08T18:30:00.000Z",
        "title": "Investor Meeting",
        "icsUrl": "https://in.marketscreener.com/api/stateful/agenda/event-async/Investor-Meeting-46659494.ics"
      },
      {
        "section": "Past",
        "dateTimeRaw": "26/04/2024",
        "dateTimeISO": "2024-04-25T18:30:00.000Z",
        "title": "Investor Meeting - ICICI Prudential AMC",
        "icsUrl": "https://in.marketscreener.com/api/stateful/agenda/event-async/Investor-Meeting-ICICI-Prudential-AMC-46498613.ics"
      },
      {
        "section": "Past",
        "dateTimeRaw": "15/04/2024",
        "dateTimeISO": "2024-04-14T18:30:00.000Z",
        "title": "Investor Meeting - SBI Mutual Fund",
        "icsUrl": "https://in.marketscreener.com/api/stateful/agenda/event-async/Investor-Meeting-SBI-Mutual-Fund-46420256.ics"
      },
      {
        "section": "Past",
        "dateTimeRaw": "22/03/2024",
        "dateTimeISO": "2024-03-21T18:30:00.000Z",
        "title": "Investor Meeting",
        "icsUrl": "https://in.marketscreener.com/api/stateful/agenda/event-async/Investor-Meeting-46271086.ics"
      },
      {
        "section": "Past",
        "dateTimeRaw": "21/03/2024",
        "dateTimeISO": "2024-03-20T18:30:00.000Z",
        "title": "Investor Meeting - Allianz Global",
        "icsUrl": "https://in.marketscreener.com/api/stateful/agenda/event-async/Investor-Meeting-Allianz-Global-46271074.ics"
      },
      {
        "section": "Past",
        "dateTimeRaw": "21/03/2024",
        "dateTimeISO": "2024-03-20T18:30:00.000Z",
        "title": "Investor Meeting - DNB Asset Management",
        "icsUrl": "https://in.marketscreener.com/api/stateful/agenda/event-async/Investor-Meeting-DNB-Asset-Management-46271073.ics"
      },
      {
        "section": "Past",
        "dateTimeRaw": "21/03/2024",
        "dateTimeISO": "2024-03-20T18:30:00.000Z",
        "title": "Investor Meeting - Citi",
        "icsUrl": "https://in.marketscreener.com/api/stateful/agenda/event-async/Investor-Meeting-Citi-46271072.ics"
      },
      {
        "section": "Past",
        "dateTimeRaw": "29/02/2024",
        "dateTimeISO": "2024-02-28T18:30:00.000Z",
        "title": "Investor Meeting - ICICI Prudential AMC",
        "icsUrl": "https://in.marketscreener.com/api/stateful/agenda/event-async/Investor-Meeting-ICICI-Prudential-AMC-46181703.ics"
      },
      {
        "section": "Past",
        "dateTimeRaw": "28/02/2024",
        "dateTimeISO": "2024-02-27T18:30:00.000Z",
        "title": "Investor Meeting - Jefferies",
        "icsUrl": "https://in.marketscreener.com/api/stateful/agenda/event-async/Investor-Meeting-Jefferies-46181618.ics"
      },
      {
        "section": "Past",
        "dateTimeRaw": "23/02/2024",
        "dateTimeISO": "2024-02-22T18:30:00.000Z",
        "title": "Investor Meeting - UBS",
        "icsUrl": "https://in.marketscreener.com/api/stateful/agenda/event-async/Investor-Meeting-UBS-46181470.ics"
      },
      {
        "section": "Past",
        "dateTimeRaw": "20/02/2024",
        "dateTimeISO": "2024-02-19T18:30:00.000Z",
        "title": "Kotak Chasing Growth Conference",
        "icsUrl": "https://in.marketscreener.com/api/stateful/agenda/event-async/Kotak-Chasing-Growth-Conference-46181304.ics"
      },
      {
        "section": "Past",
        "dateTimeRaw": "16/02/2024",
        "dateTimeISO": "2024-02-15T18:30:00.000Z",
        "title": "Investor Meeting - Alquity Capital",
        "icsUrl": "https://in.marketscreener.com/api/stateful/agenda/event-async/Investor-Meeting-Alquity-Capital-46181224.ics"
      },
      {
        "section": "Past",
        "dateTimeRaw": "15/02/2024",
        "dateTimeISO": "2024-02-14T18:30:00.000Z",
        "title": "IIFL Enterprising India Global Investors Conference",
        "icsUrl": "https://in.marketscreener.com/api/stateful/agenda/event-async/IIFL-Enterprising-India-Global-Investors-Conference-46181160.ics"
      },
      {
        "section": "Past",
        "dateTimeRaw": "14/02/2024",
        "dateTimeISO": "2024-02-13T18:30:00.000Z",
        "title": "Axis Capital India Conference",
        "icsUrl": "https://in.marketscreener.com/api/stateful/agenda/event-async/Axis-Capital-India-Conference-46181109.ics"
      },
      {
        "section": "Past",
        "dateTimeRaw": "13/02/2024 11:00 am",
        "dateTimeISO": "2024-02-13T05:30:00.000Z",
        "title": "Q3 2024 Earnings Call",
        "icsUrl": "https://in.marketscreener.com/api/stateful/agenda/event-async/Q3-2024-Earnings-Call-46181030.ics"
      },
      {
        "section": "Past",
        "dateTimeRaw": "13/02/2024",
        "dateTimeISO": "2024-02-12T18:30:00.000Z",
        "title": "Nuvama India Conference",
        "icsUrl": "https://in.marketscreener.com/api/stateful/agenda/event-async/Nuvama-India-Conference-46181053.ics"
      },
      {
        "section": "Past",
        "dateTimeRaw": "12/02/2024 07:36 pm",
        "dateTimeISO": "2024-02-12T14:06:00.000Z",
        "title": "Q3 2024 Earnings Release",
        "icsUrl": "https://in.marketscreener.com/api/stateful/agenda/event-async/Q3-2024-Earnings-Release-42901923.ics"
      },
      {
        "section": "Past",
        "dateTimeRaw": "07/12/2023",
        "dateTimeISO": "2023-12-06T18:30:00.000Z",
        "title": "Investor Meeting - Nuvama Institutional Equities",
        "icsUrl": "https://in.marketscreener.com/api/stateful/agenda/event-async/Investor-Meeting-Nuvama-Institutional-Equities-45509432.ics"
      },
      {
        "section": "Past",
        "dateTimeRaw": "07/12/2023",
        "dateTimeISO": "2023-12-06T18:30:00.000Z",
        "title": "Investor Meeting - Paradice Investments",
        "icsUrl": "https://in.marketscreener.com/api/stateful/agenda/event-async/Investor-Meeting-Paradice-Investments-45509431.ics"
      },
      {
        "section": "Past",
        "dateTimeRaw": "07/12/2023",
        "dateTimeISO": "2023-12-06T18:30:00.000Z",
        "title": "J.P. Morgan India Emerging Opportunities Forum",
        "icsUrl": "https://in.marketscreener.com/api/stateful/agenda/event-async/J-P-Morgan-India-Emerging-Opportunities-Forum-45499859.ics"
      },
      {
        "section": "Past",
        "dateTimeRaw": "01/12/2023",
        "dateTimeISO": "2023-11-30T18:30:00.000Z",
        "title": "Investor Meeting - Nuvama Institutional Equities",
        "icsUrl": "https://in.marketscreener.com/api/stateful/agenda/event-async/Investor-Meeting-Nuvama-Institutional-Equities-45448060.ics"
      },
      {
        "section": "Past",
        "dateTimeRaw": "30/11/2023",
        "dateTimeISO": "2023-11-29T18:30:00.000Z",
        "title": "Investor Meeting - C WorldWide Asset Management",
        "icsUrl": "https://in.marketscreener.com/api/stateful/agenda/event-async/Investor-Meeting-C-WorldWide-Asset-Management-45448057.ics"
      },
      {
        "section": "Past",
        "dateTimeRaw": "30/11/2023",
        "dateTimeISO": "2023-11-29T18:30:00.000Z",
        "title": "Citic CLSA India Forum",
        "icsUrl": "https://in.marketscreener.com/api/stateful/agenda/event-async/Citic-CLSA-India-Forum-45437395.ics"
      },
      {
        "section": "Past",
        "dateTimeRaw": "29/11/2023",
        "dateTimeISO": "2023-11-28T18:30:00.000Z",
        "title": "Investor Meeting - Aberdeen India Investments",
        "icsUrl": "https://in.marketscreener.com/api/stateful/agenda/event-async/Investor-Meeting-Aberdeen-India-Investments-45431240.ics"
      },
      {
        "section": "Past",
        "dateTimeRaw": "29/11/2023",
        "dateTimeISO": "2023-11-28T18:30:00.000Z",
        "title": "Investor Meeting - CLSA India Private Limited",
        "icsUrl": "https://in.marketscreener.com/api/stateful/agenda/event-async/Investor-Meeting-CLSA-India-Private-Limited-45431239.ics"
      },
      {
        "section": "Past",
        "dateTimeRaw": "29/11/2023",
        "dateTimeISO": "2023-11-28T18:30:00.000Z",
        "title": "Investor Meeting - BofA Securities India Limited",
        "icsUrl": "https://in.marketscreener.com/api/stateful/agenda/event-async/Investor-Meeting-BofA-Securities-India-Limited-45431238.ics"
      },
      {
        "section": "Past",
        "dateTimeRaw": "28/11/2023",
        "dateTimeISO": "2023-11-27T18:30:00.000Z",
        "title": "Investor Meeting - CLSA India Private Limited",
        "icsUrl": "https://in.marketscreener.com/api/stateful/agenda/event-async/Investor-Meeting-CLSA-India-Private-Limited-45431237.ics"
      },
      {
        "section": "Past",
        "dateTimeRaw": "27/11/2023",
        "dateTimeISO": "2023-11-26T18:30:00.000Z",
        "title": "Investor Meeting - Alta Capital",
        "icsUrl": "https://in.marketscreener.com/api/stateful/agenda/event-async/Investor-Meeting-Alta-Capital-45424230.ics"
      },
      {
        "section": "Past",
        "dateTimeRaw": "23/11/2023",
        "dateTimeISO": "2023-11-22T18:30:00.000Z",
        "title": "JM Financial India Conference",
        "icsUrl": "https://in.marketscreener.com/api/stateful/agenda/event-async/JM-Financial-India-Conference-45404293.ics"
      },
      {
        "section": "Past",
        "dateTimeRaw": "21/11/2023",
        "dateTimeISO": "2023-11-20T18:30:00.000Z",
        "title": "Investor Meeting - Kotak Securities Limited",
        "icsUrl": "https://in.marketscreener.com/api/stateful/agenda/event-async/Investor-Meeting-Kotak-Securities-Limited-45381560.ics"
      },
      {
        "section": "Past",
        "dateTimeRaw": "16/11/2023",
        "dateTimeISO": "2023-11-15T18:30:00.000Z",
        "title": "Investor Meeting - APG Asset Management",
        "icsUrl": "https://in.marketscreener.com/api/stateful/agenda/event-async/Investor-Meeting-APG-Asset-Management-45369574.ics"
      },
      {
        "section": "Past",
        "dateTimeRaw": "09/11/2023 10:30 am",
        "dateTimeISO": "2023-11-09T05:00:00.000Z",
        "title": "Q2 2024 Earnings Call",
        "icsUrl": "https://in.marketscreener.com/api/stateful/agenda/event-async/Q2-2024-Earnings-Call-45334214.ics"
      },
      {
        "section": "Past",
        "dateTimeRaw": "08/11/2023 08:21 pm",
        "dateTimeISO": "2023-11-08T14:51:00.000Z",
        "title": "Q2 2024 Earnings Release",
        "icsUrl": "https://in.marketscreener.com/api/stateful/agenda/event-async/Q2-2024-Earnings-Release-42219688.ics"
      },
      {
        "section": "Past",
        "dateTimeRaw": "13/10/2023",
        "dateTimeISO": "2023-10-12T18:30:00.000Z",
        "title": "Investor Meeting - Sloane Robinson LLP",
        "icsUrl": "https://in.marketscreener.com/api/stateful/agenda/event-async/Investor-Meeting-Sloane-Robinson-LLP-45046352.ics"
      },
      {
        "section": "Past",
        "dateTimeRaw": "28/09/2023",
        "dateTimeISO": "2023-09-27T18:30:00.000Z",
        "title": "Investor Meeting - Goldman Sachs India",
        "icsUrl": "https://in.marketscreener.com/api/stateful/agenda/event-async/Investor-Meeting-Goldman-Sachs-India-44901994.ics"
      },
      {
        "section": "Past",
        "dateTimeRaw": "27/09/2023",
        "dateTimeISO": "2023-09-26T18:30:00.000Z",
        "title": "Investor Meeting",
        "icsUrl": "https://in.marketscreener.com/api/stateful/agenda/event-async/Investor-Meeting-44901988.ics"
      },
      {
        "section": "Past",
        "dateTimeRaw": "26/09/2023",
        "dateTimeISO": "2023-09-25T18:30:00.000Z",
        "title": "Investor Meeting - Nuvama Institutional",
        "icsUrl": "https://in.marketscreener.com/api/stateful/agenda/event-async/Investor-Meeting-Nuvama-Institutional-44901987.ics"
      },
      {
        "section": "Past",
        "dateTimeRaw": "22/09/2023 03:30 pm",
        "dateTimeISO": "2023-09-22T10:00:00.000Z",
        "title": "Annual General Meeting",
        "icsUrl": "https://in.marketscreener.com/api/stateful/agenda/event-async/Annual-General-Meeting-44717659.ics"
      },
      {
        "section": "Past",
        "dateTimeRaw": "21/09/2023",
        "dateTimeISO": "2023-09-20T18:30:00.000Z",
        "title": "Investor Meeting - HSBC Securities",
        "icsUrl": "https://in.marketscreener.com/api/stateful/agenda/event-async/Investor-Meeting-HSBC-Securities-44862507.ics"
      },
      {
        "section": "Past",
        "dateTimeRaw": "18/09/2023",
        "dateTimeISO": "2023-09-17T18:30:00.000Z",
        "title": "Investor Meeting - Motilal Oswal Financial Services Ltd",
        "icsUrl": "https://in.marketscreener.com/api/stateful/agenda/event-async/Investor-Meeting-Motilal-Oswal-Financial-Services-Ltd-44840379.ics"
      },
      {
        "section": "Past",
        "dateTimeRaw": "15/09/2023",
        "dateTimeISO": "2023-09-14T18:30:00.000Z",
        "title": "Investor Meeting - Axis Capital",
        "icsUrl": "https://in.marketscreener.com/api/stateful/agenda/event-async/Investor-Meeting-Axis-Capital-44829874.ics"
      },
      {
        "section": "Past",
        "dateTimeRaw": "15/09/2023",
        "dateTimeISO": "2023-09-14T18:30:00.000Z",
        "title": "Ex-dividend day for final dividend",
        "icsUrl": "https://in.marketscreener.com/api/stateful/agenda/event-async/Ex-dividend-day-for-final-dividend-44808596.ics"
      },
      {
        "section": "Past",
        "dateTimeRaw": "14/09/2023",
        "dateTimeISO": "2023-09-13T18:30:00.000Z",
        "title": "Investor Meeting - Sumitomo Mitsui DS Asset Management",
        "icsUrl": "https://in.marketscreener.com/api/stateful/agenda/event-async/Investor-Meeting-Sumitomo-Mitsui-DS-Asset-Management-44819852.ics"
      },
      {
        "section": "Past",
        "dateTimeRaw": "10/09/2023",
        "dateTimeISO": "2023-09-09T18:30:00.000Z",
        "title": "Investor Meeting - Jefferies",
        "icsUrl": "https://in.marketscreener.com/api/stateful/agenda/event-async/Investor-Meeting-Jefferies-44790239.ics"
      },
      {
        "section": "Past",
        "dateTimeRaw": "06/09/2023",
        "dateTimeISO": "2023-09-05T18:30:00.000Z",
        "title": "Investor Meeting - Elara Capital",
        "icsUrl": "https://in.marketscreener.com/api/stateful/agenda/event-async/Investor-Meeting-Elara-Capital-44769149.ics"
      },
      {
        "section": "Past",
        "dateTimeRaw": "04/09/2023",
        "dateTimeISO": "2023-09-03T18:30:00.000Z",
        "title": "Investor Meeting - Aditya Birla",
        "icsUrl": "https://in.marketscreener.com/api/stateful/agenda/event-async/Investor-Meeting-Aditya-Birla-44739533.ics"
      },
      {
        "section": "Past",
        "dateTimeRaw": "29/08/2023",
        "dateTimeISO": "2023-08-28T18:30:00.000Z",
        "title": "Nirmal Bang Investor Conference",
        "icsUrl": "https://in.marketscreener.com/api/stateful/agenda/event-async/Nirmal-Bang-Investor-Conference-44696974.ics"
      },
      {
        "section": "Past",
        "dateTimeRaw": "25/08/2023 01:00 pm",
        "dateTimeISO": "2023-08-25T07:30:00.000Z",
        "title": "Axis Capital Rrising Stars Conference",
        "icsUrl": "https://in.marketscreener.com/api/stateful/agenda/event-async/Axis-Capital-Rrising-Stars-Conference-44654663.ics"
      },
      {
        "section": "Past",
        "dateTimeRaw": "24/08/2023",
        "dateTimeISO": "2023-08-23T18:30:00.000Z",
        "title": "Investor Meeting - Taiyo Pacific Partners",
        "icsUrl": "https://in.marketscreener.com/api/stateful/agenda/event-async/Investor-Meeting-Taiyo-Pacific-Partners-44666098.ics"
      },
      {
        "section": "Past",
        "dateTimeRaw": "23/08/2023 10:00 am",
        "dateTimeISO": "2023-08-23T04:30:00.000Z",
        "title": "Investor Meeting - Castle Hook Partners",
        "icsUrl": "https://in.marketscreener.com/api/stateful/agenda/event-async/Investor-Meeting-Castle-Hook-Partners-44654660.ics"
      },
      {
        "section": "Past",
        "dateTimeRaw": "22/08/2023 11:00 am",
        "dateTimeISO": "2023-08-22T05:30:00.000Z",
        "title": "Motilal Oswal Global Investor Conference",
        "icsUrl": "https://in.marketscreener.com/api/stateful/agenda/event-async/Motilal-Oswal-Global-Investor-Conference-44646678.ics"
      },
      {
        "section": "Past",
        "dateTimeRaw": "17/08/2023",
        "dateTimeISO": "2023-08-16T18:30:00.000Z",
        "title": "Nuvama India Conference",
        "icsUrl": "https://in.marketscreener.com/api/stateful/agenda/event-async/Nuvama-India-Conference-44624302.ics"
      },
      {
        "section": "Past",
        "dateTimeRaw": "16/08/2023",
        "dateTimeISO": "2023-08-15T18:30:00.000Z",
        "title": "Avendus Spark Conference",
        "icsUrl": "https://in.marketscreener.com/api/stateful/agenda/event-async/Avendus-Spark-Conference-44635614.ics"
      },
      {
        "section": "Past",
        "dateTimeRaw": "11/08/2023",
        "dateTimeISO": "2023-08-10T18:30:00.000Z",
        "title": "Investor Meeting - RBC Asset Management",
        "icsUrl": "https://in.marketscreener.com/api/stateful/agenda/event-async/Investor-Meeting-RBC-Asset-Management-44558695.ics"
      },
      {
        "section": "Past",
        "dateTimeRaw": "09/08/2023 11:30 am",
        "dateTimeISO": "2023-08-09T06:00:00.000Z",
        "title": "Q1 2024 Earnings Call",
        "icsUrl": "https://in.marketscreener.com/api/stateful/agenda/event-async/Q1-2024-Earnings-Call-44558690.ics"
      },
      {
        "section": "Past",
        "dateTimeRaw": "08/08/2023 08:09 pm",
        "dateTimeISO": "2023-08-08T14:39:00.000Z",
        "title": "Q1 2024 Earnings Release",
        "icsUrl": "https://in.marketscreener.com/api/stateful/agenda/event-async/Q1-2024-Earnings-Release-41230454.ics"
      },
      {
        "section": "Past",
        "dateTimeRaw": "19/07/2023",
        "dateTimeISO": "2023-07-18T18:30:00.000Z",
        "title": "Investor Meeting - Lord Abbett",
        "icsUrl": "https://in.marketscreener.com/api/stateful/agenda/event-async/Investor-Meeting-Lord-Abbett-44343677.ics"
      },
      {
        "section": "Past",
        "dateTimeRaw": "30/06/2023",
        "dateTimeISO": "2023-06-29T18:30:00.000Z",
        "title": "Investor Meeting - HSBC Securities",
        "icsUrl": "https://in.marketscreener.com/api/stateful/agenda/event-async/Investor-Meeting-HSBC-Securities-44238239.ics"
      },
      {
        "section": "Past",
        "dateTimeRaw": "06/06/2023",
        "dateTimeISO": "2023-06-05T18:30:00.000Z",
        "title": "Investor Meeting - Tata Mutual Fund",
        "icsUrl": "https://in.marketscreener.com/api/stateful/agenda/event-async/Investor-Meeting-Tata-Mutual-Fund-44077880.ics"
      },
      {
        "section": "Past",
        "dateTimeRaw": "06/06/2023",
        "dateTimeISO": "2023-06-05T18:30:00.000Z",
        "title": "Investor Meeting - HDFC Securities",
        "icsUrl": "https://in.marketscreener.com/api/stateful/agenda/event-async/Investor-Meeting-HDFC-Securities-44077879.ics"
      },
      {
        "section": "Past",
        "dateTimeRaw": "02/06/2023",
        "dateTimeISO": "2023-06-01T18:30:00.000Z",
        "title": "B&K Securities Trinity India Conference",
        "icsUrl": "https://in.marketscreener.com/api/stateful/agenda/event-async/B-K-Securities-Trinity-India-Conference-44036867.ics"
      },
      {
        "section": "Past",
        "dateTimeRaw": "01/06/2023",
        "dateTimeISO": "2023-05-31T18:30:00.000Z",
        "title": "Investor Meeting - J.P. Morgan",
        "icsUrl": "https://in.marketscreener.com/api/stateful/agenda/event-async/Investor-Meeting-J-P-Morgan-44008993.ics"
      },
      {
        "section": "Past",
        "dateTimeRaw": "26/05/2023",
        "dateTimeISO": "2023-05-25T18:30:00.000Z",
        "title": "Investor Meeting - Jefferies",
        "icsUrl": "https://in.marketscreener.com/api/stateful/agenda/event-async/Investor-Meeting-Jefferies-43969501.ics"
      },
      {
        "section": "Past",
        "dateTimeRaw": "25/05/2023 11:30 am",
        "dateTimeISO": "2023-05-25T06:00:00.000Z",
        "title": "Q4 2023 Earnings Call",
        "icsUrl": "https://in.marketscreener.com/api/stateful/agenda/event-async/Q4-2023-Earnings-Call-43915115.ics"
      },
      {
        "section": "Past",
        "dateTimeRaw": "24/05/2023 10:45 pm",
        "dateTimeISO": "2023-05-24T17:15:00.000Z",
        "title": "Q4 2023 Earnings Release",
        "icsUrl": "https://in.marketscreener.com/api/stateful/agenda/event-async/Q4-2023-Earnings-Release-40506746.ics"
      },
      {
        "section": "Past",
        "dateTimeRaw": "13/03/2023",
        "dateTimeISO": "2023-03-12T18:30:00.000Z",
        "title": "Investor Meeting - Kumpulan Wang Amanah Persaraan",
        "icsUrl": "https://in.marketscreener.com/api/stateful/agenda/event-async/Investor-Meeting-Kumpulan-Wang-Amanah-Persaraan-43283680.ics"
      },
      {
        "section": "Past",
        "dateTimeRaw": "27/02/2023",
        "dateTimeISO": "2023-02-26T18:30:00.000Z",
        "title": "Investor Meeting",
        "icsUrl": "https://in.marketscreener.com/api/stateful/agenda/event-async/Investor-Meeting-43090843.ics"
      },
      {
        "section": "Past",
        "dateTimeRaw": "23/02/2023",
        "dateTimeISO": "2023-02-22T18:30:00.000Z",
        "title": "HSBC Institutiona Equities Conference",
        "icsUrl": "https://in.marketscreener.com/api/stateful/agenda/event-async/HSBC-Institutiona-Equities-Conference-43090798.ics"
      },
      {
        "section": "Past",
        "dateTimeRaw": "21/02/2023",
        "dateTimeISO": "2023-02-20T18:30:00.000Z",
        "title": "Kotak Chasing Growth Conference",
        "icsUrl": "https://in.marketscreener.com/api/stateful/agenda/event-async/Kotak-Chasing-Growth-Conference-43090743.ics"
      },
      {
        "section": "Past",
        "dateTimeRaw": "17/02/2023",
        "dateTimeISO": "2023-02-16T18:30:00.000Z",
        "title": "Investor Meeting",
        "icsUrl": "https://in.marketscreener.com/api/stateful/agenda/event-async/Investor-Meeting-43028913.ics"
      },
      {
        "section": "Past",
        "dateTimeRaw": "16/02/2023",
        "dateTimeISO": "2023-02-15T18:30:00.000Z",
        "title": "IIFL Securities Enterprising India Conference",
        "icsUrl": "https://in.marketscreener.com/api/stateful/agenda/event-async/IIFL-Securities-Enterprising-India-Conference-43028885.ics"
      },
      {
        "section": "Past",
        "dateTimeRaw": "09/02/2023",
        "dateTimeISO": "2023-02-08T18:30:00.000Z",
        "title": "Nuvama India Conference",
        "icsUrl": "https://in.marketscreener.com/api/stateful/agenda/event-async/Nuvama-India-Conference-42965350.ics"
      },
      {
        "section": "Past",
        "dateTimeRaw": "08/02/2023 12:00 pm",
        "dateTimeISO": "2023-02-08T06:30:00.000Z",
        "title": "Q3 2023 Earnings Call",
        "icsUrl": "https://in.marketscreener.com/api/stateful/agenda/event-async/Q3-2023-Earnings-Call-42901606.ics"
      },
      {
        "section": "Past",
        "dateTimeRaw": "07/02/2023 06:05 pm",
        "dateTimeISO": "2023-02-07T12:35:00.000Z",
        "title": "Q3 2023 Earnings Release",
        "icsUrl": "https://in.marketscreener.com/api/stateful/agenda/event-async/Q3-2023-Earnings-Release-37792626.ics"
      },
      {
        "section": "Past",
        "dateTimeRaw": "26/01/2023",
        "dateTimeISO": "2023-01-25T18:30:00.000Z",
        "title": "Investor Meeting",
        "icsUrl": "https://in.marketscreener.com/api/stateful/agenda/event-async/Investor-Meeting-42839292.ics"
      },
      {
        "section": "Past",
        "dateTimeRaw": "24/01/2023",
        "dateTimeISO": "2023-01-23T18:30:00.000Z",
        "title": "Investor Meeting - Newport Asia",
        "icsUrl": "https://in.marketscreener.com/api/stateful/agenda/event-async/Investor-Meeting-Newport-Asia-42839264.ics"
      },
      {
        "section": "Past",
        "dateTimeRaw": "06/12/2022",
        "dateTimeISO": "2022-12-05T18:30:00.000Z",
        "title": "Investor Meeting - Taiyo Pacific Partners LP",
        "icsUrl": "https://in.marketscreener.com/api/stateful/agenda/event-async/Investor-Meeting-Taiyo-Pacific-Partners-LP-42521517.ics"
      },
      {
        "section": "Past",
        "dateTimeRaw": "06/12/2022",
        "dateTimeISO": "2022-12-05T18:30:00.000Z",
        "title": "Investor Meeting - Macquarie Capital Securities (India) Private Limited",
        "icsUrl": "https://in.marketscreener.com/api/stateful/agenda/event-async/Investor-Meeting-Macquarie-Capital-Securities-India-Private-Limited-42521516.ics"
      },
      {
        "section": "Past",
        "dateTimeRaw": "06/12/2022",
        "dateTimeISO": "2022-12-05T18:30:00.000Z",
        "title": "J.P. Morgan India Emerging Opportunities Forum",
        "icsUrl": "https://in.marketscreener.com/api/stateful/agenda/event-async/J-P-Morgan-India-Emerging-Opportunities-Forum-42521515.ics"
      },
      {
        "section": "Past",
        "dateTimeRaw": "05/12/2022",
        "dateTimeISO": "2022-12-04T18:30:00.000Z",
        "title": "Investor Meeting - Elephant Asset Management",
        "icsUrl": "https://in.marketscreener.com/api/stateful/agenda/event-async/Investor-Meeting-Elephant-Asset-Management-42521509.ics"
      },
      {
        "section": "Past",
        "dateTimeRaw": "05/12/2022",
        "dateTimeISO": "2022-12-04T18:30:00.000Z",
        "title": "Investor Meeting - Nuvama Wealth Management Limited",
        "icsUrl": "https://in.marketscreener.com/api/stateful/agenda/event-async/Investor-Meeting-Nuvama-Wealth-Management-Limited-42521508.ics"
      },
      {
        "section": "Past",
        "dateTimeRaw": "29/11/2022",
        "dateTimeISO": "2022-11-28T18:30:00.000Z",
        "title": "Investor Meeting",
        "icsUrl": "https://in.marketscreener.com/api/stateful/agenda/event-async/Investor-Meeting-42471153.ics"
      },
      {
        "section": "Past",
        "dateTimeRaw": "17/11/2022",
        "dateTimeISO": "2022-11-16T18:30:00.000Z",
        "title": "Roadshow - Day 2",
        "icsUrl": "https://in.marketscreener.com/api/stateful/agenda/event-async/Roadshow-Day-2-42366558.ics"
      },
      {
        "section": "Past",
        "dateTimeRaw": "16/11/2022",
        "dateTimeISO": "2022-11-15T18:30:00.000Z",
        "title": "Roadshow - Day 1",
        "icsUrl": "https://in.marketscreener.com/api/stateful/agenda/event-async/Roadshow-Day-1-42366537.ics"
      },
      {
        "section": "Past",
        "dateTimeRaw": "15/11/2022",
        "dateTimeISO": "2022-11-14T18:30:00.000Z",
        "title": "CLSA Investor Conference",
        "icsUrl": "https://in.marketscreener.com/api/stateful/agenda/event-async/CLSA-Investor-Conference-42366503.ics"
      },
      {
        "section": "Past",
        "dateTimeRaw": "10/11/2022",
        "dateTimeISO": "2022-11-09T18:30:00.000Z",
        "title": "Investor Meeting - Organized by Nuvama Wealth Management Limited",
        "icsUrl": "https://in.marketscreener.com/api/stateful/agenda/event-async/Investor-Meeting-Organized-by-Nuvama-Wealth-Management-Limited-42295571.ics"
      },
      {
        "section": "Past",
        "dateTimeRaw": "09/11/2022 12:30 pm",
        "dateTimeISO": "2022-11-09T07:00:00.000Z",
        "title": "Interim 2023 Earnings Call",
        "icsUrl": "https://in.marketscreener.com/api/stateful/agenda/event-async/Interim-2023-Earnings-Call-42219282.ics"
      },
      {
        "section": "Past",
        "dateTimeRaw": "08/11/2022 05:54 pm",
        "dateTimeISO": "2022-11-08T12:24:00.000Z",
        "title": "Interim 2023 Earnings Release",
        "icsUrl": "https://in.marketscreener.com/api/stateful/agenda/event-async/Interim-2023-Earnings-Release-36842780.ics"
      },
      {
        "section": "Past",
        "dateTimeRaw": "17/10/2022",
        "dateTimeISO": "2022-10-16T18:30:00.000Z",
        "title": "Investor Meeting - HDFC MF",
        "icsUrl": "https://in.marketscreener.com/api/stateful/agenda/event-async/Investor-Meeting-HDFC-MF-42149418.ics"
      },
      {
        "section": "Past",
        "dateTimeRaw": "12/10/2022",
        "dateTimeISO": "2022-10-11T18:30:00.000Z",
        "title": "Investor Meeting - Morgan Stanley",
        "icsUrl": "https://in.marketscreener.com/api/stateful/agenda/event-async/Investor-Meeting-Morgan-Stanley-42149387.ics"
      },
      {
        "section": "Past",
        "dateTimeRaw": "06/10/2022",
        "dateTimeISO": "2022-10-05T18:30:00.000Z",
        "title": "Investor Meeting - ICICI Prudential Life Insurance",
        "icsUrl": "https://in.marketscreener.com/api/stateful/agenda/event-async/Investor-Meeting-ICICI-Prudential-Life-Insurance-41963081.ics"
      },
      {
        "section": "Past",
        "dateTimeRaw": "30/09/2022",
        "dateTimeISO": "2022-09-29T18:30:00.000Z",
        "title": "Investor Meeting",
        "icsUrl": "https://in.marketscreener.com/api/stateful/agenda/event-async/Investor-Meeting-41907590.ics"
      },
      {
        "section": "Past",
        "dateTimeRaw": "27/09/2022",
        "dateTimeISO": "2022-09-26T18:30:00.000Z",
        "title": "Investor Meeting - Jefferies",
        "icsUrl": "https://in.marketscreener.com/api/stateful/agenda/event-async/Investor-Meeting-Jefferies-41907543.ics"
      },
      {
        "section": "Past",
        "dateTimeRaw": "26/09/2022",
        "dateTimeISO": "2022-09-25T18:30:00.000Z",
        "title": "Investor Meeting - Jefferies",
        "icsUrl": "https://in.marketscreener.com/api/stateful/agenda/event-async/Investor-Meeting-Jefferies-41907535.ics"
      },
      {
        "section": "Past",
        "dateTimeRaw": "21/09/2022",
        "dateTimeISO": "2022-09-20T18:30:00.000Z",
        "title": "HSBC Global Emerging Markets Forum",
        "icsUrl": "https://in.marketscreener.com/api/stateful/agenda/event-async/HSBC-Global-Emerging-Markets-Forum-41854170.ics"
      },
      {
        "section": "Past",
        "dateTimeRaw": "20/09/2022 03:30 pm",
        "dateTimeISO": "2022-09-20T10:00:00.000Z",
        "title": "Annual General Meeting",
        "icsUrl": "https://in.marketscreener.com/api/stateful/agenda/event-async/Annual-General-Meeting-41627097.ics"
      },
      {
        "section": "Past",
        "dateTimeRaw": "16/09/2022",
        "dateTimeISO": "2022-09-15T18:30:00.000Z",
        "title": "Investor Meeting - B&K Securities",
        "icsUrl": "https://in.marketscreener.com/api/stateful/agenda/event-async/Investor-Meeting-B-K-Securities-41800022.ics"
      },
      {
        "section": "Past",
        "dateTimeRaw": "13/09/2022",
        "dateTimeISO": "2022-09-12T18:30:00.000Z",
        "title": "Investor Meeting - Eastspring Investments",
        "icsUrl": "https://in.marketscreener.com/api/stateful/agenda/event-async/Investor-Meeting-Eastspring-Investments-41799955.ics"
      },
      {
        "section": "Past",
        "dateTimeRaw": "12/09/2022",
        "dateTimeISO": "2022-09-11T18:30:00.000Z",
        "title": "Ex-dividend day for final dividend",
        "icsUrl": "https://in.marketscreener.com/api/stateful/agenda/event-async/Ex-dividend-day-for-final-dividend-41619621.ics"
      },
      {
        "section": "Past",
        "dateTimeRaw": "07/09/2022",
        "dateTimeISO": "2022-09-06T18:30:00.000Z",
        "title": "Investor Meeting - TT International",
        "icsUrl": "https://in.marketscreener.com/api/stateful/agenda/event-async/Investor-Meeting-TT-International-41742133.ics"
      },
      {
        "section": "Past",
        "dateTimeRaw": "07/09/2022",
        "dateTimeISO": "2022-09-06T18:30:00.000Z",
        "title": "Spark Capital Investor Conference",
        "icsUrl": "https://in.marketscreener.com/api/stateful/agenda/event-async/Spark-Capital-Investor-Conference-41742126.ics"
      },
      {
        "section": "Past",
        "dateTimeRaw": "02/09/2022",
        "dateTimeISO": "2022-09-01T18:30:00.000Z",
        "title": "Goldman Sachs Virtual Real Estate Forum",
        "icsUrl": "https://in.marketscreener.com/api/stateful/agenda/event-async/Goldman-Sachs-Virtual-Real-Estate-Forum-41690238.ics"
      },
      {
        "section": "Past",
        "dateTimeRaw": "12/08/2022 12:00 pm",
        "dateTimeISO": "2022-08-12T06:30:00.000Z",
        "title": "Q1 2023 Earnings Call",
        "icsUrl": "https://in.marketscreener.com/api/stateful/agenda/event-async/Q1-2023-Earnings-Call-41230153.ics"
      },
      {
        "section": "Past",
        "dateTimeRaw": "11/08/2022 07:25 pm",
        "dateTimeISO": "2022-08-11T13:55:00.000Z",
        "title": "Q1 2023 Earnings Release",
        "icsUrl": "https://in.marketscreener.com/api/stateful/agenda/event-async/Q1-2023-Earnings-Release-31038588.ics"
      },
      {
        "section": "Past",
        "dateTimeRaw": "30/06/2022",
        "dateTimeISO": "2022-06-29T18:30:00.000Z",
        "title": "India Real Estate Forum",
        "icsUrl": "https://in.marketscreener.com/api/stateful/agenda/event-async/India-Real-Estate-Forum-40885370.ics"
      },
      {
        "section": "Past",
        "dateTimeRaw": "16/06/2022",
        "dateTimeISO": "2022-06-15T18:30:00.000Z",
        "title": "Investor Meeting",
        "icsUrl": "https://in.marketscreener.com/api/stateful/agenda/event-async/Investor-Meeting-40761291.ics"
      },
      {
        "section": "Past",
        "dateTimeRaw": "09/06/2022",
        "dateTimeISO": "2022-06-08T18:30:00.000Z",
        "title": "Motilal Oswal Ideation Conference",
        "icsUrl": "https://in.marketscreener.com/api/stateful/agenda/event-async/Motilal-Oswal-Ideation-Conference-40703068.ics"
      },
      {
        "section": "Past",
        "dateTimeRaw": "07/06/2022",
        "dateTimeISO": "2022-06-06T18:30:00.000Z",
        "title": "Morgan Stanley Virtual India Conference",
        "icsUrl": "https://in.marketscreener.com/api/stateful/agenda/event-async/Morgan-Stanley-Virtual-India-Conference-40701500.ics"
      },
      {
        "section": "Past",
        "dateTimeRaw": "25/05/2022 11:00 am",
        "dateTimeISO": "2022-05-25T05:30:00.000Z",
        "title": "FY 2022 Earnings Call",
        "icsUrl": "https://in.marketscreener.com/api/stateful/agenda/event-async/FY-2022-Earnings-Call-40506509.ics"
      },
      {
        "section": "Past",
        "dateTimeRaw": "24/05/2022 09:16 pm",
        "dateTimeISO": "2022-05-24T15:46:00.000Z",
        "title": "FY 2022 Earnings Release",
        "icsUrl": "https://in.marketscreener.com/api/stateful/agenda/event-async/FY-2022-Earnings-Release-36031924.ics"
      },
      {
        "section": "Past",
        "dateTimeRaw": "24/02/2022",
        "dateTimeISO": "2022-02-23T18:30:00.000Z",
        "title": "Kotak Chasing Growth Conference",
        "icsUrl": "https://in.marketscreener.com/api/stateful/agenda/event-async/Kotak-Chasing-Growth-Conference-38153489.ics"
      },
      {
        "section": "Past",
        "dateTimeRaw": "17/02/2022",
        "dateTimeISO": "2022-02-16T18:30:00.000Z",
        "title": "Axis Capital India Conference",
        "icsUrl": "https://in.marketscreener.com/api/stateful/agenda/event-async/Axis-Capital-India-Conference-38153413.ics"
      },
      {
        "section": "Past",
        "dateTimeRaw": "16/02/2022",
        "dateTimeISO": "2022-02-15T18:30:00.000Z",
        "title": "Jefferies Investor Conference",
        "icsUrl": "https://in.marketscreener.com/api/stateful/agenda/event-async/Jefferies-Investor-Conference-38153387.ics"
      },
      {
        "section": "Past",
        "dateTimeRaw": "15/02/2022",
        "dateTimeISO": "2022-02-14T18:30:00.000Z",
        "title": "Nirmal Bang Investor Conference",
        "icsUrl": "https://in.marketscreener.com/api/stateful/agenda/event-async/Nirmal-Bang-Investor-Conference-38153368.ics"
      },
      {
        "section": "Past",
        "dateTimeRaw": "14/02/2022",
        "dateTimeISO": "2022-02-13T18:30:00.000Z",
        "title": "IIFL Enterprising India Investor Conference",
        "icsUrl": "https://in.marketscreener.com/api/stateful/agenda/event-async/IIFL-Enterprising-India-Investor-Conference-38153347.ics"
      },
      {
        "section": "Past",
        "dateTimeRaw": "11/02/2022",
        "dateTimeISO": "2022-02-10T18:30:00.000Z",
        "title": "Edelweiss India Conference",
        "icsUrl": "https://in.marketscreener.com/api/stateful/agenda/event-async/Edelweiss-India-Conference-38153300.ics"
      },
      {
        "section": "Past",
        "dateTimeRaw": "10/02/2022",
        "dateTimeISO": "2022-02-09T18:30:00.000Z",
        "title": "Build India, New India Conference",
        "icsUrl": "https://in.marketscreener.com/api/stateful/agenda/event-async/Build-India-New-India-Conference-38153269.ics"
      },
      {
        "section": "Past",
        "dateTimeRaw": "08/02/2022 11:30 am",
        "dateTimeISO": "2022-02-08T06:00:00.000Z",
        "title": "Q3 2022 Earnings Call",
        "icsUrl": "https://in.marketscreener.com/api/stateful/agenda/event-async/Q3-2022-Earnings-Call-37792276.ics"
      },
      {
        "section": "Past",
        "dateTimeRaw": "07/02/2022 07:25 pm",
        "dateTimeISO": "2022-02-07T13:55:00.000Z",
        "title": "Q3 2022 Earnings Release",
        "icsUrl": "https://in.marketscreener.com/api/stateful/agenda/event-async/Q3-2022-Earnings-Release-32378146.ics"
      },
      {
        "section": "Past",
        "dateTimeRaw": "10/12/2021",
        "dateTimeISO": "2021-12-09T18:30:00.000Z",
        "title": "Edelweiss Emerging Ideas Conference",
        "icsUrl": "https://in.marketscreener.com/api/stateful/agenda/event-async/Edelweiss-Emerging-Ideas-Conference-37289114.ics"
      },
      {
        "section": "Past",
        "dateTimeRaw": "18/11/2021",
        "dateTimeISO": "2021-11-17T18:30:00.000Z",
        "title": "CITIC CLSA India Forum",
        "icsUrl": "https://in.marketscreener.com/api/stateful/agenda/event-async/CITIC-CLSA-India-Forum-37010696.ics"
      },
      {
        "section": "Past",
        "dateTimeRaw": "15/11/2021",
        "dateTimeISO": "2021-11-14T18:30:00.000Z",
        "title": "Centrum Orion Big Ideas Growth Conference",
        "icsUrl": "https://in.marketscreener.com/api/stateful/agenda/event-async/Centrum-Orion-Big-Ideas-Growth-Conference-37010612.ics"
      },
      {
        "section": "Past",
        "dateTimeRaw": "02/11/2021 12:00 pm",
        "dateTimeISO": "2021-11-02T06:30:00.000Z",
        "title": "Interim 2022 Earnings Call",
        "icsUrl": "https://in.marketscreener.com/api/stateful/agenda/event-async/Interim-2022-Earnings-Call-36842296.ics"
      },
      {
        "section": "Past",
        "dateTimeRaw": "01/11/2021 08:31 pm",
        "dateTimeISO": "2021-11-01T15:01:00.000Z",
        "title": "Interim 2022 Earnings Release",
        "icsUrl": "https://in.marketscreener.com/api/stateful/agenda/event-async/Interim-2022-Earnings-Release-31717271.ics"
      },
      {
        "section": "Past",
        "dateTimeRaw": "24/09/2021 03:30 pm",
        "dateTimeISO": "2021-09-24T10:00:00.000Z",
        "title": "Annual General Meeting",
        "icsUrl": "https://in.marketscreener.com/api/stateful/agenda/event-async/Annual-General-Meeting-36347178.ics"
      },
      {
        "section": "Past",
        "dateTimeRaw": "16/09/2021",
        "dateTimeISO": "2021-09-15T18:30:00.000Z",
        "title": "Ex-dividend day for final dividend",
        "icsUrl": "https://in.marketscreener.com/api/stateful/agenda/event-async/Ex-dividend-day-for-final-dividend-36339971.ics"
      },
      {
        "section": "Past",
        "dateTimeRaw": "14/09/2021",
        "dateTimeISO": "2021-09-13T18:30:00.000Z",
        "title": "Motilal Oswal Global Investor Conference",
        "icsUrl": "https://in.marketscreener.com/api/stateful/agenda/event-async/Motilal-Oswal-Global-Investor-Conference-36460696.ics"
      },
      {
        "section": "Past",
        "dateTimeRaw": "26/08/2021",
        "dateTimeISO": "2021-08-25T18:30:00.000Z",
        "title": "Rising Stars Conference",
        "icsUrl": "https://in.marketscreener.com/api/stateful/agenda/event-async/Rising-Stars-Conference-36346754.ics"
      },
      {
        "section": "Past",
        "dateTimeRaw": "24/08/2021",
        "dateTimeISO": "2021-08-23T18:30:00.000Z",
        "title": "Investor Meeting - Kotak Institutional Equities",
        "icsUrl": "https://in.marketscreener.com/api/stateful/agenda/event-async/Investor-Meeting-Kotak-Institutional-Equities-36584935.ics"
      },
      {
        "section": "Past",
        "dateTimeRaw": "07/08/2021 12:00 pm",
        "dateTimeISO": "2021-08-07T06:30:00.000Z",
        "title": "Q1 2022 Earnings Call",
        "icsUrl": "https://in.marketscreener.com/api/stateful/agenda/event-async/Q1-2022-Earnings-Call-36104217.ics"
      },
      {
        "section": "Past",
        "dateTimeRaw": "06/08/2021 07:09 pm",
        "dateTimeISO": "2021-08-06T13:39:00.000Z",
        "title": "Q1 2022 Earnings Release",
        "icsUrl": "https://in.marketscreener.com/api/stateful/agenda/event-async/Q1-2022-Earnings-Release-30767608.ics"
      },
      {
        "section": "Past",
        "dateTimeRaw": "29/05/2021 12:00 pm",
        "dateTimeISO": "2021-05-29T06:30:00.000Z",
        "title": "FY 2021 Earnings Call",
        "icsUrl": "https://in.marketscreener.com/api/stateful/agenda/event-async/FY-2021-Earnings-Call-35056239.ics"
      },
      {
        "section": "Past",
        "dateTimeRaw": "27/05/2021 10:49 pm",
        "dateTimeISO": "2021-05-27T17:19:00.000Z",
        "title": "FY 2021 Earnings Release",
        "icsUrl": "https://in.marketscreener.com/api/stateful/agenda/event-async/FY-2021-Earnings-Release-33330428.ics"
      },
      {
        "section": "Past",
        "dateTimeRaw": "13/02/2021 11:30 am",
        "dateTimeISO": "2021-02-13T06:00:00.000Z",
        "title": "Q3 2021 Earnings Call",
        "icsUrl": "https://in.marketscreener.com/api/stateful/agenda/event-async/Q3-2021-Earnings-Call-32437253.ics"
      },
      {
        "section": "Past",
        "dateTimeRaw": "12/02/2021",
        "dateTimeISO": "2021-02-11T18:30:00.000Z",
        "title": "Q3 2021 Earnings Release",
        "icsUrl": "https://in.marketscreener.com/api/stateful/agenda/event-async/Q3-2021-Earnings-Release-29965907.ics"
      },
      {
        "section": "Past",
        "dateTimeRaw": "13/11/2020 11:30 am",
        "dateTimeISO": "2020-11-13T06:00:00.000Z",
        "title": "Interim 2021 Earnings Call",
        "icsUrl": "https://in.marketscreener.com/api/stateful/agenda/event-async/Interim-2021-Earnings-Call-31783983.ics"
      },
      {
        "section": "Past",
        "dateTimeRaw": "12/11/2020",
        "dateTimeISO": "2020-11-11T18:30:00.000Z",
        "title": "Interim 2021 Earnings Release",
        "icsUrl": "https://in.marketscreener.com/api/stateful/agenda/event-async/Interim-2021-Earnings-Release-29555608.ics"
      },
      {
        "section": "Past",
        "dateTimeRaw": "30/07/2020 12:00 pm",
        "dateTimeISO": "2020-07-30T06:30:00.000Z",
        "title": "Q1 2021 Earnings Call",
        "icsUrl": "https://in.marketscreener.com/api/stateful/agenda/event-async/Q1-2021-Earnings-Call-31038120.ics"
      },
      {
        "section": "Past",
        "dateTimeRaw": "29/07/2020",
        "dateTimeISO": "2020-07-28T18:30:00.000Z",
        "title": "Q1 2021 Earnings Release",
        "icsUrl": "https://in.marketscreener.com/api/stateful/agenda/event-async/Q1-2021-Earnings-Release-29010162.ics"
      },
      {
        "section": "Past",
        "dateTimeRaw": "30/06/2020 12:00 pm",
        "dateTimeISO": "2020-06-30T06:30:00.000Z",
        "title": "FY 2020 Earnings Call",
        "icsUrl": "https://in.marketscreener.com/api/stateful/agenda/event-async/FY-2020-Earnings-Call-30836243.ics"
      },
      {
        "section": "Past",
        "dateTimeRaw": "29/06/2020",
        "dateTimeISO": "2020-06-28T18:30:00.000Z",
        "title": "FY 2020 Earnings Release",
        "icsUrl": "https://in.marketscreener.com/api/stateful/agenda/event-async/FY-2020-Earnings-Release-30836198.ics"
      },
      {
        "section": "Past",
        "dateTimeRaw": "11/02/2020 11:30 am",
        "dateTimeISO": "2020-02-11T06:00:00.000Z",
        "title": "Q3 2020 Earnings Call",
        "icsUrl": "https://in.marketscreener.com/api/stateful/agenda/event-async/Q3-2020-Earnings-Call-29963146.ics"
      },
      {
        "section": "Past",
        "dateTimeRaw": "10/02/2020",
        "dateTimeISO": "2020-02-09T18:30:00.000Z",
        "title": "Q3 2020 Earnings Release",
        "icsUrl": "https://in.marketscreener.com/api/stateful/agenda/event-async/Q3-2020-Earnings-Release-29008836.ics"
      },
      {
        "section": "Past",
        "dateTimeRaw": "12/11/2019 02:00 pm",
        "dateTimeISO": "2019-11-12T08:30:00.000Z",
        "title": "Interim 2020 Earnings Call",
        "icsUrl": "https://in.marketscreener.com/api/stateful/agenda/event-async/Interim-2020-Earnings-Call-29549018.ics"
      },
      {
        "section": "Past",
        "dateTimeRaw": "11/11/2019",
        "dateTimeISO": "2019-11-10T18:30:00.000Z",
        "title": "Interim 2020 Earnings Release",
        "icsUrl": "https://in.marketscreener.com/api/stateful/agenda/event-async/Interim-2020-Earnings-Release-28298653.ics"
      },
      {
        "section": "Past",
        "dateTimeRaw": "24/09/2019 03:30 pm",
        "dateTimeISO": "2019-09-24T10:00:00.000Z",
        "title": "Annual General Meeting",
        "icsUrl": "https://in.marketscreener.com/api/stateful/agenda/event-async/Annual-General-Meeting-29173101.ics"
      },
      {
        "section": "Past",
        "dateTimeRaw": "08/08/2019 11:00 am",
        "dateTimeISO": "2019-08-08T05:30:00.000Z",
        "title": "Q1 2020 Earnings Call",
        "icsUrl": "https://in.marketscreener.com/api/stateful/agenda/event-async/Q1-2020-Earnings-Call-29044474.ics"
      },
      {
        "section": "Past",
        "dateTimeRaw": "07/08/2019",
        "dateTimeISO": "2019-08-06T18:30:00.000Z",
        "title": "Q1 2020 Earnings Release",
        "icsUrl": "https://in.marketscreener.com/api/stateful/agenda/event-async/Q1-2020-Earnings-Release-27988671.ics"
      }
    ]
  },
  "pastDividends": {
    "count": 20,
    "dividends": [
      {
        "section": "Past Dividends",
        "dateRaw": "15/09/2025",
        "dateISO": "2025-09-14T18:30:00.000Z",
        "type": "Annual",
        "amount": 2.5,
        "currency": "INR",
        "title": "Annual 2.5 INR"
      },
      {
        "section": "Past Dividends",
        "dateRaw": "20/08/2024",
        "dateISO": "2024-08-19T18:30:00.000Z",
        "type": "Annual",
        "amount": 5,
        "currency": "INR",
        "title": "Annual 5 INR"
      },
      {
        "section": "Past Dividends",
        "dateRaw": "15/09/2023",
        "dateISO": "2023-09-14T18:30:00.000Z",
        "type": "Annual",
        "amount": 5,
        "currency": "INR",
        "title": "Annual 5 INR"
      },
      {
        "section": "Past Dividends",
        "dateRaw": "12/09/2022",
        "dateISO": "2022-09-11T18:30:00.000Z",
        "type": "Annual",
        "amount": 2.4,
        "currency": "INR",
        "title": "Annual 2.4 INR"
      },
      {
        "section": "Past Dividends",
        "dateRaw": "16/09/2021",
        "dateISO": "2021-09-15T18:30:00.000Z",
        "type": "Annual",
        "amount": 1,
        "currency": "INR",
        "title": "Annual 1 INR"
      },
      {
        "section": "Past Dividends",
        "dateRaw": "17/09/2019",
        "dateISO": "2019-09-16T18:30:00.000Z",
        "type": "Annual",
        "amount": 3,
        "currency": "INR",
        "title": "Annual 3 INR"
      },
      {
        "section": "Past Dividends",
        "dateRaw": "11/09/2018",
        "dateISO": "2018-09-10T18:30:00.000Z",
        "type": "Annual",
        "amount": 2.6,
        "currency": "INR",
        "title": "Annual 2.6 INR"
      },
      {
        "section": "Past Dividends",
        "dateRaw": "18/09/2017",
        "dateISO": "2017-09-17T18:30:00.000Z",
        "type": "Annual",
        "amount": 2.4,
        "currency": "INR",
        "title": "Annual 2.4 INR"
      },
      {
        "section": "Past Dividends",
        "dateRaw": "31/08/2016",
        "dateISO": "2016-08-30T18:30:00.000Z",
        "type": "Final Payment",
        "amount": 0.45,
        "currency": "INR",
        "title": "Final Payment 0.45 INR"
      },
      {
        "section": "Past Dividends",
        "dateRaw": "17/03/2016",
        "dateISO": "2016-03-16T18:30:00.000Z",
        "type": "Interim Payment",
        "amount": 1.75,
        "currency": "INR",
        "title": "Interim Payment 1.75 INR"
      },
      {
        "section": "Past Dividends",
        "dateRaw": "02/09/2015",
        "dateISO": "2015-09-01T18:30:00.000Z",
        "type": "Annual",
        "amount": 2.2,
        "currency": "INR",
        "title": "Annual 2.2 INR"
      },
      {
        "section": "Past Dividends",
        "dateRaw": "13/08/2014",
        "dateISO": "2014-08-12T18:30:00.000Z",
        "type": "Annual",
        "amount": 2.2,
        "currency": "INR",
        "title": "Annual 2.2 INR"
      },
      {
        "section": "Past Dividends",
        "dateRaw": "12/08/2013",
        "dateISO": "2013-08-11T18:30:00.000Z",
        "type": "Annual",
        "amount": 2.2,
        "currency": "INR",
        "title": "Annual 2.2 INR"
      },
      {
        "section": "Past Dividends",
        "dateRaw": "10/08/2012",
        "dateISO": "2012-08-09T18:30:00.000Z",
        "type": "Annual",
        "amount": 2,
        "currency": "INR",
        "title": "Annual 2 INR"
      },
      {
        "section": "Past Dividends",
        "dateRaw": "09/09/2011",
        "dateISO": "2011-09-08T18:30:00.000Z",
        "type": "Annual",
        "amount": 1.8,
        "currency": "INR",
        "title": "Annual 1.8 INR"
      },
      {
        "section": "Past Dividends",
        "dateRaw": "17/09/2010",
        "dateISO": "2010-09-16T18:30:00.000Z",
        "type": "Annual",
        "amount": 1.2,
        "currency": "INR",
        "title": "Annual 1.2 INR"
      },
      {
        "section": "Past Dividends",
        "dateRaw": "11/09/2009",
        "dateISO": "2009-09-10T18:30:00.000Z",
        "type": "Annual",
        "amount": 1,
        "currency": "INR",
        "title": "Annual 1 INR"
      },
      {
        "section": "Past Dividends",
        "dateRaw": "12/09/2008",
        "dateISO": "2008-09-11T18:30:00.000Z",
        "type": "Annual",
        "amount": 1,
        "currency": "INR",
        "title": "Annual 1 INR"
      },
      {
        "section": "Past Dividends",
        "dateRaw": "25/10/2007",
        "dateISO": "2007-10-24T18:30:00.000Z",
        "type": "Annual",
        "amount": 3,
        "currency": "INR",
        "title": "Annual 3 INR"
      },
      {
        "section": "Past Dividends",
        "dateRaw": "07/09/2006",
        "dateISO": "2006-09-06T18:30:00.000Z",
        "type": "Annual",
        "amount": 2,
        "currency": "INR",
        "title": "Annual 2 INR"
      }
    ]
  }
}