{
  "companyCode": "THERMAX-LIMITED-9058890",
  "timestamp": "2025-10-13T12:27:30.010Z",
  "annualResults": {
    "2023": {
      "Net salesMillion INR": {
        "metric": "Net salesMillion INR",
        "unit": "Million INR",
        "fiscalMonth": "March",
        "year": "2023",
        "released": "80 898",
        "forecast": "81 263",
        "spreadRaw": "-0.45%"
      },
      "EBITDAMillion INR": {
        "metric": "EBITDAMillion INR",
        "unit": "Million INR",
        "fiscalMonth": "March",
        "year": "2023",
        "released": "5 976",
        "forecast": "5 966",
        "spreadRaw": "0.16%"
      },
      "EBITMillion INR": {
        "metric": "EBITMillion INR",
        "unit": "Million INR",
        "fiscalMonth": "March",
        "year": "2023",
        "released": "4 807",
        "forecast": "5 128",
        "spreadRaw": "-6.26%"
      },
      "Earnings before Tax (EBT)Million INR": {
        "metric": "Earnings before Tax (EBT)Million INR",
        "unit": "Million INR",
        "fiscalMonth": "March",
        "year": "2023",
        "released": "6 031",
        "forecast": "5 967",
        "spreadRaw": "1.07%"
      },
      "Net incomeMillion INR": {
        "metric": "Net incomeMillion INR",
        "unit": "Million INR",
        "fiscalMonth": "March",
        "year": "2023",
        "released": "4 503",
        "forecast": "4 441",
        "spreadRaw": "1.39%"
      },
      "EPS INR": {
        "metric": "EPS INR",
        "unit": "INR",
        "fiscalMonth": "March",
        "year": "2023",
        "released": "40,0",
        "forecast": "39,4",
        "spreadRaw": "1.36%"
      },
      "Announcement Date": {
        "metric": "Announcement Date",
        "unit": null,
        "fiscalMonth": "March",
        "year": "2023",
        "released": "17/05/23",
        "forecast": null,
        "spreadRaw": null
      }
    },
    "2024": {
      "Net salesMillion INR": {
        "metric": "Net salesMillion INR",
        "unit": "Million INR",
        "fiscalMonth": "March",
        "year": "2024",
        "released": "93 235",
        "forecast": "92 426",
        "spreadRaw": "0.88%"
      },
      "EBITDAMillion INR": {
        "metric": "EBITDAMillion INR",
        "unit": "Million INR",
        "fiscalMonth": "March",
        "year": "2024",
        "released": "7 966",
        "forecast": "7 606",
        "spreadRaw": "4.73%"
      },
      "EBITMillion INR": {
        "metric": "EBITMillion INR",
        "unit": "Million INR",
        "fiscalMonth": "March",
        "year": "2024",
        "released": "6 485",
        "forecast": "6 249",
        "spreadRaw": "3.78%"
      },
      "Earnings before Tax (EBT)Million INR": {
        "metric": "Earnings before Tax (EBT)Million INR",
        "unit": "Million INR",
        "fiscalMonth": "March",
        "year": "2024",
        "released": "8 690",
        "forecast": "7 869",
        "spreadRaw": "10.43%"
      },
      "Net incomeMillion INR": {
        "metric": "Net incomeMillion INR",
        "unit": "Million INR",
        "fiscalMonth": "March",
        "year": "2024",
        "released": "6 453",
        "forecast": "5 963",
        "spreadRaw": "8.21%"
      },
      "EPS INR": {
        "metric": "EPS INR",
        "unit": "INR",
        "fiscalMonth": "March",
        "year": "2024",
        "released": "57,3",
        "forecast": "51,3",
        "spreadRaw": "11.68%"
      },
      "Announcement Date": {
        "metric": "Announcement Date",
        "unit": null,
        "fiscalMonth": "March",
        "year": "2024",
        "released": "10/05/24",
        "forecast": null,
        "spreadRaw": null
      }
    },
    "2025": {
      "Net salesMillion INR": {
        "metric": "Net salesMillion INR",
        "unit": "Million INR",
        "fiscalMonth": "March",
        "year": "2025",
        "released": "103 887",
        "forecast": "104 209",
        "spreadRaw": "-0.31%"
      },
      "EBITDAMillion INR": {
        "metric": "EBITDAMillion INR",
        "unit": "Million INR",
        "fiscalMonth": "March",
        "year": "2025",
        "released": "9 075",
        "forecast": "9 082",
        "spreadRaw": "-0.08%"
      },
      "EBITMillion INR": {
        "metric": "EBITMillion INR",
        "unit": "Million INR",
        "fiscalMonth": "March",
        "year": "2025",
        "released": "7 490",
        "forecast": "7 557",
        "spreadRaw": "-0.88%"
      },
      "Earnings before Tax (EBT)Million INR": {
        "metric": "Earnings before Tax (EBT)Million INR",
        "unit": "Million INR",
        "fiscalMonth": "March",
        "year": "2025",
        "released": "8 845",
        "forecast": "8 685",
        "spreadRaw": "1.84%"
      },
      "Net incomeMillion INR": {
        "metric": "Net incomeMillion INR",
        "unit": "Million INR",
        "fiscalMonth": "March",
        "year": "2025",
        "released": "6 345",
        "forecast": "6 476",
        "spreadRaw": "-2.03%"
      },
      "EPS INR": {
        "metric": "EPS INR",
        "unit": "INR",
        "fiscalMonth": "March",
        "year": "2025",
        "released": "56,3",
        "forecast": "56,3",
        "spreadRaw": "0.05%"
      },
      "Announcement Date": {
        "metric": "Announcement Date",
        "unit": null,
        "fiscalMonth": "March",
        "year": "2025",
        "released": "09/05/25",
        "forecast": null,
        "spreadRaw": null
      }
    },
    "2026": {
      "Net salesMillion INR": {
        "metric": "Net salesMillion INR",
        "unit": "Million INR",
        "fiscalMonth": "March",
        "year": "2026",
        "released": null,
        "forecast": "116 196",
        "spreadRaw": null
      },
      "EBITDAMillion INR": {
        "metric": "EBITDAMillion INR",
        "unit": "Million INR",
        "fiscalMonth": "March",
        "year": "2026",
        "released": null,
        "forecast": "11 406",
        "spreadRaw": null
      },
      "EBITMillion INR": {
        "metric": "EBITMillion INR",
        "unit": "Million INR",
        "fiscalMonth": "March",
        "year": "2026",
        "released": null,
        "forecast": "9 334",
        "spreadRaw": null
      },
      "Earnings before Tax (EBT)Million INR": {
        "metric": "Earnings before Tax (EBT)Million INR",
        "unit": "Million INR",
        "fiscalMonth": "March",
        "year": "2026",
        "released": null,
        "forecast": "10 540",
        "spreadRaw": null
      },
      "Net incomeMillion INR": {
        "metric": "Net incomeMillion INR",
        "unit": "Million INR",
        "fiscalMonth": "March",
        "year": "2026",
        "released": null,
        "forecast": "7 781",
        "spreadRaw": null
      },
      "EPS INR": {
        "metric": "EPS INR",
        "unit": "INR",
        "fiscalMonth": "March",
        "year": "2026",
        "released": null,
        "forecast": "67,6",
        "spreadRaw": null
      },
      "Announcement Date": {
        "metric": "Announcement Date",
        "unit": null,
        "fiscalMonth": "March",
        "year": "2026",
        "released": "-",
        "forecast": null,
        "spreadRaw": null
      }
    },
    "2027": {
      "Net salesMillion INR": {
        "metric": "Net salesMillion INR",
        "unit": "Million INR",
        "fiscalMonth": "March",
        "year": "2027",
        "released": null,
        "forecast": "133 258",
        "spreadRaw": null
      },
      "EBITDAMillion INR": {
        "metric": "EBITDAMillion INR",
        "unit": "Million INR",
        "fiscalMonth": "March",
        "year": "2027",
        "released": null,
        "forecast": "13 905",
        "spreadRaw": null
      },
      "EBITMillion INR": {
        "metric": "EBITMillion INR",
        "unit": "Million INR",
        "fiscalMonth": "March",
        "year": "2027",
        "released": null,
        "forecast": "11 801",
        "spreadRaw": null
      },
      "Earnings before Tax (EBT)Million INR": {
        "metric": "Earnings before Tax (EBT)Million INR",
        "unit": "Million INR",
        "fiscalMonth": "March",
        "year": "2027",
        "released": null,
        "forecast": "12 972",
        "spreadRaw": null
      },
      "Net incomeMillion INR": {
        "metric": "Net incomeMillion INR",
        "unit": "Million INR",
        "fiscalMonth": "March",
        "year": "2027",
        "released": null,
        "forecast": "9 704",
        "spreadRaw": null
      },
      "EPS INR": {
        "metric": "EPS INR",
        "unit": "INR",
        "fiscalMonth": "March",
        "year": "2027",
        "released": null,
        "forecast": "83,9",
        "spreadRaw": null
      },
      "Announcement Date": {
        "metric": "Announcement Date",
        "unit": null,
        "fiscalMonth": "March",
        "year": "2027",
        "released": null,
        "forecast": null,
        "spreadRaw": null
      }
    },
    "2028": {
      "Net salesMillion INR": {
        "metric": "Net salesMillion INR",
        "unit": "Million INR",
        "fiscalMonth": "March",
        "year": "2028",
        "released": null,
        "forecast": "149 856",
        "spreadRaw": null
      },
      "EBITDAMillion INR": {
        "metric": "EBITDAMillion INR",
        "unit": "Million INR",
        "fiscalMonth": "March",
        "year": "2028",
        "released": null,
        "forecast": "16 514",
        "spreadRaw": null
      },
      "EBITMillion INR": {
        "metric": "EBITMillion INR",
        "unit": "Million INR",
        "fiscalMonth": "March",
        "year": "2028",
        "released": null,
        "forecast": "14 481",
        "spreadRaw": null
      },
      "Earnings before Tax (EBT)Million INR": {
        "metric": "Earnings before Tax (EBT)Million INR",
        "unit": "Million INR",
        "fiscalMonth": "March",
        "year": "2028",
        "released": null,
        "forecast": "15 755",
        "spreadRaw": null
      },
      "Net incomeMillion INR": {
        "metric": "Net incomeMillion INR",
        "unit": "Million INR",
        "fiscalMonth": "March",
        "year": "2028",
        "released": null,
        "forecast": "11 585",
        "spreadRaw": null
      },
      "EPS INR": {
        "metric": "EPS INR",
        "unit": "INR",
        "fiscalMonth": "March",
        "year": "2028",
        "released": null,
        "forecast": "100",
        "spreadRaw": null
      },
      "Announcement Date": {
        "metric": "Announcement Date",
        "unit": null,
        "fiscalMonth": "March",
        "year": "2028",
        "released": null,
        "forecast": null,
        "spreadRaw": null
      }
    }
  },
  "quarterlyResults": {
    "2024 Q2": {
      "Net salesMillion INR": {
        "metric": "Net salesMillion INR",
        "unit": "Million INR",
        "fiscalMonth": "March",
        "period": "2024 Q2",
        "released": "23 025",
        "releasedNum": 23025,
        "forecast": "23 323",
        "forecastNum": 23323,
        "spreadRaw": "-1.28%",
        "spreadPct": -1.28
      },
      "EBITDAMillion INR": {
        "metric": "EBITDAMillion INR",
        "unit": "Million INR",
        "fiscalMonth": "March",
        "period": "2024 Q2",
        "released": "2 044",
        "releasedNum": 2044,
        "forecast": "1 822",
        "forecastNum": 1822,
        "spreadRaw": "12.18%",
        "spreadPct": 12.18
      },
      "EBITMillion INR": {
        "metric": "EBITMillion INR",
        "unit": "Million INR",
        "fiscalMonth": "March",
        "period": "2024 Q2",
        "released": "1 714",
        "releasedNum": 1714,
        "forecast": "1 345",
        "forecastNum": 1345,
        "spreadRaw": "27.49%",
        "spreadPct": 27.49
      },
      "Earnings before Tax (EBT)Million INR": {
        "metric": "Earnings before Tax (EBT)Million INR",
        "unit": "Million INR",
        "fiscalMonth": "March",
        "period": "2024 Q2",
        "released": "2 175",
        "releasedNum": 2175,
        "forecast": "1 825",
        "forecastNum": 1825,
        "spreadRaw": "19.19%",
        "spreadPct": 19.19
      },
      "Net incomeMillion INR": {
        "metric": "Net incomeMillion INR",
        "unit": "Million INR",
        "fiscalMonth": "March",
        "period": "2024 Q2",
        "released": "1 586",
        "releasedNum": 1586,
        "forecast": "1 326",
        "forecastNum": 1326,
        "spreadRaw": "19.57%",
        "spreadPct": 19.57
      },
      "EPS INR": {
        "metric": "EPS INR",
        "unit": "INR",
        "fiscalMonth": "March",
        "period": "2024 Q2",
        "released": "14,0",
        "releasedNum": 14,
        "forecast": "10,7",
        "forecastNum": 10.7,
        "spreadRaw": "31.09%",
        "spreadPct": 31.09
      },
      "Announcement Date": {
        "metric": "Announcement Date",
        "unit": null,
        "fiscalMonth": "March",
        "period": "2024 Q2",
        "released": "03/11/23",
        "releasedDate": "03/11/23",
        "forecast": null,
        "spreadRaw": null,
        "spreadPct": null
      }
    },
    "2024 Q3": {
      "Net salesMillion INR": {
        "metric": "Net salesMillion INR",
        "unit": "Million INR",
        "fiscalMonth": "March",
        "period": "2024 Q3",
        "released": "23 244",
        "releasedNum": 23244,
        "forecast": "23 511",
        "forecastNum": 23511,
        "spreadRaw": "-1.14%",
        "spreadPct": -1.14
      },
      "EBITDAMillion INR": {
        "metric": "EBITDAMillion INR",
        "unit": "Million INR",
        "fiscalMonth": "March",
        "period": "2024 Q3",
        "released": "1 874",
        "releasedNum": 1874,
        "forecast": "2 081",
        "forecastNum": 2081,
        "spreadRaw": "-9.94%",
        "spreadPct": -9.94
      },
      "EBITMillion INR": {
        "metric": "EBITMillion INR",
        "unit": "Million INR",
        "fiscalMonth": "March",
        "period": "2024 Q3",
        "released": "1 516",
        "releasedNum": 1516,
        "forecast": "1 553",
        "forecastNum": 1553,
        "spreadRaw": "-2.41%",
        "spreadPct": -2.41
      },
      "Earnings before Tax (EBT)Million INR": {
        "metric": "Earnings before Tax (EBT)Million INR",
        "unit": "Million INR",
        "fiscalMonth": "March",
        "period": "2024 Q3",
        "released": "3 092",
        "releasedNum": 3092,
        "forecast": "2 038",
        "forecastNum": 2038,
        "spreadRaw": "51.72%",
        "spreadPct": 51.72
      },
      "Net incomeMillion INR": {
        "metric": "Net incomeMillion INR",
        "unit": "Million INR",
        "fiscalMonth": "March",
        "period": "2024 Q3",
        "released": "2 383",
        "releasedNum": 2383,
        "forecast": "1 548",
        "forecastNum": 1548,
        "spreadRaw": "53.95%",
        "spreadPct": 53.95
      },
      "EPS INR": {
        "metric": "EPS INR",
        "unit": "INR",
        "fiscalMonth": "March",
        "period": "2024 Q3",
        "released": "21,2",
        "releasedNum": 21.2,
        "forecast": "13,1",
        "forecastNum": 13.1,
        "spreadRaw": "61.11%",
        "spreadPct": 61.11
      },
      "Announcement Date": {
        "metric": "Announcement Date",
        "unit": null,
        "fiscalMonth": "March",
        "period": "2024 Q3",
        "released": "08/02/24",
        "releasedDate": "08/02/24",
        "forecast": null,
        "spreadRaw": null,
        "spreadPct": null
      }
    },
    "2024 Q4": {
      "Net salesMillion INR": {
        "metric": "Net salesMillion INR",
        "unit": "Million INR",
        "fiscalMonth": "March",
        "period": "2024 Q4",
        "released": "27 637",
        "releasedNum": 27637,
        "forecast": "26 645",
        "forecastNum": 26645,
        "spreadRaw": "3.72%",
        "spreadPct": 3.72
      },
      "EBITDAMillion INR": {
        "metric": "EBITDAMillion INR",
        "unit": "Million INR",
        "fiscalMonth": "March",
        "period": "2024 Q4",
        "released": "2 733",
        "releasedNum": 2733,
        "forecast": "2 340",
        "forecastNum": 2340,
        "spreadRaw": "16.81%",
        "spreadPct": 16.81
      },
      "EBITMillion INR": {
        "metric": "EBITMillion INR",
        "unit": "Million INR",
        "fiscalMonth": "March",
        "period": "2024 Q4",
        "released": "2 234",
        "releasedNum": 2234,
        "forecast": "1 958",
        "forecastNum": 1958,
        "spreadRaw": "14.09%",
        "spreadPct": 14.09
      },
      "Earnings before Tax (EBT)Million INR": {
        "metric": "Earnings before Tax (EBT)Million INR",
        "unit": "Million INR",
        "fiscalMonth": "March",
        "period": "2024 Q4",
        "released": "2 509",
        "releasedNum": 2509,
        "forecast": "2 257",
        "forecastNum": 2257,
        "spreadRaw": "11.15%",
        "spreadPct": 11.15
      },
      "Net incomeMillion INR": {
        "metric": "Net incomeMillion INR",
        "unit": "Million INR",
        "fiscalMonth": "March",
        "period": "2024 Q4",
        "released": "1 903",
        "releasedNum": 1903,
        "forecast": "1 833",
        "forecastNum": 1833,
        "spreadRaw": "3.84%",
        "spreadPct": 3.84
      },
      "EPS INR": {
        "metric": "EPS INR",
        "unit": "INR",
        "fiscalMonth": "March",
        "period": "2024 Q4",
        "released": "16,9",
        "releasedNum": 16.9,
        "forecast": "16,4",
        "forecastNum": 16.4,
        "spreadRaw": "2.77%",
        "spreadPct": 2.77
      },
      "Announcement Date": {
        "metric": "Announcement Date",
        "unit": null,
        "fiscalMonth": "March",
        "period": "2024 Q4",
        "released": "10/05/24",
        "releasedDate": "10/05/24",
        "forecast": null,
        "spreadRaw": null,
        "spreadPct": null
      }
    },
    "2025 Q1": {
      "Net salesMillion INR": {
        "metric": "Net salesMillion INR",
        "unit": "Million INR",
        "fiscalMonth": "March",
        "period": "2025 Q1",
        "released": "21 844",
        "releasedNum": 21844,
        "forecast": "22 513",
        "forecastNum": 22513,
        "spreadRaw": "-2.97%",
        "spreadPct": -2.97
      },
      "EBITDAMillion INR": {
        "metric": "EBITDAMillion INR",
        "unit": "Million INR",
        "fiscalMonth": "March",
        "period": "2025 Q1",
        "released": "1 412",
        "releasedNum": 1412,
        "forecast": "1 917",
        "forecastNum": 1917,
        "spreadRaw": "-26.37%",
        "spreadPct": -26.37
      },
      "EBITMillion INR": {
        "metric": "EBITMillion INR",
        "unit": "Million INR",
        "fiscalMonth": "March",
        "period": "2025 Q1",
        "released": "1 051",
        "releasedNum": 1051,
        "forecast": "1 660",
        "forecastNum": 1660,
        "spreadRaw": "-36.67%",
        "spreadPct": -36.67
      },
      "Earnings before Tax (EBT)Million INR": {
        "metric": "Earnings before Tax (EBT)Million INR",
        "unit": "Million INR",
        "fiscalMonth": "March",
        "period": "2025 Q1",
        "released": "1 613",
        "releasedNum": 1613,
        "forecast": "1 796",
        "forecastNum": 1796,
        "spreadRaw": "-10.2%",
        "spreadPct": -10.2
      },
      "Net incomeMillion INR": {
        "metric": "Net incomeMillion INR",
        "unit": "Million INR",
        "fiscalMonth": "March",
        "period": "2025 Q1",
        "released": "1 158",
        "releasedNum": 1158,
        "forecast": "1 346",
        "forecastNum": 1346,
        "spreadRaw": "-13.96%",
        "spreadPct": -13.96
      },
      "EPS INR": {
        "metric": "EPS INR",
        "unit": "INR",
        "fiscalMonth": "March",
        "period": "2025 Q1",
        "released": "10,3",
        "releasedNum": 10.3,
        "forecast": "12,3",
        "forecastNum": 12.3,
        "spreadRaw": "-16.49%",
        "spreadPct": -16.49
      },
      "Announcement Date": {
        "metric": "Announcement Date",
        "unit": null,
        "fiscalMonth": "March",
        "period": "2025 Q1",
        "released": "01/08/24",
        "releasedDate": "01/08/24",
        "forecast": null,
        "spreadRaw": null,
        "spreadPct": null
      }
    },
    "2025 Q2": {
      "Net salesMillion INR": {
        "metric": "Net salesMillion INR",
        "unit": "Million INR",
        "fiscalMonth": "March",
        "period": "2025 Q2",
        "released": "26 116",
        "releasedNum": 26116,
        "forecast": "25 556",
        "forecastNum": 25556,
        "spreadRaw": "2.19%",
        "spreadPct": 2.19
      },
      "EBITDAMillion INR": {
        "metric": "EBITDAMillion INR",
        "unit": "Million INR",
        "fiscalMonth": "March",
        "period": "2025 Q2",
        "released": "2 779",
        "releasedNum": 2779,
        "forecast": "2 375",
        "forecastNum": 2375,
        "spreadRaw": "17.02%",
        "spreadPct": 17.02
      },
      "EBITMillion INR": {
        "metric": "EBITMillion INR",
        "unit": "Million INR",
        "fiscalMonth": "March",
        "period": "2025 Q2",
        "released": "2 359",
        "releasedNum": 2359,
        "forecast": "2 081",
        "forecastNum": 2081,
        "spreadRaw": "13.37%",
        "spreadPct": 13.37
      },
      "Earnings before Tax (EBT)Million INR": {
        "metric": "Earnings before Tax (EBT)Million INR",
        "unit": "Million INR",
        "fiscalMonth": "March",
        "period": "2025 Q2",
        "released": "2 663",
        "releasedNum": 2663,
        "forecast": "2 460",
        "forecastNum": 2460,
        "spreadRaw": "8.25%",
        "spreadPct": 8.25
      },
      "Net incomeMillion INR": {
        "metric": "Net incomeMillion INR",
        "unit": "Million INR",
        "fiscalMonth": "March",
        "period": "2025 Q2",
        "released": "1 970",
        "releasedNum": 1970,
        "forecast": "1 817",
        "forecastNum": 1817,
        "spreadRaw": "8.42%",
        "spreadPct": 8.42
      },
      "EPS INR": {
        "metric": "EPS INR",
        "unit": "INR",
        "fiscalMonth": "March",
        "period": "2025 Q2",
        "released": "17,5",
        "releasedNum": 17.5,
        "forecast": "15,7",
        "forecastNum": 15.7,
        "spreadRaw": "11.63%",
        "spreadPct": 11.63
      },
      "Announcement Date": {
        "metric": "Announcement Date",
        "unit": null,
        "fiscalMonth": "March",
        "period": "2025 Q2",
        "released": "13/11/24",
        "releasedDate": "13/11/24",
        "forecast": null,
        "spreadRaw": null,
        "spreadPct": null
      }
    },
    "2025 Q3": {
      "Net salesMillion INR": {
        "metric": "Net salesMillion INR",
        "unit": "Million INR",
        "fiscalMonth": "March",
        "period": "2025 Q3",
        "released": "25 078",
        "releasedNum": 25078,
        "forecast": "26 970",
        "forecastNum": 26970,
        "spreadRaw": "-7.02%",
        "spreadPct": -7.02
      },
      "EBITDAMillion INR": {
        "metric": "EBITDAMillion INR",
        "unit": "Million INR",
        "fiscalMonth": "March",
        "period": "2025 Q3",
        "released": "1 890",
        "releasedNum": 1890,
        "forecast": "2 565",
        "forecastNum": 2565,
        "spreadRaw": "-26.31%",
        "spreadPct": -26.31
      },
      "EBITMillion INR": {
        "metric": "EBITMillion INR",
        "unit": "Million INR",
        "fiscalMonth": "March",
        "period": "2025 Q3",
        "released": "1 539",
        "releasedNum": 1539,
        "forecast": "1 967",
        "forecastNum": 1967,
        "spreadRaw": "-21.74%",
        "spreadPct": -21.74
      },
      "Earnings before Tax (EBT)Million INR": {
        "metric": "Earnings before Tax (EBT)Million INR",
        "unit": "Million INR",
        "fiscalMonth": "March",
        "period": "2025 Q3",
        "released": "1 563",
        "releasedNum": 1563,
        "forecast": "2 316",
        "forecastNum": 2316,
        "spreadRaw": "-32.53%",
        "spreadPct": -32.53
      },
      "Net incomeMillion INR": {
        "metric": "Net incomeMillion INR",
        "unit": "Million INR",
        "fiscalMonth": "March",
        "period": "2025 Q3",
        "released": "1 159",
        "releasedNum": 1159,
        "forecast": "1 834",
        "forecastNum": 1834,
        "spreadRaw": "-36.79%",
        "spreadPct": -36.79
      },
      "EPS INR": {
        "metric": "EPS INR",
        "unit": "INR",
        "fiscalMonth": "March",
        "period": "2025 Q3",
        "released": "10,3",
        "releasedNum": 10.3,
        "forecast": "15,7",
        "forecastNum": 15.7,
        "spreadRaw": "-34.25%",
        "spreadPct": -34.25
      },
      "Announcement Date": {
        "metric": "Announcement Date",
        "unit": null,
        "fiscalMonth": "March",
        "period": "2025 Q3",
        "released": "04/02/25",
        "releasedDate": "04/02/25",
        "forecast": null,
        "spreadRaw": null,
        "spreadPct": null
      }
    },
    "2025 Q4": {
      "Net salesMillion INR": {
        "metric": "Net salesMillion INR",
        "unit": "Million INR",
        "fiscalMonth": "March",
        "period": "2025 Q4",
        "released": "30 849",
        "releasedNum": 30849,
        "forecast": "31 273",
        "forecastNum": 31273,
        "spreadRaw": "-1.36%",
        "spreadPct": -1.36
      },
      "EBITDAMillion INR": {
        "metric": "EBITDAMillion INR",
        "unit": "Million INR",
        "fiscalMonth": "March",
        "period": "2025 Q4",
        "released": "3 004",
        "releasedNum": 3004,
        "forecast": "3 102",
        "forecastNum": 3102,
        "spreadRaw": "-3.16%",
        "spreadPct": -3.16
      },
      "EBITMillion INR": {
        "metric": "EBITMillion INR",
        "unit": "Million INR",
        "fiscalMonth": "March",
        "period": "2025 Q4",
        "released": "2 550",
        "releasedNum": 2550,
        "forecast": "2 709",
        "forecastNum": 2709,
        "spreadRaw": "-5.84%",
        "spreadPct": -5.84
      },
      "Earnings before Tax (EBT)Million INR": {
        "metric": "Earnings before Tax (EBT)Million INR",
        "unit": "Million INR",
        "fiscalMonth": "March",
        "period": "2025 Q4",
        "released": "3 006",
        "releasedNum": 3006,
        "forecast": "2 952",
        "forecastNum": 2952,
        "spreadRaw": "1.85%",
        "spreadPct": 1.85
      },
      "Net incomeMillion INR": {
        "metric": "Net incomeMillion INR",
        "unit": "Million INR",
        "fiscalMonth": "March",
        "period": "2025 Q4",
        "released": "2 057",
        "releasedNum": 2057,
        "forecast": "2 258",
        "forecastNum": 2258,
        "spreadRaw": "-8.88%",
        "spreadPct": -8.88
      },
      "EPS INR": {
        "metric": "EPS INR",
        "unit": "INR",
        "fiscalMonth": "March",
        "period": "2025 Q4",
        "released": "18,3",
        "releasedNum": 18.3,
        "forecast": "17,0",
        "forecastNum": 17,
        "spreadRaw": "7.32%",
        "spreadPct": 7.32
      },
      "Announcement Date": {
        "metric": "Announcement Date",
        "unit": null,
        "fiscalMonth": "March",
        "period": "2025 Q4",
        "released": "09/05/25",
        "releasedDate": "09/05/25",
        "forecast": null,
        "spreadRaw": null,
        "spreadPct": null
      }
    },
    "2026 Q1": {
      "Net salesMillion INR": {
        "metric": "Net salesMillion INR",
        "unit": "Million INR",
        "fiscalMonth": "March",
        "period": "2026 Q1",
        "released": "21 502",
        "releasedNum": 21502,
        "forecast": "24 436",
        "forecastNum": 24436,
        "spreadRaw": "-12.01%",
        "spreadPct": -12.01
      },
      "EBITDAMillion INR": {
        "metric": "EBITDAMillion INR",
        "unit": "Million INR",
        "fiscalMonth": "March",
        "period": "2026 Q1",
        "released": "2 249",
        "releasedNum": 2249,
        "forecast": "1 928",
        "forecastNum": 1928,
        "spreadRaw": "16.64%",
        "spreadPct": 16.64
      },
      "EBITMillion INR": {
        "metric": "EBITMillion INR",
        "unit": "Million INR",
        "fiscalMonth": "March",
        "period": "2026 Q1",
        "released": "1 760",
        "releasedNum": 1760,
        "forecast": "1 685",
        "forecastNum": 1685,
        "spreadRaw": "4.47%",
        "spreadPct": 4.47
      },
      "Earnings before Tax (EBT)Million INR": {
        "metric": "Earnings before Tax (EBT)Million INR",
        "unit": "Million INR",
        "fiscalMonth": "March",
        "period": "2026 Q1",
        "released": "2 115",
        "releasedNum": 2115,
        "forecast": "1 876",
        "forecastNum": 1876,
        "spreadRaw": "12.71%",
        "spreadPct": 12.71
      },
      "Net incomeMillion INR": {
        "metric": "Net incomeMillion INR",
        "unit": "Million INR",
        "fiscalMonth": "March",
        "period": "2026 Q1",
        "released": "1 524",
        "releasedNum": 1524,
        "forecast": "1 408",
        "forecastNum": 1408,
        "spreadRaw": "8.24%",
        "spreadPct": 8.24
      },
      "EPS INR": {
        "metric": "EPS INR",
        "unit": "INR",
        "fiscalMonth": "March",
        "period": "2026 Q1",
        "released": "13,5",
        "releasedNum": 13.5,
        "forecast": "12,7",
        "forecastNum": 12.7,
        "spreadRaw": "6.37%",
        "spreadPct": 6.37
      },
      "Announcement Date": {
        "metric": "Announcement Date",
        "unit": null,
        "fiscalMonth": "March",
        "period": "2026 Q1",
        "released": "31/07/25",
        "releasedDate": "31/07/25",
        "forecast": null,
        "spreadRaw": null,
        "spreadPct": null
      }
    },
    "2026 Q2": {
      "Net salesMillion INR": {
        "metric": "Net salesMillion INR",
        "unit": "Million INR",
        "fiscalMonth": "March",
        "period": "2026 Q2",
        "released": null,
        "releasedNum": null,
        "forecast": "28 228",
        "forecastNum": 28228,
        "spreadRaw": null,
        "spreadPct": null
      },
      "EBITDAMillion INR": {
        "metric": "EBITDAMillion INR",
        "unit": "Million INR",
        "fiscalMonth": "March",
        "period": "2026 Q2",
        "released": null,
        "releasedNum": null,
        "forecast": "2 667",
        "forecastNum": 2667,
        "spreadRaw": null,
        "spreadPct": null
      },
      "EBITMillion INR": {
        "metric": "EBITMillion INR",
        "unit": "Million INR",
        "fiscalMonth": "March",
        "period": "2026 Q2",
        "released": null,
        "releasedNum": null,
        "forecast": "1 900",
        "forecastNum": 1900,
        "spreadRaw": null,
        "spreadPct": null
      },
      "Earnings before Tax (EBT)Million INR": {
        "metric": "Earnings before Tax (EBT)Million INR",
        "unit": "Million INR",
        "fiscalMonth": "March",
        "period": "2026 Q2",
        "released": null,
        "releasedNum": null,
        "forecast": "2 371",
        "forecastNum": 2371,
        "spreadRaw": null,
        "spreadPct": null
      },
      "Net incomeMillion INR": {
        "metric": "Net incomeMillion INR",
        "unit": "Million INR",
        "fiscalMonth": "March",
        "period": "2026 Q2",
        "released": null,
        "releasedNum": null,
        "forecast": "1 808",
        "forecastNum": 1808,
        "spreadRaw": null,
        "spreadPct": null
      },
      "EPS INR": {
        "metric": "EPS INR",
        "unit": "INR",
        "fiscalMonth": "March",
        "period": "2026 Q2",
        "released": null,
        "releasedNum": null,
        "forecast": "14,9",
        "forecastNum": 14.9,
        "spreadRaw": null,
        "spreadPct": null
      },
      "Announcement Date": {
        "metric": "Announcement Date",
        "unit": null,
        "fiscalMonth": "March",
        "period": "2026 Q2",
        "released": "-",
        "releasedDate": "-",
        "forecast": null,
        "spreadRaw": null,
        "spreadPct": null
      }
    },
    "2026 Q3": {
      "Net salesMillion INR": {
        "metric": "Net salesMillion INR",
        "unit": "Million INR",
        "fiscalMonth": "March",
        "period": "2026 Q3",
        "released": null,
        "releasedNum": null,
        "forecast": "28 074",
        "forecastNum": 28074,
        "spreadRaw": null,
        "spreadPct": null
      },
      "EBITDAMillion INR": {
        "metric": "EBITDAMillion INR",
        "unit": "Million INR",
        "fiscalMonth": "March",
        "period": "2026 Q3",
        "released": null,
        "releasedNum": null,
        "forecast": "2 671",
        "forecastNum": 2671,
        "spreadRaw": null,
        "spreadPct": null
      },
      "EBITMillion INR": {
        "metric": "EBITMillion INR",
        "unit": "Million INR",
        "fiscalMonth": "March",
        "period": "2026 Q3",
        "released": null,
        "releasedNum": null,
        "forecast": "2 442",
        "forecastNum": 2442,
        "spreadRaw": null,
        "spreadPct": null
      },
      "Earnings before Tax (EBT)Million INR": {
        "metric": "Earnings before Tax (EBT)Million INR",
        "unit": "Million INR",
        "fiscalMonth": "March",
        "period": "2026 Q3",
        "released": null,
        "releasedNum": null,
        "forecast": "2 413",
        "forecastNum": 2413,
        "spreadRaw": null,
        "spreadPct": null
      },
      "Net incomeMillion INR": {
        "metric": "Net incomeMillion INR",
        "unit": "Million INR",
        "fiscalMonth": "March",
        "period": "2026 Q3",
        "released": null,
        "releasedNum": null,
        "forecast": "2 076",
        "forecastNum": 2076,
        "spreadRaw": null,
        "spreadPct": null
      },
      "EPS INR": {
        "metric": "EPS INR",
        "unit": "INR",
        "fiscalMonth": "March",
        "period": "2026 Q3",
        "released": null,
        "releasedNum": null,
        "forecast": "17,4",
        "forecastNum": 17.4,
        "spreadRaw": null,
        "spreadPct": null
      },
      "Announcement Date": {
        "metric": "Announcement Date",
        "unit": null,
        "fiscalMonth": "March",
        "period": "2026 Q3",
        "released": "-",
        "releasedDate": "-",
        "forecast": null,
        "spreadRaw": null,
        "spreadPct": null
      }
    },
    "2026 Q4": {
      "Net salesMillion INR": {
        "metric": "Net salesMillion INR",
        "unit": "Million INR",
        "fiscalMonth": "March",
        "period": "2026 Q4",
        "released": null,
        "releasedNum": null,
        "forecast": "36 491",
        "forecastNum": 36491,
        "spreadRaw": null,
        "spreadPct": null
      },
      "EBITDAMillion INR": {
        "metric": "EBITDAMillion INR",
        "unit": "Million INR",
        "fiscalMonth": "March",
        "period": "2026 Q4",
        "released": null,
        "releasedNum": null,
        "forecast": "4 043",
        "forecastNum": 4043,
        "spreadRaw": null,
        "spreadPct": null
      },
      "EBITMillion INR": {
        "metric": "EBITMillion INR",
        "unit": "Million INR",
        "fiscalMonth": "March",
        "period": "2026 Q4",
        "released": null,
        "releasedNum": null,
        "forecast": "2 741",
        "forecastNum": 2741,
        "spreadRaw": null,
        "spreadPct": null
      },
      "Earnings before Tax (EBT)Million INR": {
        "metric": "Earnings before Tax (EBT)Million INR",
        "unit": "Million INR",
        "fiscalMonth": "March",
        "period": "2026 Q4",
        "released": null,
        "releasedNum": null,
        "forecast": "3 627",
        "forecastNum": 3627,
        "spreadRaw": null,
        "spreadPct": null
      },
      "Net incomeMillion INR": {
        "metric": "Net incomeMillion INR",
        "unit": "Million INR",
        "fiscalMonth": "March",
        "period": "2026 Q4",
        "released": null,
        "releasedNum": null,
        "forecast": "2 116",
        "forecastNum": 2116,
        "spreadRaw": null,
        "spreadPct": null
      },
      "EPS INR": {
        "metric": "EPS INR",
        "unit": "INR",
        "fiscalMonth": "March",
        "period": "2026 Q4",
        "released": null,
        "releasedNum": null,
        "forecast": "19,0",
        "forecastNum": 19,
        "spreadRaw": null,
        "spreadPct": null
      },
      "Announcement Date": {
        "metric": "Announcement Date",
        "unit": null,
        "fiscalMonth": "March",
        "period": "2026 Q4",
        "released": "-",
        "releasedDate": "-",
        "forecast": null,
        "spreadRaw": null,
        "spreadPct": null
      }
    },
    "2027 Q1": {
      "Net salesMillion INR": {
        "metric": "Net salesMillion INR",
        "unit": "Million INR",
        "fiscalMonth": "March",
        "period": "2027 Q1",
        "released": null,
        "releasedNum": null,
        "forecast": "25 693",
        "forecastNum": 25693,
        "spreadRaw": null,
        "spreadPct": null
      },
      "EBITDAMillion INR": {
        "metric": "EBITDAMillion INR",
        "unit": "Million INR",
        "fiscalMonth": "March",
        "period": "2027 Q1",
        "released": null,
        "releasedNum": null,
        "forecast": null,
        "forecastNum": null,
        "spreadRaw": null,
        "spreadPct": null
      },
      "EBITMillion INR": {
        "metric": "EBITMillion INR",
        "unit": "Million INR",
        "fiscalMonth": "March",
        "period": "2027 Q1",
        "released": null,
        "releasedNum": null,
        "forecast": "1 912",
        "forecastNum": 1912,
        "spreadRaw": null,
        "spreadPct": null
      },
      "Earnings before Tax (EBT)Million INR": {
        "metric": "Earnings before Tax (EBT)Million INR",
        "unit": "Million INR",
        "fiscalMonth": "March",
        "period": "2027 Q1",
        "released": null,
        "releasedNum": null,
        "forecast": null,
        "forecastNum": null,
        "spreadRaw": null,
        "spreadPct": null
      },
      "Net incomeMillion INR": {
        "metric": "Net incomeMillion INR",
        "unit": "Million INR",
        "fiscalMonth": "March",
        "period": "2027 Q1",
        "released": null,
        "releasedNum": null,
        "forecast": null,
        "forecastNum": null,
        "spreadRaw": null,
        "spreadPct": null
      },
      "EPS INR": {
        "metric": "EPS INR",
        "unit": "INR",
        "fiscalMonth": "March",
        "period": "2027 Q1",
        "released": null,
        "releasedNum": null,
        "forecast": "14,5",
        "forecastNum": 14.5,
        "spreadRaw": null,
        "spreadPct": null
      },
      "Announcement Date": {
        "metric": "Announcement Date",
        "unit": null,
        "fiscalMonth": "March",
        "period": "2027 Q1",
        "released": "-",
        "releasedDate": "-",
        "forecast": null,
        "spreadRaw": null,
        "spreadPct": null
      }
    }
  },
  "upcomingEvents": {
    "count": 6,
    "events": [
      {
        "section": "Upcoming",
        "dateTimeRaw": "11/11/2025",
        "dateTimeISO": "2025-11-10T18:30:00.000Z",
        "title": "Q2 2026 Earnings Release",
        "icsUrl": "https://in.marketscreener.com/api/stateful/agenda/event-async/Q2-2026-Earnings-Release-48161804.ics"
      },
      {
        "section": "Upcoming",
        "dateTimeRaw": "10/02/2026",
        "dateTimeISO": "2026-02-09T18:30:00.000Z",
        "title": "Q3 2026 Earnings Release (Projected)",
        "icsUrl": "https://in.marketscreener.com/api/stateful/agenda/event-async/Q3-2026-Earnings-Release-Projected-48751123.ics"
      },
      {
        "section": "Upcoming",
        "dateTimeRaw": "08/05/2026",
        "dateTimeISO": "2026-05-07T18:30:00.000Z",
        "title": "Q4 2026 Earnings Release",
        "icsUrl": "https://in.marketscreener.com/api/stateful/agenda/event-async/Q4-2026-Earnings-Release-48401575.ics"
      },
      {
        "section": "Upcoming",
        "dateTimeRaw": "30/07/2026",
        "dateTimeISO": "2026-07-29T18:30:00.000Z",
        "title": "Q1 2027 Earnings Release (Projected)",
        "icsUrl": "https://in.marketscreener.com/api/stateful/agenda/event-async/Q1-2027-Earnings-Release-Projected-50453269.ics"
      },
      {
        "section": "Upcoming",
        "dateTimeRaw": "11/11/2026",
        "dateTimeISO": "2026-11-10T18:30:00.000Z",
        "title": "Q2 2027 Earnings Release (Projected)",
        "icsUrl": "https://in.marketscreener.com/api/stateful/agenda/event-async/Q2-2027-Earnings-Release-Projected-50453275.ics"
      },
      {
        "section": "Upcoming",
        "dateTimeRaw": "07/05/2027",
        "dateTimeISO": "2027-05-06T18:30:00.000Z",
        "title": "Q4 2027 Earnings Release (Projected)",
        "icsUrl": "https://in.marketscreener.com/api/stateful/agenda/event-async/Q4-2027-Earnings-Release-Projected-50453276.ics"
      }
    ]
  },
  "pastEvents": {
    "count": 80,
    "events": [
      {
        "section": "Past",
        "dateTimeRaw": "01/08/2025 11:15 am",
        "dateTimeISO": "2025-08-01T05:45:00.000Z",
        "title": "Q1 2026 Earnings Call",
        "icsUrl": "https://in.marketscreener.com/api/stateful/agenda/event-async/Q1-2026-Earnings-Call-50551396.ics"
      },
      {
        "section": "Past",
        "dateTimeRaw": "31/07/2025 04:30 pm",
        "dateTimeISO": "2025-07-31T11:00:00.000Z",
        "title": "Annual General Meeting",
        "icsUrl": "https://in.marketscreener.com/api/stateful/agenda/event-async/Annual-General-Meeting-50444091.ics"
      },
      {
        "section": "Past",
        "dateTimeRaw": "31/07/2025 04:00 pm",
        "dateTimeISO": "2025-07-31T10:30:00.000Z",
        "title": "Q1 2026 Earnings Release",
        "icsUrl": "https://in.marketscreener.com/api/stateful/agenda/event-async/Q1-2026-Earnings-Release-47464154.ics"
      },
      {
        "section": "Past",
        "dateTimeRaw": "04/07/2025",
        "dateTimeISO": "2025-07-03T18:30:00.000Z",
        "title": "Ex-dividend day for final dividend",
        "icsUrl": "https://in.marketscreener.com/api/stateful/agenda/event-async/Ex-dividend-day-for-final-dividend-49989089.ics"
      },
      {
        "section": "Past",
        "dateTimeRaw": "06/06/2025",
        "dateTimeISO": "2025-06-05T18:30:00.000Z",
        "title": "Investor Meeting - ApaH Capital",
        "icsUrl": "https://in.marketscreener.com/api/stateful/agenda/event-async/Investor-Meeting-ApaH-Capital-50119977.ics"
      },
      {
        "section": "Past",
        "dateTimeRaw": "05/06/2025",
        "dateTimeISO": "2025-06-04T18:30:00.000Z",
        "title": "Investor Meeting - Lazard Asset Management",
        "icsUrl": "https://in.marketscreener.com/api/stateful/agenda/event-async/Investor-Meeting-Lazard-Asset-Management-50119972.ics"
      },
      {
        "section": "Past",
        "dateTimeRaw": "30/05/2025",
        "dateTimeISO": "2025-05-29T18:30:00.000Z",
        "title": "B&K Securities Trinity India Investor Conference",
        "icsUrl": "https://in.marketscreener.com/api/stateful/agenda/event-async/B-K-Securities-Trinity-India-Investor-Conference-50069440.ics"
      },
      {
        "section": "Past",
        "dateTimeRaw": "14/05/2025 11:15 am",
        "dateTimeISO": "2025-05-14T05:45:00.000Z",
        "title": "Q4 2025 Earnings Call",
        "icsUrl": "https://in.marketscreener.com/api/stateful/agenda/event-async/Q4-2025-Earnings-Call-49887866.ics"
      },
      {
        "section": "Past",
        "dateTimeRaw": "09/05/2025 06:31 pm",
        "dateTimeISO": "2025-05-09T13:01:00.000Z",
        "title": "Q4 2025 Earnings Release",
        "icsUrl": "https://in.marketscreener.com/api/stateful/agenda/event-async/Q4-2025-Earnings-Release-46644025.ics"
      },
      {
        "section": "Past",
        "dateTimeRaw": "07/02/2025 11:15 am",
        "dateTimeISO": "2025-02-07T05:45:00.000Z",
        "title": "Q3 2025 Earnings Call",
        "icsUrl": "https://in.marketscreener.com/api/stateful/agenda/event-async/Q3-2025-Earnings-Call-48920447.ics"
      },
      {
        "section": "Past",
        "dateTimeRaw": "04/02/2025 02:56 pm",
        "dateTimeISO": "2025-02-04T09:26:00.000Z",
        "title": "Q3 2025 Earnings Release",
        "icsUrl": "https://in.marketscreener.com/api/stateful/agenda/event-async/Q3-2025-Earnings-Release-45808453.ics"
      },
      {
        "section": "Past",
        "dateTimeRaw": "14/11/2024 11:15 am",
        "dateTimeISO": "2024-11-14T05:45:00.000Z",
        "title": "Q2 2025 Earnings Call",
        "icsUrl": "https://in.marketscreener.com/api/stateful/agenda/event-async/Q2-2025-Earnings-Call-48318958.ics"
      },
      {
        "section": "Past",
        "dateTimeRaw": "13/11/2024 04:15 pm",
        "dateTimeISO": "2024-11-13T10:45:00.000Z",
        "title": "Q2 2025 Earnings Release",
        "icsUrl": "https://in.marketscreener.com/api/stateful/agenda/event-async/Q2-2025-Earnings-Release-45064117.ics"
      },
      {
        "section": "Past",
        "dateTimeRaw": "02/08/2024 11:15 am",
        "dateTimeISO": "2024-08-02T05:45:00.000Z",
        "title": "Q1 2025 Earnings Call",
        "icsUrl": "https://in.marketscreener.com/api/stateful/agenda/event-async/Q1-2025-Earnings-Call-47486591.ics"
      },
      {
        "section": "Past",
        "dateTimeRaw": "01/08/2024 04:00 pm",
        "dateTimeISO": "2024-08-01T10:30:00.000Z",
        "title": "Annual General Meeting",
        "icsUrl": "https://in.marketscreener.com/api/stateful/agenda/event-async/Annual-General-Meeting-47340064.ics"
      },
      {
        "section": "Past",
        "dateTimeRaw": "01/08/2024 03:29 pm",
        "dateTimeISO": "2024-08-01T09:59:00.000Z",
        "title": "Q1 2025 Earnings Release",
        "icsUrl": "https://in.marketscreener.com/api/stateful/agenda/event-async/Q1-2025-Earnings-Release-44394403.ics"
      },
      {
        "section": "Past",
        "dateTimeRaw": "05/07/2024",
        "dateTimeISO": "2024-07-04T18:30:00.000Z",
        "title": "Ex-dividend day for final dividend",
        "icsUrl": "https://in.marketscreener.com/api/stateful/agenda/event-async/Ex-dividend-day-for-final-dividend-46766984.ics"
      },
      {
        "section": "Past",
        "dateTimeRaw": "13/05/2024 11:30 am",
        "dateTimeISO": "2024-05-13T06:00:00.000Z",
        "title": "Q4 2024 Earnings Call",
        "icsUrl": "https://in.marketscreener.com/api/stateful/agenda/event-async/Q4-2024-Earnings-Call-46643949.ics"
      },
      {
        "section": "Past",
        "dateTimeRaw": "10/05/2024",
        "dateTimeISO": "2024-05-09T18:30:00.000Z",
        "title": "Q4 2024 Earnings Release",
        "icsUrl": "https://in.marketscreener.com/api/stateful/agenda/event-async/Q4-2024-Earnings-Release-43841383.ics"
      },
      {
        "section": "Past",
        "dateTimeRaw": "20/02/2024",
        "dateTimeISO": "2024-02-19T18:30:00.000Z",
        "title": "Kotak Chasing Growth Conference",
        "icsUrl": "https://in.marketscreener.com/api/stateful/agenda/event-async/Kotak-Chasing-Growth-Conference-45859640.ics"
      },
      {
        "section": "Past",
        "dateTimeRaw": "12/02/2024 11:15 am",
        "dateTimeISO": "2024-02-12T05:45:00.000Z",
        "title": "Q3 2024 Earnings Call",
        "icsUrl": "https://in.marketscreener.com/api/stateful/agenda/event-async/Q3-2024-Earnings-Call-45889485.ics"
      },
      {
        "section": "Past",
        "dateTimeRaw": "08/02/2024 01:58 pm",
        "dateTimeISO": "2024-02-08T08:28:00.000Z",
        "title": "Q3 2024 Earnings Release",
        "icsUrl": "https://in.marketscreener.com/api/stateful/agenda/event-async/Q3-2024-Earnings-Release-42641783.ics"
      },
      {
        "section": "Past",
        "dateTimeRaw": "14/12/2023",
        "dateTimeISO": "2023-12-13T18:30:00.000Z",
        "title": "Investor Meeting",
        "icsUrl": "https://in.marketscreener.com/api/stateful/agenda/event-async/Investor-Meeting-45487627.ics"
      },
      {
        "section": "Past",
        "dateTimeRaw": "06/11/2023 12:00 pm",
        "dateTimeISO": "2023-11-06T06:30:00.000Z",
        "title": "Q2 2024 Earnings Call",
        "icsUrl": "https://in.marketscreener.com/api/stateful/agenda/event-async/Q2-2024-Earnings-Call-45318596.ics"
      },
      {
        "section": "Past",
        "dateTimeRaw": "03/11/2023 04:41 pm",
        "dateTimeISO": "2023-11-03T11:11:00.000Z",
        "title": "Q2 2024 Earnings Release",
        "icsUrl": "https://in.marketscreener.com/api/stateful/agenda/event-async/Q2-2024-Earnings-Release-42291937.ics"
      },
      {
        "section": "Past",
        "dateTimeRaw": "02/08/2023 11:15 am",
        "dateTimeISO": "2023-08-02T05:45:00.000Z",
        "title": "Q1 2024 Earnings Call",
        "icsUrl": "https://in.marketscreener.com/api/stateful/agenda/event-async/Q1-2024-Earnings-Call-44488377.ics"
      },
      {
        "section": "Past",
        "dateTimeRaw": "01/08/2023 04:00 pm",
        "dateTimeISO": "2023-08-01T10:30:00.000Z",
        "title": "Annual General Meeting",
        "icsUrl": "https://in.marketscreener.com/api/stateful/agenda/event-async/Annual-General-Meeting-44276142.ics"
      },
      {
        "section": "Past",
        "dateTimeRaw": "01/08/2023 03:39 pm",
        "dateTimeISO": "2023-08-01T10:09:00.000Z",
        "title": "Q1 2024 Earnings Release",
        "icsUrl": "https://in.marketscreener.com/api/stateful/agenda/event-async/Q1-2024-Earnings-Release-40883642.ics"
      },
      {
        "section": "Past",
        "dateTimeRaw": "21/07/2023",
        "dateTimeISO": "2023-07-20T18:30:00.000Z",
        "title": "Ex-dividend day for final dividend",
        "icsUrl": "https://in.marketscreener.com/api/stateful/agenda/event-async/Ex-dividend-day-for-final-dividend-43962461.ics"
      },
      {
        "section": "Past",
        "dateTimeRaw": "02/06/2023",
        "dateTimeISO": "2023-06-01T18:30:00.000Z",
        "title": "B&K Securities Institutional Conference",
        "icsUrl": "https://in.marketscreener.com/api/stateful/agenda/event-async/B-K-Securities-Institutional-Conference-44020958.ics"
      },
      {
        "section": "Past",
        "dateTimeRaw": "25/05/2023",
        "dateTimeISO": "2023-05-24T18:30:00.000Z",
        "title": "Investor Meeting",
        "icsUrl": "https://in.marketscreener.com/api/stateful/agenda/event-async/Investor-Meeting-43952514.ics"
      },
      {
        "section": "Past",
        "dateTimeRaw": "18/05/2023 11:00 am",
        "dateTimeISO": "2023-05-18T05:30:00.000Z",
        "title": "Q4 2023 Earnings Call",
        "icsUrl": "https://in.marketscreener.com/api/stateful/agenda/event-async/Q4-2023-Earnings-Call-43929248.ics"
      },
      {
        "section": "Past",
        "dateTimeRaw": "17/05/2023",
        "dateTimeISO": "2023-05-16T18:30:00.000Z",
        "title": "Q4 2023 Earnings Release",
        "icsUrl": "https://in.marketscreener.com/api/stateful/agenda/event-async/Q4-2023-Earnings-Release-40497074.ics"
      },
      {
        "section": "Past",
        "dateTimeRaw": "13/02/2023 10:00 am",
        "dateTimeISO": "2023-02-13T04:30:00.000Z",
        "title": "Q3 2023 Earnings Call",
        "icsUrl": "https://in.marketscreener.com/api/stateful/agenda/event-async/Q3-2023-Earnings-Call-42961300.ics"
      },
      {
        "section": "Past",
        "dateTimeRaw": "07/02/2023 07:37 pm",
        "dateTimeISO": "2023-02-07T14:07:00.000Z",
        "title": "Q3 2023 Earnings Release",
        "icsUrl": "https://in.marketscreener.com/api/stateful/agenda/event-async/Q3-2023-Earnings-Release-37679168.ics"
      },
      {
        "section": "Past",
        "dateTimeRaw": "14/11/2022 11:15 am",
        "dateTimeISO": "2022-11-14T05:45:00.000Z",
        "title": "Interim 2023 Earnings Call",
        "icsUrl": "https://in.marketscreener.com/api/stateful/agenda/event-async/Interim-2023-Earnings-Call-42291730.ics"
      },
      {
        "section": "Past",
        "dateTimeRaw": "11/11/2022 04:58 pm",
        "dateTimeISO": "2022-11-11T11:28:00.000Z",
        "title": "Interim 2023 Earnings Release",
        "icsUrl": "https://in.marketscreener.com/api/stateful/agenda/event-async/Interim-2023-Earnings-Release-37007617.ics"
      },
      {
        "section": "Past",
        "dateTimeRaw": "03/08/2022 11:00 am",
        "dateTimeISO": "2022-08-03T05:30:00.000Z",
        "title": "Q1 2023 Earnings Call",
        "icsUrl": "https://in.marketscreener.com/api/stateful/agenda/event-async/Q1-2023-Earnings-Call-41142639.ics"
      },
      {
        "section": "Past",
        "dateTimeRaw": "02/08/2022 04:11 pm",
        "dateTimeISO": "2022-08-02T10:41:00.000Z",
        "title": "Q1 2023 Earnings Release",
        "icsUrl": "https://in.marketscreener.com/api/stateful/agenda/event-async/Q1-2023-Earnings-Release-36028212.ics"
      },
      {
        "section": "Past",
        "dateTimeRaw": "02/08/2022 04:00 pm",
        "dateTimeISO": "2022-08-02T10:30:00.000Z",
        "title": "Annual General Meeting",
        "icsUrl": "https://in.marketscreener.com/api/stateful/agenda/event-async/Annual-General-Meeting-40935979.ics"
      },
      {
        "section": "Past",
        "dateTimeRaw": "21/07/2022",
        "dateTimeISO": "2022-07-20T18:30:00.000Z",
        "title": "Ex-dividend day for final dividend",
        "icsUrl": "https://in.marketscreener.com/api/stateful/agenda/event-async/Ex-dividend-day-for-final-dividend-41006481.ics"
      },
      {
        "section": "Past",
        "dateTimeRaw": "23/05/2022 11:15 am",
        "dateTimeISO": "2022-05-23T05:45:00.000Z",
        "title": "FY 2022 Earnings Call",
        "icsUrl": "https://in.marketscreener.com/api/stateful/agenda/event-async/FY-2022-Earnings-Call-40502566.ics"
      },
      {
        "section": "Past",
        "dateTimeRaw": "20/05/2022 03:21 pm",
        "dateTimeISO": "2022-05-20T09:51:00.000Z",
        "title": "FY 2022 Earnings Release",
        "icsUrl": "https://in.marketscreener.com/api/stateful/agenda/event-async/FY-2022-Earnings-Release-33326721.ics"
      },
      {
        "section": "Past",
        "dateTimeRaw": "14/02/2022 02:00 pm",
        "dateTimeISO": "2022-02-14T08:30:00.000Z",
        "title": "Investor Meeting - Jefferies Equity Research",
        "icsUrl": "https://in.marketscreener.com/api/stateful/agenda/event-async/Investor-Meeting-Jefferies-Equity-Research-39522081.ics"
      },
      {
        "section": "Past",
        "dateTimeRaw": "07/02/2022 02:30 pm",
        "dateTimeISO": "2022-02-07T09:00:00.000Z",
        "title": "Q3 2022 Earnings Call",
        "icsUrl": "https://in.marketscreener.com/api/stateful/agenda/event-async/Q3-2022-Earnings-Call-37788441.ics"
      },
      {
        "section": "Past",
        "dateTimeRaw": "04/02/2022 04:51 pm",
        "dateTimeISO": "2022-02-04T11:21:00.000Z",
        "title": "Q3 2022 Earnings Release",
        "icsUrl": "https://in.marketscreener.com/api/stateful/agenda/event-async/Q3-2022-Earnings-Release-32559972.ics"
      },
      {
        "section": "Past",
        "dateTimeRaw": "12/11/2021 11:15 am",
        "dateTimeISO": "2021-11-12T05:45:00.000Z",
        "title": "Interim 2022 Earnings Call",
        "icsUrl": "https://in.marketscreener.com/api/stateful/agenda/event-async/Interim-2022-Earnings-Call-37007346.ics"
      },
      {
        "section": "Past",
        "dateTimeRaw": "10/11/2021 05:06 pm",
        "dateTimeISO": "2021-11-10T11:36:00.000Z",
        "title": "Interim 2022 Earnings Release",
        "icsUrl": "https://in.marketscreener.com/api/stateful/agenda/event-async/Interim-2022-Earnings-Release-31657351.ics"
      },
      {
        "section": "Past",
        "dateTimeRaw": "09/08/2021 11:15 am",
        "dateTimeISO": "2021-08-09T05:45:00.000Z",
        "title": "Q1 2022 Earnings Call",
        "icsUrl": "https://in.marketscreener.com/api/stateful/agenda/event-async/Q1-2022-Earnings-Call-36100587.ics"
      },
      {
        "section": "Past",
        "dateTimeRaw": "06/08/2021 04:00 pm",
        "dateTimeISO": "2021-08-06T10:30:00.000Z",
        "title": "Annual General Meeting",
        "icsUrl": "https://in.marketscreener.com/api/stateful/agenda/event-async/Annual-General-Meeting-35957715.ics"
      },
      {
        "section": "Past",
        "dateTimeRaw": "05/08/2021 05:40 pm",
        "dateTimeISO": "2021-08-05T12:10:00.000Z",
        "title": "Q1 2022 Earnings Release",
        "icsUrl": "https://in.marketscreener.com/api/stateful/agenda/event-async/Q1-2022-Earnings-Release-30697166.ics"
      },
      {
        "section": "Past",
        "dateTimeRaw": "22/07/2021",
        "dateTimeISO": "2021-07-21T18:30:00.000Z",
        "title": "Ex-dividend day for final dividend",
        "icsUrl": "https://in.marketscreener.com/api/stateful/agenda/event-async/Ex-dividend-day-for-final-dividend-35784015.ics"
      },
      {
        "section": "Past",
        "dateTimeRaw": "26/05/2021 11:15 am",
        "dateTimeISO": "2021-05-26T05:45:00.000Z",
        "title": "FY 2021 Earnings Call",
        "icsUrl": "https://in.marketscreener.com/api/stateful/agenda/event-async/FY-2021-Earnings-Call-33326283.ics"
      },
      {
        "section": "Past",
        "dateTimeRaw": "25/05/2021",
        "dateTimeISO": "2021-05-24T18:30:00.000Z",
        "title": "FY 2021 Earnings Release",
        "icsUrl": "https://in.marketscreener.com/api/stateful/agenda/event-async/FY-2021-Earnings-Release-31082727.ics"
      },
      {
        "section": "Past",
        "dateTimeRaw": "03/02/2021",
        "dateTimeISO": "2021-02-02T18:30:00.000Z",
        "title": "Q3 2021 Earnings Release",
        "icsUrl": "https://in.marketscreener.com/api/stateful/agenda/event-async/Q3-2021-Earnings-Release-30697077.ics"
      },
      {
        "section": "Past",
        "dateTimeRaw": "04/11/2020",
        "dateTimeISO": "2020-11-03T18:30:00.000Z",
        "title": "Interim 2021 Earnings Release",
        "icsUrl": "https://in.marketscreener.com/api/stateful/agenda/event-async/Interim-2021-Earnings-Release-29462746.ics"
      },
      {
        "section": "Past",
        "dateTimeRaw": "13/08/2020 11:30 am",
        "dateTimeISO": "2020-08-13T06:00:00.000Z",
        "title": "Q1 2021 Earnings Call",
        "icsUrl": "https://in.marketscreener.com/api/stateful/agenda/event-async/Q1-2021-Earnings-Call-31123899.ics"
      },
      {
        "section": "Past",
        "dateTimeRaw": "12/08/2020 03:30 pm",
        "dateTimeISO": "2020-08-12T10:00:00.000Z",
        "title": "Annual General Meeting",
        "icsUrl": "https://in.marketscreener.com/api/stateful/agenda/event-async/Annual-General-Meeting-30987416.ics"
      },
      {
        "section": "Past",
        "dateTimeRaw": "12/08/2020",
        "dateTimeISO": "2020-08-11T18:30:00.000Z",
        "title": "Q1 2021 Earnings Release",
        "icsUrl": "https://in.marketscreener.com/api/stateful/agenda/event-async/Q1-2021-Earnings-Release-28899226.ics"
      },
      {
        "section": "Past",
        "dateTimeRaw": "19/06/2020 11:30 am",
        "dateTimeISO": "2020-06-19T06:00:00.000Z",
        "title": "FY 2020 Earnings Call",
        "icsUrl": "https://in.marketscreener.com/api/stateful/agenda/event-async/FY-2020-Earnings-Call-30798723.ics"
      },
      {
        "section": "Past",
        "dateTimeRaw": "18/06/2020",
        "dateTimeISO": "2020-06-17T18:30:00.000Z",
        "title": "Q1 2021 Earnings Release",
        "icsUrl": "https://in.marketscreener.com/api/stateful/agenda/event-async/Q1-2021-Earnings-Release-30696984.ics"
      },
      {
        "section": "Past",
        "dateTimeRaw": "18/06/2020",
        "dateTimeISO": "2020-06-17T18:30:00.000Z",
        "title": "FY 2020 Earnings Release",
        "icsUrl": "https://in.marketscreener.com/api/stateful/agenda/event-async/FY-2020-Earnings-Release-28897523.ics"
      },
      {
        "section": "Past",
        "dateTimeRaw": "20/03/2020",
        "dateTimeISO": "2020-03-19T18:30:00.000Z",
        "title": "Ex-dividend day for dividende intermdiaire",
        "icsUrl": "https://in.marketscreener.com/api/stateful/agenda/event-async/Ex-dividend-day-for-dividende-intermediaire-30164174.ics"
      },
      {
        "section": "Past",
        "dateTimeRaw": "05/02/2020 11:30 am",
        "dateTimeISO": "2020-02-05T06:00:00.000Z",
        "title": "Q3 2020 Earnings Call",
        "icsUrl": "https://in.marketscreener.com/api/stateful/agenda/event-async/Q3-2020-Earnings-Call-29925459.ics"
      },
      {
        "section": "Past",
        "dateTimeRaw": "04/02/2020",
        "dateTimeISO": "2020-02-03T18:30:00.000Z",
        "title": "Q3 2020 Earnings Release",
        "icsUrl": "https://in.marketscreener.com/api/stateful/agenda/event-async/Q3-2020-Earnings-Release-28302546.ics"
      },
      {
        "section": "Past",
        "dateTimeRaw": "14/11/2019 11:30 am",
        "dateTimeISO": "2019-11-14T06:00:00.000Z",
        "title": "Interim 2020 Earnings Call",
        "icsUrl": "https://in.marketscreener.com/api/stateful/agenda/event-async/Interim-2020-Earnings-Call-29590476.ics"
      },
      {
        "section": "Past",
        "dateTimeRaw": "13/11/2019",
        "dateTimeISO": "2019-11-12T18:30:00.000Z",
        "title": "Interim 2020 Earnings Release",
        "icsUrl": "https://in.marketscreener.com/api/stateful/agenda/event-async/Interim-2020-Earnings-Release-28294267.ics"
      },
      {
        "section": "Past",
        "dateTimeRaw": "09/08/2019 11:30 am",
        "dateTimeISO": "2019-08-09T06:00:00.000Z",
        "title": "Q1 2020 Earnings Call",
        "icsUrl": "https://in.marketscreener.com/api/stateful/agenda/event-async/Q1-2020-Earnings-Call-29044750.ics"
      },
      {
        "section": "Past",
        "dateTimeRaw": "08/08/2019 03:30 pm",
        "dateTimeISO": "2019-08-08T10:00:00.000Z",
        "title": "Annual General Meeting",
        "icsUrl": "https://in.marketscreener.com/api/stateful/agenda/event-async/Annual-General-Meeting-28968369.ics"
      },
      {
        "section": "Past",
        "dateTimeRaw": "08/08/2019",
        "dateTimeISO": "2019-08-07T18:30:00.000Z",
        "title": "Q1 2020 Earnings Release",
        "icsUrl": "https://in.marketscreener.com/api/stateful/agenda/event-async/Q1-2020-Earnings-Release-26353726.ics"
      },
      {
        "section": "Past",
        "dateTimeRaw": "25/07/2019",
        "dateTimeISO": "2019-07-24T18:30:00.000Z",
        "title": "Ex-dividend day for final dividend",
        "icsUrl": "https://in.marketscreener.com/api/stateful/agenda/event-async/Ex-dividend-day-for-final-dividend-28659649.ics"
      },
      {
        "section": "Past",
        "dateTimeRaw": "23/05/2019 11:30 am",
        "dateTimeISO": "2019-05-23T06:00:00.000Z",
        "title": "FY 2019 Earnings Call",
        "icsUrl": "https://in.marketscreener.com/api/stateful/agenda/event-async/FY-2019-Earnings-Call-28656435.ics"
      },
      {
        "section": "Past",
        "dateTimeRaw": "22/05/2019",
        "dateTimeISO": "2019-05-21T18:30:00.000Z",
        "title": "FY 2019 Earnings Release",
        "icsUrl": "https://in.marketscreener.com/api/stateful/agenda/event-async/FY-2019-Earnings-Release-26400995.ics"
      },
      {
        "section": "Past",
        "dateTimeRaw": "11/02/2019 11:30 am",
        "dateTimeISO": "2019-02-11T06:00:00.000Z",
        "title": "Q3 2019 Earnings Call",
        "icsUrl": "https://in.marketscreener.com/api/stateful/agenda/event-async/Q3-2019-Earnings-Call-27986516.ics"
      },
      {
        "section": "Past",
        "dateTimeRaw": "08/02/2019",
        "dateTimeISO": "2019-02-07T18:30:00.000Z",
        "title": "Q3 2019 Earnings Release",
        "icsUrl": "https://in.marketscreener.com/api/stateful/agenda/event-async/Q3-2019-Earnings-Release-26262988.ics"
      },
      {
        "section": "Past",
        "dateTimeRaw": "15/11/2018 11:15 am",
        "dateTimeISO": "2018-11-15T05:45:00.000Z",
        "title": "Interim 2019 Earnings Call",
        "icsUrl": "https://in.marketscreener.com/api/stateful/agenda/event-async/Interim-2019-Earnings-Call-27623056.ics"
      },
      {
        "section": "Past",
        "dateTimeRaw": "14/11/2018",
        "dateTimeISO": "2018-11-13T18:30:00.000Z",
        "title": "Interim 2019 Earnings Release",
        "icsUrl": "https://in.marketscreener.com/api/stateful/agenda/event-async/Interim-2019-Earnings-Release-26262874.ics"
      },
      {
        "section": "Past",
        "dateTimeRaw": "09/08/2018 11:15 am",
        "dateTimeISO": "2018-08-09T05:45:00.000Z",
        "title": "Q1 2019 Earnings Call",
        "icsUrl": "https://in.marketscreener.com/api/stateful/agenda/event-async/Q1-2019-Earnings-Call-27097712.ics"
      },
      {
        "section": "Past",
        "dateTimeRaw": "08/08/2018 03:30 pm",
        "dateTimeISO": "2018-08-08T10:00:00.000Z",
        "title": "Annual General Meeting",
        "icsUrl": "https://in.marketscreener.com/api/stateful/agenda/event-async/Annual-General-Meeting-26968888.ics"
      },
      {
        "section": "Past",
        "dateTimeRaw": "08/08/2018",
        "dateTimeISO": "2018-08-07T18:30:00.000Z",
        "title": "Q1 2019 Earnings Release",
        "icsUrl": "https://in.marketscreener.com/api/stateful/agenda/event-async/Q1-2019-Earnings-Release-26262674.ics"
      }
    ]
  },
  "pastDividends": {
    "count": 27,
    "dividends": [
      {
        "section": "Past Dividends",
        "dateRaw": "04/07/2025",
        "dateISO": "2025-07-03T18:30:00.000Z",
        "type": "Annual",
        "amount": 14,
        "currency": "INR",
        "title": "Annual 14 INR"
      },
      {
        "section": "Past Dividends",
        "dateRaw": "05/07/2024",
        "dateISO": "2024-07-04T18:30:00.000Z",
        "type": "Annual",
        "amount": 12,
        "currency": "INR",
        "title": "Annual 12 INR"
      },
      {
        "section": "Past Dividends",
        "dateRaw": "21/07/2023",
        "dateISO": "2023-07-20T18:30:00.000Z",
        "type": "Annual",
        "amount": 10,
        "currency": "INR",
        "title": "Annual 10 INR"
      },
      {
        "section": "Past Dividends",
        "dateRaw": "21/07/2022",
        "dateISO": "2022-07-20T18:30:00.000Z",
        "type": "Annual",
        "amount": 9,
        "currency": "INR",
        "title": "Annual 9 INR"
      },
      {
        "section": "Past Dividends",
        "dateRaw": "22/07/2021",
        "dateISO": "2021-07-21T18:30:00.000Z",
        "type": "Annual",
        "amount": 7,
        "currency": "INR",
        "title": "Annual 7 INR"
      },
      {
        "section": "Past Dividends",
        "dateRaw": "20/03/2020",
        "dateISO": "2020-03-19T18:30:00.000Z",
        "type": "Interim Payment",
        "amount": 7,
        "currency": "INR",
        "title": "Interim Payment 7 INR"
      },
      {
        "section": "Past Dividends",
        "dateRaw": "25/07/2019",
        "dateISO": "2019-07-24T18:30:00.000Z",
        "type": "Annual",
        "amount": 7,
        "currency": "INR",
        "title": "Annual 7 INR"
      },
      {
        "section": "Past Dividends",
        "dateRaw": "26/07/2018",
        "dateISO": "2018-07-25T18:30:00.000Z",
        "type": "Annual",
        "amount": 6,
        "currency": "INR",
        "title": "Annual 6 INR"
      },
      {
        "section": "Past Dividends",
        "dateRaw": "27/07/2017",
        "dateISO": "2017-07-26T18:30:00.000Z",
        "type": "Annual",
        "amount": 6,
        "currency": "INR",
        "title": "Annual 6 INR"
      },
      {
        "section": "Past Dividends",
        "dateRaw": "28/07/2016",
        "dateISO": "2016-07-27T18:30:00.000Z",
        "type": "Annual",
        "amount": 6,
        "currency": "INR",
        "title": "Annual 6 INR"
      },
      {
        "section": "Past Dividends",
        "dateRaw": "16/07/2015",
        "dateISO": "2015-07-15T18:30:00.000Z",
        "type": "Annual",
        "amount": 7,
        "currency": "INR",
        "title": "Annual 7 INR"
      },
      {
        "section": "Past Dividends",
        "dateRaw": "10/07/2014",
        "dateISO": "2014-07-09T18:30:00.000Z",
        "type": "Annual",
        "amount": 6,
        "currency": "INR",
        "title": "Annual 6 INR"
      },
      {
        "section": "Past Dividends",
        "dateRaw": "11/07/2013",
        "dateISO": "2013-07-10T18:30:00.000Z",
        "type": "Annual",
        "amount": 7,
        "currency": "INR",
        "title": "Annual 7 INR"
      },
      {
        "section": "Past Dividends",
        "dateRaw": "12/07/2012",
        "dateISO": "2012-07-11T18:30:00.000Z",
        "type": "Annual",
        "amount": 7,
        "currency": "INR",
        "title": "Annual 7 INR"
      },
      {
        "section": "Past Dividends",
        "dateRaw": "07/07/2011",
        "dateISO": "2011-07-06T18:30:00.000Z",
        "type": "Annual",
        "amount": 9,
        "currency": "INR",
        "title": "Annual 9 INR"
      },
      {
        "section": "Past Dividends",
        "dateRaw": "08/07/2010",
        "dateISO": "2010-07-07T18:30:00.000Z",
        "type": "Annual",
        "amount": 5,
        "currency": "INR",
        "title": "Annual 5 INR"
      },
      {
        "section": "Past Dividends",
        "dateRaw": "09/07/2009",
        "dateISO": "2009-07-08T18:30:00.000Z",
        "type": "Annual",
        "amount": 5,
        "currency": "INR",
        "title": "Annual 5 INR"
      },
      {
        "section": "Past Dividends",
        "dateRaw": "10/07/2008",
        "dateISO": "2008-07-09T18:30:00.000Z",
        "type": "Annual",
        "amount": 8,
        "currency": "INR",
        "title": "Annual 8 INR"
      },
      {
        "section": "Past Dividends",
        "dateRaw": "12/07/2007",
        "dateISO": "2007-07-11T18:30:00.000Z",
        "type": "Final Payment",
        "amount": 2.6,
        "currency": "INR",
        "title": "Final Payment 2.6 INR"
      },
      {
        "section": "Past Dividends",
        "dateRaw": "20/03/2007",
        "dateISO": "2007-03-19T18:30:00.000Z",
        "type": "Interim Payment",
        "amount": 3.4,
        "currency": "INR",
        "title": "Interim Payment 3.4 INR"
      },
      {
        "section": "Past Dividends",
        "dateRaw": "06/07/2006",
        "dateISO": "2006-07-05T18:30:00.000Z",
        "type": "Annual",
        "amount": 3.4,
        "currency": "INR",
        "title": "Annual 3.4 INR"
      },
      {
        "section": "Past Dividends",
        "dateRaw": "14/07/2005",
        "dateISO": "2005-07-13T18:30:00.000Z",
        "type": "Annual",
        "amount": 12,
        "currency": "INR",
        "title": "Annual 12 INR"
      },
      {
        "section": "Past Dividends",
        "dateRaw": "08/07/2004",
        "dateISO": "2004-07-07T18:30:00.000Z",
        "type": "Annual",
        "amount": 12,
        "currency": "INR",
        "title": "Annual 12 INR"
      },
      {
        "section": "Past Dividends",
        "dateRaw": "14/07/2003",
        "dateISO": "2003-07-13T18:30:00.000Z",
        "type": "Annual",
        "amount": 7,
        "currency": "INR",
        "title": "Annual 7 INR"
      },
      {
        "section": "Past Dividends",
        "dateRaw": "14/07/2003",
        "dateISO": "2003-07-13T18:30:00.000Z",
        "type": "Bonus Payment",
        "amount": 5,
        "currency": "INR",
        "title": "Bonus Payment 5 INR"
      },
      {
        "section": "Past Dividends",
        "dateRaw": "16/09/2002",
        "dateISO": "2002-09-15T18:30:00.000Z",
        "type": "Annual",
        "amount": 5,
        "currency": "INR",
        "title": "Annual 5 INR"
      },
      {
        "section": "Past Dividends",
        "dateRaw": "07/08/2001",
        "dateISO": "2001-08-06T18:30:00.000Z",
        "type": "Annual",
        "amount": 1,
        "currency": "INR",
        "title": "Annual 1 INR"
      }
    ]
  }
}