{
  "companyCode": "UNO-MINDA-LIMITED-46730285",
  "timestamp": "2025-10-13T12:21:28.086Z",
  "annualResults": {
    "2023": {
      "Net salesMillion INR": {
        "metric": "Net salesMillion INR",
        "unit": "Million INR",
        "fiscalMonth": "March",
        "year": "2023",
        "released": "112 365",
        "forecast": "113 557",
        "spreadRaw": "-1.05%"
      },
      "EBITDAMillion INR": {
        "metric": "EBITDAMillion INR",
        "unit": "Million INR",
        "fiscalMonth": "March",
        "year": "2023",
        "released": "13 419",
        "forecast": "12 862",
        "spreadRaw": "4.33%"
      },
      "EBITMillion INR": {
        "metric": "EBITMillion INR",
        "unit": "Million INR",
        "fiscalMonth": "March",
        "year": "2023",
        "released": "9 120",
        "forecast": "8 833",
        "spreadRaw": "3.25%"
      },
      "Earnings before Tax (EBT)Million INR": {
        "metric": "Earnings before Tax (EBT)Million INR",
        "unit": "Million INR",
        "fiscalMonth": "March",
        "year": "2023",
        "released": "7 914",
        "forecast": "8 334",
        "spreadRaw": "-5.03%"
      },
      "Net incomeMillion INR": {
        "metric": "Net incomeMillion INR",
        "unit": "Million INR",
        "fiscalMonth": "March",
        "year": "2023",
        "released": "6 536",
        "forecast": "6 532",
        "spreadRaw": "0.05%"
      },
      "EPS INR": {
        "metric": "EPS INR",
        "unit": "INR",
        "fiscalMonth": "March",
        "year": "2023",
        "released": "11,4",
        "forecast": "11,5",
        "spreadRaw": "-1.05%"
      },
      "Announcement Date": {
        "metric": "Announcement Date",
        "unit": null,
        "fiscalMonth": "March",
        "year": "2023",
        "released": "18/05/23",
        "forecast": null,
        "spreadRaw": null
      }
    },
    "2024": {
      "Net salesMillion INR": {
        "metric": "Net salesMillion INR",
        "unit": "Million INR",
        "fiscalMonth": "March",
        "year": "2024",
        "released": "140 309",
        "forecast": "139 115",
        "spreadRaw": "0.86%"
      },
      "EBITDAMillion INR": {
        "metric": "EBITDAMillion INR",
        "unit": "Million INR",
        "fiscalMonth": "March",
        "year": "2024",
        "released": "15 853",
        "forecast": "15 420",
        "spreadRaw": "2.8%"
      },
      "EBITMillion INR": {
        "metric": "EBITMillion INR",
        "unit": "Million INR",
        "fiscalMonth": "March",
        "year": "2024",
        "released": "10 590",
        "forecast": "10 438",
        "spreadRaw": "1.46%"
      },
      "Earnings before Tax (EBT)Million INR": {
        "metric": "Earnings before Tax (EBT)Million INR",
        "unit": "Million INR",
        "fiscalMonth": "March",
        "year": "2024",
        "released": "11 918",
        "forecast": "9 941",
        "spreadRaw": "19.89%"
      },
      "Net incomeMillion INR": {
        "metric": "Net incomeMillion INR",
        "unit": "Million INR",
        "fiscalMonth": "March",
        "year": "2024",
        "released": "8 803",
        "forecast": "8 377",
        "spreadRaw": "5.09%"
      },
      "EPS INR": {
        "metric": "EPS INR",
        "unit": "INR",
        "fiscalMonth": "March",
        "year": "2024",
        "released": "15,3",
        "forecast": "14,6",
        "spreadRaw": "4.8%"
      },
      "Announcement Date": {
        "metric": "Announcement Date",
        "unit": null,
        "fiscalMonth": "March",
        "year": "2024",
        "released": "23/05/24",
        "forecast": null,
        "spreadRaw": null
      }
    },
    "2025": {
      "Net salesMillion INR": {
        "metric": "Net salesMillion INR",
        "unit": "Million INR",
        "fiscalMonth": "March",
        "year": "2025",
        "released": "167 746",
        "forecast": "167 474",
        "spreadRaw": "0.16%"
      },
      "EBITDAMillion INR": {
        "metric": "EBITDAMillion INR",
        "unit": "Million INR",
        "fiscalMonth": "March",
        "year": "2025",
        "released": "18 738",
        "forecast": "18 798",
        "spreadRaw": "-0.32%"
      },
      "EBITMillion INR": {
        "metric": "EBITMillion INR",
        "unit": "Million INR",
        "fiscalMonth": "March",
        "year": "2025",
        "released": "14 391",
        "forecast": "12 784",
        "spreadRaw": "12.57%"
      },
      "Earnings before Tax (EBT)Million INR": {
        "metric": "Earnings before Tax (EBT)Million INR",
        "unit": "Million INR",
        "fiscalMonth": "March",
        "year": "2025",
        "released": "13 066",
        "forecast": "11 882",
        "spreadRaw": "9.97%"
      },
      "Net incomeMillion INR": {
        "metric": "Net incomeMillion INR",
        "unit": "Million INR",
        "fiscalMonth": "March",
        "year": "2025",
        "released": "10 206",
        "forecast": "9 617",
        "spreadRaw": "6.12%"
      },
      "EPS INR": {
        "metric": "EPS INR",
        "unit": "INR",
        "fiscalMonth": "March",
        "year": "2025",
        "released": "16,4",
        "forecast": "16,9",
        "spreadRaw": "-3.25%"
      },
      "Announcement Date": {
        "metric": "Announcement Date",
        "unit": null,
        "fiscalMonth": "March",
        "year": "2025",
        "released": "21/05/25",
        "forecast": null,
        "spreadRaw": null
      }
    },
    "2026": {
      "Net salesMillion INR": {
        "metric": "Net salesMillion INR",
        "unit": "Million INR",
        "fiscalMonth": "March",
        "year": "2026",
        "released": null,
        "forecast": "196 262",
        "spreadRaw": null
      },
      "EBITDAMillion INR": {
        "metric": "EBITDAMillion INR",
        "unit": "Million INR",
        "fiscalMonth": "March",
        "year": "2026",
        "released": null,
        "forecast": "22 722",
        "spreadRaw": null
      },
      "EBITMillion INR": {
        "metric": "EBITMillion INR",
        "unit": "Million INR",
        "fiscalMonth": "March",
        "year": "2026",
        "released": null,
        "forecast": "15 734",
        "spreadRaw": null
      },
      "Earnings before Tax (EBT)Million INR": {
        "metric": "Earnings before Tax (EBT)Million INR",
        "unit": "Million INR",
        "fiscalMonth": "March",
        "year": "2026",
        "released": null,
        "forecast": "14 890",
        "spreadRaw": null
      },
      "Net incomeMillion INR": {
        "metric": "Net incomeMillion INR",
        "unit": "Million INR",
        "fiscalMonth": "March",
        "year": "2026",
        "released": null,
        "forecast": "12 022",
        "spreadRaw": null
      },
      "EPS INR": {
        "metric": "EPS INR",
        "unit": "INR",
        "fiscalMonth": "March",
        "year": "2026",
        "released": null,
        "forecast": "21,1",
        "spreadRaw": null
      },
      "Announcement Date": {
        "metric": "Announcement Date",
        "unit": null,
        "fiscalMonth": "March",
        "year": "2026",
        "released": "-",
        "forecast": null,
        "spreadRaw": null
      }
    },
    "2027": {
      "Net salesMillion INR": {
        "metric": "Net salesMillion INR",
        "unit": "Million INR",
        "fiscalMonth": "March",
        "year": "2027",
        "released": null,
        "forecast": "231 047",
        "spreadRaw": null
      },
      "EBITDAMillion INR": {
        "metric": "EBITDAMillion INR",
        "unit": "Million INR",
        "fiscalMonth": "March",
        "year": "2027",
        "released": null,
        "forecast": "27 397",
        "spreadRaw": null
      },
      "EBITMillion INR": {
        "metric": "EBITMillion INR",
        "unit": "Million INR",
        "fiscalMonth": "March",
        "year": "2027",
        "released": null,
        "forecast": "19 461",
        "spreadRaw": null
      },
      "Earnings before Tax (EBT)Million INR": {
        "metric": "Earnings before Tax (EBT)Million INR",
        "unit": "Million INR",
        "fiscalMonth": "March",
        "year": "2027",
        "released": null,
        "forecast": "18 580",
        "spreadRaw": null
      },
      "Net incomeMillion INR": {
        "metric": "Net incomeMillion INR",
        "unit": "Million INR",
        "fiscalMonth": "March",
        "year": "2027",
        "released": null,
        "forecast": "14 869",
        "spreadRaw": null
      },
      "EPS INR": {
        "metric": "EPS INR",
        "unit": "INR",
        "fiscalMonth": "March",
        "year": "2027",
        "released": null,
        "forecast": "26,1",
        "spreadRaw": null
      },
      "Announcement Date": {
        "metric": "Announcement Date",
        "unit": null,
        "fiscalMonth": "March",
        "year": "2027",
        "released": null,
        "forecast": null,
        "spreadRaw": null
      }
    },
    "2028": {
      "Net salesMillion INR": {
        "metric": "Net salesMillion INR",
        "unit": "Million INR",
        "fiscalMonth": "March",
        "year": "2028",
        "released": null,
        "forecast": "274 495",
        "spreadRaw": null
      },
      "EBITDAMillion INR": {
        "metric": "EBITDAMillion INR",
        "unit": "Million INR",
        "fiscalMonth": "March",
        "year": "2028",
        "released": null,
        "forecast": "32 649",
        "spreadRaw": null
      },
      "EBITMillion INR": {
        "metric": "EBITMillion INR",
        "unit": "Million INR",
        "fiscalMonth": "March",
        "year": "2028",
        "released": null,
        "forecast": "24 002",
        "spreadRaw": null
      },
      "Earnings before Tax (EBT)Million INR": {
        "metric": "Earnings before Tax (EBT)Million INR",
        "unit": "Million INR",
        "fiscalMonth": "March",
        "year": "2028",
        "released": null,
        "forecast": "23 195",
        "spreadRaw": null
      },
      "Net incomeMillion INR": {
        "metric": "Net incomeMillion INR",
        "unit": "Million INR",
        "fiscalMonth": "March",
        "year": "2028",
        "released": null,
        "forecast": "18 357",
        "spreadRaw": null
      },
      "EPS INR": {
        "metric": "EPS INR",
        "unit": "INR",
        "fiscalMonth": "March",
        "year": "2028",
        "released": null,
        "forecast": "32,0",
        "spreadRaw": null
      },
      "Announcement Date": {
        "metric": "Announcement Date",
        "unit": null,
        "fiscalMonth": "March",
        "year": "2028",
        "released": null,
        "forecast": null,
        "spreadRaw": null
      }
    }
  },
  "quarterlyResults": {
    "2024 Q2": {
      "Net salesMillion INR": {
        "metric": "Net salesMillion INR",
        "unit": "Million INR",
        "fiscalMonth": "March",
        "period": "2024 Q2",
        "released": "36 213",
        "releasedNum": 36213,
        "forecast": "34 163",
        "forecastNum": 34163,
        "spreadRaw": "6%",
        "spreadPct": 6
      },
      "EBITDAMillion INR": {
        "metric": "EBITDAMillion INR",
        "unit": "Million INR",
        "fiscalMonth": "March",
        "period": "2024 Q2",
        "released": "4 016",
        "releasedNum": 4016,
        "forecast": "3 798",
        "forecastNum": 3798,
        "spreadRaw": "5.74%",
        "spreadPct": 5.74
      },
      "EBITMillion INR": {
        "metric": "EBITMillion INR",
        "unit": "Million INR",
        "fiscalMonth": "March",
        "period": "2024 Q2",
        "released": "2 762",
        "releasedNum": 2762,
        "forecast": "2 611",
        "forecastNum": 2611,
        "spreadRaw": "5.76%",
        "spreadPct": 5.76
      },
      "Earnings before Tax (EBT)Million INR": {
        "metric": "Earnings before Tax (EBT)Million INR",
        "unit": "Million INR",
        "fiscalMonth": "March",
        "period": "2024 Q2",
        "released": "2 579",
        "releasedNum": 2579,
        "forecast": "2 339",
        "forecastNum": 2339,
        "spreadRaw": "10.23%",
        "spreadPct": 10.23
      },
      "Net incomeMillion INR": {
        "metric": "Net incomeMillion INR",
        "unit": "Million INR",
        "fiscalMonth": "March",
        "period": "2024 Q2",
        "released": "2 250",
        "releasedNum": 2250,
        "forecast": "2 048",
        "forecastNum": 2048,
        "spreadRaw": "9.88%",
        "spreadPct": 9.88
      },
      "EPS INR": {
        "metric": "EPS INR",
        "unit": "INR",
        "fiscalMonth": "March",
        "period": "2024 Q2",
        "released": "3,93",
        "releasedNum": 3.93,
        "forecast": "3,52",
        "forecastNum": 3.52,
        "spreadRaw": "11.52%",
        "spreadPct": 11.52
      },
      "Announcement Date": {
        "metric": "Announcement Date",
        "unit": null,
        "fiscalMonth": "March",
        "period": "2024 Q2",
        "released": "07/11/23",
        "releasedDate": "07/11/23",
        "forecast": null,
        "spreadRaw": null,
        "spreadPct": null
      }
    },
    "2024 Q3": {
      "Net salesMillion INR": {
        "metric": "Net salesMillion INR",
        "unit": "Million INR",
        "fiscalMonth": "March",
        "period": "2024 Q3",
        "released": "35 229",
        "releasedNum": 35229,
        "forecast": "34 650",
        "forecastNum": 34650,
        "spreadRaw": "1.67%",
        "spreadPct": 1.67
      },
      "EBITDAMillion INR": {
        "metric": "EBITDAMillion INR",
        "unit": "Million INR",
        "fiscalMonth": "March",
        "period": "2024 Q3",
        "released": "3 796",
        "releasedNum": 3796,
        "forecast": "3 776",
        "forecastNum": 3776,
        "spreadRaw": "0.53%",
        "spreadPct": 0.53
      },
      "EBITMillion INR": {
        "metric": "EBITMillion INR",
        "unit": "Million INR",
        "fiscalMonth": "March",
        "period": "2024 Q3",
        "released": "2 471",
        "releasedNum": 2471,
        "forecast": "2 439",
        "forecastNum": 2439,
        "spreadRaw": "1.29%",
        "spreadPct": 1.29
      },
      "Earnings before Tax (EBT)Million INR": {
        "metric": "Earnings before Tax (EBT)Million INR",
        "unit": "Million INR",
        "fiscalMonth": "March",
        "period": "2024 Q3",
        "released": "2 700",
        "releasedNum": 2700,
        "forecast": "2 279",
        "forecastNum": 2279,
        "spreadRaw": "18.48%",
        "spreadPct": 18.48
      },
      "Net incomeMillion INR": {
        "metric": "Net incomeMillion INR",
        "unit": "Million INR",
        "fiscalMonth": "March",
        "period": "2024 Q3",
        "released": "1 935",
        "releasedNum": 1935,
        "forecast": "2 063",
        "forecastNum": 2063,
        "spreadRaw": "-6.22%",
        "spreadPct": -6.22
      },
      "EPS INR": {
        "metric": "EPS INR",
        "unit": "INR",
        "fiscalMonth": "March",
        "period": "2024 Q3",
        "released": "3,37",
        "releasedNum": 3.37,
        "forecast": "3,62",
        "forecastNum": 3.62,
        "spreadRaw": "-6.91%",
        "spreadPct": -6.91
      },
      "Announcement Date": {
        "metric": "Announcement Date",
        "unit": null,
        "fiscalMonth": "March",
        "period": "2024 Q3",
        "released": "07/02/24",
        "releasedDate": "07/02/24",
        "forecast": null,
        "spreadRaw": null,
        "spreadPct": null
      }
    },
    "2024 Q4": {
      "Net salesMillion INR": {
        "metric": "Net salesMillion INR",
        "unit": "Million INR",
        "fiscalMonth": "March",
        "period": "2024 Q4",
        "released": "37 940",
        "releasedNum": 37940,
        "forecast": "37 832",
        "forecastNum": 37832,
        "spreadRaw": "0.29%",
        "spreadPct": 0.29
      },
      "EBITDAMillion INR": {
        "metric": "EBITDAMillion INR",
        "unit": "Million INR",
        "fiscalMonth": "March",
        "period": "2024 Q4",
        "released": "4 740",
        "releasedNum": 4740,
        "forecast": "4 282",
        "forecastNum": 4282,
        "spreadRaw": "10.71%",
        "spreadPct": 10.71
      },
      "EBITMillion INR": {
        "metric": "EBITMillion INR",
        "unit": "Million INR",
        "fiscalMonth": "March",
        "period": "2024 Q4",
        "released": "3 248",
        "releasedNum": 3248,
        "forecast": "2 914",
        "forecastNum": 2914,
        "spreadRaw": "11.48%",
        "spreadPct": 11.48
      },
      "Earnings before Tax (EBT)Million INR": {
        "metric": "Earnings before Tax (EBT)Million INR",
        "unit": "Million INR",
        "fiscalMonth": "March",
        "period": "2024 Q4",
        "released": "3 867",
        "releasedNum": 3867,
        "forecast": "2 829",
        "forecastNum": 2829,
        "spreadRaw": "36.7%",
        "spreadPct": 36.7
      },
      "Net incomeMillion INR": {
        "metric": "Net incomeMillion INR",
        "unit": "Million INR",
        "fiscalMonth": "March",
        "period": "2024 Q4",
        "released": "2 891",
        "releasedNum": 2891,
        "forecast": "2 405",
        "forecastNum": 2405,
        "spreadRaw": "20.21%",
        "spreadPct": 20.21
      },
      "EPS INR": {
        "metric": "EPS INR",
        "unit": "INR",
        "fiscalMonth": "March",
        "period": "2024 Q4",
        "released": "5,03",
        "releasedNum": 5.03,
        "forecast": "4,26",
        "forecastNum": 4.26,
        "spreadRaw": "18.08%",
        "spreadPct": 18.08
      },
      "Announcement Date": {
        "metric": "Announcement Date",
        "unit": null,
        "fiscalMonth": "March",
        "period": "2024 Q4",
        "released": "23/05/24",
        "releasedDate": "23/05/24",
        "forecast": null,
        "spreadRaw": null,
        "spreadPct": null
      }
    },
    "2025 Q1": {
      "Net salesMillion INR": {
        "metric": "Net salesMillion INR",
        "unit": "Million INR",
        "fiscalMonth": "March",
        "period": "2025 Q1",
        "released": "38 175",
        "releasedNum": 38175,
        "forecast": "36 885",
        "forecastNum": 36885,
        "spreadRaw": "3.5%",
        "spreadPct": 3.5
      },
      "EBITDAMillion INR": {
        "metric": "EBITDAMillion INR",
        "unit": "Million INR",
        "fiscalMonth": "March",
        "period": "2025 Q1",
        "released": "4 077",
        "releasedNum": 4077,
        "forecast": "3 937",
        "forecastNum": 3937,
        "spreadRaw": "3.56%",
        "spreadPct": 3.56
      },
      "EBITMillion INR": {
        "metric": "EBITMillion INR",
        "unit": "Million INR",
        "fiscalMonth": "March",
        "period": "2025 Q1",
        "released": "2 660",
        "releasedNum": 2660,
        "forecast": "2 475",
        "forecastNum": 2475,
        "spreadRaw": "7.46%",
        "spreadPct": 7.46
      },
      "Earnings before Tax (EBT)Million INR": {
        "metric": "Earnings before Tax (EBT)Million INR",
        "unit": "Million INR",
        "fiscalMonth": "March",
        "period": "2025 Q1",
        "released": "2 408",
        "releasedNum": 2408,
        "forecast": "2 230",
        "forecastNum": 2230,
        "spreadRaw": "7.97%",
        "spreadPct": 7.97
      },
      "Net incomeMillion INR": {
        "metric": "Net incomeMillion INR",
        "unit": "Million INR",
        "fiscalMonth": "March",
        "period": "2025 Q1",
        "released": "1 990",
        "releasedNum": 1990,
        "forecast": "2 055",
        "forecastNum": 2055,
        "spreadRaw": "-3.14%",
        "spreadPct": -3.14
      },
      "EPS INR": {
        "metric": "EPS INR",
        "unit": "INR",
        "fiscalMonth": "March",
        "period": "2025 Q1",
        "released": "3,46",
        "releasedNum": 3.46,
        "forecast": "3,57",
        "forecastNum": 3.57,
        "spreadRaw": "-2.99%",
        "spreadPct": -2.99
      },
      "Announcement Date": {
        "metric": "Announcement Date",
        "unit": null,
        "fiscalMonth": "March",
        "period": "2025 Q1",
        "released": "07/08/24",
        "releasedDate": "07/08/24",
        "forecast": null,
        "spreadRaw": null,
        "spreadPct": null
      }
    },
    "2025 Q2": {
      "Net salesMillion INR": {
        "metric": "Net salesMillion INR",
        "unit": "Million INR",
        "fiscalMonth": "March",
        "period": "2025 Q2",
        "released": "42 448",
        "releasedNum": 42448,
        "forecast": "41 106",
        "forecastNum": 41106,
        "spreadRaw": "3.26%",
        "spreadPct": 3.26
      },
      "EBITDAMillion INR": {
        "metric": "EBITDAMillion INR",
        "unit": "Million INR",
        "fiscalMonth": "March",
        "period": "2025 Q2",
        "released": "4 824",
        "releasedNum": 4824,
        "forecast": "4 516",
        "forecastNum": 4516,
        "spreadRaw": "6.8%",
        "spreadPct": 6.8
      },
      "EBITMillion INR": {
        "metric": "EBITMillion INR",
        "unit": "Million INR",
        "fiscalMonth": "March",
        "period": "2025 Q2",
        "released": "3 315",
        "releasedNum": 3315,
        "forecast": "3 086",
        "forecastNum": 3086,
        "spreadRaw": "7.41%",
        "spreadPct": 7.41
      },
      "Earnings before Tax (EBT)Million INR": {
        "metric": "Earnings before Tax (EBT)Million INR",
        "unit": "Million INR",
        "fiscalMonth": "March",
        "period": "2025 Q2",
        "released": "2 791",
        "releasedNum": 2791,
        "forecast": "2 826",
        "forecastNum": 2826,
        "spreadRaw": "-1.24%",
        "spreadPct": -1.24
      },
      "Net incomeMillion INR": {
        "metric": "Net incomeMillion INR",
        "unit": "Million INR",
        "fiscalMonth": "March",
        "period": "2025 Q2",
        "released": "2 452",
        "releasedNum": 2452,
        "forecast": "2 377",
        "forecastNum": 2377,
        "spreadRaw": "3.13%",
        "spreadPct": 3.13
      },
      "EPS INR": {
        "metric": "EPS INR",
        "unit": "INR",
        "fiscalMonth": "March",
        "period": "2025 Q2",
        "released": "4,26",
        "releasedNum": 4.26,
        "forecast": "4,24",
        "forecastNum": 4.24,
        "spreadRaw": "0.47%",
        "spreadPct": 0.47
      },
      "Announcement Date": {
        "metric": "Announcement Date",
        "unit": null,
        "fiscalMonth": "March",
        "period": "2025 Q2",
        "released": "12/11/24",
        "releasedDate": "12/11/24",
        "forecast": null,
        "spreadRaw": null,
        "spreadPct": null
      }
    },
    "2025 Q3": {
      "Net salesMillion INR": {
        "metric": "Net salesMillion INR",
        "unit": "Million INR",
        "fiscalMonth": "March",
        "period": "2025 Q3",
        "released": "41 840",
        "releasedNum": 41840,
        "forecast": "41 206",
        "forecastNum": 41206,
        "spreadRaw": "1.54%",
        "spreadPct": 1.54
      },
      "EBITDAMillion INR": {
        "metric": "EBITDAMillion INR",
        "unit": "Million INR",
        "fiscalMonth": "March",
        "period": "2025 Q3",
        "released": "4 570",
        "releasedNum": 4570,
        "forecast": "4 557",
        "forecastNum": 4557,
        "spreadRaw": "0.28%",
        "spreadPct": 0.28
      },
      "EBITMillion INR": {
        "metric": "EBITMillion INR",
        "unit": "Million INR",
        "fiscalMonth": "March",
        "period": "2025 Q3",
        "released": "2 994",
        "releasedNum": 2994,
        "forecast": "2 948",
        "forecastNum": 2948,
        "spreadRaw": "1.55%",
        "spreadPct": 1.55
      },
      "Earnings before Tax (EBT)Million INR": {
        "metric": "Earnings before Tax (EBT)Million INR",
        "unit": "Million INR",
        "fiscalMonth": "March",
        "period": "2025 Q3",
        "released": "3 010",
        "releasedNum": 3010,
        "forecast": "2 557",
        "forecastNum": 2557,
        "spreadRaw": "17.71%",
        "spreadPct": 17.71
      },
      "Net incomeMillion INR": {
        "metric": "Net incomeMillion INR",
        "unit": "Million INR",
        "fiscalMonth": "March",
        "period": "2025 Q3",
        "released": "2 326",
        "releasedNum": 2326,
        "forecast": "2 175",
        "forecastNum": 2175,
        "spreadRaw": "6.92%",
        "spreadPct": 6.92
      },
      "EPS INR": {
        "metric": "EPS INR",
        "unit": "INR",
        "fiscalMonth": "March",
        "period": "2025 Q3",
        "released": "4,04",
        "releasedNum": 4.04,
        "forecast": "3,80",
        "forecastNum": 3.8,
        "spreadRaw": "6.32%",
        "spreadPct": 6.32
      },
      "Announcement Date": {
        "metric": "Announcement Date",
        "unit": null,
        "fiscalMonth": "March",
        "period": "2025 Q3",
        "released": "06/02/25",
        "releasedDate": "06/02/25",
        "forecast": null,
        "spreadRaw": null,
        "spreadPct": null
      }
    },
    "2025 Q4": {
      "Net salesMillion INR": {
        "metric": "Net salesMillion INR",
        "unit": "Million INR",
        "fiscalMonth": "March",
        "period": "2025 Q4",
        "released": "45 283",
        "releasedNum": 45283,
        "forecast": "44 461",
        "forecastNum": 44461,
        "spreadRaw": "1.85%",
        "spreadPct": 1.85
      },
      "EBITDAMillion INR": {
        "metric": "EBITDAMillion INR",
        "unit": "Million INR",
        "fiscalMonth": "March",
        "period": "2025 Q4",
        "released": "5 267",
        "releasedNum": 5267,
        "forecast": "5 173",
        "forecastNum": 5173,
        "spreadRaw": "1.82%",
        "spreadPct": 1.82
      },
      "EBITMillion INR": {
        "metric": "EBITMillion INR",
        "unit": "Million INR",
        "fiscalMonth": "March",
        "period": "2025 Q4",
        "released": "4 167",
        "releasedNum": 4167,
        "forecast": "3 584",
        "forecastNum": 3584,
        "spreadRaw": "16.26%",
        "spreadPct": 16.26
      },
      "Earnings before Tax (EBT)Million INR": {
        "metric": "Earnings before Tax (EBT)Million INR",
        "unit": "Million INR",
        "fiscalMonth": "March",
        "period": "2025 Q4",
        "released": "3 835",
        "releasedNum": 3835,
        "forecast": "3 166",
        "forecastNum": 3166,
        "spreadRaw": "21.15%",
        "spreadPct": 21.15
      },
      "Net incomeMillion INR": {
        "metric": "Net incomeMillion INR",
        "unit": "Million INR",
        "fiscalMonth": "March",
        "period": "2025 Q4",
        "released": "2 892",
        "releasedNum": 2892,
        "forecast": "2 718",
        "forecastNum": 2718,
        "spreadRaw": "6.44%",
        "spreadPct": 6.44
      },
      "EPS INR": {
        "metric": "EPS INR",
        "unit": "INR",
        "fiscalMonth": "March",
        "period": "2025 Q4",
        "released": "4,62",
        "releasedNum": 4.62,
        "forecast": "4,47",
        "forecastNum": 4.47,
        "spreadRaw": "3.43%",
        "spreadPct": 3.43
      },
      "Announcement Date": {
        "metric": "Announcement Date",
        "unit": null,
        "fiscalMonth": "March",
        "period": "2025 Q4",
        "released": "21/05/25",
        "releasedDate": "21/05/25",
        "forecast": null,
        "spreadRaw": null,
        "spreadPct": null
      }
    },
    "2026 Q1": {
      "Net salesMillion INR": {
        "metric": "Net salesMillion INR",
        "unit": "Million INR",
        "fiscalMonth": "March",
        "period": "2026 Q1",
        "released": "44 891",
        "releasedNum": 44891,
        "forecast": "44 527",
        "forecastNum": 44527,
        "spreadRaw": "0.82%",
        "spreadPct": 0.82
      },
      "EBITDAMillion INR": {
        "metric": "EBITDAMillion INR",
        "unit": "Million INR",
        "fiscalMonth": "March",
        "period": "2026 Q1",
        "released": "5 431",
        "releasedNum": 5431,
        "forecast": "4 876",
        "forecastNum": 4876,
        "spreadRaw": "11.38%",
        "spreadPct": 11.38
      },
      "EBITMillion INR": {
        "metric": "EBITMillion INR",
        "unit": "Million INR",
        "fiscalMonth": "March",
        "period": "2026 Q1",
        "released": "3 838",
        "releasedNum": 3838,
        "forecast": "3 001",
        "forecastNum": 3001,
        "spreadRaw": "27.88%",
        "spreadPct": 27.88
      },
      "Earnings before Tax (EBT)Million INR": {
        "metric": "Earnings before Tax (EBT)Million INR",
        "unit": "Million INR",
        "fiscalMonth": "March",
        "period": "2026 Q1",
        "released": "3 519",
        "releasedNum": 3519,
        "forecast": "3 077",
        "forecastNum": 3077,
        "spreadRaw": "14.35%",
        "spreadPct": 14.35
      },
      "Net incomeMillion INR": {
        "metric": "Net incomeMillion INR",
        "unit": "Million INR",
        "fiscalMonth": "March",
        "period": "2026 Q1",
        "released": "2 907",
        "releasedNum": 2907,
        "forecast": "2 248",
        "forecastNum": 2248,
        "spreadRaw": "29.31%",
        "spreadPct": 29.31
      },
      "EPS INR": {
        "metric": "EPS INR",
        "unit": "INR",
        "fiscalMonth": "March",
        "period": "2026 Q1",
        "released": "5,05",
        "releasedNum": 5.05,
        "forecast": "3,95",
        "forecastNum": 3.95,
        "spreadRaw": "27.85%",
        "spreadPct": 27.85
      },
      "Announcement Date": {
        "metric": "Announcement Date",
        "unit": null,
        "fiscalMonth": "March",
        "period": "2026 Q1",
        "released": "06/08/25",
        "releasedDate": "06/08/25",
        "forecast": null,
        "spreadRaw": null,
        "spreadPct": null
      }
    },
    "2026 Q2": {
      "Net salesMillion INR": {
        "metric": "Net salesMillion INR",
        "unit": "Million INR",
        "fiscalMonth": "March",
        "period": "2026 Q2",
        "released": null,
        "releasedNum": null,
        "forecast": "47 990",
        "forecastNum": 47990,
        "spreadRaw": null,
        "spreadPct": null
      },
      "EBITDAMillion INR": {
        "metric": "EBITDAMillion INR",
        "unit": "Million INR",
        "fiscalMonth": "March",
        "period": "2026 Q2",
        "released": null,
        "releasedNum": null,
        "forecast": "5 342",
        "forecastNum": 5342,
        "spreadRaw": null,
        "spreadPct": null
      },
      "EBITMillion INR": {
        "metric": "EBITMillion INR",
        "unit": "Million INR",
        "fiscalMonth": "March",
        "period": "2026 Q2",
        "released": null,
        "releasedNum": null,
        "forecast": "3 673",
        "forecastNum": 3673,
        "spreadRaw": null,
        "spreadPct": null
      },
      "Earnings before Tax (EBT)Million INR": {
        "metric": "Earnings before Tax (EBT)Million INR",
        "unit": "Million INR",
        "fiscalMonth": "March",
        "period": "2026 Q2",
        "released": null,
        "releasedNum": null,
        "forecast": "3 343",
        "forecastNum": 3343,
        "spreadRaw": null,
        "spreadPct": null
      },
      "Net incomeMillion INR": {
        "metric": "Net incomeMillion INR",
        "unit": "Million INR",
        "fiscalMonth": "March",
        "period": "2026 Q2",
        "released": null,
        "releasedNum": null,
        "forecast": "2 838",
        "forecastNum": 2838,
        "spreadRaw": null,
        "spreadPct": null
      },
      "EPS INR": {
        "metric": "EPS INR",
        "unit": "INR",
        "fiscalMonth": "March",
        "period": "2026 Q2",
        "released": null,
        "releasedNum": null,
        "forecast": "5,10",
        "forecastNum": 5.1,
        "spreadRaw": null,
        "spreadPct": null
      },
      "Announcement Date": {
        "metric": "Announcement Date",
        "unit": null,
        "fiscalMonth": "March",
        "period": "2026 Q2",
        "released": "-",
        "releasedDate": "-",
        "forecast": null,
        "spreadRaw": null,
        "spreadPct": null
      }
    },
    "2026 Q3": {
      "Net salesMillion INR": {
        "metric": "Net salesMillion INR",
        "unit": "Million INR",
        "fiscalMonth": "March",
        "period": "2026 Q3",
        "released": null,
        "releasedNum": null,
        "forecast": "49 324",
        "forecastNum": 49324,
        "spreadRaw": null,
        "spreadPct": null
      },
      "EBITDAMillion INR": {
        "metric": "EBITDAMillion INR",
        "unit": "Million INR",
        "fiscalMonth": "March",
        "period": "2026 Q3",
        "released": null,
        "releasedNum": null,
        "forecast": "5 692",
        "forecastNum": 5692,
        "spreadRaw": null,
        "spreadPct": null
      },
      "EBITMillion INR": {
        "metric": "EBITMillion INR",
        "unit": "Million INR",
        "fiscalMonth": "March",
        "period": "2026 Q3",
        "released": null,
        "releasedNum": null,
        "forecast": "3 914",
        "forecastNum": 3914,
        "spreadRaw": null,
        "spreadPct": null
      },
      "Earnings before Tax (EBT)Million INR": {
        "metric": "Earnings before Tax (EBT)Million INR",
        "unit": "Million INR",
        "fiscalMonth": "March",
        "period": "2026 Q3",
        "released": null,
        "releasedNum": null,
        "forecast": "3 789",
        "forecastNum": 3789,
        "spreadRaw": null,
        "spreadPct": null
      },
      "Net incomeMillion INR": {
        "metric": "Net incomeMillion INR",
        "unit": "Million INR",
        "fiscalMonth": "March",
        "period": "2026 Q3",
        "released": null,
        "releasedNum": null,
        "forecast": "3 254",
        "forecastNum": 3254,
        "spreadRaw": null,
        "spreadPct": null
      },
      "EPS INR": {
        "metric": "EPS INR",
        "unit": "INR",
        "fiscalMonth": "March",
        "period": "2026 Q3",
        "released": null,
        "releasedNum": null,
        "forecast": "5,70",
        "forecastNum": 5.7,
        "spreadRaw": null,
        "spreadPct": null
      },
      "Announcement Date": {
        "metric": "Announcement Date",
        "unit": null,
        "fiscalMonth": "March",
        "period": "2026 Q3",
        "released": "-",
        "releasedDate": "-",
        "forecast": null,
        "spreadRaw": null,
        "spreadPct": null
      }
    },
    "2026 Q4": {
      "Net salesMillion INR": {
        "metric": "Net salesMillion INR",
        "unit": "Million INR",
        "fiscalMonth": "March",
        "period": "2026 Q4",
        "released": null,
        "releasedNum": null,
        "forecast": "52 402",
        "forecastNum": 52402,
        "spreadRaw": null,
        "spreadPct": null
      },
      "EBITDAMillion INR": {
        "metric": "EBITDAMillion INR",
        "unit": "Million INR",
        "fiscalMonth": "March",
        "period": "2026 Q4",
        "released": null,
        "releasedNum": null,
        "forecast": "6 211",
        "forecastNum": 6211,
        "spreadRaw": null,
        "spreadPct": null
      },
      "EBITMillion INR": {
        "metric": "EBITMillion INR",
        "unit": "Million INR",
        "fiscalMonth": "March",
        "period": "2026 Q4",
        "released": null,
        "releasedNum": null,
        "forecast": "4 279",
        "forecastNum": 4279,
        "spreadRaw": null,
        "spreadPct": null
      },
      "Earnings before Tax (EBT)Million INR": {
        "metric": "Earnings before Tax (EBT)Million INR",
        "unit": "Million INR",
        "fiscalMonth": "March",
        "period": "2026 Q4",
        "released": null,
        "releasedNum": null,
        "forecast": "3 725",
        "forecastNum": 3725,
        "spreadRaw": null,
        "spreadPct": null
      },
      "Net incomeMillion INR": {
        "metric": "Net incomeMillion INR",
        "unit": "Million INR",
        "fiscalMonth": "March",
        "period": "2026 Q4",
        "released": null,
        "releasedNum": null,
        "forecast": "3 385",
        "forecastNum": 3385,
        "spreadRaw": null,
        "spreadPct": null
      },
      "EPS INR": {
        "metric": "EPS INR",
        "unit": "INR",
        "fiscalMonth": "March",
        "period": "2026 Q4",
        "released": null,
        "releasedNum": null,
        "forecast": "5,90",
        "forecastNum": 5.9,
        "spreadRaw": null,
        "spreadPct": null
      },
      "Announcement Date": {
        "metric": "Announcement Date",
        "unit": null,
        "fiscalMonth": "March",
        "period": "2026 Q4",
        "released": "-",
        "releasedDate": "-",
        "forecast": null,
        "spreadRaw": null,
        "spreadPct": null
      }
    },
    "2027 Q1": {
      "Net salesMillion INR": {
        "metric": "Net salesMillion INR",
        "unit": "Million INR",
        "fiscalMonth": "March",
        "period": "2027 Q1",
        "released": null,
        "releasedNum": null,
        "forecast": "53 149",
        "forecastNum": 53149,
        "spreadRaw": null,
        "spreadPct": null
      },
      "EBITDAMillion INR": {
        "metric": "EBITDAMillion INR",
        "unit": "Million INR",
        "fiscalMonth": "March",
        "period": "2027 Q1",
        "released": null,
        "releasedNum": null,
        "forecast": "5 992",
        "forecastNum": 5992,
        "spreadRaw": null,
        "spreadPct": null
      },
      "EBITMillion INR": {
        "metric": "EBITMillion INR",
        "unit": "Million INR",
        "fiscalMonth": "March",
        "period": "2027 Q1",
        "released": null,
        "releasedNum": null,
        "forecast": "4 128",
        "forecastNum": 4128,
        "spreadRaw": null,
        "spreadPct": null
      },
      "Earnings before Tax (EBT)Million INR": {
        "metric": "Earnings before Tax (EBT)Million INR",
        "unit": "Million INR",
        "fiscalMonth": "March",
        "period": "2027 Q1",
        "released": null,
        "releasedNum": null,
        "forecast": null,
        "forecastNum": null,
        "spreadRaw": null,
        "spreadPct": null
      },
      "Net incomeMillion INR": {
        "metric": "Net incomeMillion INR",
        "unit": "Million INR",
        "fiscalMonth": "March",
        "period": "2027 Q1",
        "released": null,
        "releasedNum": null,
        "forecast": null,
        "forecastNum": null,
        "spreadRaw": null,
        "spreadPct": null
      },
      "EPS INR": {
        "metric": "EPS INR",
        "unit": "INR",
        "fiscalMonth": "March",
        "period": "2027 Q1",
        "released": null,
        "releasedNum": null,
        "forecast": null,
        "forecastNum": null,
        "spreadRaw": null,
        "spreadPct": null
      },
      "Announcement Date": {
        "metric": "Announcement Date",
        "unit": null,
        "fiscalMonth": "March",
        "period": "2027 Q1",
        "released": "-",
        "releasedDate": "-",
        "forecast": null,
        "spreadRaw": null,
        "spreadPct": null
      }
    }
  },
  "upcomingEvents": {
    "count": 4,
    "events": [
      {
        "section": "Upcoming",
        "dateTimeRaw": "18/11/2025",
        "dateTimeISO": "2025-11-17T18:30:00.000Z",
        "title": "Q2 2026 Earnings Release (Projected)",
        "icsUrl": "https://in.marketscreener.com/api/stateful/agenda/event-async/Q2-2026-Earnings-Release-Projected-48303064.ics"
      },
      {
        "section": "Upcoming",
        "dateTimeRaw": "11/02/2026",
        "dateTimeISO": "2026-02-10T18:30:00.000Z",
        "title": "Q3 2026 Earnings Release (Projected)",
        "icsUrl": "https://in.marketscreener.com/api/stateful/agenda/event-async/Q3-2026-Earnings-Release-Projected-48330154.ics"
      },
      {
        "section": "Upcoming",
        "dateTimeRaw": "14/05/2026",
        "dateTimeISO": "2026-05-13T18:30:00.000Z",
        "title": "Q4 2026 Earnings Release (Projected)",
        "icsUrl": "https://in.marketscreener.com/api/stateful/agenda/event-async/Q4-2026-Earnings-Release-Projected-48330158.ics"
      },
      {
        "section": "Upcoming",
        "dateTimeRaw": "12/08/2026",
        "dateTimeISO": "2026-08-11T18:30:00.000Z",
        "title": "Q1 2027 Earnings Release (Projected)",
        "icsUrl": "https://in.marketscreener.com/api/stateful/agenda/event-async/Q1-2027-Earnings-Release-Projected-50648981.ics"
      }
    ]
  },
  "pastEvents": {
    "count": 174,
    "events": [
      {
        "section": "Past",
        "dateTimeRaw": "02/10/2025",
        "dateTimeISO": "2025-10-01T18:30:00.000Z",
        "title": "Non-Deal Roadshow - Day 4",
        "icsUrl": "https://in.marketscreener.com/api/stateful/agenda/event-async/Non-Deal-Roadshow-Day-4-51153305.ics"
      },
      {
        "section": "Past",
        "dateTimeRaw": "01/10/2025",
        "dateTimeISO": "2025-09-30T18:30:00.000Z",
        "title": "Non-Deal Roadshow - Day 3",
        "icsUrl": "https://in.marketscreener.com/api/stateful/agenda/event-async/Non-Deal-Roadshow-Day-3-51162888.ics"
      },
      {
        "section": "Past",
        "dateTimeRaw": "30/09/2025",
        "dateTimeISO": "2025-09-29T18:30:00.000Z",
        "title": "Non-Deal Roadshow - Day 2",
        "icsUrl": "https://in.marketscreener.com/api/stateful/agenda/event-async/Non-Deal-Roadshow-Day-2-51162886.ics"
      },
      {
        "section": "Past",
        "dateTimeRaw": "29/09/2025",
        "dateTimeISO": "2025-09-28T18:30:00.000Z",
        "title": "Non-Deal Roadshow - Day 1",
        "icsUrl": "https://in.marketscreener.com/api/stateful/agenda/event-async/Non-Deal-Roadshow-Day-1-51162885.ics"
      },
      {
        "section": "Past",
        "dateTimeRaw": "26/09/2025",
        "dateTimeISO": "2025-09-25T18:30:00.000Z",
        "title": "Non-Deal Roadshow",
        "icsUrl": "https://in.marketscreener.com/api/stateful/agenda/event-async/Non-Deal-Roadshow-51162884.ics"
      },
      {
        "section": "Past",
        "dateTimeRaw": "24/09/2025",
        "dateTimeISO": "2025-09-23T18:30:00.000Z",
        "title": "Non-Deal Roadshow",
        "icsUrl": "https://in.marketscreener.com/api/stateful/agenda/event-async/Non-Deal-Roadshow-51162879.ics"
      },
      {
        "section": "Past",
        "dateTimeRaw": "03/09/2025",
        "dateTimeISO": "2025-09-02T18:30:00.000Z",
        "title": "Goldman Sachs Asia Leaders Conference",
        "icsUrl": "https://in.marketscreener.com/api/stateful/agenda/event-async/Goldman-Sachs-Asia-Leaders-Conference-50928162.ics"
      },
      {
        "section": "Past",
        "dateTimeRaw": "14/08/2025",
        "dateTimeISO": "2025-08-13T18:30:00.000Z",
        "title": "Non Deal Roadshow - Day 2",
        "icsUrl": "https://in.marketscreener.com/api/stateful/agenda/event-async/Non-Deal-Roadshow-Day-2-50714552.ics"
      },
      {
        "section": "Past",
        "dateTimeRaw": "13/08/2025",
        "dateTimeISO": "2025-08-12T18:30:00.000Z",
        "title": "Non Deal Roadshow - Day 1",
        "icsUrl": "https://in.marketscreener.com/api/stateful/agenda/event-async/Non-Deal-Roadshow-Day-1-50714546.ics"
      },
      {
        "section": "Past",
        "dateTimeRaw": "08/08/2025 10:30 am",
        "dateTimeISO": "2025-08-08T05:00:00.000Z",
        "title": "Annual General Meeting",
        "icsUrl": "https://in.marketscreener.com/api/stateful/agenda/event-async/Annual-General-Meeting-50507909.ics"
      },
      {
        "section": "Past",
        "dateTimeRaw": "06/08/2025 04:00 pm",
        "dateTimeISO": "2025-08-06T10:30:00.000Z",
        "title": "Q1 2026 Earnings Call",
        "icsUrl": "https://in.marketscreener.com/api/stateful/agenda/event-async/Q1-2026-Earnings-Call-50697399.ics"
      },
      {
        "section": "Past",
        "dateTimeRaw": "06/08/2025 12:53 pm",
        "dateTimeISO": "2025-08-06T07:23:00.000Z",
        "title": "Q1 2026 Earnings Release",
        "icsUrl": "https://in.marketscreener.com/api/stateful/agenda/event-async/Q1-2026-Earnings-Release-47577214.ics"
      },
      {
        "section": "Past",
        "dateTimeRaw": "27/06/2025",
        "dateTimeISO": "2025-06-26T18:30:00.000Z",
        "title": "Non Deal Roadshow - Day 2",
        "icsUrl": "https://in.marketscreener.com/api/stateful/agenda/event-async/Non-Deal-Roadshow-Day-2-50315709.ics"
      },
      {
        "section": "Past",
        "dateTimeRaw": "26/06/2025",
        "dateTimeISO": "2025-06-25T18:30:00.000Z",
        "title": "Non Deal Roadshow - Day 1",
        "icsUrl": "https://in.marketscreener.com/api/stateful/agenda/event-async/Non-Deal-Roadshow-Day-1-50315708.ics"
      },
      {
        "section": "Past",
        "dateTimeRaw": "30/05/2025",
        "dateTimeISO": "2025-05-29T18:30:00.000Z",
        "title": "Final dividend",
        "icsUrl": "https://in.marketscreener.com/api/stateful/agenda/event-async/Final-dividend-50121930.ics"
      },
      {
        "section": "Past",
        "dateTimeRaw": "21/05/2025 03:21 pm",
        "dateTimeISO": "2025-05-21T09:51:00.000Z",
        "title": "Q4 2025 Earnings Release",
        "icsUrl": "https://in.marketscreener.com/api/stateful/agenda/event-async/Q4-2025-Earnings-Release-44909513.ics"
      },
      {
        "section": "Past",
        "dateTimeRaw": "21/05/2025 04:00 pm",
        "dateTimeISO": "2025-05-21T10:30:00.000Z",
        "title": "Q4 2025 Earnings Call",
        "icsUrl": "https://in.marketscreener.com/api/stateful/agenda/event-async/Q4-2025-Earnings-Call-49975867.ics"
      },
      {
        "section": "Past",
        "dateTimeRaw": "28/03/2025 11:00 am",
        "dateTimeISO": "2025-03-28T05:30:00.000Z",
        "title": "Investor Meeting",
        "icsUrl": "https://in.marketscreener.com/api/stateful/agenda/event-async/Investor-Meeting-49434294.ics"
      },
      {
        "section": "Past",
        "dateTimeRaw": "12/02/2025",
        "dateTimeISO": "2025-02-11T18:30:00.000Z",
        "title": "Ex-dividend day for dividende intermédiaire",
        "icsUrl": "https://in.marketscreener.com/api/stateful/agenda/event-async/Ex-dividend-day-for-dividende-intermediaire-49070826.ics"
      },
      {
        "section": "Past",
        "dateTimeRaw": "11/02/2025 04:00 pm",
        "dateTimeISO": "2025-02-11T10:30:00.000Z",
        "title": "Investor Meeting - Invesco AMC",
        "icsUrl": "https://in.marketscreener.com/api/stateful/agenda/event-async/Investor-Meeting-Invesco-AMC-49044920.ics"
      },
      {
        "section": "Past",
        "dateTimeRaw": "06/02/2025 03:30 pm",
        "dateTimeISO": "2025-02-06T10:00:00.000Z",
        "title": "Q3 2025 Earnings Call",
        "icsUrl": "https://in.marketscreener.com/api/stateful/agenda/event-async/Q3-2025-Earnings-Call-48946464.ics"
      },
      {
        "section": "Past",
        "dateTimeRaw": "06/02/2025 12:16 pm",
        "dateTimeISO": "2025-02-06T06:46:00.000Z",
        "title": "Q3 2025 Earnings Release",
        "icsUrl": "https://in.marketscreener.com/api/stateful/agenda/event-async/Q3-2025-Earnings-Release-44909511.ics"
      },
      {
        "section": "Past",
        "dateTimeRaw": "20/01/2025 11:00 am",
        "dateTimeISO": "2025-01-20T05:30:00.000Z",
        "title": "Bharat Mobility Global Expo",
        "icsUrl": "https://in.marketscreener.com/api/stateful/agenda/event-async/Bharat-Mobility-Global-Expo-48762428.ics"
      },
      {
        "section": "Past",
        "dateTimeRaw": "14/01/2025",
        "dateTimeISO": "2025-01-13T18:30:00.000Z",
        "title": "Non Deal Roadshow - Day 2",
        "icsUrl": "https://in.marketscreener.com/api/stateful/agenda/event-async/Non-Deal-Roadshow-Day-2-48683727.ics"
      },
      {
        "section": "Past",
        "dateTimeRaw": "13/01/2025",
        "dateTimeISO": "2025-01-12T18:30:00.000Z",
        "title": "Non Deal Roadshow - Day 1",
        "icsUrl": "https://in.marketscreener.com/api/stateful/agenda/event-async/Non-Deal-Roadshow-Day-1-48683726.ics"
      },
      {
        "section": "Past",
        "dateTimeRaw": "12/11/2024 03:00 pm",
        "dateTimeISO": "2024-11-12T09:30:00.000Z",
        "title": "Q2 2025 Earnings Call",
        "icsUrl": "https://in.marketscreener.com/api/stateful/agenda/event-async/Q2-2025-Earnings-Call-48284767.ics"
      },
      {
        "section": "Past",
        "dateTimeRaw": "12/11/2024 11:36 am",
        "dateTimeISO": "2024-11-12T06:06:00.000Z",
        "title": "Q2 2025 Earnings Release",
        "icsUrl": "https://in.marketscreener.com/api/stateful/agenda/event-async/Q2-2025-Earnings-Release-44909510.ics"
      },
      {
        "section": "Past",
        "dateTimeRaw": "09/10/2024",
        "dateTimeISO": "2024-10-08T18:30:00.000Z",
        "title": "Non Deal Roadshow - Day 3",
        "icsUrl": "https://in.marketscreener.com/api/stateful/agenda/event-async/Non-Deal-Roadshow-Day-3-47999024.ics"
      },
      {
        "section": "Past",
        "dateTimeRaw": "08/10/2024",
        "dateTimeISO": "2024-10-07T18:30:00.000Z",
        "title": "Non Deal Roadshow - Day 2",
        "icsUrl": "https://in.marketscreener.com/api/stateful/agenda/event-async/Non-Deal-Roadshow-Day-2-47999023.ics"
      },
      {
        "section": "Past",
        "dateTimeRaw": "07/10/2024",
        "dateTimeISO": "2024-10-06T18:30:00.000Z",
        "title": "Non Deal Roadshow - Day 1",
        "icsUrl": "https://in.marketscreener.com/api/stateful/agenda/event-async/Non-Deal-Roadshow-Day-1-47999022.ics"
      },
      {
        "section": "Past",
        "dateTimeRaw": "13/09/2024",
        "dateTimeISO": "2024-09-12T18:30:00.000Z",
        "title": "Non Deal Roadshow",
        "icsUrl": "https://in.marketscreener.com/api/stateful/agenda/event-async/Non-Deal-Roadshow-47797779.ics"
      },
      {
        "section": "Past",
        "dateTimeRaw": "12/09/2024",
        "dateTimeISO": "2024-09-11T18:30:00.000Z",
        "title": "Non Deal Roadshow",
        "icsUrl": "https://in.marketscreener.com/api/stateful/agenda/event-async/Non-Deal-Roadshow-47797770.ics"
      },
      {
        "section": "Past",
        "dateTimeRaw": "11/09/2024",
        "dateTimeISO": "2024-09-10T18:30:00.000Z",
        "title": "Non Deal Roadshow - Day 2",
        "icsUrl": "https://in.marketscreener.com/api/stateful/agenda/event-async/Non-Deal-Roadshow-Day-2-47797765.ics"
      },
      {
        "section": "Past",
        "dateTimeRaw": "10/09/2024",
        "dateTimeISO": "2024-09-09T18:30:00.000Z",
        "title": "Non Deal Roadshow - Day 1",
        "icsUrl": "https://in.marketscreener.com/api/stateful/agenda/event-async/Non-Deal-Roadshow-Day-1-47797762.ics"
      },
      {
        "section": "Past",
        "dateTimeRaw": "09/09/2024",
        "dateTimeISO": "2024-09-08T18:30:00.000Z",
        "title": "Non Deal Roadshow",
        "icsUrl": "https://in.marketscreener.com/api/stateful/agenda/event-async/Non-Deal-Roadshow-47797756.ics"
      },
      {
        "section": "Past",
        "dateTimeRaw": "06/09/2024",
        "dateTimeISO": "2024-09-05T18:30:00.000Z",
        "title": "Non Deal Roadshow",
        "icsUrl": "https://in.marketscreener.com/api/stateful/agenda/event-async/Non-Deal-Roadshow-47797751.ics"
      },
      {
        "section": "Past",
        "dateTimeRaw": "27/08/2024 10:30 am",
        "dateTimeISO": "2024-08-27T05:00:00.000Z",
        "title": "Annual General Meeting",
        "icsUrl": "https://in.marketscreener.com/api/stateful/agenda/event-async/Annual-General-Meeting-47577107.ics"
      },
      {
        "section": "Past",
        "dateTimeRaw": "07/08/2024 04:00 pm",
        "dateTimeISO": "2024-08-07T10:30:00.000Z",
        "title": "Q1 2025 Earnings Call",
        "icsUrl": "https://in.marketscreener.com/api/stateful/agenda/event-async/Q1-2025-Earnings-Call-47576998.ics"
      },
      {
        "section": "Past",
        "dateTimeRaw": "07/08/2024 01:03 pm",
        "dateTimeISO": "2024-08-07T07:33:00.000Z",
        "title": "Q1 2025 Earnings Release",
        "icsUrl": "https://in.marketscreener.com/api/stateful/agenda/event-async/Q1-2025-Earnings-Release-44476052.ics"
      },
      {
        "section": "Past",
        "dateTimeRaw": "07/06/2024",
        "dateTimeISO": "2024-06-06T18:30:00.000Z",
        "title": "Final dividend",
        "icsUrl": "https://in.marketscreener.com/api/stateful/agenda/event-async/Final-dividend-46881502.ics"
      },
      {
        "section": "Past",
        "dateTimeRaw": "23/05/2024 03:30 pm",
        "dateTimeISO": "2024-05-23T10:00:00.000Z",
        "title": "Q4 2024 Earnings Call",
        "icsUrl": "https://in.marketscreener.com/api/stateful/agenda/event-async/Q4-2024-Earnings-Call-46770962.ics"
      },
      {
        "section": "Past",
        "dateTimeRaw": "23/05/2024 02:51 pm",
        "dateTimeISO": "2024-05-23T09:21:00.000Z",
        "title": "Q4 2024 Earnings Release",
        "icsUrl": "https://in.marketscreener.com/api/stateful/agenda/event-async/Q4-2024-Earnings-Release-43845108.ics"
      },
      {
        "section": "Past",
        "dateTimeRaw": "02/05/2024 11:00 am",
        "dateTimeISO": "2024-05-02T05:30:00.000Z",
        "title": "Investor Meeting - Mathews Asia",
        "icsUrl": "https://in.marketscreener.com/api/stateful/agenda/event-async/Investor-Meeting-Mathews-Asia-46525325.ics"
      },
      {
        "section": "Past",
        "dateTimeRaw": "26/04/2024 11:00 am",
        "dateTimeISO": "2024-04-26T05:30:00.000Z",
        "title": "Investor Meeting - BNP Paribas (Hongkong)",
        "icsUrl": "https://in.marketscreener.com/api/stateful/agenda/event-async/Investor-Meeting-BNP-Paribas-Hongkong-46525317.ics"
      },
      {
        "section": "Past",
        "dateTimeRaw": "26/04/2024 10:00 am",
        "dateTimeISO": "2024-04-26T04:30:00.000Z",
        "title": "Investor Meeting - Mirae Asset Management",
        "icsUrl": "https://in.marketscreener.com/api/stateful/agenda/event-async/Investor-Meeting-Mirae-Asset-Management-46525316.ics"
      },
      {
        "section": "Past",
        "dateTimeRaw": "20/04/2024 11:30 am",
        "dateTimeISO": "2024-04-20T06:00:00.000Z",
        "title": "Shareholders Meeting - Unsecured Creditors",
        "icsUrl": "https://in.marketscreener.com/api/stateful/agenda/event-async/Shareholders-Meeting-Unsecured-Creditors-46269471.ics"
      },
      {
        "section": "Past",
        "dateTimeRaw": "20/04/2024 10:00 am",
        "dateTimeISO": "2024-04-20T04:30:00.000Z",
        "title": "Shareholders Meeting - Equity Shareholders",
        "icsUrl": "https://in.marketscreener.com/api/stateful/agenda/event-async/Shareholders-Meeting-Equity-Shareholders-46269470.ics"
      },
      {
        "section": "Past",
        "dateTimeRaw": "02/04/2024 09:30 am",
        "dateTimeISO": "2024-04-02T04:00:00.000Z",
        "title": "Investor Meeting - Fidelity Internationa",
        "icsUrl": "https://in.marketscreener.com/api/stateful/agenda/event-async/Investor-Meeting-Fidelity-Internationa-46223075.ics"
      },
      {
        "section": "Past",
        "dateTimeRaw": "29/03/2024 11:30 am",
        "dateTimeISO": "2024-03-29T06:00:00.000Z",
        "title": "Investor Meeting - Dymon Asia",
        "icsUrl": "https://in.marketscreener.com/api/stateful/agenda/event-async/Investor-Meeting-Dymon-Asia-46317823.ics"
      },
      {
        "section": "Past",
        "dateTimeRaw": "28/03/2024 04:00 pm",
        "dateTimeISO": "2024-03-28T10:30:00.000Z",
        "title": "Investor Meeting - Carnelian Capital",
        "icsUrl": "https://in.marketscreener.com/api/stateful/agenda/event-async/Investor-Meeting-Carnelian-Capital-46317814.ics"
      },
      {
        "section": "Past",
        "dateTimeRaw": "28/03/2024 02:00 pm",
        "dateTimeISO": "2024-03-28T08:30:00.000Z",
        "title": "Investor Meeting - Wellington Partners",
        "icsUrl": "https://in.marketscreener.com/api/stateful/agenda/event-async/Investor-Meeting-Wellington-Partners-46223070.ics"
      },
      {
        "section": "Past",
        "dateTimeRaw": "07/03/2024 04:30 pm",
        "dateTimeISO": "2024-03-07T11:00:00.000Z",
        "title": "Investor Meeting - DSP Mutual Fund",
        "icsUrl": "https://in.marketscreener.com/api/stateful/agenda/event-async/Investor-Meeting-DSP-Mutual-Fund-46178300.ics"
      },
      {
        "section": "Past",
        "dateTimeRaw": "07/03/2024 03:30 pm",
        "dateTimeISO": "2024-03-07T10:00:00.000Z",
        "title": "Investor Meeting - HSBC Mutual Fund",
        "icsUrl": "https://in.marketscreener.com/api/stateful/agenda/event-async/Investor-Meeting-HSBC-Mutual-Fund-46178299.ics"
      },
      {
        "section": "Past",
        "dateTimeRaw": "07/03/2024 02:00 pm",
        "dateTimeISO": "2024-03-07T08:30:00.000Z",
        "title": "Investor Meeting - PGIM",
        "icsUrl": "https://in.marketscreener.com/api/stateful/agenda/event-async/Investor-Meeting-PGIM-46178301.ics"
      },
      {
        "section": "Past",
        "dateTimeRaw": "07/03/2024 12:15 pm",
        "dateTimeISO": "2024-03-07T06:45:00.000Z",
        "title": "Investor Meeting - BOI Mutual Fund",
        "icsUrl": "https://in.marketscreener.com/api/stateful/agenda/event-async/Investor-Meeting-BOI-Mutual-Fund-46178298.ics"
      },
      {
        "section": "Past",
        "dateTimeRaw": "07/03/2024 11:15 am",
        "dateTimeISO": "2024-03-07T05:45:00.000Z",
        "title": "Investor Meeting - Max Life",
        "icsUrl": "https://in.marketscreener.com/api/stateful/agenda/event-async/Investor-Meeting-Max-Life-46178297.ics"
      },
      {
        "section": "Past",
        "dateTimeRaw": "07/03/2024 10:00 am",
        "dateTimeISO": "2024-03-07T04:30:00.000Z",
        "title": "Investor Meeting - Tata Mutual Fund",
        "icsUrl": "https://in.marketscreener.com/api/stateful/agenda/event-async/Investor-Meeting-Tata-Mutual-Fund-46178295.ics"
      },
      {
        "section": "Past",
        "dateTimeRaw": "06/03/2024 05:00 pm",
        "dateTimeISO": "2024-03-06T11:30:00.000Z",
        "title": "Investor Meeting - SBI MF",
        "icsUrl": "https://in.marketscreener.com/api/stateful/agenda/event-async/Investor-Meeting-SBI-MF-46178220.ics"
      },
      {
        "section": "Past",
        "dateTimeRaw": "06/03/2024 04:00 pm",
        "dateTimeISO": "2024-03-06T10:30:00.000Z",
        "title": "Investor Meeting - ICICI Pru Mutual Fund",
        "icsUrl": "https://in.marketscreener.com/api/stateful/agenda/event-async/Investor-Meeting-ICICI-Pru-Mutual-Fund-46178219.ics"
      },
      {
        "section": "Past",
        "dateTimeRaw": "06/03/2024 02:30 pm",
        "dateTimeISO": "2024-03-06T09:00:00.000Z",
        "title": "Investor Meeting - ICICI Pru Life Insurance",
        "icsUrl": "https://in.marketscreener.com/api/stateful/agenda/event-async/Investor-Meeting-ICICI-Pru-Life-Insurance-46178218.ics"
      },
      {
        "section": "Past",
        "dateTimeRaw": "20/02/2024",
        "dateTimeISO": "2024-02-19T18:30:00.000Z",
        "title": "Investor Meeting - Wellington Partners",
        "icsUrl": "https://in.marketscreener.com/api/stateful/agenda/event-async/Investor-Meeting-Wellington-Partners-46177572.ics"
      },
      {
        "section": "Past",
        "dateTimeRaw": "19/02/2024",
        "dateTimeISO": "2024-02-18T18:30:00.000Z",
        "title": "Investor Meeting - William Blair & Company",
        "icsUrl": "https://in.marketscreener.com/api/stateful/agenda/event-async/Investor-Meeting-William-Blair-Company-46177543.ics"
      },
      {
        "section": "Past",
        "dateTimeRaw": "15/02/2024",
        "dateTimeISO": "2024-02-14T18:30:00.000Z",
        "title": "Ex-dividend day for dividende intermédiaire",
        "icsUrl": "https://in.marketscreener.com/api/stateful/agenda/event-async/Ex-dividend-day-for-dividende-intermediaire-45976922.ics"
      },
      {
        "section": "Past",
        "dateTimeRaw": "07/02/2024 04:00 pm",
        "dateTimeISO": "2024-02-07T10:30:00.000Z",
        "title": "Q3 2024 Earnings Call",
        "icsUrl": "https://in.marketscreener.com/api/stateful/agenda/event-async/Q3-2024-Earnings-Call-45860380.ics"
      },
      {
        "section": "Past",
        "dateTimeRaw": "07/02/2024 12:53 pm",
        "dateTimeISO": "2024-02-07T07:23:00.000Z",
        "title": "Q3 2024 Earnings Release",
        "icsUrl": "https://in.marketscreener.com/api/stateful/agenda/event-async/Q3-2024-Earnings-Release-42839028.ics"
      },
      {
        "section": "Past",
        "dateTimeRaw": "19/01/2024",
        "dateTimeISO": "2024-01-18T18:30:00.000Z",
        "title": "Non Deal Roadshow - Day 2",
        "icsUrl": "https://in.marketscreener.com/api/stateful/agenda/event-async/Non-Deal-Roadshow-Day-2-45754445.ics"
      },
      {
        "section": "Past",
        "dateTimeRaw": "18/01/2024",
        "dateTimeISO": "2024-01-17T18:30:00.000Z",
        "title": "Non Deal Roadshow - Day 1",
        "icsUrl": "https://in.marketscreener.com/api/stateful/agenda/event-async/Non-Deal-Roadshow-Day-1-45754440.ics"
      },
      {
        "section": "Past",
        "dateTimeRaw": "12/01/2024",
        "dateTimeISO": "2024-01-11T18:30:00.000Z",
        "title": "Investor Meeting - SBI Life Insurance",
        "icsUrl": "https://in.marketscreener.com/api/stateful/agenda/event-async/Investor-Meeting-SBI-Life-Insurance-45736125.ics"
      },
      {
        "section": "Past",
        "dateTimeRaw": "01/12/2023",
        "dateTimeISO": "2023-11-30T18:30:00.000Z",
        "title": "Investor Meeting",
        "icsUrl": "https://in.marketscreener.com/api/stateful/agenda/event-async/Investor-Meeting-45488366.ics"
      },
      {
        "section": "Past",
        "dateTimeRaw": "07/11/2023 04:00 pm",
        "dateTimeISO": "2023-11-07T10:30:00.000Z",
        "title": "Q2 2024 Earnings Call",
        "icsUrl": "https://in.marketscreener.com/api/stateful/agenda/event-async/Q2-2024-Earnings-Call-45331482.ics"
      },
      {
        "section": "Past",
        "dateTimeRaw": "07/11/2023 01:05 pm",
        "dateTimeISO": "2023-11-07T07:35:00.000Z",
        "title": "Q2 2024 Earnings Release",
        "icsUrl": "https://in.marketscreener.com/api/stateful/agenda/event-async/Q2-2024-Earnings-Release-42218962.ics"
      },
      {
        "section": "Past",
        "dateTimeRaw": "28/09/2023",
        "dateTimeISO": "2023-09-27T18:30:00.000Z",
        "title": "Investor Meeting - HSBC Mutual Fund",
        "icsUrl": "https://in.marketscreener.com/api/stateful/agenda/event-async/Investor-Meeting-HSBC-Mutual-Fund-44912193.ics"
      },
      {
        "section": "Past",
        "dateTimeRaw": "20/09/2023 10:30 am",
        "dateTimeISO": "2023-09-20T05:00:00.000Z",
        "title": "Annual General Meeting",
        "icsUrl": "https://in.marketscreener.com/api/stateful/agenda/event-async/Annual-General-Meeting-44685870.ics"
      },
      {
        "section": "Past",
        "dateTimeRaw": "14/09/2023",
        "dateTimeISO": "2023-09-13T18:30:00.000Z",
        "title": "Non Deal Roadshow",
        "icsUrl": "https://in.marketscreener.com/api/stateful/agenda/event-async/Non-Deal-Roadshow-44717531.ics"
      },
      {
        "section": "Past",
        "dateTimeRaw": "13/09/2023",
        "dateTimeISO": "2023-09-12T18:30:00.000Z",
        "title": "Macquarie Asia Energy Transition & Materials for Future Technologies Conference",
        "icsUrl": "https://in.marketscreener.com/api/stateful/agenda/event-async/Macquarie-Asia-Energy-Transition-Materials-for-Future-Technologies-Conference-44675358.ics"
      },
      {
        "section": "Past",
        "dateTimeRaw": "12/09/2023",
        "dateTimeISO": "2023-09-11T18:30:00.000Z",
        "title": "Non Deal Roadshow",
        "icsUrl": "https://in.marketscreener.com/api/stateful/agenda/event-async/Non-Deal-Roadshow-44717527.ics"
      },
      {
        "section": "Past",
        "dateTimeRaw": "11/09/2023",
        "dateTimeISO": "2023-09-10T18:30:00.000Z",
        "title": "Non Deal Roadshow",
        "icsUrl": "https://in.marketscreener.com/api/stateful/agenda/event-async/Non-Deal-Roadshow-44717519.ics"
      },
      {
        "section": "Past",
        "dateTimeRaw": "08/09/2023",
        "dateTimeISO": "2023-09-07T18:30:00.000Z",
        "title": "Non Deal Roadshow",
        "icsUrl": "https://in.marketscreener.com/api/stateful/agenda/event-async/Non-Deal-Roadshow-44717513.ics"
      },
      {
        "section": "Past",
        "dateTimeRaw": "31/08/2023",
        "dateTimeISO": "2023-08-30T18:30:00.000Z",
        "title": "Non Deal Roadshow",
        "icsUrl": "https://in.marketscreener.com/api/stateful/agenda/event-async/Non-Deal-Roadshow-44717503.ics"
      },
      {
        "section": "Past",
        "dateTimeRaw": "31/08/2023",
        "dateTimeISO": "2023-08-30T18:30:00.000Z",
        "title": "Final dividend",
        "icsUrl": "https://in.marketscreener.com/api/stateful/agenda/event-async/Final-dividend-44706821.ics"
      },
      {
        "section": "Past",
        "dateTimeRaw": "29/08/2023",
        "dateTimeISO": "2023-08-28T18:30:00.000Z",
        "title": "Investor Meeting - Martin Currie Fund",
        "icsUrl": "https://in.marketscreener.com/api/stateful/agenda/event-async/Investor-Meeting-Martin-Currie-Fund-44717498.ics"
      },
      {
        "section": "Past",
        "dateTimeRaw": "16/08/2023",
        "dateTimeISO": "2023-08-15T18:30:00.000Z",
        "title": "Nuvama India Conference",
        "icsUrl": "https://in.marketscreener.com/api/stateful/agenda/event-async/Nuvama-India-Conference-44614174.ics"
      },
      {
        "section": "Past",
        "dateTimeRaw": "09/08/2023 04:00 pm",
        "dateTimeISO": "2023-08-09T10:30:00.000Z",
        "title": "Q1 2024 Earnings Call",
        "icsUrl": "https://in.marketscreener.com/api/stateful/agenda/event-async/Q1-2024-Earnings-Call-44475995.ics"
      },
      {
        "section": "Past",
        "dateTimeRaw": "09/08/2023 12:24 pm",
        "dateTimeISO": "2023-08-09T06:54:00.000Z",
        "title": "Q1 2024 Earnings Release",
        "icsUrl": "https://in.marketscreener.com/api/stateful/agenda/event-async/Q1-2024-Earnings-Release-41229770.ics"
      },
      {
        "section": "Past",
        "dateTimeRaw": "26/06/2023 11:00 am",
        "dateTimeISO": "2023-06-26T05:30:00.000Z",
        "title": "Investor Meeting",
        "icsUrl": "https://in.marketscreener.com/api/stateful/agenda/event-async/Investor-Meeting-44200010.ics"
      },
      {
        "section": "Past",
        "dateTimeRaw": "15/06/2023",
        "dateTimeISO": "2023-06-14T18:30:00.000Z",
        "title": "Investor Meeting - Kotak Securities India Corporate Day",
        "icsUrl": "https://in.marketscreener.com/api/stateful/agenda/event-async/Investor-Meeting-Kotak-Securities-India-Corporate-Day-44097170.ics"
      },
      {
        "section": "Past",
        "dateTimeRaw": "26/05/2023",
        "dateTimeISO": "2023-05-25T18:30:00.000Z",
        "title": "Investor Meeting - DSP Mutual Fund",
        "icsUrl": "https://in.marketscreener.com/api/stateful/agenda/event-async/Investor-Meeting-DSP-Mutual-Fund-43969333.ics"
      },
      {
        "section": "Past",
        "dateTimeRaw": "26/05/2023",
        "dateTimeISO": "2023-05-25T18:30:00.000Z",
        "title": "Investor Meeting - White Oak India",
        "icsUrl": "https://in.marketscreener.com/api/stateful/agenda/event-async/Investor-Meeting-White-Oak-India-43969332.ics"
      },
      {
        "section": "Past",
        "dateTimeRaw": "26/05/2023",
        "dateTimeISO": "2023-05-25T18:30:00.000Z",
        "title": "Investor Meeting - ICICI Pru Life",
        "icsUrl": "https://in.marketscreener.com/api/stateful/agenda/event-async/Investor-Meeting-ICICI-Pru-Life-43969331.ics"
      },
      {
        "section": "Past",
        "dateTimeRaw": "26/05/2023",
        "dateTimeISO": "2023-05-25T18:30:00.000Z",
        "title": "Investor Meeting - SBI Mutual Fund",
        "icsUrl": "https://in.marketscreener.com/api/stateful/agenda/event-async/Investor-Meeting-SBI-Mutual-Fund-43969330.ics"
      },
      {
        "section": "Past",
        "dateTimeRaw": "26/05/2023",
        "dateTimeISO": "2023-05-25T18:30:00.000Z",
        "title": "Investor Meeting",
        "icsUrl": "https://in.marketscreener.com/api/stateful/agenda/event-async/Investor-Meeting-43969329.ics"
      },
      {
        "section": "Past",
        "dateTimeRaw": "23/05/2023",
        "dateTimeISO": "2023-05-22T18:30:00.000Z",
        "title": "Investor Meeting - Bawal and Manesar Gurgaon (Haryana)",
        "icsUrl": "https://in.marketscreener.com/api/stateful/agenda/event-async/Investor-Meeting-Bawal-and-Manesar-Gurgaon-Haryana-43941970.ics"
      },
      {
        "section": "Past",
        "dateTimeRaw": "19/05/2023 10:30 am",
        "dateTimeISO": "2023-05-19T05:00:00.000Z",
        "title": "Q4 2023 Earnings Call",
        "icsUrl": "https://in.marketscreener.com/api/stateful/agenda/event-async/Q4-2023-Earnings-Call-43899995.ics"
      },
      {
        "section": "Past",
        "dateTimeRaw": "19/05/2023",
        "dateTimeISO": "2023-05-18T18:30:00.000Z",
        "title": "Investor Meeting - Paradice Investment",
        "icsUrl": "https://in.marketscreener.com/api/stateful/agenda/event-async/Investor-Meeting-Paradice-Investment-43941957.ics"
      },
      {
        "section": "Past",
        "dateTimeRaw": "18/05/2023 06:34 pm",
        "dateTimeISO": "2023-05-18T13:04:00.000Z",
        "title": "Q4 2023 Earnings Release",
        "icsUrl": "https://in.marketscreener.com/api/stateful/agenda/event-async/Q4-2023-Earnings-Release-40506116.ics"
      },
      {
        "section": "Past",
        "dateTimeRaw": "03/05/2023 02:00 pm",
        "dateTimeISO": "2023-05-03T08:30:00.000Z",
        "title": "Investor Meeting - Equity Shareholders",
        "icsUrl": "https://in.marketscreener.com/api/stateful/agenda/event-async/Investor-Meeting-Equity-Shareholders-43844536.ics"
      },
      {
        "section": "Past",
        "dateTimeRaw": "20/02/2023",
        "dateTimeISO": "2023-02-19T18:30:00.000Z",
        "title": "Kotak Chasing Growth Conference",
        "icsUrl": "https://in.marketscreener.com/api/stateful/agenda/event-async/Kotak-Chasing-Growth-Conference-43028409.ics"
      },
      {
        "section": "Past",
        "dateTimeRaw": "20/02/2023",
        "dateTimeISO": "2023-02-19T18:30:00.000Z",
        "title": "Ex-dividend day for dividende intermédiaire",
        "icsUrl": "https://in.marketscreener.com/api/stateful/agenda/event-async/Ex-dividend-day-for-dividende-intermediaire-43023545.ics"
      },
      {
        "section": "Past",
        "dateTimeRaw": "15/02/2023",
        "dateTimeISO": "2023-02-14T18:30:00.000Z",
        "title": "Investor Meeting - British Columbia Investment Management Corporation",
        "icsUrl": "https://in.marketscreener.com/api/stateful/agenda/event-async/Investor-Meeting-British-Columbia-Investment-Management-Corporation-43028349.ics"
      },
      {
        "section": "Past",
        "dateTimeRaw": "08/02/2023 04:00 pm",
        "dateTimeISO": "2023-02-08T10:30:00.000Z",
        "title": "Q3 2023 Earnings Call",
        "icsUrl": "https://in.marketscreener.com/api/stateful/agenda/event-async/Q3-2023-Earnings-Call-42838781.ics"
      },
      {
        "section": "Past",
        "dateTimeRaw": "21/12/2022",
        "dateTimeISO": "2022-12-20T18:30:00.000Z",
        "title": "Investor Meeting - CICI Prudential Life Insurance",
        "icsUrl": "https://in.marketscreener.com/api/stateful/agenda/event-async/Investor-Meeting-CICI-Prudential-Life-Insurance-42617211.ics"
      },
      {
        "section": "Past",
        "dateTimeRaw": "21/12/2022",
        "dateTimeISO": "2022-12-20T18:30:00.000Z",
        "title": "Investor Meeting - Eastbridge",
        "icsUrl": "https://in.marketscreener.com/api/stateful/agenda/event-async/Investor-Meeting-Eastbridge-42617210.ics"
      },
      {
        "section": "Past",
        "dateTimeRaw": "21/12/2022",
        "dateTimeISO": "2022-12-20T18:30:00.000Z",
        "title": "Investor Meeting - Canara Robeco Mutual Fund",
        "icsUrl": "https://in.marketscreener.com/api/stateful/agenda/event-async/Investor-Meeting-Canara-Robeco-Mutual-Fund-42617209.ics"
      },
      {
        "section": "Past",
        "dateTimeRaw": "20/12/2022",
        "dateTimeISO": "2022-12-19T18:30:00.000Z",
        "title": "Investor Meeting - SBI Mutual Fund",
        "icsUrl": "https://in.marketscreener.com/api/stateful/agenda/event-async/Investor-Meeting-SBI-Mutual-Fund-42617199.ics"
      },
      {
        "section": "Past",
        "dateTimeRaw": "20/12/2022",
        "dateTimeISO": "2022-12-19T18:30:00.000Z",
        "title": "Investor Meeting - Tata Mutual Fund",
        "icsUrl": "https://in.marketscreener.com/api/stateful/agenda/event-async/Investor-Meeting-Tata-Mutual-Fund-42617198.ics"
      },
      {
        "section": "Past",
        "dateTimeRaw": "20/12/2022",
        "dateTimeISO": "2022-12-19T18:30:00.000Z",
        "title": "Investor Meeting - Motilal Oswal Mutual Fund",
        "icsUrl": "https://in.marketscreener.com/api/stateful/agenda/event-async/Investor-Meeting-Motilal-Oswal-Mutual-Fund-42617197.ics"
      },
      {
        "section": "Past",
        "dateTimeRaw": "20/12/2022",
        "dateTimeISO": "2022-12-19T18:30:00.000Z",
        "title": "Investor Meeting - SBI Life Insurance Company",
        "icsUrl": "https://in.marketscreener.com/api/stateful/agenda/event-async/Investor-Meeting-SBI-Life-Insurance-Company-42617196.ics"
      },
      {
        "section": "Past",
        "dateTimeRaw": "20/12/2022",
        "dateTimeISO": "2022-12-19T18:30:00.000Z",
        "title": "Investor Meeting - HSBC Mutual Fund",
        "icsUrl": "https://in.marketscreener.com/api/stateful/agenda/event-async/Investor-Meeting-HSBC-Mutual-Fund-42617195.ics"
      },
      {
        "section": "Past",
        "dateTimeRaw": "19/12/2022",
        "dateTimeISO": "2022-12-18T18:30:00.000Z",
        "title": "Investor Meeting - Quantum Advisors",
        "icsUrl": "https://in.marketscreener.com/api/stateful/agenda/event-async/Investor-Meeting-Quantum-Advisors-42617193.ics"
      },
      {
        "section": "Past",
        "dateTimeRaw": "10/11/2022 04:00 pm",
        "dateTimeISO": "2022-11-10T10:30:00.000Z",
        "title": "Interim 2023 Earnings Call",
        "icsUrl": "https://in.marketscreener.com/api/stateful/agenda/event-async/Interim-2023-Earnings-Call-42218621.ics"
      },
      {
        "section": "Past",
        "dateTimeRaw": "10/11/2022 12:56 pm",
        "dateTimeISO": "2022-11-10T07:26:00.000Z",
        "title": "Interim 2023 Earnings Release",
        "icsUrl": "https://in.marketscreener.com/api/stateful/agenda/event-async/Interim-2023-Earnings-Release-36764911.ics"
      },
      {
        "section": "Past",
        "dateTimeRaw": "05/10/2022",
        "dateTimeISO": "2022-10-04T18:30:00.000Z",
        "title": "Roadshow - Day - 3",
        "icsUrl": "https://in.marketscreener.com/api/stateful/agenda/event-async/Roadshow-Day-3-41907237.ics"
      },
      {
        "section": "Past",
        "dateTimeRaw": "04/10/2022",
        "dateTimeISO": "2022-10-03T18:30:00.000Z",
        "title": "Roadshow - Day - 2",
        "icsUrl": "https://in.marketscreener.com/api/stateful/agenda/event-async/Roadshow-Day-2-41907235.ics"
      },
      {
        "section": "Past",
        "dateTimeRaw": "03/10/2022",
        "dateTimeISO": "2022-10-02T18:30:00.000Z",
        "title": "Roadshow - Day - 1",
        "icsUrl": "https://in.marketscreener.com/api/stateful/agenda/event-async/Roadshow-Day-1-41907232.ics"
      },
      {
        "section": "Past",
        "dateTimeRaw": "23/09/2022",
        "dateTimeISO": "2022-09-22T18:30:00.000Z",
        "title": "Aditya Birla Money Conference",
        "icsUrl": "https://in.marketscreener.com/api/stateful/agenda/event-async/Aditya-Birla-Money-Conference-41799639.ics"
      },
      {
        "section": "Past",
        "dateTimeRaw": "22/09/2022",
        "dateTimeISO": "2022-09-21T18:30:00.000Z",
        "title": "JP Morgan India Investor Summit",
        "icsUrl": "https://in.marketscreener.com/api/stateful/agenda/event-async/JP-Morgan-India-Investor-Summit-41799636.ics"
      },
      {
        "section": "Past",
        "dateTimeRaw": "16/09/2022 11:00 am",
        "dateTimeISO": "2022-09-16T05:30:00.000Z",
        "title": "Annual General Meeting",
        "icsUrl": "https://in.marketscreener.com/api/stateful/agenda/event-async/Annual-General-Meeting-41626319.ics"
      },
      {
        "section": "Past",
        "dateTimeRaw": "15/09/2022",
        "dateTimeISO": "2022-09-14T18:30:00.000Z",
        "title": "Capital Group Conference",
        "icsUrl": "https://in.marketscreener.com/api/stateful/agenda/event-async/Capital-Group-Conference-41799579.ics"
      },
      {
        "section": "Past",
        "dateTimeRaw": "15/09/2022",
        "dateTimeISO": "2022-09-14T18:30:00.000Z",
        "title": "UBS Asset Management Conference",
        "icsUrl": "https://in.marketscreener.com/api/stateful/agenda/event-async/UBS-Asset-Management-Conference-41799578.ics"
      },
      {
        "section": "Past",
        "dateTimeRaw": "14/09/2022",
        "dateTimeISO": "2022-09-13T18:30:00.000Z",
        "title": "UBS India Annual Auto Field Trip Conference",
        "icsUrl": "https://in.marketscreener.com/api/stateful/agenda/event-async/UBS-India-Annual-Auto-Field-Trip-Conference-41799560.ics"
      },
      {
        "section": "Past",
        "dateTimeRaw": "13/09/2022",
        "dateTimeISO": "2022-09-12T18:30:00.000Z",
        "title": "Mathews Asia Conference",
        "icsUrl": "https://in.marketscreener.com/api/stateful/agenda/event-async/Mathews-Asia-Conference-41799542.ics"
      },
      {
        "section": "Past",
        "dateTimeRaw": "05/09/2022",
        "dateTimeISO": "2022-09-04T18:30:00.000Z",
        "title": "Kotak Mutual Fund Conference",
        "icsUrl": "https://in.marketscreener.com/api/stateful/agenda/event-async/Kotak-Mutual-Fund-Conference-41741515.ics"
      },
      {
        "section": "Past",
        "dateTimeRaw": "05/09/2022",
        "dateTimeISO": "2022-09-04T18:30:00.000Z",
        "title": "Max Life Insurance Company Conference",
        "icsUrl": "https://in.marketscreener.com/api/stateful/agenda/event-async/Max-Life-Insurance-Company-Conference-41741514.ics"
      },
      {
        "section": "Past",
        "dateTimeRaw": "05/09/2022",
        "dateTimeISO": "2022-09-04T18:30:00.000Z",
        "title": "ICICI Prudential Mutual Fund Conference",
        "icsUrl": "https://in.marketscreener.com/api/stateful/agenda/event-async/ICICI-Prudential-Mutual-Fund-Conference-41741513.ics"
      },
      {
        "section": "Past",
        "dateTimeRaw": "02/09/2022",
        "dateTimeISO": "2022-09-01T18:30:00.000Z",
        "title": "Roadshow - Day - 2",
        "icsUrl": "https://in.marketscreener.com/api/stateful/agenda/event-async/Roadshow-Day-2-41689622.ics"
      },
      {
        "section": "Past",
        "dateTimeRaw": "01/09/2022",
        "dateTimeISO": "2022-08-31T18:30:00.000Z",
        "title": "Roadshow - Day - 1",
        "icsUrl": "https://in.marketscreener.com/api/stateful/agenda/event-async/Roadshow-Day-1-41689608.ics"
      },
      {
        "section": "Past",
        "dateTimeRaw": "08/08/2022 04:00 pm",
        "dateTimeISO": "2022-08-08T10:30:00.000Z",
        "title": "Q1 2023 Earnings Call",
        "icsUrl": "https://in.marketscreener.com/api/stateful/agenda/event-async/Q1-2023-Earnings-Call-41229462.ics"
      },
      {
        "section": "Past",
        "dateTimeRaw": "08/08/2022 11:45 am",
        "dateTimeISO": "2022-08-08T06:15:00.000Z",
        "title": "Q1 2023 Earnings Release",
        "icsUrl": "https://in.marketscreener.com/api/stateful/agenda/event-async/Q1-2023-Earnings-Release-36104007.ics"
      },
      {
        "section": "Past",
        "dateTimeRaw": "07/07/2022",
        "dateTimeISO": "2022-07-06T18:30:00.000Z",
        "title": "Bonus Issue: 1 new share for 1 existing share",
        "icsUrl": "https://in.marketscreener.com/api/stateful/agenda/event-async/Bonus-Issue-1-new-share-for-1-existing-share-40645723.ics"
      },
      {
        "section": "Past",
        "dateTimeRaw": "07/07/2022",
        "dateTimeISO": "2022-07-06T18:30:00.000Z",
        "title": "Ex-dividend day for final dividend",
        "icsUrl": "https://in.marketscreener.com/api/stateful/agenda/event-async/Ex-dividend-day-for-final-dividend-40645722.ics"
      },
      {
        "section": "Past",
        "dateTimeRaw": "24/05/2022 04:00 pm",
        "dateTimeISO": "2022-05-24T10:30:00.000Z",
        "title": "FY 2022 Earnings Call",
        "icsUrl": "https://in.marketscreener.com/api/stateful/agenda/event-async/FY-2022-Earnings-Call-40505834.ics"
      },
      {
        "section": "Past",
        "dateTimeRaw": "24/05/2022 03:57 pm",
        "dateTimeISO": "2022-05-24T10:27:00.000Z",
        "title": "FY 2022 Earnings Release",
        "icsUrl": "https://in.marketscreener.com/api/stateful/agenda/event-async/FY-2022-Earnings-Release-35591867.ics"
      },
      {
        "section": "Past",
        "dateTimeRaw": "23/02/2022",
        "dateTimeISO": "2022-02-22T18:30:00.000Z",
        "title": "Kotak Chasing Growth Conference - Chasing Growth",
        "icsUrl": "https://in.marketscreener.com/api/stateful/agenda/event-async/Kotak-Chasing-Growth-Conference-Chasing-Growth-38152550.ics"
      },
      {
        "section": "Past",
        "dateTimeRaw": "17/02/2022",
        "dateTimeISO": "2022-02-16T18:30:00.000Z",
        "title": "Taiyo Pacific Partners Conference",
        "icsUrl": "https://in.marketscreener.com/api/stateful/agenda/event-async/Taiyo-Pacific-Partners-Conference-38152510.ics"
      },
      {
        "section": "Past",
        "dateTimeRaw": "16/02/2022 12:30 pm",
        "dateTimeISO": "2022-02-16T07:00:00.000Z",
        "title": "Investor Meeting - Unsecured Creditors",
        "icsUrl": "https://in.marketscreener.com/api/stateful/agenda/event-async/Investor-Meeting-Unsecured-Creditors-37557812.ics"
      },
      {
        "section": "Past",
        "dateTimeRaw": "16/02/2022 10:30 am",
        "dateTimeISO": "2022-02-16T05:00:00.000Z",
        "title": "Investor Meeting - Equity Shareholders",
        "icsUrl": "https://in.marketscreener.com/api/stateful/agenda/event-async/Investor-Meeting-Equity-Shareholders-37557813.ics"
      },
      {
        "section": "Past",
        "dateTimeRaw": "16/02/2022",
        "dateTimeISO": "2022-02-15T18:30:00.000Z",
        "title": "Ex-dividend day for dividende intermédiaire",
        "icsUrl": "https://in.marketscreener.com/api/stateful/agenda/event-async/Ex-dividend-day-for-dividende-intermediaire-38552670.ics"
      },
      {
        "section": "Past",
        "dateTimeRaw": "16/02/2022",
        "dateTimeISO": "2022-02-15T18:30:00.000Z",
        "title": "Axiom International Conference",
        "icsUrl": "https://in.marketscreener.com/api/stateful/agenda/event-async/Axiom-International-Conference-38152496.ics"
      },
      {
        "section": "Past",
        "dateTimeRaw": "16/02/2022",
        "dateTimeISO": "2022-02-15T18:30:00.000Z",
        "title": "Driehaus Capital Conference",
        "icsUrl": "https://in.marketscreener.com/api/stateful/agenda/event-async/Driehaus-Capital-Conference-38152495.ics"
      },
      {
        "section": "Past",
        "dateTimeRaw": "14/02/2022",
        "dateTimeISO": "2022-02-13T18:30:00.000Z",
        "title": "William Blair Conference",
        "icsUrl": "https://in.marketscreener.com/api/stateful/agenda/event-async/William-Blair-Conference-38152454.ics"
      },
      {
        "section": "Past",
        "dateTimeRaw": "07/02/2022 04:30 pm",
        "dateTimeISO": "2022-02-07T11:00:00.000Z",
        "title": "Q3 2022 Earnings Call",
        "icsUrl": "https://in.marketscreener.com/api/stateful/agenda/event-async/Q3-2022-Earnings-Call-37791641.ics"
      },
      {
        "section": "Past",
        "dateTimeRaw": "07/02/2022 12:10 pm",
        "dateTimeISO": "2022-02-07T06:40:00.000Z",
        "title": "Q3 2022 Earnings Release",
        "icsUrl": "https://in.marketscreener.com/api/stateful/agenda/event-async/Q3-2022-Earnings-Release-32318977.ics"
      },
      {
        "section": "Past",
        "dateTimeRaw": "13/12/2021 11:00 am",
        "dateTimeISO": "2021-12-13T05:30:00.000Z",
        "title": "Business Update Call",
        "icsUrl": "https://in.marketscreener.com/api/stateful/agenda/event-async/Business-Update-Call-37416099.ics"
      },
      {
        "section": "Past",
        "dateTimeRaw": "02/12/2021",
        "dateTimeISO": "2021-12-01T18:30:00.000Z",
        "title": "Investor Meeting",
        "icsUrl": "https://in.marketscreener.com/api/stateful/agenda/event-async/Investor-Meeting-37215714.ics"
      },
      {
        "section": "Past",
        "dateTimeRaw": "11/11/2021 05:00 pm",
        "dateTimeISO": "2021-11-11T11:30:00.000Z",
        "title": "Interim 2022 Earnings Call",
        "icsUrl": "https://in.marketscreener.com/api/stateful/agenda/event-async/Interim-2022-Earnings-Call-37009974.ics"
      },
      {
        "section": "Past",
        "dateTimeRaw": "11/11/2021 02:57 pm",
        "dateTimeISO": "2021-11-11T09:27:00.000Z",
        "title": "Interim 2022 Earnings Release",
        "icsUrl": "https://in.marketscreener.com/api/stateful/agenda/event-async/Interim-2022-Earnings-Release-31661839.ics"
      },
      {
        "section": "Past",
        "dateTimeRaw": "16/08/2021 04:00 pm",
        "dateTimeISO": "2021-08-16T10:30:00.000Z",
        "title": "Q1 2022 Earnings Call",
        "icsUrl": "https://in.marketscreener.com/api/stateful/agenda/event-async/Q1-2022-Earnings-Call-36329334.ics"
      },
      {
        "section": "Past",
        "dateTimeRaw": "14/08/2021 12:45 pm",
        "dateTimeISO": "2021-08-14T07:15:00.000Z",
        "title": "Q1 2022 Earnings Release",
        "icsUrl": "https://in.marketscreener.com/api/stateful/agenda/event-async/Q1-2022-Earnings-Release-31161338.ics"
      },
      {
        "section": "Past",
        "dateTimeRaw": "12/08/2021 10:30 am",
        "dateTimeISO": "2021-08-12T05:00:00.000Z",
        "title": "Annual General Meeting",
        "icsUrl": "https://in.marketscreener.com/api/stateful/agenda/event-async/Annual-General-Meeting-35968145.ics"
      },
      {
        "section": "Past",
        "dateTimeRaw": "04/08/2021",
        "dateTimeISO": "2021-08-03T18:30:00.000Z",
        "title": "Ex-dividend day for final dividend",
        "icsUrl": "https://in.marketscreener.com/api/stateful/agenda/event-async/Ex-dividend-day-for-final-dividend-35938383.ics"
      },
      {
        "section": "Past",
        "dateTimeRaw": "14/06/2021 04:00 pm",
        "dateTimeISO": "2021-06-14T10:30:00.000Z",
        "title": "FY 2021 Earnings Call",
        "icsUrl": "https://in.marketscreener.com/api/stateful/agenda/event-async/FY-2021-Earnings-Call-35651644.ics"
      },
      {
        "section": "Past",
        "dateTimeRaw": "13/06/2021 07:52 pm",
        "dateTimeISO": "2021-06-13T14:22:00.000Z",
        "title": "FY 2021 Earnings Release",
        "icsUrl": "https://in.marketscreener.com/api/stateful/agenda/event-async/FY-2021-Earnings-Release-28900767.ics"
      },
      {
        "section": "Past",
        "dateTimeRaw": "15/02/2021",
        "dateTimeISO": "2021-02-14T18:30:00.000Z",
        "title": "Ex-dividend day for dividende intermédiaire",
        "icsUrl": "https://in.marketscreener.com/api/stateful/agenda/event-async/Ex-dividend-day-for-dividende-intermediaire-32373488.ics"
      },
      {
        "section": "Past",
        "dateTimeRaw": "04/02/2021 04:30 pm",
        "dateTimeISO": "2021-02-04T11:00:00.000Z",
        "title": "Q3 2021 Earnings Call",
        "icsUrl": "https://in.marketscreener.com/api/stateful/agenda/event-async/Q3-2021-Earnings-Call-32377148.ics"
      },
      {
        "section": "Past",
        "dateTimeRaw": "04/02/2021",
        "dateTimeISO": "2021-02-03T18:30:00.000Z",
        "title": "Q3 2021 Earnings Release",
        "icsUrl": "https://in.marketscreener.com/api/stateful/agenda/event-async/Q3-2021-Earnings-Release-28900398.ics"
      },
      {
        "section": "Past",
        "dateTimeRaw": "10/11/2020 03:30 pm",
        "dateTimeISO": "2020-11-10T10:00:00.000Z",
        "title": "Interim 2021 Earnings Call",
        "icsUrl": "https://in.marketscreener.com/api/stateful/agenda/event-async/Interim-2021-Earnings-Call-31783412.ics"
      },
      {
        "section": "Past",
        "dateTimeRaw": "10/11/2020",
        "dateTimeISO": "2020-11-09T18:30:00.000Z",
        "title": "Interim 2021 Earnings Release",
        "icsUrl": "https://in.marketscreener.com/api/stateful/agenda/event-async/Interim-2021-Earnings-Release-28900210.ics"
      },
      {
        "section": "Past",
        "dateTimeRaw": "24/08/2020 04:00 pm",
        "dateTimeISO": "2020-08-24T10:30:00.000Z",
        "title": "Q1 2021 Earnings Call",
        "icsUrl": "https://in.marketscreener.com/api/stateful/agenda/event-async/Q1-2021-Earnings-Call-31161153.ics"
      },
      {
        "section": "Past",
        "dateTimeRaw": "22/08/2020",
        "dateTimeISO": "2020-08-21T18:30:00.000Z",
        "title": "Q1 2021 Earnings Release",
        "icsUrl": "https://in.marketscreener.com/api/stateful/agenda/event-async/Q1-2021-Earnings-Release-28899740.ics"
      },
      {
        "section": "Past",
        "dateTimeRaw": "14/08/2020",
        "dateTimeISO": "2020-08-13T18:30:00.000Z",
        "title": "Rights Issue: 1 new share @ 250 INR for 27 existing shares",
        "icsUrl": "https://in.marketscreener.com/api/stateful/agenda/event-async/Rights-Issue-1-new-share-250-INR-for-27-existing-shares-31128273.ics"
      },
      {
        "section": "Past",
        "dateTimeRaw": "29/06/2020",
        "dateTimeISO": "2020-06-28T18:30:00.000Z",
        "title": "FY 2020 Earnings Release",
        "icsUrl": "https://in.marketscreener.com/api/stateful/agenda/event-async/FY-2020-Earnings-Release-27989149.ics"
      },
      {
        "section": "Past",
        "dateTimeRaw": "17/02/2020",
        "dateTimeISO": "2020-02-16T18:30:00.000Z",
        "title": "Ex-dividend day for dividende intermédiaire",
        "icsUrl": "https://in.marketscreener.com/api/stateful/agenda/event-async/Ex-dividend-day-for-dividende-intermediaire-30004442.ics"
      },
      {
        "section": "Past",
        "dateTimeRaw": "06/02/2020 05:00 pm",
        "dateTimeISO": "2020-02-06T11:30:00.000Z",
        "title": "Q3 2020 Earnings Call",
        "icsUrl": "https://in.marketscreener.com/api/stateful/agenda/event-async/Q3-2020-Earnings-Call-29962886.ics"
      },
      {
        "section": "Past",
        "dateTimeRaw": "06/02/2020",
        "dateTimeISO": "2020-02-05T18:30:00.000Z",
        "title": "Q3 2020 Earnings Release",
        "icsUrl": "https://in.marketscreener.com/api/stateful/agenda/event-async/Q3-2020-Earnings-Release-27988995.ics"
      },
      {
        "section": "Past",
        "dateTimeRaw": "11/12/2019 02:00 pm",
        "dateTimeISO": "2019-12-11T08:30:00.000Z",
        "title": "Shareholders Meeting",
        "icsUrl": "https://in.marketscreener.com/api/stateful/agenda/event-async/Shareholders-Meeting-29633423.ics"
      },
      {
        "section": "Past",
        "dateTimeRaw": "09/12/2019 09:30 am",
        "dateTimeISO": "2019-12-09T04:00:00.000Z",
        "title": "Shareholders Meeting",
        "icsUrl": "https://in.marketscreener.com/api/stateful/agenda/event-async/Shareholders-Meeting-29633281.ics"
      },
      {
        "section": "Past",
        "dateTimeRaw": "19/11/2019 01:00 pm",
        "dateTimeISO": "2019-11-19T07:30:00.000Z",
        "title": "Shareholders Meeting - Unsecured Creditors",
        "icsUrl": "https://in.marketscreener.com/api/stateful/agenda/event-async/Shareholders-Meeting-Unsecured-Creditors-29461290.ics"
      },
      {
        "section": "Past",
        "dateTimeRaw": "19/11/2019 11:00 am",
        "dateTimeISO": "2019-11-19T05:30:00.000Z",
        "title": "Shareholders Meeting - Equity Shareholders",
        "icsUrl": "https://in.marketscreener.com/api/stateful/agenda/event-async/Shareholders-Meeting-Equity-Shareholders-29461291.ics"
      },
      {
        "section": "Past",
        "dateTimeRaw": "14/11/2019 04:30 pm",
        "dateTimeISO": "2019-11-14T11:00:00.000Z",
        "title": "Interim 2020 Earnings Call",
        "icsUrl": "https://in.marketscreener.com/api/stateful/agenda/event-async/Interim-2020-Earnings-Call-29590365.ics"
      },
      {
        "section": "Past",
        "dateTimeRaw": "14/11/2019",
        "dateTimeISO": "2019-11-13T18:30:00.000Z",
        "title": "Interim 2020 Earnings Release",
        "icsUrl": "https://in.marketscreener.com/api/stateful/agenda/event-async/Interim-2020-Earnings-Release-27988806.ics"
      },
      {
        "section": "Past",
        "dateTimeRaw": "09/10/2019 04:00 pm",
        "dateTimeISO": "2019-10-09T10:30:00.000Z",
        "title": "Acquisition of Delvis Gmbh by Minda Industries Limited",
        "icsUrl": "https://in.marketscreener.com/api/stateful/agenda/event-async/Acquisition-of-Delvis-Gmbh-by-Minda-Industries-Limited-29393910.ics"
      },
      {
        "section": "Past",
        "dateTimeRaw": "07/08/2019 04:00 pm",
        "dateTimeISO": "2019-08-07T10:30:00.000Z",
        "title": "Q1 2020 Earnings Call",
        "icsUrl": "https://in.marketscreener.com/api/stateful/agenda/event-async/Q1-2020-Earnings-Call-29007499.ics"
      },
      {
        "section": "Past",
        "dateTimeRaw": "06/08/2019 03:30 pm",
        "dateTimeISO": "2019-08-06T10:00:00.000Z",
        "title": "Annual General Meeting",
        "icsUrl": "https://in.marketscreener.com/api/stateful/agenda/event-async/Annual-General-Meeting-28893813.ics"
      },
      {
        "section": "Past",
        "dateTimeRaw": "06/08/2019",
        "dateTimeISO": "2019-08-05T18:30:00.000Z",
        "title": "Q1 2020 Earnings Release",
        "icsUrl": "https://in.marketscreener.com/api/stateful/agenda/event-async/Q1-2020-Earnings-Release-26621349.ics"
      }
    ]
  },
  "pastDividends": {
    "count": 31,
    "dividends": [
      {
        "section": "Past Dividends",
        "dateRaw": "30/05/2025",
        "dateISO": "2025-05-29T18:30:00.000Z",
        "type": "Final Payment",
        "amount": 1.5,
        "currency": "INR",
        "title": "Final Payment 1.5 INR"
      },
      {
        "section": "Past Dividends",
        "dateRaw": "12/02/2025",
        "dateISO": "2025-02-11T18:30:00.000Z",
        "type": "Interim Payment",
        "amount": 0.75,
        "currency": "INR",
        "title": "Interim Payment 0.75 INR"
      },
      {
        "section": "Past Dividends",
        "dateRaw": "07/06/2024",
        "dateISO": "2024-06-06T18:30:00.000Z",
        "type": "Final Payment",
        "amount": 1.35,
        "currency": "INR",
        "title": "Final Payment 1.35 INR"
      },
      {
        "section": "Past Dividends",
        "dateRaw": "15/02/2024",
        "dateISO": "2024-02-14T18:30:00.000Z",
        "type": "Interim Payment",
        "amount": 0.65,
        "currency": "INR",
        "title": "Interim Payment 0.65 INR"
      },
      {
        "section": "Past Dividends",
        "dateRaw": "31/08/2023",
        "dateISO": "2023-08-30T18:30:00.000Z",
        "type": "Final Payment",
        "amount": 1,
        "currency": "INR",
        "title": "Final Payment 1 INR"
      },
      {
        "section": "Past Dividends",
        "dateRaw": "20/02/2023",
        "dateISO": "2023-02-19T18:30:00.000Z",
        "type": "Interim Payment",
        "amount": 0.5,
        "currency": "INR",
        "title": "Interim Payment 0.5 INR"
      },
      {
        "section": "Past Dividends",
        "dateRaw": "07/07/2022",
        "dateISO": "2022-07-06T18:30:00.000Z",
        "type": "Final Payment",
        "amount": 1,
        "currency": "INR",
        "title": "Final Payment 1 INR"
      },
      {
        "section": "Past Dividends",
        "dateRaw": "16/02/2022",
        "dateISO": "2022-02-15T18:30:00.000Z",
        "type": "Interim Payment",
        "amount": 0.5,
        "currency": "INR",
        "title": "Interim Payment 0.5 INR"
      },
      {
        "section": "Past Dividends",
        "dateRaw": "04/08/2021",
        "dateISO": "2021-08-03T18:30:00.000Z",
        "type": "Final Payment",
        "amount": 0.5,
        "currency": "INR",
        "title": "Final Payment 0.5 INR"
      },
      {
        "section": "Past Dividends",
        "dateRaw": "15/02/2021",
        "dateISO": "2021-02-14T18:30:00.000Z",
        "type": "Interim Payment",
        "amount": 0.35,
        "currency": "INR",
        "title": "Interim Payment 0.35 INR"
      },
      {
        "section": "Past Dividends",
        "dateRaw": "17/02/2020",
        "dateISO": "2020-02-16T18:30:00.000Z",
        "type": "Interim Payment",
        "amount": 0.4,
        "currency": "INR",
        "title": "Interim Payment 0.4 INR"
      },
      {
        "section": "Past Dividends",
        "dateRaw": "29/07/2019",
        "dateISO": "2019-07-28T18:30:00.000Z",
        "type": "Final Payment",
        "amount": 0.65,
        "currency": "INR",
        "title": "Final Payment 0.65 INR"
      },
      {
        "section": "Past Dividends",
        "dateRaw": "15/02/2019",
        "dateISO": "2019-02-14T18:30:00.000Z",
        "type": "Interim Payment",
        "amount": 0.45,
        "currency": "INR",
        "title": "Interim Payment 0.45 INR"
      },
      {
        "section": "Past Dividends",
        "dateRaw": "11/07/2018",
        "dateISO": "2018-07-10T18:30:00.000Z",
        "type": "Final Payment",
        "amount": 1.6,
        "currency": "INR",
        "title": "Final Payment 1.6 INR"
      },
      {
        "section": "Past Dividends",
        "dateRaw": "22/02/2018",
        "dateISO": "2018-02-21T18:30:00.000Z",
        "type": "Interim Payment",
        "amount": 1.2,
        "currency": "INR",
        "title": "Interim Payment 1.2 INR"
      },
      {
        "section": "Past Dividends",
        "dateRaw": "21/08/2017",
        "dateISO": "2017-08-20T18:30:00.000Z",
        "type": "Final Payment",
        "amount": 1,
        "currency": "INR",
        "title": "Final Payment 1 INR"
      },
      {
        "section": "Past Dividends",
        "dateRaw": "16/02/2017",
        "dateISO": "2017-02-15T18:30:00.000Z",
        "type": "Interim Payment",
        "amount": 1.2,
        "currency": "INR",
        "title": "Interim Payment 1.2 INR"
      },
      {
        "section": "Past Dividends",
        "dateRaw": "03/08/2016",
        "dateISO": "2016-08-02T18:30:00.000Z",
        "type": "Final Payment",
        "amount": 4,
        "currency": "INR",
        "title": "Final Payment 4 INR"
      },
      {
        "section": "Past Dividends",
        "dateRaw": "11/02/2016",
        "dateISO": "2016-02-10T18:30:00.000Z",
        "type": "Interim Payment",
        "amount": 3,
        "currency": "INR",
        "title": "Interim Payment 3 INR"
      },
      {
        "section": "Past Dividends",
        "dateRaw": "30/07/2015",
        "dateISO": "2015-07-29T18:30:00.000Z",
        "type": "3.5 INR",
        "amount": null,
        "currency": null,
        "title": "3.5 INR"
      },
      {
        "section": "Past Dividends",
        "dateRaw": "26/02/2015",
